time,tweet
2009-11-16 13:45:50,Giannelli accoglie le osservazioni dell'Assessore.
2009-11-16 13:44:39,La mozione Giannelli ha subito una serie di emendamenti da parte dell'Assessore
2009-11-16 13:03:57,"La proposta di Giannelli concerne alcuni aspetti tecnici, soprattutto in merito alle basi d'asta degli appalti. http://ff.im/byj95"
2009-11-16 13:03:12,"La proposta di Giannelli concerne alcuni aspetti tecnici, soprattutto in merito alle basi d'asta degli appalti."
2009-11-16 13:00:48,La richiesta riguarda l'organizzazione degli appalti pubblici.
