time,tweet
2009-11-14 21:17:22,@tonybaltierra We probably expect opposing bands to have class?
2009-11-14 21:15:49,@uscwomensvolley Awesome. Good luck in set 4. I completely forgot to come by after the disheartening game in the Coliseum.
2009-11-14 21:14:10,I took off my suit and put on a Georgia shirt...should have know it would be  bad luck.
2009-11-14 21:12:44,"@utematt Oh I completely agree with Notre Dame, but the diff b/w them and USC is that USC actually does have a couple of decent wins."
2009-11-14 21:05:23,Caleb King busts another big run for a touchdown. UGA up 31-24.
