time,tweet
2009-11-25 12:18:03,Novos jogos de EdP com fotos inéditas do filme http://bit.ly/5GkXOH
2009-11-25 11:47:35,Oliver Phelps volta aos estúdios amanhã para filmar RdM http://bit.ly/6yFUJg
2009-11-25 11:31:11,Mais uma nova notícia sendo postada logo após a do Oliver!
2009-11-25 11:30:35,Ator @OliverPhelps comentou no twitter que volta amanhã para filmar HP7. Notícia no site em instantes!
2009-11-25 10:57:11,Ben Shepard vai hoje aos sets de Relíquias da Morte para fazer especial http://bit.ly/733CWQ
