time,tweet
2009-11-16 04:10:49,"ok eerste bulk mail nu verwerkt, agenda loopt daardoor vol en replies stromen binnen. gaat druk weekje worden"
2009-11-16 02:59:43,"ok, back from a great vacation in Jordan. Now back to business"
2009-11-04 04:18:37,today BAD day...................maar wel lekker bezig:)
2009-11-02 02:45:44,gelukkig maakt het geen kans want moet toch niet gekker worden http://tinyurl.com/y9xm3an
2009-11-02 01:44:04,"kleine naar creche, schilder geinstrueerd en weer achter buro. ff hoop doen vandaag. lijstje to do wordt langer ipv korter:( wat doe ik fout"
