time,tweet
2009-11-21 20:42:07,we had a word war and i won! hoorah!! i got a pillow about writing #nanowrimo
2009-11-21 20:33:19,i lost the word war. i think too much while i write #nanowrimo
2009-11-21 20:32:24,@heldermira me and the coffee are going HARD tonight. i want my second cup but i'm holding off
2009-11-21 20:10:00,"@mylesbianBFF national novel writing month. for the entire month of november i have to write a 50,000 word novel"
2009-11-21 20:06:28,"but, i've got a refillable mug full of coffee and some (delicious) espresso cookies.  i am PREPARED! #nanowrimo."
