time,tweet
2009-11-24 17:59:06,I just became the mayor of Kroger - Briarcliff on @foursquare! http://bit.ly/zmbKt
2009-11-24 17:59:04,Why do woman insist on standing in the middle of th aisle blocking me and not move until I say something. Get the F*** out of my way!
2009-11-24 16:10:02,"I'm at Athletic Club Northeast (1515 Sheriden Rd NE, Exectutive Park Dr NE, Atlanta). http://bit.ly/JVMnr"
2009-11-23 19:41:00,I just ousted Beau B. as the mayor of Whole Foods Market - Briarcliff on @foursquare! http://bit.ly/S14z
2009-11-23 19:40:58,"I'm at Whole Foods Market - Briarcliff (2111 Briarcliff Rd NE, at Lavista Rd NE, Atlanta). http://bit.ly/S14z"
