time,tweet
2009-11-15 10:22:55,"вывела свою формулу бога - все ходят под звездами. мои звезды видят меня насквозь и говорят мне, что я справлюсь"
2009-11-12 11:04:17,По ходу я сегодня вечером великий туситель сама с собой
2009-11-12 10:59:30,Съездила на прошлой неделе в гости с кедровыми орешками. Отравила себя и хозяев
2009-11-07 09:41:13,@codename_mika у меня есть личный говоритель от имени звезд и планет )
2009-11-07 07:24:25,"i'm back to life, кстати. мне прочат любовные привлечения и хвост пистолетом 10-го и 12-го."
