time,tweet
2009-11-25 05:19:55,"Obrigado @camilinhayu - ""Fantástica a apresentação do @rkiso no #inovadoresespm! Co criação, inovação, eficiência e resultados"""
2009-11-20 10:52:06,Assustador!! Tattoos de LED podem mudar muita coisa [video] - http://bit.ly/2oqv68 @wired
2009-11-20 10:46:30,"Ta todo mundo querendo seguir o sucesso do iTunes. Agora é a vez da Sony, o diferencial será a rede do PlayStation. http://migre.me/c6oD"
2009-11-20 05:38:46,O Google quer destruir o desktop e a Microsoft com o Chrome OS - http://bit.ly/4i66LO
2009-11-20 05:37:14,"Faça download do Google Chrome OS, essa foi rápido.. http://gizmodo.com/5408931/ #chromeos #googlechromeos"
