time,tweet
2009-11-24 05:53:13,prepping for in-store wine tastings today in ocean twp
2009-11-21 09:36:55,Check out An Effective Health Care System Requires New Beliefs at http://gotaf.socialtwist.com/redirect?l=-146959289841092771011
2009-11-17 09:28:07,"nick, is that a picture of you with hair?  so glad you're getting the attention you deserve these days ... http://corkd.com/x1NAVpD @corkd"
2009-11-13 02:14:52,working on the last few cases of summers 06 cab andriana's avail--hmm  delish
2009-10-31 07:46:07,love this guys music -- Ólafur Arnalds - Ljósið (Official Music Video) http://bit.ly/1PWDj
