time,tweet
2009-11-27 07:58:44,When Sadie makes our first snowfall in Akron...well there goes golf today. http://yfrog.com/au6wnj
2009-11-26 22:02:00,"@jeremyisaacs  so, I'm too busy reading my Bible to know whether I have HD channels or not...sorry!"
2009-11-26 21:47:59,Wondering how many of my tweet friends are going to be shopping tomorrow?
2009-11-25 16:09:21,"Preparing for Cooper David's #5 birthday party...he chose--pizza, cheesebread and cake...the boy's got the goods!"
2009-11-25 15:45:23,Sadie and Branson are dominating my TV...peacefully http://yfrog.com/33aakycj
