time,tweet
2009-11-19 06:43:55,traffic in SLEX goin' bats is soooooooo baaad! watta day! idiot drivers! http://bit.ly/45qMai
2009-11-19 06:11:40,Stuck in Ayala Avenue traffic. I am so sleepy -Update via SMS for FREE using http://isip.ph http://bit.ly/gcSb0
2009-11-19 06:11:40,"just got home, super traffic at edsa! http://bit.ly/3Fau79"
2009-11-19 05:09:59,Google maps in Singapore now features live traffic condition updates and public bus/MRT route information. - maps.g... http://bit.ly/3TMAom
2009-11-19 05:09:58,Google has enabled LIVE traffic and bus/mrt routing for Singapore. Works on iPhone maps. http://bit.ly/2ShQj
