time,tweet
2009-11-14 10:43:19,RT @tonymorganlive: this reminds me of churches and denominations that think they can avoid change: http://bit.ly/4j8E9N
2009-11-14 09:18:29,"@ProgressiveKel no problem, yeah I know what you mean, website is looking good though, much more simplified."
2009-11-11 20:10:46,just got home from the editing lab and about to watch #Glee
2009-11-10 19:33:46,"@DF87 it's been pretty good so far, impressive effects for a television series."
2009-11-10 19:27:18,"relaxing a bit and watching V, interesting show so far."
