time,tweet
2009-11-29 02:06:26,"Rt:@Rob_Zilla Ever get off the elevator in your hotel to find Secret Service on a protection detail? I did, for Speaker/House, Nancy Pelosi."
2009-11-29 01:54:31,"I just generated my #TweetCloud out of a year of my tweets. Top three words: love, dude, record - http://w33.us/b5n"
2009-11-29 01:41:11,Promote synergy (like a boss) Hit on Debra (like a boss) Get rejected (like a boss) Swallow sadness (like a boss)  http://moby.to/b8aj6n
2009-11-29 00:13:16,Love this. It'd be a blast to work here. Come up w/ bullsh*t all day. The brainstorming sessions would be amazing. http://moby.to/ggt2ux
2009-11-28 23:54:42,"This app, ""One Bus Away"" is sooo rad. Tells you exactly when the next bus is gonna be there & whether they're running late. Lovin it."
