time,tweet
2009-11-28 19:19:06,"Hey, @TweetDeck !  You guys need to be thinking about an interface to #GoogleWave via #TweetDeck sort of like you have for FaceBook"
2009-11-28 19:01:20,Great thing about accessing FaceBook  from @TweetDeck  NO advertisements!!!!!!
2009-11-28 18:41:56,"Hey, @TweetDeck   Great  FaceBook interface.  I likes it - your User Interface/app, not necessarily FaceBook. It ... well, you know.  ;-)"
2009-11-28 18:37:11,"Ok, maybe FaceBook won't be so onerous to me if I do it all fm TweetDeck.  Just got to be careful what I send to FaceBook with gKids on. :-/"
2009-11-28 18:27:45,Left arm is sore again from using right angle grinder tool again. :-(
