time,tweet
2009-11-29 05:53:25,On my friend's pullout. Been awake since 4:30. Related: have been wanting Subway since 4:30.
2009-11-27 18:36:16,"""Oh look, you have boobies! Are those new?"" -Mom"
2009-11-27 15:53:27,"“Find what you love, and let it kill you.”"
2009-11-27 02:55:35,Also let me point out that there were people literally camping out in front of Wal-Mart at 10pm. They open at 5.
2009-11-27 02:54:01,Black Friday is madness. In an angry mob of older gentlewomen outside Kohl's. Seriously I just want a Festivus dress.
