time,tweet
2009-11-25 16:59:57,Teen injured after rock thrown from freeway overpass: A teenage girl was lucky not to have suffered serious injurie... http://bit.ly/5N1xSL
2009-11-25 16:59:56,Car collision leaves 3 in hospital: Three people have taken to hospital - one in a life-threatening condition - aft... http://bit.ly/8naK0s
2009-11-25 16:59:55,Ambulance call operator sacked after blunders: The New South Wales Ambulance Service has confirmed that it has stoo... http://bit.ly/5ZR7Jy
2009-11-25 16:59:55,DSE red-faced over warning mistake: The Department of Sustainability and Environment (DSE) is red-faced after a an ... http://bit.ly/6xmaAM
2009-11-25 16:59:54,"Alleged scrub fire arsonists charged: Two men face court in Sydney's south-west today, accused of starting a fire t... http://bit.ly/4H2SUB"
