time,tweet
2009-11-20 16:37:44,"Irgendwo hier http://bit.ly/5Subzw stand ich übrigens im Publikum. Und es war groß. Nass und kalt, aber groß. #linkinpark #rockamring2001"
2009-11-20 16:29:44,"@Fledermaus Schuljung. Ich sprach kurzzeitig mal von und mit dem Rest meiner versoffenen Timeline, Du Koalaseebärin. ;)"
2009-11-20 16:23:57,Man müsste Klavier spielen können. Gar nicht mal wegen des sprichwörtlichen Glücks.
2009-11-20 16:22:17,Dass Ihr schon wieder saufen könnt ... #twittersaufen
2009-11-20 16:04:37,"@Pleitegeiger Ich mach gar nix, ich denk nur laut :) Geschuftet wird erst morgen früh wieder. (Oops, das ist ja gleich.)"
