time,tweet
2009-11-28 22:25:19,"@KStew411 Sam is playing is LA tonight, right? Are R/K still out in LA?  Any word if they showed up at his concert?"
2009-11-25 15:52:06,I am soo freakn bored. Can u tell? RT @Late2thePartee: *favoriting tweets like the #perv I am*
2009-11-25 15:45:17,Just as many! RT @ROBkriSTENLOVRS: Do you wish to see just as many teaser clips released for Eclipse as there were for New Moon?
2009-11-25 15:44:55,I have bail $RT @Late2thePartee: How much trouble would I get in if I made  a video with New Moon scenes in it? *ponders the possibilities*
2009-11-25 15:44:28,"I read a 3 way one, not that good RT @Late2thePartee: Are there any fanfics where Bella gets pregnant or any with 3-ways #dontaskLOL"
