time,tweet
2009-11-20 17:53:56,Totally going to give my swinging boss' wife a Dizzy Gillespie tonight. Bring them into the 00's sexually. http://tinyurl.com/yhw9tg4
2009-11-20 12:44:28,"You used to call ""eating a girl on her period,"" ""getting your red wings."" I will now call it ""becoming Edward Cullen."""
2009-11-20 09:44:03,"Nailed a few underage teens last night at the New Moon midnight show. Dressed like werewolf, the girls were screaming, I came in their hair."
2009-11-19 10:47:23,"Through the woods to Grandmom's house we go. My grandmom is a whore, so the wood is a euphemism for all the hard dicks I pass on the way."
2009-11-19 07:16:13,There needs to be a sexual version of wind beneath my wings. Perhaps the breath beneath my taint as sung by Vaneesa Williams.
