time,tweet
2009-11-26 07:06:00,"wow...everytime i come to my mom's house, i find things to take back to mine...its like shopping for free"
2009-11-25 14:30:47,http://twitpic.com/qwsc6 - 3pm - 7 lanes of Atlanta exodus
2009-11-24 21:40:33,"no, i didnt climb Fuji-San..wish i had while i lived in Japan..its another reason to go back ->>>RT: @HyunINC You climbed Mt Fuji?"
2009-11-24 21:34:00,the pics from your trip are gorgeous..->>>RT: @HyunINC Wait until you see the pics tomorrow.
2009-11-24 21:29:30,you too->>>RT: @PINKSUGARATL:Have a wonderful Thanksgiving
