time,tweet
2009-11-18 21:10:40,Coach  Tim Durtschi swung by camp before heading up to Baker.  Guess they are suppose to get a few feet of snow. Have fun Tim.
2009-11-18 18:39:59,Free Session - http://bit.ly/4rle8c
2009-11-18 15:09:18,Fall Summit USASA  at Windells.  That Video is Hilarious.  http://windells.com/2009/11/usasa-fall-summit-comes-to-windells/
2009-11-18 12:16:58,Another 8 Inches of Fresh Snow overnight up on Hood.  Almost up to 100 inches for the season and it is not even December!
2009-11-17 18:12:43,The Windells Shredcast: EP1: Johnnie Paxson: Windells is proud to announce the launching of :  http://vimeo.com/7367957
