time,tweet
2009-11-15 02:19:10,watching SUPERBAD
2009-11-14 23:57:44,@MustLoveAnimals lol i dont wanna go out anymore today so i just put the dough in the fridge and used chips
2009-11-14 23:11:00,i couldn't make my homemade tortillas i left my rolling pin at my cousins house when we moved
2009-11-14 17:21:49,"Cheddar sour cream ruffles, zebra cakes, and mountain dew, and girly flickz I'm going into chick mode...need comfort food. .=.["
2009-11-14 17:08:34,All I want is a clean house y can't you cooperate with me on that shit
