time,tweet
2009-11-13 06:09:53,achei que fosse Inter ou Gremio: RT @SporTV Time faz enquete para escolher novo técnico pela internet http://bit.ly/2Yw2Pz
2009-11-13 06:06:50,"@rodrigo_dias no RS sim, já que o Delta do Jacuí é um dos 5 Portais ;)"
2009-11-13 06:04:45,"#chuva - e assim como começou, terminou... parece um orgasmo"
2009-11-13 06:03:12,"sexta-feira 13 ta linda com chuva torrencial e tempestade eletrica, só falta o Jason e o castelo do Doutor"
2009-11-13 06:01:39,momento apagão RT @_frantz queria um note... pra nao precisar de luz o tempo todo
