time,tweet
2009-11-17 03:39:06,Goodnite to da car jail great bday @laurastylez dats wuuuut frieends are foooor lol gotta love it  http://yfrog.com/5fnrucyj
2009-11-17 02:26:35,"RT @DjSilasNyC: Real down to earth dude   @dennisdamenace niCe talking to u hOmie,Ima get them t's sOOn just let me know LIKEWISE BRO SALUTE"
2009-11-17 02:18:53,Happy bday @laurastylez she's happy but my buddy @djyonny is sad cause hes going to da car jail to pick up lexie http://yfrog.com/jb570j
2009-11-17 02:10:17,RT @HersyKiSS: @dennisdamenace I salute u sir...lol get home safe shunnnnn!  You too AND I SALUTE YOOOOU
2009-11-16 22:42:12,Making my way to da circus to celebrate my sister @luarastylez bday
