time,tweet
2009-11-16 08:18:15,Dudando entre ver los 2 capitulos del prisionero ahora o esperarse hasta el miercoles para verlo TODO A LA VEZ
2009-11-16 03:50:14,Quien dijo que no se podia emborrachar uno en domingo?
2009-11-15 07:44:56,"Hoy el prisionero y mañana tambien, y pasado tambien, y... luego ya no"
2009-11-14 05:25:58,Por que estopa saca un comic haciendo ellos de superheroes? De verdad le interesa a alguien?
2009-11-14 05:12:19,@Shine_McShine Juraria que ese chiste NO es tuyo...
