time,tweet
2009-11-19 07:10:36,Maister Trusted Advisor traits: 16)Act like a real person-not someone in a role 17)Are reliably on our side & have our interests at heart.
2009-11-18 18:46:00,Maister Trusted Advisor trait #15) Make us feel comfortable and casual personally (but they take the issues seriously).
2009-11-18 05:15:26,Maister Trusted Advisor trait #14) Challenge our assumptions (help us uncover the false assumptions we've been working under).
2009-11-17 17:07:23,"last Maister Trusted Advisor trait for today:13)Give us options,increase our understanding of options,gives recommendation,and let us choose"
2009-11-17 11:59:31,"next Maister Trusted Advisor trait: #12) Give us the reasoning (to help us think), not just their conclusions."
