time,tweet
2009-11-26 23:14:05,"I LOVE Thanksgiving. I am thankful for great food, great family, great friends and a great love."
2009-11-26 11:33:55,"I'm sorry poor little roommate, I never realized it was so hard to get your laundry when it's done in the dryer."
2009-11-26 01:07:13,burned my nail trying to light incense...what an awful smell.
2009-11-24 21:30:01,"@delta_goodrem ticket prices are a lot though, maybe we'll just sit outside the Honda Center with a sparkly Delta sign haha"
2009-11-24 16:26:55,I must see @delta_goodrem at the Honda Center! Anyone hae $400 I can borrow?
