time,tweet
2009-11-24 10:38:45,"comment: Success with Disadvantage: OK, I succeeded to configure TKL Core for my needs. After running a.. http://bit.ly/4AWStW"
2009-11-24 06:38:03,"comment: My fault, sorry: You are right. Nothing is installed in TKL Core. http://bit.ly/6JkGmv"
2009-11-24 04:37:22,comment: TKL Core <--> TKL MySql: Thanks for your replies. I started to configure TKL Core for my.. http://bit.ly/69fN7P
2009-11-24 00:38:26,"comment: MySQL appliance is configured as a database server: As JedMeister mentioned above, the MySQL a.. http://bit.ly/5Iyhet"
2009-11-23 18:39:06,comment: Language Isn't The Real Obstacle:  It is really nice if all webpages could be translated .. http://bit.ly/5lpyAY
