time,tweet
2009-11-21 13:10:25,"@rantingteacher Mind you, left arm is always tricky. Could also indicate other probs. Take care now!"
2009-11-21 13:09:40,@rantingteacher Initially somewhat but after some time my lower arm refused to work altogether. Had manual therapy and found new job.
2009-11-21 13:05:09,@rantingteacher Probably trapped nerve in back/neck. Had that few years back. Stress related! Quitting regular education helped me...
2009-11-21 13:00:46,Anyone want to test drive the beta version of Google Chrome OS? http://bit.ly/4Xon5y
2009-11-21 12:56:47,Off to visit RL friends! May have to actually talk to communicate tonight. How does that work again?
