time,tweet
2009-11-23 00:10:31,I uploaded a YouTube video -- Video369 http://www.youtube.com/watch?v=V7ikiBAW7Ss&feature=autoshare_twitter
2009-11-22 23:44:54,I uploaded a YouTube video -- Video368 http://www.youtube.com/watch?v=e5Y9kgEf2Ic&feature=autoshare_twitter
2009-11-20 23:33:55,I subscribed to damienwalters's channel on YouTube http://www.youtube.com/user/damienwalters?feature=autoshare_twitter
2009-11-20 23:30:09,I JUST UPLOADED MY SHOWREEL 2009 http://www.youtube.com/watch?v=KEBrCwp4oBI
2009-08-31 18:15:26,وجدت الذاكرة لتبقى و تتذكر..... لا لتنسى
