time,tweet
2009-11-17 12:26:37,"am @decatorevista ! Deocamdata, pentru ca o voi da mai departe"
2009-11-17 04:43:27,what the trendsetter says to the early adopter RT @tic_nica Coolissimo. Europe in 2010. http://is.gd/4WpCP (via @TheEconomist)
2009-11-16 11:46:49,"I have just added my Twitter to my LinkedIn account, yay #in"
2009-11-16 07:22:50,"@raulnecesar și eu am @decatorevista de sub tejghea la librăria Anthony Frost, deci trebuie mai multe :)"
2009-11-16 07:04:19,http://bit.ly/2OBeO3 Top Gear in Romania - Auto - HotNews.ro - do watch the youtube videos :)
