time,tweet
2009-11-15 02:48:39,"Will try and post some photos of our singing if get any, but might not be until tomorrow as we'll be getting back late!"
2009-11-15 02:48:11,Morning and welcome to any new followers! Thank goodness it seems drier now outside.
2009-11-14 11:38:53,@StefansBelle thanks Sharon!
2009-11-14 11:37:40,I was reading that Children in need this year going to be from Royal Albert Hall?
2009-11-14 11:37:14,"@Jantunstill it totally is!! I've been to one of these things for Messiah before, but I wasn't singing it - just in the audience!"
