time,tweet
2009-11-12 18:32:01,@frankiefreds meant at the awkward comment.
2009-11-12 18:31:12,@frankiefreds I would have used sh!**y.
2009-11-12 18:26:25,Vancouver- Tonight Element57 is hosting an open mic at the Prairie Bar & Grill.  Come down and/or and please tell your musician friends.
2009-10-28 13:32:28,"Would like to say one more time. What a fantastic time buy real estate in Vancouver, WA. Prices are outstanding...think rental portfolio."
2009-10-27 12:00:00,"Tomorrow night Element57's song ""Ripcord"" will be played on Road Rules Challenge- MTV 10p EST.  Hopefully they play a lot of it :)"
