time,tweet
2009-11-16 10:51:53,"After spending binge, White House says it will focus on deficits http://bit.ly/1ifBso #TCOT #GOP #iamthemob"
2009-11-16 10:51:18,BOOM goes the Budget: Good news for CA budget swallowed by worse news: a growing deficit http://bit.ly/2Kkb1m #catcot #tcot #cagop
2009-11-16 10:50:31,Government Motors Admits It Lied About Jobs Created From Federal Stimulus Dollars http://bit.ly/3nW1Eq #fail #tcot
2009-11-15 22:18:40,RT @TheSacCitizen State Finance Director Warns of More Trouble Ahead http://bit.ly/48OIEu #catcot
2009-11-15 22:03:33,@Brian90277 the abolitionist movement aiming at Edison’s bulb & the poor replacement that bureaucrats will leave us: http://bit.ly/2xw7DI
