time,tweet
2009-11-22 23:24:07,New concept (for me anyway) - model photos by candle light (only) - thank you Canon 5D Mark II and thank you Cici! http://flic.kr/p/7hGY2J
2009-11-22 20:55:06,Something special about Cici's portrait..most comments I've ever seen so fast in my stream?  Let know what u think! http://flic.kr/p/7hxSPK
2009-11-22 17:28:56,Chinese model Cici is back with an 8 new photos and an all new set! http://flic.kr/p/7hBLu7
2009-11-20 09:37:21,Japanese model Ami Haruna looking very traditional with her yukata and fan! http://flic.kr/p/7h1ohF
2009-11-20 00:12:27,"Kawaii desu!  Japanese model Ami Haruna appears in 7 new photos dressed in ""Harajuku style"" http://flic.kr/p/7gWqm2"
