time,tweet
2009-11-22 05:56:46,@DKatri I'll see what I can do mate. Just a shame cameras on BBs aren't great.
2009-11-21 17:57:59,"RT @lachance680: If someone's pissed you off, is it right to physically assault them? <-- It can't hurt."
2009-11-21 17:56:44,@Christine_mufc He's definitely moved up a notch or three. Most improved player for me and becoming one of the first few names in the team.
2009-11-21 17:49:13,Bolloxed. Bass Day UK at the RNCM tomorrow. Can't wait. Night all.
2009-11-21 17:45:44,"@EamonnHolmes You do know you can customise Tweetdeck don't you? It's fantastic, and much better than the twitter home page."
