time,tweet
2009-11-24 20:46:51,"#spill Motion for Lib leadership spill rejected 48-35, Malcolm Turnbull hangs on as leader"
2009-11-24 20:41:31,"The mining, refining, oil, gas and energy industries have their say on the ETS deal struck between the ALP and the... http://bit.ly/72Al6Y"
2009-11-24 20:23:11,Mimosa pigra found in WA: The noxious weed mimosa pigra has been found for the first time in Western Australia. http://bit.ly/5hrjqS
2009-11-24 18:55:56,"Rain damage pushes grain prices up: Rain damage to grain crops in South Australia, Victoria and southern NSW ha.. http://bit.ly/7ivojd"
2009-11-24 18:55:51,Call for coal industry to upgrade technology with emissions compo: An alternative energy expert says the coal i.. http://bit.ly/5CSjYl
