time,tweet
2009-11-24 18:33:19,"@DigiDogs Dont put so many diamonds next time on JLo's kick bars, she may be able to not fall down ;)"
2009-11-24 17:38:25,"@Sagoon Everything is great, Robin is back and I couldnt be happier."
2009-11-24 13:41:31,"Enjoying working from home all week, things slowed down and @robinlemlime is back in the office.  Its nice out today, I think a swim is good"
2009-11-21 20:53:07,@LACommAgent I see at least 40% of our auditions come out for same day auditions. Stay on your toes actors it fast paced these days.
2009-11-20 21:42:08,@eugeniedfranval congrats on the job. When it airs we all wanna hear you brag about it. All the way to the bank ;)
