time,tweet
2009-11-27 13:53:31,Tiger woods was in an accident?.....i suspect DUI...
2009-11-27 13:46:37,description of problem: blackberry has a white screen and customer is wearing a black yankees cap and a black vest...lol...new phone.. :-)
2009-11-27 11:50:04,it's a shame i gotta go the sprint store in tri county to get this phone fixed..tired of all this driving
2009-11-27 11:33:30,recession what?..these ppl just bought up the whole of bestbuy
2009-11-27 06:55:59,i havent slept in 2days
