time,tweet
2009-11-18 17:03:51,"@IamSecond we will once we are done, but we are filming the students all week and so it won't be done until sometime next week"
2009-11-18 16:57:01,"@IamSecond our youth are doing the service at @GCChurch on November 29th, and the sermon is called ""Training for Second Place"""
2009-11-18 16:52:53,"@IamSecond we are filming our own I Am Second video of our students and times they put themselves second, or what being second means to them"
2009-11-18 15:51:32,"@jeffreykauffman plus, it would be good info to know if i ever wanted to prank someone... lol"
2009-11-18 15:51:14,"@jeffreykauffman no, but i was hoping it was a car cuz then I could make all sorts of jokes about how you knew how to do it and such..."
