time,tweet
2009-11-25 14:49:33,"Boerin Lida Flapper richtte www.vrouwvanboer.nl op. Want boerinnen hebben heus geen makkelijk leven, hoor! Jan Willem ging op 't erf kiekn."
2009-11-25 14:31:55,"John van den Heuvel heeft een nieuw boek: 'Moorden op bestelling.' Hij vertelt er zometeen over, exclusief bij BNN Today op Radio 1 ;-)"
2009-11-25 14:29:39,Bavianen in Zuid-Afrika vallen je aan en roven de auto leeg! Elles v Gelder woont daar... is zij al eens door een baviaan in elkaar getrapt?
2009-11-25 14:21:24,Lachen: Ron Meerbeek reist voor zijn profielwerkstuk als Beatrix (http://bit.ly/6p2Z5e). Eerder al als Bin Laden (http://bit.ly/8cy8If).
2009-11-25 14:09:31,Nu bij Today: @Luuk Ikink met de uitslag van Ranking the News. Daarna weer even naar Ragnar en met Exit Holland gaan we naar Zuid-Afrika!
