time,tweet
2009-11-13 23:22:19,"Droid Grabs Chunk of U.S. Mobile Internet Usage at Launch: This is significant, not only for demonstrating the .. http://tinyurl.com/yh332zw"
2009-11-13 23:22:16,Xing grows revenue while profit falls – and no LinkedIn takeover ...: I&#39;m not sure but a takeover by Linked.. http://tinyurl.com/yhrs26r
2009-11-13 23:22:10,Stephenie Meyer on &#39;Oprah Winfrey&#39;: About that original &#39;New Moon ...: Fri 11/13/09 8:22 PM. You kn.. http://tinyurl.com/yl6cb5k
2009-11-13 23:22:07,My advice to German media « BuzzMachine: Thus Google takes a share of the risk and that is what motivates it to.. http://tinyurl.com/yl47272
2009-11-13 23:22:04,"Flying the Digitally-Friendly Skies: Gogo, Google and the Facebook ...: All Things Digital. AllThingsD.com is a.. http://tinyurl.com/ydx2wyr"
