time,tweet
2009-11-24 22:16:44,"Seattle Times: Apple Cup week answers, volume two: Another round, looking  at some UW history. ... http://bit.ly/90WWL8"
2009-11-24 22:16:44,"Seattle Times: Video: Lorenzo Romar talks Pac-10, Quincy Pondexter and more: At his weekly press conference today, ... http://bit.ly/80GjGt"
2009-11-24 22:16:43,Seattle Times: Tuesday practice report: UW is off the field after about a two-hour Husky Stadium workout that staye... http://bit.ly/56LOvg
2009-11-24 21:37:38,"Go Huskies Blog: Huskies On FSN Northwest This Week: If you hadn't heard, it's Apple Cup week!  And, that means to... http://bit.ly/4YjxBR"
2009-11-24 20:48:21,Condotta: Tuesday practice report: UW is off the field after about a two-hour Husky Stadium workout that sta... http://bit.ly/56LOvg #Dawgs
