time,tweet
2009-11-25 06:22:02,"""The guy who sits in this chair winning on Sunday is going to have to make a few eagles. It's the most impor... http://bit.ly/719AhK #quote"
2009-11-25 06:21:31,My doctor told me to stop having intimate dinners for four. Unless there are three other people. ~~~ Orson We... http://bit.ly/OE2L0 #quote
2009-11-25 02:36:00,"Through art alone are we able to emerge from ourselves, to know what another person sees http://bit.ly/4TVHvS #quote"
2009-11-25 02:28:50,"Pablo Picasso: ""There is no abstract art. You must always start with something. Afterward you can remove all ... http://bit.ly/S0BDH #quote"
2009-11-25 02:09:03,"If you think you can do a thing, or think you can't do a thing; you're right.-Henry Fordmore about Ford http://bit.ly/7C8z1b #quote"
