time,tweet
2009-11-20 12:14:17,Atlantic premiers divided over deal to sell NB Power: Atlantic Canada's premiers emerged from a meeting Friday in L... http://bit.ly/8BZ8jj
2009-11-20 12:14:17,"Cop Tasers girl for resisting bedtime: The local police chief in Ozark, Arkansas is standing behind one of his offi... http://bit.ly/4AKsIE"
2009-11-20 11:35:58,"Sexual predator deported to Fiji, border agency says: The Canada Border Services Agency says it has deported a viol... http://bit.ly/84CrJc"
2009-11-20 11:35:57,Air Canada launches in-flight Internet access: Air Canada has become the first Canadian airline to offer in-flight ... http://bit.ly/4ycSAW
2009-11-20 11:02:19,Poll finds support for changes to citizenship book: A new poll suggests people are generally pleased with a new imm... http://bit.ly/4EuRlW
