time,tweet
2009-11-22 22:14:42,is missing baseball. Only 88 days until pitchers & catchers report for spring training.
2009-11-22 21:39:09,@ashleysumpter you are missed!  I'm praying that those promises become clear for you.  Happy Thanksgiving!
2009-11-22 12:25:21,is kicking off Thanksgiving week with a shout out to all the AU Chi Alpha student leaders.  I love serving with you!
2009-11-22 10:12:36,"""I'll stand with arms high and heart abandoned, in awe of the One who gave it all."""
2009-11-21 08:24:54,wonders why counting to 3 causes children to obey.
