time,tweet
2009-11-23 20:05:18,No. More. Comm. Research. Need. Pajamas. Nowwwwwwwww
2009-11-23 19:43:07,@rwhitneyjr SAVIOR!! Thank youuu!!!
2009-11-23 19:12:25,@rwhitneyjr do you remember the date of the Hayden article for class? Trying to work on it but forgot my notes w/ assign at home!
2009-11-23 19:04:38,My head is NOT screwed on lately - silly banking mistakes are making me angry at myself!
2009-11-23 19:01:34,SO FULL from a delicious dinner with Sarah @ Cheesecake Factory. Looking forward to my bed and packing for Jerz!
