time,tweet
2009-11-18 16:22:38,Ring a ling who's caaaaaalllin.. my phone so early in the moooooornin?
2009-11-18 16:21:43,@Maxturk I will fund that venture.. and I second that love for Steady as she goes.. uhhhhh huh !
2009-11-18 13:22:49,Man. Parents STILL don't understand ! and its been a real min since that record was released..http://www.youtube.com/watch?v=qI0dCVwdedE
2009-11-18 04:01:11,I mean it.. I loved playing for you last night and it meant everything to feel such connection :) Lets do it again really sooooon I love you
2009-11-18 04:00:17,Nope! nnooo.. not gonna tweet at 5:03 am.. haven't slept.. not gonna do it! ughh. crap! ok. glad I did cuz I thank you guys for comin out.xo
