time,tweet
2009-11-16 08:38:58,@natural_beauT My hsbd think I'm crazy for wanting more than two. I'll settle for 3.
2009-11-16 08:33:18,On Sundays sports take over Twitter and religion takes over Facebook.
2009-11-16 08:31:46,But I did check up on ya'll tho & nothin was goin on but a whole buncha sports commentary so I'm sure ya'll were thoroughly entertained.
2009-11-16 08:31:04,"I just chilled w/the hsbd all day, did some more much needed shopping and went to breakfast and dinner. Oh and saw our friend's new baby."
2009-11-16 08:26:12,I didn't tweet at ALL yesterday??? Damn....I wasn't even that busy.
