time,tweet
2009-11-26 08:52:47,Hola mundo.
2009-11-26 00:17:41,I think it's time to go to bed. See you all in the morning. Good night.
2009-11-26 00:02:45,"Luego de escuchar tanto Last Christmas, quiero escribir algo navideño. Pero no tengo ninguna idea navideña, ¿sugerencias?"
2009-11-25 23:34:32,"A todo esto, medio polígono amoroso que hay en #Glee D:"
2009-11-25 23:32:01,"""Who do you think I am?"" - ""That's actually a very good question because I've forgotten both of your names."" #Glee #Sueisawesome"
