time,tweet
2009-11-16 07:13:37,"Get focused, Turn off your phone and earn more money! - Read More: http://om.ly/cAsE"
2009-11-16 07:01:57,Get paid to teach what you learn - Create your opportunity today - http://om.ly/cAqb
2009-11-16 06:54:18,Terminate distractions and attract wealth! Learn more here - http://om.ly/cApu
2009-11-16 06:43:40,Always avoid the personal guarantee - find out why - http://om.ly/cApa
2009-11-16 06:32:43,The Three Pillars of Designing Your Ultimate Internet Lifestyle - Read more: http://om.ly/cAos
