time,tweet
2009-11-27 07:23:48,"RT @RevRunWisdom: It really doesnt matter the size of your next step, what matters is the direction- (Marston)"
2009-11-26 07:01:53,join my new facebook blog - here - http://bit.ly/6JSjr6.. Love 2 u all. DK
2009-11-25 08:28:45,http://bit.ly/5vrwtN -My old page was maliciously deleted -facebook cant seem to get it back so Im starting again - join me. Much Luv
2009-11-23 14:31:40,http://bit.ly/5vrwtN -My old page was maliciously deleted -facebook cant seem to get it back so Im starting again - join me again- much luv
2009-11-23 10:49:49,is finally back at the house in Joburg .. :)
