time,tweet
2009-11-25 03:40:14,"Instead of going about your business as usual, it's more excit... More for Taurus http://twittascope.com/twittascope/?sign=2"
2009-11-24 03:54:04,"You have a clear vision now of your ideal future, but may pref... More for Taurus http://twittascope.com/twittascope/?sign=2"
2009-11-22 03:40:22,Just because you are making plans for what's ahead doesn't mea... More for Taurus http://twittascope.com/twittascope/?sign=2
2009-11-21 03:40:57,Your most significant relationships have probably grown more i... More for Taurus http://twittascope.com/twittascope/?sign=2
2009-11-20 15:48:31,has just done a job in Hustle Pool in #MobsterWorld http://www.playmobsterworld.com/?platform=twitter&source=oneline_dojob
