time,tweet
2009-11-24 13:15:33,si: Pujols wins 3rd NL MVP Award in unanimous vote http://bit.ly/8bJcdz
2009-11-24 13:04:36,deadspin: Jay Mariotti: Lurking Tormentor Of The Chicago Bar Scene http://bit.ly/8zgYzM
2009-11-24 12:58:40,nba: Court rules state can seize property for Nets' new arena http://bit.ly/62DfTV
2009-11-24 12:23:58,"yahoo sports: Big Ben has concussion, expected to play (AP) http://bit.ly/6jaxQT"
2009-11-24 12:23:37,fanhouse: Alicia Sacramone Says She's Dating Brady Quinn http://bit.ly/7JMybX
