time,tweet
2009-11-19 21:47:42,@genevievejaxn night
2009-11-19 21:47:29,@cicizzle you are twitter cici..not nothing else...NADA DAYUM THANG...lOl
2009-11-19 21:46:14,Going to see it with my sussy @cicizzle and jasmine...or jasabell i call her....oh my....too excited
2009-11-19 21:45:01,Am i the only one that is excited about new moon?? I mean come on....to excited for it...TOO...
2009-11-18 15:29:54,Ahhh..i have to log off of twitter but I will be back on as soon as i get home from school....So yea Peace out
