time,tweet
2009-11-27 01:34:26,"@dontevenworry Yeah, I like the idea... just need to figure out how to start the process."
2009-11-27 00:59:15,2am revelation: I think I'm going to look into possible employment in Ireland for next year.
2009-11-26 19:00:50,Charlie Brown Thanksgiving! YES! My holiday is complete.
2009-11-26 18:25:01,"@toreyadore whoops, said hi, but forgot to direct it to ya..."
2009-11-26 17:19:34,"@omahairish Haha, I think I may have had my family thinking that for a while too."
