time,tweet
2009-11-27 21:36:06,"Be thankful i'm not a whore, not pregnant, not in your house and i'm in school trying to progress. #ohhellnaw"
2009-11-27 21:34:53,My mother is goin off! I'll let her figure out why I won't be home til the day before christmas. Told us we lost our minds!
2009-11-27 21:23:04,And mama jo looks absolutely disgusted with out clothes and I don't have anything on hoochie mind you. #settrippin
2009-11-27 21:22:10,So it looks like i'm goin to the marvell to celebrate with @qjamelf owww! See how the evening turns out.
2009-11-27 14:55:31,"""They say i'm nasty but I don't give a damn"""
