time,tweet
2009-11-24 02:12:56,I dont know if i like auto share on #youtube its ok if its some vids i like but some i comment on id rather ppl not see tht i watched ;)
2009-11-24 02:08:19,I favorited a YouTube video -- Kenny's Trip http://www.youtube.com/watch?v=aFAGQOGa9zE&feature=autoshare_twitter
2009-11-24 02:05:02,Effin rad @fadzero I love LA! (YouTube http://www.youtube.com/watch?v=aFAGQOGa9zE&feature=autoshare_twitter)
2009-11-24 01:54:12,I love it @fadzero rockin the slideshow with #THESHOCKER from #STEELPANTHER
2009-11-24 01:53:14,Check this video out -- Kenny's Trip http://www.youtube.com/watch?v=aFAGQOGa9zE my homie @fadzero made this slide show of my two LA trips!
