time,tweet
2009-11-18 18:58:29,"@cash4anthony keep going, good work buddy"
2009-11-18 18:56:46,"@tonyhawk Hey Tony, long time admirer even though I bmx ha ha.  Watched stoked the other day, mad mad story!!!"
2009-11-15 17:00:50,"""Knowledge is acquired through experiences so experience plenty and become knowledgeable"" Sam"
2009-11-15 14:54:50,thx followers keep on twittering
2009-11-15 10:47:52,Check out the free @hubspot webinar with CEO @bhalligan - A CEO's Guide to Internet Marketing on Nov 19 - http://bit.ly/ceomktg
