time,tweet
2009-11-17 14:50:06,@JasianPrincess oh lol i heard from other people too but more than likely it will be. and ill be checking my dms now!
2009-11-17 14:45:52,"ok tweets do I watch Center Stage, Harry potter 5 or Jonas 3d ? toughies. I've seen all like a gajillion times."
2009-11-17 14:42:38,Can I have this dance <3 my fave scene.
2009-11-17 14:39:52,@JasianPrincess nov 25th. :) so i hear...
2009-11-17 14:39:04,"watching High School Musical 3. Dear dancers at my school, that my friends is how you do the cancan haha."
