time,tweet
2009-11-27 03:02:39,Wih sadis on.haha autis it kebanggaanRT @siscoohohoo: @ayibbinsane setidakx dia ga jadi autis kea km Kn ksian. msag kucing autis sih?
2009-11-27 03:01:41,Panglima? oke RT @kusumaRAWR: Gabung kubu panglima rendi
2009-11-27 03:00:58,"Wah . Kapan* aje ya fal.kalo ol dikompiRT @naufalabahe: Isinya keren2 lo.. RT @ayibbinsane: Engak ah, mals gue"
2009-11-26 11:38:22,semoga ga kesiangan deh heheRT @nnenannee: haha iya iya betol km sndiri?kaga solat?RT @ayibbinsane: tidor.besok solat ied RT @nnenannee: zzz
2009-11-26 11:29:59,tidor.besok solat ied RT @nnenannee: zzz
