time,tweet
2009-11-14 03:47:33,wachten tot de zaal opengaat (zonder koffie :( ) holiday on ice Martiniplaza
2009-11-11 16:34:01,"Off 2 bed soon, but only after a Jura (again) 27/1/99 58% 40ppm heavy peated edition 'cause it's #whiskywednesday"
2009-11-11 16:00:55,@boslucht & @BrendaMcArthur Wat is jullie dram vandaag?
2009-11-11 15:38:08,I just opened up a brand new bottle of Jura 10 http://bit.ly/45fDUw #whiskywednesday
2009-11-11 15:19:50,"@BrendaMcArthur Heb net de koffie op, telt dat ook? O... oke ik zoek wel wat uit. Even geduld."
