time,tweet
2009-11-24 12:45:14,Candy Cane Cruise on Clifton Boulevard is a new LakewoodBuzz.com sponsor in Lakewood Ohio http://tinyurl.com/LakewoodForum community forum.
2009-11-24 09:36:28,"Checking the voting for ""Lakewood's Best"" in 2009 at LakewoodBuzz.com http://LakewoodBuzz.com this morning!"
2009-11-13 11:53:11,Did you know that using Lakewood Ohio based Greener Search Engine.com http://GreenerSearchEngine.com helps save energy?
2009-11-06 23:27:55,DYK that Lakewood Ohio's first independent community website LakewoodBuzz.com http://LakewoodBuzz.com is 9 years old this Thanksgiving?
2009-11-06 23:26:25,Checking the voting so far for 2009 best veggie burger in Lakewood Ohio at LakewoodsBest.com http://LakewoodsBest.com today.
