time,tweet
2009-11-24 07:06:26,http://www.ted.com/talks/hans_rosling_asia_s_rise_how_and_wh: http://digg.com/d31AqEe?t
2009-11-24 00:31:48,@raduboncea Great article about how our brains learnt to read. Thanks for sharing it.
2009-11-24 00:08:43,Google Chrome OS Will Not Support Hard Disk Drives: http://digg.com/d31AXVe?t
2009-11-23 05:30:21,Tweets or bleats? Tool measures importance on Twitter: http://digg.com/d31AoiY?t
2009-11-23 04:17:28,New computer worm virus may affect documents: http://digg.com/d31AoR2?t
