time,tweet
2009-11-24 12:51:52,No se aburren en el facebook? jaja :P #fb
2009-11-24 12:49:13,Segun el acuerdo al que se quiere llegar es que estudiantes $4 y $6 normal #parocamionescordoba
2009-11-24 12:47:44,asta el momento se dice que el paro en la zona centro de veracruz se levanta asta que lleguen a un acuerdo y se respete #parocamionescordoba
2009-11-24 12:45:12,@gillesgarzn Estudiantes :D desde las 5 de la mañana tomaron camiones y central camionera :D porque levantaron mucho los precios :D
2009-11-24 12:44:09,Hoy me toca hacer pesas :D espero poder rendir el doble :D me quiero sentir muy agotado jeje :P
