time,tweet
2009-11-24 22:22:29,Official: Pakistanis want Taliban defeat http://bit.ly/6xWfwe (via cnn world)
2009-11-24 22:05:34,Obama's First State Dinner Honors India http://bit.ly/7jtadq  (via CBS News) #news
2009-11-24 21:35:12,Yoomi Bottle is self-heating http://bit.ly/7k7WS1 #gadgets
2009-11-24 21:23:41,Obama seeks to reassure Singh on U.S.-India ties http://bit.ly/4Ff69A  (via Reuters) #news
2009-11-24 20:49:30,Another FOX News Flub: Will Someone Get Fired Like Promised? http://bit.ly/4VlO21  (via Digg.com)
