time,tweet
2009-11-14 06:35:59,Really love our health minister but why no hot security guys??
2009-11-14 01:50:36,"Dunno if its nationwide or just my stop though.. Either way, i think im gonna be late for work now..."
2009-11-14 01:49:34,"NEWSALERT!!! Smrt having technical difficulties, cant top up ezllink card and dunno when the next train is.."
2009-11-14 00:54:29,going to work in an hour then have to burn the midnight (or possibly 2-4 am oil) to complete my en2111 assignment:) Have a happy saturday!!
2009-11-13 22:53:40,RIP Eddie Guerrero. You are still missed and not forgotten. Viva La Raza!
