time,tweet
2009-11-26 08:54:39,You probably won't be able to shut off the flow of images that... More for Taurus http://twittascope.com/twittascope/?sign=2
2009-11-26 03:17:24,well im off to dream world everybody..( @LX_BLV3 and @GuessMyMix86 )  hasta manana!!!!!
2009-11-26 03:13:59,@LX_BLV3 lol yea..but at least you would be stylish..
2009-11-26 03:08:47,"@LX_BLV3 yea, just keep a low boy..thats cheap. although there is a lot of upkeep. u gotta keep it smooth"
2009-11-26 03:06:27,@LX_BLV3 lol its not oral its LaRo..lol..dammit..
