time,tweet
2009-11-29 11:46:10,@munchieeLOVE what happened??
2009-11-29 11:22:21,"RT @munchieeLOVE: Good girls are like shooting stars very rare, but when u find one she can make ur wildest dreams come true,!"
2009-11-29 01:04:28,hopefully ill be in a better mood in the morning ..Night .
2009-11-29 00:03:32,im bout to start not giving a fck *shrug* .. people just piss me off .. smh
2009-11-29 00:00:04,RT @msabell & i'm cutting alot of people out of my life . i'm too nice and many people dont deserve my kindness . their loss
