time,tweet
2009-11-16 06:35:19,Nobody's Home: Cats fail at Cal but will try Door #2 - Tucson Citizen http://ow.ly/1620gX
2009-11-16 06:30:15,Martyn Brunt Blog: Out On A Limb - Wiggle Bloggle (blog) - Wiggle Bloggle (blog)Martyn Brunt Blog: Out On A LimbWig... http://ow.ly/16202d
2009-11-16 06:30:15,Cycling in-the-news: Trini-born US sailor killed in cycling crash - Trinidad & Tobago Express http://ow.ly/16202c
2009-11-16 03:23:39,Why Do You Pull a 8-Ton Bus With Your Hair: Guinness World Record Week Recap - About - News & Issues (blog) http://ow.ly/161YjY
2009-11-16 03:23:38,Cycling in-the-news: Karma hit back at Cycle Challenge - Independent Online http://ow.ly/161YjX
