time,tweet
2009-11-24 14:29:34,Doing the right thing for others is never a bad place to start your relationships. Businesses who understand this thrive always!
2009-11-15 09:52:50,Yeah Jim. We are hoping Denver doesn't show up ;-)
2009-11-03 23:01:11,"According to a new survey from Administaff Inc, most small business owners believe the economy will recover within the next year."
2009-10-28 16:22:51,Secondary market guarantee program for 504 loans will create greater liquidity for lenders and extend access to capital for small businesses
2009-10-16 09:09:41,#FollowFriday @CPA_Trendlines @janiceriley @BobColeman @BrockNortonIns @BobColeman
