time,tweet
2009-11-16 00:09:36,Currently putting my ass to use.ya white girl has moves
2009-11-15 21:27:01,I would bet money on this night ending in blood shed. I hate everyone right now
2009-11-15 17:29:44,Getting ready to go out 2nite to Maryoke w/ my dysfunctional work family so i can laugh at them.Chalk this up to my once a year bar venture
2009-11-14 17:50:36,Did i really just get hit on while looking for a new deodorant? Are you serious dude?! I hope i smelled like armpit.
2009-11-13 22:52:49,@brozogirl Meh it happens dont worry about it.
