time,tweet
2009-11-17 03:51:13,i wish i didn't have to do study or exams and just become rich and successful automatically.
2009-11-17 03:24:26,"i would like to get my hands on some cash. i need new clothes and shoes and the Mighty Boosh season three, thanks."
2009-11-16 23:34:06,now the sun is out from behind the clouds. this is absurd  !
2009-11-16 23:28:38,why is it raining when it is in the middle of November in Australia ? i blame climate change.
2009-11-16 22:29:30,"2/4 - half way there, thank goodness. the worst exam has been completed."
