time,tweet
2009-11-14 10:52:33,I wish twiggas StoP trying to sell weed while they in school...huh u wasn't even a good weed man when u was selling it! *give up* #fail!
2009-11-14 10:50:21,Think I'm about to go to the gym...
2009-11-12 23:39:13,@cAndiRed88 PISSeD! should've steped out!
2009-11-12 22:13:28,@sofreshshad jus made me sum salmon(fresh) wit a cesar salad and baked potatoe..yaw I'm in heaven this ish is DELICIOUS!!
2009-11-12 20:31:44,Tired and eyelids becoming extremely heavy...
