time,tweet
2009-11-25 17:22:12,"I heart Chris Duda he makes me giggle, and he is sooo watching the lion king with me soon haha."
2009-11-23 16:52:14,IM ON STICKAM! stickam.com/hardcoreshorty
2009-11-22 16:57:18,http://twitpic.com/qk6cd - SOMEONE FUCKING BUY ME THIS SHIRT FOR CHRISTMAS AND I WILL LOVE YOU FOREVER!!! lol
2009-11-21 12:38:28,"LMFAO dacing to shake it by metro station with my momma and my dad said there's no dancing in football, I THINK THERE IS!!!!"
2009-11-21 12:35:41,GO BUCKS! lmfao texting hilary because she's a michigan fan! we can stay updated and not be in the same neighborhood anymore!!
