time,tweet
2009-11-19 23:45:01,Flurry of activity at Sierra ski areas in coming days - Examiner.com http://bit.ly/2ja8Yx
2009-11-19 22:18:07,Tahoe Ski Resorts Opening with Snow in the Forecast - First Tracks http://bit.ly/xRkgh
2009-11-19 14:18:05,Bring it on: Four more Sierra resorts to open by Saturday - Reno Gazette-Journal http://bit.ly/37geEn
2009-11-19 10:15:32,Lake Tahoe Resort Gears Up for a Heavenly Ski Season - First Tracks http://bit.ly/3RsmJQ
2009-11-19 02:14:46,Police and fire report for Nov. 19 - Bemidji Pioneer http://bit.ly/2yO1Pb
