time,tweet
2009-11-29 00:40:12,"Remember when the devils said,have you come before the time?but Christ told them to hold their peace & come out of te man.The devil is-"
2009-11-29 00:36:34,"The bible is to him that reads it.Christ teachings shut the mouths of men & ocassion from them,but also said,the end is not yet marvel not."
2009-11-29 00:32:13,"The Father said,I will find Me a new people & upon the fleshly parts of his heart & mind I will write My laws & he shall be unto Me."
2009-11-29 00:21:12,"Come now children of the most High & only Father,repent & be clean before your name is called.A simple thing to Christ;Love your Neighbor"
2009-11-29 00:15:32,"Pharisees & scribes;high seats in the synagogues of men,being greeted in the markets as leaders or a father.Read the ways of Christ & see."
