time,tweet
2009-11-27 21:36:06,@thekillerschile ahahaha... me pondré mi nick en un distintivo xD
2009-11-27 21:21:33,"@thekillerschile gracias...! amé las poleras... lástima que no pueda ir mañana, asi que no nos queda otra que vernos en el concierto...! :)"
2009-11-27 20:44:00,chata del dolor de muñeeeeca! >.<
2009-11-27 20:01:01,@GabrielSaporta por favor haz feliz a mi amiga @javierasays ... deséale un Happy b-day! :)
2009-11-27 18:51:55,"AGOTADÍSIMA....! pero pienso en lo genial que será el concierto, y me convenzo de que valió la pena xD"
