time,tweet
2009-11-23 19:09:06,"@arabean Yeah, exactly. JG is a good actor but he cannot carry this show. I think they all have a hard time accepting that."
2009-11-23 19:07:32,"@arabean @1critic I have always said that this show has TWO huge issues:  1. The reset button, hence lack of development 2. Leonard."
2009-11-23 19:05:55,"@1critic Not so much to go back to ensemble, we had an ensemble last season and it worked great. It's more about giving JG sth to do."
2009-11-23 19:04:39,"@arabean So they know P/L are not exactly working but if it means they can keep Galecki (the original lead) occupied, it's fine by them."
2009-11-23 19:02:55,"@arabean The sole fact that they are building the show around Parsons now, that's a problem for them."
