time,tweet
2009-11-14 04:22:31,"Moi: Din mamma har inte vaknat än. Flickvännen: Jo, det har hon, men hon lyssnar på melodikrysset. I en annan kanal."
2009-11-14 04:10:32,RT @donnyhedlund     Nu ser jag Råsunda i fjärran. Råttornas hembygd.
2009-11-14 03:45:00,Var tvungen att googla Robert Pattinson. #56åringen
2009-11-14 03:42:55,Dagens nyretroord: regnbågsfamilj http://bit.ly/3fLdmk
2009-11-14 03:39:32,RT @Grubblaren Frågan är ju bara vad de ska jobba med sen? Konstfacksfreaksen. Både Clownen Manne o Ika i rutan är ju tyvärr redan upptaget.
