time,tweet
2009-11-14 20:32:49,gonna escape to Fiji Wednesday until early December. Hope BO hasn't ef'd up some more while I'm escaping.  :O(
2009-11-14 20:31:12,"geez! I'm still stuck on the 100's of billions of debt GWB racked up. How am I 2 understand BO's 2 trillion?? You guys voted him in, not me!"
2009-11-09 20:33:21,bummer to feel good requires us to reflect on past events (berlin wall fell) & todays events crumble our spirit ($30B bonus 4 wall street)
2009-11-07 23:24:29,"@Hewitt_4919 Hmmmmmmmm, wealth & power. never been accused of those wonderful traits B4. but thx."
2009-11-07 23:20:47,"well, time 2 get pissed off.......gonna go watch faux news by FOX & over the top gibberish from MSNBC. Why can't we have a VIABLE 3rd party?"
