time,tweet
2009-11-25 15:17:39,"At my desk at work drinking coke wishing I had something to go in it. Jack, Crown, Jim, Henny something!! Shit!"
2009-11-25 15:15:49,RT @dustinprestige: You can not speak amongst adults if you possess the common sense of a juvenile. <- #church smh
2009-11-25 15:15:21,"RT @BlazeXXXII: three new albums on deck: R. Kelly, Rakim, and Juvenile. I hope they are worth listening to! <- R. Kelly go hard!"
2009-11-25 15:14:30,I won't lie. This Trey Songs Anticipation CD be putting people to sleep yeah. #nowplaying Trey Songs - it would be you.
2009-11-25 15:10:16,RT @Cook985: Pray that ya boi has a safe trip home twit fam<- got you boy
