time,tweet
2009-11-24 06:45:28,"Plano nuclear do Irã e pacifico! (kkkkkkkkkkkkkk) Otima piada senhor presidente, e isso que o Brasil precisa um homem de humor a sua frente!"
2009-11-16 21:28:50,"Ser fofoqueiro da dinheiro na internet,vejam os exemplos de fofoqueiros ,Orkut e twitter.Vc perde totalmente a privacidade em 140 caracteris"
2009-11-10 19:45:34,To com medo...
2009-11-10 19:45:19,do mundo acabar em 2012 ...
2009-11-10 19:44:40,"pq pensa cmgo, para o comite permitir que Brasil seja sde ds Olympiadase da copa e pq os maias estão certos! Eles nos sacaniaram"
