time,tweet
2009-11-16 01:57:17,Uhh school today = yuk. I'm too sleepy and I have a cough and a sore throat :-(
2009-11-15 17:34:54,"Just bought a realy old camera from eBay, I'm sick of digital. It all seems to perfect!! Can't wait to go back to film :-)"
2009-11-15 07:48:08,Might go paw trekking with the dogs today :-)
2009-11-14 16:46:10,"Maths grinds was fun and easy to understand, in starting to like maths !!"
2009-11-14 06:07:09,"Shopping :-) I have maths grinds later, that should be fun lol"
