time,tweet
2009-11-13 04:40:52,"Bom dia gente, como o Deraldo, editor chefe do O Jornal, diz: As páginas da Gazata de Alagoas estão pingando sangue!"
2009-11-12 21:09:37,Indo dormi pessoas! Noite boa para todos!
2009-11-12 21:07:06,"kkkk é pra mecher com vc @NataliaOsouza RT@LF__ Acabo de assistir ""Se beber não case"" MUITO BOM! Uma das melhores comédias que já assisti!"
2009-11-12 21:02:46,@victoorbrasiil Sorte Boa xuxu
2009-11-12 21:01:43,"http://twitpic.com/pb084 - ProgramAÇÃO ! @alanacamila_ (repórter e editora),@Szammyiirskii (apresentador e editor),@laisemoreira (produç"
