time,tweet
2009-11-27 17:50:20,Hope everyone enjoyed Black Friday.  Check out www.swartz2010.com Jeremy Swartz Independent for US Senate 2010
2009-11-27 06:21:05,Good Morning all.  Please take a look at Jeremy Swartz for US Senate www.swartz2010.com
2009-11-26 22:01:44,@19actionnews look at Jeremy Swartz for US Senate 2010 independent www.swartz2010.com  twitter swartzforsenate
2009-11-26 20:28:50,Hope everyone has enjoyed Thanksgiving.  Please take a look at www.swartz2010.com  independent choice for US Senate Jeremy Swartz
2009-11-26 15:11:42,Hope everyone is enjoying Thanksgiving.  If you have a chance take a look at www.swartz2010.com and share with your friends.
