time,tweet
2009-11-13 23:22:19,"What is the problem with your dog?: Like always, we had a lot of fun at a recent dog event. Being in the dog t.. http://bit.ly/22KPcC"
2009-11-13 23:17:23,"Yahoo! HotJobs: Travel Consultant T-24 Senior-BCD Travel-Peachtree City,GA-http://hotjobs.yahoo.com/j/JOBT6P6IQ.. http://bit.ly/4Dbdb8"
2009-11-13 22:31:19,NewsBusted: How Did Obama Make History? http://bit.ly/1I14x8
2009-11-13 21:18:59,"@jarsofclay Is the show next month in Peachtree City, GA a LFBTE or Christmas show? http://bit.ly/fp639 http://.. http://bit.ly/3GE4oo"
2009-11-13 21:18:17,Water on the Moon: Even Google’s Celebrating! http://bit.ly/6N2mE
