time,tweet
2009-11-23 12:05:05,On my way up cal...class at 2...n higher den a muh
2009-11-23 09:18:00,Ugh its cold outside i need to get my ass up if i plan on gettin back to cal before my next class...def bout to say eff it
2009-11-23 08:44:31,You want to find a perfect balance today between a meaningful ... More for Cancer http://twittascope.com/twittascope/?sign=4
2009-11-22 22:06:43,AMAS was entertaining....now imma change the channel n watch some law n order
2009-11-22 21:56:48,im startin to think shit was rigged at the amas....
