time,tweet
2009-11-24 13:56:41,"Ima tell you one tiiiime, girl I love, girl I love youuuuu.... Awhh @justinbieber , I love that song, fair do's :)"
2009-11-24 13:26:54,RT @lazaros_13: Whats better theme 4 a song? @Paparoach's suicide or @Britneyspears' 3some? i dont knw bout you but im livin in sin. R U in?
2009-11-24 13:21:31,"Cold, soar ulser on my lip,fed up,everything.. Gahhhhhh...."
2009-11-24 13:18:48,Btw britney is full on gonna kick papa roaches ass in fuse video of the year. Hell to the yeah. It's britney BITCH (:
2009-11-24 13:16:12,And they were all immenceeee ...
