time,tweet
2009-11-21 01:40:32,マンハッタン距離の三角不等式ってのを直感的に理解できたのでヨシとする。ユークリッド距離に比べると、等号が成り立つケースが割とよくある気がする。
2009-11-21 01:12:05,マンハッタン空間って内積空間ですかね？？。マンハッタン距離は三角不等式満たすはずだから○ですよね？？。
2009-11-21 00:22:53,SEAの枝刈り条件が、（自分自身に対して）明快に証明できなかったのだが、専門家の @kaz_hagio からご名答いただいた。三角不等式の変形とはなるほどだ。おかげで失敗した研究も別のステップへ遷移できるかも。
2009-11-21 00:07:49,@ryo_grid なるほろ。にしてもデザインが１０年近く前のHTMLだよね。もうちょっと綺麗なテンプレートないんかいｗと。
2009-11-21 00:03:42,この手のサイトはいつもデザインが同じだが、下請けが一緒なのだろうかｗｗ　RT @ryo_grid: ktkr > 好きな女性、タイプな女を口説き落とす方法！ http://bit.ly/7sw2eu
