time,tweet
2009-11-14 04:07:29,a little less sixteen candles a little more touch me
2009-11-14 03:35:18,I neeed to get Sims! To waste time in my boaring life!
2009-11-14 03:28:42,new perspective by Panic! I'm obsessed with that song for weeks! Today I'm gonna wear there tshirt I got in 06 =')
2009-11-14 03:05:12,I love not been woken by an alarm clock! Ugh its only 9 I wanna sleep more for the day to go by quicker
2009-11-13 17:52:24,"now its like 11:40pm coming home, and need to do my tan!:("
