time,tweet
2009-11-15 12:24:38,"@TheEllenShow  I wish I COULD find your purse for you_that would get me totally out of debt!  No job, but NO DEBT either_what a BLESSING!"
2009-11-15 12:11:00,@amygrant Saw the FOX video_Good Job Amy! My son & his wife both served in the Navy & always loved getting mail.  Thank you for helping out!
2009-11-15 11:55:14,"@myearmark  Is that my solution?  I own no land, still paying for my car, own 2nd hand everything_I don't think those 3 methods will help me"
2009-11-15 11:18:07,"Anyone want to buy a candle? More like 20 candles?_That would pay my last Rx bill_of course I'm behind about 3 mo's_1 month @ a time,right?"
2009-11-15 11:13:25,"Can't bring myself to ask anyone to help pay the Rx bills_when I say ""they're on my credit cards"" I'm sure it'll seem I want them to pay CC"
