time,tweet
2009-11-13 23:10:08,50 piores momentos da dublagem nos games  http://is.gd/4UFkT
2009-11-13 23:09:06,Paul W. S. Anderson de olho em filme de Metal Gear Solid http://is.gd/4UFeI
2009-11-13 23:05:59,Um Geek maluco com MUITO tempo livre fez esse video irado: Ford SHELBY vs CAMARO vs JEEP vs VAZ 2107 vs HELICOPTER http://is.gd/4UFeI
2009-11-13 22:51:34,Confira novo trailer e data de lançamento de Final Fantasy XIII! http://is.gd/4UEUh
2009-11-13 22:50:47,olha aí @fredseph seu filme preferido: Independence Day terá duas sequências http://is.gd/4UETB
