time,tweet
2009-11-25 04:14:59,Les tournées c'est ça aussi. #mamarosin #rubiks «le roi du rubicub disney»: Shared by livingdancing Les tournée.. http://cli.gs/4MYb8
2009-11-25 04:14:21,@delgoff Unkle revival ou véritable confusion?
2009-11-25 02:54:39,Où l'on se rapproche du duopole. RT @romanding: Orange (France Telecom) prend le contrôle de Sunrise (TDC) http://bit.ly/5Bs0uU
2009-11-25 02:52:20,"L'éditorial(!), ""monde qui procure [?] toujours plus d'incertitudes [pluriel ?] et d'insécurité"" #hopitalsefoutdelacharité http://tr.im/FJNW"
2009-11-25 02:44:00,"Réponses intelligentes à question stupide, à partir d'un sondage sans valeur ni méthode. #badjournalism (via @heraclite) http://tr.im/FJN7"
