time,tweet
2009-11-15 17:33:17,"RT @tashaselenia: happy birthday kak @novembriani @miarenauly , wish you all the best. JBU :)"
2009-11-15 09:26:57,kau buat ku jadi gila...(terus lupa lanjutan nya) :p
2009-11-15 09:24:36,@danielpasaribu hmm natal budut yg pasti di bln des hehe gw jd sie take a pic loh hohoho
2009-11-15 09:22:43,"@danielpasaribu kita hrs berjanji! biar tmpt duduk menjadi saksi, biar kita duduk bareng trus di gereja! :p"
2009-11-15 07:18:33,It can be quite a challenge now to balance your desire for act... More for Sagittarius http://bit.ly/79sZN
