time,tweet
2009-11-17 06:40:59,"Bom dia a todos, mudança de servidores concluída com sucesso, TweetDeck devidamente (clandestinamente) instalado, hora de ler posts antigos."
2009-11-16 17:10:50,Sobre preconceito... http://bit.ly/2k6Xwu
2009-11-13 08:44:05,"Sabia que tinha esquecido alguém: #FF @luiztegedor, suporte em TI com um blog legal: http://bit.ly/16QNHa"
2009-11-13 08:36:13,"@japenido Por nada James, o reconhecimento é necessário!"
2009-11-13 08:28:20,Primeira lista #FF (perdi a virgindade...) @anabee @Mayroses @japenido @bqeg @carlosemilio @millorfernandes @n2nd3 @ODarwin @OCriador
