time,tweet
2009-11-23 07:17:54,Music News: Jennifer Lopez Gave A Knock Out Performance At American Music Awards - OnTheFlix http://url4.eu/oPHA
2009-11-23 07:16:38,Music News: Spotify Lands App For Symbian Phones - PC World http://url4.eu/oPDS
2009-11-23 07:16:19,Music News: Rihanna timeline: From shocking violence to triumphant return to music - Chicago Tribune http://url4.eu/oPDR
2009-11-23 07:07:23,Music News: Adam Lambert ready to shake up pop world with CD - The Associated Press http://url4.eu/oP30
2009-11-23 07:07:21,Music News: Taylor Swift Wins Big at the American Music Awards - The Gossip Girls (blog) http://url4.eu/oP31
