time,tweet
2009-11-24 19:47:54,Hey what's up? @celebblvddotcom
2009-11-20 20:10:42,#FF @DaRealSebastian @RenzoMusic @CelebBlvdDotCom @TTTorrez @Kenni329 @MoWorldwide @DJBabeyDrew @MechanicalDummy @ExcuseMyFresh
2009-11-19 16:09:27,"Yep I have the woman for u, let me know when ur ready lol. & I agree u should do a shoot Ive never seen a pic u look bad in @DaRealSebastian"
2009-11-18 19:54:41,Yeah you love it until yo butt start freezing... NYC worse than Detroit lol @Nelly_MO
2009-11-18 19:47:56,Aawww Sebastian...I got the perfect woman for you...she'll treat you like a king & u won't be lonely no more :) @DaRealSebastian
