time,tweet
2009-11-29 12:28:03,Vamos falar de nomes estranhos? ai vai um : Xerox Fotocopia Autenticada.. (como deixaram os pais colocarem esse nome no filho eu não sei)'-'
2009-11-29 12:22:38,Vou trocar meu nome no twitter :P
2009-11-29 12:11:04,"Meus followers estão caindo como se fosse chuva, oque eu fiz? O.O"
2009-11-29 12:08:12,"Ah, hoje eu sonhei com o taylor Lautner :S UAHSUHA eu queria MUITO que o sonho fosse verdade, mas é IMPOSSIVEL =/"
2009-11-29 12:00:31,"Cara ta dando dr. Dolitte 5 (acho que é assim que se escreve '-') Como uma coisa CHATA assim, fez tanto sucesso? :O"
