time,tweet
2009-11-14 11:44:35,"Brown pulls a 27-yard FG wide right, still no score."
2009-11-14 11:39:55,Shawn Abuhoff swats away a pass that would have been a touchdown.
2009-11-14 11:39:02,"Dartmouth fumbles the handoff on its first play, Brown recovers."
2009-11-14 11:38:23,Garrett Waggoner with a big tackle on fourth down to give the ball to the Big Green at the 31 of Brown.
2009-11-14 11:36:46,Going to be a sloppy football game at Brown with the rain and the grass field. Brown gets the ball first.
