time,tweet
2009-11-18 20:52:31,"Enfim depois de engordar mil kilos, vou escovar os dentes e dormiir, mudanxa de planos, sala ocupada, vou com minha momis :)"
2009-11-18 20:47:24,"@ClodiSEP a pizza hut abriiiu ? Como assim, acabei de come pizza :( cuuu hahaha"
2009-11-18 19:52:17,"Na aula de teatro eu tive que simular, sozinha, que alguem estava me matando...ai fiz alguem infiando um caco de vidro no meu neeck ! #funny"
2009-11-18 19:50:13,"Comer e durmiir no sofa, ja que eu a ro vai dormi aquii...mais se bem que eu gosto de durmi com tv :D"
2009-11-18 19:49:47,"A pizza chegooou :D as meninas foram buaca, ja to de pijaminha hahaha!"
