time,tweet
2009-11-14 12:37:32,"I hope @LamefaceLivi likes her present...if she doesnt, I think Ill cry."
2009-11-14 11:25:36,"""I love you so much it's retarded."""
2009-11-14 10:22:28,All these little people that I used to tower over are towering over ME now...it's so strange.
2009-11-14 09:33:25,"RT @AndrewBravener: To whom it may concern; why do people write ""don't comment"" on their myspace pictures. I find this perplexing."
2009-11-14 09:04:05,@LamefaceLivi HAPPY FRIGGAN BIRTHDAY. <3
