time,tweet
2009-11-23 02:24:46,emang gw boongin RT @juliosv: RT jangan jangan tadi gue diboongin @fathaichsan: @shohibi heh lu tkg bohong http://myloc.me/1ETEw
2009-11-23 02:24:08,emang td rambut gw spaiki ya?? RT @firdul: Hai spaiki bok @shohibi http://myloc.me/1ETD1
2009-11-22 21:31:22,emang gw tukang boong RT @fathaichsan: @shohibi heh lu tkg bohong http://myloc.me/1EG0b
2009-11-21 07:41:00,kaos aja do RT @juliosv: @shohibi dapet apaan i jadinya midnight sale? http://myloc.me/1CRVv
2009-11-21 01:30:08,gw nggak jd ke pp do gw mau ke ex  tp klo cahyo keanya jd deh RT @juliosv: @istyabudi @shohibi udah di pp belom? http://myloc.me/1Cwom
