time,tweet
2009-11-17 07:52:56,Planning to offer featured links for free - free submissions - multiple deep link submissions - Submit now http://newgenresoft.com/Directory
2009-11-17 07:52:04,Feel free to add your websites for free - See the submission offer at the right place - http://newgenresoft.com/seoblog
2009-11-17 05:49:10,Subscribe and Get SEO Articles in Mailbox weekly - http://newgenresoft.com/seoblog
2009-11-17 05:25:41,7 Best thing that can be done for SERP improvement - Learn how to do - http://newgenresoft.com/seoblog
2009-11-17 05:24:40,How to make your business grow? Isn't search engine results play a lead role? http://www.newgenresoft.com/seoblog/index.php
