time,tweet
2009-11-13 05:43:32,"Új könyváruház. Megnyit: Kósa, dedikál: Tóth Krisztina, Aczél Géza, Kácsor Zsolt, Sztanó László, Valuch Tibor http://bit.ly/37txV7 #debrecen"
2009-11-13 04:29:27,Hogyan lett Ficsku Pál író neve: Ficsku? http://napielet.hu/napi/rovat/napiezer/5499/nevado A sztori
2009-11-13 02:32:55,"A HAON minden részletre kiterjedő helyszíni tudósítása a tegnapi, debreceni demonstrációról. http://twitpic.com/pbrdn by Holdrabló"
2009-11-13 00:44:04,Leszarjankózta a rendőröket a jobbikos szónok http://bit.ly/35Ve3N #debrecen
2009-11-12 02:22:05,NOSZTALGIA TROLI http://bit.ly/BoDdJ #debrecen
