time,tweet
2009-11-20 09:26:19,sick from stress need to know whats goin on and i need to know if everythings ok but i cant find out because she wont call or message me =(
2009-11-20 04:55:50,love and hate which is it i want love i wont the special girl here to give me that special kiss and to tell me how much she loves meplz ibeg
2009-11-19 21:43:38,goin to bed im tired and sick call me or message me if ya need me
2009-11-19 21:11:06,life in my opinion is unpredictable in ways you can imagine somtimes its heart ache but whatever it is it still sux and always will call me
2009-11-19 16:11:37,im gunna go fuckin read katie if you even care call me idk if you want to or not because your sick just kind of worried peace out ttyl
