time,tweet
2009-11-23 02:03:19,"RT @monkey2mill: Voting Junksounds Awards 2009 tinggal seminggu, pilih kita sebanyak mungkin:... http://bit.ly/07ZVTD8"
2009-11-23 02:02:37,Loakan mano? RT @ratihahmad: di loakan sih klo kamera gituan biasanya
2009-11-23 02:01:16,"Bkn, saya bu tien *nahlo*RT @desetoiles: mereka mba tutut & mba mamikRT @teguhpur: aku mas bambang gt @desetoiles?nah,mrk sapa @dedekstar?"
2009-11-22 23:57:03,ingin ditarik dari zona nyaman ini
2009-11-22 23:54:36,RT @endahNrhesa: VOte Endah N Rhesa for Junksounds Awards http://sites.junkonline.net/junksounds/category06.php .. thank u all. :)
