time,tweet
2009-11-28 21:36:11,Celebrities Without Makeup: http://jenontheedge.files.wordpress.com/2009/04/goldie.jpg http://bit.ly/6OO7t3
2009-11-28 21:26:09,Ryan Mallett is Pretty Pretty Pretty Good: Arkansas now needs to hang on for another 1:18 seconds. But les Miles always http://bit.ly/59TVvo
2009-11-28 20:16:21,"Corey Wilson Walked onto the Field Today: Best thing I saw all day today, props to the young man for not giving up and http://bit.ly/4KFOWK"
2009-11-28 17:46:26,Just Back from Norman: Watching the KU game totally naked in front of my television. Drinking Wellers and 7 and http://bit.ly/4Xxf5R
2009-11-28 16:36:13,My most epic fail of all time: I'm still upset at the turn of events last night where I had such an epic fail. Ok. Some http://bit.ly/5I7fls
