time,tweet
2009-11-15 00:17:28,Brandon Jennings had a light 55. I knew hed be nice!!!
2009-11-15 00:05:54,No one is seeing pacquaio
2009-11-14 15:06:15,I'm definitely watching this pacquaio fight tonight. Hard to bet against Manny either. I got him winning by knockout in the 7th
2009-11-13 17:25:28,Bout to scoop this call of duty with @bobbosmooth. We here now! Time for war lol
2009-11-13 13:43:21,"RT @BigWos: My phone pocket-calls the very WORST ppl in my phone book. Lol awkwarddddd. ""Only time u ever call is by accident"". Damn it lol"
