time,tweet
2009-11-21 17:22:34,"Angel Josué, es claro que no pudo ser de otra forma ya lo ves mi amigo, estaba escrita así te encontre y te perdí Te recordare siempre Amigo"
2009-11-21 16:35:16,"Angel mi amor, mi amigo! Q Dios te tenga en su Santa Gloria mi amor me vas a hacer DEMASIADA Falta !!"
2009-11-21 14:59:59,"Angle mi amor, mi amigo! Q Dios te tenga en su Santa Gloria mi amor me vas a hacer DEMASIADA Falta !!"
2009-11-21 10:46:28,Mi gente oren muuucho x la salud de Angel !! Señor ayudalo!! Angel Te kierou muuuucho!!
2009-11-19 19:00:17,"Suuper feliz, amo lo ke tengo amo lo ke soy!!!! Amo mis new friends de la vida y a los q no le guste q se muerdan!  ... http://lnk.ms/4WJHz"
