time,tweet
2009-11-27 20:44:11,"Aff, tá tudo muito rosa, odeio rosa, vou mudar tudo pra vermelho :~"
2009-11-27 20:42:53,"Eu ate podia ir pra Boomerangue amanhã mas eu morreria lá por causa das rodinhas, fatão"
2009-11-27 20:41:30,"@thycs Se você for cantar (principalmente se for Avenged), mande alguém filmar pra eu ver depois :)"
2009-11-27 20:16:30,"Ok, ou NINGUÉM tem o orkut de Miguel ou Miguel não tem orkut.. Que mole, daqui da janela não dá pra ver direito como ele é :/ -q"
2009-11-27 18:16:08,"http://twitpic.com/r8dis - ""Sou a 1ª palhaça de óculos ¬¬"" EHUAHEUAHU morri de rir hoje -q"
