time,tweet
2009-11-19 02:08:28,Big ideas... are little ideas that no one killed too soon. ;-) via Seth Godin Blog
2009-11-18 16:58:10,"E-Car-Angebot vom Stromversorger Ihres Vertrauens mit happigen Preisen, via heise http://bit.ly/3dF7UQ"
2009-11-17 07:38:42,RT @RAStadler: Neuer Blogeintrag Filesh.-Abmahnung DigiProtect+ Kornmeier-eine juristische Analyse http://tinyurl.com/ydkqfyx (via @alvar_f)
2009-11-11 02:52:29,@nordseestern Auch von mir alles Gute zum Wiegenfest!
2009-11-11 02:43:17,"Seit zwei Monaten eine neue Scheibe von Living Colour, und ich habe es jetzt erst gemerkt! The Chair in the Doorway #Mukke #Vernon_Reid"
