time,tweet
2009-11-15 03:06:51,"La. gets high marks for education technology, policies: By Mike Hasten • mhasten@gannett.com • November 15, 200.. http://bit.ly/2uiQwx"
2009-11-15 00:05:33,Verizon&#39;s top technology trends for 2010 | Blade Watch: Verizon have published their top technology trends .. http://bit.ly/2ZhgQG
2009-11-14 21:18:33,SCIENCE & TECHNOLOGY: by Yinghan Ding &#39;12 The Governors&#39; Global Climate Summit 2 was held in Los An.. http://bit.ly/1MkBAu
2009-11-14 18:02:20,Marvell Technology Investigates Employee Named in Galleon Hedge ...: By Linda Sandler and David Glovin Nov. 14 .. http://bit.ly/37nE1d
2009-11-14 15:06:58,"Essex Technology expanding footprint, relationships to grow sales: David Aldridge, vice president of finance fo.. http://bit.ly/3lpunc"
