time,tweet
2009-11-22 20:52:34,"@acrtts então até amanhã *_* e vai pro colégio, to com saudades :*"
2009-11-22 20:50:44,"vou dormir gente bonita, amanha tem revisão pro vest, boletim e lua nova.. só alegria \m/"
2009-11-22 20:49:54,"@nathygandolfo eu tb, estava vendo seu twitter agr e rindo que nem uma idiota! vou em janeiro, voce vai me ver né ?"
2009-11-22 20:38:35,"passou da meia noite,   #mileysweet17    *_*"
2009-11-22 20:37:45,"@acrtts  nossa nem fala, se a gente pirou no cinema a revista a gente sei la .. UAHSAUA. AMANHA VAMOS VER DE NOVO ?"
