time,tweet
2009-11-26 00:58:39,다시 m-flo가 좋아지는 중.
2009-11-25 09:33:24,콜린 퍼스는 역시 브리짓 존슨에서 최고였죠. RT @navercast: [영화 스페셜] 스페셜 무비 에디션 - 콜린 퍼스 A to Z : 나이가 들수록 더욱 깊고 근사해지는 배우 http://bit.ly/4DRSer #navercast
2009-11-25 09:30:09,하루를 정리하면서 랩탑이 아닌 휴대폰으로 트윗을 할 수 있다는 것이 새로운 기쁨. 앞으로 트윗을 제대로 하려면 맞춤법부터 배워야겠다.
2009-11-25 04:37:37,거기엔 순 여성을 찾는 남성분들 뿐이더라구요. RT @xguru: 아이폰용 폰투폰 메신저인 WhatsApp도 현재 무료 http://bit.ly/5GT90f 아이디없이 자기 전화번호로 사용해서 편리. 푸쉬가능해서 아이폰 사용자끼린 SMS대체가능
2009-11-24 10:09:26,"트위터의 생각 출력창은 크기가 작아서 일본식 하이쿠 쓰기가 좋을 것 같네. 이미 쓰는 사람도 꽤 되는 것 같기도 하고. 아 참, 일본은 트위터 정식오픈을 했지... 우리 나라도 http://twitterkr.com이 있지만 서도."
