time,tweet
2009-11-16 13:22:27,"http://twitpic.com/ps25t - So und jetzt ratet mal, wer heute unbedingt mit'm Fahrrad ohne Schutzbleche ins Büro wollte"
2009-11-16 12:16:32,Hachja...Arbeit....
2009-11-16 08:09:09,"@Calaelen  Haha, wie ich das kenne-""Da ist was mit IHREN Servern nicht in Ordnung! Bei mir stimmt alles! Ja das geht halt einfach nicht!"" ;)"
2009-11-16 01:26:40,"So, jetzt aber! #fruehstueck"
2009-11-16 00:20:19,Guten Morgen! Und wieder beginnt eine schöne Woche mitm Arztbesuch... *sigh*
