time,tweet
2009-11-21 05:32:33,Saturday night at home :) gaya nya si belajaaar.. Hihi.. Awas aja senin kalo masi ga bisa ujiannya..  http://myloc.me/1CJ8L
2009-11-21 05:28:14,RT karna aku special :) haha @Chellakarsidi: @annastasiasaz klo aku gk dibilang makasih? http://myloc.me/1Cn62 http://myloc.me/1CIRS
2009-11-21 00:12:58,RT karna aku special :) haha @Chellakarsidi: @annastasiasaz klo aku gk dibilang makasih? http://myloc.me/1Cn62
2009-11-20 22:41:08,Ngantuk bgt :( http://myloc.me/1CmIf
2009-11-20 22:33:08,@annastasiasaz happy birthday ! Iya sayanggg :)  http://myloc.me/1Cme5
