time,tweet
2009-11-21 09:19:06,@Koronix jól átsütve fínom ropogós :)
2009-11-21 06:50:57,"h nem tudod, hogy egy ismeretlen faluban hol van a temető, akkor kövesd a feketeruhás öreg néniket virággal a kezükben #fb"
2009-11-21 06:28:26,családunk művésze a nagybátyám http://nemethlaci.hu/ #fb
2009-11-21 05:10:07,"tegnap csak két percet neteztem :O nem is tudom, hogy éltem túl egy ilyen napot :O #fb"
2009-11-21 02:06:18,"@connordothu ebbe én is beletutottam, mikor takarytás közben a music playlistemet játszattam le..."
