time,tweet
2009-11-20 09:26:19,"@roveg ""new retweet"": must stink like some dirty old dog laying on a heap of garbage. Must have bit Odysseus & Yudishtra (dogmen) real bad."
2009-11-20 09:16:44,"Ocean vistas: mother Earth protect us. Sweet Jesus, be kind! http://twitpic.com/q8e3w"
2009-11-20 09:13:07,"@moritherapy ""Going to Cancun"" alibis & lulabyes: Mexican mindscapes: drugwars and starvation at a commercial price. We need to live. Peace."
2009-11-20 08:59:18,"Breath is the vehicle between all layers of ""body."" (Yes even Dharmakaya: ""God."") Breath - Merkaba - Juggernautha - Vajrayana."
2009-11-20 08:55:52,"Yes, play: the games are becomming increasingly interactive and increasingly addictive. Who will take the moment to breathe? Breath diamond."
