time,tweet
2009-11-25 07:44:22,@HugoGloss olha como esse ' fake du mal' do Alvaro Garnero é falso http://twitter.com/alvarogarnero/status/3230520283
2009-11-25 07:13:28,@dacordoprazer Adorei o cd de vcs ! Ouço todo dia .. Tão de parabéns
2009-11-25 07:03:41,Joselito é romântico http://migre.me/ctA3 (@Doutor_Pepper)
2009-11-25 06:58:55,Twitter é a rede social mais acessada do Brasil http://migre.me/ctyj ( Via @OlharDigital )
2009-11-25 06:41:54,"Uau, que tesão... http://migre.me/ctp4 HAUAHSUAHSUAHUS' (@Doutor_Pepper)"
