time,tweet
2009-11-12 23:32:04,Mande saludos a Andressa.. xfa mi amor!! te amo mucho (@guillermorosas live on http://twitcam.com/5j2h)
2009-11-12 23:31:19,"Mande saludos a Andressa, xfa mi amor (@guillermorosas live on http://twitcam.com/5j2h)"
2009-11-12 23:29:17,Brasil te esperaaaaaaa (@guillermorosas live on http://twitcam.com/5j2h)
2009-11-12 23:28:15,AAAAA las vondys! (@guillermorosas live on http://twitcam.com/5j2h)
2009-11-12 23:26:58,"mi amor, cuanda regresas a Brasil? (@guillermorosas live on http://twitcam.com/5j2h)"
