time,tweet
2009-11-27 05:17:22,"""Arraigados y edificados en Cristo, firmes en la fe"" (San Pablo) @madrid2011jmj"
2009-11-27 05:11:00,"RT: ViviEloy    ""Só quem já perdeu na vida sabe o que é ganhar, porque encontrou na derrota o motivo para lutar"". (@pefabiodemelo)"
2009-11-27 05:10:46,@mariacancaonova ei.. valeu pelo bilhetinho
2009-11-26 16:53:11,Estou dando uma olhada agora na nova interface do orkut... interessante...
2009-11-26 16:51:11,"Oi, já estou em casa, não teve aula hoje! Pelo menos poderei descansar um pouco.. rs"
