time,tweet
2009-11-13 05:48:44,"O ""Brasil decola"" na capa da revista ""The Economist"" desta semana. Destaque para o crescimento e alerta para o ""orgulho"" do país."
2009-11-13 05:25:47,"""A invencibilidade repousa na defesa, a vulnerabilidade revela-se no ataque."""
2009-11-12 12:07:03,"Num confronto, atacar as estratégias, em seguida as alianças e depois os soldados em seu próprio campo é a melhor inteligência militar."
2009-11-11 11:32:53,"Brasil10anos: regime de metas de inflação, superávit fiscal+redução do endividamento, câmbio flutuante. Não é pouco, mas ainda insuficiente."
2009-11-11 08:25:30,A inércia é a principal inimiga das realizações!
