time,tweet
2009-11-14 06:18:29,"la creacion de proyectos politicos en base al interes electoral deslegitima la actividad politica, que se debe encauzar al interes general"
2009-11-14 06:17:36,el cambio constante en la direccion del pais y de sus politicos crea inestabilidad y perdida de oportunidades de desarrollo
2009-11-14 06:15:03,la estabilidad en cualquier proyecto politico implica tiempo para desarrollarlo pero como los politicos son como son hay que irlos cambiando
2009-11-14 06:13:36,"las dmocracias y las rpublicas adolecen de 3 enfermedades: la incoherencia del votante, los abusos de los politicos, los cambios de criterio"
2009-11-14 06:11:43,Verguenza de nuestra Justicia politizada: Casas estudia retrasar el fallo del Estatut un año a instancias del Gobierno http://bit.ly/2RgisD
