time,tweet
2009-11-14 04:11:10,"Frontal sekali kamu Nyim, ckckck. RT @izyanayuni: Ah ia gitu?anggap aj dy monster mi.hwahaa"
2009-11-14 02:49:40,Besok pagi mau senam apa ke Gasibu ya? Bingung.
2009-11-14 02:47:13,"@qdhu nambah stres saya kang, haha"
2009-11-14 02:32:42,Kok tiba2 jadi ngerasa kesepian ya? Mana kosan sepi pula pada pulang kampung. Huwaa.... Pengen maen! :(
2009-11-14 02:30:39,Tadi mamah cerita katanya bis bakar2 ikan di pantai sama semua keluarga besar. Ah gak terima. Mau ikuuuuuuutt!!! :(
