time,tweet
2009-11-29 03:41:47,Nurses: is currently  accepting resumes for full-time Flight Nurses to be part of one of our bases in Arizona. Our..... http://cli.gs/86hpL
2009-11-29 03:41:46,Case Manager Post Discharge Nurse - Medicare: Case Manager Post Discharge Nurse - Medicare  Full Time... Management ... http://cli.gs/HHJ42
2009-11-29 01:04:37,Nurses: currently  accepting resumes for full-time Flight Nurses to be part of one of our bases in Arizona. Our... c... http://cli.gs/BGEUE
2009-11-28 19:45:23,Case Manager I (Pre-certification Nurse): Position Purpose:  Review inpatient admissions to assure appropriate level... http://cli.gs/gdtyL
2009-11-26 17:40:18,Registered Nurse I - (145th Ave. McDowell): considered a Floor/Career Nurse. Requires RN license... nursing experien... http://cli.gs/LBb9H
