time,tweet
2009-11-29 04:05:23,Isyam pameerrr! Ya gak @anyagomez??   http://myloc.me/1Mgee
2009-11-29 02:43:44,@dehimas happy birthday ya:) http://myloc.me/1MaOP
2009-11-29 02:32:42,"Jalan-jalan? Ujan.. Main? Main apaan,sama siapa? Mau ol? Internetnya lemot.. Ke warnet? MALAS http://myloc.me/1Ma5Y"
2009-11-29 02:27:40,@YoaRietta jiaaah kebetulan neh.. :D http://myloc.me/1M9KY
2009-11-29 02:21:56,"Omegee sakit banget jari manisku,susah digerakin :( gara gara ketimpuk bola basket hahhh -.-"" http://myloc.me/1M9nL"
