time,tweet
2009-11-18 20:52:31,dan ga ada yang sadar klo 2 jam itadi gw pake sendal bukan sepatu
2009-11-18 20:51:48,RT @jokoanwar:  Please don't make us angry. You don't like it when we are angry. #SBYtegasataumundur
2009-11-18 18:16:34,"Selamat morning,good pagi RT @IndoContest: Morning All!! @TechnoBoost @LifeHacks @TheLifeDesign @ChiaChie @ me @SayaSatria @CiciCuitt"
2009-11-18 08:44:51,Yg nama'y hura2 itu ga ada guna'y RT @derris_a: Mending ngendok dikamar aja/ ikutan hura2 itu malam ini? aduh dilema -.-
2009-11-18 07:15:06,Ketawa ktiwi nonton Ovj
