time,tweet
2009-11-13 07:47:08,SEM relatórios...matéria PELA METADE...Trabalho de penal ao invés de prova...VIVA AOS NERDS SALVADORES DOS DESEPERADOS!!! \0/ \0/ \0/
2009-11-13 07:46:54,"DICA: ao invés de reclamar DEPOIS, vamos discutir JUNTOS e NO MOMENTO! Reclamar é fácil...agir é bem mais difícil!!!"
2009-11-13 07:41:39,ADORO quando pessoas reclamam sem fundamento nenhum e sem ao menos analisar o que foi feito em benefício do coletivo!!!
2009-11-13 07:41:33,"FELIZ!!! De 2 LIVROS de matéria, conseguimos diminuir para POUCAS PÁGINAS!"
2009-10-28 12:24:18,"E depois pagodinho no comitê do Ary...hehehehe...Manda e-mail respondendo, ok?"
