time,tweet
2009-11-22 18:59:37,"Já que não existe teletransporte e eu não tenho dinheiro pra ir no show do Jason Mraz,fica só a vontade no play aqui."
2009-11-22 18:54:11,"O @caiocastanheira tá tão nervoso que forçou a chamada do zeca camargo,ao vivo."
2009-11-22 18:52:13,"eeeita passou sagui no fantastico,hahahhaha"
2009-11-22 18:49:37,O apartamento do Clodovil é igual ao meu. AHAHAHA sou fraca não
2009-11-22 18:36:27,@SergioMarone bah acabei de dizer que senti antes mesmo de vc perguntar haha
