time,tweet
2009-11-17 06:34:50,"@linipink verdade, fazer prova e ir embora cedo é a melhooor coisa!! hahahah"
2009-11-17 06:16:34,"@linipink nem em fale! a minha é semana que vem e eu quase não vou ter prova, mas a de segunda tá me matando desde já!!"
2009-11-17 06:03:59,@linipink muuito fofos! eu acho que eles total deviam ficar juntos de verdade!! hahaha e eu tbm tenho que estudar =/
2009-11-17 05:55:51,"@linipink noossa, que tudo!! eu queria muito tbm! e eu gosto hein! haha acho que a Taylor foi por causa do Taylor, certeza! hahahaha"
2009-11-17 05:40:43,"@linipink jura? aaaaaaaah! queria muito tá lá! (ou não, pq devia tá um infeeeerno aquilo! hahaha) seria beeem legaal!!!"
