time,tweet
2009-11-24 15:43:07,"@renatoadauto É isso aí! ""Bancadas do RJ e ES obstruem votação na Câm por divisão de royalties do pré-sal"" Passar de 7,5% p/44% é um absurdo"
2009-11-24 15:40:09,As cigarras ñ param de anunciar o verão antecipado e os mosquitos começam a incomodar. Muito #calor #veraochegou
2009-11-24 15:38:02,"Qdo a gente gosta do q faz nem sente o tempo passar. Estamos escrevendo 1 projeto q ficará bacana! Hora de deixar o trabalho, de ir p/casa."
2009-11-24 10:55:02,Ñ dava p/ ver montanhas nem casas. Só nuvens! Isso é q é incosciente coletivo #sobrenatural . Até + See you later.
2009-11-24 10:53:30,"Ñ fui só eu quem tive a idéia de dar um mergulho na praia da Ferradura, no almoço. As nuvens tb! O calor é tanto q elas resolveram mergulhar"
