time,tweet
2009-11-25 04:51:34,Global Worming Newsletter September 2009 « Global Worming http://bit.ly/57B9hp
2009-11-25 03:22:44,Farming Today - FSA call for clearer food labels http://bit.ly/8A1eeG
2009-11-25 02:51:46,Statement: New Edubiase United grateful to Sidalco | Sports News ... http://bit.ly/5CAS4q
2009-11-25 01:52:29,16000 Aion Players Have Been Banned Farming bots and spam-bots have been ... http://bit.ly/6QnyxJ
2009-11-25 01:52:28,Student totes live turkey to promote local farming http://bit.ly/5Q7bYe
