time,tweet
2009-11-19 23:10:58,@cdibona Congrats on ChromiumOS! well done!
2009-11-19 22:50:13,I need PivotalTracker style project management without all that Agile mumbojumbo. Anybody? Why no PM apps for wearers of many hats?
2009-11-19 21:09:42,"I have said it before, and I will say it again. Cmd+Q and Cmd+W are too close to eachother! blurgh."
2009-11-19 20:56:17,"Homemade bread, fresh from the oven. But it's 10pm!! How did that happen?! :/ http://twitpic.com/q6j9y"
2009-11-19 16:06:17,"@Bloodyfufu LOL! Is that the happy, singing, Redskins-loving guy? If he hates us, he hides it well..."
