time,tweet
2009-11-24 23:51:33,"Em tempo, o mundo mudou, sim. Mas só um pouquinho. Como parece que era pra ser, aliás."
2009-11-24 23:28:16,"vai dormir, @byapbrasil! enquanto isso, eu fico aqui, na ingrata tarefa de trocar de conta no MSN... :p"
2009-11-24 19:55:22,"Ok. Ganhei quatro convites para o novo orkut. Quem quiser, me manda uma DM. Uma dica? Eu NÃO recomendo."
2009-11-23 19:45:32,"O mundo muda amanhã. Ou não. Provavelmente não, aliás."
2009-11-23 19:39:19,@ayade RT @tarushijio: um dos melhores vídeos dos últimos tmepos RT: @PapoDeButeco: Post no blog^- Siri Malhando -  http://ow.ly/163TpN
