time,tweet
2009-11-25 16:52:08,Teenage Mutant Ninja Turtles: Arcade Attack (DS) cheats (source: IGN Entertainment): Teenage Mutant Ninja Turtl.. http://bit.ly/91JfEu
2009-11-25 16:52:05,"PSN Store stuffed for Thanksgiving (source: Gamespot): PlayStation Store Update: Tekken 6, Little Big Planet hi.. http://bit.ly/70zTlU"
2009-11-25 15:52:07,Call of Duty: Modern Warfare 2 Map Recon - Secret Spots on Estate (source: IGN Entertainment): Call of Duty: Mo.. http://bit.ly/4oaMTH
2009-11-25 15:52:06,Final Fight: Double Impact Unveiled (source: IGN Entertainment): Final Fight: Double Impact (PS3)Double pack of.. http://bit.ly/616Svo
2009-11-25 15:52:01,Scene It? Twilight - From Memory Gameplay Movie (source: Gamespot): Players must remember details from a short .. http://bit.ly/92B4js
