time,tweet
2009-11-17 03:45:13,Fri Football Extra William Byrd senior has eyes set on Vinton council seat: With elections tw.. http://bit.ly/20l0xJ
2009-11-17 03:45:11,Fri Football Extra Soldier with ties to our area dies in Afghanistan: Specialist Christopher .. http://bit.ly/20IfTr
2009-11-17 03:45:09,Fri Football Extra UPDATED: Jury selection underway for man accused of abducting & murdering .. http://bit.ly/31UR6d
2009-11-15 00:14:01,Fri Football Extra Giles vs Radford: Radford beats Giles 14 to 6. http://bit.ly/1QP1b1
2009-11-13 23:43:49,Fri Football Extra Magna Vista vs. Carroll County (11/13): Magna Vista won 36 to 13. http://bit.ly/2sbyYx
