time,tweet
2009-11-21 22:05:35,"but you can't because of the way you broke it off, I'm tired of seein this guy N just looking away awkwardly,but I don't have an alternative"
2009-11-21 22:04:48,I have a question... do any of you just have that one guy that all you want is to scream his name when you see him and give him a hug
2009-11-21 21:59:06,@kelseyreporter I was so taken aback... like where did THIS MAN come from?
2009-11-21 21:58:47,"@gayshitgoeshere bwahahahaha. But I promise if he was there, I would LEARN UGH"
2009-11-21 21:50:17,This spokesman on this Disaronno commercial is NOTHING short of gorgeous
