time,tweet
2009-11-26 19:00:55,How does a web development company get your  more business http://www.businesstoolchest.com/articles/data/20091123234955.shtml
2009-11-26 17:01:25,"You may delay, but time will not. Benjamin Franklin"
2009-11-26 14:02:34,"Until you value yourself, you won't value your time. Until you value your time, you will not do anything with it. M. Scott Peck"
2009-11-26 13:02:20,The top 10 of making your business profitable http://www.businesstoolchest.com/articles/data/20091123160032.shtml
2009-11-26 11:04:08,Let him who would enjoy a good future waste none of his present. Roger Babson
