time,tweet
2009-11-14 04:57:14,勉強になるからとても有り難い話なのだが、まだ作る工程が曖昧で本当に綺麗には出来ない事、そしてはけなくなったジーパンを持ち込みしてもらってるのだけど、思い出の品に私なんかが鋏入れちゃっていいのかなぁ　なんて　腕を磨く。
2009-11-14 04:55:54,わーい　口コミでボランティアな仕事が増えていく増えていく。　楽しいけど端から見るとマジで慈善事業。　オフでジーパンリメイクのトートバック依頼２件もらったよ！　どういう事ですか神様！！
2009-11-14 04:16:05,結局最後に変な補足入ったww　　@nishikoo したく頑張ってら！
2009-11-14 04:15:33,ドライな性格。仕事はミスが無いように丁寧にこなす。典型的なA型。しかし基本的観念がずれている面もあり、採寸とか普通にルチとかひんむいてテキパキサイズはかり出してしまう。　　　こんなもんか。
2009-11-14 04:11:58,@nishikoo wwwwwwwwwwwwwwwwwwキャラ的にみんな阿呆っぽい吹いたwwww ご主人様がまず抜けてるキャラだったから使用人に影響してたのかもしれない
