time,tweet
2009-11-18 10:01:30,"Dia de tocar hoje, tirarei Beyond Belief do Epica u_u"
2009-11-18 09:48:49,"Boa tarde, pessoas. :)"
2009-11-17 18:34:53,"Agora jantar e estudar CSS. Bom, pelo menos to na pag. 36 de 411 pags. LOL"
2009-11-17 17:17:46,"Mercyful Fate é ESCROTO e legal ao mesmo tempo, estranho. Estranho como o KING DIAMOND, que é um TR00 com voz de BICHA."
2009-11-17 17:03:24,"Victory tem uma das letras mais criativas do Megadeth. É toda feita com nomes de musicas antigas, muito boa."
