time,tweet
2009-11-18 12:44:26,"@TheBrianDuggan Yes, but how do you motivate the activists out onto the doorstep? Blogs and social networks work #yfblog"
2009-11-18 09:10:49,@CllrIanGilbert Haha! Hope Southend's ready to be amazed by it!
2009-11-18 09:04:59,I'm getting increasingly irritated that I can't get the new #againsttheodds PPB to work on my work PC! I hear good reviews....
2009-11-18 02:56:08,PPC letter to the PM on Electoral Reform referendum on polling day. http://bit.ly/4GEnpt #timeforachange
2009-11-17 15:51:25,Hope Queen's speech is 'shameless'... shamelessly progressive; shamelessly reforming; and shamelessly Labour. Cameron can just pipe down.
