time,tweet
2009-11-20 16:47:31,uhuuu jogando RAGNAROK.... depois vou atrás do PERFECT WORLD....uHUUUUUU
2009-10-23 20:26:17,Apaixonado.... S2.......
2009-10-15 10:43:18,Amanha tem Encontro.. Uhuuhhhhh ancioso para chegar logo o momento..... Atorom.. o Encontro....
2009-10-13 17:46:44,Voltando a Ativa....... Fiquei uns tempos sem entrar no twitter... Mas Estou de Volta....... Como estão volcs Twitteiros.???
2009-10-06 09:01:03,Putz ancioso para que lance o novo CD do Flyleaf... vai lançar dia 11/10 anciosissimo......... chega logo dia 11....
