time,tweet
2009-11-14 09:31:06,"Para ser engenheiro de trânsito em Goiânia, é preciso descender de uma família de idiotas."
2009-11-14 09:29:31,"Eh sabadaço, Goiânia!"
2009-11-13 16:28:27,"@Sen_Cristovam Pra todos q perguntam sobre 2010, queria ser candidato outra vez. // @diegoescosteguy O PSDB adoraria, senador. (Morri!!!)"
2009-11-13 16:22:06,"Acompanhando a fala do Marcelo de Carvalho, na cerimônia de 10 anos da Rede TV! Será q ele ganhou a Lu Gimenez com esse discursinho fraco?"
2009-11-13 13:48:53,Todo picareta que usa camiseta falsificada da DIESEL combina com uma calça da USTop e tem certeza que convence.
