time,tweet
2009-11-26 21:06:56,"@OGOchoCinco Uh...not too much on the Giants side of the ball.  Also, I'd destroy you in NHL 10, for what it's worth.  Just sayin'."
2009-11-26 20:48:29,"@heelsonthefield I replied to you.  Not that hard, was it?  I know the big-timers get hundreds of e-mails/tweets every day, but still."
2009-11-26 20:23:38,"I absolutely, positively cannot stand people who do ""this"" who don't make more of an effort to reply to their readers.  Readers make you."
2009-11-26 20:22:45,"I'm sorry, Josh McDaniels, what was that again you were trying to do?  Win this what?  Mother...something game?  Can you repeat that?"
2009-11-26 19:56:37,"@TSNBobMcKenzie Correct me if I'm wrong, but Hensick's stock has dropped quite a bit if he can clear waivers..."
