time,tweet
2009-11-18 17:26:32,@Thierry_Henry shame on you
2009-11-18 16:15:56,"excelente link para todos aquellos en linkedIn RT @pedroramirez: LinkedIn SuperGuide: Tutorials, Tips and Tools http://tr.im/Fea9"
2009-11-17 23:05:09,Porqué el café de starbucks es tan adictivo y caro? Me salía más barato fumar una cajetilla diaria
2009-11-14 15:27:44,Reporte desde cancún: mucho sol y se aprecia una tormenta en formación con mucho hielo y agua mineral
2009-11-12 20:11:34,objetivo del día de hoy: subir crudo mañana al avión
