time,tweet
2009-11-25 16:03:42,yay! happy thanksgiving! ^________^!
2009-11-25 06:48:06,"found out that wearing red is not allowed at the school...makeup, earrings, clothes, etc...go fig..."
2009-11-25 01:54:30,got a baked good from a student while waiting at the crosswalk ^_^
2009-11-24 16:18:19,http://www.allkpop.com/index.php/full_story/people_magazine_chooses_john_cho_and_daniel_dae_kim_as_sexiest_men/
2009-11-24 06:37:16,"as much as i love glee...why did they put in ""the other asian kid"" line for the ballads episode? -_-;;"
