time,tweet
2009-11-25 08:02:37,Toy recalls have dropped from 162 last year to 38 so far this year. Still sounds like 38 too many to me. http://bit.ly/7vWjlt
2009-11-24 15:35:21,Six-hour tarmac delay costs Continental $100K and who knows how many customers. http://bit.ly/5833ov
2009-11-24 10:17:02,Caveat emptor: Your online retailer might be pulling a fast one. I guess scams aren't just for Nigerian princes. http://bit.ly/6Zh3tS
2009-11-24 07:42:41,"First the largest U.S. recall by Toyota, now the largest crib recall. Not the kind of records you want to see broken. http://bit.ly/5nTLHS"
2009-11-19 10:16:46,Travelers eager to get to their cramped seats and enjoy their third of a can of Pepsi might need to wait a bit today. http://bit.ly/11ZQdO
