time,tweet
2009-11-19 00:15:07,Nyuh kemari kek RT @shastrifaction: Siniiihhh cup cup RT @indianindita: Cheer me up keeekk http://myloc.me/1AemB
2009-11-19 00:14:03,Lop yu tu RT @shastrifaction: @indianindita @yashyaaa loveeeeeeeee :D:D http://myloc.me/1Aeju
2009-11-19 00:01:18,Cheer me up keeekk http://myloc.me/1AdKD
2009-11-18 23:57:35,Iya gue jg hehe RT @yashyaaa: Aku gak sibuk kok cups! RT @shastrifaction: Jadi temen2 saya sibuk semua. Susah deh. http://myloc.me/1AdBn
2009-11-18 22:12:19,"Ya Allah giliran mau solat malah 'dapet' argh butuh pembalut ekstra -_-"" http://myloc.me/1A8Ap"
