time,tweet
2009-11-23 02:00:52,PostToday: ต้านสร้างเขื่อนในพม่า: กลุ่มองค์กรพัฒนาเอกชนภาคเหนือต้านไทยร่วมทุนจีนสร้างเขื่อนฮัตจี http://bit.ly/083glV6
2009-11-23 01:31:10,PostToday: แม้วขอบคุณท่าทีป๋าเปรม: ทักษิณทวิตขอบคุณท่าทีใหม่ของป๋าเปรมให้ทุกฝ่ายหันหน้าเข้าหากัน http://bit.ly/4pGVqT
2009-11-23 01:31:08,PostToday: ใช้กม.มั่นคงคุมแดงชุมนุม: สุเทพชงครม.ใช้กม.มั่นคง28พ.ย.-14ธ.ค.คุมพื้นที่ดุสิตราชดำเนินบางข.. http://bit.ly/084Gvlk
2009-11-23 01:21:41,Blognone: ไมโครซอฟท์ต่อยอดรายการเกมโชว์ใน Xbox Live หวังเข้าสู่ธุรกิจโฆษณาบนโทรทัศน์:  หลังจากที่ไมโคร.. http://bit.ly/6XZZFl
2009-11-23 01:00:45,PostToday: ศาลออกหมายจับเพชรวรรต: กลุ่มรักเชียงใหม่ปลุกแดงลุกฮือหลังศาลอนุมัติจับเพชรวรรตขู่ฆ่านายกฯ http://bit.ly/07CsEzp
