time,tweet
2009-11-15 10:02:07,"I'm at Washington Square Park (Washington Square Park, New York). http://bit.ly/4YcaT"
2009-11-15 05:25:15,ok this is weird. daughter is not even awake yet and i am watching The Wonder Pets already. http://www.nickjr.com/wonder-pets/
2009-11-15 05:01:20,wow. i think my jet-lagged coffee-addled brain just solved the 37-variable equation that is my family relocation. the answer is in Brooklyn.
2009-11-15 04:37:52,Scientist Photo Galleries | Science House http://bit.ly/22LpYe <- is it me or are these people all suspiciously good looking for scientists?
2009-11-15 04:23:21,nice month long delay Twitfeed! RT @anthonymobile: i'm reading GaWC Research Bulletin 321 http://bit.ly/zdoWM
