time,tweet
2009-11-24 05:25:39,Adicionado jogo Azure Dreams (psx). http://www.mundoemu.org/jogos/6309-azure_dreams.html. Confira no Mundo Emu!
2009-11-23 19:09:16,Adicionado jogo Golden Axe The Duel (segas). http://www.mundoemu.org/jogos/6308-golden_axe.html. Confira no Mundo Emu!
2009-11-23 16:57:00,Adicionado detonado Sailor Moon: Another Story (snes). http://www.mundoemu.org/detonados/2202-sailor_moo.html. Confira no Mundo Emu!
2009-11-23 16:47:31,Adicionado detonado 007 Goldeneye (n64). http://www.mundoemu.org/detonados/2201-007_goldeneye.html. Confira no Mundo Emu!
2009-11-23 16:29:15,Adicionado detonado Metal Gear Solid (gbc). http://www.mundoemu.org/detonados/2200-metal_gear_solid.html. Confira no Mundo Emu!
