time,tweet
2009-11-21 02:37:58,@dihrock *-*
2009-11-18 20:05:23,"ACREDITEM:  To vendo naruto  *---------------------* ,FEHUEHFOSUIAHFIUSHIUFHUIASHFIUASHFUIHASUIHFOUIASHOFHAOSIUFUIFHOAISUEHFAIU <33"
2009-11-18 19:55:18,"@Rafael_Benetti ooooooooo, sua puta *-* , Vai faze oqe amanha de tarde? :D e vaaleu fdp por i la na escola :@ e esperei GAY --' FEYGFUIASDFF"
2009-11-18 18:47:46,"@lucasfresno <3 Grêmioooooo,  *---------------------* , FJSEOPOIAJOIFJSOIJFAOIJFOIJOISEJFOIJASEFOIAS"
2009-11-18 18:36:25,"- Manoo , nem em casa to ): , FEHSAIFUHSEUIFHOIUSEHFUIHASEIUFHUAEISHFUIHUIAES"
