time,tweet
2009-11-14 11:03:34,We are recommending Essential Travel for affordable travel insurance throughout Europe from the UK: http://tinyurl.com/ozsjbw
2009-11-14 10:21:41,Interesting Expat News!: Spain's EU minister subject of judicial ... http://bit.ly/3xDGw6
2009-11-14 08:09:37,If you live in #Spain then check out http://expatlifespain.com for daily news that is of interest to #expats living in spain.
2009-11-14 08:01:08,"Need Parking at any UK Airport? We have used and recommend these guys: http://tinyurl.com/r6a6tm Secure, convenient & affordable."
2009-11-14 07:07:02,"2 new comments on ""AlmerimarLife Strays"" and more http://bt.io/ALNk"
