time,tweet
2009-11-20 07:56:06,"@AmaliaFarida jgn senin, ada ulangan fisika jam pelajaran pertama. sebenarnya minggu bsk gue ulangan tiap hari. tp gue usahain. udah bs sms?"
2009-11-20 07:40:43,@AmaliaFarida missssss you tooooooo! kpn lo pulang ke rumah lo di iowa? want to call youuuu ASAP
2009-11-20 07:33:09,"@harsyadika hahahaha okeoke, gue rasa abis makan siang gue bakal pergi dr career day"
2009-11-20 07:29:14,ga ada dan gausah aja yuuuuuuk RT @harsyadika: ITA 3117 besok ada yang inten gk?
2009-11-20 07:27:56,@aliciamanda aku juga sama papa. tapi dia agak syok pas lihat jamnya ........... eh abis dr sekolah kita ke sugi yuk
