time,tweet
2009-11-13 03:42:09,@s_zhmakina http://www.jaguarcenter.ru/jaguar_xj
2009-11-13 03:41:51,"не ну конечно, на таком уровне моя мечта Jaguar XJ RT@s_zhmakina s_zhmakina    @AKompaniets А моей - Maserati GranTurismo S ;))) ...купе!!!"
2009-11-13 03:38:04,"@shoguevara ок, уже удалил вместе с листом ))"
2009-11-13 03:29:09,"Знания – это багаж, который никогда не бывает лишний (учили в школе). Особенно когда ты бедный.."
2009-11-12 08:49:22,но моей мечтой остается Honda Civic Type-R..
