time,tweet
2009-11-26 01:41:10,そして一番言いたいのは、うちの近くのユニクロよ何とかしてくれ。買い物客に駐輪場利用券渡すとか、十億円還元する前にやるべきことがあるでしょうが。・・・と、結局はいつも私怨からしがないアイディアを捻り出しているオレ。
2009-11-26 01:37:39,発想を変えて、なぜ西欧で美しいといわれている街には路駐駐輪がないのか。もちろん自転車文化の違いや犯罪率の背景もあるだろうが、たぶん別のファクターが働いているのではないか。
2009-11-26 01:35:12,トライアンドエラーの繰り返しかもしれない。でも最初の一歩は間違いなく「意志」。精神論を語ってもしょうがないけど（笑） RT @xx101: それは賛成。だから実現方法を模索してたんちゃうん？いい方法がないから今の状態なんやと思うねんけど…やる気だけでは事は動かん。
2009-11-26 01:30:27,店の前、駅の前、歩道の上に駐輪する人々は、たとえ10歩先に無料駐輪場があっても店先にとめると思う。その10歩を歩かせる工夫が必要。違反取締りは目的ではなく手段。目指すのはバリアフリーな都市空間であり、それに魅力を感じる人々によってさらに賑わいが増すこと。
2009-11-26 01:21:33,要はアイディア、そしてやりきるという意志次第。妊婦、ベビーカー、高齢者、障害者への配慮がなさ過ぎる現状は改善すべきではないかと。 RT @xx101: だったら駅前店の客も減るかもよ？
