time,tweet
2009-11-26 17:40:10,Fútbol. La jornada más allá del clásico (Diario Apuestas): ... Es que el Málaga marcha último en el c.. http://bit.ly/5NEjkd  #valencia
2009-11-26 14:10:07,El Alicante constituye su fundación con el objetivo de conseguir ayudas para la cantera (Diario Infor.. http://bit.ly/7B0zSz  #valencia
2009-11-26 13:40:08,"Fútbol.- Gregorio Manzano (Mallorca): ""Vamos a Valencia con mucho que ganar"" (Europa Press): PALMA DE.. http://bit.ly/4GRhqI  #valencia"
2009-11-26 12:40:12,El carril bici desde la universidad hasta Valencia estará listo en 2010 (Hortanoticias.com): El área .. http://bit.ly/5Q64hS  #valencia
2009-11-26 10:40:14,El camerunés Kome descartado para el choque del domingo frente al Valladolid (As Celta): ... ejercici.. http://bit.ly/4sOUnB  #valencia
