time,tweet
2009-11-22 14:52:40,ORKUT novo mto estranhooo hauahuahauahau
2009-11-22 14:44:11,@DaniloGentili Pq chimarrão é mtooooooo bom...aqui em SC tb tomamos...soh q detalhe é q o chima não engorda q nem a pizza...rsrsrs
2009-11-21 07:23:33,Qd era criança os professores diziam:Ond pensa q vai chegar s/ estudar?Hoje eu sei mt bem:na presidência. #piorestwittadas do @danilogentili
2009-11-21 07:18:56,Principal diferença q Gugu sentirá na Record: seu patrão ñ joga + dinh p/ povo.O povo q joga p/ o patrão. #piorestwittadas do @danilogentili
2009-11-21 05:36:26,Findiiiiiiiiii =)
