time,tweet
2009-11-26 03:08:10,バイトの女子大生と雑談しつつ女の子メディアリサーチ。ほんの何歳か違うだけで、嗚呼、まるで異世界…生息地が違い？もはや生まれの違い？
2009-11-26 00:02:11,うちの子が、木場公園に入ったきり2日目。公園で夜を明かしているの！？迎えに行こうかと本気で思い始めた今日このごろ。ふと、バーチャルな生き物だったことに気づく。  #travatar
2009-11-25 20:00:16,【デザイン基本帳 本当に必要なプロのルール】大事なことが書いã.. http://book.akahoshitakuya.com/cmt/3928479
2009-11-25 19:25:00,信じてtweetしつづけます。RT @giga0731: 大人にもサンタさんっていればいいのにねRT @Ich_co: 欲しい。サンタさんに向けたメモ。RT @gizmodojapan: 【最新記事】 「紙とあそぶレゴブロック」 http://bit.ly/60jrh9
2009-11-25 08:34:13,欲しい。サンタさんに向けたメモ。RT @gizmodojapan: 【最新記事】 レゴ＋無印良品＝超可愛いおもちゃ「紙とあそぶレゴブロック」 http://bit.ly/60jrh9
