time,tweet
2009-11-21 05:51:43,Ayoooo kapan dimana? RT @Anandarandy: @dheyaw @sarahmutiah @firlieathirah ayuklah ngumpul
2009-11-21 05:51:16,@sarahmutiah iya bundaku mau buat bakso loooh spesial buat si @firlieathirah hahaha. Eh si laras apa kabar yaa?
2009-11-21 05:50:13,Besok newmoon gimana yaa gue dapet ga yaa aaaaa RT @puisipancara: @dheyaw nggatau dhey yg mesen bkn gueueue
2009-11-21 05:37:01,Besok lo nonton dimana seiiy? RT @puisipancara: Mau ntn 2012 bsk mesen tiketnya skrg ckck
2009-11-21 05:36:24,@firlieathirah @sarahmutiah @anandarandy waaaahh aimicuu pokoknya nanti kita ngumpul ya ditanyain bundaku
