time,tweet
2009-11-25 00:13:18,Anaaakkkk setaaann!!!! RT @SamuraijacK_: Hehehehhehe. Mantaappp. Nike Dunk Gucci http://pic.gd/dc4dc9 http://myloc.me/1GV3K
2009-11-25 00:09:35,Ow ayaayaay sukses yaa.. RT @sherly4u: @gadiiing gading td gak sempet ngobrol yach?? Hehe slm knl. Aku sherly yg 4U td hihi
2009-11-24 22:26:32,"Yeap.. RT @jacqueline1804: @gadiiing nanti malam mazda, sayang :)"
2009-11-24 21:52:48,Hahha liat bsk yah.. :p RT @Viesavior: @gadiiing kk bsk da acara bagi2 jaket lg kagak...hahahaha *ngarep*
2009-11-24 21:52:16,Yah gw ngemc ditempat lain..RT @annedominic: @gadiiing jam 7!I'm not coming..sakit gue!sial..
