time,tweet
2009-11-26 21:26:46,@tlhoyle thanks for all your support happy thanksgiving
2009-11-26 21:25:50,I bet things have changed
2009-11-26 21:25:27,Ha ha crash my belly is upset dont help grandma has to tell old school story maken us laff the last time she was in nc was 1946
2009-11-26 15:54:44,Just got done eating a great dinner with the GCI fam. Off to the airport to pick up grandma. Have a great turkey day!
2009-11-26 11:50:28,God bless all the troops that arnt home with there familys serving there country
