time,tweet
2009-11-29 12:52:13,"Minha conclusão: Estratégia de Marketing, quer audiência de alguma forma... ok..?! Vamos usar só um pouquinho da criatividade,pois todos têm"
2009-11-29 12:50:20,"Pensem que mesmo sendo uma ajuda as pessoas necessitadas, isso é anti-ético, ainda mais por não ser no mesmo dia que o outro programa..."
2009-11-29 12:48:55,"Luciano Huck e Gugu, ultimamente, fazem comentários de que um copiou conteúdos do programa do outro..."
2009-11-29 12:48:05,"É,depois de um tempo sem entrar no twitter pra fazer um comentário..."
2009-10-15 13:09:11,"Tô vendo a novela: ""Alma Gêmea""... hehehehehehee...."
