time,tweet
2009-11-15 14:15:08,Thinking in Modern Warfare 2 and of course Assassins Creed 2...coming soon
2009-11-15 11:56:30,"En casa de Quiñones con los Procedimientos Almacenados, mas tarde la raza quiere ir al cine...veremos XD  aun ando cansado"
2009-11-14 16:24:07,@VargasAlan alan nomas se la pasa en el Twitter XD
2009-11-14 16:03:22,Por cierto debo de subir las fotos al Facebook !! jajaja y claro al Osum
2009-11-14 16:02:42,"En casa, cansado pero creo que me ire a jugar un rato Futbol con la banda de Monterrey !! despues seguire checando actividades laborales"
