time,tweet
2009-11-26 09:21:29,"Cookies and Cream Hersey's bar for breakfast? Heck, yes."
2009-11-26 09:21:08,"@_debalice - I may or may not have accidentally triggered my time machine, which propelled everyone forward by a few months... Whoops?"
2009-11-26 08:57:04,"@sergioshorts - Well, she could always hit up the ICU at the hospital. There has to be /someone/ there in a coma..."
2009-11-26 08:51:54,"@sergioshorts - Pathetic. Just...pathetic! If she's that desperate, can't she just get random guys drunk and do them?"
2009-11-26 08:48:28,"@sergioshorts - Seriously!! Like, really. How good can you feel about yourself when you have to extort sex out of a man?"
