time,tweet
2009-11-18 19:01:53,Italia-Blog.it: Ue:Ronchi e Meloni a Trieste per seminario politiche giovani http://bit.ly/4c01MQ
2009-11-18 19:01:51,Italia-Blog.it: Sicurezza: Anziano soccorso in mare a Trieste http://bit.ly/4fRhck
2009-11-18 19:01:50,Italia-Blog.it: Napoli: il reggino Barillà è il nome nuovo per la fascia sinistra http://bit.ly/34V0OP
2009-11-18 19:01:50,Italia-Blog.it: Successo per la raccolta firme promossa dalle Acli a Napoli per la tutela... http://bit.ly/3t1Q9c
2009-11-18 19:01:47,Italia-Blog.it: RomeoImmobiliare – Napoli http://bit.ly/3LL7yj
