time,tweet
2009-11-19 04:54:58,Nueva versión de LaTeXiT disponible: http://pierre.chachatelier.fr/programmation/latexit_en.php
2009-11-19 04:40:05,"El viernes pasado fuimos al teatro a ver a Faemino y Cansado. Hacía tiempo que no me reía tanto. ¡Qué va, qué va... Yo leo a Kierkegaard!"
2009-11-19 04:38:00,"Iba a contestar un offtopic en la LSPM, pero me he contenido gracias a Twitter"
2009-11-19 02:46:53,Acabo de ver que la señora de la limpieza ha estado toqueteando mi ratón y me lo ha enguarrado :-(
2009-11-19 02:46:22,Al final resolví mis problemas con el 10.6.2 instalando la actualización combo.
