time,tweet
2009-11-27 05:19:39,iaa eh ukurannya yg pas ya lee.. RT @ulezhafirah: @nauvale @ssfrs eh harganya 53 ribu aslinya plus ongkir jadi 58 ribu satu orang ye.
2009-11-27 04:57:37,MADEPUCKYEAH RT @gomfernando: @nauvale banyak bacot nih hahahahaha
2009-11-27 04:56:31,ga boleh sama siapa?? putra?? HAHA RT @kansaurie: maunyaaaaaaa.....tapi gak dibolehin kak  T.T RT @nauvale
2009-11-27 04:54:51,haha mang enak belom. emang kenapa kalo udah?? RT @dinidinns: @nauvale belom pay yaampun lo udaaaah ? jangan bilang udah please
2009-11-27 04:53:11,"HAHA  bangga lah orang betawi gue mpok.. samlekom RT @dinidinns: bangga kamu dek ? RT @nauvale: wuuhhhhuuiii muter"" jakarta"
