time,tweet
2009-11-29 14:02:08,Video: by far the best thing i have ever seen. http://tumblr.com/x5c4c8d33
2009-11-28 09:42:18,somewhere in new paltz. sooo tired soooo hungry.
2009-11-28 01:57:07,"'abrams, jaime said that you tackle like a bitch and uhhh you suck at uhhhhh drinking cause youre in zbt.'-nt god bless america."
2009-11-24 21:38:29,@withthepunches its not breaking edge if you do it in a walmart.
2009-11-24 12:14:50,"Photo: for the love of god, someone buy this for me. http://tumblr.com/x5c48bxmv"
