time,tweet
2009-11-24 16:26:05,Lower Makefield Township receives $250K green energy grant: By Matthew Fleishman; Yardley News Editor Lower Mak.. http://bit.ly/6HS0v8
2009-11-24 16:25:57,"Children books explore global warming: Our kids are surrounded with references to global warming, greenhouse ga.. http://bit.ly/8JbcGb"
2009-11-24 16:25:52,Recycle old electronics Dec. 5 http://bit.ly/6Wo7GA
2009-11-24 15:25:44,Shell: market alone cannot deliver green energy: guardian.co.uk Royal Dutch Shell CEO Peter Voser says falling .. http://bit.ly/8c9MZ3
2009-11-24 14:26:44,German Jordanian UniversityGJU | Conferance about Natural Resource ... http://bit.ly/7c7xoW
