time,tweet
2009-11-20 06:32:52,El Colegio de Abogados balear promocionará en Navidad la prevención jurídica con spots publicitarios en salas de cin... http://bit.ly/WkPEt
2009-11-20 06:32:52,"Más de 100 tractores se manifiestan en Mallorca para exigir más ayudas  ante la ""mala situación del sector agrario"" http://bit.ly/12wkwv"
2009-11-20 06:32:51,Más de 100 tractores se manifiestan en Mallorca http://www.que.es/islas-baleares/200911201306-mas-100-tractores-manifiestan-mallorca.html
2009-11-20 06:32:51,Fundació Destí Menorca promociona la Isla en el mercado nacional y alemán http://bit.ly/1LYYNx
2009-11-19 13:55:34,Seis de cada diez hombres con disfunción eréctil padece daños vasculares que pueden llegar a ser irreversibles http://bit.ly/26BXpw
