time,tweet
2009-11-24 22:06:34,"Peter told them, “Each of you should change your mind and be baptized in Jesus Christ’s name” (Acts 2:38, Bible as Poetry)."
2009-11-24 22:06:08,“Bible reading is an education in itself” - Lord Tennyson
2009-11-24 21:00:02,It is exactly two days (48 hours) before the Bible as Poetry New Testament is released. Then you can download it at www.BibleAsPoetry.com.
2009-11-24 20:13:45,"May you have boundless hope in the Holy Spirit’s ability (Romans 15:13, Bible as Poetry)."
2009-11-24 20:12:28,The Bible as Poetry New Testament will be released at www.BibleAsPoetry.com on Thursday at 9pm North American Central time.
