time,tweet
2009-11-24 08:42:10,Jobs in Bharat Electronics Limited (BEL) http://tinyurl.com/yamohrn companyjobs.co.cc
2009-11-24 08:42:03,Jobs in National Brain Research Centre (NBRC) http://tinyurl.com/yb24y54 companyjobs.co.cc
2009-11-24 08:42:01,Jobs in The Shipping Corporation Of India Ltd. (SCI) http://tinyurl.com/ykcry9m companyjobs.co.cc
2009-11-24 08:41:57,"Jobs in Indian Institute Of Technology (IIT), Kharagpur http://tinyurl.com/ykt5rzo companyjobs.co.cc"
2009-11-24 08:41:53,Jobs in Delhi Judicial Academy http://tinyurl.com/y8nov5w companyjobs.co.cc
