time,tweet
2009-11-23 19:01:32,A full battery on an iPhone is like having a full thank of gas. http://tumblr.com/xwi47smzu
2009-11-23 17:59:57,"Updating the Tumblr app, looks promising."
2009-11-23 17:38:48,"Morgan Freeman inks deal to narrate Lexington Ave., routes over loudspeaker! (via @FakeMTA)"
2009-11-23 17:38:09,Having a full battery on your iPhone is like having a full thank of gas. just sayin…
2009-11-23 17:38:00,"@AlisonM no worries, you aren't the only one. If you bring the cookies, I'll bring the milk! Whole, 2%, 1%, Skim, or Soy?"
