time,tweet
2009-11-21 20:48:47,Pete Cashmore (Mashable founder and CEO) exclusive to CNN.  Next Year's Twitter.  http://bit.ly/8uaKM4 http://bit.ly/5EJ5uD
2009-11-21 16:03:19,"Most Companies Don't ""Get"" Twitter, but they're learning just like the rest of us ... there is no established... http://bit.ly/08GwROC"
2009-11-21 15:47:33,"Issue advocacy and political persuasion are different than (yet similar to) typical ""business"" ... I'm studying... http://bit.ly/08deH3O"
2009-11-21 15:38:44,@patrickmgleason I just had to post it on FB (and tag you both).  Love it!
2009-11-20 19:27:42,@patrickmgleason did you get your mouse?  i use plastic new version of old school metal snapper...and sticky... and delicious poison
