time,tweet
2009-11-26 22:47:35,@agilenature OMG!! what are you doing there!!!.. tenes que hacernos un review para #emoNation XD
2009-11-26 18:37:08,"on #thanksGivingDay i want to thank Steve Jobs, for changing the mobile world (among a lot other things) http://ir.pe/ev9"
2009-11-26 17:53:59,"y hace 4 años yo pensaba que las campañas publicitarias de los politicos no podian tener peor produccion, me equivoque en grande!"
2009-11-26 09:56:28,Schrodinger cat walks into a bar..... and doesn't // ROFL!! #humorGeek
2009-11-26 09:54:07,esto es lo mas Nerd y Divertido que he visto! http://www.youtube.com/watch?v=e7DkeQ0roAM en proporciones equivalentes!
