time,tweet
2009-11-14 08:42:11,I gotta feeling... ♪
2009-11-14 08:41:54,"Queeeeeeeeee noite! Mais do que o esperado.. :) full batery, friends!"
2009-11-13 11:31:08,"Flamengo sem o Pet, Fluminense sem o Fred, sou eu assim sem você...  ♪"
2009-11-13 11:25:05,O Lula está até agora questionando que o raio pode ter sido a causa do apagão. Isso tá dando o que falar hein.
2009-11-13 11:24:46,"Uma vizinha da rua aqui do lado morreu. Chamaram a ambulância tarde, Putz! Tipo de notícia que se espalha beeem rápido."
