time,tweet
2009-11-18 10:35:00,TAB: Surveillance: New Online Get A Mac Ad http://bit.ly/LCSqE #apple #mac #iphone
2009-11-18 10:26:16,"General: Jennings: Real Money, Real Problems http://bit.ly/1UxsXf  #mmo #mmorpg #gaming"
2009-11-18 09:54:31,"Star Trek Online: Exclusive Screenshots, Part 4.5 http://bit.ly/2OuMyP  #mmo #mmorpg #gaming"
2009-11-18 08:57:23,"Wii | Calling Screens: 118 new shots posted.   Get the full article at GameSpot         ""W.. http://bit.ly/2zSNdo  (via Gamespot) #game"
2009-11-18 06:26:13,News:      Zynga snags $15 million new investment http://bit.ly/3UK1Ob  #gamesindustry
