time,tweet
2009-11-26 04:37:28,Die Mitarbeiter des Autobauers Toyota müssen in diesem Jahr auf einen Großteil ihrer Boni verzichten. Hintergru.. http://bit.ly/4XsVzD
2009-11-26 04:37:26,Werbung aus aufgezeichneten Fernsehsendungen entfernen oder selbst gedrehte Aufnahmen zu einem Film zusammensch.. http://bit.ly/8MYRaL
2009-11-26 04:37:24,Die Bonner Staatsanwaltschaft hat bundesweit von 200 Kripo-Beamten 46 Wohnungen durchsuchen lassen. Die Verdäch.. http://bit.ly/4ALAck
2009-11-26 04:37:22,Die Jugendschutzwarnung vor den «Simpsons» im Schweizer Fernsehen lässt die Emotionen der 20-Minuten-User hochg.. http://bit.ly/4UvxdJ
2009-11-26 04:37:20,"Und wieder gibt es Neuigkeiten aus dem Hause Samuel-Klum: Seal soll Heidis Tochter Leni adoptieren, die während.. http://bit.ly/8bswhT"
