time,tweet
2009-11-29 14:03:50,Kellan Lutz Is Freaking SEXY!!!!!
2009-11-29 13:21:57,So Much Funn! Lol! @friend_facts Is VeryAddicting!!!!!! Oh My Gosh!!! #facebook! Go check it you Will Get Addicted Too!!!
2009-11-29 12:52:29,Really!?!?!?!? I Work Again Today.... The Fourth Sunday In A Row. I Havent Gone To Youth Group In A Month. :( I Miss Everybody!!!!
2009-11-29 12:46:14,Yesterday Was A Blast! Hanging Out With The Gang Then Them Following Me To Work Then Bowling With Them! I Was Out Till Midnight! So Much Fun
2009-11-28 11:43:19,Alexis
