time,tweet
2009-11-21 04:41:12,Traditional Breast Cancer Treatments and Alternative - http://www.cancer-health.info/?p=873
2009-11-21 04:11:19,Who Made My Breast Biopsy Diagnosis? - http://www.cancer-health.info/?p=872
2009-11-21 03:59:08,Breast Cancer Can Be Prevented - http://www.cancer-health.info/?p=871
2009-11-21 03:38:09,Selecting Products For Breast Cancer - http://www.cancer-health.info/?p=870
2009-11-21 00:26:12,Breast Cancer Signs - What All Women Should Know - http://www.cancer-health.info/?p=869
