time,tweet
2009-11-18 17:18:51,yeah than its probably ur school work or something.
2009-11-18 17:18:46,"yeah, exactomundoooo -- but what do i put it in any random folder or like a binder or some special folder? idk. ;O -roxy. <3"
2009-11-18 17:17:51,ohh than it's probably all ur school work. -avina
2009-11-18 17:17:00,"its an interview for a schoool. where i have to put grades (report card from last year], & papers."
2009-11-18 17:16:39,i'm sorry about our conversation we have going on here. it's me and roxana. lol
