time,tweet
2009-11-13 09:08:43,"az önce bi sinek burnuma konup, ""cınıms çok heba ediyosun kendini bak dinlen bireaz a-a-a"" diyip gitti. çohfantastikbiryaşamımvarmesela."
2009-11-13 09:06:22,"işin aslı şöyle, annemi çagırıp ""enneeaa ateşim kaaç"" dicem, o da hizmetçin mi var diyip gitşek, dı end. EHE."
2009-11-13 09:05:35,ben gidiyorum gençler. katya yı çagırıp ateşimi ölçtürcem. burnumdaki beyaz sıvıyı da ondan bulucam. sonra da jakuzimde viskimi yudumlicam.
2009-11-13 09:00:50,"alttaki tivit yüzünden beni unfolov yapmayı planlayanlar, SELAM,NABER? hiç mi grip olmadın !"
2009-11-13 09:00:04,burnum akıyi şuan. aha şu su gibi renksiz olan var ya ondan hep. bak yola çıhtı. düşüüyi düşüyiiii çektimburnumu. ama bu renksiz ha. yoksa.
