time,tweet
2009-11-18 09:23:37,"Muito melancólica, com uma mazela enorme, droga de vida."
2009-11-16 06:55:38,"""A melhor forma de apostar no futuro é fazê-lo brotar no presente"" (JK)."
2009-11-08 13:22:19,"Uma vez uma pessoa de muita consideração disse-me:  "" - Elizangela, não dar para você ser séria o tempo todo.""  E é isso que estou tentando!"
2009-11-08 08:24:53,"Rs, conversar com você, sempre é agradável, e uma das poucas pessoas."
2009-11-08 08:19:24,"Muito, que bom que conseguimos nos falar."
