time,tweet
2009-11-26 22:24:23,@mauibr @dukasampson porque essa conversa a essa hora? Oo'
2009-11-26 21:40:47,mouse com clique duplo eu até aceito.. agora barra de espaço com digito duplo é a primeira que vejo! #raiva
2009-11-26 20:19:30,"na boa, como mamonas e Claudinho e Buchecha não vai existir jamais!"
2009-11-26 20:03:57,"@francelino_ mermão,  que saudade que deu desses caras! #claudinhoebuchecharules"
2009-11-26 11:24:18,"@mauibr eu tenho prova do detran de manhã, depois só 22:00 tem vigília na igreja! então, um dia livre! o/"
