time,tweet
2009-11-14 02:01:47,This worked for me! Get the girls knocking your door down  http://bit.ly/2nRfC2
2009-11-14 01:01:40,Get the sexiest girls! see how http://bit.ly/2nRfC2
2009-11-14 00:01:41,Online dating! How to get the sexiest girls on the net to date you  http://bit.ly/2nRfC2
2009-11-13 23:01:54,To all the single dudes! want to get that girl? We want it just as much you know.  http://bit.ly/2nRfC2
2009-11-13 22:01:33,"C'mon Boys, get the girls to come to you. Play it cool and check out these tips  http://bit.ly/2nRfC2"
