time,tweet
2009-11-17 06:10:22,When my current knightand all my ex boyfriends are in a dream without my wing girls! It's time to stop dreaming!
2009-11-17 06:05:28,@melissalwhite @MandeeReese what do u girls mean u never watched pee wee! With the word Of the day! It's the sexy laugh that sucks Mandee in
2009-11-17 06:03:40,Way to many crazy dreams with @MandeeReese cousins in it! I have got to shut my brain off before if gets me in trouble !
2009-11-17 06:01:09,"@Arianna_Kay road runner I should join with me, I am going to look at one of the other fitness centers for aclass rhough"
2009-11-16 18:55:02,I am going to Try to find a mommy and me class pecan aerobics classs@Arianna_Kay
