time,tweet
2009-11-13 07:41:28,Кими Райконен може да се завърне в Макларън: Финландецът няма да продължи договора си с Ферари http://bit.ly/4hjb0y
2009-11-13 07:41:27,"Близки на пациентка пребиха медицинския екип в плевенската болница: Болната жена, чиито приятели са разбили реа.. http://bit.ly/2qqAH"
2009-11-13 07:41:25,"В ""Зона спорт"" очаквайте: Разговор със специалния ни гост Георги Иванов : Коментар за контролната среща на наци.. http://bit.ly/3Fw2Mi"
2009-11-13 07:09:44,В спортните новини очаквайте: Подробности от приятелската среща на националния отбор с Шахтьор (Донецк): Репорт.. http://bit.ly/3ZQtJP
2009-11-13 07:09:42,"Участвай в ""Нека говорят"", питай Камен Воденичаров: Очаквайте и ексклузивно интервю с полицая от Долни Дъбник, .. http://bit.ly/4skfuf"
