time,tweet
2009-11-20 22:04:32,@2terrible2kiss How's that snack coming? (impatiently nosy) ---> See what you turned me into!!!Y___Y
2009-11-20 22:03:34,"@AzureKitsune Yeah!:D I've never read any Loveless fics, shame on me. I'm sort of stuck on HP at the mo>.>"
2009-11-20 22:01:00,"@AzureKitsune actually understood what it was. Have a few on my flist who've mentioned it many times but well, dumbspell gets one nowhere:0"
2009-11-20 22:00:04,"@AzureKitsune Awesome!! I'll definitely support ya!! (Can you believe how lame I am, I had to google NaNoWriMo-- heard about it but never"
2009-11-20 21:58:39,@AzureKitsune read!!
