time,tweet
2009-11-25 02:23:17,Thanks to Per - check out http://www.grist.org/article/2009-11-24-copenhagen-diagnosis-offers-a-grim-update-to-the-ipccs-climate-s/
2009-11-24 05:10:33,"Congratulations to Connie Hedegaard on the European Commissioner Post.  And big congrats, too, to Lykke Friis, new Danish climate minister!"
2009-11-23 08:35:19,@domjame It is depressing but we have to remember that even the black knight was conquered in the end...!!
2009-11-23 08:15:49,Great climate change cartoon from The Economist..  http://www.economist.com/daily/news/displaystory.cfm?story_id=14917816&fsrc=nwl
2009-11-22 10:20:06,The climate sceptics are like the black knight in Monty Python - they don't know when they're beat!  www.youtube.com/watch?v=2eMkth8FWno
