time,tweet
2009-11-25 20:50:01,"Report: Iverson set to retire   (AP) : AP - Allen Iverson is set to retire from the NBA, according to an online.. http://ad.vu/y26x"
2009-11-25 18:49:29,AP IMPACT: A stream of WH health care visits   (AP) : AP - President Barack Obama's top aides met frequently wi.. http://ad.vu/wnre
2009-11-25 16:52:07,"Obama to plead US case at global warming summit   (AP) : AP - Putting his prestige on the line, President Barac.. http://ad.vu/nktw"
2009-11-25 14:51:33,Stores look to basics to draw in holiday shoppers   (AP) : AP - As stores prepare for hordes of Black Friday sh.. http://ad.vu/nkpr
2009-11-25 12:49:41,"Shuttle Atlantis leaves space station, headed home   (AP) : AP - Shuttle Atlantis undocked from the Internation.. http://ad.vu/psc6"
