time,tweet
2009-11-14 17:55:46,"É  NAUM ADIANTO SECAR O SÃO PAULO, O JEITO É O MENGÃO FAZER SUA PARTE AMANHA E ESPERAR O TRICOLOR TROPEÇAR!!!"
2009-11-14 10:40:45,É HJ É DIA DE SECAR O SÃO PAULO PARA AMANHA O MENGÃO PEGAR A LIDERANÇA DO BRASILEIRO!!
2009-11-13 21:02:48,Pq o fim de semana parece ter só 24 horas??
2009-11-13 18:13:29,"SEXTA FEIRA DIA DE FUTEBOL... VO JOGAR UM FUT COM OS PARCEIROS!""!!"
2009-11-13 18:00:44,É MINHA GENTE JA É DIFICIL CHAGAR A SEXTA FEIRA E QJUANDO CHEGA TEM SER 13?? VCS... O ZAGALO QUE DEVE GOSTAR DESSSA DATA
