time,tweet
2009-11-27 03:01:28,is hoogste tijd voor latte en casse croute
2009-11-27 03:00:56,*beteuterd kijkt* @janvds55 kom je dan niet voor @erwblo en ook niet voor mij?
2009-11-27 02:44:19,"@pvantees heb ik niet bewust gezien geloof ik, was blijkbaar teveel bezig met leuke shirts uitzoeken"
2009-11-27 02:37:06,"Last FM doet het even niet, jammer want kan wel wat muziek gebruiken om geronk en gepiep buiten te overstemmen"
2009-11-27 02:34:06,"@TheRoel verbaast me, heb er behoorlijk wat en sommigen al jaren en die houden zich goed, maar wisselt wel per shirt"
