time,tweet
2009-11-20 18:43:43,Is moving to Canada really that good? NOFX think so in their popular song FRANCO UN-AMERICAN: http://bit.ly/7YvHLK
2009-11-20 18:41:25,"REM - LOSING MY RELIGION, an ode to atheism or just a tricky use of words? Find out here: http://bit.ly/5K6JWL"
2009-11-20 18:39:18,"if you like guitars you'll LOVE this: Joe Satriani, Steve Vai and Yngwie Malmsteen AKA G3 Full concert: http://bit.ly/8uDgk6"
2009-11-20 17:13:08,ok one more : P Here is a song by DEEP PURPLE which many of you probably never heard but it rocks (TIME TO KILL): http://bit.ly/5JiDoa
2009-11-20 17:11:26,we'll add some more videos/bands tomorrow morning. I really really need sleep LOL
