time,tweet
2009-11-27 07:54:18,Down with Xmas music! All 90's all the time at All By Hand today.... okay maybe some Xmas Mariah Carey & Nysnc will sneak in.....
2009-11-27 07:51:08,#blackfriday FREE pins with every purchase at All By Hand today!!! Stop in and support your local artists!!!
2009-11-27 07:50:13,Hey pals It's Black Friday! Know what that means? Free pins with every purchase from All By Hand! Stop in & stock up on your Xmas gifts!
2009-11-26 10:43:04,Happy Thanksgiving friends! Be sure to stop in All By Hand tomorrow for a free button with each purchase! Support your local artists!
2009-11-26 10:36:22,We're in the Inquirer!!! Woo Hoo! http://www.philly.com/inquirer/magazine/20091126_Mirror__Mirror___Pop-up__goes_the_seasonal_shop.html
