time,tweet
2009-11-29 03:23:41,"I just generated my #TweetCloud out of a year of my tweets. Top three words: kaip, reikia, iphone - http://w33.us/cfb"
2009-11-27 08:41:16,Updeito paleidimas blogai idėja kai lėtas inernetas ir nori jau bėgti :)
2009-11-27 06:09:07,"Objektinis programavimas jėga, kol nepažiūri į resusrsų naudojimą. paprastas paemimas is db (Zend Freimork + Doctrine) jau sveria 9.75MB RAM"
2009-11-27 02:40:53,"Vatikanas patvirtino kad gali būti gyventojų iš kitų planetų, o dabar ale mokslininkai kalba su ateiviais tarp mūsų. http://bit.ly/62srR0"
2009-11-26 10:08:30,@Andrius kad jau 3 tai visai buvo lievas :)
