time,tweet
2010-05-19 13:13:15,4136. Get More Twitter Followers. FREE Now! http://tinyurl.com/2axb8xy
2010-05-19 23:01:44,Cuban migrants illegal in their own country - http://bit.ly/dvl8fu
2010-05-19 23:02:35,Pakistan blocks Facebook over 'Draw Mohammed' Day - http://bit.ly/d7xzQu
2010-05-19 23:06:06,Giant solar-powered yacht to circle globe - http://bit.ly/cWBoPn
2010-05-19 23:17:39,"North Korea paying $10,000 for each of the two young elephants from Zimbabwe in what had been dubbed a ""Noah's Ark"" wildlife gift,"
