time,tweet
2010-01-14 15:47:22,"Alprazolam! Spell from #Harry Potter? No, generic name 4 #Xanax. Learn more facts & #addiction treatment solutions here http://bit.ly/6xqNFf"
2010-01-14 15:49:35,"Alprazolam! Spell from #HarryPotter? No, generic name 4 #Xanax. Learn more facts & #addiction treatment solutions here http://bit.ly/6xqNFf"
2010-01-22 14:50:07,Patients who take more than 4 mg/day of #Xanax  for periods of 12 months  or > r at a greater risk 4 becoming #addicted.http://bit.ly/8uvh7C
2010-02-09 14:01:17,Just added myself to the http://bit.ly/Bi1Ah twitter directory under:  #nashville_tn #xanax #addiction #recovery #treatment #detox
2010-02-09 14:02:45,Just added myself to the http://wefollow.com twitter directory under:  #nashvill #xanax #addiction #recovery #treatment #detox
