time,tweet
2009-12-31 19:06:38,rt How Has Tiger Helped Everyday Golf?  #postrank #golf http://tinyurl.com/ye2hxwg
2009-12-31 19:06:46,rt Return trip to China reminds Gay how far he's come on road to s...  #postrank #golf http://tinyurl.com/ye2hxwg
2009-12-31 19:06:52,rt Woods can pick his spot for return -- or not (AP)  #postrank #golf http://tinyurl.com/ye2hxwg
2009-12-31 19:06:59,rt Santa at Whister  #postrank #golf http://tinyurl.com/ye2hxwg
2009-12-31 19:07:06,rt Garcia to visit specialist over hand injury (AP)  #postrank #golf http://tinyurl.com/ye2hxwg
