time,tweet
2010-01-10 15:11:04,History Of The Paso Doble Dance:             By Melanie LaPatinWho says the French can't be Spanish? Witnes.. http://bit.ly/6xFvMS
2010-01-11 05:11:07,Castle Weddings A Growing Fad:             By Stephen HenryIf you are looking to get married in a unique se.. http://bit.ly/52KLoC
2010-01-11 07:11:06,The Benefits of Friendship:             By Ann ShorbWe were created for relationship both with God and with.. http://bit.ly/5rZWMr
2010-01-12 07:11:31,Get Back Girlfriend:             By George F. MerryweatherGet Back Girlfriend - Relationships go through a .. http://bit.ly/5VQBDC
2010-01-12 09:11:21,"Is it Worth it To Fix My Relationship?:             By Lynn HuberWho would want to finish up shattered, des.. http://bit.ly/8YUSdz"
