time,tweet
2009-12-29 10:26:58,A goal without a plan is just a wish....
2009-12-30 12:09:23,Let me tell you the secret that has led me to my goal: my strength lies solely in my tenacity....
2010-01-05 10:47:37,The first step to getting the things you want out of life is this: Decide what you want...
2010-01-06 10:45:02,Most people live and die with their music still unplayed. They never dare to try...
2010-01-07 15:06:20,Have Fun And Get Friends And Followers Fast  http://bit.ly/6BiLk3  Send Out News Tweets
