time,tweet
2010-01-22 15:48:02,"é dewagar, é dewagar, é dewagar, é dewagar, dewagarinho...é dewagar, é dewagar, é dewagar, é dewagar, dewagarinho..."
2010-01-25 12:18:17,"Tô chegando na área, galera, chegando dewagar, dewagar, dewagarinho. É que eu sou lento assim mesmo, aprendi com W. Vocês conhecem W?"
2010-01-25 12:21:10,"Talento eu não tenho muito, mas que eu tô lento, tô."
2010-01-25 12:49:29,"Ao cabeça da chapa do senador César não basta ser honesto, é preciso parecer honesto."
2010-01-25 12:50:52,"Socorro, socorro, lá vem a tartaruga me morder... Existe algum soro anti-tartaruguíco?"
