time,tweet
2010-01-15 13:22:57,Bush Family Planning Appoin... ;) hhs http://bit.ly/6v1BkR
2010-01-20 16:27:46,Charlie Sheen  Denise Richards Reunite For Their Kids http://newstiger.info/charlie-sheen-denise-richards-reunite-for-their-kids-2 !
2010-01-21 18:27:12,http://newstiger.info/conan-o%e2%80%99brien-says-he-won%e2%80%99t-do-tonight-show-at-1205 tuesday night Conan O’Brien Says He Won’... ;)
2010-01-24 01:21:23,Venezuela to host Russia navy exercise in Cari... http://todayspulse.net/venezuela-to-host-russia-navy-exercise-in-caribbean ! russian navy
2010-01-24 04:31:37,shorty ! Nominate @Cudlitz for a Shorty Award! | Southland... http://newstiger.info/nominate-cudlitz-for-a-shorty-award-southlandtvfans-com
