time,tweet
2010-01-09 11:54:45,"Yeah, I'm on twitter!"
2010-01-09 12:36:04,"@KimberlyEddy if you are interested in article writing and article marketing, you may like this http://bit.ly/6Q0Yaw"
2010-01-09 12:36:06,"@alexwalters if you are interested in article marketing, you may like this http://bit.ly/6Q0Yaw"
2010-01-09 12:43:39,"must go out and not really thrilled about it... with wind chill, feels like 19 degrees. Ugh."
2010-01-09 13:10:57,"RT @MariSmith: “All the knowledge I possess everyone else can acquire, but my heart is exclusively my own.” ~Goethe"
