time,tweet
2010-01-07 18:36:57,"Question... Is saddle soap good for leather furniture. - NO WAY!  pH is way wrong.  Use it on Saddles only, not furniture or car leather."
2010-01-08 10:25:25,Reminder...  regularly conditioner your leather with SG - 25.  Get it at http://www.advleather.com
2010-01-08 16:21:20,Got a question about leather furniture care?  Check out http://advleather.blogspot.com for a bunch of hits and tips.
2010-01-09 11:06:38,Hey friends... If you have leather furniture chk in with me for all the details about care and maintenance - http://advleather.com
2010-01-10 14:39:07,"Tip of the day...  Never store leather in plastic, it has to breath.  Learn more at http://advleather.com."
