time,tweet
2010-03-05 06:16:14,Your life is about to change for you today. Because you were lucky enough to land on this page. Click here http://bit.ly/4Yna4K
2010-03-05 07:15:55,Learn the bottom line Truth toward gaining weight and building lean muscle mass right away! Click here: http://bit.ly/4Yna4K
2010-03-05 08:14:54,"You Now have access to the most powerful, muscle growth and weight gain system ever developed for skinny hardgainers! http://bit.ly/4Yna4K"
2010-03-05 10:13:01,If you want a nutritional advantage and exactly what does work in bodybuilding supplements: go to the site here. http://bit.ly/4Yna4K
2010-03-05 11:00:52,The Latest News About Muscle Building  From Musclewithtweet http://tinyurl.com/y9ytklc
