time,tweet
2010-01-10 20:31:08,Playing Call of Duty 5 and smokin everybody
2010-01-11 22:47:28,Feeds for Google Alerts: Welcome to this Google Alerts feed! Here you will receive new alerts for your Comprehe.. http://bit.ly/tnrng
2010-01-11 23:17:32,Only 15 Percent Of Gamers Buy DLC: ... but I will definitely and have definitely shelled out digital money for .. http://bit.ly/6T2tOv
2010-01-11 23:17:34,"Letter: Grounds crude: Therefore it is completely logical, and even laudable, for the author of “Wake up call” .. http://bit.ly/87StZU"
2010-01-11 23:17:36,"Asus Radeon HD 5970: It was only limited by our PC&#39;s processor in our Call of Duty 4 test, getting identica.. http://bit.ly/7YOMyY"
