time,tweet
2010-03-14 10:27:13,"Chuck Norris http://bit.ly/90o6Br :P Fosston, Minn., students kick some serious butt celebrating Chuck Norris 70th birthday"
2010-03-14 13:00:12,"k cups: Also @JimmyPSHayes, tell Shawn to get some Butter Toffee K-cups for her Kuerig. Very good... ! http://bit.ly/aEwxLw"
2010-03-14 19:52:20,k cups: And The Winners Are… http://singleservecoffeemakerreview.com/k-cups-and-the-winners-are%e2%80%a6/  ;)
2010-03-15 04:00:37,single se... http://singleservecoffeemakerreview.com/single-serve-coffee-nescafe-kp210050-dolce-gusto-single-serve-coffee-machine-black/ .
2010-03-15 22:05:49,Wyclef Jean Haiti relief gro...   everlasting memory http://newsgossipgator.com/wyclef-jean-haiti-relief-group-yele-may-get-3m-donation-fro
