time,tweet
2010-01-07 15:19:39,Feeds for Google Alerts: Welcome to this Google Alerts feed! Here you will receive new alerts for your Comprehe.. http://bit.ly/tnrng
2010-01-07 15:49:18,New York Times cafeteria food may be past its deadline: New York Daily News BY Stephanie Gaskell The Health Dep.. http://bit.ly/8iGLgm
2010-01-07 16:48:49,"You Tube turns amateur chefs into food celebs The Globe and Mail: Home cooks kick Martha, Emeril and Jamie to t.. http://bit.ly/4Fouli"
2010-01-07 17:18:47,5 Cocktail Trends for a New Decade The Atlantic Food Channel: 1 Cocktail and Food Pairing Cocktails and food ca.. http://bit.ly/5qwxP8
2010-01-07 18:18:43,Restaurant food has more calories than advertised: Houston Chronicle Calorie counters beware: Some chain restau.. http://bit.ly/6stxPV
