time,tweet
2010-02-01 12:15:14,Happy Valentines Love! Say it with Chocolate! - Milk Chocolate: http://bit.ly/cMiT1K
2010-02-01 12:19:16,Leonidas Belgian Chocolates: Mini Valentine's Day Heart (6 pcs.): http://bit.ly/cjkgJ2
2010-02-01 12:19:20,California Delicious Valentine Tin: http://bit.ly/dsUjDa
2010-02-01 12:19:42,Small Valentines Day Heart Container of Chocolate Rainbow Non Pareils: http://bit.ly/cIB6qD
2010-02-01 12:19:51,Sweet Wishes For You! Gourmet Food Gift Basket: http://bit.ly/cAar5z
