time,tweet
2010-01-17 03:34:58,"Join and grab your pre-launch link, start building your team today. http://tinyurl.com/yjznlj9"
2010-01-17 05:34:32,A system that is going to produce massive residual income. http://tinyurl.com/yjznlj9
2010-01-17 06:35:51,Check out the daily system status!  http://tinyurl.com/yha2w79
2010-01-17 09:34:51,7000   Members In 15 Days And Growing.. SOTAM Is Exploding!  http://tinyurl.com/yjznlj9
2010-01-17 11:34:56,A Mailer 300 Years Ahead Of Its Time! Pre-Launch Team Build Now. http://tinyurl.com/yjznlj9
