time,tweet
2010-01-21 18:42:02,Campanha 2010 / Tome uma Atitude! Participem !!! http://www.planetavoluntarios.com.br/nossas-acoes
2010-01-21 19:01:59,"Aids já deixou mais de 11 milhões de órfãos na África; o devastador avanço desta doença fará com que, em 2010, pelo menos 40 milhões orfãos"
2010-01-21 19:29:52,"adicione o seu blog ou site em nosso portal, após vc aderir a nossa Campanha !!! http://www.planetavoluntarios.com.br/selo"
2010-01-21 20:51:11,Apenas um por cento dos milhões de africanos que precisam de tratamento contra Aids tem acesso ao coquetel de remédios que prolonga a vida.
2010-01-21 21:43:42,Cerca de 44 milhões de brasileiros vivem em condições sanitárias abaixo do mínimo esperado.
