time,tweet
2010-05-26 09:06:49,Starting off with a driver and smash it 300yds how great is that ? http://bit.ly/300yds
2010-05-26 10:09:10,Experience the thrill of a truly balanced set of precision clubs http://bit.ly/theset
2010-05-26 11:06:04,"Struggling with fresh content for your blog, then you NEED to check this out http://bit.ly/bdnlbA"
2010-05-26 12:07:19,A NEW Taylormade R9   9 irons and $500 dicount green fees for a few minutes of your time ? it's a no brainer go http://bit.ly/Golfdeal
2010-05-26 13:07:40,"A breakthrough formula for outstanding performance ,only one ball though http://bit.ly/dimples"
