time,tweet
2010-01-15 22:17:34,Want to Go to the Top on twitter here is how  http://bit.ly/6ns0sc
2010-01-17 13:54:15,Have Fun With Twitter - Twitter Marketing Software  http://bit.ly/6ns0sc
2010-01-21 21:58:57,Work your way to celebrity status on twitter while having loads of fun  http://bit.ly/6ns0sc Get Your Tweets Out On The Net
2010-01-21 21:58:57,Work your way to celebrity status on twitter while having loads of fun  http://bit.ly/6ns0sc Get Your Tweets Out On The Net
2010-01-26 07:22:00,Here is a GIFT for you - SAVE 25 PERCENT OFF using this coupon for  http://bit.ly/6ns0sc Enter coupon TWEETNOW
