time,tweet
2010-01-12 11:34:00,We are looking for 20 celebrities to follow us on colorbread.
2010-01-12 11:56:20,Most probably the healthiest bread ever made. find out more at www.colorbread.co.uk
2010-01-20 07:54:45,Our hearts go out to the people of Haiti if someone looks at our idea! we promise to help in causes like this www.colorbread.co.uk
2010-01-23 08:03:24,Company data on COLORBREAD LIMITED at http://ukdata.com/n/06856180
2010-02-04 04:06:38,"Hi we are New to Twitter We want to reach a target of 10000 Followers,So will u guys help me reach that Target,Just Follow Me"
