time,tweet
2010-01-13 12:12:16,Free Videos On Making Money Using Your Twitter Account.It Could'nt Be Easier!
2010-01-13 13:10:44,Set It And Forget It!Completely Automate Your Twitter Account To Make You Money Everyday. Check It Out!
2010-01-13 14:11:14,How Would You to like Make Money With Your Twitter Account Every Single Day On Auto-Pilot!
2010-01-13 21:39:08,Get more friends and followers send out news tweets all automatically all FUN http://bit.ly/75FifU
2010-01-14 01:12:42,Look How I Used My Twitter Account To Earn Extra Cash Everyday On Auto-Pilot!
