time,tweet
2010-01-08 09:14:32,Im sick of this snow....I never thought id miss the rain!
2010-01-08 17:46:11,Watching Sex And The City now curled up on the sofa with a hot chocolate on a friday night...how sad am I?
2010-01-09 05:24:28,Time to go shopping :-D Im thinking sensible shoes instead of trendy ones today!
2010-01-09 17:37:49,I think im addicted to Rolo yoghurts lol.
2010-01-10 04:30:58,Iv got such a headache this morning...one too many glasses of wine was drunk last night I think :-(
