time,tweet
2010-01-06 11:47:52,Crafty Little Gifts... » Creation | Cut Out + Keep: crafty gifts!!: flissy e.&#39;s craft creation for inspirat.. http://bit.ly/7tl5UA
2010-01-06 12:01:02,"It is so cold up here, I'M FREEZING.  Okay, that's enough."
2010-01-06 12:17:32,Gift Certificate - $10 [GIFT-0002] - $10.00 : Western Maine Market ...: Western Maine Market Gift Certificate -.. http://bit.ly/5Iti4w
2010-01-06 12:17:34,Gifts & Goodies on The Child Health Site: From $10.00. Gift Certificate - Festive Holly Tree. From $10.00 ... http://bit.ly/8SZhIY
2010-01-06 12:46:56,"ALE agents say Mecklenburg ABC Board broke state law: But now, ALE agents have found the wining and dining was .. http://bit.ly/6NQju6"
