time,tweet
2010-01-13 10:47:05,"Commentary: Herschel Walker jumps into MMA the way he does everything — full tilt: Palm Beach Post Walker, in f.. http://bit.ly/66ogkk"
2010-01-13 11:39:16,"Live mixed martial arts action returns to Clarksville with “SSF 14 ...: CLARKSVILLE, Tenn. - This Saturday, Jan.. http://bit.ly/4ETeDr"
2010-01-13 12:07:47,"Herschel Walker Set to Battle on January 30th in Mixed Martial Arts Debut: Mixed martial arts is the ""spor.. http://bit.ly/5g6wru"
2010-01-13 13:38:16,Akayama Ryu martial arts at OB Rec Center Jan. 16-17: All styles and ranks are welcome to this martial arts cam.. http://bit.ly/8aPfAa
2010-01-13 15:06:54,Carroll&#39;s Martial Arts announces rank promotions: by New Lenox Patriot Staff Carroll&#39;s offers Shorei Go.. http://bit.ly/7xuNF6
