time,tweet
2010-01-09 16:03:49,"I really feel that the true meaning of Consciousness is that annoying time between naps. Speaking of which, time to exit consciousness..."
2010-01-09 19:31:08,Is getting ready to google Chuck Norris and then hit  I’m feeling lucky. Gonna come at ya like a spider monkey chuck.
2010-01-09 23:05:50,is thinking that Saturday Night Live should have been canceled in 1999.
2010-01-10 09:16:06,Dam It! Really funny Scotty. Now beam down my dam clothes.
2010-01-10 14:30:43,"gives a shout out to all of the Naomi's of the world...after all imoan backwards is Naomi, thats right..."
