time,tweet
2010-01-31 12:19:15,Refresh Netvibes without reloading the whole session - Netvibes - Lifehacker http://ff.im/-fa5Yc
2010-02-25 14:25:23,I just added Twitter to my Lifestream. Check out my page: http://lifestream.aim.com/stream/aldnew1
2010-02-25 14:33:23,"Get more productive and organized with Search Pad, the newest feature of Yahoo! Search. Try it now at http://searchpad.yahoo.com/"
2010-02-26 18:02:05,Just added a new blog post on OpenSocial http://ning.it/bsh7oh
2010-02-26 18:03:08,"Checking out ""MyBlogLog - aldnew1 : Topic"" on OpenSocial: http://ning.it/bsh7oh"
