time,tweet
2010-01-13 08:33:28,Latvian Schools Song and Dance Festival included in UNESCO Calendar of Events for 2010/2011 http://bit.ly/64wzfM
2010-01-13 08:54:16,Follow us and find useful information about tourism in Latvia!
2010-01-14 01:28:36,Amazing video about Latvia made by us. Beautiful things and places in Latvia that you should see!!! English version http://bit.ly/65hgMb
2010-01-14 08:27:36,See on map free parking places in the center of  Riga - friendly advice for the guests of our capital. WELCOME! http://bit.ly/7MB4Yv
2010-01-15 01:13:52,"Video about Latvia, GERMAN version: bit.ly/8rXiyD Beautiful things and places in Latvia that you should see!!!"
