time,tweet
2010-01-29 23:05:05,Have a new rock music forum called Rockers Around The World Unite at www.ratwu.org for people who love rock music as much as I do.
2010-01-30 19:12:07,Acid Rain invites you to join my free rock music discussion forum www.ratwu.org .The latest news & comments on everything that rocks!
2010-01-30 19:55:29,Have a new rock music forum called Rockers Around The World Unite at www.ratwu.org for people who love rock music as much as I do.
2010-01-30 22:54:22,Love rock music? Registar free at Acid Rains's new rock music forum Rockers Around The World Unite at www.ratwu.org .
2010-01-31 22:55:26,Registar free at Acid Rains's new rock music forum Rockers Around The World Unite at www.ratwu.org . Check out the rock mystery question.
