time,tweet
2010-01-10 12:17:31,Hello everybody! I love Ebay. I alway by and sell products on Ebay. And I aslo take part in Ebay Business.
2010-01-10 12:18:54,I d like to share my own experiences when I by and sell on Ebay. And want to hear from you about that toptic.
2010-01-10 12:19:40,It is happy to me when you follow me. And you are my friend Ebay :) Thank you!
2010-01-10 13:09:11,@Rockin_99 Thank you for following me. Please keep in touch mr Rockin!
2010-01-12 14:27:30,Get more friends and followers send out news tweets all automatically all FUN http://bit.ly/6ns0sc
