time,tweet
2010-04-08 19:00:23,:P How to find IP of all the devices connected with my pc? how to find ip http://bit.ly/9SnHwB
2010-04-08 19:00:29,How come when I change IP only the last 6 digits are changed? ip ;O http://bit.ly/cShE8e
2010-04-08 19:00:30,ip address http://bit.ly/cvRRw9 :O Put Internet on PSP  The Easy Way
2010-04-08 19:00:31,"http://bit.ly/dCyYWT Ask Rick: tape transfers, sharing files, US TV, email signatures and editing icons . hdd dvd recorder"
2010-04-08 19:00:31,generalelection Ex-Houston Mayor Bill White wins Democratic nomination for governor http://bit.ly/bTK7jg :)
