time,tweet
2010-03-15 12:43:58,: Apple Needs People to Test The iPad!  You Get to Keep an iPad just by writing a short review! spon http://tinyur... http://bit.ly/btaevv
2010-03-15 14:01:53,"Toyota Sudden Acceleration: Is It All Older Drivers&#039; Fault?: So-called ""sudden acceleration"" is an http://url4.eu/1nyN6"
2010-03-15 14:51:16,"Best New-Car Deals: Ford, Hyundai Among Most Marked-Down: Ford and Hyundai have both been making tremendous http://url4.eu/1o0cd"
2010-03-15 15:03:20,"Want a free new laptop? I'm sharing a dead simple deal, go here, give your email and get a laptop http://tinyurl.com/yad3xss"
2010-03-15 15:40:55,Toyota Calls &#039;Hoax&#039; On Runaway Prius In San Diego: Toyota&#039;s sudden acceleration problems seemed to http://url4.eu/1o2jp
