time,tweet
2010-07-05 06:56:11,"Denise Dead as Doorknob - Don’t Miss, Eastenders News, Featured, http://bit.ly/doDCXB"
2010-07-05 07:00:42,"Alfie Moon Brings Light to Walford - Celeb Chat!, Eastenders News, Sneak Preview, http://bit.ly/aExxjU"
2010-07-05 07:20:59,"H thinks :Daz: It Get’s Your Whites Whiter - Eastenders News, Omg Blog, http://bit.ly/bYMhI3"
2010-07-05 07:21:18,"Money for My Curry? - Eastenders News, http://bit.ly/9bs6g4"
2010-07-05 07:21:36,"Lacey Turner Enters the Unknown - Celeb Chat!, Eastenders News, http://bit.ly/9MXz3X"
