time,tweet
2010-01-28 18:22:32,"Tapp's take on P. Manning: ""We had to go off of wrist bands because he picks up on stuff so fast. He's a very smar... http://bit.ly/cNI91D"
2010-01-28 18:22:33,"Coming soon to a silver screen near you — Tim Tebow: The film, which does not yet have a name, will chronicle Tebo... http://bit.ly/bIOWyU"
2010-01-28 18:22:34,Underwood to Sing Super Bowl National Anthem: Mark those calendars: We've got the skinny on the most important stu... http://bit.ly/bTfgE0
2010-01-28 18:35:32,CBS Says Gay Dating Super Bowl Ad 'Under Review'; Pro-Life ...: Here's the thing with CBS (CBS)'s decision to allo... http://bit.ly/cIoTaZ
2010-01-28 18:35:33,"EcoMeme: Superbowl Ad Controversy | EcoSalon: Should women be encouraged to have kids at all costs, when overpopul... http://bit.ly/8ZGDiL"
