time,tweet
2010-01-08 07:47:10,"Vi interessa Guadagnare Soldi in automatico con il Forex? nel mio Blog, Consigli, Trucchi e Segreti. www.renditamensile.com"
2010-01-14 01:58:14,"Vi interessa Guadagnare Soldi in automatico con il Forex?  nel mio Blog, Consigli, Trucchi e Segreti.  www.renditamensile.com"
2010-01-15 03:02:53,Vuoi Guadagnare in automatico con il Forex. 600€ in una notte con FAPTURBO 49 ottimizzato www.renditamensile.com
2010-01-15 03:03:51,1280€ in una notte con EA-Boss www.renditamensile.com
2010-01-15 03:05:03,tutte le istruzioni per iniziare a guadagnare con i Forex Robot www.renditamensile.com
