time,tweet
2010-01-04 10:28:52,The craigslist killer has arrived! http://www.FreeListingsonline.com
2010-01-04 16:05:42,"List your event, or items for sale at http://www.freelistingsonline.com  great for finding stuff too.  all for free!"
2010-01-07 11:25:15,List your items for free to be seen by millions right now at http://www.FreeListingsOnline.com  plz retweet
2010-01-11 19:51:54,Latest postings on freelistingsonline.com http://www.freelistingsonline.com/?view=showad&adid=61038&cityid=1&lang=en
2010-01-12 09:52:44,"Just posted on http://www.freelistingsonline.com  jobs, jobs, http://www.freelistingsonline.com/?view=showad&adid=46955&cityid=1&lang=en"
