time,tweet
2010-01-28 08:09:44,If you want to make money with your Twitter Account you have got to see these FREE videos! http://bit.ly/7uf7yN
2010-01-28 09:09:28,If you want to add thousands of followers to your Twitter Account on auto pilot check out the FREE Videos! http://bit.ly/7uf7yN
2010-01-28 10:07:02,The Latest News About Usbc  Bowl.com  From Bigbaadbowler http://tinyurl.com/yk75qx6
2010-01-28 10:09:27,Best teaching guide in the market learn to Bowl like the Pro's and impress your date. http://bit.ly/7NbvJG
2010-01-28 10:09:28,If you have been struggling to make money online check out the helpful FREE Videos to make Hundreds of dollars a day! http://bit.ly/7uf7yN
