time,tweet
2010-03-26 10:11:24,"Call for beta-testers to experience Yoomit, the new meetings and minutes web app.  20 slots for early adopters. beta@yoomit.com #business"
2010-03-29 06:33:35,Beta-Testing Program: what an overwhelming response! I guess will have to go way beyond those 20 slots :-) #productivity - www.yoomit.com
2010-03-29 06:44:00,Yoomit is on Facebook too! Check it out: http://www.facebook.com/pages/Yoomit/109120525780867
2010-03-29 10:20:21,"What a great small idea! - No more USB cables (and others!) behind your desk, for < $1: http://bit.ly/bKT3ZL"
2010-03-30 06:18:55,"Last call for beta-testers to experience Yoomit, the new meetings and minutes web app. 20+ slots for early adopters. beta@yoomit.com #saas"
