time,tweet
2010-02-07 16:00:54,Social icon sets just come to Twitter. Follow us for hot free social icons. ;) http://www.socialiconsets.com/ #socialicons #icons #freeicons
2010-02-07 17:25:58,Social Bookmark Icon Set http://irt.me/kBO
2010-02-08 13:07:48,If you need #socialicons justvisit us: http://www.socialiconsets.com #freeicons #icons #socialmedia
2010-02-12 08:04:50,In a short time we will register for affiliate networks. Do you know any #affilates about #icons #design #socialmedia or #socialnetworks?
2010-02-13 19:44:56,Social Media Icons in Heart http://irt.me/DNY
