time,tweet
2010-01-15 04:42:35,http://bit.ly/63iPny :) Charlie Sheen’s wife claims he threatened her      (AP) Entertainment
2010-01-17 14:00:21,Yele The Readout: Is Wyclefs Yele Haiti Foundation Legit? http://bit.ly/65pFfN :P
2010-01-22 11:03:08,How does Adam Smiths economic ideas in the Wealth of Nations can be seen as a critique of mercantilism... Adam http://bit.ly/7kOakf ;P
2010-01-26 07:25:49,;P Keurig coffee maker http://bit.ly/8BaVTb Keurig B70 One Cup C...
2010-01-27 02:49:01,Perfec Cup of Coffee every time!  Keurig coffee maker http://singleservecoffeemakerreview.com/perfec-cup-of-coffee-every-time/
