time,tweet
2010-03-02 00:04:40,The foundation of a healthy body is a healthy blood stream.  Simple techniques to promote the bodys health. http://bit.ly/Oxycise
2010-03-02 04:05:53,5 Steps To Maintaining A Positive Mental Attitude Good read for today! http://bit.ly/PosMentalAtt
2010-03-02 05:04:08,Crazy good article! Steps To Visualize And Dream Your Way To Serious Online Profits http://bit.ly/UVisualize
2010-03-02 06:04:22,"You have nothing to lose but the weight you hate, by learning to breath healthy! http://bit.ly/Oxycise"
2010-03-02 07:04:24,"More information on Healthy Living, by Expert Author, Ron Lewis. http://bit.ly/GoArticles"
