time,tweet
2010-01-28 08:13:41,there is a lot of advertising  here
2010-01-28 08:19:08,"I just rolled out of bed, did my daily devotional studies, and of course twittered, have a wonderful and blessed day"
2010-01-28 09:21:41,"i'm sad because I wish i knew more about computers and where i am goin with this, i want to learn more, but i still love doing this"
2010-01-28 12:53:53,Feeds for Google Alerts: Welcome to this Google Alerts feed! Here you will receive new alerts for your Comprehensi... http://bit.ly/78gVej
2010-01-28 17:04:02,good evening-work is over-hope all is well with everyone- go bless all of you
