time,tweet
2010-01-25 09:35:57,PRESS DIGEST - New York Times business news - Jan 25 - Reuters http://bit.ly/5NU6E3
2010-01-25 09:36:04,BUSINESS NEWS Fidentia cases postponed - iAfrica.com http://bit.ly/6uObU3
2010-01-25 10:06:39,Just designed and posted my background using http://PrettyTweet.com
2010-01-25 10:11:57,Father died saving sons in raging surf - The Australian http://bit.ly/5sw08j
2010-01-25 10:26:57,New Recession-Proof Internet Marketing Package Allows Businesses to Ramp Up ... - PR Newswire (press release) http://bit.ly/8SflQg
