time,tweet
2010-04-13 20:15:48,Scientific Memory Games: Improve your cognitive abilities. http://bit.ly/4prIl0
2010-04-13 21:11:30,"Get  two free tickets to Christopher Howard's Breakthrough to Success in Australia, New Zealand , and England  here. http://bit.ly/4zr56w"
2010-04-13 22:11:56,check out our blog at http://financialadvisercoach.blogspot.com/
2010-04-13 23:07:11,Agribusiness MIS specialist FEA enters administration: Forestry Enterprises Australia Limited has entered voluntar... http://bit.ly/bR6UFd
2010-04-14 00:16:00,Be apart of Tony Robbins History with the First ever Date with Destiny in Bali Indonesia Apr 12th - 17th 2010. http://bit.ly/7PAkMj
