time,tweet
2010-01-30 20:39:02,New Blog Post http://www.mypetspecialtiesblog.com/pet-products/540-reflective-dog…linking-lights/
2010-01-31 20:54:53,New Blog post about the importance of dog ID tags http://www.mypetspecialtiesblog.com/pet-products/550-pet-id-tags-make-a-difference/
2010-01-31 23:08:24,@magiesplace I think all the links are working alright now.  Thanks for the heads up
2010-02-01 09:30:39,Is your dog bored?  New Blog Post http://www.mypetspecialtiesblog.com/pet-products/556-the-bored-dog/
2010-02-01 19:51:34,Blog Post-Is your dog's collar putting him in danger? http://www.mypetspecialtiesblog.com/pet-products/507-is-your-dogs-c…-him-in-danger/
