time,tweet
2010-02-27 04:07:02,Good find 'Legal Credit Card Debt Elimination - You Can Get Rid of 50% Your Credit Card Debt' http://tinyurl.com/yagkuez
2010-02-27 08:07:06,Its Not Valentines Day But A Good Day For Avon Lip Balm! http://tinyurl.com/yjnny73
2010-02-27 15:50:51,"Helped me out 'Wealth, Opportunities and Travel With a Village Lifestyle!' http://tinyurl.com/yg6u9sj"
2010-02-27 18:55:20,Lots of good info here '7 Reasons to Start a Home Based Business in a Recession' http://tinyurl.com/yjwlb8h
2010-02-27 21:15:13,"I hate taking cab at this timing! Can't even get a single cab so much for saying too many taxis, where are they? Not even a single one here"
