time,tweet
2010-02-27 12:17:48,DP High School Baseball is now on Twitter. http://bit.ly/bbPiWR
2010-02-27 12:19:54,"If you are a Dr Phillips High School baseball fan and follower, become a fan of our facebook page!  Follow the... http://bit.ly/a9bXXw"
2010-02-27 12:35:43,DP has started the season 2-2 going into today's game against First Academy at home 1pm first pitch.  Weather is a... http://bit.ly/cJfBEc
2010-03-08 13:18:52,Orlando Dr. Phillips Athletics: Baseball Update: http://www.dpathletics.net/sport.asp?sid=18 via
2010-03-08 13:37:30,Baseball Staff learning the ways of social media.  DPHS Baseball moving towards communicating with our fans and... http://bit.ly/bFg4Ek
