time,tweet
2010-02-11 09:11:24,Pro Bowl charade a necessity for NFL (Yahoo! Sports) http://eag.ly/l/OQu1N #NFL
2010-02-11 09:11:40,"Browns, Dolphins make unusual trade (AP) http://eag.ly/l/as43F #NFL"
2010-02-11 09:11:56,"Cleveland Browns, Miami Dolphins exchange front-office personnel (The Canadian Press) http://eag.ly/l/09j6T #NFL"
2010-02-11 09:12:12,"Saints, Cards offer hope to forlorn franchises (Yahoo! Sports) http://eag.ly/l/lXoid #NFL"
2010-02-11 09:12:28,Special teams could prove pivotal in Super Bowl (AP) http://eag.ly/l/l1aX0 #NFL
