time,tweet
2010-02-09 10:31:19,We're Open
2010-04-27 04:52:34,...meld je ook aan op de Linkedin Group http://tinyurl.com/385pdoz
2010-04-27 04:53:11,Vanaf vandaag komen hier dagelijks vele NIEUWE vacatures online uit de online media industrie...
2010-04-27 06:17:08,"Senior Consultant Interactieve Marketing: NH,  FunctiebeschrijvingVoor onze opdrachtgever zijn wij per direct op z... http://bit.ly/aRh0PZ"
2010-04-27 06:17:09,"Accountmanager Marketing/Communicatie: NB-Breda,  BedrijfsomschrijvingGrafisch ProductiebureauFunctieomschrijvingJ... http://bit.ly/aFe0vp"
