time,tweet
2010-02-14 18:01:41,Hi  Easy steps to making money:  http://cbpirate.com/s/cbp/mygan
2010-02-14 18:02:50,"Just got back from Africa,finding it hard to setle back in to the ""modern World'"
2010-02-14 19:10:39,Cneck out my blog:    http://mygan.cbpirateblog.com
2010-02-14 19:37:34,Hi this is how I manage ot travel often and take a year off  check out my blog  http://mygan.cbpirateblog.com
2010-02-15 00:26:39,"Something new in affiliate marketing;  <a href=""http://c812a37t0xbwds5gy0ucqk5n67.hop.clickbank.net/"" target=""_top"">Click Here!</a>"
