time,tweet
2010-02-28 22:00:13,There is a learning feature available where you can do a dummy FOREX trade without risking any capital. http://bit.ly/9d5Gke
2010-02-28 22:19:31,This is one of the few FOREX autopilot programs that work with intra day trading. http://bit.ly/9d5Gke
2010-02-28 23:18:04,A more user-friendly software than most other automated forex systems. http://bit.ly/9d5Gke
2010-03-01 00:14:47,Forex market is the largest financial market in the world. http://bit.ly/9d5Gke
2010-03-01 01:17:02,Forex trading is a unique form of investing which can bring you great wealth but not without risk. http://bit.ly/9d5Gke
