time,tweet
2010-02-25 04:03:50,"Hi!guys,this is kanna.I want to know some things about twitter.so could you guys plzzzzzzzzzzzz help me out?"
2010-05-12 01:19:46,Hey guys what do you think will make summer perfect?
2010-05-12 01:35:38,"Hey guys i want you to know that,former woman CHAZ BONO changed his story by transforming into a man."
2010-05-12 01:39:45,@emilmilmil hey i cant understand what you are saying.why dont you text it in english?
2010-05-12 02:01:17,@_ItsMiyPieBiisH hey thank you for following me
