time,tweet
2010-02-13 15:00:16,Todays Fitness tip is related to Fat Burning.Please check it out.http://bit.ly/bwBpc0
2010-02-13 15:10:21,The Latest News About Fat Loss And Fat Burning Tips  From Fitnessportal http://tinyurl.com/yhn83gl
2010-02-13 16:10:47,The Latest News About Fat Loss And Fat Burning Tips   From Fitnessportal http://tinyurl.com/yhn83gl
2010-02-14 01:00:07,"Learn Simple,Quick,NEW way of Fat loss and fitness tips.http://bit.ly/bwBpc0"
2010-02-14 03:00:14,How to trim our stomachs much faster than boring 'abs' exercise.http://bit.ly/bwBpc0
