time,tweet
2010-04-25 07:16:21,Check out the http://Money4LifeCoach.blogspot.com/
2010-04-25 08:16:44,"Tony Robbins LIVE in Orlando, March 11-14, 2010. SAVE UP TO $500 PER TICKET! http://bit.ly/5ymCwj"
2010-04-25 09:16:13,Wall Street Survivor http://bit.ly/cppmUZ
2010-04-25 10:17:13,The most highly recommended weekend conference I CAN DO IT! http://bit.ly/8Y48T8
2010-04-25 12:19:11,Anthony Robbins Date With Destiny. First Time Ever held in Bali Indonesia Apr 12th-7th 2010. http://bit.ly/7PAkMj
