time,tweet
2010-02-19 06:16:18,Acai Berry Powder | Acai Berry: The Most Nutritional Fruit (http://bit.ly/cVpqB9)
2010-02-19 06:23:57,Acai Berry Research | Discover The Benefits Of Acai Berry Supplements As Part Of Your  (http://bit.ly/cIkBKM)
2010-02-19 06:23:58,Acai Berry Research | Discover The Benefits Of Acai Berry Supplements As Part Of Your  (http://bit.ly/caa8Ui)
2010-02-19 07:33:14,Acai Berry Research | Acai Berry - Research And Benefits Of Acai Berry (http://bit.ly/d2Uiwa)
2010-02-19 08:33:24,Acai Berry Research | What Are The Health Benefits Of Acai Berries? (http://bit.ly/95AT1c)
