time,tweet
2010-02-04 01:33:23,Just updated my twitter background for FREE from http://twitrounds.com - Check it out!
2010-02-04 12:33:38,Feeds for Google Alerts: Welcome to this Google Alerts feed! Here you will receive new alerts for your Blogs query... http://bit.ly/aveqHW
2010-02-04 13:02:09,Do you have it in you ? ? ?:  http://bit.ly/aIfzdN
2010-02-04 13:26:23,Do you have it in you ? ? ?: http://bit.ly/cnAQ1i
2010-02-04 13:53:03,Avatar movie has created ripples all over the world ...just how passionate a fan are you??? comment on avatarites.blogspot.com
