time,tweet
2010-02-04 15:55:15,"ONLINE PHARMACY SHOP. Drugstore. Cheap Brand and Generic medications (Tamiflu, Viagra, Levitra, Zithromax ets) http://buygeneric.host-sc.com"
2010-02-06 17:48:22,What is a generic medication? http://j.mp/1OFiDT ( #drugs #pharmacy ) Wikipedia gives the following definition:“Generic drug (pl. generic...
2010-02-06 17:51:06,Does a generic medication differ from a brand name drug? http://j.mp/8i14cc
2010-02-10 16:24:02,"Wish to get free sample pills? It's easy! Placing an order for 60 or more pills of generic ED medication (Viagra, Cialis  http://j.mp/7VCRFv"
2010-02-12 11:52:20,"Generic Cialis (Tadalafil 10/20mg, 10mg × 10 / $28.95) http://j.mp/c3D5WC is used to treat erection problems in men. Also, it is current.."
