time,tweet
2010-02-13 00:30:24,Dear John :O http://bit.ly/aK8Ycz Fearless Forecast  Big Money For Valentines Day
2010-02-15 03:30:43,Get Coaching Clients With Twitter :P http://bit.ly/aXM591 target
2010-03-02 15:27:42,http://bit.ly/dD35Cx ;O common man Jokes About Business People » Business Calculator
2010-03-05 07:00:43,;O Silver  gold rise on bullish global cues silver bullion http://bit.ly/aDrB7R
2010-03-08 21:00:29,TNA  http://bit.ly/dz0tnR Early WWE RAW Vs. TNA IMPACT! Preview For Tonight  WrestlingInc.com
