time,tweet
2009-12-06 23:58:37,RT @FrontRowNews: http://twitpic.com/si8ch - Sarah Buxton (#6)- 2009 CMT Music Awards - Photo: David G. Mills-FrontRowNews.com
2009-12-07 14:26:34,"You Rock blog posting, How to Play the Electric Guitar : How to Play Electric Guitar Power Chords - http://bit.ly/92H6pq"
2009-12-07 14:59:32,"You Rock blog posting, Complete Color Coded Flash Cards for All Beginning Music Students - http://bit.ly/7IUygi"
2009-12-07 18:26:17,"You Rock blog posting, Music Lessons - You're Never Too Old to Learn to Play a Musical Instrument - http://bit.ly/4KqQfP"
2009-12-07 19:31:06,You Rock Radio ? ?: Beatles (http://bit.ly/6aNQHV)
