time,tweet
2010-03-20 15:01:47,"Wealthy Affiliate is Ranked the 1 Internet Marketing Training Program by over 499,000 Independent Websites and Counting http://znb.me/lwa16"
2010-03-20 17:01:47,"Internet Marketing May Sound Complicated But You Will Be Surprised At How Simple the Process is, Only 3 Simple Step http://znb.me/lwa18"
2010-03-20 19:02:13,"Wealthy Affiliate Has Helped Over 35,000 People Succeed Online and This Number Is Growing Every Single day http://znb.me/lwa20"
2010-03-20 21:02:11,"Brain Surgeon Is $80,000 Tuition Cost, Yearly Earning Potential $200,000, Time 8  Years But Internet Marketing $39/month http://znb.me/lwa22"
2010-03-20 22:01:51,"Business Degree Is $20,000 Tuition Cost, Yearly Earning Potential $40,000, Time 5 Years But Internet Marketing $39/month http://znb.me/lwa23"
