time,tweet
2010-02-13 21:21:16,"Flaming enthusiasm, backed up by horse sense and persistence, is the quality that most frequently makes for success.  Dale Carnegie"
2010-02-13 22:00:23,"Though we travel the world over to find the beautiful, we must carry it with us or we find it not.  Ralph Waldo Emerson"
2010-02-15 22:46:50,"Flaming enthusiasm, backed up by horse sense and persistence, is the quality that most frequently makes for success.  Dale Carnegie"
2010-02-15 22:52:05,Did you know that you can travel for free and earn cash at the same time?
2010-02-21 20:17:33,"Cherish your visions and your dreams as they are the children of your soul, the blueprints of your ultimate achievements.  Napoleon Hill"
