time,tweet
2010-03-10 15:40:07,"FOLLOWS, FOLLOWS! IF YOU NEED FOLLOWERS FAST THEN YOU HAVE GOT TO SEE THIS SITE! IT'S COMPLETELY AUTOMATED http://bit.ly/195LH8"
2010-03-10 16:00:00,Michigan Internet Marketing Company Ingenex Digital Launches New Web Site (Marketwire via Yahoo! Finance) http://tinyurl.com/y8wlz5e
2010-03-10 16:39:09,Making Money Online Couldn't Be Any Easier. You Don't Even Need A Website! All You Need Is Your Twitter Account http://bit.ly/195LH8
2010-03-10 16:45:00,EyeView Launches Innovative Video Marketing Quiz (PRWeb via Yahoo! News) http://tinyurl.com/yl4hhep
2010-03-10 17:30:00,Twitter Gets Its Own URL Shortener To Stop Scams; Good Marketers Need Not Fear (Search Engine Land) http://tinyurl.com/yaxb75y
