time,tweet
2010-02-19 11:27:46,New CVF post: Hello Twitter World http://bit.ly/9hBYEL
2010-02-19 17:02:18,"MJC auction adjourned again, this time until March 25. Will it happen before the Preakness?"
2010-02-19 19:14:02,Conspiracy theory re MJC auction delay - Stronach wants to bid for it himself
2010-02-20 18:41:13,New CVF post: Strings and Arrows 4th at Aqueduct http://bit.ly/9fTREm
2010-02-20 20:45:05,"Nice race today for Strings and Arrows. 6 furlongs was too short, but he closed well for 4th. Can't wait for a 1-mile race."
