time,tweet
2010-02-13 14:08:13,Free Financial Calculators: We are pleased to offer the following Free financial calculators. If you are an inv.. http://bit.ly/9ZgAei
2010-02-14 08:07:54,Handling the stress of online MLM business: Are you looking online for a possible MLM business avenue of creating ... http://bit.ly/b69Waj
2010-02-20 05:55:01,Just added myself to the http://wefollow.com twitter directory under:  #s #internetmarketing #ebooks #healthcare #networking #mlm
2010-02-20 06:04:20,Free Video email that can improve your response rate by 38%: No Software to install....easy to use and set up!  It... http://bit.ly/cuEHH9
2010-02-20 10:11:08,"This Month's Featured Website Law Office of George R. Brezina, Jr. PA Personal Injury Lawyer:    This Month's Feat... http://bit.ly/bCUvly"
