time,tweet
2010-02-08 06:11:08,WeForest is in the process of reforesting 20 MILLION sq Kilometres of the world! Come and find out more about us here http://bit.ly/dbtvAc
2010-02-08 06:16:21,Check out this great video about WeForest narrated by the brilliant @StephenFry! http://bit.ly/9aqdj1
2010-02-08 06:17:54,I went to see #Avatar for the second time this week! It has so much synergy with the WeForest ethos. http://bit.ly/cwyvFz
2010-02-08 06:22:04,Did you know that you can offset your carbon footprint with Neo.org check it out here it's great! http://bit.ly/bAYOtv
2010-02-08 06:27:14,"@kaisernova It's def best @ the Imax, u really feel like you're in the movie. If you like the Avatar msg check this out http://bit.ly/cwyvFz"
