time,tweet
2010-05-05 15:28:49,For sale: We buy jewelry - Gold -Silver- Platinum http://bit.ly/9QBBJj posted on @Oodle
2010-05-05 15:50:54,For sale: Sell your Old Jewelry for Cash Today http://bit.ly/d6NTdD posted on @Oodle
2010-05-05 16:25:08,For sale: Need Extra CASH - We Buy - Gold -Silver- Platinum - Jewelry http://bit.ly/aQjg9o posted on @Oodle
2010-05-05 16:39:02,For sale: Need Extra CASH - We Buy - Gold -Silver- Platinum - Jewelry http://bit.ly/bV8uUi posted on @Oodle
2010-05-05 16:48:33,For rent: Need extra cash to get a new place?  800-399-9702 http://bit.ly/aLxnn9 posted on @Oodle
