time,tweet
2010-03-05 00:00:12,Haven't Found The Secret To Online Income Yet . . . Watch These FREE Videos . . . http://bit.ly/aFu4vk
2010-03-05 02:15:26,Wondering If You'll Ever Make Money Online . . . Watch These FREE Videos . . . http://bit.ly/aFu4vk
2010-03-05 05:15:47,"Why Do Some People Make So Much Money Online, Yet You Struggle . . . Watch These FREE Videos . . . http://bit.ly/aFu4vk"
2010-03-05 08:18:57,Online Income Is Easy When You Know The Secret . . . Watch These FREE Videos . . . http://bit.ly/aFu4vk
2010-03-05 11:13:54,Been Looking For Autopilot Income . . . Watch These FREE Videos . . . http://bit.ly/aFu4vk
