time,tweet
2010-02-12 05:33:33,"Our ‘Pop Party in the Park’ will take place on Saturday 21st August 2010 at Clumber Park, Worksop. http://bit.ly/dh1a3b"
2010-02-12 06:46:37,Peter Andre has signed to perform at Pop Party in the Park Saturday 21st August 2010 http://www.ukeventsandproduction.com/poppartypark.html
2010-02-12 10:51:36,New Myspace Pages http://bit.ly/c7qJk4
2010-02-19 06:50:47,Tickets will be on sale from Monday 8th March at http://www.clumberconcerts.com or ticketline 01909 485783
2010-03-04 10:51:33,The Saturdays are confirmed at this years POP PARTY IN THE PARK: tickets on sale 8th March ticketline 01909 485 783 http://bit.ly/9OarjQ
