time,tweet
2010-02-13 18:00:17,The Latest News About Gold And Silver  From Numatikk http://tinyurl.com/y9tmhay
2010-02-13 18:00:50,Destined for Millions and just under 5000 distributors in 5mos. this company is ridiculously attractive. http://bit.ly/dBfslw
2010-02-13 19:00:17,The Latest News About Gold And Silver  From Numatikk http://tinyurl.com/y89rl8f
2010-02-13 19:00:52,This Binary company breaks all the rules and pays on the strong leg. http://bit.ly/dBfslw
2010-02-13 20:01:00,This is the only MLM business where everybody wants what you have TODAY! http://bit.ly/dBfslw
