time,tweet
2010-03-02 22:09:43,New link posted:  http://www.merchantserviceprocessing.com/?p=
2010-03-02 23:54:54,New post: What You Should Know About Zero Balance Transfers (http://www.merchantserviceprocessing.com/?p=212)
2010-03-03 01:10:36,New post: Managing Family Dynamics in a Family-Owned Business (http://www.merchantserviceprocessing.com/?p=213)
2010-03-03 01:40:00,New post: I DIDN'T BELIEVE UNTIL I SAW THIS! CHECK THIS OUT BEFORE YOU ORDER AND SEE FOR YO (http://bit.ly/aBoKSp)
2010-03-03 03:21:06,New post: Find Out the Best Credit Cards For Your Youngsters (http://www.merchantserviceprocessing.com/?p=215)
