time,tweet
2010-03-17 05:48:00,"> #habbo_rt NÃO TEM NINGUEM NO MSN , JA ROUBEI TODO MUNDO NA COLHEITA FELIZ , E O #HABBO TA EM MANUTENÇÃO , AAA [..] http://bit.ly/a1X5LB"
2010-03-17 10:05:59,> #habbo_rt Habbo.no top 100 scanned! http://www.onlyhabbo.nl/badgetool (via OHBadgetool) http://bit.ly/dCF8Qc
2010-03-17 11:18:05,"> #habbo_rt Galera dj sam está on na radio ds, entrem no habbo e vamos começar a festa!! (via Habbo_DS) http://bit.ly/9zkuA5"
2010-03-17 15:53:58,> #habbo_rt Boredom has taken a new level - Habbo Hotel. (via dickyFTW) http://bit.ly/bOKfk4
2010-03-17 16:35:57,"> #habbo_rt miha prima disse que tem um tal de uma jogo chamado habbo, ela disse que esse tal de habbo dela é @-I [..] http://bit.ly/coAeDR"
