time,tweet
2010-02-12 08:03:14,Forex Online Trading Commodity: Forex online trading commodity gives the best value to forex traders. If you ar.. http://bit.ly/cAG7FR
2010-02-13 02:21:52,Get the best Forex Trading Ideas to earn 1000$ in 1 week http://ping.fm/8yATz
2010-02-15 02:03:46,Forex Online Option Trading: Forex Online Option Trading is a new opportunity since ‘07 for single invest.. http://bit.ly/akCIwv
2010-02-26 02:53:20,"Forex Futures Trading: The world of money, there are two different types of forex trading. The first is the mos.. http://bit.ly/cUcr4c"
2010-02-27 02:53:52,"Account Forex Online Trading: Start a lucrative business in a foreign currency market, you must first open an a.. http://bit.ly/9p45oL"
