time,tweet
2010-03-02 11:00:09,Turn Your Twitter Account Into ATM Machine! Say Good Bye to Money Struggle and Make Hundreds of Dollars per Day on Twitter.
2010-03-02 11:17:06,How Many Followers Do You Want? Watch These Free and Simple Videos to Get Thousands of Followers!
2010-03-02 12:14:22,"Money, Money, Money! We all Want it! Now You Can REALLY Get It! Watch These Videos and Find Out How?"
2010-03-02 13:20:00,Amazingly Easy to Make Money With Your Twitter Account! All on Auto Pilot!! Free Video Explanation!!
2010-03-02 14:14:33,Making Money Online Has Never Been Easier! Your Twitter Account Made it Possible. Check it Out!
