time,tweet
2010-02-08 12:00:11,The Latest News About Elderly Companionship  From Daughter4rent http://tinyurl.com/ykd47df
2010-02-08 12:00:16,The Latest News About Senior Living  From Daughter4rent http://tinyurl.com/yanynvg
2010-02-08 15:00:13,The Latest News About In-home Care  From Daughter4rent http://tinyurl.com/yb2uwl8
2010-02-08 15:00:16,The Latest News About In Home Caregiver  From Daughter4rent http://tinyurl.com/yztxhua
2010-02-08 16:00:30,The Latest News About Senior Living  From Daughter4rent http://tinyurl.com/yf7ztnc
