time,tweet
2010-02-19 03:03:55,Warriors beat Clippers to end 9-game slide (AP) http://eag.ly/l/KWuSL #NBA
2010-02-19 03:04:11,AP Source: NBA proposal targets all player types (AP) http://eag.ly/l/0miX6 #NBA
2010-02-19 03:04:27,"Suicide Lines: Pitino or others in Jersey, trade talk, Brown out? (Yahoo! Sports) http://eag.ly/l/HXQi9 #NBA"
2010-02-19 03:04:44,"BDL Twitter Top 30: We got all your teams, 140 at a time (Yahoo! Sports) http://eag.ly/l/HnVXY #NBA"
2010-02-19 03:05:00,Durant poised to join game's elite stars (Yahoo! Sports) http://eag.ly/l/LlgEY #NBA
