time,tweet
2010-06-08 11:03:12,"has just come across a Tesco signing sandwich, I must get myself one of those tomorrow!"
2010-06-08 11:45:44,"Wow, good stuff 'Top Debt Settlement Companies - What to Look For When Selecting a Debt Settlement Company' http://tinyurl.com/3xejkcw"
2010-06-08 13:08:28,why must women be so mean to each other? Are we really that insecure?
2010-06-08 13:26:40,I do one blog and they are talking bout me on radio stations everywhere that probably never played my songs
2010-06-08 15:42:56,Super volume Mascara ~ Kick  It To the Curb http://tinyurl.com/2cc7su9
