time,tweet
2010-03-05 01:16:02,Wondering If You'll Ever Make Money Online . . . Watch These FREE Videos . . . http://bit.ly/bVDVtd
2010-03-05 04:16:11,"Why Do Some People Make So Much Money Online, Yet You Struggle . . . Watch These FREE Videos . . . http://bit.ly/bVDVtd"
2010-03-05 07:19:50,Online Income Is Easy When You Know The Secret . . . Watch These FREE Videos . . . http://bit.ly/bVDVtd
2010-03-05 10:15:53,Been Looking For Autopilot Income . . . Watch These FREE Videos . . . http://bit.ly/bVDVtd
2010-03-05 13:17:00,Make Money From Home . . . Simple and Easy . . . Watch These FREE Videos . . . http://bit.ly/bVDVtd
