time,tweet
2010-03-17 00:01:18,Do You Own A Property Free and Clear and Need To Sell? We Buy Houses Cash! just click at http://www.sixtyminutesale.com
2010-03-17 00:01:53,We're a group of experienced homebuyers looking for houses right now. at http://www.sixtyminutesale.com
2010-03-17 00:02:21,"If You Need To Stop Foreclosure, We Buy Houses Fast...contact us at http://www.avoidforeclosure.me"
2010-03-17 00:02:40,Get a fair all cash offer on your home and close quickly at http://www.avoidforeclosure.me
2010-03-17 00:03:01,Choose one of our quick solution options to the right. at http://www.freezeforeclosure.me
