time,tweet
2010-03-28 08:19:59,Create Easter eggs that will stay beautiful for a long time: The Flint Journal - MLive.com By Bay City Time... http://bit.ly/cqz1HS #easter
2010-03-28 09:22:20,More BA strikes possible after Easter: LONDON (SHARECAST) - British Airways passengers face the possibility... http://bit.ly/96er1o #easter
2010-03-28 09:22:21,Paragon Carousel gets gussied up for Easter weekend opening: Wicked Local Hull (blog) The annual Easter Egg... http://bit.ly/bmD2Q1 #easter
2010-03-28 09:22:22,Hot Cross Buns for Easter: Southeast Missourian (blog) Someone will recall their mother or grandmother havi... http://bit.ly/c2jCYy #easter
2010-03-28 09:22:24,Easter and the black church: OregonLive.com By Guest Columnist As we approach Easter. I would like to share... http://bit.ly/aWalH8 #easter
