time,tweet
2010-03-29 00:40:17,just foe your succus
2010-03-29 00:47:58,follow me and u will give you $ 1  http://tweetspeedy.com?r=ksuarafah@gmail.com
2010-03-29 01:25:40,ini cara cari 100 follower dalam 1 menit.... http://tweetspeedy.com?r=ksuarafah@gmail.com
2010-03-29 01:28:03,mau dapetin follower ratusanperhari...youmusti pakeni software bung  http://tweetspeedy.com?r=ksuarafah@gmail.com
2010-03-29 22:52:46,Jutawan Internet terlahir dari sini . Jangan ketinggalan ...http://cafebisnis.com/?reg=fath
