time,tweet
2010-05-02 06:50:35,New blog post: Is the Flip Video Ultra also a digital camera? http://bit.ly/blTRGQ
2010-05-02 18:02:11,"New blog post: Currently, what is the best pocket HD Camcorder? http://bit.ly/a5SQI5"
2010-05-02 18:02:17,New blog post: Pure Digital Flip Ultra Camcorder Hang Leather case http://bit.ly/cGDoHF
2010-05-02 18:02:19,New blog post: The Fog From Where I Am Located - .WMV Version http://bit.ly/b7mWRJ
2010-05-03 03:45:56,New blog post: Videos Creation Secret. http://flipcamcorder.geek-news.co.uk/2010/05/videos-creation-secret/
