time,tweet
2010-03-27 16:54:50,New post: Make Money Online – Follow the Leaders | jobspro http://bit.ly/aGGJ8e
2010-03-28 00:06:53,New post: DomainGraduate - Make Money Online Buying Domains. http://bit.ly/cTHWgz
2010-03-28 00:06:59,New post: Fast and Easy Way to MAKE MONEY ONLINE for FREE Earn $15000 http://bit.ly/bDFWBh
2010-03-28 00:07:07,New post: Earn Money Online for Free With Best Paid to Click Sites | Strive ... http://bit.ly/cHV0ex
2010-03-28 00:07:14,New post: How can i make money online without spending money anyone have any ideas? http://bit.ly/adl7Gn
