time,tweet
2010-06-11 10:22:13,"Yoga Supplies for Sale, Mu... 1005# you have reached your maximum limit of possible api requests with this IP address. Please wait 24 hours."
2010-06-11 10:27:10,Sound Healing For You  http://vtc.es/EVJ
2010-06-11 10:27:13,Hang Drums  http://snipr.com/xb7wa
2010-06-11 12:11:13,"Participants say yoga, Pilates are excellent stress relievers http://LNK.by/eDZd"
2010-06-11 13:07:08,Enduring the Emotional Turmoil After a Divorce http://spiritual-healing-central.com/blog/Enduring-the-Emotional-Turmoil-After-a-Divorce
