time,tweet
2010-03-05 01:00:06,Wondering If You'll Ever Make Money Online . . . Watch These FREE Videos . . . http://bit.ly/92vg5O
2010-03-05 03:14:10,"Why Do Some People Make So Much Money Online, Yet You Struggle . . . Watch These FREE Videos . . . http://bit.ly/92vg5O"
2010-03-05 06:19:31,Online Income Is Easy When You Know The Secret . . . Watch These FREE Videos . . . http://bit.ly/92vg5O
2010-03-05 09:15:23,Been Looking For Autopilot Income . . . Watch These FREE Videos . . . http://bit.ly/92vg5O
2010-03-05 12:22:26,Make Money From Home . . . Simple and Easy . . . Watch These FREE Videos . . . http://bit.ly/92vg5O
