time,tweet
2010-03-28 23:33:33,CB Cash Clouds - New Powerful Method To Monetize Your Blog.: CB Cash Clouds - New Powerful Method To Monetize Your... http://bit.ly/bmpyGD
2010-03-29 00:03:33,"looking for diabetic supplies, medical supplies, personal care items and health and beauty aids.Pharmacy a large-volume http://bit.ly/8z8Vjw"
2010-03-29 00:03:52,Knitting For Profit.: Knitting For Profit.An Exciting New Book That Shows Step-by-step How To Make Money From Knit... http://bit.ly/8YtRQ5
2010-03-29 00:03:53,The Secrets To Successful Candle Making.: The Secrets To Successful Candle Making.Discover The Secrets To Successf... http://bit.ly/anEaqT
2010-03-29 00:03:53,How To Make A Diaper Cake Video Instructions.: How To Make A Diaper Cake Video Instructions.Diaper Cakes Are The H... http://bit.ly/ckDK4p
