time,tweet
2010-06-29 23:40:23,"The Yellow Flag has been Raised , God Bless The New President Noynoy Aquino III :)"
2010-06-29 23:48:41,"Oh Justin Bieber , Please Visit Here in the Philippines :)"
2010-06-30 00:19:49,"I just voted ""Jasmine Villegas "" on ""Who should be Justin Biebers girl friend ?"" Vote now: http://bit.ly/bPwzLP"
2010-07-01 07:04:03,Still up for my Homeworks ! Ow Gosh!
2010-07-01 07:05:41,"""Never Say Never "" Oh I LOVE that song by Justin Bieber ft. Jaden Smith I Love Them Both :)"
