time,tweet
2010-05-02 22:24:16,#nowplaying Vampire Weekend!!!!
2010-05-02 22:24:18,"If I had to live my life over again, I would have a different father, a different wife and a different religion."
2010-05-03 20:20:47,I want to make a policy statement. I am unabashedly in favor of women. (On appointing 10 women to top government positions)
2010-05-05 07:45:20,Ya @MCHammer is making me insane
2010-05-05 07:45:22,We are here and it is now. Further than that all human knowledge is moonshine.
