time,tweet
2010-03-10 20:27:53,"Me Talk Pretty One Day (Paperback) tagged ""humor"" 126 times http://bit.ly/9DJqDh"
2010-03-10 23:14:48,"Me Talk Pretty One Day (Paperback) tagged ""humor"" 126 times http://bit.ly/d9hch9"
2010-03-11 14:45:59,"Kissing Frogs in Cyberspace (Paperback) tagged ""humor"" 126 times http://links.assetize.com/links/a6257b"
2010-03-11 20:18:21,"Living the Dream (Paperback) tagged ""humor"" 96 times http://bit.ly/drJVoI"
2010-03-12 15:04:04,"Living the Dream (Paperback) tagged ""humor"" 97 times http://bit.ly/9OqCvd"
