time,tweet
2010-03-31 17:42:11,"Starwood opens 1,000th hotel, plans major expansion in China: Starwood Hotels & Resorts says it has opened its 1000... http://cli.gs/7njU4"
2010-03-31 20:38:36,American Airlines bulks up service in New York City: American Airlines is turning up the heat in an escalating batt... http://cli.gs/juMuJ
2010-03-31 21:47:34,American Airlines bulks up service in New York City: American Airlines is turning up the heat in an escalating batt... http://cli.gs/trAX5
2010-04-01 01:00:13,Thousands of jets put on risky paths in Detroit: Thousands of jets landing and taking off in Detroit were assigned ... http://cli.gs/yp7WG
2010-04-01 02:04:35,American Airlines bulks up service in New York City: American Airlines is turning up the heat in an escalating batt... http://cli.gs/ZL7SV
