time,tweet
2010-03-16 07:55:22,"If you could plant a seed for an apple tree, would you expect it to sprout apples the first day? Of course not right?The seed has to sprout."
2010-03-16 09:23:35,One today is worth two tomorrows.
2010-03-16 15:17:40,You have to have a dream so you can get up in the morning.
2010-03-16 19:51:59,Enjoy yourself drink call the life you live today your own but only that.
2010-03-16 20:22:47,Twitter Twenius is the real deal from marketing master @dhollings. What more can I say? Become a Twitter genius http://budurl.com/twenius
