time,tweet
2010-04-08 18:22:10,"Win some goodies! All you have to do is follow us & RT @asfx_org Play Safe, Stay Sexy www.asfx.org #SafeSex"
2010-04-08 18:28:37,Kissing can cause hearing loss? Find out about some other silly sex injuries http://bit.ly/90xk0E
2010-04-08 21:48:05,RT @WetTogether @screamingo @asfx_org that was great! Loved it!!
2010-04-08 21:48:54,@Ginger_Leigh Yay! Looking forward to reading.
2010-04-08 21:49:41,"Win these goodies! http://twitpic.com/1e4cmm Just follow us & RT @asfx_org Play Safe, Stay Sexy www.asfx.org #SafeSex"
