time,tweet
2010-04-13 20:33:16,@mm53bar or patrick stefan
2010-04-13 20:37:04,"Update: Tony Hawk Ride PS3, Xbox 360, Wii grinds to $49.99 - Punch Jump (blog) http://bit.ly/9dYFGO"
2010-04-13 20:40:42,Update: Wii Fit Starter bundle 6-in-1 http://www.worldofwii.info/wii-accessories/wii-fit-starter-bundle-6-in-1/
2010-04-13 21:59:58,Update: Hot Wheels Beat That http://www.worldofwii.info/wii-games/hot-wheels-beat-that/
2010-04-13 21:59:59,Update: Discover the Hottest Wii and Wii Accessories http://bit.ly/agVdPF
