time,tweet
2010-03-30 21:52:14,http://bit.ly/cNdfUZ Michigan Coupon Service Places Products on Page 1 of Google michigan seo services
2010-03-31 01:00:16,"warehouse management system Singer22.com Complaints Decrease with Installation of Data Subsytems, Inc. ERP Software http://bit.ly/8WWtQS ;)"
2010-03-31 01:06:48,"seo webmaster tool ;O Video Recap of Weekly Search Buzz :: March 12, 2010 http://bit.ly/9dbhEr"
2010-03-31 01:24:25,engine marketing optimization search Social Media and Interactive Marketing Growth Spur Name Change from NetSuccess  http://bit.ly/91C7si ;)
2010-03-31 01:59:29,http://bit.ly/aedZXF Website optimization :O search engine optimization submission
