time,tweet
2010-04-01 08:25:31,Important for your hair care! http://femalefashionblog.com/hair-care-gift-sets
2010-04-01 08:30:45,@littleartist04 Strawberries are the best fruit in the world!!
2010-04-01 08:46:42,Following ppl interested in fashion ... twitter really is fun :-)
2010-04-01 09:16:35,"Hungaro refused from Lindsay Lohan: As might be expected, after a series of accusations that destroy the brand, de... http://bit.ly/993gz3"
2010-04-01 09:16:37,Body Corseting: Body corseting is a fairly new craze which is popular with fashion forward females who want to sta... http://bit.ly/bVzADp
