time,tweet
2010-03-24 12:43:27,Making my Twitter profile look good with Themeleon by @COLOURlovers http://colourlovers.com/themeleon Love it?
2010-03-24 13:09:47,My husband started with a Mulit Level Marketing Company called Monavie. HOW DO I GET HIM OUT? http://cli.gs/svHqX
2010-03-24 13:11:24,Pregnant and wondering if anyone tried MonaVie? http://cli.gs/9mzrD
2010-03-24 13:12:30,I heard MonaVie is great for Arthritis? http://cli.gs/QE4j4
2010-03-24 13:13:49,How do i build my monavie downline? Im tired of my job? http://cli.gs/XQdtG #monavie
