time,tweet
2010-03-23 16:44:24,Getting busy setting up Android Game Blog! Watch this space!
2010-03-23 16:49:26,Working on getting our WordPress theme integrated with Twitter. Should offer some cool cross site functionality.
2010-03-23 22:50:37,So excited for launch. Hoping to roll out this weekend. Stay tuned. Lots of cool content coming up at go-live!
2010-03-23 23:05:24,Getting lots of original content together so that when we launch there'll be plenty to dig into right away!
2010-03-27 11:14:27,"Launch is getting closer! Next weekend should be the big event! Lots of fun stuff happening, stay tuned!"
