time,tweet
2010-03-27 02:41:30,Pizza Joint Saved By Cell Phone Marketing: http://homebasedbusiness.com/profiles/blogs/cell-phone-marketing-saves
2010-03-27 16:07:56,Cell Phone Marketing Saves Business.  See Story Here: http://homebasedbusiness.com/profiles/blogs/cell-phone-marketing-saves
2010-03-27 16:09:01,Does Your Business Need New Blood? http://www.cellphonemarketinginfo.blogspot.com
2010-03-28 15:02:21,Apple & Google Are Fighting For Position. Get In Why You Still Can: http://textmessagemarketinginfo.blogspot.com/
2010-03-28 15:03:24,Selling Pizza With Text Message Marketing: http://textmessagemarketinginfo.blogspot.com/ Your Business Could Do The Same
