time,tweet
2010-03-25 16:53:09,This is how I make money. Take it or leave it. http://bit.ly/cpZNxZ
2010-03-25 16:53:37,Democrats near victorious end of health care fight      (AP)  http://tinyurl.com/yeyasu7
2010-03-25 16:58:40,Eurozone agrees on bailout plan for Greece      (AP)  http://tinyurl.com/ydj2n5s
2010-03-25 17:03:37,Vatican axed trial for priest accused by deaf boys      (AP)  http://tinyurl.com/yk7tvw3
2010-03-25 17:08:36,Bin Laden threatens US over alleged 9/11 plotter      (AP)  http://tinyurl.com/yzks7po
