time,tweet
2010-04-17 11:23:12,what to do with tart strawberries? slice them in half and dump them into a jug of water for a great alkalizing effect! :)
2010-04-19 13:25:21,Drink a moderate amount of red wine daily to lower the risk of heart attacks. Moderate=1 drink a day for women and 2 drinks a day for men!
2010-04-19 22:58:52,"For healthy glowing skin apply this homemade mask for 20 minutes. Puree 4 mint leaves, a deseeded cucumber and an egg white for the mask."
2010-04-19 23:18:59,Cravings are NOT your body's way of telling you it needs something. We crave foods we enjoy and associate with pleasurable times.
2010-04-19 23:48:57,Alcohol/drugs are often used to self-medicate the symptoms of depression or anxiety. A treatment addressing both problems is most effective.
