time,tweet
2010-04-14 10:39:54,VISIT US @ http://timelesstreasuresbymaria.net/
2010-04-14 10:41:34,Let our photographers capture your special moment in time : http://timelesstreasuresbymaria.net/
2010-04-22 14:38:46,Visit our new website and give us your feedback: http://timelesstreasuresbymaria.net/
2010-04-22 14:39:28,Visit our website and check out testimonials : http://timelesstreasuresbymaria.net/
2010-04-22 14:41:10,"Timeless Treasures by Maria serves the following areas including Austin,Round Rock,and much more: http://timelesstreasuresbymaria.net/"
