time,tweet
2010-03-12 15:08:46,100 Ways To Develop Your Mind: The Psychology Of The Mind And How To Develop Your Mind To Change Your Life (Volume 1... http://bit.ly/c9xglx
2010-03-12 15:08:48,"The Complete Woodblock Prints of Kitagawa Utamaro: A Descriptive Catalogue (Paperback) tagged ""art"" 56 times http://bit.ly/aYLMlU"
2010-03-13 14:12:25,"Overlooked New York: Impassioned New Yorkers from an Artist's Perspective (Volume 1) (Paperback) tagged ""art&qu... http://bit.ly/c9ImaZ"
2010-03-20 10:49:00,"The War of Art: Break Through the Blocks and Win Your Inner Creative Battles (Paperback) tagged ""art"" 34 t... http://bit.ly/94qD2F"
2010-03-21 04:47:10,"The War of Art: Break Through the Blocks and Win Your Inner Creative Battles (Paperback) tagged ""art"" 34 t... http://bit.ly/c9KfYh"
