time,tweet
2010-03-29 17:20:18,Looking for cheap hotels in Madison WI?  www.abvimadison.net
2010-03-29 18:30:25,"We assist passionate entrepreneurs in executing their business plans by offering financial resources, corp filing assistance and guidance."
2010-03-29 20:30:14,"Visit www.abvimadison.net for cheap hotel accomodations.  Madison, WI"
2010-04-02 17:21:28,"@Wisconsinmade Visit www.abvimadison.net for cheap hotel accomodations.  Madison, WI"
2010-04-18 20:08:10,Video Internet marketing is taking the online world by storm. Contact us today for more information at 1(877)678-4879!
