time,tweet
2010-04-02 05:00:22,scoop shops http://bit.ly/bxxrQc ;P Pick Up A Free Ben  Jerrys Ice Cream Cone At 5 CT Scoop Shops
2010-04-02 12:00:49,;P oy Bitchie Mail: Rihanna Shouldn’t Perform “Rude Boy” For Kids http://bit.ly/9CMwHr
2010-04-04 12:00:22,Carly Joerger named Pocatello/Chubbuck Junior Miss for 2010/2011 #shelikes http://bit.ly/aMZE98 :)
2010-04-05 22:00:25,"#ZodiacFacts   http://bit.ly/bAHDC3 Padres 7, Reds 5"
2010-04-06 00:10:18,http://bit.ly/bJzo7O Car Radio Installation Part 4  ISO Connections – What They Are stereo car
