time,tweet
2010-03-27 23:11:55,"I know, Meditation has ability to take you to the next dimension before death. Any suggestions?"
2010-03-29 18:39:29,"Checking out http://tweetspinner.com features: profile image rotation, DM and follower de-spam, follower management, reciprocity scores..."
2010-03-31 03:19:56,"I know, Meditation has ability to take you to the next dimension before death. Any suggestions?"
2010-04-06 00:14:01,Life is a tragedy when seen in closeup but a comedy in long shot
2010-04-08 21:48:09,Weight Watchers! This is a real Fat Burning Furnace http://bit.ly/b59zTr Invest in your health
