time,tweet
2010-03-28 10:46:33,USB2.0 Slim External Rewriteable CD and 8X DVD +/- RW Read/write Blu-ray BD-ROM CD DVD Drive for laptop notebook (... http://bit.ly/8ZBeoc
2010-03-28 10:46:34,"Samsung BD-P1590 Blu-Ray Disc Player - 1080p, HDMI, Ethernet, USB, BD-Live, Netflix Streaming, Remote Control, (Re... http://bit.ly/9WSqfu"
2010-03-28 10:46:35,"Fantastic Mr. Fox (Video On Demand) newly tagged ""blu-ray"" http://bit.ly/ayGNVE"
2010-03-28 10:46:36,"Panasonic DMP-BD45 Ultra-Fast Booting Blu-Ray Disc Player (Black) (Electronics) newly tagged ""blu-ray"" http://bit.ly/cUjdVD"
2010-03-28 10:46:37,"Polk Audio PSWi225 Wireless Subwoofer (Electronics) newly tagged ""blu-ray"" http://bit.ly/bhyx1F"
