time,tweet
2010-03-12 15:08:10,Mediabridge Ultra Series - 6ft High Speed HDMI Cable - Version 1.3 Category 2 Certified - 1080p - Blu-Ray - PS3 tagg... http://bit.ly/ameDTO
2010-03-12 23:14:35,"Planet Earth: The Complete BBC Series [Blu-ray] (Blu-ray) tagged ""1080p"" 224 times http://bit.ly/9agn3M"
2010-03-13 20:08:10,"Samsung Touch Of Color T260HD 25.5-Inch LCD HDTV Monitor (Electronics) tagged ""1080p"" 103 times http://bit.ly/cVqzp1"
2010-03-14 08:08:30,"Samsung Touch Of Color T260HD 25.5-Inch LCD HDTV Monitor (Electronics) tagged ""1080p"" 103 times http://bit.ly/aEdsGz"
2010-03-15 14:27:57,"Samsung LN52B750 52-Inch 1080p 240 Hz LCD HDTV with Charcoal Grey Touch of Color (Electronics) tagged ""1080p&qu... http://bit.ly/9GH5YY"
