time,tweet
2010-03-12 22:14:52,"@muridman maaf brow, salam kenal. aku pengen nanya tentang robotsmail bs, cara dapetinnya gmn ??"
2010-03-13 14:04:45,"@muridman ow, pantesan, aku coba buka webnya ga bs smua. pdahal pnasaran nich pngen bs dpt $$ bnyk dr adsense kayak master Elricko. hehe"
2010-03-14 13:28:28,Panas bangetttt... padahal udah pake kipas angin.
2010-03-24 18:46:05,"I'm on Ad.ly... go to http://ad.ly/ to advertise on my feed, or sign up http://ad.ly/get-sponsored/"
2010-04-01 13:21:07,Signed up at OnlyWire.com http://onlywire.com
