time,tweet
2010-03-26 11:22:51,"There is only one thing that can kill the Movies, and that is education."
2010-03-26 11:22:53,"RT @pazpaz #sometimesiwonder how Chicago started. I think guys in NY said, I'm enjoying the crime and poverty here, but its not cold enough."
2010-03-26 18:22:50,"When we are born, we cry, that we are come To this great stage of fools."
2010-03-26 18:22:51,"RT @pazpaz The greatest trick the devil ever pulled was convincing the world he didn't exist. Oh, and inventing chatroulette."
2010-04-01 06:01:32,Oh yea… @johncmayer that doesn't make sense
