time,tweet
2010-06-09 04:20:15,Do you enjoy porn?Why not get paid to watch it.Check this out. Access code 6975  http://bit.ly/bED1el
2010-06-09 04:25:16,"Love Porn, Love Naked bodies, Love Money?? Why not get paid to watch porn. Access  code 6975 http://bit.ly/bED1el"
2010-06-09 04:51:17,"Are you looking to expand your wealth,but at the same time have a great time?Check this out. access code 6975  http://bit.ly/bED1el"
2010-06-09 05:01:17,Get paid to watch porn. Own your own Adult Web Site. Check this out to see how .  access code 6975 http://bit.ly/bED1el
2010-06-09 05:12:28,BONDAGE VEST sensational sex with the incredible  Bondage Vest !#bondage http://bit.ly/casXfd #bdsm #sex http://tweetphoto.com/26335315
