time,tweet
2010-03-10 02:04:50,"Dragon Age: Origins (DVD-ROM) tagged ""rpg"" 105 times http://links.assetize.com/links/2e21f4"
2010-03-10 23:14:37,"Mass Effect (Video Game) tagged ""rpg"" 270 times http://bit.ly/aLTUY4"
2010-03-11 05:13:57,"Mass Effect (Video Game) tagged ""rpg"" 270 times http://bit.ly/cEtOGY"
2010-03-11 12:12:07,"Dragon Age: Origins (DVD-ROM) tagged ""rpg"" 107 times http://bit.ly/9VjZzr"
2010-03-13 05:09:41,"Dragon Age: Origins (Video Game) tagged ""rpg"" 101 times http://bit.ly/cWKtOY"
