time,tweet
2010-03-23 10:11:05,Styx and Blue Oyster Cult to bring classic rock double shot to Musikfest | - lehighvalleylive.com http://bit.ly/aPZXbZ
2010-03-23 17:46:43,Join Pack Moose Radio on Facebook as well at http://bit.ly/aTqtZx
2010-03-23 18:55:07,Does anyone remember laughter? - Robert Plant
2010-03-23 20:08:08,"Older and wiser voices can help you find the right path, if you are only willing to listen. - Jimmy Buffett"
2010-03-23 21:00:12,I would never have gone anywhere if it hadn't been for Mother's faith and support. - Patsy Cline
