time,tweet
2010-06-29 07:09:26,New York Yankees Dodgers Vs Yankees  Hollywood divided as the coast to coast rivals meet http://bit.ly/cYQFrQ :P
2010-06-29 07:30:13,http://bit.ly/bLV0Po There are options for jaw joint dysfunctions   ibuprofen
2010-06-29 07:43:46,"muscle mass The Zone Diet – Have Proportions of Carbohydrates, Protein, and  :P http://bit.ly/9RrPnA"
2010-06-29 15:55:42,http://bit.ly/90hK7m robert wone What Happened at Robert Wones Funeral?
2010-06-29 16:09:23,Dodgers stunned by Yankees comeback . http://bit.ly/aFWokm Los Angeles Dodgers
