time,tweet
2010-05-03 05:50:17,"E o busao que perdi se adiantou e o que to esperando ta atrazado, pelo jeito a semana nao sera igual a anterior..."
2010-05-03 06:41:55,Once 6 Minutes started playing when i was taking my sis shopping at the childrens place and i refused to let her leave until it was over :)
2010-05-03 07:02:41,"My heart dreams BIG, The Lord determines my steps, I apply my HUZTLE, how can I lose? Good Mornin, Get up, Get Better! N I'm on the move"
2010-05-03 07:56:57,had so much homework to do that I forgot to eat. I'm blaming school for my annorexia. Hahaaaaa
2010-05-03 09:02:32,"Wind 5.0 km/h W. Barometer 1037.0 hPa, Falling slowly. Temperature 13.1 °C. Rain today 0.0 mm. Humidity 89%"
