time,tweet
2010-04-15 14:30:22,http://bit.ly/dyxrZt Goodnight ;O Tina Fey reprises Sarah Palin role on NBCs Saturday Night Live for first
2010-04-15 15:20:35,:O afghan girl http://bit.ly/doLOOB Frieda Pinto denies Bond Girl rumours
2010-04-15 15:41:07,Padres preview: Is the grass really greener? http://bit.ly/dj2Lo3 las vegas oddsmakers
2010-04-15 17:20:28,Stubbs: Celtic dont have players who do the jersey justice ! tommy thompson http://bit.ly/8Y9p07
2010-04-15 22:00:42,Dixie Carter im Alter von 70 Jahren gestorben one life to live http://bit.ly/bex228
