time,tweet
2010-04-06 17:07:51,Coming soon..a new way to connect with your fam... Stay tuned!! :)
2010-04-07 12:14:18,@ExecutiveRisks I should think so too! ;)
2010-04-16 09:47:32,WhatsUpFam! We're gonna get started building the site today...hopefully we'll have the home page up by Monday...let me know what you think!
2010-04-21 12:16:40,"FAM - ppl u r related 2 thru family ties, close friendships, or tight-knit social networks i.e. church members, community softball team, etc"
2010-04-21 13:27:14,Installing video and web chat capabilities today!
