time,tweet
2010-06-08 20:41:13,Don't Throw It Out Just Yet http://linkee.com/F4Q
2010-06-08 22:20:09,BUY NOISE HEADPHONES HERE!!!!  http://vtc.es/CKy
2010-06-08 22:51:13,Blackberry Finder  1005# you have reached your maximum limit of possible api requests with this IP address. Please wait 24 hours.
2010-06-08 23:09:10,Blu ray or a upscaling player? Is blu ray disc player worth it to buy? http://tinyurl.com/2746y2e
2010-06-09 06:34:08,Cordless Phones - Move Freely While Communicating http://linkee.com/HLq
