time,tweet
2010-04-13 22:45:19,Making my Twitter profile look good with Themeleon by @COLOURlovers http://colourlovers.com/themeleon Love it?
2010-04-14 10:28:41,"I feel like it's all coming together now! I'm meeting the people i'm suppose to meet, and around the people I'm suppose to be around."
2010-04-14 11:18:32,Me and a coworker talking about the music business and how it has changed
2010-04-14 11:30:22,@LilWayneHQ keep ya head up and hopefully we can do a track together when you get out. You still holding it down out here!
2010-04-14 19:54:03,"I uploaded a YouTube video -- Major "" Paper Stacks"" New Official song http://youtu.be/VO3FxlLtaL4?a"
