time,tweet
2010-04-12 08:00:17,"Looking for sexy chicks on the net, http://tinyurl.com/y5geu94"
2010-04-12 12:16:47,"Blonde strip and try to seduce her viewers, http://cli.gs/PEuGV"
2010-04-12 13:33:53,"A very young teens create a nude videos, http://cli.gs/Ha7XS"
2010-04-12 14:49:15,"A sexy young red head teen strip on her room, she is adorable and has great shape of body, http://cli.gs/mMqjn"
2010-04-13 07:12:52,"Teen girl from the local soccer team shows off her gravity defying perky titties, http://cli.gs/HAeq6"
