time,tweet
2010-04-25 06:07:57,Ford Fiesta: America finally joins the party - Washington Post - http://tinyurl.com/25yl5ux
2010-04-25 06:08:01,Red Line cars hit by shots from pellet gun - Boston Globe - http://tinyurl.com/29wq88b
2010-04-25 06:29:58,"Daimler Surges After Raising 2010 Forecasts for Cars, Trucks - BusinessWeek - http://tinyurl.com/3azhmm4"
2010-04-25 06:30:07,"Talladega is a game of luck, but in the scheme of the season it means little - Orlando Sentinel - http://tinyurl.com/25l9mfm"
2010-04-25 06:30:15,Spoiler alert: a big test for rear of cars in NASCAR - The Virginian-Pilot - http://tinyurl.com/26vcuon
