time,tweet
2010-05-02 22:50:03,Hydroponic Information Blog ~ http://hydroponicindoorgarden.com/
2010-05-03 01:07:47,"He who has health, has hope; and he who has hope, has everything.~Arabian Proverb"
2010-05-03 01:14:58,Hydroponic Gardening - 3 Advantages of a Hydroponic Vegetable Garden ~ http://dld.bz/bXUz
2010-05-04 12:22:16,Choose the Right Hydroponic System for You ~ http://dld.bz/bPCW
2010-05-04 13:22:09,"You can do what you have to do, and sometimes you can do it even better than you think you can.~Jimmy Carter"
