time,tweet
2010-05-11 06:35:02,Dieses Video musst du dir ansehen! -- Ein tierischer Spaß!! Marmaduke http://www.youtube.com/yjggo
2010-05-11 23:20:51,"Einfaches Online Projekt-Management für Startups - jetzt 30 Tage kostenlos, dann ab 9€ http://j.mp/d8SQDx #planio #redmine #spon"
2010-05-12 03:07:48,Dieses Video musst du dir ansehen! -- Ein tierischer Spaß!! Marmaduke http://www.youtube.com/yjggo
2010-05-13 02:14:43,Die GameDuell Skat Schule mit Heiner Lauterbach - http://yjggo.de/spiele/computer-spiele/index.html
2010-05-15 03:17:21,Hier gehts zum GATIS - Ratgeber - Werbung zum Nulltarif - http://yjggo.de/online-shopping/ebooks/web-cash-club/index.html
