time,tweet
2010-04-15 23:30:28,http://bit.ly/cPjmJi Wayland A to Z: S is for Special Prosecutor :P archibald cox
2010-04-15 23:41:08,Turner Classic Movies launches its first ever film festival in L.A. from April  . http://bit.ly/cKzUaR movie star photos
2010-04-16 01:01:04,"Jerseys Zoubek, Thomas celebrate title http://bit.ly/9WnXEF basketball jerseys !"
2010-04-16 06:02:20,UK Data: RICS House Price Balance Dips: More Sellers Emerge  monetary policy committee http://bit.ly/cYPmHV
2010-04-16 16:30:57,First Horizon 1Q loss shrinks with bad debt cost http://bit.ly/d3CLSA ;) money market
