time,tweet
2010-06-10 19:13:39,Solar Panel Facts Update:  Small Solar Panels Kit © - You Must Try It! http://bit.ly/bxTv53
2010-06-10 19:30:07,Solar Panel Facts Update:  Build Solar Panel Cheap - 100% Workable Guaranteed.flv http://bit.ly/cx1Whm
2010-06-10 19:38:26,Solar Panel Facts Update:  Customer's view of solar panel installation. http://bit.ly/ae7Bd5
2010-06-10 19:38:29,Solar Panel Facts Update:  Advantages of solar panels and wind turbines http://bit.ly/atEags
2010-06-10 20:06:59,Solar Panel Facts Update:  Green Job Training 80 WATT SOLAR PANEL Grid Tie Inverter Direct Monocrysta... http://bit.ly/aYHsMT
