time,tweet
2010-04-23 18:49:57,FOR MORE INFO CHECK OUT MY DOT COM. http://magenmelancholy.com/
2010-04-23 18:50:05,OUR LATEST RELEASE IS ENTITLED “THE SHORT-LIVED LIFE OF MAGEN MELANCHOLY”. IT’S GOT 8 TRACKS.
2010-04-23 18:50:11,IF IT JUST SO HAPPENS THAT YOU LIKE TO DISCOVER NEW MUSIC AND YOU ENJOY OURS… WELL THEN YOU CAN HAVE IT!
2010-04-23 18:50:39,I JUST FOLLOW YOU. IT'S LIKE A WAVE. I SAY HELLO FROM ALL THE WAY OVER HERE AND I ONLY POINT THE WAY.
2010-04-23 18:50:56,IT WILL MOST LIKELY GET SUSPENDED EVEN THOUGH I AM NOT SOLICITING OR FLUTTERING USERS WITH SPAM.
