time,tweet
2010-05-04 05:58:57,"You have to know what's important and what's unimportant, for you. (David H. Fink)"
2010-05-04 07:02:44,"Closed: Rivers of America, all river boats, Thunder Mt., the Swings, Redwood Creek, Souvenir 66. Reopening: N/A"
2010-05-04 07:48:58,plz lord dont make me have to send dis B***H up!
2010-05-04 08:27:22,"Sing-""Cause we're so young now,so young now,n when tomorrow come we just do it all again.."""
2010-05-04 09:26:06,My day is f*d already and I'm not even at work yet
