time,tweet
2010-06-18 17:47:54,If Wayne Rooney is troubled by an ankle injury then we are certainly going to struggle to get anywhere in the world cup.Thats bein realistic
2010-06-18 17:50:36,"I found mtself unable to leave the sofa after the England match, so ened up watching Big Brother. I found it boring yet  carried on watching"
2010-06-18 17:50:54,myself even
2010-06-18 17:53:09,#nowplaying There must be more to life than this Michael Jackson & Freddie Mercury.
2010-06-18 17:55:03,Wimbledon tennis starts on Monday. Favs to win as per usual Roger Federer and Venus or Serena Williams!
