time,tweet
2010-04-27 11:45:50,When you chose not to decide you have already made a choice.
2010-04-27 11:46:56,False effort can not last longer than time needed to unfold true effortlessness.
2010-04-27 11:47:16,"Keeping being occupied with action that occupies, you sealed the gates of sight of beauty of self. Unnamed"
2010-04-27 19:04:36,Using mathematically most advanced affiliate program in history. Contact me in first. http://bit.ly/bQAPuV
2010-04-28 04:03:35,"Join the most mathematically advanced affiliate program in the history, no one is left behind. Strong team support. http://bit.ly/bQAPuV"
