time,tweet
2010-05-17 00:47:48,Update: Rotosound RS77LE Monel Flatwound Bass Guitar Strings http://bit.ly/9XyK1w
2010-05-17 00:53:50,"Update: DR Strings Electric Guitar Strings, Dimebag Darrell Signature, Treated Nickel-Plated, 11-50 http://bit.ly/cPC1AM"
2010-05-17 01:00:38,"Update: Ovation Applause Series AE148 Super Shallow Cutaway Acoustic-Electric Guitar, Black http://bit.ly/9ghur4"
2010-05-17 01:06:11,Update: CBI Cable with Right Angle Plug - 25 Foot http://bit.ly/bQJDGR
2010-05-17 08:14:44,Update: AXL Rapture 25TR 25w Guitar Amplifier with Accutronics Spring Reverb http://bit.ly/aJK4si
