time,tweet
2010-06-07 18:00:56,Juntos cosechamos un nuevo desarrollo. ¿Cuál es tu aporte al desarrollo?
2010-06-07 19:38:44,Nueva imagen de la Prefectura del Azuay. -- Spot Prefectura del Azuay http://youtu.be/l-1Vs-1ImHI
2010-06-08 19:05:31,"""Azuay se Alimenta"", tenemos derecho al acceso a la Seguridad y Soberanía Alimentaria http://www.youtube.com/watch?v=9kwqqnL_Mrg"
2010-06-09 09:10:03,"""Se ha generado una comunidad trasnacional”, dijo Carrasco en el debate sobre Migración de la UNIA - España http://tinyurl.com/2ap4yrv"
2010-06-09 15:44:55,La Prefectura del Azuay entregó nuevos equipos tecnológicos a los cantones para realizar planos territoriales http://tinyurl.com/27u94hv
