time,tweet
2010-05-09 13:04:31,How to Shop for a Leather Coat - http://bit.ly/bnJQzF... http://bit.ly/cYIM2n
2010-05-09 13:06:35,Jobs Legally For 50k Plus http://www.xzcution.com/4R
2010-05-09 14:07:11,How to Become A DJ and Keep the Party Going - http://www.xzcution.com/3T http://www.xzcution.com/3T
2010-05-09 14:08:07,How to Store Your Leather Coat - http://www.xzcution.com/5u http://www.xzcution.com/5u
2010-05-09 16:36:48,"How to Become A DJ: Is There A DJ in You? - If you want to become a DJ, then there are a few things that you s... http://www.xzcution.com/3U"
