time,tweet
2010-05-27 23:19:22,Help Bring Michael Pearl to The Home Depot's Attention!! http://tsort.us/ycp7ac
2010-05-28 20:49:19,SAVE MONEY WITH COUPONBUG! 1005# you have reached your maximum limit of possible api requests with this IP address. Please wait 24 hours.
2010-05-29 20:58:09,can any help me solve this riddle? you find this in an office supplies store and you also use it on animals a? http://to.ly/4Sgr
2010-05-30 17:28:16,Office Supplier  http://linkee.com/Gi4
2010-05-30 21:17:14,Audit: MTA wasted $39M on jet fuel http://snipr.com/wxypv
