time,tweet
2010-05-14 08:57:10,Come Party at the bronx's premier spot Luna Club http://bit.ly/bN6LLo
2010-05-14 08:59:16,SPATWATCH: Conservatives vs. New York City http://tinyurl.com/25zx25g
2010-05-14 09:07:48,"No te pierdas este gran evento el Luna club, una noche para recordar llama ahora para tus boletos, no te quedes af http://twitpic.com/1nos7y"
2010-05-14 09:11:47,@eriktaveras No te pierdas el party oficial de new york este sabado en luna club con pochy y familia urbano http://twitpic.com/1nos7y
2010-05-14 09:11:56,@lostirapiedra No te pierdas el party oficial de new york este sabado en luna club con pochy y familia urbano http://twitpic.com/1nos7y
