time,tweet
2010-05-10 22:23:26,Every Swiss citizen is required by law to have a bomb shelter. #veefacts
2010-05-10 22:24:14,The states with the most presidential burial sites: Ohio and Virginia (tie). #veefacts
2010-05-10 22:24:51,Moscow weathermen can be fined for inaccurate weather forecasting. #veefacts
2010-05-10 22:25:53,"Before roasting, some green coffee beans are stored for years, and experts believe that certain beans improve with age. #veefacts"
2010-05-10 22:26:52,"The largest employer in the world is the Indian railway system in India, employing over 1.6 million people. #veefacts"
