time,tweet
2010-06-01 02:37:55,The Facts About DLP VS Plasma TVs !  digital light processing
2010-06-01 07:02:36,The Complete Guide to Direct TV Receiver  ;) definition resolution
2010-06-01 07:16:08,"amazon Samsung LN46A650 LCD TV Review-Do Not Miss This Excellent 46"" HDTV With Amazon Super Saver Free Shipping!"
2010-06-01 11:00:54,:P http://bit.ly/bVFoCo olegvolk: Polaroid Land SX70 instant camera (slightly nsfw) Polaroid Camera Digital
2010-06-01 12:19:15,;O money How to Find the Right TV Brackets For Your Unit
