time,tweet
2010-05-25 17:02:27,HUGE Sale on Designer Sneakers at: http://www.Mens-Sneakers.com
2010-05-25 17:09:27,Louis Vuitton X Kanye West High-top Sneakers on SALE: http://cli.gs/0vL2b
2010-05-25 17:15:44,"For Geek Pride Day, pick up the ultimate Geek Shoes, DC Comics X Bape http://cli.gs/mVJVe and Marvel X Bape http://cli.gs/73b6B"
2010-05-25 18:26:05,Louis Vuitton X Kanye West Hudson Boat Shoes http://cli.gs/NsvD4
2010-05-25 19:11:19,Dolce & Gabanna 2010 Collection online here: http://cli.gs/Yq6VQ
