time,tweet
2010-06-23 03:38:57,Weak miners pull Britain's FTSE lower (at Reuters) http://dlvr.it/1yL5s #S&P #Trading
2010-06-23 03:38:58,GLOBAL MARKETS-World stocks retreat on growth fears (at Reuters) http://dlvr.it/1yL5r #S&P #Trading
2010-06-23 04:15:56,The Day Ahead: Woe for Retailers http://dlvr.it/1x1cD #S&P #Trading
2010-06-23 04:15:56,World stocks retreat on growth fears (Reuters) http://dlvr.it/1yN4p #S&P #Trading
2010-06-23 04:15:56,"Stock futures point to higher U.S. open, Fed eyed (at Reuters) http://dlvr.it/1yN4n #S&P #Trading"
