time,tweet
2010-05-16 23:58:29,"The uggs are so comfortable, infact, that they have inspired me to walk to work. http://www.bootugg.com"
2010-05-16 23:59:13,Uggs are the best boots for fall and winter. They have a great history of being perfect for snowy settings. http://www.bootugg.com
2010-05-17 00:00:07,The boots arrived in time for the great snowstorms. They are warm. They look great.  http://www.bootugg.com
2010-05-17 00:01:01,I currently own 12 pairs of Uggs. These were the only ones I ordered from http://www.bootugg.com  and easily got the best deal...not tax !
2010-05-17 00:01:21,Cheap $69 ugg boots hot sale! http://www.bootugg.com
