time,tweet
2010-05-08 23:38:17,I have use a lot of trading tools over the years but this one blows my socks off.  The Wizard makes my choices easy. http://cli.gs/Ashley
2010-05-08 23:38:37,Deep-sea ice crystals stymie Gulf oil leak fix      (AP)  http://tinyurl.com/37p2ffd
2010-05-08 23:58:37,US Sen. Bob Bennett ousted at Utah GOP convention      (AP)  http://tinyurl.com/39d5xb7
2010-05-09 00:18:24,@Babygirl8123 See how to take your trading to a whole new dimension.  http://cli.gs/Ashley
2010-05-09 00:18:37,Shelby: Bank bill should include mortgage firms      (AP)  http://tinyurl.com/33dgqul
