time,tweet
2008-05-20 00:58:00,WPZOOM has returned with a new design. Check it here: http://www.wpzoom.com/
2008-05-20 13:47:40,A new collection of fresh themes was published http://is.gd/jfz
2008-05-23 05:01:17,Just published first article from BEST OF Category - http://is.gd/kIz .You cand Digg it if u think it's worth - http://is.gd/kIB
2008-05-26 09:46:34,"I became an affiliate of several premium themes for WP. You can check them, and I'll be glad if you'll buy any of them from http://is.gd/lSX"
2008-05-27 14:33:33,Collecting some free premium themes for next article :)
