time,tweet
2010-06-02 16:18:03,Crazy Taxi and Sonic Adventure For Xbox 360 Outed by Ratings Board: There have been rumors for some time now that ... http://bit.ly/9KE0Bn
2010-06-02 19:24:09,Remains of the Day: Hulu on the Xbox 360 [For What It's Worth]: # forwhatitsworth The rumor mill puts Hulu on the ... http://bit.ly/daAxzf
2010-06-03 04:45:20,"Supreme Commander: Supreme Commander                                           For a millennium, war has raged bet... http://bit.ly/dvEzn1"
2010-06-03 11:41:59,"Xbox 360 Kart Racer Joy Ride Canceled?: One of Microsoft's announcements at E3 2009 was Joy Ride , a new kart race... http://bit.ly/cormnP"
2010-06-03 14:47:20,Hulu Could be Coming to the Xbox 360: Rumors have begun to circulate that Microsoft will be announcing a deal at E... http://bit.ly/bjyzNN
