time,tweet
2010-06-15 04:46:17,Types of Loans for UK Post-graduate Students http://tsort.us/a724xm
2010-06-15 05:32:08,Is it hard to Study the Economy? http://bit.ly/cHAUhp
2010-06-15 06:00:08,Make More Money As A Financial Planner With Your Own Domain http://vtc.es/I92
2010-06-15 06:49:08,3 Biggest Arguments Agains... 1005# you have reached your maximum limit of possible api requests with this IP address. Please wait 24 hours.
2010-06-15 06:54:09,Lowest Mortgage Rates are outstanding http://vtc.es/IAj
