time,tweet
2010-05-12 17:27:51,Cold Blue Rebels with Vj Ginger Fish of Marilyn Manson and Dj Scott Savak ~18+ This Saturday May 15th!!
2010-05-13 15:59:19,Cold Blue Rebels with Vj Ginger Fish of Marilyn Manson and Dj Scott Savak ~18+ This Saturday May 15th!!
2010-05-13 16:12:32,My Life with the Thrill Kill Kult and Psychotica May 29th!! Presale at Barsinister.net
2010-05-13 16:13:36,"Underworld 5/30 Hosted by Rev John of Das Bunker, Bruce Perdew of Perversion & Tricia LaBelle of Bar Sinister w/ Live HexRX barsinister.net"
2010-05-13 20:23:50,LOST BOYS III seeking Vampire interviews for outtake footage  PLEASE CALL SCOTT DEVINE AT 818.635.5278 FOR INTERVIEW 5/15/10 @ BAR SINISTER
