time,tweet
2010-05-04 04:24:12,What's up?
2010-05-09 16:14:43,"Whatever is at the center of our life will be the source of our security, guidance, wisdom, and power."
2010-05-09 21:29:48,"I hope our wisdom will grow with our power, and teach us, that the less we use our power the greater it will be."
2010-05-10 02:42:53,It's so simple to be wise. Just think of something stupid to say and then don't say it.
2010-05-10 07:55:25,"Almost every wise saying has an opposite one, no less wise, to balance it."
