time,tweet
2009-11-25 20:03:22,Become a fan of the Acting For Real Online Creative Community and learn how to become the celebrity in your niche!  Be BOP http://ow.ly/FJxL
2009-11-25 20:35:26,I'd like to wish everyone a Happy Thanksgiving and hope you spend some quality time with those near and dear to you.
2009-11-25 22:54:20,Whats your best Turkey call? B Bop http://ow.ly/FL8Y
2009-11-25 23:42:26,"Happy thanksgiving, check out my thanksgiving blog called ""dressing the bird"" because her breast are to big.B Bop  http://ow.ly/FLyD"
2009-11-26 01:55:19,"Happy thanksgiving, check out my thanksgiving blog called ""dressing the bird"" because her breast are to big.B Bop http://ow.ly/FLyD"
