time,tweet
2010-05-29 20:09:38,"Eminence Seattle Values: Plant-based products, Sustainable farming, 100% Wind Power http://organic.amyskincare.com/Eminence_Values_s/44.htm"
2010-06-01 00:01:02,Eminence a variety of effective organic treatments that help you bring your acne under control naturally http://tinyurl.com/eminenceacne
2010-06-01 00:04:48,Eminence products for Rosacea include Eminence Couperose-C Serum &  Black Perlette Grape Moisturizer  http://tinyurl.com/eminence-rosacea
2010-06-01 00:06:54,Eminence Eight Greens Youth Serum  & Eight Greens Whip Moisturizer are great product for hormonal skin- http://tinyurl.com/eminence-hormonal
2010-06-01 00:10:03,Feel like you need more oil control than BP? Try Eminence Tomato Oil Control Gel to treat oily skin- http://tinyurl.com/eminence-oilcontrol
