time,tweet
2010-07-28 14:51:04,What is best tv in the market as I am currently looking to buy one? http://LNK.by/eaCNA
2010-07-28 16:04:05,HP Color Laserjet CM1312NFI - Tech Look http://lasercolorprinteronline.com/blog/HP-Color-Laserjet-CM1312NFI--Tech-Look
2010-07-28 16:09:05,PFT: T.O. hints at current asking price http://bit.ly/9cyuxJ
2010-07-28 16:31:04,Security System Wireless Options  http://ur.ly/ilci
2010-07-28 17:17:05,Sensor Size And Depth Of Field In Film And Digital Cameras http://ur.ly/itoR
