time,tweet
2010-05-13 02:57:05,helloo World
2010-05-13 03:27:42,Update: cars and stuff http://www.technomobiles.info/technology-mobiles/cars-and-stuff/
2010-05-13 03:27:43,Update: Boost Mobiles Expanding Handset Lineup http://www.technomobiles.info/mobiles/boost-mobiles-expanding-handset-lineup/
2010-05-13 03:27:44,"Update: Mobile Disco set up, part ... http://www.technomobiles.info/tutorial-mobile/mobile-disco-set-up-part-2-setting-up-the-audio-and-pa/"
2010-05-13 03:27:45,Update: Android Live wallpaper Waves Wallpaper For the Google Nexus One and Android 2.1 http://bit.ly/apLLBP
