time,tweet
2010-05-28 07:42:55,"Phoenix, AZ Family Doctor, Brian D. Dedinsky, MD, Receives Mercy Physicians Award - http://ow.ly/1R6gW"
2010-05-28 07:45:22,I appreciate my doctor having a nutritionist on staff - http://ow.ly/1R6kK
2010-05-28 07:46:14,How important to you is texting your primary care doctor? http://ow.ly/1R6mh
2010-05-28 07:50:11,Why choose a concierge physician? http://ow.ly/1R6sg
2010-05-28 07:51:56,"Phoenix, AZ - READING: ""The Importance of Annual Physicals, Age 45-65"" http://ow.ly/1R6va"
