time,tweet
2010-05-15 13:33:02,Update: Fixing Your Original Nintendo. http://ds.allaboutsite.info/dsi/fixing-your-original-nintendo/
2010-05-15 14:11:15,Update: Nintendo 3DS - What the Nintendo 3DS Games could look like! http://bit.ly/aGJXGj
2010-05-15 14:12:16,Update: DS Lite Video Review http://ds.allaboutsite.info/ds-lite/ds-lite-video-review/
2010-05-15 14:12:21,Update: Disassembling DS Lite. TeknoConsolas.es http://ds.allaboutsite.info/ds-lite/disassembling-ds-lite-teknoconsolas-es/
2010-05-15 14:20:56,Update: Nintendo DS Lite Cobalt / Black http://ds.allaboutsite.info/ds-lite/nintendo-ds-lite-cobalt-black/
