time,tweet
2010-05-11 17:54:18,some different options for online piano lessons - http://snipez.net/bb02
2010-05-24 08:47:43,take a break from the piano if u play the affiliate game and check this out - http://tgli.de/Jj5
2010-06-10 15:25:51,"pianists, tweet your music promotions virally - http://tgli.de/Jbo"
2010-06-23 08:12:33,viral marketing tools can create more time for piano and music in your life - http://tgli.de/JmI
2010-06-26 22:24:49,"explode your twitter following virally in no time, free! - http://tgli.de/KEl"
