time,tweet
2010-06-21 08:07:08,"Still adding new videos! We're planning for something big - stay tuned for a bigger, better RedPad!"
2010-06-21 17:37:25,Plenty of traffic so far today - http://redpad.net/ has today's 75 new movies up for views !
2010-06-21 18:19:50,"Holy cow she's hot, http://www.youtube.com/watch?v=immyP7coPhs and she's right there on http://redpad.net/ !"
2010-06-21 18:28:50,RedPad is continually expanding - did you know this hot blonde - http://www.youtube.com/watch?v=jrGwFiH1leg - and... http://fb.me/BgOv5ytV
2010-06-22 05:58:21,"doggone, it's a beautiful day for a quick one after work! http://redpad.net/ has a huge selection of free porn, supporting iPad & iPhone!"
