time,tweet
2010-06-26 00:15:47,"Federal recreation, camping and tour reservation information - Recreation.gov: [2010 Share the Experience Photo Co... http://bit.ly/cDn14c"
2010-06-26 00:15:47,"CNN.com International - Breaking, World, Business, Sports, Entertainment and Video News: CNN.com International del... http://bit.ly/auGFo0"
2010-06-26 00:15:53,Giving the BEST to your little ones...: Kidz Paradise shares the sentiments of adoring parents and the joy childre... http://bit.ly/cLNUAt
2010-06-26 00:15:54,"Games at Miniclip.com - Play Free Online Games: Play Free Online Games, fun games, puzzle games, action games, spo... http://bit.ly/9M0eZ6"
2010-06-26 01:46:04,ESPN: The Worldwide Leader In Sports: ESPN.com provides comprehensive sports coverage.  Complete sports informatio... http://bit.ly/d89Vuw
