time,tweet
2010-04-21 06:47:54,I think you will like this http://acaiberrycleanse.me/
2010-04-30 22:32:53,my best friend just lost 44 pounds in 2 months! here: http://freenews6.courl.net
2010-05-01 16:40:11,my best friend just lost 44 pounds in 2 months! here: http://freenews6.courl.net
2010-05-01 19:20:39,"if anyone is interested in losing weight, this is a must: http://freenews6.courl.net"
2010-06-06 23:18:16,I found a way we can make some extra cash over the summer http://bit.ly/9cZRB9
