time,tweet
2009-10-28 07:13:34,The internet has ended the art of goofing off http://techradar.com/644730
2009-10-28 07:43:14,7 reasons Mandelson's three strikes plan sucks http://techradar.com/645241
2009-10-28 11:37:36,"Heads up: Google Chrome OS release is fake. See small print: ""Chrome OS is not related to Google"""
2009-11-02 05:20:28,Our colleagues over at MacFormat have done a full O2 vs Orange comparison of iPhone tariffs http://bit.ly/nz4QJ - save up to 63p!
2009-11-02 07:07:34,Lunchtime reading: Why hasn't spam been stamped out yet? http://techradar.com/645254
