time,tweet
2010-06-26 00:45:22,Top Paying Affiliate Programs - Please Create Cashflow Before The ...: Top Paying Affiliate Programs When scouting... http://bit.ly/dmeq8R
2010-06-26 01:46:21,Give Away Vacations And Make Extra Income: Give away vacations and make extra money.Continue reading Give Away Vac... http://bit.ly/bVrFO8
2010-06-26 01:46:22,"Strategic Internet Marketing For All Businesses: The Internet has changed almost every aspect of life today, inclu... http://bit.ly/d7B9DW"
2010-06-26 01:46:24,WordPress 3.0 Issues and Surprises: My take on WP 3.0 thus far…So we have all had time to digest the latest WordPr... http://bit.ly/cjAgpt
2010-06-26 02:07:44,Revtwt http://www.revtwt.com
