time,tweet
2010-06-16 10:10:33,[18]I justt gottt alot of followers using http://retwt.me/1NrtW .
2010-06-16 10:18:40,[79] Thee easiestt way to get moree followers is using http://retwt.me/1NrtW
2010-06-16 10:51:40,"And in the end, it's not the years in your life that count. It's the life in your years...."
2010-06-16 10:56:10,Friends are God's way of taking care of us
2010-06-16 10:59:58,Give others freedom to be themselves. Appreciate the differences between their ways an yours. That is friendship
