time,tweet
2010-06-12 11:18:09,watch Live England play Usa watch the game live online for free: http://bit.ly/d8Deg2
2010-06-12 12:37:32,Greaat game! England play Usa watch the game live online for free: http://bit.ly/d8Deg2
2010-06-12 12:53:49,"Lionel messi,worldcup,fifa world,#watchliveFoot,watch live streaming online:http://bit.ly/d8Deg2"
2010-06-12 13:19:25,watch Football(soccer) world cup live Online:http://bit.ly/d8Deg2
2010-06-12 13:32:34,"Lionel messi,maradona,wayne rooney worldcup,fifa world,#watchliveFoot,watch live streaming online:http://bit.ly/d8Deg2"
