time,tweet
2008-08-08 16:54:47,has just joined twitter
2008-08-26 16:23:05,Promises to update Twitter more often... Needs to give it an honest shot...
2008-08-26 16:49:48,is making fondue for his girlfriend tonight.  I'll let ya'll know if it works out!
2008-08-27 10:43:52,my fondue dinner with Janice was good.  (it Turns out homemade fondue is cheaper than the 'Melting Pot' $100-$200) :D
2008-08-27 16:34:28,Just got back from SpeedPitching.  almost all the presenters had great companies.  only one was a little sketchy :-/
