time,tweet
2010-06-12 10:15:58,WORLD FOREX: Euro Decline Speeds As Investors Flood Out Of Risk ...: WORLD FOREX: Euro Decline Speeds As Investors Flo... http://11pta.tk
2010-06-12 20:09:17,Forex PipBot | Pip Bot News & Reviews: Looking for Forex PipBot | Pip Bot Related Forex News & Reviews? Check out the ... http://orz7r.tk
2010-06-13 05:21:38,Forex formula freedom 3-payment plan and a planned four-payment ...: Boys Forex formula freedom are installed on the o... http://mku4b.tk
2010-06-13 20:31:00,"Exports unlikely to affect forex policy: BEIJING, June 14 -- Faster-than-expected export growth in May is unlikely to ... http://1b4qt.tk"
2010-06-14 04:10:19,WORLD FOREX: Euro Hits 1-Week High Vs Yen On Stock Gains: By Miho Nakauchi Of DOW JONES NEWSWIRES TOKYO (Dow Jones)--T... http://6trog.tk
