time,tweet
2010-02-04 22:59:45,Letter from the Mayor | The Folly Current http://bit.ly/9T8kro
2010-02-04 23:43:33,"Insight Zone: L is for Love | The MamaZone: Of course ""L"" is for love, it's the first week in February! What else ... http://bit.ly/aj9rHw"
2010-02-04 23:46:34,Which Debt Company Should I Use to Solve My Debt Problem ... http://bit.ly/cGJGwO
2010-02-04 23:53:08,"HT Mobile G19, Mobile Phone with Trackpad and Dual Camera http://bit.ly/aHbxsW"
2010-02-05 00:22:46,Success In Network Marketing http://bit.ly/9wohHR
