time,tweet
2010-07-15 21:41:52,75% comm // A high converting manual on: A no nonsense straight forward eBook explaining how you can create an ong... http://bit.ly/cKEjZl
2010-07-15 21:41:54,Learning Spanish Like Crazy.: Now paying the highest affiliate commission in the Languages Subcategory. Affiliates... http://bit.ly/9tdYAv
2010-07-15 22:12:44,The Quantum Key by Aaron Murakami - Energy & Potential Mastery!: Get your * Black Belt * in Taboo Physics. Learn w... http://bit.ly/aQt6iv
2010-07-15 22:12:45,RV Freedom Now: 10 Easy Steps to Full-Time RV Freedom: 50% pay-out. New eBook packed with solid how-to information... http://bit.ly/djDIwP
2010-07-15 22:43:37,Grow Taller Book Height-Increasing Program: 75% Commissions! Huge Target Audience! Tiny Competition! 50%+ People W... http://bit.ly/aIZHxK
