time,tweet
2008-09-17 06:32:07,"Trying to be the perfect companion, fighting my way through loads of work and hoping to make band practice ..."
2009-03-06 04:19:15,Friday is the mother of all weekends
2009-08-27 05:03:41,"RT @SevenSnap, die neue Entertainment Shopping App für das iPhone, verlost ein MacBook Pro. Ich bin dabei http://de.sevensnap.com/win.php"
2009-08-27 09:06:17,#verbraucherzentrale gewinnt gegen #google vor hamburger landgericht. #datenschutz http://bit.ly/dZ3JB
2009-08-28 03:47:15,The first #skateboarding school in #afghanistan. #peace http://skateistan.org/
