time,tweet
2010-07-19 07:05:16,World Exclusive video: Time Tra http://www.greattravelIn.com/world-exclusive-video-time-travel-scientist-dr-ronald-mallett-history-channel/
2010-07-19 07:43:47,World Travel Jobs http://www.greattravelinfo.com/world-travel-jobs/
2010-07-19 07:50:40,Pre-Flight Travel Planning Tips http://www.greattravelinfo.com/pre-flight-travel-planning-tips/
2010-07-19 08:07:52,Zobmondo Would You Rather? Pocket Travel Version -  http://www.greattravelinfo.com/zobmondo-would-you-rather-pocket-travel-version-classic/
2010-07-19 08:50:49,Girls in Pants: The Third  http://bit.ly/9Hbf7b
