time,tweet
2010-07-11 23:02:20,Imagine Getting Six Months Worth Of List Growth In Just Days!  http://bit.ly/9PyBW6
2010-07-11 23:09:15,Get A Flood Of New Highly Targeted Traffic To Your Site... http://bit.ly/9PyBW6
2010-07-11 23:10:15,"Invite-Only Joint Venture That Will Automatically Grow A HUGE, Targeted Opt-In Email List For You. Almost Overnight!  http://bit.ly/9PyBW6"
2010-07-11 23:14:25,Want To Grow Your Opt-in List Let US  Do All The Work For You  http://bit.ly/9PyBW6
2010-07-13 13:16:49,Internet Marketing Giant Giveaway Get Tons Of Free Gifts From Guru Internet Marketers... http://bit.ly/b1SVL0
