time,tweet
2010-06-29 02:36:37,"The official fan tweets of ""Heavy Plant Crossing"" has launched. We follow the band and post regular updates of gigs + events"
2010-06-29 04:43:27,"HPC have been asked to assist in the selection of bands for North Somerset & Bristol Rock Festivals by the organisers, details to follow"
2010-06-29 13:19:43,All you really have that really matters are feelings. That's what music is to me - Janis Joplin - American Singer 1943-1970
2010-06-29 13:21:09,"@britney_breyae - Yes im great, thanks for asking. Hope you are well, keep in touch."
2010-06-29 13:24:26,"Check out this tune from heavy plant crossing called ""Tornado"" http://mp3twit.com/37j"
