time,tweet
2010-07-21 13:46:34,Do you think Apple made the correct decision to not recall the iPhone and instead offer a fix? http://bit.ly/cWQHxC #iPhone
2010-07-21 14:11:49,Why haven't you bought the iPhone 4? http://bit.ly/aceBSB #iPhone
2010-07-21 14:49:30,What new iPhone 4 feature makes it a real winner? http://bit.ly/aRI2UH #iPhone4
2010-07-21 16:42:28,What do you think the most interesting Twitter topic of the week was? http://bit.ly/codrbE #Twitter
2010-07-21 17:10:39,Is giving away the free bumper for iPhone 4 owners a good enough response to the antenna problem? http://bit.ly/bSZaMo #SteveJobs
