time,tweet
2010-07-12 16:36:13,"I feel good today,.I'm Feeling Healthy. Thank GOD"
2010-07-12 16:39:47,why We always never knew what we got until its gone..HEALTH.
2010-07-13 15:13:43,The greatest wealth is health.  ~Virgil
2010-07-13 15:50:50,There's lots of people in this world who spend so much time watching their health that they haven't the time to enjoy it.  ~Josh Billings
2010-07-13 16:00:54,The trouble with always trying to preserve the health of the body is that it is so difficult to do without destroying the health of the mind
