time,tweet
2010-07-19 09:59:17,Vroom: AUDI R8 sale date?!? http://www.audi-dealership.co.uk/audi-r8-sale-date/
2010-07-19 10:30:50,Vroom: Audi A8 – the Embodiment of a True Sporty and Luxury Car http://bit.ly/cx390l
2010-07-19 10:31:47,Vroom: New Audi A4 2008 model MSN Cars test drive http://www.audi-dealership.co.uk/new-audi-a4-2008-model-msn-cars-test-drive/
2010-07-19 10:33:43,Vroom: Audi A3 Sportback 2.0 TDI 170 Ambition Luxe S-Tronic GPS Couleur Occasion http://bit.ly/9gmRdN
2010-07-19 10:33:49,Vroom: Audi Smokes BMW? 2010 Audi S4 vs. 2009 BMW 335i http://www.audi-dealership.co.uk/audi-smokes-bmw-2010-audi-s4-vs-2009-bmw-335i/
