time,tweet
2010-07-15 14:55:43,"FREE digital camera, new board game SCRIBBLISH, and $100 for families with kids age 8 and up. Contact jason@compulsivepictures.com ASAP"
2010-07-15 15:53:09,"@djsfreegame FREE camera, new board game SCRIBBLISH, and $100 for families with kids age 8 and up. Contact jason@compulsivepictures.com ASAP"
2010-07-15 16:23:08,"@DadsDealsOnline FREE camera, new game SCRIBBLISH, and $100 for families with kids age 8 and up. Contact jason@compulsivepictures.com ASAP"
2010-07-15 16:24:38,"@mailtohartley FREE camera, new game SCRIBBLISH, and $100 for families with kids age 8 and up. Contact jason@compulsivepictures.com ASAP"
2010-07-15 16:27:21,"@jennaloveeee FREE camera, new board game SCRIBBLISH, and $100 for families w/ kids age 8 and up. Contact jason@compulsivepictures.com ASAP"
