time,tweet
2010-07-14 10:00:33,"Google Top Rank has launched and we are ready to take YOUR business to the top of Google. Stay tuned as we demonstrate, http://bit.ly/a1C8Uv"
2010-07-14 10:11:13,"Ok, u want top Google rankings but it's so competitive! Well, follow along as I demonstrate the power of Google Top Rank, stay tuned rankers"
2010-07-14 10:46:47,Twitter and FaceBook set up July 15th. Watch as I grow the 'followers' and 'likers' and push Google Top Rank to the top of Google - FAST!
2010-07-15 22:55:33,How long does it take to get to No.1 in Google? Well ask my client AFAN and he'll tell you ONLY 1 month! http://bit.ly/aUUXzN
2010-07-15 22:58:32,How long does it take to get to No.1 in Google? Well ask my client AFAN and he'll tell you ONLY 1 month!... http://fb.me/vtZxXVMR
