time,tweet
2010-07-11 01:54:56,Did you hear about the restaurant on the moon? Great food ... but no atmosphere. Ha Ha!
2010-07-11 01:55:34,What do you get when you cross a policeman with a skunk? Law and Odor! haha
2010-07-11 01:57:23,What's the difference between erotic and kinky? Erotic = using a feather. Kinky = using the whole chicken! lol
2010-07-11 01:57:43,What is a cannibal's favorite picnic food? Baked Beings.
2010-07-11 01:57:59,Q. How does a coffee pot feel when it's full? A. Perky.
