time,tweet
2010-07-10 21:28:21,just got new account.. the other ones turned into a stalker page.. lol people on me like its no joke lol
2010-07-10 21:36:35,i am sitting here trying to setup my new office
2010-07-10 21:48:19,Check this video out -- Michael Jordan answers Kobe Bryant vs LeBron James http://youtu.be/pOsamobHeMc
2010-07-10 21:56:15,@dwadeofficial Hey man gotta call u the evil genius. Laker fan here. u got your ring on your own 1 up now bring lames and bosh get u more
2010-07-10 21:57:01,@dwadeofficial and i mean that as a compliment to ya.. why not but either way LAkers 3peat baby... lol
