time,tweet
2010-07-07 15:57:50,"solo puedo escoger entre dos opciones, no le puedo dictar el resultado del Baloto #noinsista"
2010-07-07 15:58:20,"@en_la_prorroga ya me estaba preocupando yo soy el original , jejeje"
2010-07-07 16:10:32,"ya les dije que no tengo nada que ver con este sujeto, no es mi primo, hermano ni nada. http://twitpic.com/23akt3"
2010-07-07 16:13:29,"acabo de firmar contrato con Twitter, fuera ballena inmunda http://twitpic.com/22zutr"
2010-07-07 16:22:32,@diarionocturno solo si esta fresca ....
