time,tweet
2009-06-05 05:20:31,"Holiday deal- 4* Thailand Cosy Beach Hotel, 31 Aug, All Inc, 13nts, other dates avail, most UK airports,£789pp http://tinyurl.com/n6ak5c"
2009-06-05 07:25:21,"Holiday deal, 4* St Lucia, 15 Sep,Almond Smugglers Cove, All Inc,14Nts,more dates avail, most UK airports, £1199PP http://tinyurl.com/nly52o"
2009-06-05 08:20:37,"Holiday deals, 4* Antigua, Hawksbill Beach, 15 Oct, 14nts All Inc,most UK airports, more dates avail, £1199pp http://tinyurl.com/lb6tkl"
2009-06-05 12:20:56,Reviews on hotels you've stopped in needed for new travel R-reviews website- win a trip to Sri Lanka in return. http://tinyurl.com/qdlpj8
2009-06-05 13:16:12,"Holiday deal, 5* Estepona, Costa del Sol,12 July B&B, 14nts from Glasgow, £599pp, other dates avail, http://tinyurl.com/meyj7d"
