time,tweet
2009-12-17 18:44:32,Check out my blog on my newest post in regards to why you need to keeping people you do business with satisfied...
2009-12-17 18:44:54,You can find the post on http://www.sheldonskingdom.com/blog. Enjoy reading.
2009-12-21 09:12:33,"James 3:17 But the wisdom that is from above is first pure, then peaceable, gentle, and easy to be entreated....."
2009-12-21 09:13:18,"James 3:17 Cont: .... full of mercy and good fruits, without partiality, and without hypocrisy."
2009-12-21 09:14:05,Morning all. Hope everyone had a great weekend. Getting started on some good content for everyone to read...
