time,tweet
2009-11-19 07:20:15,loving this site http://bit.ly/3vmTym mentioning the 5 movies rentokil would have ruined blog post  @clarkpest :)
2009-11-19 08:46:12,"Killer bees: nasty sting, not so smart - Short Sharp Science - New Scientist: http://bit.ly/255VPE via @addthis"
2009-11-20 03:10:04,RT @robbrucemcnair: Seven Ways to Create More Time In Your Day http://bit.ly/2gptOe
2009-11-23 03:50:03,Boring holiday photos? Spice them up with some pest photos like Ben does http://bit.ly/1la5S0
2009-11-23 05:55:04,Intolerance is usually unacceptable - but when it comes to pests we promote it http://bit.ly/2qJ6ZQ
