time,tweet
2009-11-13 21:28:58,Army Live » Resiliency Training: The student&#39;s perspective: Since the results of an individual&#39;s survey.. http://bit.ly/4573hb
2009-11-13 21:29:09,Army Live » Resiliency Training: The student&#39;s perspective http://bit.ly/1KLyxo
2009-11-13 21:29:10,Having it large « the nef triple crunch blog http://bit.ly/2ZHXaW
2009-11-14 00:28:35,Southfield school starts kids on adult principles of success http://bit.ly/44aWIz
2009-11-14 00:28:40,"Southfield school starts kids on adult principles of success: This fall, the curriculum at McIntyre Elementary .. http://bit.ly/44aWIz"
