time,tweet
2010-01-18 18:44:50,"""Love is the only force capable of transforming an enemy into a friend.""  MLK Jr."
2010-01-19 08:04:45,CHINA: Google in China: Unanswered Questions http://www.ibls.com/internet_law_news_portal_view.aspx?s=sa&id=1832
2010-01-19 08:06:58,We are healed of our suffering only by experiencing it to the full. -Marcel Proust
2010-01-19 09:56:53,"Compassion, Social Justice, and Haiti: I was watching Rachel Maddow’s show last night (1/21/10) as she interviewed... http://bit.ly/8JRIxP"
2010-01-19 13:26:50,"Medical News: Online Therapy Successful for Depression - in Psychiatry, Depression from MedPage Today: http://bit.ly/8ywys1"
