time,tweet
2009-12-21 04:48:42,New post: Cisco CCNA Career Retraining Insights (http://bit.ly/68IkEn http://bit.ly/5DbehO
2009-12-21 05:53:00,New post: How to Open (http://irvinmoore.com/how-to-open-a-clickbank-account.php) http://irvinmoore.com/how-to-open-a-clickbank-account.php
2009-12-21 05:57:10,New post: Considering Adobe Web Design Training Uncovered (http://bit.ly/8BFw0W http://bit.ly/4Cs4ja
2009-12-21 07:25:11,New post: The Panasonic TX-P42X10 - Worth Considering (http://bit.ly/87xFNC http://bit.ly/7ZFp4r
2009-12-21 07:51:33,New post: Reasons To  (http://irvinmoore.com/reasons-to-use-kelley-blue-book.php) http://irvinmoore.com/reasons-to-use-kelley-blue-book.php
