time,tweet
2009-08-14 20:34:30,"Wow, I Just Pulled This One Out Of The Vault... And Watched For The 4th Time... It Never Gets Old! http://bit.ly/6xzKE ~WATCH IT~"
2009-08-15 00:06:36,Wow! I Heard This Video Changed The Lives Of Thousands Of Reps In Becoming Top 1% Income Earner In Their M-L-M http://bit.ly/95mrq
2009-08-17 00:12:50,IT'S FINALLY HERE! Attn Network Marketers ~Everything Has Changed! The Day Internet Marketing Changes FOREVER! http://bit.ly/6xzKE Please RT
2009-08-17 00:24:58,@JohniLouise Thanks for the support!  You Rock:)
2009-08-17 00:29:54,@jessiegetts Love The Pic:)
