time,tweet
2010-01-22 06:04:26,"Here at last, a way of getting followers on your list to buy, we give you a thousand free ? interested go to http://bit.ly/7mK1NQ"
2010-01-22 07:04:31,"At last, twitter one way followers by the bucket load for no cost, how? Go check it out no catch simple and easy http://bit.ly/7mK1NQ"
2010-01-22 08:04:28,"It’s so easy, the only thing you need to do to get 1000 new one way followers is to go to http://bit.ly/7mK1NQ NOW"
2010-01-22 09:04:42,"Proven steps to make more money, is to get more followers, get your video training for free, go to http://bit.ly/Escalator"
2010-01-22 10:03:37,"Act NOW, to get a thousand FREE one way followers into your account, why are you still here ? go to http://bit.ly/7mK1NQ"
