time,tweet
2009-12-28 19:18:30,Just walked into my homegirl set thinking it's some sexy ladies in here.... Man this shit is a boy scout meeting! Smh
2009-12-28 19:47:29,It's 30 dudes in here with the lights off listenin to bak dat ass up waiting on 2 chicks to finish dancing
2009-12-28 20:16:04,Uh ooohhhh 2 more ladies just walked in.... Now it's 30 to 4!!!!
2009-12-28 20:30:14,The reason why I ain't left yet was because they just put in #shutupandlisten9... Cnt walk out on my own mixtape
2009-12-28 20:38:06,"dude jus walked up to me and asked if I wanted to ""cop some loud""..Nigga u got on mid top air force ones..U sellin Reggie"
