time,tweet
2008-11-27 10:17:06,"we have published our first icon pack, check it out here: http://tinyurl.com/5j63wq"
2009-01-30 05:26:46,"We have released ""Weby Icon"" pack designed by Asher Abbasi especially for our readers. 100 Free icons at 64x64 pixels !"
2009-02-17 04:21:44,9 New icon packs have been added on www.iconspedia.com
2009-03-10 13:02:55,"We have just published ""Were Are My Money"" icon pack on our blog.  http://tinyurl.com/bwdq5r Digg it!"
2009-03-17 07:08:42,Major update on Iconspedia: 6 new icon packs and 118 icons. http://www.iconspedia.com/
