time,tweet
2009-09-05 17:24:36,"Take Action: Sign up to Help An Adult Get a GED, Learn to Read or Learn English http://bit.ly/jHHnh"
2009-09-07 08:31:46,Take Action: Tutor/Mentor Homeless Youth http://bit.ly/2uVEr0
2009-09-08 07:21:06,Take Action: long/short term volunteer http://bit.ly/uxJXC
2009-09-08 12:19:18,"Take Action: Sign up to Help An Adult Get a GED, Learn to Read or Learn English http://bit.ly/19r9hh"
2009-09-08 17:18:01,Take Action: After-school Instructor for Middle School Youth http://bit.ly/uncI2
