time,tweet
2009-07-20 04:12:46,"Tournament: World Series of Poker Day 7 update:  Out of the nearly 6,500 players who started on this long, excit.. http://bit.ly/PHfoM"
2009-07-20 04:12:50,"Tournament: WSOP no longer the only show in Vegas:  As the WSOP Main Event action rages on at the Rio, the heat .. http://bit.ly/nAs91"
2009-07-20 04:12:54,"Tournament: World Series of Poker Day 8 update:  At last, the field of 6,494 hopefuls has been honed down to the.. http://bit.ly/2gK0TE"
2009-07-20 12:49:27,Tournament: Phil Ivey plus eight lightweights at the final table:  For eight of the 2009 WSOP Main Event finalis.. http://bit.ly/pCsdg
2009-07-21 14:20:26,"Editorial: The four strangest attempts to beat the casinos:  There always were gamblers, who didn't understand t.. http://bit.ly/tfX9A"
