time,tweet
2009-11-05 18:24:25,"Listening to the Michael Jackson, This is it album...Listen to samples... http://tinyurl.com/this-is-it-cd"
2009-11-05 18:40:31,"Still pumped from the Yankees win yesterday...sorry Phillies fans, I just can't resist robbing it in one more time."
2009-11-05 19:12:30,"I told my boss ""sayonara""... i share the steps I took here... http://tgli.de/8d"
2009-11-05 20:11:36,"Have you heard the Michael Jackson, This is it single?..Listen to samples... .http://tinyurl.com/this-is-it-cd"
2009-11-05 20:40:36,Don't like your job?... follow what I did... I quit in a little less than 90 days http://tgli.de/8d
