time,tweet
2008-12-27 14:11:39,"Just finished a dynamite team call. Great product testimonials, welcomed new team members, and great training."
2009-10-26 22:21:43,"Tonight, Big Al rocked the house in Philly. If you're going to do the business, you must invest in developing the skills was his message."
2009-10-28 08:52:42,Here's a thought. Your network is your net worth.
2009-11-06 06:13:19,"""Nothing will work unless you do.""  -Maya Angelou, American Writer"
2009-11-07 05:16:02,"""Vision without action is a daydream. Action without vision is a nightmare.""  -Japanese Proverb"
