time,tweet
2009-02-27 00:29:27,We've identified all the bugs in the new site. Now if only we could figure out how to fix it! LOL
2009-02-27 00:41:31,Check out the new site: http://astronutrition.com - No animals were harmed in the making of this product.
2009-02-27 16:53:23,The Habs are going to win the Stanley Cup. You heard it here first.
2009-02-28 01:00:08,is on a 3 popsicle a day limit. This is going to be tough.
2009-02-28 14:34:46,A Beta-Alanine boosting supplement is one of the best supplements for aerobic and anaerobic training. It's true!
