time,tweet
2010-01-07 12:58:33,Chapter 11 news. CIB Marine Bancshares emerges from bankruptcy: By Don Dodson CHAMPAIGN – Central Illinois Bank's ... http://bit.ly/5HG55R
2010-01-07 15:43:48,WSJ bankruptcy news. Connecticut AG Calls On Ski Market To Honor Gift Cards:   Associated Press Richard Blumenthal... http://bit.ly/504MQ6
2010-01-08 08:22:47,WSJ bankruptcy news. The Daily Docket: Reliance Ups LyondellBasell Bid: India’s Reliance Industries Ltd. recently ... http://bit.ly/6KDo0z
2010-01-08 10:41:09,WSJ bankruptcy news. Prudent Lessons From Judge Prudence Carter Beatty:   Kirkland & Ellis LLP Jonathan Henes  By ... http://bit.ly/8bETTM
2010-01-08 15:29:49,WSJ bankruptcy news. It’s Official: 2009 Sets New Default Record At 265:   Getty Images   In case you needed more ... http://bit.ly/6Yinv7
