time,tweet
2010-05-24 23:21:23,"If you want to be happy for a year, plant a garden; If you want to be happy for life, plant a tree. (via @BitOWisdom)"
2010-05-25 02:21:22,English Proverb Faith is taking the first step even when you don't see the whole staircase. (via @BitOWisdom)
2010-05-25 04:04:56,Get paid to pass out free coffee samples: http://Give.CoffeeCures.biz
2010-05-25 04:59:09,Insanely great: iPhone's cool factor proves stronger than the lure of rival ... http://bit.ly/dm1d1T
2010-05-25 05:21:28,"Martin Luther King Jr. Faith can move mountains, but don't be surprised if God hands you a shovel. (via @BitOWisdom)"
