time,tweet
2009-01-26 10:56:37,setting up a twitter account!
2009-01-26 10:59:46,Writing a blog post about valentines day at http://cardcafe.com/blog/
2009-01-26 11:20:17,"Just published blog post about valentines at http://cardcafe.com/blog/ - don't be in the dog house, send your valentines cards today"
2009-01-26 11:50:47,just started following @hashtags to see if anyone is interested in #greetingcards or #valentines #cards
2009-01-26 14:14:52,"@TreesInstead, http://tinyurl.com/depzwz we are green too!"
