time,tweet
2009-08-27 13:53:19,Deepest sympathy goes out to Jack Collison. A brave lad any father would be proud to call his son.
2009-09-01 14:48:42,Plz RT - I\'m capturing followers without sending to twitter using http://quickfollow.com -just launched!
2009-09-03 09:45:36,There is nothing more frustrating than ones who do not try!
2009-09-04 09:06:09,Honestly! I didn't find the Chelsea ban funny whatsoever!! :-D Sorry...
2009-09-14 05:16:39,"@Ammar_Zahar giveaway his Bestselling PLR products, Get it NOW at http://tinyurl.com/freeTPC Turbo PLR Product and Millionaire Uncover f ..."
