time,tweet
2009-09-08 21:14:34,"Play #QHF Reason #2: QHF, free. Leveling up your team, free. Convincing your sig. other to wear the cheerleading outfit? Priceless."
2009-09-09 10:44:24,Barry Sanders -- Part Deux: http://bit.ly/xJHGW
2009-09-09 21:26:53,"Play #QHF Reason #1: When it's done, it's going to be the greatest football video game ever. EVER."
2009-09-15 10:46:43,Quick Hit's CMO on the Future of Fantasy: http://bit.ly/19ObUw
2009-09-15 10:50:31,@AlexOnFyre you won't have to wait until it launch if you requested a key.. you should have it soon..
