time,tweet
2009-09-20 19:24:43,"Good News, I found a NO COST methods, to make thousands or Millions of dollars on autopilot WITHOUT SPENDING ANY MONEY http://bit.ly/CMkDG"
2009-09-22 23:12:29,"Bebo Or Facebook ?Bebo Vs Facebook The Battle Started  We Pay You $20,$40,$60 For You Vote http://bit.ly/drlem"
2009-09-28 23:19:09,I just updated my Squidoo page: Profit Miracle a Scam ? / http://tinyurl.com/yad5v5v
2009-09-30 15:57:05,Watch smooth HD videos with  video acceleration. Accelerate videos from over 150 video sites for FREE  http://bit.ly/VideoAcceleratorFree
2009-10-01 01:50:50,Global Economy 4 U http://bit.ly/z9z6M
