time,tweet
2010-01-30 16:11:07,You and your competitors want the same thing. The only thing that matters is who works the hardest for it.
2010-01-30 17:52:30,"Want FREE Samples? We'll send you vitamins, Colgate toothpaste and other health related samples today! ad http://tinyurl.com/yawc6nt"
2010-01-31 03:14:38,Hajnen Payson Internet Guru about YouTube and YOU | The Internet ... http://bit.ly/b6NBc8
2010-01-31 03:14:40,Internet Marketing: Keeping Track of Your Online Business http://bit.ly/9ovtka
2010-01-31 04:11:45,This works and it is FREE. http://bit.ly/3m6743
