time,tweet
2009-06-26 05:47:10,Official movie trailer - http://creationthemovie.com/ Upcoming Charles Darwin film starring Jennifer Connelly and Paul Bettany.
2009-06-26 12:23:43,Stills from the set of Darwin's study http://bit.ly/293KrV
2009-07-02 11:56:33,"New advance praise for Richard Dawkins' upcoming book ""The Greatest Show on Earth"" - see http://bit.ly/12zYXR (via @RichardDawkins)"
2009-07-15 04:08:16,The world premiere of CREATION will open this year's 34th Toronto Film Festival on Sept. 10. http://bit.ly/APsNo
2009-07-22 04:09:06,"""Creation makes Charles Darwin sexy"", The Guardian http://bit.ly/1EtpQg"
