time,tweet
2009-11-30 13:10:57,For more information on the ReserveAge Organics Cyber Monday 25% off sale take a look at http://tinyurl.com/y8la9pz
2009-11-30 14:52:04,Polyphenols may be able to delay the onset of Alzheimer's according to a Spanish study. http://tinyurl.com/ykelulh
2009-11-30 16:05:05,Intereseting article on new cancer vaccines http://tinyurl.com/yk6suy6
2009-12-01 08:46:36,All things in moderation . . . even working out. http://tinyurl.com/y9t2bgo
2009-12-01 09:52:37,Stifling anger may lead to increased risk of heart attack. http://tinyurl.com/yl9na7l
