time,tweet
2010-05-17 15:18:20,TODAY IS THE LAST DAY FOR $10 PRE-SALE TICKETS FOR KEY CLUB MAY 22ND SHOW THIS SATURDAY NITE! GET UR TIX NOW AT GENESISIANMUSIC.COM TOMORROW
2010-05-17 15:20:56,Check out GENESIS IAN - http://www.reverbnation.com/genesisian
2010-05-17 15:34:24,I subscribed to TnuocehT's channel on YouTube. http://www.youtube.com/user/TnuocehT?feature=autoshare
2010-05-17 15:37:07,I subscribed to TheSportsReportGirl's channel on YouTube. http://www.youtube.com/user/TheSportsReportGirl?feature=autoshare
2010-05-17 15:37:20,I subscribed to fantasysportsgirl's channel on YouTube. http://www.youtube.com/user/fantasysportsgirl?feature=autoshare
