time,tweet
2010-07-25 10:35:30,Image Correction in Office 2010 http://tinyurl.com/25fc358 .. ^guv
2010-07-25 11:29:29,Five Best Book Recommendation Services [Hive Five] http://tinyurl.com/377g6qh .. ^guv
2010-07-25 12:25:52,Smell | Odor | Deodorizer | Smells | Odors | Odour http://tinyurl.com/2vl6u5j .. ^guv
2010-07-25 12:31:09,"The Genealogist: Search Online Census, Birth, Marriage, Death & Parish Record Indexes and Directories http://tinyurl.com/mtod2h .. ^guv"
2010-07-25 12:36:54,Energy Department Has a New Commitment to Solar (and a New Blog) http://tinyurl.com/266efta .. ^guv
