time,tweet
2010-04-12 12:43:31,Mandatory Password Changes Costs Billions in Lost Productivity [Passwords]:                                       ... http://bit.ly/cDYeYH
2010-04-12 13:48:27,Upgrade Your Office Chair on the Cheap [Upgrades]:                                        Office chairs aren't che... http://bit.ly/aZlsZo
2010-04-12 13:48:29,"Google Docs Updates with a Drawing Editor, Real-Time Collaboration, and Speed [Screenshot Tour]:                  ... http://bit.ly/9Wg03B"
2010-04-12 14:55:06,Meet hot new adult film star June Rivers in the sexy and funny series I'M DATING A PORN STAR - http://blip.tv/file/3303992
2010-04-12 16:55:29,Microsoft Announces Two New Social Feature Phones - The Kin One and Kin Two [Video] http://is.gd/bq56g
