time,tweet
2009-12-10 18:04:34,Doutzen Kroes dazzles in a costume:  http://bit.ly/5AHpEX
2009-12-10 18:04:37,"Md. judge rules in Jon Gosselin, TLC dispute; says dad must stop making ... - Gaea Times (blog):  http://bit.ly/51WjI8"
2009-12-10 21:05:06,Do NOT Let the Dentist Fool You! Dentists don't want you to know about THIS teeth whitening secret! spon http://tinyurl.com/yflcrwm
2009-12-11 00:05:58,Tiger Woods - amNY:  http://bit.ly/8cXGxZ
2009-12-11 00:05:59,Editorial: Health reform plan risks sacrificing cost controls - San Jose Mercury News:  http://bit.ly/5x9hAc
