time,tweet
2009-02-20 16:48:43,check my blog at tengreens.com for my $10/day daily update.
2009-02-20 17:30:57,Created a Google Adsense account to drive some traffic to my Flash components.
2009-02-20 18:09:42,I'm selling an HP MINI 1010NR to make my daily 10 Greens. I'll be putting it up on eBay tomorrow.
2009-02-20 19:03:25,Planning an iPhone App for http://tengreens.com
2009-02-21 00:15:47,"Project Liger has begun. I can't give any details just yet, but I'm collaborating with two of my coworkers to develop something cool."
