time,tweet
2009-04-29 09:28:29,nice! another cold rainy miserable day in Chicago!
2009-04-29 16:36:37,"playlist of my favorite classic jazz/blues vocals.  follow the link > click ""Listen To Playlist"" > enjoy: http://tr.im/k3sN"
2009-04-29 16:53:53,@21stcenturyfox how about both... might make for an interesting workout.
2009-04-29 16:54:50,"@workhomexpert well, since you're not plagued with computer issues anymore it appears that i actually have some time on my hands..."
2009-04-29 17:01:21,@21stcenturyfox exactly... but be careful.  drink a glass (or three) or wine before yoga and you may wind up in some unexpected positions.
