time,tweet
2010-01-11 10:02:15,The Latest News About Software Development  From Solentive http://tinyurl.com/ygf37m6
2010-01-11 10:02:28,The Latest News About Web Development  From Solentive http://tinyurl.com/y8uqlxg
2010-01-11 14:04:17,The Latest News About Microsoft  From Solentive http://tinyurl.com/ydhaklk
2010-01-11 20:02:34,The Latest News About Microsoft  From Solentive http://tinyurl.com/ye7jbg2
2010-01-11 22:01:41,The Latest News About Sharepoint Development  From Solentive http://tinyurl.com/yfhr8nb
