time,tweet
2009-03-06 15:02:01,I just joined the Geocaching Twitter Group http://tgr.me/g/geocaching so stop by and see us. #geocaching
2009-03-06 15:46:29,"@DVSGEM And that's my birthday, so it's even more special :) haha"
2009-03-06 16:02:58,I got a BUNCH of Healthy Energy Drinks for free http://tinyurl.com/cueaze If you're in the U.S. you can too... really cool offer!
2009-03-06 19:18:09,"What's your Favorite and Least Favorite Geocache containers? #Geocaching My least fav. bison tube Fav. creative, custom like bird houses etc"
2009-03-06 19:19:17,I'll be announcing a Contest Monday where I'll be giving away some cool #Geocaching prizes. Follow me to see.
