time,tweet
2009-12-02 04:48:25,News: Steele Hill Resorts Selects SPI Orange Software http://bit.ly/88itS9
2009-12-02 04:49:05,New blog post: SPI Orange Software Selected By Steele Hill Resorts http://bit.ly/6wryiT
2009-12-03 10:40:26,News: ResorTime.Com Offers Special Values For Sedona’s Red Rock Fantasy http://bit.ly/6zau3h #news #travel #business
2009-12-03 10:43:28,News: ResorTime.Com Offers Special Values For Sedona’s Red Rock Fantasy http://bit.ly/85dIPQ
2009-12-03 10:43:47,New blog post:  Sedona's Red Rock Fantasy Offered Special Values By ResorTime.Com http://bit.ly/6PFYFs
