time,tweet
2009-11-12 09:06:40,Bet on the NBABasketball betting odds handicappers have a top shelf basketball betting doubleheader on TNT for  Thur... http://bit.ly/2R7bp7
2009-11-12 10:01:32,Bet on the NHLHockey betting odds have seen  the defending Western Conference champion Detroit Red Wings hit the bot... http://bit.ly/1EH4e4
2009-11-12 11:40:02,"BetRoyal'ers - Check out our Weekly Sports Postcard for all the latest. Try it, you might like it @  http://murl.it/PcHyQC.go  ""PLEASE RT"""
2009-11-12 12:50:38,Pacquiao/Cotto Fight Could Help Vegas Economy. It's the fight all have waiting for:  Pacquiao/Cotto will pack them in.
2009-11-13 08:30:09,"For GLOBAL SPORTS INFORMATION  & Scores, check out our Blog here @ http://bit.ly/uxgqX ""PLEASE RT""     Thanks and have a good day."
