time,tweet
2009-12-29 08:34:06,"join @foodforthepoor on a mission trip, volunteer vacations! http://www.foodforthepoor.org/mission/ #jesustweeters"
2009-12-29 09:19:12,One of our Champions for the Poor. Visit their page and donate at: http://www.foodforthepoor.org/chickensforthepoor http://bit.ly/8YzSSe
2009-12-29 09:34:36,"As a man thinks in his heart, so is he. Proverbs 23:7   #jesustweeters"
2009-12-29 10:41:02,"Haitian-Americans to celebrate Haitian Independence Day in Randolph, Massachussetts. http://bit.ly/6EugIJ"
2009-12-29 12:15:59,One of our Champions for the Poor. Visit their page and donate at: http://www.foodforthepoor.org/chickensforthepoor http://bit.ly/91dLLo
