time,tweet
2009-03-10 09:59:58,Hi this is Mimi Ford and this is my first twitter post!
2009-03-13 22:21:46,We had a great Vemma week! Welcome all new members. Vemma is a team sport.
2009-03-14 14:04:04,I am spanked. Road the Shootout. Road 85 miles. http://tinyurl.com/b94ddo
2009-04-05 08:29:36,Off to race my bike. It is a tough circuit race called Tumacacori road race. http://www.roadbikerides.com/ride/view/tumacacori_road_race/701
2009-04-06 23:51:04,Play the Vemma Success Game. It works and it is fun! http://www.tylerandmimiford.com/vemma-success-game/
