time,tweet
2009-12-25 08:31:10,Free Videos On Making Money Using Your Twitter Account. It Couldn't Be Easier!! http://bit.ly/4FE1X7
2009-12-25 09:31:09,Want To Make Some Extra Money Online? Check Out These Free Videos And See How http://bit.ly/4FE1X7
2009-12-25 09:57:53,"Twitter / Jone Wong: Make money on twitter, Add ... http://bit.ly/7iEixp"
2009-12-25 09:57:53,Make Money With Twitter - Your Ultimate Guide http://bit.ly/6W59mY
2009-12-25 10:31:11,Check Out These Free Videos On How To Make Lots Of Money Using Just Your Twitter Account. It Is So Easy!! http://bit.ly/4FE1X7
