time,tweet
2010-01-13 01:55:31,Localizar um grupo Meetup perto de você! - Executive and Business ... http://bit.ly/86DJYV
2010-01-13 01:55:32,WBCNA - Business Coaching Services in North Alabama Small Business ... http://bit.ly/7KXPC8
2010-01-13 04:58:20,Wireless Headsets Rock | Business Coach | Business Mentor | CEO ... http://bit.ly/7TG7jF
2010-01-13 04:58:21,Small Business Coaching http://bit.ly/91qkkU
2010-01-13 04:58:21,"| New Perspectives Business Coaching, Sydney http://bit.ly/4w7ROs"
