time,tweet
2010-03-09 02:00:46,The Latest News About Affilate Marketing  From Howtotweetcash http://tinyurl.com/ykswcft
2010-03-09 03:03:35,If You Want To Make Money With Your Twitter Account You Have Got To See These FREE Videos! http://bit.ly/dBd12N
2010-03-09 04:03:56,"Thousands Of People Are Using There Twitter Accounts To Make Hundreds Of Dollars/Pounds Everyday, Are You ? http://bit.ly/dBd12N"
2010-03-09 05:03:25,Making Money Online Couldn't Be Easier. You Don't Even Need A Website! All You Need Is Your Twitter Account! http://bit.ly/dBd12N
2010-03-09 05:03:25,Want To Make Money?? These Videos Will Show You How To Do It. http://bit.ly/dBd12N
