time,tweet
2009-03-16 21:07:42,"Working on a low-cost web page optimization report to help small businesses get a handle on their web pages, keywords, and SEO strategies."
2009-03-17 16:29:31,Working on a new video for the Web site...and to post on YouTube.
2009-03-17 18:03:57,"@agenteo It's not that search engines hate images, it's just that people usually don't use them the right way, or don't use tags correctly."
2009-03-17 18:08:31,@JamieEdwards Jamie...back in the office...if you're still up!
2009-03-17 18:49:50,http://www.tweepme.com - get thousands of twitter followers automatically  #TweepMe
