time,tweet
2009-12-19 10:49:24,"3,000+ of the hottest most sought after online products, only $9.95 http://www.list-twister.com/link/FounderPosition"
2009-12-19 11:10:55,"You Don't Still Do This, Do You? Are You Still Struggling to Earn Online? http://www.list-twister.com/link/ViralPower"
2009-12-19 11:47:13,"A $9.95 proven system that guarantees you $2,000 - $22,220/month on automatic?!Check it out http://www.list-twister.com/link/FounderPosition"
2009-12-19 11:54:56,They Don't Care About You! Join a Program where Your Success is the Goal. http://www.list-twister.com/link/ViralPower
2009-12-19 13:23:33,Can you click a mouse? Then you can get paid! No fee to participate. http://10477.powerbarclub.com
