time,tweet
2010-02-02 01:49:34,SEO.com Supports Haiti Relief Effort Through Seth Godin Event http://bit.ly/d7W47D
2010-02-02 03:18:16,Upgraded Real Estate Investing Websites Unveiled http://bit.ly/cvZ5Kv
2010-02-02 04:09:25,dhtmlxscheduler:external_plugin:joomla [] http://bit.ly/9LfqE9
2010-02-02 04:25:21,Building a Drupal module with Flex: Fx Gallery : Mihai CORLAN http://bit.ly/d4coQT
2010-02-02 05:35:37,@AshleyJaynes @mavergames @didiermisson @urbanjungleboy @Al_Jaber @voooz  Thank you for your RT's and mentions!
