time,tweet
2009-07-07 17:53:31,"@scottlondon ah, then there's the inalienable rights idealogy, let's not progress to far from those old ideas"
2009-09-11 18:36:15,Working with an amazing new product release @myfdb for fashion week http://bit.ly/qmfTa
2009-09-13 13:18:48,"Fashion Night Out - Hugo Boss, Matthew Williamson, David Bowie tunes at Scoop, Rag & Bones and the banjo man ending with Prabal #NYFW"
2009-09-13 13:33:39,BrandAid/DVF event was amazing.  Great people / art / shoes and truffles.  #NYFW #BrandaidProject
2009-09-14 19:38:07,"Host of the town NY, well at least #Expose at #AKAhotel the launch is launched"
