time,tweet
2010-02-23 09:35:34,"Elvegata, Lillehammer, Norway http://bit.ly/dwq18H #photo #flickr #photography"
2010-02-23 09:37:48,"River Mesna in the spring, Lillehammer, Norway http://bit.ly/9ZERQ8 #photo #flickr #photography"
2010-02-23 09:39:22,"9 new photos from Lillehammer, Norway uploaded http://bit.ly/9Rw4xW #photo #flickr #photography"
2010-02-25 02:20:34,Nice catch on dry fly http://bit.ly/blIM3u #photo #flickr #photography
2010-02-25 02:22:23,Flyfisher http://bit.ly/dwSZp2 #photo #flickr #photography
