time,tweet
2010-01-27 18:44:08,TBLightning Replace the Brass Band with Lightning Girls Jello fightning Pls
2010-01-27 18:50:20,RT @southernmojo: @HockeyBay Love the jumbotron Twitter feed idea! That would rock!
2010-01-27 18:51:53,@Boltskins http://twitpic.com/102tpb - Nice! Get on the jello fightin outfit ! minus the Brass Band Grrrr!!!!
2010-01-27 18:52:51,I am running up there and peeing in the Tuba .... ( Rental return )
2010-01-27 19:04:48,Vinny VL4 Scoooooooooooooooooooooooooooores About F'n time 2-0 TBLightning
