time,tweet
2009-03-25 18:09:18,New Internet Marketing and Professional SEO Blog - http://tinyurl.com/ce94d2
2009-03-26 03:09:17,Understanding What Google Can See On Your Website - http://tinyurl.com/dgwhnh
2009-03-27 02:57:06,"Did you know that daily, mobile internet usage has increased dramatically? http://tinyurl.com/cwhn4m"
2009-03-28 03:24:31,Professional SEO Tips - 20 Things You Should Not Do With Meta Tags - http://tinyurl.com/d6nx9r
2009-03-29 03:45:05,Professional SEO Tips - Why Web Browser Compatibility Is Important - http://tinyurl.com/ck4od5
