time,tweet
2010-01-20 18:58:31,found out some intresting news tonight all i can say is lmfao! ppl should talk n look at themselves before sayin things
2010-01-20 19:21:48,I uploaded a YouTube video -- DJ D ROCK @ the Legendary Sue's Rendezvous (Marcia Brazil Night Jan 15th... http://youtu.be/-Lopjpu0yjQ?a
2010-01-20 22:00:58,@alexisford u in nyc this weekend?
2010-01-20 22:01:31,i dont think there is a word for the amount of work i am about to do!!! lol
2010-01-20 22:05:29,@alexisford e mail me drockpromo@aol.com could network some things if u intrested.www.djdrockny.com read first
