time,tweet
2009-08-25 17:16:27,Kyocera's Ian is a guest trainer for ambassador energy agent training.  http://mypict.me/rbgW
2009-08-26 11:58:03,SMA at Ambassador Energy HQ teaching art of inverters. After Kyocera yesterday we are on the knowledge train! http://mypict.me/rBj9
2009-08-26 12:25:42,"Larry LaPrise, who wrote The Hokey Pokey, died yesterday. Most traumatic part was getting him in the coffin.They put his left leg in..."
2009-08-28 17:08:43,Last day of ambassador energy agent training. Fantastic week. Norcal Socal Chico Dallas Phoenix represent!  Go AE!
2009-08-28 17:15:43,Steve CEO doing last training session.  http://mypict.me/sR8U
