time,tweet
2009-03-30 17:37:46,Always check a ladys shoes before you agree to go out with her. Bad shoes are not acceptable. Happy First Tweet! #seduction #style
2009-03-30 17:52:09,What watch are you wearing? Invest in a timepiece you'll have for years. It's worth it. #watches #breitling
2009-03-30 17:58:16,Got bad choppers? Invisalign is your friend. #teeth
2009-03-30 18:08:15,"Think D'Marge may take the form of a Twitter feed. My thoughts are so random and short, so it's a good fit."
2009-03-30 18:37:13,@TheHairStyler howdie. My associate next to me is into the short sides and long top. it's lookin fresh.
