time,tweet
2009-11-26 22:20:55,Japanese Officials Show Concern as Dollar Slides - New York Times http://ow.ly/164F4E
2009-11-26 23:20:38,China vows to dramatically slow emissions growth - The Associated Press http://ow.ly/164Fw7
2009-11-27 00:21:09,Aussie Financials Distance Themselves From Dubai World - Wall Street Journal http://ow.ly/164FRT
2009-11-27 01:20:46,"Safe-haven flows boost yen, stabilize dollar on Dubai worries - MarketWatch http://ow.ly/164GwM"
2009-11-27 02:20:51,ING prices $11.2 billion rights issue at hefty discount - Reuters http://ow.ly/164GVH
