time,tweet
2009-04-03 10:12:57,"26 day's till exams :(,,,, how am I ever going to be prepared for this pressure  :) only if there was a way??????"
2009-04-03 19:28:10,£750 Billion Injected In Our Global Economy!! Will it be distributed in the right way? Or to the right people?
2009-07-14 16:52:26,I can read me heeeeyaaa :)
2009-07-14 16:57:09,Is wondering if he's got any future  as rapper :) and if he does become the next eminem what would he be called? Gimme some ideas ppl... :P
2009-07-16 08:35:27,busy fool :(
