time,tweet
2010-02-22 18:37:12,New post: Jacksonville kindergarten students fascinated by 103-year-old (The Florida Times-Union) (http://cli.gs/VHdD2)
2010-02-22 18:37:35,New post: Larry Brown Might Be The Right Coach For Tyrus Thomas (http://cli.gs/YYTSH)
2010-02-22 18:37:45,New post: Video: Does Tracy McGrady Still Have it? (http://cli.gs/1jJVX)
2010-02-22 18:37:53,New post: The Trouble With Change (http://cli.gs/jM8e1)
2010-02-22 18:38:09,New post: New Partnership deal with MobilePhoneXchange and e2Save Announcement (http://cli.gs/zPRrE)
