time,tweet
2010-01-14 13:30:22,Join the explosion and join the FUN. You make money and your friends make money!! Take a look. http://www.peoplestring.com/?f=jmoore01
2010-01-14 16:35:16,This economy is tough!! need some extra cash just let me know I can help.
2010-01-14 19:40:15,Winning is not everything it is the ONLY thing!!! Vince Lombardi http://www.peoplestring.com/?f=jmoore01
2010-01-14 22:06:36,Hope the new year is better than last year
2010-01-14 22:45:28,"Live Longer, Live stronger, SO EASY!! blackgrapehealth.com/jmoore01"
