time,tweet
2009-04-12 15:41:09,Updating my real estate blog
2009-05-16 23:23:09,"I Just Increase My Followers By Using The Twitter @OnlineSystem , Try It Out @ http://bit.ly/onlinesystem It's FREE"
2009-06-22 00:58:35,Reading a really interesting blog post on free living in California. You can view it at: http://bit.ly/ZR81F
2009-07-06 10:19:29,Reading a good post on Cap & trade bill and it's new real estate requirements at:http://www.brokerforyou.com/brokerforyou/?paged=2
2009-07-06 12:38:49,Just published July San Diego events at: http://bit.ly/lYYwj
