time,tweet
2009-12-19 11:21:02,Revised Senate health bill cuts deficit: CBO   (Reuters) http://tinyurl.com/yhr9zqg #cash #money
2009-12-19 12:20:55,U.S. opens probe of Diebold unit sale: report   (Reuters) http://tinyurl.com/yfebcuv #cash #money
2009-12-19 16:50:59,Citadel to file bankruptcy as soon as Sunday: report   (Reuters) http://tinyurl.com/y92emw2 #cash #money
2009-12-19 18:51:25,Hynix can spend $2 billion capex in 2010   (Reuters) http://tinyurl.com/ycquxdx #cash #money
2009-12-19 23:21:09,New Macau leader to diversify economy from gaming   (Reuters) http://tinyurl.com/yesvar3 #cash #money
