time,tweet
2010-06-12 09:21:33,"Great deal on Amazon: 'Jesse Stone: No Remorse' by Tom Selleck, Kathy Baker, W... http://amzn.to/amH58P"
2010-06-12 09:25:35,"Great deal on 'Lost: The Complete Sixth and Final Season [Blu-ray]' by Matthew Fox, Evangeline Lil... http://amzn.to/9QTrr4"
2010-06-12 09:40:38,"Check out this Amazon deal: 'House: The Complete Sixth Season' by Hugh Laurie, Lisa Edelstein... http://amzn.to/aPNDX7"
2010-06-12 09:41:21,Shah serious on Rovers bid http://tinyurl.com/34nffjl
2010-06-12 09:55:40,"Check out this Amazon deal: 'The Bounty Hunter' by Jennifer Aniston, Gerard Bu... http://amzn.to/a9uexY"
