time,tweet
2009-04-13 18:16:17,"nueva versión de Windows 7 disponible - build 7106, en inglés, ruso y chino --> http://tinyurl.com/dcen25"
2009-04-13 18:29:58,Cómo actualizar Windows 7 de Beta a RC http://tinyurl.com/ccms4n
2009-04-13 18:40:50,New blog post: Sigue a Windows 7 Noticias en Twitter http://tinyurl.com/dxvegr
2009-04-13 20:48:56,síguenos en twitter! podrás encontrar las últimas noticias sobre windows 7 :)
2009-04-13 23:28:23,New blog post: Anuncia en Windows 7 Noticias http://tinyurl.com/c6kdwz
