time,tweet
2010-01-12 23:00:43,"$28 million home listing is tops for Chicago area|A 26-room, 27,000-square-foot mansion in Winnetka officially .. http://oohja.com/x4KyD"
2010-01-13 00:00:30,Local business briefs -- 1/13|INLANDInvestor buys long-vacant store A Colton retail site that once housed a Kmart .. http://oohja.com/x4KJy
2010-01-13 00:06:35,Mayflower Looks to Restructure Debt: The effort by Rockwood Capital to restructure its $200 million mortgage is a sign  http://url4.eu/17Bjt
2010-01-13 00:06:35,"Ladbrokes CEO to Step Down: Christopher Bell said he would leave the British gambling group, kick-starting a hunt for a http://url4.eu/17Bjw"
2010-01-13 00:06:47,Mayflower Looks to Restructure Debt: The effort by Rockwood Capital to restructure its $200 million mortgage is a sign  http://url4.eu/17Bkm
