time,tweet
2010-06-08 07:14:20,Back from Miami after training with the Biologique Recherche team from Paris. The face remodelling machine is AWESOME.
2010-06-10 19:24:29,"Off to NYC. Training with Aida Bicaj, our celebrity skincare guru."
2010-06-17 18:19:45,"New York, New York....bringing the Face Remodeling Machine and Biologique Recherche to Charleston!"
2010-06-20 20:44:51,Back from NYC. The Face remodeling Machine is in Charleston!!!!
2010-07-03 08:26:26,Get your FREE Apple iPad 3G on us! http://tinyurl.com/2cnupwk
