time,tweet
2010-01-16 19:33:45,Financial Freedom has arrived. Take your first step to success and Major discounts. http://bit.ly/8FeAPV
2010-01-16 19:33:45,FREE videos on making money using your Twitter Account. It couldn't be eaiser!!! http://bit.ly/91cpsE
2010-01-16 20:35:21,Want to make some extra money online? Check out these free videos and see how! http://bit.ly/91cpsE
2010-01-16 21:33:43,CHECK IT OUT!! YOUR TWITTER ACCOUNT CAN SOLVE YOUR FINACIAL TROUBLES. WATCH THE VIDEOS TO LEARN HOW! http://bit.ly/91cpsE
2010-01-16 21:33:44,Build your own mailing list and get PAID for it!! THIS IS A GREAT INCOME SITE. http://bit.ly/6KBX6L
