time,tweet
2010-05-07 12:03:03,@2freshp The Black Surfer  No Color Lines No Border Lines I do it all   http://twitpic.com/1lt36t
2010-05-07 12:07:41,LMAO whatup bro!? RT @ThatDudeMCFLY: @2freshp you think i forgot how sexy your girl is? smh ...lawd
2010-05-07 12:09:26,First Obama now Blk Sufers ..Sh.. What's Next!. LMAO I Love #Socal http://twitpic.com/1lt4jd
2010-05-07 12:10:37,"yea Huntington Beach,  ur n cali too right ?RT @ThatDudeMCFLY: @2freshp chillin man, you live in cali right"
2010-05-07 12:12:27,U can do anything you want with determination and God's blessing. Headed to Go surf Have a Blessed Day!  http://twitpic.com/1lt4jd
