time,tweet
2010-04-20 01:21:17,FROM WEB: Summer Movie Preview: 25 films of note http://adjix.com/ypan
2010-04-20 03:45:54,"FROM WEB: Robert Pattinson And Kristen Stewart New Movie Suggestion: ""Mars Venus""! http://adjix.com/ypbb"
2010-04-20 07:12:28,FROM WEB: Robert Pattinson and Kristen Stewart to appear movie adaptation of Men are ... http://adjix.com/ypdb
2010-04-20 08:43:14,FROM WEB: 'Twilight: Eclipse' soundtrack gets a June 8 release date http://adjix.com/ypdw
2010-04-20 13:14:20,FROM WEB: For Twilight Fans -- Robert Pattinson And Kristen Stewart In A New Movie? http://adjix.com/yphf
