time,tweet
2009-07-18 10:37:10,#iPhone Explorer - Desktop app to access #iPhone as a flash drive. Windows alpha now available. http://is.gd/1Dlug
2009-07-18 18:44:15,Pizza hut now have an #iPhone app and more http://bit.ly/Olq19
2009-07-21 18:40:30,"I've listed myself on http://geofollow.com  in Melbourne , Vic  3013  with the tags  #iphone #mobile #technology"
2009-07-21 20:38:25,#iPhone app lets you find legal pot http://is.gd/1GXNt
2009-07-22 17:59:21,Navigon is one of the first full-featured turn-by-turn GPS navigation apps 4 the #iPhone for US $69.99! No subscription http://bit.ly/e8QmR
