time,tweet
2009-12-03 15:01:18,Richard Florida(Business Week):People under the age of 30 change jobs almost once a year compare to national average of once every 3 years.
2009-12-03 17:00:45,"Be sure to list your most important task, accomplishment or responsibility first on your resume."
2009-12-04 13:00:34,Have a portfolio? Consider putting it online and including the link on your resume. Let your employers see it!
2009-12-04 15:01:12,"After an interview, other than sending your follow up email, wait a week before making any other contact with employers"
2009-12-04 17:00:46,"When emailing resumes, it may be a good idea to convert them to PDFs to avoid formatting issues."
