time,tweet
2010-05-11 12:41:50,"""There is no left to bail out the earth - unless the Martians come"" - Adam Fisher - Commonwealth Opportunity Capital"
2010-05-11 18:02:41,To reduce the carbon footprint you need to reduce the carbon footprinters = support 0 population growth or even better less people
2010-05-11 18:03:28,"if you want to be green, support population reduction on earth - less people is better - planet ain't getting any bigger"
2010-05-11 18:04:35,"A bull market? San Antonio, good economic city, has had 16 straight months of sales tax revenue declines - be a #bear"
2010-05-11 18:09:39,Another one bites the dust - Movie Gallery/Hollywood Video goes bankrupt - be a #bear
