time,tweet
2010-06-14 15:16:26,Gitomer: You can’t afford to ignore social media - Long Island Business News http://tinyurl.com/2f4ns8k
2010-06-14 15:16:33,Steve Daheb Named Finalist in 2010 American Business Awards for Marketing Officer of the YearSM http://tinyurl.com/24h7kc6
2010-06-14 15:42:53,I'm Making Money With My Twitter Account. I Can't Believe How Easy It Is. See For Yourself.  http://bit.ly/cHcme3
2010-06-14 16:15:19,Gulf vacationers wait last-minute or go elsewhere http://tinyurl.com/2f9ofr8
2010-06-14 16:15:19,Elgan: Why you apos;ll use Foursquare - San Francisco Gate http://tinyurl.com/2423t2q
