time,tweet
2009-12-27 09:23:06,What Twitter and Facebook's 2009 Trends Tell Us About Ourselves http://bit.ly/7TxgQR
2009-12-27 09:23:07,Is Kim Kardashian Getting Paid for Twitter? http://bit.ly/5uR458
2009-12-27 11:41:17,Urban Meyer resigns from Florida Gators football hot topic on Twitter (VIDEO) http://bit.ly/7u5hdS
2009-12-27 11:41:18,It's hip to be Square; Twitter inventor has new venture http://bit.ly/4nwYWs
2009-12-27 13:25:40,And Yet Another Use for Twitter: Publishing the Names of Drunk ... http://bit.ly/8UiYxt
