time,tweet
2009-11-26 21:16:16,This Is A 100% FREE System That Will Start Adding Thousands Of REAL Followers In Only Minutes! http://vur.me/s/mtf
2009-11-27 01:18:26,Personality is the most important thing to an actresss success. Shlomo ron joined us as a marketer. http://ihid.us?i=6is
2009-11-27 07:39:25,We have affiliates in Minden new york. Nothing in the world can take the place of persistence. http://ihid.us?i=6i1
2009-11-27 16:29:13,"You Can Win A Weekly Cash & Prize Give Away While Networking & Advertising Your Business For FREE. Crazy, Right? http://budurl.com/tbdm"
2009-11-27 19:39:10,"This Is Your #1 One Stop MLM Resource! FREE ""How To"" Articles, Tips And Ticks! http://budurl.com/ntrain"
