time,tweet
2009-12-15 21:15:18,"Wow, what a wonderful video which made me smile! If everyone knew this secret, the world would truly be a better place. http://bit.ly/5SzNSa"
2009-12-17 04:47:13,An interesting prediction about the future of Google in 2010... http://bit.ly/6EY9bc
2009-12-18 06:42:19,"Personal branding in the social media landscape - ""Monetize that sh*t! - Gary V"" Check the full video here: http://bit.ly/4TnPA1"
2009-12-18 07:04:03,Still haven't got your head around social media? Here's a simple vid which explains it in PLAIN ENGLISH: http://bit.ly/8BU6qS
2009-12-19 07:05:01,Very helpful video - 7 Rules For Social Marketing Effectiveness: http://bit.ly/8xn330. I just put a couple of rules into place right now!
