time,tweet
2010-02-12 22:01:04,Want to improve your life? Ordain it by understanding the physics involved. Visit http://bit.ly/joedweb
2010-02-13 00:01:00,Ordain your own reality by understanding the physics involved...see http://bit.ly/joedweb
2010-02-13 01:00:54,Discover the real secret behind The Secret. Visit http://bit.ly/joedweb
2010-02-13 02:00:59,Ordain your future reality by understanding the physics involved. See http://bit.ly/joedweb
2010-02-13 04:01:10,Create your own reality by understanding the science involved. Visit http://bit.ly/joedweb
