time,tweet
2009-12-21 02:32:26,Hot Jobs In Green Technology – Up And Coming Five Careers In Green ...: It looks like green technology is going t... http://bit.ly/5lEGnn
2009-12-21 08:25:53,"Sandia to evaluate water power technology: AP - December 21, 2009 7:05 AM ET ALBUQUERQUE, NM (AP) - Sandia National... http://bit.ly/8DljDv"
2009-12-21 12:13:22,Defense bill funding military technology projects across Ohio: WASHINGTON — The Dayton region is to receive $4.8 ... http://bit.ly/7qdSRF
2009-12-21 14:25:16,Applications requiring 3 ISA slots and a P4 CPU should consider the bit.ly/UKgTR  combo/kit
2009-12-21 17:24:37,"With ""Avatar,"" Technology Has Never Looked So Human in Film (VIDEO): After all the online buzz (some good, others b... http://bit.ly/6AaL4D"
