time,tweet
2010-06-02 13:00:09,"350,000 – aluminum cans produced every minute."
2010-06-02 13:00:10,The average American uses 7 trees a year.
2010-06-02 13:00:10,70% – Amount of greenhouse gas emissions that have increased between 1970 and 2004.
2010-06-02 13:00:22,The weak can never forgive. Forgiveness is the attribute of the strong. ~Mahatma Gandhi
2010-06-02 14:00:04,Consumers will throw out about 400 million electronics this year. Sell-donate or recycle your old electronics rather than throwing it away.
