time,tweet
2009-09-13 16:59:45,Jews >> Check us out playing Texas Dreidel at LimmudFest South East 09 >> http://bit.ly/1luaos
2009-09-25 10:34:20,Thanks Guys! xo RT @JewishAgency @jewlicious It's a hilarious video! Texas Hold 'Em dreidel :-)
2009-09-25 10:44:38,Dreidel Quote of the Day: RT @EllerSparklez i want a kaleidescope for christmas. and a dreidel.
2009-09-26 10:32:37,RT @skweeds I need to find something to do... I shouldn't be at home on a Friday night singing the Dreidel song.
2009-09-26 22:11:32,"RT @JewDaddysMama i was hyper...had most of a cupcake in my mouth and decided to sing the dreidel song,almost needed the heimlich manuever"
