time,tweet
2009-05-28 12:02:01,RAINY RIVER RESOURCES RECEIVES GOLD RESOURCE UPDATE: INDICATED RESOURCES INCREASE BY 61 PERCENT IN ONE YEAR www.bayfieldventures.com
2009-06-29 09:17:26,(TSX.V: BYV) Bayfield Ventures acquires 2 properties in NW Ontario. Near the former producing Golden Patricia Mine.www.bafieldventures.com
2009-07-24 10:26:37,Bayfield Begins Exploration on Gold Creek Property in Northwestern Ontario. www.bayfieldventures.com
2009-07-24 11:53:53,Bayfield Begins Exploration on Gold Creek Property in Northwestern Ontario http://tinyurl.com/ktcqew TSX.V: BYV
2009-07-28 09:11:38,"Goldcorps Mr. Louis Chastko, PGeo. joins advisory board http://tinyurl.com/ljmahc"
