time,tweet
2010-03-15 07:35:49,"@tassaura Have u thought about getting an online valuation & selling to http://bit.ly/9kCn2X Discover the fast, easy, guaranteed way to sell"
2010-03-15 07:36:51,"@faglaboi If u decide to sell your car, get an online valuation & sell to http://bit.ly/9kCn2X! Discover the fast and easy way to sell!"
2010-03-15 07:39:23,"@Allebone Hi. Have you thought about having your car valued at http://bit.ly/9kCn2X. Discover the fast, easy, guaranteed way to sell."
2010-03-15 07:41:40,@ClareBrownClown Have u thought about getting an online valuation & selling to http://bit.ly/9kCn2X Discover the quick and easy way to sell!
2010-03-15 07:42:55,@raubrey @giocompario will be up for it too!
