time,tweet
2009-05-15 23:14:27,think about words---who they will reach and why those people should be called upon. so said a hopi medicine man while we played 9 ball
2009-05-15 23:42:03,Twitter can be much  like standing in front of a fire and  bellowing. Speaking the unspoken and reaching for a drink when parched.
2009-05-15 23:44:29,http://bit.ly/JdbHg
2009-05-15 23:52:52,http://www.chicoer.com/news/ci_12367149   Disappointing!
2009-05-16 01:32:12,Reading about my followers i love you all
