time,tweet
2010-04-23 08:40:41,Gardeners host annual plant sale in Lakewood: He and other members of the Ocean County Master Gardeners ar... http://bit.ly/bMQsl6 BestBlog
2010-04-23 17:27:50,"California gardener? Plant California natives: ""Water-Wise Plants for the Southwest"" covers the bases for ... http://bit.ly/9lS9LR BestBlog"
2010-04-24 00:09:43,"Experienced gardeners ready to help novices in Community Garden venture: There will be music, comments fro... http://bit.ly/aBmNfu BestBlog"
2010-04-24 03:57:13,"Older gardeners get advice to keep their hobby going: Eddison's new book, Gardening for a Lifetime: How to... http://bit.ly/cNh9l3 BestBlog"
2010-04-24 03:57:13,Master Gardener offers May gardening tips: Introducing your children to gardening can be a rewarding exper... http://bit.ly/b67ezt BestBlog
