time,tweet
2009-09-22 21:52:25,"Price Drop: California Gold Rush (games) - AppShopper.com: All New Apps, Version Changes and Price Changes: iPod.. http://tinyurl.com/lawox8"
2009-09-22 21:52:26,Oktoberfest: Liquid Gold - beer « WordPress.com Tag Feed: As the taps are already open and liquid gold is flowin.. http://tinyurl.com/mpobgt
2009-09-22 21:52:27,"Gold rises above $1,010 an ounce as dollar's slide resumes - I'm A Pimpin Turtle...: NEW YORK (MarketWatch) -- G.. http://tinyurl.com/mzlufl"
2009-09-23 09:41:51,Oikonomika Blog: GATA: Fed admits hiding gold swap arrangements: The disclosure contradicts denials provided by .. http://bit.ly/3udD9r
2009-09-23 21:34:48,Is The Fed Hiding Gold Swap Arrangements With Foreign Central ...: The disclosure contradicts denials provided b.. http://bit.ly/10kzhE
