time,tweet
2009-08-30 07:09:45,@JulieFarin Thanks for the rt Julie :)
2009-08-30 10:40:02,Taking the kids fishing...wish us luck!
2009-08-31 10:45:04,What an awesome day! Hope yours is going well too!
2009-08-31 13:33:56,"Great Strategy for Adults and Kids: Patti Handy is a Cash Coach for Teens, however her advice is sound for all a.. http://bit.ly/xnSjm"
2009-08-31 18:30:53,"""The quality of your life will never exceed the quality of your thoughts.  Change one and you'll change the other."""
