time,tweet
2009-09-25 09:31:08,A step by step video tutorial on how to build RESIDUAL INCOME for LIFE: www.cashgiftingsecrets101.com
2009-09-25 09:31:13,A step by step video tutorial on how to build RESIDUAL INCOME for LIFE: www.TheNetworkingSystem.yolasite.com
2009-09-25 09:31:15,A sure way to make GREAT MONEY ONLINE: www.cashgiftingsecrets101.com
2009-09-25 09:31:18,A system thats BEST of the BEST nothing even comes close RESIDUAL INCOME FOR LIFE: www.cashgiftingsecrets101.com
2009-09-25 09:31:20,A system thats BEST of the BEST nothing even comes close RESIDUAL INCOME FOR LIFE: www.TheNetworkingSystem.yolasite.com
