time,tweet
2009-12-16 13:29:22,Selling on eBay is Dead? No Way! The SellingQueen Makes Over $120K a Month Easily From Her Kitchen Table spon http://tinyurl.com/yclqy6f
2009-12-16 18:15:16,Jimmy got his FREE Iphone 3GS just by entering his zipcode! sounds impossible? Well GET YOURS NOW TOO! ad http://tinyurl.com/ybbjyof
2009-12-16 19:23:44,Internet Marketing Opportunities http://ow.ly/16ar7r
2009-12-17 06:43:31,Internet Marketing: Things You Should Know About Online Training Courses http://ow.ly/16aBim
2009-12-17 23:46:46,Santa Dropped This Macy's Shopping Spree - Get It Here promo http://tinyurl.com/yc5nlz2
