time,tweet
2009-06-29 07:01:42,"Watching: ""Brazzers.com Members Area Stops Working .... NEVER - RRT - Real Rap Talk"" (http://twitthis.com/vpjkz5)"
2010-04-04 21:53:32,"Salam Dahsyat! Administrator Support Online http://www.smart-v.us.tt Memberi bukti,bukan janji. Take action now !!! Nothing is Immposible"
2010-04-12 22:25:47,"I make help US%2410.000 a week for you%2C Sure %21%21%21, http://hubpages.com/t/13b4b1"
2010-04-22 00:48:48,Genuine online money making system...http://www.shoemoneysystem.com/?c=rial_gear@yahoo.com - He\'s giving you $2500 in free advertising!
2010-04-22 00:50:08,"Reading: ""acme-poeple-search.tk""( http://twitthis.com/93hqu8 )"
