time,tweet
2009-06-01 17:55:42,"RT @garymccaffrey has a crazy idea. 19,530 new twitter followers in 30 days? Check it out http://tweetergetter.com/rocinetower"
2009-06-01 18:52:30,"I am surfing affiliate marketing sites at Starbucks. I am hungry so I will go to Super salad soon,."
2009-09-23 13:06:32,I am listening to blog talk radio on the subject of EFT while answering email and advertising my new webpage: www.fullmotionclassified.com
2009-12-25 08:00:17,The Latest News About Twitter Marketing  From Rocinetower http://tinyurl.com/yfd5hz5
2009-12-25 22:00:30,The Latest News About Twitter Marketing  From Rocinetower http://tinyurl.com/yfd5hz5
