time,tweet
2009-11-07 20:30:41,Best Internet Marketing Service Provider
2009-11-09 15:24:50,Now We provide Exclusive Services & Products To Promote Your Business World Wide http://www.myebx.com
2009-11-13 02:19:22,How Much And Why Internet Marketing Is Important Then Traditional Marketing In your Trade And Business?
2009-12-06 11:08:07,SMS Blaster SMS Marketing World Wide. http://myebx.com/e-products.html
2009-12-06 11:09:58,"Video Blaster Submit Submit Your Video to 32 High Page Rank Site, http://myebx.com/Software-Video-Marketing.html"
