time,tweet
2010-07-11 18:02:58,I favorited a YouTube video -- STILETTOS RUN New York City 2009 (professional video) http://youtu.be/Tk4pNfyl2cQ?a
2010-07-11 18:50:02,Facebook Fan page for Stop Child Trafficking -LIVE thanks for fanning & pls RT http://ow.ly/29VFX #trafficking #fb
2010-07-12 13:26:06,"I liked a YouTube video -- #3-Michelle-Jenks, OK ""The Cause"" interv: Stop Child Traffi... http://youtu.be/zPcn1IjvUtc?a"
2010-07-12 13:50:12,TEST
2010-07-12 14:14:10,We are LIVE and thanks for your help! http://Facebook.com/SCTNow
