time,tweet
2010-01-21 00:29:46,Internet Multilevel Network Marketing - The Critical First Step http://bit.ly/70R3yq
2010-01-21 01:56:38,"For Super Bowl XLIV Advertisers, Synergy Is the Name of the Game http://bit.ly/6hjFKN"
2010-01-21 02:23:35,Calling All Guidos: Two Jersey Boys Watch Jersey Shore http://bit.ly/8kc3EM
2010-01-21 02:58:10,Three Network Monochrome Laser Printers Launched by Xerox | PC ... http://bit.ly/7Tmm6d
2010-01-21 02:58:12,Martha Coakley vs. Scott Brown: Who Would Win the Social Media Race? http://bit.ly/4vhKn6
