time,tweet
2009-06-05 12:45:44,Microsoft has unveiled a toolkit for PHP developers building opensource applications that help planned Azure cloud http://tinyurl.com/qd37q5
2009-06-07 05:02:47,php neutral: 40 Tips for optimizing your php code  http://bit.ly/phpneutral
2009-06-09 15:25:09,Developer`s Choice: PHP and MySQL Web Development (4th Edition) (Developer's Library)  by Luke Welling http://bit.ly/leRA1
2009-08-20 05:43:18,"Microsoft has rolled out a free trial of its cloud-based relational database, SQL Azure Database http://bit.ly/S9hJK"
2009-08-31 16:14:53,"Microsoft offers open source link for PHP, .Net http://bit.ly/15Ug0S"
