time,tweet
2009-06-04 17:45:15,I dont know how to work twitter can sumone help PLEASE!
2009-06-10 17:19:00,Waitin on my boo to get home from work he need to help me type this paper..lol
2009-06-12 11:14:41,Just woke up.. finna get my shit together for Super Jam
2009-06-21 13:49:53,U changed U changed   U got dough and changed  Baby U changed (It wasn't the same)   Cuz U got dough and changed   What was I to do  ...
2009-06-22 12:52:37,IF I WAS U I'D HATE ME TOO.. LOUIS VUTTON SHOES AND A WHOLE LOTTA JEWELS
