time,tweet
2009-12-25 04:58:57,PapayaHome: Papayas are known for their enzyme; papain http://bit.ly/5Uqwwy
2009-12-25 09:11:43,"Discovering negative calories, A dieters dream in the aid to ... http://bit.ly/87NbIP"
2009-12-25 09:11:44,WeightLoss EBook(R) :Negative Calorie Foods. « Kdockery's Weblog http://bit.ly/698v5z
2009-12-25 11:55:18,Best Weight Loss Patch & Pills » Blog Archiv » 4 Great Tips to ... http://bit.ly/6QLJq1
2009-12-25 17:59:21,Do celery and apples really give you negative calories Herbs and ... http://bit.ly/4Tryw5
