time,tweet
2009-06-06 02:42:41,I just launched a new website. Check it out:  http://www.BestFreeMoneyInfo.com  Let me know what you think. :-)  Thanks!
2009-06-13 21:25:58,get more info about home business opportunity at http://www.bestfreemoneyinfo.com/blog...
2009-06-18 05:57:02,"RT @garymccaffrey has a crazy idea. 19,530 new twitter followers in 30 days? Check it out http://tweetergetter.com/xcaxtus"
2009-06-19 02:51:21,"I am asking you, the one reading this, if you feel you can succeed in a home based business? check @ http://www.bestfreemoneyinfo.com/blog"
2009-06-19 20:59:53,Huge Package of High Quality Products w/Private Label Rights - @http://bit.ly/39fniU
