time,tweet
2010-06-09 12:00:01,"HOW TO DATE THE BEAUTIFUL WOMEN.: How To Date The Beautiful Women Youve Always Wanted To Date – How To Find Them, ... http://bit.ly/bPtn6q"
2010-06-09 12:20:54,Upper Body Isolation Exercises : Upper Body Workout Equipment: Your core is critical in any workout. Learn the lit... http://bit.ly/9C18mw
2010-06-09 13:18:17,Sultan’s Paste: The Natural Viagra!! You do not even need to go to your doctor. Instant appetite to hoop whatever ... http://bit.ly/cgoe53
2010-06-09 13:39:51,Is there a new New Apple iPhone being launched or just a software update?: Can we discuss it me if there is an tan... http://bit.ly/9jUOeF
2010-06-09 13:57:14,Enjoy Longer Shooting With Digital Camera Battery: Digital camera gives a smashing photography knowledge to a user... http://bit.ly/d7iBhl
