time,tweet
2009-07-03 20:53:01,great trip reports and photos from USA and beyond http://bit.ly/sgDpl
2009-07-03 21:00:50,@PremierMikeRann why would u build a tram line next2 a rail line the park Tce port road xing will be grid lock it's allready 2km long in am
2009-07-03 21:03:15,the new glenelg tram bridge is a total mess grid lock every day works are blocking one lane unessasarly were is the supervision
2009-07-05 01:47:04,The Mojave Desert a great place to visit winter or summer   http://bit.ly/wfoOC
2009-07-07 01:53:39,Adelaide note da taffic jams we waste so much on 1 project we cant afford a freeway  http://bit.ly/sn4OQ
