time,tweet
2009-06-08 21:21:30,"Join my Facebook page @ http://bit.ly/aBhPB .  Updates, images, discounts, and more will be posted!"
2009-06-08 23:28:37,"Info on services, pricing, and contacting me directly can be found on the newly updated web site...http://www.thepetsitter.com"
2009-07-23 10:04:12,Finishing up late morning walk in the woods with big Dali.
2009-07-23 10:08:27,Current clients: want to know what your pets are up to during the day? Email brandon@thepetsitter.com to get added to live updates via t ...
2009-07-23 10:22:53,"Free PETCO gift cards...refer a friend, get $10.  Refer 2, get $25!"
