time,tweet
2009-06-13 10:10:18,Looking for network marketers around the world. I'm really excited about my ACN business. Join me. You won't regret it. That's a guarantee.
2009-06-13 17:53:30,How would u like to be paid each time someone uses their phone? Earn residual income wk after wk...mth after mth....yr after yr. Cool!!!!
2009-06-13 18:00:42,Just added myself to the http://wefollow.com twitter directory under:  #marketing #entrepreneur #business
2009-12-13 06:09:05,TripleClicks Deal-of-the-day: Roller Coaster Tycoon PC Game $5.99 (normally $10.99) http://tinyurl.com/yj8h5wg
2009-12-14 01:23:39,@bobtheteacher @inkedmarketer thanks for your cpanel website lessons today http://www.discovercpanel.com/easy/?videos=2855
