time,tweet
2009-08-24 23:28:38,World #Extreme #Cagefighting & Mixed #Martial #Arts News and Information http://bit.ly/yyaKE #vsmma #mma #wec
2009-10-15 11:18:22,"WEC Notes and Quotes: Harris, Shelby, Semerzier, WEC 43 Replay http://bit.ly/3iatP1 #vsmma"
2009-10-15 16:52:50,"Video: Mir, Varner, Torres Q&A Session in San Antonio http://bit.ly/2d8Kvc #vsmma"
2009-10-16 12:57:23,World MMA Awards Preview: Fight of the Year http://bit.ly/1BkxUT #vsmma
2009-10-16 13:13:04,"Cole Province Suspended, Fined Following WEC 42 Drug Failure http://bit.ly/GMGUq #vsmma"
