time,tweet
2009-07-01 13:33:30,July 2009 Riley Hospital Media Tips: Buzz. Buzz. Buzz. It's insect season! There are many products for sale such.. http://bit.ly/Ac8Ke
2009-07-07 10:33:31,New Strategies to Improve Treatment and Ultimately Prevent Heart Failure in Children: INDIANAPOLIS – Struc.. http://bit.ly/4iOULC
2009-07-15 13:00:49,Making the Difficult Task of Transporting a Child with Special Needs Safer: Study Finds Parents Are Doing Well b.. http://bit.ly/d28am
2009-07-27 13:05:17,"Educators Are Building Capacity in Their Work With Autistic Students: INDIANAPOLIS – Teachers, teaching as.. http://bit.ly/mEmaa"
2009-07-31 17:01:45,Nominate a Riley Champion: Online applications accepted through August 14 INDIANAPOLIS - They face adversi.. http://bit.ly/gd92G
