time,tweet
2010-04-20 03:30:12,Twitter Money Machine Exposed!-The Best Viral Traffic Machine Online! Make More Money Than You Ever Imagined...... http://ff.im/jcix6
2010-04-20 03:30:12,"The Twitter DripFeed Robot Will Practically Launch An Internet Marketing Campaign For You, On... http://ff.im/jcix3"
2010-04-20 03:30:12,"Tweeteronix: Auto-Follow, Auto-Unfollow, Auto-Tweet gives Auto-Grow, Auto-Marketing... http://eCa.sh/7uHH http://ff.im/jciwY"
2010-04-20 03:30:12,The Money Is In The ... PromoneyList http://eCa.sh/ASZs http://ff.im/jciwR
2010-04-20 03:30:12,Secrets of the rich revealed on the Internet: http://eCa.sh/sfi http://ff.im/jcix0
