time,tweet
2009-06-23 14:28:35,Sejam bem-vindos e participem do processo legislativo.
2009-06-23 14:28:40,Visitem o site: http://www.deputadorobertomagalhaes.com.br/
2009-06-23 14:30:23,"Participo agora da reunião ordinária da Comissão de Constituição e Justiça e de Cidadania, da qual sou titular."
2009-06-23 15:37:15,Participei há pouco da Comissão Especial da Regulamentação de Dispositivos da Consituição Federal.
2009-06-23 15:37:58,"Nessa Comissão, sou responsável pelos artigos 136 a 143: da defesa do Estado e das instituições democráticas."
