time,tweet
2010-05-04 23:33:01,Experince our Green Tea Hydrating Body Mist - www.sweetpskincare.com/green-tea-hydrating-body-mist.html
2010-05-05 10:13:02,Pleasure yourself with Honeysuckle Custom Glycerin Soap - www.sweetpskincare.com/honeysuckle-custom-glycerin-soap.html
2010-05-05 10:58:24,Re-energize with our Sunflower Aloe Vera Shampoo - www.sweetpskincare.com/sunflower-aloe-vera-shampoo.html
2010-05-05 11:31:26,Pamper yourself with Tea Tree Custom Glycerin Soap - www.sweetpskincare.com/tea-tree-custom-glycerin-soap.html
2010-05-05 12:02:28,Pamper yourself with Magnolia Blossom Buttery Cream Sugar Scrub - www.sweetpskincare.com/magnolia-blossom-buttery-cream-sugar-scrub.html
