time,tweet
2009-09-01 08:49:34,It truly kills all your birds with one stone:VIRAL Inviter - Invite friends from your social networking sites http://www.MegaPreLaunch.com
2009-09-01 08:53:44,You are invited to www.hugeprelaunch.com
2009-09-01 09:52:38,Sign up for FREE right now to lock your position in this exciting and unprecedented new opportunity! http://www.MegaPreLaunch.com
2009-09-01 10:59:40,YOU MUST WATCH THIS!! http://www.MegaPreLaunch.com
2009-09-01 12:04:46,This HOT new Viral Technology company has just opened their doors for Pre-Launch. YOU MUST WATCH THIS MOVIE!! http://www.Megaprelaunch.com
