time,tweet
2009-06-24 14:02:14,Sie haben Stress? Ich kann Ihnen helfen! http://www.kampfgegenstress.com
2009-06-25 11:58:48,"Sparen Sie bei Ihrer Hochzeit, ohne dass es ""billig"" wirkt. http://www.heiratsplanungen.com"
2009-06-25 12:02:49,"Neue Methode entdeckt: Geld verdienen im Internet. Neu in Deutschland. http://www.themen-theke.de, absoluter Geheimtipp!!!"
2009-06-28 10:03:55,Machen Sie diese Fehler im Vorstellungsgespräch? 100% ig! Jetzt Gratis-Report anfordern auf http://www.wege-zum-traumjob.de
2009-07-03 10:03:23,Vorsicht - das neue Profit-Twitter-Tool laesst Ihre Umsaetze explodieren! http://www.profit-twitter-tool.com
