time,tweet
2009-09-15 10:45:15,Your wallet cannont handle today's game releases. http://bit.ly/nyaqt
2009-09-15 10:51:34,Skate 3 Shreds out in 2010. http://bit.ly/173wZv
2009-09-15 11:28:20,Ars reviews Gran Turismo PSP: portable racing grows up http://digg.com/d314Osu
2009-09-15 13:24:48,RT @hardikupadhyay: Portable Gaming: Can Apple Take Down Nintendo and Sony? http://bit.ly/vVnuN
2009-09-15 13:25:18,"RT @macnewsspot: Updated 8GB iPod touch has lower price, not better gaming: Ars Technica Initial speed tests confirm http://bit.ly/2X9bp"
