time,tweet
2009-06-28 14:02:20,Humanity Has Such Great Potential - The possibilities are beyond the scope of what you can imagine. http://bit.ly/jKLue
2009-06-28 14:04:24,7 Benefits of Meditation http://bit.ly/Vl5Ye
2009-06-28 14:06:24,20 Ways to Get Good Karma -  Instructions for Life by The Dalai Lama http://bit.ly/U1POD
2009-06-28 16:11:33,Spiritual Survival Skills: Our world is shifting. Some of us have felt the tremors deep within our core. http://bit.ly/18iJZv
2009-06-28 16:11:47,"How to Solve Problems: ""When a problem confronts you, take it into the silence of your consciousness. Instead of.. http://bit.ly/Id7W2"
