time,tweet
2009-07-01 21:04:40,did you know a beautiful smile makes you appear more intelligent? http://bit.ly/tBpKu
2009-07-01 21:13:11,I offer free cosmetic dentistry advice at my site www.celebritydentist.com. Send me a question and I'll give you a personal answer.
2009-07-01 23:16:15,See our website: www.celebritydentist.com
2009-07-02 18:51:37,"i just wrote pr in cosmetic dentistry,regarding porcelain veneers vs lumineers,check it out visit www.celebritydentist.com"
2009-07-02 18:57:39,Hey I wrote an article on porcelain veneers & lumineers. Read it here http://bit.ly/2uQ6p
