time,tweet
2009-07-03 21:59:30,"How about a little humor mixed with creativity? I saw this on a tee-shirt. ""Boycott Shampoo.....get real Poo."" Humor for the soul."
2009-07-04 00:08:47,SWOT Analysis For Goal Achieving: SWOT Analysis - the secret to using this tool for your own success. Tap into w.. http://bit.ly/10s2Nc
2009-07-07 16:13:59,Personal Motivation Strategy: Want to know why your motivation doesn't last? You are lacking a personal motivati.. http://bit.ly/MhoAU
2009-07-07 22:12:09,Goal Setting Motivation Theory: Discover the secret of the Goal Setting Motivation Theory and how it can fuel yo.. http://bit.ly/12aLkO
2009-07-08 21:03:59,What Is Success: You want to know what is success? The answer may surprise you. http://bit.ly/2hH6js
