time,tweet
2009-07-07 09:20:07,"RT @bradcallen has a cool, new FREE tool to massively increase the number of Twitter followers you have! http://www.twiveaway.com"
2009-07-10 16:32:18,Join us in August at http://www.powertoachieveseminar.co.uk with coach Andy Harrington
2009-07-10 16:33:58,Simon Coulson internet marketing home study DVD. now available with instalments http://bit.ly/10oa9M
2009-07-14 15:43:56,Checking out internet business in a box marketingmainevent4.co.uk - amazing
2009-07-14 15:44:29,That should have been http://www.marketingmainevent4.co.uk
