time,tweet
2009-07-22 18:03:51,Prova de natação de águas abertas no rio Águeda - Soberania do Povo http://bit.ly/kSTgw
2009-07-22 21:04:32,Albergaria-a-Velha: 500 pessoas dizem não à construção da A32 - Diário de Aveiro http://bit.ly/Y9x4L
2009-07-23 03:05:21,Académica ganha ao Belenenses e conquista Taça Cidade de Águeda - Rádio Renascença http://bit.ly/4cYOh
2009-07-23 06:06:25,Zeinal Bava em Aveiro para apresentação de equipamento português ... - RTP http://bit.ly/wtru4
2009-07-23 09:07:28,Equipamento de fibra óptica revelado em Aveiro - Diário de Notícias - Lisboa http://bit.ly/2iL18
