time,tweet
2009-08-29 20:47:09,@alyson68 Was Tom Cruise involved in what? ..
2009-08-29 20:51:35,#rememberwhen your twitter was a C.B radio
2009-08-30 08:05:29,This is great- Here's your invitation to followe.rs: http://followe.rs/d6
2009-08-30 16:47:05,I'm looking for a business partner to help me test a new system. Must be interested in having 100K followers.
2009-08-30 17:00:43,I'm looking for a business partner to help me test a new system I'm setting up. Must be interested in getting 100K followers.
