time,tweet
2010-06-17 21:11:34,"This is how I eliminated over $40,000 in credit card debt much quicker than I thought possible...http://bit.ly/9CKbsp"
2010-06-17 21:49:01,See how to get rid of debt quickly using the new Millionaire Planner financial success guide. http://bit.ly/c5s7Yy
2010-06-17 22:01:45,Learn how this financial success guide can help you become financially secure by the time you retire...http://bit.ly/9CKbsp
2010-06-17 22:13:50,I recently found this free guide to financial success at MyMillionairePlanner.com...http://bit.ly/c5s7Yy
2010-06-17 23:18:52,"Check out how ""The Millionaire Planner"" ebook can help you eliminate debt and become a millionaire...http://bit.ly/9CKbsp"
