time,tweet
2009-12-23 06:25:15,Taxpayers finance $196000 ride http://bit.ly/6FREE8
2009-12-23 08:22:56,Mexico Finance Minister Cordero Affirms Werner as His Deputy http://bit.ly/7fdwYB
2009-12-23 08:51:33,"If you are looking for a job, hurry and apply while positions are still available http://bit.ly/54u1hM"
2009-12-23 10:23:59,Peru&#39;s New Finance Minister Says 2010 GDP Won&#39;t Reach 9% Highs http://bit.ly/4SME1R
2009-12-23 12:54:12,Massive hiring at: http://bit.ly/54u1hM apply today!
