time,tweet
2009-11-25 17:37:28,Qual a sua principal dificuldade no Twitter e ou Facebook? Quero fazer vídeos tutoriais a esse respeito. Vamos... http://bit.ly/6JKuby
2009-11-25 20:08:47,Happy Thanksgiving Day!!!! http://bit.ly/5xSBDm
2009-11-26 03:35:14,"Oi, @monyki_furuta !  Valeu pera interação. Clique aqui para começarmos a falar sobre esse tutorial sobre twitter. http://bit.ly/8tuSVW"
2009-11-26 03:38:31,Vamos fazer um tutorial sobre Twitter? Clique aqui para escrever suas dúvidas:... http://bit.ly/5FDd2P
2009-11-26 19:43:38,"FarmVille, Mafia Wars ou YoVille? Qual o melhor Social Game? http://bit.ly/6rZahu"
