time,tweet
2009-07-10 16:48:34,Shopping the farms for fresh cigars.
2009-07-10 18:28:04,I am enjoying Nicaraguan evening on edge of tobacco field.
2009-07-11 00:57:06,"It has been a long day, as I lay in this hacienda I can smell the tobacco, that's a lullaby in itself."
2009-07-12 10:39:42,"Made a side trip to a coffee plantation in Costa Rica, tropical mountains, tropical sun, great coffee and a nice cigar, great Sunday."
2009-07-12 23:55:29,Definitely drank too much Costa Rican coffee today. The coffee fields are a site.
