time,tweet
2010-01-27 15:51:28,New York Yankees' Brian Cashman not pursuing Johnny Damon http://bit.ly/dwV5HO
2010-01-27 15:51:29,Rosters selected for All-Star Weekend Rookie Challenge http://bit.ly/cBzYj2
2010-01-27 15:51:30,"No. 4 Syracuse rides teamwork, new star on path to 20-1 start http://bit.ly/9bw2Mm"
2010-01-27 15:51:32,"Rose heads sophomores, Evans freshmen in NBA Rookie Challenge http://bit.ly/byjaoq"
2010-01-27 18:49:31,Text 'Haiti' to 90999 to donate $10 via the Red Cross. Please RT and help #SuppHaiti http://bit.ly/4orvAp (ad)
