time,tweet
2009-07-14 06:15:48,Just added myself to the http://wefollow.com twitter directory under:  #gaming #wii #playstation
2009-07-15 06:11:00,"I just registered an account on Twellow, the Twitter Yellow Pages! My profile is here: http://twellow.com/u/gameszone"
2009-07-20 10:48:25,Waiting for a bus.Most of live seems to be about waiting and searching thats life eh
2009-07-26 09:26:42,visiting westend in london today.just been playing new wii game called beachgames.had an awesome game of tabletennis and archery its awesome
2009-08-03 05:00:10,News...Dont drink that tequilla.Just been discovered that thin layer of diamond can be created by crystallising tequilla.so get crystallisin
