time,tweet
2010-02-04 20:36:15,Metal Hammer » Blog Archive » Gene Simmons: “Michael Jackson Was A ... http://bit.ly/bzJ336
2010-02-05 01:36:26,Officials debate whether to allow Michael Jackson&#39;s doctor to surrender http://bit.ly/dp0hGA
2010-02-05 04:36:14,Janet Jackson and Jermaine Dupri Reunite ... on New Album http://bit.ly/bAiu0z
2010-02-05 04:36:15,Seniors&#39; Michael Jackson dance a hit on YouTube http://bit.ly/9hLBOQ
2010-02-05 07:36:30,Anorak News » Blog Archive » Michael Jackson Tomb Tour: Pictures ... http://bit.ly/bHDCTJ
