time,tweet
2010-01-22 12:40:02,NOW OPEN FOR SUBMISSIONS! Video contest- What's unique about being black? http://ow.ly/ZopN
2010-01-22 13:10:33,Check out our new video and please help us spread the word about our monthly video contests! http://ow.ly/ZsCV
2010-01-22 13:36:28,@therealamaru Thank you for the RT and helping us spread the word about our monthly video contests! http://www.reelinsights.com/
2010-01-22 14:05:03,Thanks for helping spread the word! RT @videocontests What's Unique About Being Black? Video Contest. Prize: $2000! http://bit.ly/7D0Dud
2010-01-22 15:25:02,"Visit http://www.reelinsights.com/ for more info on our latest contest, ""What's unique about being black?"""
