time,tweet
2009-07-21 03:38:15,How one small business is growing http://tinyurl.com/nm9z5c
2009-07-21 04:49:01,The potential of Twitter marketing for small businesses quite exciting http://bit.ly/13bWS7
2009-07-23 03:34:38,"Amazon buys Zappos.com , maybe their biggest rival in the US.  A good deal for them? http://tinyurl.com/lb2ywm"
2009-07-23 03:44:44,One in three small businesses are unaffected by the recession http://tinyurl.com/lptsvj
2009-07-23 04:46:47,The productivity trap http://bit.ly/4CLoce
