time,tweet
2010-01-29 07:50:09,Bem vindo ao Twitter da Telium Networks. by Marketing
2010-02-02 10:14:07,RT @fferragi: Confira o currículo ideal de um profissional de TI http://bit.ly/c0uolp (Entrevista com o Gerente de Produtos Fabio Ferragi)
2010-02-03 05:12:21,Telium Networks entrará no mercado Outsourcing para pequenas e médias empresas....http://telium.com.br/noticias/show/id/31
2010-02-03 05:16:00,Telium anuncia parceria com a fabricante de equipamentos de segurança da informação SonicWALL.  http://telium.com.br/noticias/show/id/32
2010-02-03 09:20:40,"Teste hoje mesmo o Telium Backup Online, disparada a melhor ferramenta de backup remoto do Brasil _mkt http://telium.com.br/backup-dados"
