time,tweet
2009-09-28 14:09:25,RT @seeingchange Now you can predict the fate of the world! Google unveils Climate Change Map http://ow.ly/rtkP (via @oppgreen @ecorazzi)
2009-09-28 16:32:06,Please help save America's ribbon seals: http://bit.ly/95U7c #ecomonday #eco
2009-09-29 17:41:48,Fascinating: The Calcium Myth http://bit.ly/P2gGu #health #food #wellness
2009-09-30 13:58:16,RT @greenbiztweets: Nike just did it:  Nike Quits Chamber of Commerce  Over Climate Policy  http://bit.ly/zIdrw [well done #nike !]
2009-09-30 17:31:47,Which Plastics Are Safe? Quick list: http://bit.ly/1DZ1DE #greenliving
