time,tweet
2010-01-21 13:40:42,"45 Leads in ONE day using Free and Low Cost Marketing, Get Yours:  http://www.winmymarket.com"
2010-01-21 13:52:43,"GET YOUR FIRE BACK - ""For this reason I remind you to fan into flame the gift of God, which is in you..."" II Timothy 1:6"
2010-01-21 14:05:44,"ACT on Your Dream Today -""Write the vision and make it plain on tablets, that he may run who reads it."" - Habakkuk 2:2"
2010-01-21 14:20:45,"KEEP Stretching- ""Enlarge the place of your tent, stretch your tent curtains wide, do not hold back...""- Isaiah"
2010-01-21 14:35:46,"Would you like me to give you the secret of success?  It's quite simple, really.  Double your rate of failure.-Thomas J. Watson"
