time,tweet
2010-01-20 22:19:53,Blake Lively says sex scene in her new movie 'made her cry' http://bit.ly/5L39I8
2010-01-20 22:19:54,Avatar Na'vi Sex Scene (NSFW) | The Movie Blog http://bit.ly/6Cbl49
2010-01-20 22:19:55,"ON THIS DAY IN MOVIES: SEX, LIES AND VIDEOTAPE - Hollywood ... http://bit.ly/8g78uX"
2010-01-20 23:32:32,Album Review: Various Artists - <em>Crazy Heart (Soundtrack)</em> http://bit.ly/7AqUYu
2010-01-21 02:51:47,Farrell's Sex Scene Snipped From Ondine http://bit.ly/6bPd59
