time,tweet
2009-07-19 19:21:05,"Looking for Guarenteed Success? We provide 10,000 OPT-In Prospects!http://bit.ly/BEZEK"
2009-07-19 19:22:07,Official Worldwide Launch! (video) http://bit.ly/BEZEK
2009-07-19 20:03:46,"If you could use 10,000 ""exclusive"" opt-in leads PER MONTH -Get in Position! http://bit.ly/yU8sm"
2009-07-19 20:04:23,"RT @DanC01 Empowering Stay at Home Moms, one at a time.... http://bit.ly/PkW6f"
2009-07-19 20:05:06,RT @marykory2The gift of life and the gift of love comes from God
