time,tweet
2009-07-19 21:36:21,@SocialMediaMo_ Hey there!
2009-07-19 22:31:41,I am a friend of @SocialMediaMo and he told me he has the greatest people following him.
2009-07-19 22:47:17,@BarbaraFriedman Thank you for the follow. Just got started with Twitter so any help would be appreciated.
2009-07-19 23:16:26,The only people with whom you should try to get even are those who have helped you - John E. Southard
2009-07-19 23:17:46,It is amazing what you can accomplish if you do not care who gets the credit - Harry Truman
