time,tweet
2009-07-21 04:56:18,"I want to see the new Harry Potter movie, but its 3 am. haha!"
2009-07-21 05:39:40,Alrighty well thank you everyone who is already following me! Hopefully we can get to know/ learn from each other. Im off to bed Good Night!
2009-07-21 16:11:06,"i just saw something called ""Comic-Con"" on the side of my page... What on earth is Comic Con?"
2009-07-21 21:33:23,Does anyone know when the new season of Hell's Kitchen is? I love Gordan Ramsey haha hes such a donkey!
2009-07-23 06:53:25,"LOOONG night, and EARLY morning... ughh."
