time,tweet
2009-07-20 19:33:58,Hello soccer fans. The countdown is on to the World Cup in South Africa 2010.
2009-07-20 19:56:00,Just got this background for my twitter profile at http://www.wishafriend.com/twitter/backgrounds/
2009-07-23 21:42:39,RT @Soccernet: ESPN Soccer Net News Beckham reiterates his commitment to Galaxy http://bit.ly/6HNlP
2009-07-23 21:43:08,RT @RUWTsoccer: Head of US World Cup bid not ruling 2018 out http://ruwt.tv/soccer/news/108556
2009-07-26 20:22:21,"RT @bellalucia: in other soccer news, USA just lost spectacularly to Mexico , who scored 5 goals on us...."
