time,tweet
2009-07-22 02:22:11,"If you pleased, come visit my blog at: http://tinyurl.com/kmyaem"
2009-07-22 03:03:52,@disamaharani momi gi ke mana cah ayu..
2009-07-22 03:15:31,Wanna know health and fitness tips for free? see me @ http://tinyurl.com/kmyaem
2009-07-23 10:57:46,Do NOT Pay For White Teeth! Learn the trick discovered by a mom to turn yellow teeth white for $5 http://tinyurl.com/nn4m6n
2009-07-23 16:32:30,Check out the different ways Acne and Acne Scars can be treated. Get real answers to your acne problems. http://tinyurl.com/mj4bpk
