time,tweet
2009-08-29 16:15:40,Kehrseiten sind selten gekehrt. (Erhard Horst Bellermann)
2009-08-30 13:15:31,"Jede unangenehme Empfindung ist ein Zeichen, daß ich Entschlüssen untreu werde. (Jean Paul)"
2009-08-31 03:23:15,"RT: @easytouch Brilliant! ;-) RT @philshealthinfo ""The only way around is through."" #quote @spruch"
2009-08-31 10:15:33,"Die Ähre beugt sich, in welcher Körner sind; die aufrecht steht ist Spreu und fliehet vor dem Wind. (Alter Spruch)"
2009-09-02 04:16:05,"Klopf' auf den Ton: in Staub wird er fallen; Schlag' den Achat, und Funken wallen. (Anastasius Grün)"
