time,tweet
2009-09-20 23:11:19,Make sure you have a ping list-bit.ly/3W9PeC
2009-09-21 03:06:54,Blogging is way to keep visitors coming back for more-bit.ly/3W9PeC
2009-09-21 05:06:16,Investigate affiliate marketing as a very low expense method of doing biz on the net-bit.ly/3W9PeC
2009-09-21 07:05:45,Working you way to great success is fully attainable if the right strategies are utilized-bit.ly/3W9PeC
2009-09-21 09:05:56,Newbie affiliate marketers don't understand that you need to be creative and flexible at the same time.-bit.ly/3W9PeC
