time,tweet
2010-01-31 17:37:29,Samantha Harris Leaves Dancing with the Stars http://bit.ly/a6MYPz
2010-01-31 17:49:47,Brittany Murphy's widower is suing Warner Brothers http://bit.ly/aDQLVW
2010-01-31 18:04:04,"When in Rome star Kristen Bell on love, luck and clumsiness http://bit.ly/9wzZwB"
2010-01-31 19:00:21,"Cell phone ban grows teeth: By TAMARA CHERRY, Toronto Sun Drivers caught using a hand-held electronic device — tha... http://bit.ly/a2xZuZ"
2010-01-31 19:30:54,Gossip & Entertainment &gt;&gt; more Gossip & Entertainment http://bit.ly/aan55f
