time,tweet
2010-01-27 15:18:40,California Home Mortgage Defaults Drop in 4th Quarter http://bit.ly/d3cfsf
2010-01-27 15:49:07,Home Depot laying off 1000 employees: memo http://bit.ly/bvBcIe
2010-01-27 15:49:15,John McCain faces tough polls at home - Full Comment http://bit.ly/d7ZPoj
2010-01-27 15:49:18,Honda&#39;s home garage gadget: Here&#39;s your solar hydrogen fueling ... http://bit.ly/czDY7c
2010-01-27 15:49:21,Conduct Free Background Checks: Business Essential or Creepiest ... http://bit.ly/bziqYN
