time,tweet
2010-02-19 06:26:02,Hot: Girl Let's Go new single release early march... Paris where r u... I'm destined to meet u....
2010-02-19 06:33:37,BigRox ppl...Now there's creativity... Threedots behind the lense... What a combo!!!
2010-02-19 18:03:00,Once again I sit in this dark room... Does anybody know where the light switch is?!?
2010-02-20 00:04:26,I believe it...I can see it...Touch it feel it...Yes I breathe it...and achieve it...Let me get inside your mind so I can free it...Ferreira
2010-02-22 13:53:17,Big ups BIGROX...
