time,tweet
2010-06-22 16:18:31,sera que con la llegada de #XboxLive a Colombia y atros de Sur America se nos facilitaran los pagos y ofertas? #yoquiero
2010-06-22 16:27:07,que tesos #TWITTERART wow
2010-06-22 16:33:26,RT @OXM_Mexico Microsoft anuncia paquete familiar de Xbox LIVE GOLD | La Revista Oficial de Xbox http://bit.ly/cow1ZF
2010-06-22 16:50:34,"no quiero una BB, soy feliz con mi Nokia 5530 ;)"
2010-06-23 08:24:31,"Video: Crystal Castles: ""Celestica"": http://bit.ly/aDhNhr via @addthis para comenzar la mañana"
