time,tweet
2009-11-09 09:49:51,Key Features Of Online Forex Trading | Strategic Internet ... http://bit.ly/11oFFf
2009-11-09 15:50:43,Put Out Less Money When You Buy A Bank Owned Property | Forex ... http://bit.ly/1FPDSx
2009-11-09 21:34:05,FOREXYARD Introduces Forex Automatic Trading – Forex Factory ... http://bit.ly/1dfoZp
2009-11-10 03:09:07,Unregistered dealer allowed to raise millions for risky trading scheme http://bit.ly/f9MJn
2009-11-10 09:01:02,Completed e-book on trading psychology http://bit.ly/10tSfg
