time,tweet
2009-07-27 01:49:06,Just learning twitter
2009-09-02 14:36:20,"RT- Amazing Webinar: Sourcecode Millions System Does 51,016 Subscribers, $276,488 on Autopilot: http://www.sourcecodemillions.com/blog"
2009-09-13 20:56:37,"Reading: Bad News Reporting: It's Not A Bug, It's A Feature! at Power Line http://www.powerlineblog.com/archives/2009/09/024513.php"
2009-09-19 14:57:40,I'm wondering what the big cheese's of the fringe media are thinking now...losers...lol
2009-09-20 14:41:35,Join Me at The Bar http://bit.ly/3kyZTa via @AddToAny
