time,tweet
2009-11-22 06:53:48,Likes The Official Website of Arsenal Footb...: My favourite football club - http://likaholix.com/r/pa1 #teams
2009-11-22 07:00:56,Likes Friends: The bset show in the world. I never get bored of it - http://likaholix.com/r/pa4 #tv shows
2009-11-22 07:09:31,Likes Apple iPod Touch: I never get bored of it and there is so m uch thing to do on it such as app... - http://likaholix.com/r/pa5 #gadgets
2009-11-22 07:11:14,"Likes Automobili Lamborghini Holding Spa: Beautiful, slick and fact car - http://likaholix.com/r/pa6 #cars"
2009-11-22 07:11:16,"Likes Automobili Lamborghini Holding Spa: Beautiful, slick and fact car - http://likaholix.com/r/pa7 #cars"
