time,tweet
2009-07-31 21:05:47,I'm so excited about my biz...iJango..it launches Aug 1st and it's going to be big. see www.everythingijango.ijango.biz for more info.
2009-08-01 11:34:43,today's the big day....check out this site www.everythingijango.ijango.biz
2009-08-01 11:35:51,iJango is a Web portal that allows you to access all your favorite sites from one central location.
2009-08-02 13:08:41,"Check out my newly registered profile on Twellow, the yellow pages of Twitter: http://twellow.com/u/everythingijang"
2009-08-02 14:04:59,Cleaning the pool...I hope the sun comes out today!
