time,tweet
2010-01-01 11:54:09,Vielen Dank für das tolle Feedback zur neuen  http://www.guioaugustin.com @MoeWa @presentationDE @zwoelftermann
2010-01-02 08:26:22,"Schöne BUZ über Loddar, seine x-te Frau, Sandy M-W und andere. http://twurl.nl/pbwbzd"
2010-01-02 11:35:05,Hihi. Ich telefoniere gerade mit der T-Mobile-Geschäftskundenbetreuung. Die Dame versucht gerade mit Vorges. meinen Tarif zu verstehen ;o)
2010-01-02 11:36:05,Jetzt klärt sie die Widersprüche ggü. den jüngsten Auskünften. Aber nett sind sie. #t-mobile #warteschleife
2010-01-02 11:42:50,Autsch RT @LudwigArtzt: Da wollte jemand beim #NDR wohl besonders witzig sein... Böses Foul! #fail #autsch http://bit.ly/7sygaD
