time,tweet
2010-02-15 19:26:03,V-Local Reports Exponential Growth Following January Launch (source: Big News Network): V-Local is confident that ... http://bit.ly/9Tha5K
2010-02-15 19:28:34,Adviser to Americans admits link to Salvador case (source: SF Gate): The man who served as legal adviser to 10 Ame... http://bit.ly/aAJ8yK
2010-02-15 20:33:12,Ottawa ready to tighten mortgage rules (source: The Globe and Mail): New mortgage rules set to be introduced Tuesd... http://bit.ly/90CbQs
2010-02-15 21:37:11,Flaherty to toughen mortgage rules (source: CBC): Finance Minister Jim Flaherty will announce new rules Tuesday ai... http://bit.ly/cCIGNY
2010-02-15 23:43:33,"Australia Earnings Helps Shares (source: Wall Street Journal): Asian shares were higher Tuesday, with stronger-tha... http://bit.ly/9cU0BM"
