time,tweet
2009-12-10 07:56:06,Bank of England: UK Interest rates remain at 0.5%s
2009-12-11 06:16:46,"Property: Dictionary of the decade :  Flipping, gazumping and über commuting. Our guide to the property termino.. http://bit.ly/4Uat9s"
2009-12-12 09:35:01,What price for the X Factor house?:  The owner of the X Factor house in Hampstead hopes publicity from the show.. http://bit.ly/8BPII8
2009-12-14 07:28:28,Property market: the perfect place for a Christmas tree:  What we're looking for on the property market this week. http://bit.ly/756aNz
2009-12-14 08:57:02,"“Don’t count the days, make the days count.” – Muhammad Ali"
