time,tweet
2010-06-11 23:55:54,“Maybe our favorite quotations say more about us than about the stories and people we’re quoting.” —  John Green
2010-06-11 23:56:09,"“I don’t want any more of this try, try again stuff. I just want out. I’ve had it. I am so tired. I am twenty and I am already exhausted.”"
2010-06-11 23:57:07,Every time I hang out with my friends its like an episode of Sex and the City. #fb
2010-06-11 23:59:33,"Putting my smile away, and on with the day."
2010-06-12 00:00:24,"Fave song right now it’s Alejandro. I know, how bandwagon of me. But trust me, I liked it waaaaay before it started playing on the radio."
