time,tweet
2009-12-07 19:39:59,"World's Weirdest Travel Gadgets - Articles: Metal-detecting sandals, self-propelled suitcases, and bacteria-disinfe... http://bit.ly/8ZXdiy"
2009-12-07 20:47:08,"America's Best Pizza - Articles: American Express Publishing (""AEP"") may use your information to send you account u... http://bit.ly/6NcWD5"
2009-12-07 22:01:59,Transportation Basel-Freiburg-Colmar-Stasbourg | Europe: I'll be spend a few days in this area. I'm not sure of the... http://bit.ly/4EslJD
2009-12-07 22:03:26,It's The End of the World as We Know It So Get Out Your Camera: Conspiracy theorists and the History Channel have s... http://bit.ly/7kv1Rk
2009-12-07 23:12:18,Senior discounts in Paris | Europe: What senior discounts would be available to us in France and what is the age th... http://bit.ly/8ksAAW
