time,tweet
2009-12-20 05:03:49,"I hope being a 'Buddian' works xP and Christian and Buddhist..I mean, all Gods and Lords are the same right? Their 1 person only? I think.."
2009-12-20 05:05:20,hm..but..I do wanna show my talents to the ppl in church..Their just so nice :) I shaked hands to so many people. And it was amazing ;)
2009-12-20 05:10:23,ohh and Lilian was in the play 'Esther' singing actually ;)
2009-12-20 05:11:15,"oww, I needda update my blog..but there's no pictures to make it interesting ): *sigh* I forgotten to bring my camera..that's why. -.-"
2009-12-20 05:11:45,"BUT! it's okay, i'll just do whatever I can do without the pictures.. haha!"
