time,tweet
2010-01-29 03:26:52,L'Allemagne au jour le jour du 28 janvier 2010 http://bit.ly/c4D8PK
2010-01-29 03:50:28,Freight train derailment reroutes commuter traffic http://bit.ly/9LhQeU
2010-01-29 03:55:39,Check out the Pocket-German Store: www.tinyurl.com/pocketstore
2010-01-29 03:57:31,Football : la sélection allemande se présente sur son nouveau site web http://bit.ly/bPOYBh
2010-01-29 03:57:31,"La banque publique KfW octroie 7,2 milliards d’euros aux PME allemandes http://bit.ly/b2r1Xe"
