time,tweet
2009-08-07 03:52:07,"Aktuelles und Neues aus den Bereichen Steuerberatung, Coaching & Meditation finden Sie unter http://news.drgross.eu"
2009-08-07 03:56:44,Begleiten Sie uns durch Rütte im Schwarzwald Wirkungsstätte von Graf Dürckheim und Maria Hippius - http://traumland-film.blogspot.com/
2009-08-07 06:16:11,Dr. Jürgen Groß nun auch auf twitter: http://gruendercoaching.drgross.eu www.nlp-coachingpraxis.de www.konflikt-begleitung.de
2009-10-15 05:24:50,"Steuerberatung, Rechnungswesen, Coaching und Begleitung in allen wirtschaftlichen Angelegenheiten aus einer Hand - WO? in Melsungen /Kassel"
2009-10-15 05:25:49,integrale Unternehmensberatung bezieht den ganzen Betrieb und seine Teile in die Beratung mit ein
