time,tweet
2010-02-15 10:33:04,Adobe takes Android out for some AIR - ZDNet UK: Telegraph.co.ukAdobe takes Android out for some AIRZDNet UKAdobe has i http://url4.eu/1PU4S
2010-02-15 11:04:57,Bioshock 2 tops UK game chart - Techwatch: MCVBioshock 2 tops UK game chartTechwatchBioshock 2 has topped the UK all-fo http://url4.eu/1PV69
2010-02-15 11:08:54,"Apple iPhone upgrades fuel fraud, insurer claims - Macworld UK: Macworld UKApple iPhone upgrades fuel fraud, insurer cl http://url4.eu/1PVLK"
2010-02-15 11:29:23,Iphone users are fraud kings - Inquirer: Telegraph.co.ukIphone users are fraud kingsInquirerWHILE MANY may see Iphone u http://url4.eu/1PVzL
2010-02-15 11:52:38,Google Buzz redesigned after social network provokes privacy complaints - Daily Mail: ReutersGoogle Buzz redesigned aft http://url4.eu/1PWka
