time,tweet
2009-08-11 12:09:48,"Trying to get Twitter to recognize my email. I have tried deleting my old profile, but Twitter doesn't seem to get it."
2009-08-11 12:14:40,Some great boats for sale in Rhode Island. Let me know what you're looking for and I'll go find it for you.
2009-08-12 09:09:06,It's about time I learned how to blog. Lots of boating news to share with all the Rhode Island boaters out there. Working on it  now.
2009-08-12 09:13:08,My first official mobile tweet. Now what?
2009-08-12 14:53:48,Taking a break from boats to my other favorite pastime - soccer. Watching the US- Mexico game on my laptop at www.veetle.com cool site
