time,tweet
2009-12-30 09:15:19,Mother's new weekly flyer is now available here: http://cli.gs/vy0buhttp://cli.gs/HtUJJ
2010-02-09 13:54:00,Be sure to vote for Mother's on the MyFoxLA.com poll for best organic supermarket: http://cli.gs/AA4pA
2010-02-11 20:11:36,"All New! Catch the Mother’s Market Radio show next Saturday, Feb 20 at 10:00am sharp! Tune in to KLAA 830 AM"
2010-02-19 14:34:52,Don't forget to catch the first ever Mother's Market Radio Show tomorrow! It airs live on AM830 at 10:00am.
2010-02-20 14:55:12,"Miss our radio show this morning? Listen online here, and get a 20% off coupon on supplements: http://cli.gs/zvqty"
