time,tweet
2009-08-11 08:15:09,"If I could show you how $27, one time, coule pay all of all your bills and create a literal fortune, would we have something to talk about?"
2009-08-11 08:42:03,"Great place to market your business...FREE   www.directmatches.com/luvon Massive amounts of tools, network marketers and potential customers"
2009-08-11 08:47:09,Build your twitter list :  http://www.twollo.com/
2009-08-11 08:51:50,How to use Twitter to build your business:  http://bit.ly/utgGw
2009-08-11 09:31:35,@brookeallman Feel your pain!  Life has sure gotten difficult.  I have a J.O.B. that I'm miserable at...but can't find another one...
