time,tweet
2009-08-13 14:35:04,Shaun Hill has drawn the start for the 49ers' preseason opener Friday against the Broncos. Coach Mike http://bit.ly/6e8xP  #NFL
2009-08-13 14:35:04,49ers | Quarterback battle still too close to call http://bit.ly/13ozam  #NFL
2009-08-13 14:35:04,At least one team source tells NFL.com's Jason La Canfora that Shaun Hill could get the nod over Alex http://bit.ly/3mxNg0  #NFL
2009-08-13 14:35:04,49ers | Starting QB for Friday still undecided http://bit.ly/iKUeZ  #NFL
2009-08-13 14:35:05,Niners QB battle rages on http://bit.ly/1gSiE6  #NFL
