time,tweet
2009-08-15 13:20:06,Posting the best Video Game news on the net!
2009-08-15 17:20:28,Street Fighter 4 Tournament: Round 2!: So after an extended dealing it is finally time for Round 2 of the first .. http://bit.ly/8eaJs
2009-08-17 18:36:01,EA scoops up living legend Couture to co-headline MMA game: As if scooping up Fedor Emelianenko to headline the .. http://bit.ly/d6bx1
2009-08-17 21:19:35,"Sega Polls Asks Fans Which Genesis Game Gets Put On XBLA, Plus An Earthworm Jim MYSTERY!: Update:  Regarding the.. http://bit.ly/T9drd"
2009-08-17 21:19:37,"Starcraft II: Old Rivals Cinematic Trailer: Blizzard loves to taunt us with glimpses of their upcoming games, pa.. http://bit.ly/wO25J"
