time,tweet
2009-09-03 18:30:54,"Regardless what type of Site or Blog you have.If you are not collect leads through an opt-in box or lead capture page, YOU ARE LOSING MONEY!"
2009-09-03 18:32:41,Here is the easiest way to build a high-quality Lead-Capture-Page for any kind of business -> http://bit.ly/y5YGB
2009-09-03 19:46:52,Thanks to you Gil! We're glad you noticed :-)
2009-09-03 20:14:08,Hey James cool. Hope you had a good time there and keep the germans in good memory. All the best for you and your family&friends
2009-09-04 02:31:28,"@skoobe Hey Ray, oh yeeah. Lini would like that & we would have another pic in the row of 863 to be blastered around the house... ;-)"
