time,tweet
2009-08-20 06:26:49,Reading a fashion magazine
2009-08-20 07:38:06,Now's the time to get up.. it's at that point where I'm either getting up now or sleeping in late.. what's it gonna be?
2009-08-24 16:31:53,"Just got some new makeup brushes, I'm testing them out in the bathroom"
2009-08-26 18:13:29,"Thanks for all the recommendations, you guys are great! @GlobalFDI @trafficadviser @rebekahtrinity GREAT TWEETERS!"
2009-08-26 18:15:01,"@ikbendat_ikben That's what I ended up doing, gotta love sleeping in. My bed is just way to comfortable! ;-)"
