time,tweet
2010-02-13 19:36:11,Checking: http://anonymx.com/ #NowPlaying V-day #WhoToldYouThat
2010-02-23 23:58:59,The truth be told the boy bout money
2010-03-02 03:53:44,Free Apple iPad! Limited offer so hurry up! See details http://bit.ly/d5Zmc1 #uknowurhigh #shininghongstar #amitheonlyone Single RT
2010-04-17 22:47:52,just joined a video chat with 8 other people at http://www.dofattv.com/nyc/ #tinychat
2010-04-17 23:02:28,just joined a video chat with 129 other people at http://www.dofattv.com/atl/ #tinychat
