time,tweet
2010-04-01 10:26:46,Video: Haiti hospital short of money http://bit.ly/eQdR5
2010-04-01 14:45:54,"Simon Johnson, Economist & Author of ""13 Banks"", on what can be done to prevent another eco crisis"
2010-04-01 15:05:34,"Even more daunting than the US census, India is trying to account for more than a billion people. 7pm"
2010-04-02 09:15:41,"This morning, @mediaite covers Peabody Award wins for BBC World News America  - http://bit.ly/8XD98f via @bbcamerica"
2010-04-02 11:53:52,Video: The Census - Measuring the nation http://bit.ly/cOlurv
