time,tweet
2009-08-29 23:15:22,Use our investor’s funds to buy homes from banks or short sales then flip them to end buyers  http://vur.me/s/05N/
2009-09-01 17:30:57,@OuchiAllStars if you need music for anything check me out @ myspace.com/rellyrellsfinest
2009-09-01 17:36:58,I have homes in Atlanta  between .45 - .50% on the dollar. jarellg@yahoo.com
2009-09-01 17:46:38,I have homes in Atlanta between .45 - .50% on the dollar. The majority of home need minor to no repair. Great rentals.... jarellg@yahoo.com
2009-10-06 11:31:40,"For Sale: 3BR/1BA Single Family House in Indianapolis, IN, $35,000 - http://postlets.com/res/2845925"
