time,tweet
2009-12-12 02:21:11,"Twitter Tweets about Twitter as of December 11, 2009 | Redneck ... http://ow.ly/168Okv"
2009-12-12 12:24:57,"Twitter Tweets about Twitter as of December 12, 2009 | Redneck ... http://ow.ly/168UFQ"
2009-12-12 12:24:58,Twitter Updates for 2009-12-11 | Product In A Weekend http://ow.ly/168UFR
2009-12-12 18:29:30,Twitter Secret … Do You Want To Know What It Is? http://ow.ly/168YSI
2009-12-12 18:29:31,Home Businsess Free Training by Doug Firebaugh | Blog Fully http://ow.ly/168YSJ
