time,tweet
2010-01-19 02:23:12,Jonathan Ogden a brick wall for Ravens QBs; top tackle of 2000s http://bit.ly/6mYjuK
2010-01-19 05:23:46,Magic need to get it together to be in title mix - FOXSports.com http://bit.ly/8xMEfj
2010-01-19 05:23:48,Victim to speak 'from the grave' in Peterson case - Washington Post http://bit.ly/4rSeq5
2010-01-19 05:23:49,Message from brass to sacked Cowboys: 'Keep it the way it is' http://bit.ly/7QzBle
2010-01-19 05:23:50,Jonathan Ogden a brick wall for Ravens QBs; top tackle of 2000s http://bit.ly/7UyTww
