time,tweet
2010-01-08 02:00:53,Partnered women gain more weight - UQ News: Partnered women gain more weightUQ NewsAs part of the Australian Lo.. http://bit.ly/7Yzkg1
2010-01-08 03:21:20,Panasonic Announces Annual Management Policy - dBusinessNews New York (press release): Panasonic Announces Annu.. http://bit.ly/4BBOIr
2010-01-08 03:21:30,www.bharatbook.com : Car Electronics Policies in China and Emerging Market ... - PRMinds (press release): www.b.. http://bit.ly/6ukwgZ
2010-01-08 05:01:07,Women's Health wing set to open today at Millville facility - Vineland Daily Journal: Women&#39;s Health wing s.. http://bit.ly/8bvpmd
2010-01-08 05:13:47,INTERNATIONAL CONSUMER ELECTRONICS SHOW: Techs expecting big 2010 - Las Vegas Review - Journal: The GuardianINT.. http://bit.ly/5rxrm5
