time,tweet
2009-09-05 13:05:42,"Lot's going on...  Stay tuned for the ""official"" launch of the Tweetmatix suite of Twitter tools.  ;)"
2009-11-07 12:47:01,A lot of forward movement in the last 60 days since starting. See the intro videos at http://tweetmatix.com #tweetmatix
2009-11-07 12:47:55,We implemented the new keyword selection tool. It's awesome and helps users accurately pick keywords and phrases to monitor.
2009-11-07 12:48:46,One of our users suggest that we add play/pause ability on a per keyword/phrase basis.  It's working! @michaeldaehn
2009-11-07 13:02:11,#Tweetmatix is a marketing tool for local businesses & bands. It helps build local connections with relevant individuals.
