time,tweet
2009-09-05 00:47:16,Outdoor Adventure Trips 2009: High Uintas Camping/Hiking/Kayaking Trip http://bit.ly/121Utx
2009-09-05 06:09:52,Open World Of Outdoors Or Camping With Hiking Backpacks: Going For ... http://bit.ly/2XnSNs
2009-09-06 18:08:47,Romantic Camping In The Great Outdoors http://bit.ly/BiXdm
2009-09-08 22:06:22,How To Pick The Best Tent To Ensure A Comfortable And Safe Refuge ... - http://bit.ly/ucdKP - great advice #camping
2009-09-08 22:09:15,"Uh... ok, romantic camping tips - http://bit.ly/2Sor0M"
