time,tweet
2010-02-18 21:05:13,Columbia MBA Smart About Dumb Pro Sports Strife: Scott Soshnick: The same drum beat emanated from All-Star weekend... http://bit.ly/bGnMTO
2010-02-18 22:30:33,NY Times dissident will not seek re-election http://bit.ly/90nK4h
2010-02-18 22:30:33,NY Times dissident will not seek re-election http://bit.ly/90nK4h
2010-02-18 22:40:33,9 News Extra: Road Home Investigation: Homeowners had three choices of what to do with the money. They could rebui... http://bit.ly/aEXeEH
2010-02-18 23:31:44,"iVdopia Debuts Pre-App and In-App Advertising For Android, Following Similar ... http://bit.ly/al7wbR"
