time,tweet
2009-10-02 04:56:04,"Always remember you're unique, just like everyone else."
2009-10-02 05:06:05,Sick and tired of the recession? Find a recession proof INCOM£ that you can earn anywhere with this system http://bit.ly/EX2GY
2009-10-02 05:29:37,Nothing will ever be attempted if all possible objections must first be overcome. - Samuel Johnson
2009-10-02 05:35:38,"The way to gain a good reputation, is to endeavor to be what you desire to appear. - Socrates"
2009-10-02 05:55:39,Get out of debt fast! A proven income generating system that actually works: http://bit.ly/34f9Od
