time,tweet
2009-09-07 17:20:24,"Caravan #3 - in the Sahara Photo: Shazbot, through a Creative Commons Attribution...: http://bit.ly/M3S7e"
2009-09-07 17:29:19,http://bit.ly/TW9Hh
2009-09-07 17:33:57,http://bit.ly/ndFFe
2009-09-07 17:42:03,"Brazilian Surfer Photo: Marcodede, through a Creative Commons Attribution...: http://bit.ly/4ueMsM"
2009-09-07 17:45:09,"Let's Go - Hiking in the Lake District of Scotland   Photo: Ian Carroll, through a Creative Commons Attribution... http://bit.ly/F6mNJ"
