time,tweet
2009-09-08 03:22:53,Great to join the forex community.
2009-09-10 01:28:13,hmm..wonder if GBP will see any action later today since interest rate is expected to remain unchange...
2009-09-10 11:41:09,Just received this. Free Forex webinar at 1pm EST starting soon => http://bit.ly/1PKtLS
2009-09-11 09:23:11,I've seen the webinar and it was great. Check out the webinar replay and this formula now http://bit.ly/3kruVQ
2009-10-05 10:58:15,Interesting...just received this. Check it out too http://bit.ly/12jiRq
