time,tweet
2010-06-23 19:41:07,Time to Cut the Fat & Feed the Pig. Smarter spending habits will result in a stronger future. http://fil411.me/cSD8Ya
2010-06-23 20:01:08,"#unemployment tips, make sure to get accurate information http://fil411.me/cEDcpb"
2010-06-23 20:21:09,NEW BLOG POST - Small Business Week 2010 http://fil411.me/bkJys6
2010-06-23 20:49:10,Car RepairÑonsumer Tips To Deciphering the Bill Is your mechanic billing you fairly? Use this list http://bit.ly/UidN3
2010-06-23 21:42:11,Free Marketing http://fil411.me/aNXZew use your own website
