time,tweet
2009-09-14 21:25:07,i gots a good feeling #raiders
2009-09-14 22:08:14,Why Your Team Sucks: Oakland Raiders - 2009 NFL preview - Deadspin http://bit.ly/8jL08
2009-09-15 00:37:43,This has got be a joke...   Who switched the feed on my TV to that joke reel.  OK - you got me.  Now put back on the real game where we win!
2009-09-15 00:39:09,Reading Oakland Raiders are back! - RootZoo Sports - http://bit.ly/gmkod #raiders
2009-09-15 00:39:23,I added myself to the Raiders fan directory on http://raiders.socialapproach.com #raiders
