time,tweet
2009-09-15 20:14:47,Made it!
2009-09-16 18:16:28,Did Wonder Woman really win DC mayoral race? Get the facts: http://sociaI.me/gHJywaN plz RT
2009-10-23 16:34:25,"hey everyone! I am finaly getting to this.. lets talk energy; I got one phrase ""fly wheel energy storage"" check this out http://tr.im/CPdz"
2009-10-23 16:48:10,here is another good article on fly wheel energy storage! check it out........ aedweb.com/energy
2009-10-23 16:49:50,didnt do the last link correctly..here is another good article on fly wheel energy storage! check it out........ http://tr.im/CPkI
