time,tweet
2009-09-19 02:23:02,WE ARE GIVING AWAY - FREE full version FAP TURBO - GIVEAWAY | Liteforex SA: http://digg.com/d314qqG?t
2009-09-19 02:55:47,Have you tried twellow yet? The yellow pages for twitter? I just registered my profile: http://twellow.com/u/LITEFOREXSA
2009-09-19 03:07:22,Liteforex  is offering $1000 bonus http://bit.ly/4Gx9v
2009-09-19 07:31:53,THE GREAT $1 Giveaway - MONEY FOR NOTHING http://bit.ly/OLzU9
2009-09-22 10:23:10,We will pay you to be a fan on our new facebook pages. Make money from home now http://www.facebook.com/pages/LITEFOREX/164313575637
