time,tweet
2010-01-18 01:32:41,Look At How I Use My Twitter Account To Make Extra Money Every Day On Auto Pilot! http://go2lite.com/O9
2010-01-18 01:34:38,http://icio.us/ct0rln
2010-01-18 03:32:34,If You Want To Make Money With Your Twitter Account You Have Got To See These FREE Videos! http://go2lite.com/O9
2010-01-18 04:05:47,Thousands Of People Are Using Their Twitter Accounts To Make Hundreds Of Dollars Per Day. Are You? http://go2lite.com/O9
2010-01-18 05:32:50,Making Money Online Couldn't Be Any Easier. You Don't Even Need A Website! All You Need Is Your Twitter Account! http://go2lite.com/O9
