time,tweet
2010-04-03 13:13:55,Best Undergraduate B-Schools 2010:  http://bit.ly/aAyQKU
2010-04-03 13:13:56,"Geithner Delays Currency Report, Urges Flexible Rate for China: U.S. Treasury Secretary Timothy F. Geithner delaye... http://bit.ly/d9CGCB"
2010-04-03 13:36:56,Could you have handled that situation a bit better? - the 48 Laws of POWER tell you how - Here - http://short.to/19tmq
2010-04-03 14:08:10,With the proven 48 Laws of Power - you can RULE any situation - watch the FREE videos here - http://short.to/19tmq - FREE!!!
2010-04-03 14:37:16,Do you feel like a victim at work? Watch the free videos on the 48 laws of power here. http://short.to/19tmq
