time,tweet
2009-12-25 14:59:20,PSSST! TELL YOUR FRIENDS- EBooks On Almost Anything.com http://bit.ly/3i5VRs
2009-12-26 10:51:45,TAKE CARE OF YOUR DIABETES IN 2010. http://bit.ly/1a3lpP EBooks On Almost Anything.com http://bit.ly/3i5VRs
2009-12-26 12:43:16,WANT TO BUILD A STRONGER MARRIAGE IN THE COMING YEAR? http://bit.ly/xCY1n EBooks On Almost Anything.com http://bit.ly/3i5VRs
2009-12-26 13:27:17,ARE YOU LOOKING FOR ARTHRITIS RELIEF FOR FRIEND? http://bit.ly/ytPxV EBooks On Almost Anything.com http://bit.ly/3i5VRs
2009-12-26 14:15:17,LEARN HOW TO BUY THE RIGHT PARROT.  http://bit.ly/Sw440 EBooks On Almost Anything.com http://bit.ly/3i5VRs
