time,tweet
2010-01-19 13:03:56,Projecting the Bobcats' Next 42 Days: Rufus on Fire takes a look at what the next 42 days mean for the Bobcats in ... http://bit.ly/5ninlz
2010-01-20 05:04:32,"Bobcats report:  Roster: ROTATION Starters -- Point guard Raymond Felton, Shooting guard Stephen Jackson, Small fo... http://bit.ly/8Fnn6E"
2010-01-20 08:31:41,Jackson will be named conference's player of the week:  http://bit.ly/72q8yo
2010-01-20 21:17:32,"Heat-Bobcats, Box: MIAMI (65)Richardson 1-6 1-2 4, Beasley 3-11 0-0 6, O'Neal 2-6 0-0 4, Alston 1-6 1-1 3, Wade 6-... http://bit.ly/6pjKX1"
2010-01-21 04:42:02,"Bobcats report:  Roster: ROTATION Starters -- Point guard Raymond Felton, Shooting guard Stephen Jackson, Small fo... http://bit.ly/6w1Pid"
