time,tweet
2010-03-23 14:39:45,"Tired All The Time? Check out a non-invasive way to deal with Pain, Energy, and Sleep... in a 3000 year old 21s… http://pbckt.com/pS.G1ZR9"
2010-03-23 15:46:40,CieAura Transparent Chips-HOW DO THEY WORK?  Have you ever heard the stories about ordinary people with ordinar… http://pbckt.com/pS.GLtFs
2010-03-27 16:43:30,downloaded WebPlayer.swf (application/x-shockwave-flash Object) http://tr.im/Ty4F with #RealPlayer http://real.com/t
2010-04-05 17:34:27,USE A CELL PHONE? Counteract Your Cell Phone’s Harmful Cancer Causing EMF Radiation…: http://bit.ly/brGoe9 via @addthis
2010-04-07 14:49:07,Wow-Breakthrough Technology! http://pbckt.com/pS.tGkFx
