time,tweet
2010-05-09 14:11:56,Open an account with Motives Cosmetics to provide unique and professional cosmetics for your clients http://bit.ly/cH3Za8
2010-05-09 14:57:27,Comfort tips for all shoe styles http://tinyurl.com/37dd7ar
2010-05-09 14:59:58,"This Eye Base is a light, textured cream that smoothes and neutralizes the eyelids and keeps eye shadow from creasing http://bit.ly/9V1Gcm"
2010-05-09 15:40:00,Bring a touch of glamour to your eyes with Motives Luxe Crème Eye Shadow http://bit.ly/bV4Kvb
2010-05-09 15:57:28,Some Shoppers Try Fashion Diet http://tinyurl.com/34dc8qe
