time,tweet
2009-12-14 23:02:41,You will not regret it! http://website.ws/gerhardstrasser
2009-12-15 01:00:28,...everything is automated! http://website.ws/gerhardstrasser
2009-12-15 03:00:38,This program is great for the beginner and for the full-time professional. http://website.ws/gerhardstrasser
2009-12-15 05:00:21,This is incredible - it really does work. http://website.ws/gerhardstrasser
2009-12-15 07:00:37,"Plus, we can work from home with unlimited income potential. http://website.ws/gerhardstrasser"
