time,tweet
2009-09-28 17:52:25,About to go to sleep! Good night everyone
2009-10-11 13:17:17,Just updating my website! About to go pictures soon also!
2009-10-11 13:26:13,"The difference between a successful person and others is not a lack of strength, not a lack of knowledge, but rather a lack in will!"
2009-10-13 15:54:20,Just back from the gym! Getting ready to relax to a nice dvd soon also
2009-10-15 10:26:08,Just come back from spending the day with my girlfriend! Relaxing with the family getting ready to attend webinar soon
