time,tweet
2010-03-22 03:01:39,Game #70: Miami Heat (36-34) vs. New Jersey Nets (7-62):                                                     Issac... http://bit.ly/cY97ka
2010-03-22 07:14:53,T-Mobile Co-Players of the Week: Vince Carter and Rashard Lewis: This post is sponsored by T-Mobile.  An odd sched... http://bit.ly/crLkFP
2010-03-22 12:22:48,Vandeweghe Questionable for Monday Night:                                            More photos »                ... http://bit.ly/ahAxpX
2010-03-22 22:02:12,"Raptors Rapid Recap - Toronto 106 - Minnesota 100:  -This one was a grind, but the Toronto Raptors took care of bu... http://bit.ly/aNS8jy"
2010-03-23 00:31:13,Dwyane Wade and Jermaine O'Neal carry Heat to victory over lowly New Jersey:                                      ... http://bit.ly/cJep4F
