time,tweet
2009-10-28 08:50:36,Just posted my first MySpace blog!
2009-10-30 17:53:29,"Just seen ""This Is It"" - what an ernomous loss Michael Jackson is - creative and performing genius! RIP"
2009-11-06 06:46:25,"Preparing to jet off to Cancun, Mexico, in the morning. Looking forward to meeting all you fellow delegates ... you know who you are :)"
2009-11-14 08:46:03,"@wbaboy Have a great time, Mr. N.! Any chance of breaking the habit of a lifetime and seeing you this Friday?"
2009-11-14 19:19:00,"@wbaboy Not to worry, Chris. Hopefully next time? About every 3 months or so since we all met at the Navigation. Social sec. Nige organises."
