time,tweet
2010-01-07 13:49:27,Leafs Hit The Ice Looking For Answers : by Matthew Iaboni --mapleleafs.com The Maple Leafs were back on the ic.. http://bit.ly/6pUyOM
2010-01-07 16:42:31,Maple Leafs Sign Mike Komisarek to 5-Year 225 Million Contract: Leafs GM Brian Burke was not done adding some g.. http://bit.ly/74CxmS
2010-01-09 00:39:50,Miller Continues His Mastery Over Leafs: Tyler Myers added a big chapter to his storybook rookie season. The 1.. http://bit.ly/6byv3B
2010-01-09 12:35:22,Leafs Host Pens Tonight At ACC:  PENGUINS (27-17-1) at MAPLE LEAFS (15-21-9) Last 10   -- Pittsburgh 3-7-0; T.. http://bit.ly/5alJxi
2010-01-10 00:37:51,Offensive Struggles Continue In Loss To Pens: TORONTO -- The Pittsburgh Penguins might have got the break they .. http://bit.ly/80DC00
