time,tweet
2010-01-28 15:24:42,Real Estate Investing Strategy Guide - http://tinyurl.com/yek6amo
2010-01-29 14:16:34,An Evaluation of Four High-Quality Printers and Which One is Right For You and Your Office - http://tinyurl.com/ydl2vev
2010-01-29 14:16:39,The Art of Making Scented Candles - 4 Steps to Aromatic Beauty - http://tinyurl.com/yekqzx2
2010-01-29 14:16:43,Real Estate Investing Ideas For Today's Market - http://tinyurl.com/ya9zmg5
2010-01-29 14:16:47,Money Blogging - http://tinyurl.com/ydkslo6
