time,tweet
2009-10-02 13:47:52,Grinding away on a Friday
2009-10-02 15:44:15,Browsing amazon for various sundry items :)
2009-10-02 18:45:20,@eleqtronics4u...check it out if you need an hdmi cable!! $6!!
2009-10-03 11:54:05,Check out http://bit.ly/Rw65A for the hands down best deal on hdmi cables on amazon! @eleqtronics4u nice work! Now time to hit the beach!!
2009-10-03 21:45:34,Dallas cowboys tomorrow afternoon...is it bad that I'm already anticipating the game the Saturday night before?? HD and beer good 4 Sundays
