time,tweet
2009-12-25 23:31:59,Top Money-Making Secret Now Revealed  Using Your Twitter Account http://bit.ly/4k0ill
2009-12-25 23:33:07,Learn How to Use Zero/Low-Cost Advertising Methods for Your Online ... http://tinyurl.com/ydeezmo
2009-12-26 00:32:01,Look at how I use my Twitter Account to make Extra Money every day on auto pilot http://bit.ly/4k0ill
2009-12-26 01:31:55,Do you Want A System That Pays You Daily  http://bit.ly/4k0ill
2009-12-26 01:32:16,Hijacked Facebook accounts pose threat of ID theft http://tinyurl.com/yfp2j39
