time,tweet
2010-01-18 06:38:13,Fundamentos Inteligência Competitiva: técnicas para análise setorial e da concorrência: Chegue antes dos concorrentes: http://migre.me/dHZs
2010-01-18 07:43:15,Depois dessas férias o seu currículo vai voltar outra pessoa: www.espm.br/ferias
2010-01-18 08:11:33,Você quer criar e tirar do papel um projeto social ? Curso ESTRATÉGIAS DE MARKETING E COMUNICAÇÃO PARA O TERCEIRO SETOR http://migre.me/dIcL
2010-01-18 09:00:43,O curso Um Dia de Cannes traz tudo sobre o festival e convidados ilustres do mundo da propaganda. Confira: http://migre.me/dIgJ
2010-01-18 09:18:47,"Jogue para ganhar! Curso de Férias ESPM ""Games como ferramenta de comunicação e marketing"" veja + http://tinyurl.com/ylqknjk"
