time,tweet
2009-12-07 17:41:57,SECRET: White Teeth Trick! Dentists don't want you to know about THIS teeth whitening secret! spon http://tinyurl.com/yhudkwh
2009-12-08 13:54:50,Would You Download and Listen To Free Songs Online If the Site Is Virus Free? Do You Think It's llegal? spon http://tinyurl.com/yz2mdnj
2009-12-08 19:34:43,Want Free Money Making Methods You Keep 100% Of All Money You Earn http://bit.ly/8W2I23
2009-12-08 19:56:06,Plan On Living Past 50? Then You Need To Quit Smoking Right Now! Click Here To Quit For Free! ad http://tinyurl.com/yb2q44z
2009-12-08 21:11:56,Do NOT Let the Dentist Fool You! Dentists don't want you to know about THIS teeth whitening secret! ad http://tinyurl.com/yg4vypk
