time,tweet
2010-04-20 12:18:56,If you want to work at home & succeed? Educate yourself first! http://www.freemlmbook.com I hope it helps.
2010-04-20 12:49:57,"Do you have the talent, is rarely the question. Do you have the guts to finish, now that is the real question."
2010-04-20 13:22:36,"When people talk, listen completely."
2010-04-20 13:42:44,"Wise people think all they say, fools say all they think."
2010-04-20 14:11:47,For the latest news and information about the Network Marketing industry check out: http://keithbrownonline.com Have a great day!
