time,tweet
2009-10-16 15:37:14,Gotta go pick up some hay and tools in my Silverado...
2009-10-16 18:32:14,Fans of the Chevy Silverado truck keep up with all the latest at http://socialapproach.com/ChevySilverado
2009-10-19 12:53:41,RT @BigMikeAuto Impressions of the  Chevy Silverado with Video and Full Review...http://tinyurl.com/pv5e5d #Silverado
2009-10-19 19:04:13,"1st a boat then a Silverado, not bad - Derby Grand Prize Winners Announced - http://bit.ly/mymrW #Silverado"
2009-12-17 18:36:07,Severance Economy Next Shoe to Drop? -- Daily Intel http://bit.ly/7Lc1pW
