time,tweet
2009-10-19 23:20:05,"TRANSLOOPA, We are cheaper than your existing translation or language service. All Languages! http://tinyurl.com/yj5p52v"
2009-10-20 01:54:56,"Do NOT Pay for White Teeth!! Learn the trick discovered by a mom to turn yellow teeth white, under $10. http://tinyurl.com/yha8947"
2009-10-20 19:56:23,Do NOT Pay For White Teeth! Mom's Whitening Method Exposed. The Results WILL Shock You. http://tinyurl.com/yff2e63
2009-10-22 00:05:12,"Jobless Mom makes $8,673/Month Part-Time Online! Read this special report to see how. http://tinyurl.com/yj5tcuo"
2009-10-22 20:20:46,Do NOT Let the Dentist Fool You! Dentists don't want you to know about THIS teeth whitening secret! http://tinyurl.com/yz8h2km
