time,tweet
2009-10-19 01:08:40,"'Twilight's Eclipse': Kirsten Prout is Lucy - Kirsten Prout, who showed off some martial arts in ""Elektra,"" Zap2it.com http://bit.ly/1UmsPJ"
2009-10-19 01:10:23,"Kirsten Prout Joins The Twilight Saga: Eclipse ComingSoon.net E! Online reports that Kirsten Prout (""Kyle XY,"" Elektra) http://bit.ly/2zsDT0"
2009-10-19 01:12:22,Kirsten Prout rejoint le casting d'Hésitation - La distribution du troisième long métrage de la saga Twilight http://bit.ly/3VEqJ8
2009-10-19 01:13:42,"Kirsten Prout será Lucy en Eclipse (Crepúsculo 3) FantasyMundo Según E! Online, la actriz Kirsten Prout (""Kyle XY"") http://bit.ly/27gV9d"
2009-10-19 01:14:43,#kirstenprout Kirsten Prout to star as vampire in Twilight 3 - Sify Television actress Kirsten Prout will star as http://bit.ly/3KMFxU
