time,tweet
2009-12-23 04:01:51,Learn everything you need to know to make money with your twitter account! http://bit.ly/50mOse
2009-12-23 05:01:51,The videos that taught me how to put my twitter account on Auto Pilot to make money! http://bit.ly/50mOse
2009-12-23 06:01:55,Take your Twitter account to the next Level ! Make money Now! http://bit.ly/50mOse
2009-12-23 07:02:05,"More Followers Now, watch these videos now! http://bit.ly/50mOse"
2009-12-23 08:01:48,Turn your Twitter Account into an ATM machine! http://bit.ly/50mOse
