time,tweet
2010-05-03 08:36:08,"Now I interested of ""Hand Blown Glass Figurines and Animal Miniature"" and ""Ceramic Miniature Figurines"" for home decoration and Souvenir."
2010-05-03 08:55:49,"You can see many product of ""Glass Miniature Figurine"" on eBay.com or URL: http://stores.ebay.com/THAI-HOME-DECORATION-and-SOUVENIR"
2010-05-05 07:55:52,Glass and Ceramic Figurines : http://stores.ebay.com/THAI-HOME-DECORATION-and-SOUVENIR?_rdc=1
2010-05-05 09:04:00,#WeLoveKing ทรงพระเจริญ_Long Live The King_I love Thailand ผมรักแผ่นดินแม่ แผ่นดินไทย อยากให้คนไทยทุกคนภูมิใจในความโชคดีของเรา รู้รักสามัคคี
2010-05-05 09:35:33,"#Glass Dragon Figurine Buy it now $9.99, Shipping $5.50 to US & Worldwire. http://bit.ly/8XN4M4"
