time,tweet
2009-12-29 12:02:10,Get instant RAPPORT and put people under your spell quick and fast...with The Power of Conversational Hypnosis... http://bit.ly/3755Ag
2009-12-29 13:01:18,How Conversational Hypnosis Saved A Maverick Doctors License And Changed The USA's Laws About Hypnosis... http://bit.ly/4AM4fh
2009-12-29 14:01:21,Learn the SECRETS Of The Most Sought After Hypnosis Instructor In The World!  http://bit.ly/3755Ag
2009-12-29 14:02:16,The Latest News About Mindpower  From Improveyourmind http://tinyurl.com/yz3zqau
2009-12-29 14:02:17,The Latest News About Improve Your Mind  From Improveyourmind http://tinyurl.com/yfl7dd4
