time,tweet
2010-06-21 15:06:44,"""Come on Spain, there should have been at least 10 goals by now! #ESP (2)vs.(0) #HON #WorldCup !"""
2010-06-21 15:08:18,"""Organized, spirited, defensive football continues to get results at this WC. I'm blaming Mourinho for bringing it to the world!"""
2010-06-22 00:30:47,"""@GarethCliff: Go Bafana! Today's a big day. If we make this fairy tale come true, then miracles are possible. I like being an optimist..."""
2010-06-22 00:41:51,"""Mexico vs. Uruguay or France vs. South Africa which one to go for? both matches on same time. or should i switch channels? :)"""
2010-06-22 03:24:52,"Before I self destruct,Evra featuring Anelka#SWC 2010"
