time,tweet
2009-10-22 07:15:34,e Orchids started its Twitter Account on 22nd October 2009
2009-11-30 01:38:01,e Orchids launched its new website on 27th Nov 2009 www.e-orchids.com
2009-11-30 13:23:28,Safe Shopping! How is it possible? http://e-orchids.com/blog/2009/11/27/safe-shopping-%E2%80%93-how-is-it-possible/
2009-11-30 22:02:47,About Safe Shopping http://e-orchids.com/blog/2009/11/27/safe-shopping-%E2%80%93-how-is-it-possible/
2009-12-02 03:39:50,How to Design Flyers? http://e-orchids.com/blog/2009/11/27/how-to-design-flyers-that-results-with-tremendous-sale-making/
