time,tweet
2010-05-16 10:39:15,#Flight >>Cheapest flight to Europe. Save big on your Europe flight tickets at OneTravel.com.  http://bit.ly/djZPIB
2010-05-16 10:39:37,#Flight >>Cheapest International Airfares with $15 Coupon '15OFF'!  http://bit.ly/96V9R7
2010-05-16 10:40:34,Get the best weekend car rental deals - as low as $14 a day!  http://bit.ly/aPcyYg
2010-05-16 10:40:46,Special Discount on New York Flights. Use Coupon Code: NYC10!  http://bit.ly/bEb2SR
2010-05-16 10:41:02,Cheap International Air Travel Deals at OneTravel - Save Up To 60% Now  http://bit.ly/aJTodL
