time,tweet
2009-10-25 12:38:40,1 timme gratis spel med 500 €. Behåll dina vinster. Du tar ingen risk.  http://presentideer.info/poker #casino
2009-10-30 23:54:44,Present idee:  [SWE] 2 nummer av NATIONAL GEOGRAPHIC SVERIGE http://presentideer.info/jxs #presenter
2009-10-30 23:54:45,Present idee:  Europas största utbud av semesterboende! – Godt tilbud http://presentideer.info/baj #presenter
2009-10-31 08:03:29,Vi vill gi deg 500 € gratis til Casino Classic. Du beholder det du vinner. http://presenter.im/nk
2009-10-31 11:42:46,Present idee:  SE_Post-it http://presentideer.info/u71 #presenter
