time,tweet
2010-01-01 02:11:47,Why Should You Build Your List Find Out If Autoresponders Are a ...: Why Should You Build Your List? Find Out I.. http://bit.ly/5pZBmf
2010-01-01 02:12:17,Forecast: Snow flurries possible as 2010 begins | Breaking News ...: Breaking News from The Birmingham News. Lo.. http://bit.ly/6KE1U8
2010-01-01 02:12:52,The Infopreneur Home Business How to Make Your Knowledge Sell: What is an infopreneur? It is an entrepreneur wh.. http://bit.ly/7vAGdb
2010-01-01 02:15:15,Great Price Sony KDL46W5100 for $1289.99 « Television: I can&#39;t dwell too much into blacks and whites in Son.. http://bit.ly/78d6P5
2010-01-01 02:39:56,Twitter Marketing Earns Business Big Dollars: Navigation: Weblog / Blog article: Twitter Marketing Earns Busine.. http://bit.ly/7D1GXb
