time,tweet
2010-03-03 21:49:34,The world can make you happy... if you help to make it happy....
2010-03-03 22:56:06,I stay home and work so can you... no cost at all... take a look >>>  http://rt.nu/r0w0ey
2010-03-04 16:08:26,I was looking around and I found a cool business and it's really FREE... check it out... and pass it to your friends... http://rt.nu/rdshkv
2010-03-04 17:01:06,Money be you bank soon come on friends... http://rt.nu/9yie5
2010-03-05 22:02:42,MLM Leaders-There's None Left They've All Jumped Ship See Why..   http://rt.nu/55cdkk
