time,tweet
2010-01-01 14:31:24,Work with charities? Check this new toolbar. http://bit.ly/3yLBJ4
2010-01-01 15:31:19,Like to have your ads and traffic on consistent monthly autopilot? Worth taking a look. http://bit.ly/3yLBJ4
2010-01-01 16:16:54,Hello @KidCody901 http://bit.ly/4ofvRL told me 2 follow U. Return the follow?
2010-01-01 16:31:24,"Want real time leads, qualified prospects, keywork search clicks, and more? ......http://bit.ly/3yLBJ4"
2010-01-01 18:02:03,Want to get thousands of ad impressions to your site? http://bit.ly/3yLBJ4
