time,tweet
2009-10-30 11:13:24,Gearing up for the North Fulton Business Expo March 2010.  The planning has officially started.
2009-11-03 10:00:15,Twitter account...check.  Twitter background...check.  Profile...check.  Following & Followers...time to get to work.  http://gnfccexpo.com
2009-11-04 01:14:35,Front page of the Expo site is up.  Still need the guts.  http://www.gnfccexpo.com
2009-11-04 08:09:09,@CharityHisle Just getting started.  We'll build on content as the show gets closer.
2009-11-09 23:07:24,Another week closer to the North Fulton Business Expo.  Get your game face on.
