time,tweet
2010-01-20 01:31:00,Get a real Tiger! With a real Tail? And he won`t be a Cheetah! http://eCa.sh/rxQa
2010-01-20 02:31:09,"It`s not free, but what is it? a moneymaker! http://bit.ly/2tlG2i"
2010-01-20 03:31:07,You asked for a raise? In a recession? are you nuts? I say Stop! and Take no more crap! http://bit.ly/2tlG2i
2010-01-20 13:31:01,This poor guy got shot in the leg for his secret! http://eCa.sh/JAvS
2010-01-20 14:31:18,Debt? up to your ass? This isn`t Debt reduction! It`s just a way out! http://bit.ly/2tlG2i
