time,tweet
2009-12-25 18:02:53,Earn $3000  Per Month I Never Thought It Will Be So Easy To Do But People Don't Understand Common Things http://bit.ly/1G5pBt
2009-12-25 18:54:05,» Make Money Online – How To – GDI : GoDaddy VS Global Domains ... http://bit.ly/5hlw4d
2009-12-25 19:03:06,What If This System Makes You $3000 to $5000 Per Month Than What Will You Do With This Money. Think Again http://bit.ly/1G5pBt
2009-12-25 20:02:59,I Know There Are Lots Scam In Online There Are Very Few Legitimate Online Business It's Up To People
2009-12-25 21:03:02,How I Bought a Brand New $1.2 Million Home Using ONLY Affiliate Commissions Earned While I Was Unemployed http://bit.ly/1G5pBt
