time,tweet
2010-03-24 18:30:08,"Full time mobile notaries make anywhere from $30,000 to $80,000 per year. The majority probably make around $50,000 per year."
2010-03-24 19:11:31,@SindicatePromo Thanks for the RT!
2010-03-25 10:25:08,How to make sure you get paid: http://ow.ly/1pqpC
2010-03-25 13:50:07,An early history of the notary public profession: http://ow.ly/1pqsr
2010-03-25 18:50:05,"Employee notaries are regular notaries who's boss paid for their commission, seal, journal, and other fees."
