time,tweet
2010-02-21 19:48:40,Owen Wilson Goes Woody Allen http://nyti.ms/aT6b9a
2010-02-21 21:00:52,"Twilight's Kristen Stewart Wins A 2010 British Movie Award,Poses & Smiles http://bit.ly/cuEy85"
2010-02-22 00:14:16,And the Winner Is... Inglourious Basterds!... Really? http://bit.ly/9DePcO
2010-02-22 01:42:39,Movies: 'Shutter Island' a creepy delight thanks to Scorsese http://bit.ly/d49d6p
2010-02-22 02:52:12,Box Office Report - Shutter Island Knocks Off Valentine's Day http://bit.ly/cvHbNf
