time,tweet
2010-02-26 19:02:22,Do YOU eat during the wrong times of the day?  http://diets-to-lose-weight-fast.com/
2010-02-26 20:02:23,Do YOU eat empty calories while watching your favorite TV Show?  http://diets-to-lose-weight-fast.com/
2010-02-26 21:02:39,"If you are looking forward to lose weight, check this out.http://diets-to-lose-weight-fast.com/"
2010-02-26 21:17:43,What is the best way to lose weight? Here it is.http://diets-to-lose-weight-fast.com/
2010-02-26 22:00:16,The Latest News About Weight Loss  From Lose_fat_ http://tinyurl.com/ybsa8wj
