time,tweet
2009-12-07 16:01:01,The Latest News About Forex  From Autoforexrobots http://tinyurl.com/yboa4ks
2009-12-07 17:02:50,"If you would like to try a live trading auto forex robot, this one is the way to go. http://www.autoforexrobot.org"
2009-12-07 19:03:37,Back-test Results Are Worthless UNLESS You Can Validate Them With Live Forward Trading! Try it here. http://www.autoforexrobot.org
2009-12-07 23:02:54,"If you would like to try a live trading auto forex robot, this one is the way to go.  http://www.autoforexrobot.org"
2009-12-08 05:02:41,Requires so little of your investment (can start with as little as $50). Try trading forex  - http://www.autoforexrobot.org
