time,tweet
2009-12-18 15:53:35,Het Barack! How's that Copenhagen thing working out for you? I think you ought to stay ther because it ain't looking too good at home
2009-12-20 09:00:26,Gteat new site to get rid of this cobgress www.goooh.com sign up invite 3 and lets get rid of these selfish inconsiderate bastards ALL OF EM
2009-12-20 10:05:24,"Does anone in the congree have ANY common sense at all. Higher taxes, Medicare cuts, forcing people on Medicaid 50% Dr don't see them now"
2009-12-20 10:34:26,"No health insurance? Ok Just wait until 2014 No Prob Until then go to www.rxcutcosts.com get BIG savings on presriptions, labs etc."
2009-12-21 09:07:29,Does anyone know what's in this bill? Not even the scumbags who voted for it in the middle of the night like theives and RATS UNBELIEVABLE!!
