time,tweet
2009-12-16 00:17:38,I would sooner fail than not be among the greatest.
2009-12-16 00:17:38,RT @pazpaz I will probably kill a kitten if you dont come RT @Talastra @pazpaz   @tarynmanning at @theViperRoom Friday! http://bit.ly/8Hxndl
2009-12-16 18:12:10,Adam Lambert and TV scandal: A match made in rock heaven
2009-12-16 18:12:10,"RT @LiniLovesMusic @MRNA92 I love rock music, maybe it works...thanks!"
2009-12-16 18:12:11,"You cannot run away from a weakness you must sometimes fight it out or perish. And if that be so, why not now, and where you stand"
