time,tweet
2010-04-04 12:48:49,"I just got word of something, and thought you needed to know...Watch this (while you still can): http://ourl.com/tda"
2010-04-04 12:49:18,"Free unique content generated for your website? This has to be installed, plus it is by SEO guru Brad Callen! http://ourl.com/te0"
2010-04-04 13:28:48,"If you want to get more traffic, especially free traffic…. This blog is jam-packed with killer traffic-getting tutorials http://ourl.com/tgc"
2010-04-04 13:43:48,Do You Want This Free Definitive Bloggers Guide? I thought so! Click here: http://ourl.com/thj
2010-04-04 15:28:49,Your hand-drawn Traffic Launcher Formula Cheat Sheets are now ready for download. Click here to get them: http://ourl.com/tm3
