time,tweet
2009-12-31 23:32:06,How Would You Like To Make Money With Your Twitter Account Every Single Day On Auto Pilot!
2010-01-01 00:21:00,Check out BingTweets about Pro Bowl http://bit.ly/6OCeF1 #bing
2010-01-01 00:24:46,hey look at http://bit.ly/8mwDrN (from @popeater)
2010-01-01 00:32:16,Look At This Awesome Twitter Marketing Video Series. I Watched The Videos And Now I'm Making Money With My Twitter Account!
2010-01-01 01:01:55,The Latest News About Twitter Marketing  From Rmmaran http://tinyurl.com/yk7ntoz
