time,tweet
2010-01-03 12:32:51,"FREE Video, Learn How to SUPERCHARGE your Farmville Farm. start today! http://bit.ly/1VdvQb"
2010-01-03 13:33:30,WARNING: Your Neighbors Will All Insist on Wanting to Know Your Secret! click this link for Farmville secrets! http://bit.ly/1VdvQb
2010-01-03 14:34:00,Ultimate FarmVille Guru Shares the Secret Tactics! http://bit.ly/1VdvQb
2010-01-03 15:33:31,"Grow Your Farm at Light speed, 100% guaranteed w/ updates. start today! http://bit.ly/1VdvQb"
2010-01-03 17:33:05,These Famville strategies were so stupidly simple I was amazed. click this link! http://bit.ly/1VdvQb
