time,tweet
2009-11-28 22:34:57,"The University of London, Number 1 in  Europe, Number 1 in the world.com  http://bit.ly/4IQysc"
2009-11-30 12:24:42,"The University of South Africa, Number 1 online U  in Africa, Number 3 in the world...http://bit.ly/77CSui"
2009-12-29 12:00:49,The Latest News About Online Education  From Bestworstonline http://tinyurl.com/yf9j29j
2009-12-30 11:01:18,The Latest News About Online Education  From Bestworstonline http://tinyurl.com/yf9j29j
2009-12-31 06:00:37,The Latest News About Online Education  From Bestworstonline http://tinyurl.com/yf9j29j
