time,tweet
2009-11-18 05:41:52,My programming improved. Now i try  to make  a completely new version of Nasdaq Indicator with c++
2009-11-18 06:02:56,I actually try to progamm a robust fractal market trading system with esignal
2009-11-18 06:22:07,I actually create a simple and robust intermarket trading indicator metastock
2009-11-18 07:20:57,Did a lot of research. I  try to setup a simple but improved swing trading system with rina systems
2009-11-18 08:54:56,"Since a long time, i  try to setup a improved currency trading system metastock"
