time,tweet
2009-12-18 18:16:40,Poll - Who else is a member of @mikefilsaime IAW? http://tinyurl.com/yep9wxy
2009-12-18 18:33:35,Is it possible to dominate Twitter in sixty days? The author of this free report (value $97) did it in 65 days. http://bit.ly/6jW2t3
2009-12-18 19:33:33,"Find out the truth about Twitter, work from home and get rich. http://bit.ly/6jW2t3"
2009-12-18 21:02:19,The Latest News About Twitter Affiliate Marketing  From Netbizfornewbie http://tinyurl.com/yfkjeol
2009-12-18 21:02:20,The Latest News About Twitter Applications  From Netbizfornewbie http://tinyurl.com/yj2u44m
