time,tweet
2009-12-13 17:23:25,All New Fantastic Does It All  http://bit.ly/6BiLk3
2009-12-17 17:25:01,The Secret To Getting Lots Of Followers On Twitter  http://bit.ly/6BiLk3  While Having FUN
2009-12-18 18:02:02,ALL NEW TWITTER AUTOMATION SOFTWARE FOR YOUR PC http://bit.ly/6BiLk3 WITH UNLIMITED ACCOUNTS AND FUN TO USE - CHECKOUT OUR VIDEO
2009-12-28 12:12:54,ALL NEW TWITTER AUTOMATION SOFTWARE FOR YOUR PC http://bit.ly/6BiLk3 WITH UNLIMITED ACCOUNTS AND FUN TO USE - CHECKOUT OUR VIDEO
2009-12-31 15:32:36,Your Going To Love My Program Twitter On Autopilot http://bit.ly/6BiLk3
