time,tweet
2010-01-20 22:18:42,"Cincinnati Reds Rumors: Masset, Burton, Chapman, Volquez: The team hopes to wrap up a contract with arbitration.. http://bit.ly/7usoIE"
2010-01-31 17:10:03,"Top Stories: Cabrera to Reds, Mora Signs, Pittsburgh Owners: 1. The Cincinnati Reds signed free agent shortstop Or... http://bit.ly/99WuY8"
2010-02-01 17:25:44,"Reds, Athletics Swap Crappy Players: The Cincinnati Reds have traded center fielder Willy Taveras along with infie... http://bit.ly/bUvqNO"
2010-02-02 12:57:28,Hot Stove Prospect Watch - Homer Bailey (Cincinnati Reds): Hot Stove Prospect Watch - Homer Bailey (Cincinnati Reds) http://bit.ly/diINGZ
2010-02-05 11:05:54,The Reds 30 Million Dollar Gamble: The small market Cincinnati Reds surprised the baseball world when they won the... http://bit.ly/b4xcQQ
