time,tweet
2010-01-07 14:41:21,"130 tabbar icons for iPhone applications for Free, download them now! http://www.Glyfish.com"
2010-01-07 14:42:20,"Another set of over 160 tabbar toolbar icons for use in your iPhone applications. Completely free, go download them now! http://bit.ly/ZVuV5"
2010-01-07 14:44:42,Good article on Avoiding iPhone App Rejection From Apple http://bit.ly/49YgkF walks you through all the things you should be careful about.
2010-01-07 19:04:24,@rebekahford check out more tutorials just like that one over in our iPhone video tutorials section! http://www.iphonedevforums.com/video/
2010-01-07 19:06:45,@suddenelfilio we have a lot of really great resources on http://iphonedevforums.com to help you get started! if you are looking for some!
