time,tweet
2009-11-30 14:12:07,Anyone having issues recruiting quality reps for your business? http://bit.ly/5BMYMO Here's your solution!
2009-12-02 08:10:48,"Good Morning everyone! Great day to be doing absolutely nothing, and making a killing doing it! http://bit.ly/5BMYMO Automate your CASH!"
2009-12-02 08:24:10,Automate your ENTIRE  network marketing business! http://bit.ly/7WfGDx And turn your prospects into CASH!
2009-12-02 08:27:55,"ATTRACTION marketing...that's how to build your business http://bit.ly/5BMYMO Works for me, it will work for you too!"
2009-12-03 10:55:06,"Hello friends, I would like to share with you the tools that changed my life! http://bit.ly/5BMYMO This is every marketers dream come true!"
