time,tweet
2010-01-13 10:01:06,"To Auto Follow targeted users in Twitter, Check out - http://bit.ly/7SeE9R"
2010-01-14 10:10:02,Send Auto-reply from your Twitter accounts based on keywords - http://bit.ly/880hPf
2010-01-15 10:15:02,Manage your multiple Twitter accounts in a click - http://bit.ly/5ayZbc
2010-01-16 10:20:02,"You can Auto un-follow people, who are not following you back - Check out - http://bit.ly/4ok8OT"
2010-01-17 10:25:02,Check progress / report of all your twitter accounts in a single click - http://bit.ly/6HaVia
