time,tweet
2010-06-23 20:28:39,Eczema clears or it’s FREE http://www.theskinsociety.com/Eczema/Eczema.html
2010-06-23 20:53:04,Own and sell your very own Skin Care line http://www.theskinsociety.com/Manufacturer/Wholesale.html
2010-06-23 21:20:38,Don't do what you'll have to find an excuse for.
2010-06-24 05:24:28,Let me develop your very own Skin Care line: http://www.theskinsociety.com/Manufacturer/Wholesale.html
2010-06-24 05:36:30,It's your skin…Take good care of it: http://yourskinforever.com
