time,tweet
2010-06-14 02:44:00,Lance Whitaker – Still Alive And Dangerous! - East Side Boxing: By James Slater - 38-year-old Lance “Mount” Whitak... http://bit.ly/ajx7nX
2010-06-14 04:48:10,Fighter finds sanctuary in ring - North Bay Nugget: Jason Gauthier is going through hell to make it to heaven. He'... http://bit.ly/baZBOF
2010-06-14 05:51:48,"SPOTLIGHT: HALL OF FAME: 'Little Red,' Cosell join ... - Las Vegas Review Journal: Lopez and Schuyler were among 1... http://bit.ly/ddSgOx"
2010-06-14 07:56:15,"Paul Pierce, Celtics not 'Cavalier' about Manny ... - Examiner: Manny Pacquiao must make for a nice distraction fo... http://bit.ly/ayIAcB"
2010-06-14 10:06:20,WBO Cruiserweight Champ Marco Huck To Face Matt Godfrey ... - East Side Boxing: by James Slater - It has been conf... http://bit.ly/cskCDv
