time,tweet
2010-02-03 22:57:17,"Pivot Points: Kobe Bryant, L.A.'s Greatest Laker? Not Yet, But He's Close: Last night Kobe Bryant scored 44 points... http://bit.ly/cdvJAL"
2010-02-04 11:13:12,"Despite His Past Adversity, Many Define Kobe As The NBA's Most Celebrated Player: By ANDRE JOHNSON Bleacher Report... http://bit.ly/dkWUVT"
2010-02-04 12:14:15,Pivot Points: Have The Lakers Found The Attitude To Match Their Talent?: Hobbled by the aggravation of a sprained ... http://bit.ly/9aL6R9
2010-02-04 17:20:26,"NBA Daily Dribbles: Raptors Looking to Deal, Lakers Staying Put:   Countdown to NBA Trading Deadline: 2 Weeks What... http://bit.ly/92PS6y"
2010-02-05 10:44:17,Phil Jackson: Los Angeles Lakers' All-Time Most Winningest Coach: Phil Jackson has won his 534th  game as the Los ... http://bit.ly/cqOure
