time,tweet
2010-03-15 21:12:04,"Love doesn't make the world go round, love is what makes the ride worthwhile. http://bit.ly/3RxfxR"
2010-03-15 22:10:31,The most precious possession that ever comes to a man in this world is a woman's heart. http://bit.ly/3RxfxR
2010-03-15 23:10:02,Love and respect will make any good relationship better. http://bit.ly/3RxfxR
2010-03-16 00:00:54,The Latest News About Dating  From Twittnikka http://tinyurl.com/yjglwvr
2010-03-16 00:00:56,The Latest News About Movies  From Twittnikka http://tinyurl.com/yhobl72
