time,tweet
2009-12-10 11:56:43,"Five Secrets of True Survivors: While camping with friends in northern Israel in 1984, White had his right leg .. http://bit.ly/6kU2J4"
2009-12-10 12:34:50,Caution: Blogging Lawsuits Ahead: Every marketing expert you've ever met has probably encouraged you to start a.. http://bit.ly/8C7p8r
2009-12-10 14:36:57,Google Sues Over Alleged Work-at-Home Scams: Google filed a lawsuit Monday to try and stop companies from alleg.. http://bit.ly/7atMh4
2009-12-10 15:56:26,Book Review - Beach Money by Jordan Adler: It is an almost must to set aside a portion of your business-buildin.. http://bit.ly/7xfkP6
2009-12-11 12:50:27,A Book For a Man: To be a man is not as easy as it appears. You can see the life of a man is simple but the fac.. http://bit.ly/91ZtzG
