time,tweet
2009-12-28 19:19:06,"Get Tokyo Flash Mens ""Diode"" Watch!. Current price $0.01 - $1.80 http://www.centseller.com/a1546"
2009-12-28 19:19:36,You like to have good time? But no money? Here is your change http://www.centseller.com/special-offers/30
2009-12-28 19:58:09,When you register use #Bonus Code: CENTSELLER139 and get some extra #free bids http://www.centseller.com/loginregister.html
2009-12-29 08:01:57,Do You have bad mood? Come and bid http://www.centseller.com auctions and if you win top products with amazing prices you will feel better.
2009-12-29 08:02:38,Zune HD 16 GB Video MP3 Player! $0.01 - $1.80 http://www.centseller.com/a1560
