time,tweet
2009-11-25 23:42:37,"Oxygen Education, LLC develops high quality, #interactive, digital content for technical #education and #workforce development."
2009-11-27 22:52:23,"From #manufacturing to green technology to custom content, @OxygenEducation leads the way in quality #onlinetraining."
2009-11-28 13:45:40,Oxygen Education is proud to present Advanced Manufacturing Education for the 21st Century (AME). http://bit.ly/8xgwuu
2009-11-30 11:24:33,Here is a link to our #eLearning website: http://bit.ly/oxygeneducation - Let us know what you think! #o2ed
2009-11-30 11:27:53,#Purdue University Chooses @OxygenEducation to Develop #Green Certification - http://bit.ly/OxygenPress
