time,tweet
2010-01-31 03:54:05,"Do You Want To Reverse Diabetes DRUG FREE Within 4 Weeks, Using Safe Proven Home Remedies? 100% Guaranteed Results!  http://bit.ly/916kb3"
2010-01-31 04:00:30,"Good habits guarantee a healthy mother, healthy father and healthy baby. No Smoking. No Alcohol. No Drugs, please http://doiop.com/vhtpreg"
2010-01-31 04:51:06,The percentage of children who are overweight has doubled in the last 20 years.Childhood obesity is on the rise. http://doiop.com/ipvhcw
2010-01-31 05:38:37,KIDS WATCHING TOO MUCH T.V. ? Keep kids away from TV or computer games until they've exercised. The Answer Here: http://doiop.com/kidfanclub
2010-01-31 06:00:27,"Regular , appropriate Physical Exercise for mother,and baby to remain healthy… before during and after pregnancy http://doiop.com/vhtpreg"
