time,tweet
2009-12-19 02:27:02,Swine Flu ebook: advice to keep your family and friends safe from this virus and not become another victim. http://bit.ly/8AG21o
2009-12-20 18:21:38,"Want a great guide during xmas for gifts ideas, party planning, games ideas & new things for the holidays? http://bit.ly/59SIle"
2009-12-20 19:25:10,Swine Flu ebook: advice to keep your family and friends safe from this virus and not become another victim. http://bit.ly/8AG21o
2009-12-20 21:14:13,ebook explaining all you need to know about anxiety and depression: http://bit.ly/4EEako
2009-12-21 02:31:20,"Been compiling a great ebook/software site for popular niche areas, check it out: http://bit.ly/8chqnx"
