time,tweet
2009-12-01 02:53:10,let's make some great investments!
2009-12-22 22:32:35,mathematician claims to have invented winning investment formulas... who believes in this? http://bit.ly/7khW0P
2009-12-23 00:55:13,"besides putting our money into the stock market, an alternative is use our time to invest. http://bit.ly/7EvysA"
2009-12-23 03:20:53,"what do great investors need, a well trained brain? http://bit.ly/7Y7OCX"
2009-12-23 08:43:59,any option investors around? let's share our strategies. here're mine. http://bit.ly/7bIuZZ
