time,tweet
2009-12-09 04:17:07,"Start building income for life, 7 day free trial. Try it, you can't lose ! http://bit.ly/6xMSwS"
2009-12-09 06:34:01,I began my home-based business with zero start up costs. Sound like something that might interest you ? http://bit.ly/6xMSwS
2009-12-09 07:00:33,The Latest News About Social Network Marketing  From Dayjobkillerphx http://tinyurl.com/yh9yff8
2009-12-09 07:00:34,The Latest News About Twitter   From Dayjobkillerphx http://tinyurl.com/ygmott9
2009-12-09 07:34:00,"This online job will work for you, give it a shot for 7 days FREE ! → http://bit.ly/6xMSwS ←"
