time,tweet
2009-12-06 02:20:39,Your Teeth can be 5 times whiter. Get your 14  day FREE trial at  http://martys.offershop.net/beauty/beverly-hills-smile
2010-02-21 03:03:45,I tried this product a few months ago and my teeth are still white. http://martys.offershop.net/beauty/alta-teeth-whitening-pen
2010-02-21 03:18:26,Whitening of up to 8 shades or more!  Same Results Delivered by Dentists! http://mjs.offershop.net/cosmetics/pearl-brites-teeth-whitening
2010-02-21 14:00:10,Your Teeth can be 5 times whiter in just 5 days. Get your 14 day FREE trial at  http://martys.offershop.net/beauty/beverly-hills-smile
2010-02-22 15:47:50,American Cancer Society Relay For Life http://main.acsevents.org/site/TR/RelayForLife/RFLFY10National?px=8307781&pg=personal&fr_id=21650
