time,tweet
2009-12-05 00:52:40,Poor Amanda Knox. She was found guilty BEFORE she even walked into the Italian courtroom.How unfair is that???
2009-12-17 23:39:35,I'm looking for gifts from tv shows to auction off to start a FREE healthcare center in Greene county IN. Can anyone help??
2009-12-18 11:16:11,did bonnie tweet today??
2009-12-18 11:26:12,@llcoolj there are none so blind as those who fail to see what is happening right in front of them
2009-12-20 00:23:17,@goldman try being sprayed when you are allergic and have already told saleslady that u r.
