time,tweet
2009-12-09 10:46:18,"Hello friends, new account just set up. Nice to meet you. Peace :)"
2009-12-10 01:53:13,"Much is missing from the Law of attraction, as explained by most."
2009-12-10 11:16:11,"Days work done, off to meditate and welcome the evening, Cya tomorrow"
2009-12-11 03:00:46,"Harlan's Hypnosis secrets to the LOA are working well 4 me fast, amazing....http://meditationcoaching.com/loa"
2009-12-11 04:40:08,"Have you seen Revolutioniz yet? ""Law of Attraction"" clarity and common sense... (finally!) http://tradeconscious.com/rev"
