time,tweet
2010-01-17 14:33:24,Hey all...  Check out my list of eMerchants that offer Great Coupons and Savings.  It's FREE! http://bit.ly/507SYF
2010-01-18 02:52:41,Welcome to FindNewCoupons.com your gateway to Internet sites all about Coupons.  It's FREE and Saves you Money. http://bit.ly/507SYF
2010-01-18 04:32:57,Get FREE Coupon Listings HERE!  Find eMerchants Offering Coupons on Items You're Currently Using. http://bit.ly/507SYF
2010-01-18 05:33:09,"Use a coupon, save a buck or two...  It's fun and worth the effort.  http://bit.ly/507SYF"
2010-01-18 06:33:00,Saving money is easy when you use coupons provided by our sponsors.  http://bit.ly/507SYF
