time,tweet
2010-01-12 08:41:01,On the Road: E-Mail? Free. Internet? That'll Cost You. (source: International Herald Tribune) : As Continental .. http://bit.ly/70p5ro
2010-01-12 08:57:03,"Fiercely idiosyncratic: Italian influences in SA wine | Pendock ...: If that&#39;s art, I&#39;ma Hottentot was .. http://bit.ly/5U9cso"
2010-01-12 09:41:07,"Machaca Hill Lodge Now Brings Guests PURE H2O (source: Send2Press) : PUNTA GORDA, Belize (SEND2PRESS NEWSWIRE) .. http://bit.ly/6hjzNe"
2010-01-12 10:00:20,"Wine-carrying truck overturns, blocks I-95 Deerfield Beach ramp: BY DIANA MOSKOVITZ A tractor trailer packed wi.. http://bit.ly/4XP4OQ"
2010-01-12 10:41:56,Delta raises fees for checked bags (source: CNN) : Checking in luggage on Delta Air Lines is about to cost pass.. http://bit.ly/7XtVut
