time,tweet
2009-12-07 13:39:42,The absolute fundamental aim is to make money out of satisfying customers.  ~John Egan
2009-12-13 17:25:30,All New Fantastic Does It All  http://bit.ly/6BiLk3
2009-12-17 17:20:58,The Secret To Getting Lots Of Followers On Twitter  http://bit.ly/6BiLk3  While Having FUN
2009-12-18 18:03:49,ALL NEW TWITTER AUTOMATION SOFTWARE FOR YOUR PC http://bit.ly/6BiLk3 WITH UNLIMITED ACCOUNTS AND FUN TO USE - CHECKOUT OUR VIDEO
2009-12-28 12:17:06,ALL NEW TWITTER AUTOMATION SOFTWARE FOR YOUR PC http://bit.ly/6BiLk3 WITH UNLIMITED ACCOUNTS AND FUN TO USE - CHECKOUT OUR VIDEO
