time,tweet
2010-07-13 14:34:40,Debt Online Help Blog update: Take Immediate Action to Reduce Credit Card Debt http://bit.ly/98rjiL
2010-07-13 14:53:40,Debt Online Help Blog update: Personal Debt Management: Wipe Off your Debts http://bit.ly/9WG51K
2010-07-13 15:07:00,Debt Online Help Blog update: Debt Resolution Companies ? How Stimulus Money Makes Getting Out Of Deb... http://bit.ly/c6q5cl
2010-07-13 15:07:02,Debt Online Help Blog update: Free Debt Settlement Counseling - How to Get Help With Debt Online For ... http://bit.ly/dtsUbs
2010-07-13 15:07:04,Debt Online Help Blog update: How Do I Know Which Debt Consolidation Agency To Choose? http://bit.ly/bq7aWO
