time,tweet
2009-12-08 18:22:13,Learn how to Make Money With Google. 100% Free. No Signing Up. No Kidding. http://tinyurl.com/ykblcej
2009-12-08 18:22:59,Today we talk about what content will get you to make Google Notice you http://tinyurl.com/ykblcej
2009-12-08 18:23:40,"Secrets revealed! Learn how to make money with google adsense, WITHOUT THE GIMMICKS! http://tinyurl.com/ykblcej"
2009-12-08 18:44:27,The best way to make money with google is find a niche that works. Learn how to find a niches at http://tinyurl.com/ykblcej
2009-12-29 15:24:54,"Don't believe I make money online? Here's My Screen Shot - Prove it's fake & I'll pay you $10,000 !"
