time,tweet
2010-01-27 11:30:54,"I never thought my bad habits, of keeping a messy desk in elementary school, would come back to haunt me 15 years later"
2010-01-27 12:02:44,"Cool - 'Debt Solutions - Get Your Debts Under Control, Don't Let Them Control You' http://tinyurl.com/y9xfe7j"
2010-01-27 12:52:01,MMM.. good http://tinyurl.com/yagqa8q
2010-01-27 13:27:45,"Vanity, bitches and magazines and movie screens."
2010-01-27 14:46:05,Lots of good info here 'What Are Corporate Bonds?' http://tinyurl.com/ya46pmt
