time,tweet
2009-12-27 03:08:16,Video Wizard - Converts both video files and DVDs in one affordable package - http://bit.ly/4C1emO
2009-12-27 04:36:00,Step-by-step wizard interface guides you through the conversion process - Video Wizard -  http://bit.ly/4C1emO
2009-12-27 05:35:39,Super easy-to-use video and DVD conversion software - Video Wizard - http://bit.ly/4C1emO
2009-12-27 06:35:44,Video Wizard - Easily converts DVDs and Video Files into almost any format for play on your iPhone or iPod - http://bit.ly/4C1emO
2009-12-27 07:35:39,VideoWizard optimizes any converted video specifically for your iPod or iPhone -  http://bit.ly/4C1emO
