time,tweet
2010-02-05 20:09:49,Eat less meat. Stir Fries or lite stews are an excellent way to reduce meat intake and still eat hearty meals.
2010-02-05 20:15:50,"Ripen tomatoes, peaches or other thin skinned fruits: set them in the sun on a tray lined with newspaper. When ripe, gently place in fridge"
2010-02-05 20:21:51,For preparing meals think in terms of the whole work week. Prep up on Saturday & Sunday & utilize through the week - you'll be so fast.
2010-02-06 13:34:57,Tune up the furnace if you haven't done it before. Read up online about how to do it and you may be able to yourself. Anything to save Money
2010-02-06 13:44:58,Lose Weight by: drinking a glass of water first thing in the morning when you wake up everyday.
