time,tweet
2009-12-11 11:55:08,Join the train and get followers: http://tweeterfollowers.com
2009-12-11 12:02:45,Things you don't know can't hurt you. But the things you know can make you more powerful.
2009-12-11 12:05:34,"Twitter Auto Pilot, that is the name of the game, and if you try it .. this is no joke. See the review site here: http://bit.ly/8Jgstc"
2009-12-11 17:04:08,Have you heard about Affiliate X? Anyone tried it?
2009-12-13 04:27:34,"To the church and back. A pretty old routine of mine ... The PC is a magnet, and it's getting me closer and closer to it. :P Good Sunday"
