time,tweet
2010-01-08 04:00:32,"I cant ge you a surefire formula for success, but I can ge you a formula for failure try to please everybody all the time.Pls RT"
2010-01-08 05:00:35,One of the keys to happiness is a bad memory.Pls RT
2010-01-08 06:00:31,"Between two evils,I always pick the one I never tried before.Pls RT"
2010-01-08 07:01:05,"I may not have gone where I intended to go, but I think I have ended up where I intended to be. Pls RT"
2010-01-08 08:00:53,"The true man wants two things danger and play.For that reason he wants woman,as the most dangerous plaything.Pls RT"
