time,tweet
2009-12-20 22:45:08,Oliver in talks to return to Texas: Oliver in talks to return to Texas http://bit.ly/7ogt5d
2009-12-20 22:45:26,A's close to signing Crisp (source: Fox Sports) : The Oakland Athletics are close to a deal with free-agent out.. http://bit.ly/6idsXh
2009-12-21 00:46:31,Stars aligning for Lee's success in Seattle: Stars aligning for Lee's success in Seattle http://bit.ly/6CzLh7
2009-12-21 02:48:12,"Odds & Ends: Fehr, Indians, Swisher: Sunday night links... Former MLBPA head Donald Fehr talked to Daniel Barba.. http://bit.ly/5Vt80L"
2009-12-21 02:49:56,College baseball player found dead in Calif. (source: Topix.net) : A Cal State Long Beach baseball player who d.. http://bit.ly/634eMe
