time,tweet
2010-01-18 14:34:51,Profit from video like the pro's using this brutally powerful video marketing software! -> http://bit.ly/video-player
2010-01-18 17:02:10,I have fund to day a perfect tool - check out in my next tweets - you can save a lot!
2010-01-19 07:02:04,Welcom to WebTraffi007 - Get a lot of free tools with http://www.web-traffic-tools.info
2010-01-19 08:02:08,I struggled for ages with video marketing until I found this powerful software! ->
2010-01-19 10:06:17,Make money on autopilot with this video marketing software -> http://bit.ly/video-player
