time,tweet
2010-01-05 04:01:03,Released Today! CHUCK: THE COMPLETE SECOND SEASON [6 DVDs/585 min.] More wacky spy shenanigans. WATCH PROMOS. $36.99 http://bit.ly/7o7E9H
2010-01-05 04:57:38,"Released Today! BIG LOVE: THE COMPLETE THIRD SEASON [4 DVDs/600 min.] ""No other TV series like it"" WATCH PROMO. $36.99 http://bit.ly/8XFQCt"
2010-01-05 06:02:12,"BIG FAN [DVD] Dark sports comedy w/Patton Oswalt, Marcia Jean Kurtz. Release Date 1/12/10. Only $19.99 http://bit.ly/6C2grE"
2010-01-05 07:05:04,"WRONG TURN AT TAHOE [DVD] Suspenseful mob drama w/ Harvey Keitel, Cuba Gooding Jr. Release Date 1/12/10. Only $12.99 http://bit.ly/7lI1JL"
2010-01-05 07:54:07,ALICE I HAVE BEEN: A NOVEL [Hardcover] Historical novel by Melanie Benjamin @MelanieBen. Release Date 1/12/10. $16.50 http://bit.ly/8oyQ98
