time,tweet
2010-01-03 08:12:07,Unique Workouts That Burn Stomach Fat http://bit.ly/855Gzq
2010-01-03 11:08:53,Trade as BIG or as SMALL as you want! This is something that ONLY the Forex market allows you http://bit.ly/8e4ZGz
2010-01-03 12:09:31,Surprising Fat Burning Foods http://bit.ly/855Gzq
2010-01-03 13:11:36,A Forex Robot that in LIVE trading doubles ANY account like clockworks http://bit.ly/8e4ZGz
2010-01-03 14:37:34,You Need To Know ABSOLULTELY NOTHING About The Forex Market Or Forex Trading To Benefit Day In And Day Out http://bit.ly/8e4ZGz
