time,tweet
2009-12-24 19:16:34,Fat Burning Furnace Free Download: Fat burning furnace ultimate fitness system? Of all the weight loss program .. http://bit.ly/4yTRwj
2009-12-24 19:41:09,Get your free fat burning gift at http://3c5930pdt-dugpam1eme6ftm38.hop.clickbank.net/?tid=MARYWEATHERS
2009-12-24 19:46:28,Fat Burning Furnace Free Download: Fat burning furnace ultimate fitness system? Of all the weight loss program .. http://bit.ly/4vM9eC
2009-12-24 19:50:43,Hurry & get your free 21 day free trial for fat burning furnace at: http://3c5930pdt-dugpam1eme6ftm38.hop.clickbank.net/?tid=MARYWEATHERS
2009-12-24 20:16:14,Fat Burning Furnace – High Speed Techniques for Long Term Weight ...: Fat Burning Furnace – Good Quick Workouts.. http://bit.ly/8bC7bk
