time,tweet
2009-12-29 01:44:20,First Impression Counts!:    It only takes just a passing glance or roughly three seconds for someone to judge.. http://bit.ly/7m73LI
2009-12-29 02:09:07,Check out 'Avatar' Game by Ubisoft (XXX) http://bit.ly/7uU3cP
2009-12-29 03:39:50,eight shapes of pearls for creating pearl earrings:    The classic elegance and luster of pearl jewelry has be.. http://bit.ly/8zXbLr
2009-12-29 04:49:39,Executive Job Search Tips - How To Navigate The Job Fair For Executive Jobs: By Jason LeeAttending job fairs is.. http://bit.ly/8B6odW
2009-12-29 05:51:44,Is It Possible To Have A Wind Turbine At My House?: The sole way of knowing if a wind turbine will work at your.. http://bit.ly/63c2ps
