time,tweet
2010-03-25 10:36:53,WEBSITE SUBMITTER – MPS AUTO WEBSITE SUBMITTER – FREE TRIAL: High Search Engine Rankings MPS Auto Website Submitte... http://bit.ly/drqrrs
2010-03-25 10:36:54,"Key To Success In ""Internet Marketing"": http://www.signupandmakedollars.com/ The internet marketing industry is th... http://bit.ly/bUrDQN"
2010-03-25 10:36:55,SEO Software: SEO Elite v4.0 – Project 7: http://RichQuickReview.com/ This is one video in my series about SEO Eli... http://bit.ly/crJpq6
2010-03-25 10:36:56,Playtech Casino Software Preview: http://www.casinoman.net/reviews/casinosoftware/playtech-review.asp – A preview ... http://bit.ly/b2pLEj
2010-03-25 18:37:02,"I Have It,ThisThing Really Works!! But I'd Tell Them To Fix The Site's Exit http://traffic2o.com/rmt Click Now"
