tid,time,tweet
290776734691889152,Mon Jan 14 11:05:50 +0000 2013,Mi annoio. Ora inizio a preferitare un po'
290776174278356992,Mon Jan 14 11:03:36 +0000 2013,Chi ha inventato i compiti per casa deve bruciare all'inferno per l'eternità
290774897788059649,Mon Jan 14 10:58:32 +0000 2013,@faith2393 Com'é la maturità? :(
290774553867718656,Mon Jan 14 10:57:10 +0000 2013,'Dimmi Van Gogh.' 'VAN GOGH.' [Cit. Compagno di classe]
290764325625421824,Mon Jan 14 10:16:32 +0000 2013,@faith2393 Non mi lasciano lo spazio per il sonno. °°
290722206806319104,Mon Jan 14 07:29:10 +0000 2013,@13_stefana Noi l'anno scorso lo abbiamo fatto e non è successo niente. Hanno solo chiamato il vice-preside. E cazziato i nostri genitori.
290721557398040576,Mon Jan 14 07:26:35 +0000 2013,Voglio dormire altri due giorni di fila.
290657266397499392,Mon Jan 14 03:11:07 +0000 2013,So che ci siete. Dai twittate.
290656778029514753,Mon Jan 14 03:09:10 +0000 2013,Ho freddo.
290618763966046208,Mon Jan 14 00:38:07 +0000 2013,"Oh, quando sto su twitter a quest'ora voi non ci state mai, sta sera che devo studiare la mia tl sta esplodendo. Brutti stronzi"
290616668047147008,Mon Jan 14 00:29:47 +0000 2013,"È l'1:30. Posso farcela. In fondo mi restano da studiare solo Lautrec, l'art-nuveo, Klimt e Basile. Nessun problema."
290568025004978177,Sun Jan 13 21:16:30 +0000 2013,@faith2393 Ho i capelli gonfi e non ho un filo di trucco. Sembro la brutta copia di Samara Morgan °-°
290567880771252228,Sun Jan 13 21:15:55 +0000 2013,@faith2393 Non nutro simpatia per i vampiri e.e
290559407517995009,Sun Jan 13 20:42:15 +0000 2013,"Ogni volta che c'é un trend tipo questo, #personecheamo, c'é sempre qualcuno che twitta 'se non sei stato menzionato stringiamoci la mano'"
290557413638144002,Sun Jan 13 20:34:20 +0000 2013,"Se qualcuno mi vedesse nelle condizioni in cui sono adesso, dovrei ucciderlo."
290557297544007681,Sun Jan 13 20:33:52 +0000 2013,@faith2393 Ti hanno attaccato i vampiri? D:
290534912149315584,Sun Jan 13 19:04:55 +0000 2013,Devo preservare il mio anonimato. Se elimino tutti i tweet mi unfollowate?
290534829420847105,Sun Jan 13 19:04:35 +0000 2013,Se scrivo il mio vecchio nick sulla ricerca spuntano ancora i miei vecchi tweet.
290528304153370624,Sun Jan 13 18:38:40 +0000 2013,"@faith2393 ahahahahahah devo finire di ridere, ci risentiamo tra un'oretta. Ahahahah"
290527679126581248,Sun Jan 13 18:36:11 +0000 2013,@iheartpaolo D: ok non ho un grande spirito d'osservazione D:
290527229547540481,Sun Jan 13 18:34:23 +0000 2013,"@faith2393 ommioddio non farlo, sei ancora in tempo! D:"
290527033019215873,Sun Jan 13 18:33:37 +0000 2013,"@iheartpaolo la manica della felpa mi sembra un gesso, la cravatta invece il nastro che tiene il braccio appeso al collo. :S"
290526037203361792,Sun Jan 13 18:29:39 +0000 2013,Finisco il mio té e torno a studiare. Uffa.
290525522910400514,Sun Jan 13 18:27:37 +0000 2013,@faith2393 AHAHAHAH non ti montare la testa adesso e.e
290524782863187969,Sun Jan 13 18:24:40 +0000 2013,"""Non credo che, in questo preciso momento, ci sia qualcuno o qualcosa in grado di tirarmi sù più della mia tl"" TRANNE LE STORIELLE DI ANDREA"
290524350346579968,Sun Jan 13 18:22:57 +0000 2013,"@faith2393 hai ragione, devo correggermi."
290524151473659904,Sun Jan 13 18:22:10 +0000 2013,Bugie.
290522231098982400,Sun Jan 13 18:14:32 +0000 2013,"Non credo che, in questo preciso momento, ci sia qualcuno o qualcosa in grado di tirarmi sù più della mia tl."
290521070639915008,Sun Jan 13 18:09:55 +0000 2013,"Come antidepressivo, twitter funziona più del gelato."
290520001713156097,Sun Jan 13 18:05:40 +0000 2013,"Ogni volta che vedo l'icon di @iheartpaolo in tl, ho l'impressione che abbia un braccio ingessato."
290518823562530816,Sun Jan 13 18:00:59 +0000 2013,Diario di una nerd pornostar
290491913579151360,Sun Jan 13 16:14:03 +0000 2013,Basta. Vi sfotto però vi amo.
290491832536821761,Sun Jan 13 16:13:44 +0000 2013,Il mio idolo non mi segue su twitter. Mi taglierò in attesa di trovare il coraggio di farla finita per sempre. #logicaditwitter
290491524037369856,Sun Jan 13 16:12:31 +0000 2013,"Quella ragazza è bella. Trovo bella quella ragazza, devo essere per forza bisessuale. #logicaditwitter"
290491237826428928,Sun Jan 13 16:11:22 +0000 2013,Ho degli sbalzi d'umore; ommioddio allora sono bipolare! #logicaditwitter
290490323765968896,Sun Jan 13 16:07:44 +0000 2013,"Voglio fare la scrittrice a tempo pieno, e l'attrice di teatro. Quanto guadagna uno scrittore?"
290489996241149953,Sun Jan 13 16:06:26 +0000 2013,"Non so cosa fare dopo la maturità, help e stra help"
290475678938329090,Sun Jan 13 15:09:33 +0000 2013,"L'unica cosa che non vorrei mai, è che qualcuno dicesse di me: ""poveretta""."
290475240939720704,Sun Jan 13 15:07:48 +0000 2013,"A volte mi viene voglia di dire tutto, tutto quello che nessuno sa di me, e vedere che faccia fanno."
290474317995728896,Sun Jan 13 15:04:08 +0000 2013,Mi sto stancando di tutti.
290473458775777280,Sun Jan 13 15:00:43 +0000 2013,"'Quando finisce un amore non è mai colpa di uno solo, ma di tutti e tre.'"
290470942747000832,Sun Jan 13 14:50:44 +0000 2013,Super ultra mega palmface.
290284315047243776,Sun Jan 13 02:29:08 +0000 2013,"Chi di spada ferisce, di spada perisce."
290283908304629760,Sun Jan 13 02:27:31 +0000 2013,"Sto di merda e non trovo i calmanti, ma che cazzo è sta sera oh tutte a me."
290264667132137472,Sun Jan 13 01:11:04 +0000 2013,Io conquisterò il mondo e vi rinchiuderò in una fognatura.
290263454638542848,Sun Jan 13 01:06:15 +0000 2013,Vi sorprenda la diarrea mentre state scopando
290263304943849472,Sun Jan 13 01:05:39 +0000 2013,Buttate il sangue dal culo esseri inutili alla società.
290262416103718912,Sun Jan 13 01:02:07 +0000 2013,"Se in questo momento avessi per mano una pistola, non oso immaginare il danno che farei."
290262163568852992,Sun Jan 13 01:01:07 +0000 2013,"Ringhio, se qualcuno mi rivolge la parola ringhio come una belva selvaggia."
290261979321479169,Sun Jan 13 01:00:23 +0000 2013,RT @JacopoJumanji: Diocccane all'ennesima potenza
290261503423180802,Sun Jan 13 00:58:29 +0000 2013,In tutto questo #HappyBirthdayLiamHemsworth
290261396053164032,Sun Jan 13 00:58:04 +0000 2013,"RT @beadleshug: è fantastico come le persone qui su twitter,nonostante non si conoscano,riescano a far sorridere le persone più di quell ..."
290260166857871361,Sun Jan 13 00:53:11 +0000 2013,"Esco sempre per fare un favore agli altri ormai, cazzo faccio solo nervi. Ora basta, sabato prossimo prendo un treno a caso e torno lunedì."
290255666579402753,Sun Jan 13 00:35:18 +0000 2013,"Dio cane quando me ne voglio andare per i cazzi miei ho sempre il telefono scarico, vaffanculo pure lui!!!"
290255404187938816,Sun Jan 13 00:34:15 +0000 2013,"Bellissimo uscire, stare 2 ore in mezzo al traffico, mezzora fuori e puoi tornare. Odio tutti cazzo, tutti."
290200722480455681,Sat Jan 12 20:56:58 +0000 2013,*eliminatweeteliminatweeteliminatweet* Dicevamo?
290200320540286978,Sat Jan 12 20:55:22 +0000 2013,Devo essere più discreta su twitter e.e
290195279905423362,Sat Jan 12 20:35:20 +0000 2013,Sei pregato di non stalkeralmi pls ♥
290188162909745154,Sat Jan 12 20:07:04 +0000 2013,"Non sono cattiva, qualcuno deve pur svegliare queste belle addormentate."
290187912228786176,Sat Jan 12 20:06:04 +0000 2013,"Aprite gli occhi. Non ha paura di soffrire, semplicemente non gliene frega abbastanza."
290187568170037248,Sat Jan 12 20:04:42 +0000 2013,"Le ragazze innamorate sono ridicole. lui: ""profumi come la mia merda"" lei: FA IL DURO PERCHÉ HA PAURA DI SOFFRIRE"
290182861242372096,Sat Jan 12 19:46:00 +0000 2013,"I sentimenti hanno la data di scadenza, non lo sapevate?"
290182449038761984,Sat Jan 12 19:44:21 +0000 2013,"Qualunque cosa lui ti dica, tu lascia perdere. Tanto un giorno si alzerà e sarà diverso. Sono fatti così."
290177675639783425,Sat Jan 12 19:25:23 +0000 2013,Miaooooow.
290177644266409986,Sat Jan 12 19:25:16 +0000 2013,Quando mi arriva un sms il mio cellulare miagola.
290177126169194496,Sat Jan 12 19:23:12 +0000 2013,@faith2393 Athos.
290176251451293696,Sat Jan 12 19:19:44 +0000 2013,Io sono la cavaliera dell'Apocalisse
290176195801251840,Sat Jan 12 19:19:30 +0000 2013,Vi dispiace se vi uccido tutti?
290174084011159555,Sat Jan 12 19:11:07 +0000 2013,Se fosse una pianta sarebbe un soffione.
290157859096911872,Sat Jan 12 18:06:39 +0000 2013,"Il mio cassetto è pieno di reggiseni, mutande, calzini, sogni."
290154748680732672,Sat Jan 12 17:54:17 +0000 2013,Studiare è deprimente.
290154189332553731,Sat Jan 12 17:52:04 +0000 2013,Studiare il sabato è tanto deprimente.
290153438287900672,Sat Jan 12 17:49:05 +0000 2013,"@faith2393 Addirittura. Poi me ne racconterai qualcuno, per curiosità e.e"
290150938591764480,Sat Jan 12 17:39:09 +0000 2013,"@faith2393 già, per fortuna ci sono i cornuti. :D"
290150655061016576,Sat Jan 12 17:38:01 +0000 2013,Mi chiedo se io non sia l'unica a fare sogni tanto insensati.
290150494146531330,Sat Jan 12 17:37:23 +0000 2013,Per tutta risposta*
290149355028115456,Sat Jan 12 17:32:51 +0000 2013,"- uguali ai miei. Terrorizzata, urlavo, e loro per tutta iniziavano a urlarmi contro, con sguardo diabolico, spaventandomi di più. Fine."
290149132130193409,Sat Jan 12 17:31:58 +0000 2013,"-entravo dentro, facevo per chiudere la porta, ma non c'era. Anche tutti iieo colleghi si comportavano allo stesso modo,tutti con i capelli-"
290148886000070656,Sat Jan 12 17:30:59 +0000 2013,"- mi toccavo i capelli e tutti facevano lo stesso. Ora mi fissavano tutti. Indietreggiavo, e loro avanzavano. Sembravano degli zombie. -"
290148544898273281,Sat Jan 12 17:29:38 +0000 2013,"trovavo nel passato. Poi un dettaglio mi inquietava. Osservavo bene: tutti avevano i capelli rossi e neri, uguali ai miei. Tutti, tutti. -"
290148287011500032,Sat Jan 12 17:28:36 +0000 2013,"- cercavano di far ragionare mia zia, ma lei voleva tornarsene a Messina. Volevo intervenire, ma non potevo. Mio cugino era piccolo: mi -"
290148060170948608,Sat Jan 12 17:27:42 +0000 2013,- l'altra! Mi sentivo un'idiota. La sera uscivo fuori e c'era mia nonna che litigava con mia zia. Faceva freddo. Tutti i miei parenti -
290147747070361600,Sat Jan 12 17:26:28 +0000 2013,"- meccanismo, ma tutti mi fissavano come se stessi dicendo qualcosa di scontato. Mi mostravano la porta e aveva due maniglie, una dentro -"
290147566694309890,Sat Jan 12 17:25:45 +0000 2013,"- porta grande e riuscivo ad aprirla. Dentro, i miei colleghi tranquilli nella mia cucina. Correvo da loro e spiegavo di aver capito il -"
290147342332604417,Sat Jan 12 17:24:51 +0000 2013,"- avevo svelato il mistero! Una porta dentro un'altra porta. Da fuori se ne apriva una, da dentro un'altra. Iniziavo a spingere forte la -"
290146973837824000,Sat Jan 12 17:23:23 +0000 2013,"- Dentro un rettangolo più grande dello stesso colore del muro, quindi si mimetizzava. La maniglia era più piccola del normale. Capivo che -"
290146757155901440,Sat Jan 12 17:22:32 +0000 2013,"- porta alle spalle. Disperata correvo verso la porta. Stavo per scoppiare in lacrime, quando mi accorgevo di un dettaglio. La porta era -"
290146256318259200,Sat Jan 12 17:20:32 +0000 2013,"- posare le mie cose in una stanza e seguirli. Poggiavo la mia borsa sul letto, ma quando facevo per andare da loro si erano già chiusi una-"
290146054035361793,Sat Jan 12 17:19:44 +0000 2013,"- da quel caos sbucavano fuori il professore e un ragazzo, li abbracciavo spaventata e gli spiegavo cosa mi era successo. Mi dicevano di -"
290145754100662273,Sat Jan 12 17:18:33 +0000 2013,"- una cucina vuota. La richiudevo e le dicevo che era la porta sbagliata, ma continuava a fissarmi e sorridere senza rispondere. Alla fine -"
290145420137623552,Sat Jan 12 17:17:13 +0000 2013,"- fare. Una ragazza continuava a scrutarmi curiosa, sorridendo, ma senza parlarmi. Alla fine mi indicava una porta, la aprivo ma era solo -"
290145079908241409,Sat Jan 12 17:15:52 +0000 2013,"- a quelle persone, ma nessuno mi ascoltava. Mi guardavano come se fossi matta e tornavano a farsi il loro. Ero disperata, non sapevo cosa -"
290144794997571584,Sat Jan 12 17:14:44 +0000 2013,"- colleghi, bensì un altro gruppo di universitari. Ero addirittura finita in un'altra casa, uguale alla nostra? Iniziavo a chiedere aiuto -"
290144389458718720,Sat Jan 12 17:13:07 +0000 2013,"- in una stanza e non riuscivo a ritrovare i miei amici. A un certo punto sentivo dei rumori: consolata, li seguivo, ma non trovavo i miei -"
290144079898107904,Sat Jan 12 17:11:53 +0000 2013,"-quindi mi facevo coraggio e iniziavo anche io a girare per la casa. Alla fine mi perdevo, non riuscivo a tornare indietro, arrivavo sempre-"
290143795104870401,Sat Jan 12 17:10:46 +0000 2013,- La porta per tornare in cucina e mi ritrovo in un'altra stanza. Mi accorgevo che tutti riuscivano a non perdersi e arrivare dove volevano-
290143531417358336,Sat Jan 12 17:09:43 +0000 2013,- C'era solo un problema: le stanze erano collegate da loro attraverso dei labirinti. Per esempio: io entro nel salone dalla cucina. Riapro-
290142990113058819,Sat Jan 12 17:07:34 +0000 2013,"Andavo all'uni. Io, dei colleghi e un professore avevamo affittato una casa tutti insieme. Era bellissima, molto minimale, dipinta da poco.-"
290142142414864385,Sat Jan 12 17:04:11 +0000 2013,"Ho fatto un sogno assurdo, ve lo racconto. Allora"
290141963158700032,Sat Jan 12 17:03:29 +0000 2013,"@faith2393 Lo so, mai rassegnarsi, MAI. #sonogemelli"
290110696933429248,Sat Jan 12 14:59:14 +0000 2013,Rassegnarmi. Rassegnarmi.
290091725345673218,Sat Jan 12 13:43:51 +0000 2013,"Da oggi ogni volta che mi unfollowa qualcuno unfollowo io qualcun altro, così sfogo la rabbia. Tzé."
290084027656970240,Sat Jan 12 13:13:16 +0000 2013,"Passo tre quarti della mia vita nel bagno. Amo il mio bagno. A volte mi addormento sul tappeto con il piumone, e studio sempre lì per terra."
290078847989325824,Sat Jan 12 12:52:41 +0000 2013,Il bello di twitter è anche sapere parlare di problematiche attuali senza guardare il telegiornale.
289880259367677954,Fri Jan 11 23:43:34 +0000 2013,"Mia nonna aveva messo per sbaglio il condizionatore freddo e si è gelata la casa, è andata nel panico. Troppo ridere."
289879795607666688,Fri Jan 11 23:41:43 +0000 2013,"@faith2393 Non hai molta fantasia con i nickname, vero? :D Fatto!"
289876497773256704,Fri Jan 11 23:28:37 +0000 2013,Se c'é qualcuno che gioca a Ruzzle contro di me lo amo tanto tanto.
289875962890448896,Fri Jan 11 23:26:29 +0000 2013,Non oso immaginare in che condizioni siano i miei sims.
289865052129996800,Fri Jan 11 22:43:08 +0000 2013,Mi sto ibernando. Stupido freddo.
289859386439000064,Fri Jan 11 22:20:37 +0000 2013,So che non sono abbastanza. Non è necessario che continui a ricordarmelo.
289852048449617920,Fri Jan 11 21:51:28 +0000 2013,@cd125 Diciamo che se non sono lesbiche lo diventano per necessità.
289848928483024896,Fri Jan 11 21:39:04 +0000 2013,Già voi andate a dormire e io ancora sto studiando. Ingiustizia
289848761679757312,Fri Jan 11 21:38:24 +0000 2013,@cd125 E perché? :O
289848051504386048,Fri Jan 11 21:35:35 +0000 2013,Ho deciso di chiudermi in convento.
289847723514003457,Fri Jan 11 21:34:17 +0000 2013,@faith2393 Che cosa falsamente tenera :')
289839931226988544,Fri Jan 11 21:03:19 +0000 2013,"@faith2393 Un classico, ero sarcastica infatti :D la scuola ti riempe inevitabilmente il cervello di doppi sensi. :S"
289838783275352064,Fri Jan 11 20:58:45 +0000 2013,Anche voi quando fate pipì e c'é qualcuno in casa cercate di non fare rumore?
289834721964347392,Fri Jan 11 20:42:37 +0000 2013,"Io sono fortunata, la più fortunata del mondo."
289833944793374721,Fri Jan 11 20:39:31 +0000 2013,"@faith2393 AHAHAHAHAHAH uhm, sorry, la mia mente troppo ingenua non aveva notato il doppio senso. (?)"
289827031640846336,Fri Jan 11 20:12:03 +0000 2013,Lalalalala pereperepere lalalalalala perepereperepere :D
289826597882712065,Fri Jan 11 20:10:20 +0000 2013,"""Ehi"" EHI, FOTTITI, EHI!!!!!!"
289826483269144576,Fri Jan 11 20:09:52 +0000 2013,@faith2393 Allora sei proprio la pistola più veloce del west.
289818281622269953,Fri Jan 11 19:37:17 +0000 2013,Potrei morire di ansia.
289818239217836032,Fri Jan 11 19:37:07 +0000 2013,@faith2393 Se è un'altra battuta temo che dovrai spiegarmela :S
289818151640776705,Fri Jan 11 19:36:46 +0000 2013,@faith2393 Ma è bella :')
289803454136852481,Fri Jan 11 18:38:22 +0000 2013,@faith2393 Non ti piace? e.e
289801414086098944,Fri Jan 11 18:30:16 +0000 2013,"""Una macchina prima per poco non mi ha messo sotto. Lo avesse fatto, almeno finiva tutto"""
289799008417890304,Fri Jan 11 18:20:42 +0000 2013,FANCULO MI FA SCHIFO LO STUDIO DATEMI UNA CANNA TIPO
289798299404361730,Fri Jan 11 18:17:53 +0000 2013,Va bene. Ora studio. Farò come Leopardi. Fuggirò dai pensieri rifugiandomi nello studio. Non posso fallire.
289797086038355968,Fri Jan 11 18:13:04 +0000 2013,"Cazzo scrivi qualcosa. Scrivi ""vaffanculo"", ""ti odio"", ""hai rotto il cazzo"", ""fuori dalle palle"", ma DAMMI UN SEGNO."
289795928276217857,Fri Jan 11 18:08:28 +0000 2013,Raccontatemi un barzelletta pls.
289795814237278208,Fri Jan 11 18:08:00 +0000 2013,"Ho bisogno di una sigaretta, devo uscire ma sto studiando. Esami di merda. Compiti di merda. Merda merda merda. Tutto merda. Pure tu."
289794056740032513,Fri Jan 11 18:01:01 +0000 2013,Non so se ho reso il concetto. Ho le budella intrecciate.
289793949734957056,Fri Jan 11 18:00:36 +0000 2013,Va da schifo.
289793913852669952,Fri Jan 11 18:00:27 +0000 2013,Va di merda.
289793720960831488,Fri Jan 11 17:59:41 +0000 2013,Malissimo.
289793681983156224,Fri Jan 11 17:59:32 +0000 2013,"Va male, male, male."
289763753787019266,Fri Jan 11 16:00:37 +0000 2013,DIO CAZZO STO SCLERANDO
289763530855575553,Fri Jan 11 15:59:43 +0000 2013,"@faith2393 Sì! Inietta, iniettali tutti!"
289763311732527106,Fri Jan 11 15:58:51 +0000 2013,Vorrei che qualcuno mi rompesse un vaso in testa per farmi dormire un paio d'ore.
289763024435286017,Fri Jan 11 15:57:43 +0000 2013,"Ho il cuore che è un martello, in gola e nel petto. Tachicardia portami via. (?)"
289762708994289665,Fri Jan 11 15:56:28 +0000 2013,@faith2393 E morfina.
289759104128401408,Fri Jan 11 15:42:08 +0000 2013,"Sto uno schifo. Sto uno schifo e devo studiare, grande."
289755272061280256,Fri Jan 11 15:26:54 +0000 2013,"Calma, è tutto ok, sono solo paranoica."
289736625821478912,Fri Jan 11 14:12:49 +0000 2013,A me fanno schifo anche le farfalle.
289710264889274369,Fri Jan 11 12:28:04 +0000 2013,Scuola. Ti odio profondamente.
289709354029039616,Fri Jan 11 12:24:27 +0000 2013,RT @GiadaB_: Ho anestetizzato i miei sentimenti talmente a lungo che ora ho davvero il desiderio di provare qualcosa e non ci riesco.
289689829506174976,Fri Jan 11 11:06:52 +0000 2013,"@faith2393 Mi piace, conquisteremo il mondo *o*"
289689676057567233,Fri Jan 11 11:06:15 +0000 2013,Continuano a followarmi strani contatti chiamati tipo VBCJCDR644HJM60
289688765423828992,Fri Jan 11 11:02:38 +0000 2013,La gente comune sale le scale. Io le zucchero.
289688005495627776,Fri Jan 11 10:59:37 +0000 2013,@faith2393 Ssh non infierire.
289687633041424384,Fri Jan 11 10:58:08 +0000 2013,"@faith2393 Dovremmo fondare un'associazione, give me five."
289687311023751168,Fri Jan 11 10:56:51 +0000 2013,Addio Iris.
289687266786439168,Fri Jan 11 10:56:41 +0000 2013,Addio rollò
289686630233686016,Fri Jan 11 10:54:09 +0000 2013,Addio salumi alle 3 di notte
289686544745394176,Fri Jan 11 10:53:49 +0000 2013,Addio mcdonald's e burger king
289686454890790912,Fri Jan 11 10:53:27 +0000 2013,Addio cordonbleu
289686450235113472,Fri Jan 11 10:53:26 +0000 2013,Addio hot dog
289686233817419776,Fri Jan 11 10:52:34 +0000 2013,@faith2393 Se non lo so io :\
289685886755549184,Fri Jan 11 10:51:12 +0000 2013,"Diventerò vegetariana, da adesso."
289684307935645696,Fri Jan 11 10:44:55 +0000 2013,Mi da un fottuto fastidio quando dicono che il pentacolo è un simbolo satanico. Ignoranti di merda.
289683514276847616,Fri Jan 11 10:41:46 +0000 2013,@faith2393 il mukkashake :O
289681697417605120,Fri Jan 11 10:34:33 +0000 2013,"Ucciditi, datti fuoco, sciogliti nell'acido, ti prego libera il mondo dalla tua puttanaggine."
289681384048558080,Fri Jan 11 10:33:18 +0000 2013,È entrata in classe quella troia altezza pompino.
289681224342052865,Fri Jan 11 10:32:40 +0000 2013,"Però i capelli fuxia non mi piacciono. Magari rosa pallido, ma fuxia no."
289680782841241601,Fri Jan 11 10:30:55 +0000 2013,Quelle che si fanno i capelli verdi/turchesi/bianchi le amo prima di conoscerle. Troppa stima.
289680234817658880,Fri Jan 11 10:28:44 +0000 2013,"Secondo la mia teoria le bionde sono stupide, le rosse sono stronze e le nere sono ninfomani."
289679164175446016,Fri Jan 11 10:24:29 +0000 2013,"Prof: ""sapete come si fa il formaggio?"" Il mio compagno: ""si shakerano le mucche."" D:"
289678810499129344,Fri Jan 11 10:23:05 +0000 2013,"La mia prof che prima mi iscrive alle olimpiadi di italiano e poi me lo comunica, ah ok. °°"
289678614679662593,Fri Jan 11 10:22:18 +0000 2013,@faith2393 Non è colpa mia se soffri di fifonaggine :D
289678056979845120,Fri Jan 11 10:20:05 +0000 2013,"RT @faith2393: #FF per @iosonounastrega , l'adorabile streghetta che non mi ha fatto dormire neanche oggi #dannatifantasmi xD"
289677842294386688,Fri Jan 11 10:19:14 +0000 2013,RT @TED_ita: Quel momento in cui parli da solo e inizi a ridere come un idiota... perché sei così dannatamente divertente.
289649143125782528,Fri Jan 11 08:25:11 +0000 2013,"Twitter, sappi che mi stai rovinando la media."
289648940289236992,Fri Jan 11 08:24:23 +0000 2013,Non c'ho voglia di ascoltare le lezioni oggi.
289547836775886848,Fri Jan 11 01:42:38 +0000 2013,Parlo sola uao. Vado alla ricerca di following notturni.
289547141154734080,Fri Jan 11 01:39:52 +0000 2013,Siete tutti dei ghiri eh.
289546897629261824,Fri Jan 11 01:38:54 +0000 2013,Sono di nuovo sola.
289493297142059009,Thu Jan 10 22:05:55 +0000 2013,@Roberta_Navy @faith2393 AHAHAHAHAH mi piscio AHAHAH lei.
289491235926843392,Thu Jan 10 21:57:43 +0000 2013,Ho appena scoperto che ridere mentre ci si soffia il naso non è una cosa bella.
289490933282652161,Thu Jan 10 21:56:31 +0000 2013,"@Roberta_Navy @faith2393 Abbiamo litigato di recente, ti ho detto tutto."
289488619100573698,Thu Jan 10 21:47:19 +0000 2013,@Roberta_Navy @faith2393 Sparane una a caso ahahahah
289488574510940160,Thu Jan 10 21:47:09 +0000 2013,@Roberta_Navy @faith2393 Averli in classe durante un cambio d'ora è tragico a volte.
289488413382553601,Thu Jan 10 21:46:30 +0000 2013,"RT @faith2393: @Roberta_Navy @iosonounastrega tutto è musica tranne quella napoletana, é un lamento di un gatto in fin di vita xD"
289486814476124160,Thu Jan 10 21:40:09 +0000 2013,"@faith2393 Abbiamo litigato di brutto. Ogni volta che non litighiamo non la calcolo più per un paio di settimane, poi facciamo pace."
289486512217800704,Thu Jan 10 21:38:57 +0000 2013,@faith2393 @Roberta_Navy A me fanno pena. Qualcuno li avrà stuprati da piccoli.
289486068129099777,Thu Jan 10 21:37:11 +0000 2013,Ho litigato con la playstation. Non vuole farmi passare un livello. Bene. Addio. Bene.
289485300458192896,Thu Jan 10 21:34:08 +0000 2013,"@Roberta_Navy a me non piacciono nemmeno, non è il genere che coinvolge. :S vabbè, pensa ai nostri compagni che ascoltano i napoletani ahah"
289485011424538624,Thu Jan 10 21:32:59 +0000 2013,@Roberta_Navy a quello che ti ho scritto poco fa :')
289482166042243072,Thu Jan 10 21:21:41 +0000 2013,@Roberta_Navy Infatti prima di dire che un cantante non mi piace sento qualche sua canzone. Ma l'unica che ho gradito è stata Demi. :S
289480801282838528,Thu Jan 10 21:16:15 +0000 2013,@Roberta_Navy Grammatica zero ma ok e.e
289480603722719232,Thu Jan 10 21:15:28 +0000 2013,"@Roberta_Navy No, ma personalmente se mi dicono brutte parola a Miley ci rimango male, soprattutto se non la conoscono, ci rispettiamo. c:"
289480213480501249,Thu Jan 10 21:13:55 +0000 2013,Chesonotenera
289480160766468096,Thu Jan 10 21:13:43 +0000 2013,@MileyCyrus amore mio cuore mio anima mia ciao. Sei il mio sorriso.
289479382517551105,Thu Jan 10 21:10:37 +0000 2013,@Roberta_Navy - oppure le gifs °°
289479290955919361,Thu Jan 10 21:10:15 +0000 2013,"@Roberta_Navy Non scrivere ste cose o ti ritrovi mezza twitter contro, scimmia e.e non so, l'ho cercato ma non l'ho trovato, vedine altri -"
289473644269293568,Thu Jan 10 20:47:49 +0000 2013,@Roberta_Navy Oh era lunga la frase ahahah :D
289473542314135552,Thu Jan 10 20:47:25 +0000 2013,@Roberta_Navy Ma quanto tttiamo. :')
289473456637091840,Thu Jan 10 20:47:04 +0000 2013,"RT @Roberta_Navy: @iosonounastrega esatto, l'amore per te, per noi &lt;3"
289469342523981825,Thu Jan 10 20:30:43 +0000 2013,@Roberta_Navy gjhdhhgdx l'amore &lt;3
289469196524478465,Thu Jan 10 20:30:09 +0000 2013,RT @Roberta_Navy: #vogliodiregraziea @iosonounastrega la mia migliore amica. Per tutto. *.*
289469158343716864,Thu Jan 10 20:30:00 +0000 2013,"@Roberta_Navy ""ora la chiamo e glielo dico"" ho dovuto scriverlo per decifrarlo ahahahah"
289462754023178240,Thu Jan 10 20:04:33 +0000 2013,@Roberta_Navy Dillo a mia enne o enne enne a e.e
289459082857943041,Thu Jan 10 19:49:57 +0000 2013,"acca o, spazio, effe a emme e"
289458826946703361,Thu Jan 10 19:48:56 +0000 2013,"@faith2393 Eh, scommetto che nemmeno tu l'hai imparata così in fretta."
289457545398059008,Thu Jan 10 19:43:51 +0000 2013,@faith2393 Pensa che l'ho già imparata a memoria! °°
289454881130029057,Thu Jan 10 19:33:16 +0000 2013,@faith2393 AHAHAHAH è da fare! Sappi che grazie a te adesso ho quella stupida canzoncina in testa e non vuole mollarmi °°
