tid,time,tweet
278821495151656960,Wed Dec 12 11:19:59 +0000 2012,@TheFakeProject cerca followers reali!!! #ImNotAFake http://t.co/vyQbnmYi
278820921026949120,Wed Dec 12 11:17:42 +0000 2012,Stamattina ho proprio odiato la sveglia!!! #ImNotAFake http://t.co/vyQbnmYi
253051570877513728,Tue Oct 02 08:39:30 +0000 2012,E dopo aver cambiato la password abbiamo il secondo Tweet!!! :)
28431337511,Fri Oct 22 18:59:41 +0000 2010,CiPPPPPPPIl mio primo tweet!
300344107270823936,Sat Feb 09 20:43:09 +0000 2013,"RT @itfakers: Finalmente comincia la caccia ai profili falsi.Dear followers, #TheFakeProject is coming. All of you will receive a privat ..."
