tid,time,tweet
225597689176403968,Wed Jul 18 14:27:35 +0000 2012,La gente a quest'ora non dovrebbe andare in macchina. Andate a piedi.
225578406467739650,Wed Jul 18 13:10:57 +0000 2012,Tocca a me? Ah. Allora attacco la Sicilia con 3.
225573117274238977,Wed Jul 18 12:49:56 +0000 2012,"La pubblicità di Cristina Parodi su La7, posso dirlo?, mi fa venire il nervoso."
225571406748979200,Wed Jul 18 12:43:08 +0000 2012,"Victoria era considerata la più bella delle Spice Girls, perché nelle foto non sorrideva mai. #bonscibonscibobobon"
225550494670659584,Wed Jul 18 11:20:03 +0000 2012,"Oggi ho in testa solo Marshall che fa ""Willem - defooou! Willem - defoooou!"""
225546225523490817,Wed Jul 18 11:03:05 +0000 2012,"Ora che ho scoperto ""Cardialmente gigioneggiavo"" alle 12 su Radio Deejay faccio lavoro-casa ancora più volentieri."
225545317913853953,Wed Jul 18 10:59:28 +0000 2012,"Datemi la forza di fare la pasta. Lo so, è un grande sforzo."
225540725834645504,Wed Jul 18 10:41:14 +0000 2012,"@angeloanormale @ilaryjohnson ce l'ho sul pc, solo che mi segna sempre 0 KB, forse ne cosumo troppo pochi :D"
225510240685264897,Wed Jul 18 08:40:05 +0000 2012,"@ilaryjohnson si in casa sempre wifi,cmq è che la vodafone non mi fa vedere quanto consumo, quindi non ho/avevo idea :D cmq grazie!"
225509670566113280,Wed Jul 18 08:37:49 +0000 2012,"@britishongaku io ne ho 500 al mese, mi sa,e ho solo whatsapp online..io pensavo che voi foste illimitati! :D"
225502418987790336,Wed Jul 18 08:09:00 +0000 2012,"@britishongaku ok, ora è tutto chiaro.Mi son presa male perché dato che ho tipo tot MB al mese non vorrei usarli tutti subito :D"
225501601127862273,Wed Jul 18 08:05:45 +0000 2012,"@ilaryjohnson ho notato..ma dato che non ho MB illimitati non vorrei che me li fregasse tutti subito, ladrone!"
225500962083708928,Wed Jul 18 08:03:13 +0000 2012,"@britishongaku mi segna sempre collegato, solo che con 'sto Nokia di m. non so controllare..ma se mi dite così mi fido!"
225494516189245440,Wed Jul 18 07:37:36 +0000 2012,Non so se mi piace che whatsapp mi ciucci connessione tutto il giorno. Uhm.
225466272962449408,Wed Jul 18 05:45:23 +0000 2012,Oggi pomeriggio il pisolino è d'obbligo. E' l'unica cosa che mi fa tirare avanti.
225305581114769408,Tue Jul 17 19:06:51 +0000 2012,E' troppo sperare che ci lasciate da soli? Almeno stasera? No eh?
225255540228489216,Tue Jul 17 15:48:00 +0000 2012,@IlaryJohnson mi avevi convinto con le chat di gruppo e le foto! lo sto già usando di brutto :D
225253979167264768,Tue Jul 17 15:41:48 +0000 2012,@IlaryJohnson FOTO????? cosa?? è la perfezione. perché non me l'avete detto prima??
225250860131819521,Tue Jul 17 15:29:24 +0000 2012,@IlaryJohnson @angeloanormale @oceanonyourskin quando capisco come funziona secondo me non ne potrò più fare a meno :D
225250292923510784,Tue Jul 17 15:27:09 +0000 2012,"@oceanonyourskin eravamo in due fino a poco tempo fa. Ma ti dirò, ho vissuto bene uguale :D"
225245030330286080,Tue Jul 17 15:06:14 +0000 2012,"All'alba di metà luglio, habemus whatsapp."
225240283850354689,Tue Jul 17 14:47:23 +0000 2012,Ok il mio cellulare è connected in a non-compatible mode. Era meglio il 3310.
225234231855558656,Tue Jul 17 14:23:20 +0000 2012,E' umanamente possibile che il mio moroso faccia gli esami a cazzo e prenda sempre 30?
225232918111457280,Tue Jul 17 14:18:06 +0000 2012,"@britishongaku sì, abbastanza, ieri ero un po' ko ma oggi son tornata operativa al lavoro (che gioia -_-)"
225231858949029888,Tue Jul 17 14:13:54 +0000 2012,"@angeloanormale ahahah! ma magari fosse da mangiare, almeno potrei ricomprarlo e rimettercelo, invece sembra che non esista °_° boh °_°"
225231559404421120,Tue Jul 17 14:12:43 +0000 2012,Odio odio ODIO quando clicco qualcosa e poi mi si imposta in automatico la pagina di ricerca non di google ma di babylon del cazzo.
225230579803758592,Tue Jul 17 14:08:49 +0000 2012,"Il mio pc mi chiede dove ho messo il file usbser.sys, lui non lo trova, devo cercarlo manualmente. Ce l'avete voi in tasca?"
225217048534458368,Tue Jul 17 13:15:03 +0000 2012,"Io VS software Nokia. Proprio perché non l'ho pagato, 'sto telefono, se no volava fuori dalla finestra."
225204873342361600,Tue Jul 17 12:26:40 +0000 2012,@britishongaku brava brava!
225200431628959745,Tue Jul 17 12:09:01 +0000 2012,@britishongaku hai finito gli esami mel?
225197124197949440,Tue Jul 17 11:55:53 +0000 2012,"Ho anche io un coupon, adesso. Posso partecipare a pazzi per la spesa. http://t.co/HFUzLqO8"
225176800190398464,Tue Jul 17 10:35:07 +0000 2012,"L'altra mattina avevo in testa ""Solo tu"", dei Matia Bazar. Oggi ""Si può dare di più"". Uccidetemi."
224970056881287168,Mon Jul 16 20:53:35 +0000 2012,Quanto sono vecchia da 1 a 10 se vado a letto adesso?
224963924427145216,Mon Jul 16 20:29:13 +0000 2012,Mi appresto a riversare in digitale ore e ore di filmati della mia fam. dagli anni '60 ad oggi. Facciamo ciaociao con la manina alle VHS.
224962562603757568,Mon Jul 16 20:23:49 +0000 2012,"Ho scritto che senza uomini non ci sappiamo stare. (Ma forse dovremmo farci qualche domanda, perché http://t.co/6rugUyBP )."
224957155726475264,Mon Jul 16 20:02:20 +0000 2012,"Perché ce l'avete tutti con la povera Nicole Minetti, cosa vi ha fatto? Vi ha fatto male la pulizia dei denti?"
224936249616637952,Mon Jul 16 18:39:15 +0000 2012,"Senza uomini non ci sappiamo stare. Anche se forse dovremmo dire il contrario, perché recenti ricerche dicono che http://t.co/6rugUyBP"
224932877006143489,Mon Jul 16 18:25:51 +0000 2012,La dura e triste realtà. http://t.co/6rugUyBP
224908351132282880,Mon Jul 16 16:48:24 +0000 2012,Mail mandata. AH!
224855265298747392,Mon Jul 16 13:17:27 +0000 2012,"Dai, rifate Forza Italia. Così posso sfoggiare la mia tshirt vintage ""Io voto Passoni"" (a cui ho aggiunto una scritta: 'molto?!')"
224844977614766080,Mon Jul 16 12:36:34 +0000 2012,"Ho voglia di leggere.. Per favore consigliatemi un paio di libri, dai."
224843578344603648,Mon Jul 16 12:31:01 +0000 2012,Ma si può svegliarsi lunedì mattina 16 luglio con la febbre?
224535398309838848,Sun Jul 15 16:06:25 +0000 2012,Fra poco inauguriamo il giro pizza La Valle. Tanta roba.
224507509359132674,Sun Jul 15 14:15:36 +0000 2012,"Ho appena finito ""Io e te"" di Ammaniti. Mi dispiace, perché scrive come piace a me, ma 10 euro non li vale."
224483993222000641,Sun Jul 15 12:42:09 +0000 2012,"Ora mi sono impadronita dello sdraio. C'è un venticello che ve lo raccomando, se mia mamma montasse la piscina farei pure un tuffo."
224478022093373440,Sun Jul 15 12:18:25 +0000 2012,"Indecisione: leggere un libro, mettermi sotto gli alberi o dormire o farmi un caffé e rimanere sveglia?"
224425660339335169,Sun Jul 15 08:50:21 +0000 2012,Ho scritto una cosa su una news che spopola su FB. E dire che io sono cinica.. http://t.co/tWBj5Gek
224424485242146816,Sun Jul 15 08:45:41 +0000 2012,"Cose che non avrei mai detto:il mio cellulare può navigare (gratis,grazie Vodafone)anche da questo buco di mondo."
224157025007964160,Sat Jul 14 15:02:54 +0000 2012,"Io, che non so neanche com'è fatta una quercia. http://t.co/IN8zotYY"
223805521436741632,Fri Jul 13 15:46:09 +0000 2012,"@angeloanormale se ci fosse stato il mare, oltre al cimitero, l'avrei presa."
223801737268576256,Fri Jul 13 15:31:06 +0000 2012,"Basta. Cercare un posto dove andare per le vacanze mi fa venire il nervoso. Affittatemi casa vostra, ovunque sia, che facciamo prima."
223796590731739137,Fri Jul 13 15:10:39 +0000 2012,Mi viene mal di mare solo al pensiero di poter prendere il traghetto.
223759985337827328,Fri Jul 13 12:45:12 +0000 2012,Dio benedica il pisolino.
223729679738224641,Fri Jul 13 10:44:47 +0000 2012,"Siete un po' troppo perfezionisti, lasciatemelo dire."
223727076270809088,Fri Jul 13 10:34:26 +0000 2012,Mi regalo una misera ricarica coi punti della vodafone. Con tutto quello che ho speso.. eppure è la prima volta in 5 anni #alleluia
223725866323156993,Fri Jul 13 10:29:37 +0000 2012,"@MattiaFornari non parlarmi di pallet e bancali, grazie."
223725476013805568,Fri Jul 13 10:28:04 +0000 2012,"@angeloanormale lascia stare. io a malapena che distinguo un bianco da un rosso, un frizzante da un fermo e credo basta u_u"
223706985919557632,Fri Jul 13 09:14:36 +0000 2012,"Lo sapevate che il vino monterosso è bianco?! Grazie che mi complicate la vita, signori enologi."
223370638168043521,Thu Jul 12 10:58:04 +0000 2012,"Avevo in programma una sessione di shopping. Mia mamma non mi ha detto ""hai troppe cose blabla"". Ha detto ""ci vengo anche io"". #top"
223337670552731648,Thu Jul 12 08:47:04 +0000 2012,"Chiamo un ufficio.Suona a vuoto.Poi risponde:""Son tornata apposta.Sono in pausa caffè x un quarto d'ora,arrivederci"". Strozzati."
223333360456568832,Thu Jul 12 08:29:57 +0000 2012,"Rispondo al tel, ""no non sono la ragazza con cui parla di solito"". ""Ah, siete sorelle?avete la stessa voce..Fate un corso?"""
223162501007802369,Wed Jul 11 21:11:01 +0000 2012,"Sei in coda alla posta,in ufficio,dal dottore, sull'autobus,ad una festa coi parenti o a casa a cazzeggiare? Allora http://t.co/3nPvU2Rj"
223152958420959232,Wed Jul 11 20:33:05 +0000 2012,5 modi per passare il tempo quando non hai nulla da fare. http://t.co/3nPvU2Rj
223124341519433729,Wed Jul 11 18:39:23 +0000 2012,Figata. Adesso mi scarico la canzone gratis I love icecream del McDonald's.
223118377256882178,Wed Jul 11 18:15:41 +0000 2012,Vi comunico che il monitor del mio pc sfarfalla. BENE.
223114064191164416,Wed Jul 11 17:58:32 +0000 2012,"Ho sganciato 20 euro e il fratello, dopo scuola guida, passa a prendere la pizza. Dio benedica i fratelli."
223113096200323074,Wed Jul 11 17:54:42 +0000 2012,Riapro Facebook dopo due o tre giorni e si è laureato il mondo. Bravi dottori. (ma domani cosafate?)
222262816869064704,Mon Jul 09 09:35:59 +0000 2012,Oggi pome scriverò un post:5 modi per passare il tempo se non hai niente da fare. Prima mi guardo il porno della Tommasi però.
222255888537362432,Mon Jul 09 09:08:27 +0000 2012,"Almeno avessi un iPhone, potrei giocare a qualche giochino. Ora ho capito perché tutti ce l'avete.."
222255364572323841,Mon Jul 09 09:06:22 +0000 2012,"Ho finito di spinzare cose per poi graffarle altrove. Ora ho 1h davanti in cui non so cosa fare, perché sono troppo brava a spinzare cose."
222071863029923840,Sun Jul 08 20:57:12 +0000 2012,"Questi di ""Pazzi per la spesa"" li stimo, eh. Ma che cacchio te ne fai di 160 pacchetti di tic tac?!"
221541180385673216,Sat Jul 07 09:48:28 +0000 2012,Basterebbe alzare il culo dalla sedia.
221201465841156096,Fri Jul 06 11:18:33 +0000 2012,"""Caldo, eh?"", ""Oh sì speriamo piova"". Il vero motivo per cui si finisce sempre a parlare del tempo: http://t.co/g3VsSxQL"
221200619778748416,Fri Jul 06 11:15:12 +0000 2012,"Vorrei sapere perché mi si è incriccato il collo, proprio oggi. Avanti, fuori il colpevole."
220982798138355714,Thu Jul 05 20:49:39 +0000 2012,Perché si finisce sempre a parlare del tempo. http://t.co/g3VsSxQL
220928256533200898,Thu Jul 05 17:12:55 +0000 2012,"Caro temporale, se devi venire, almeno fai piovere decentemente."
220810494183870464,Thu Jul 05 09:24:58 +0000 2012,Mi pagano la benzina per venire a lavorare. Quando esco dall'ufficio esulto come il 9 luglio 2006.
220808402706767873,Thu Jul 05 09:16:40 +0000 2012,"Ah no, ho anche risposto ad una telefonata in inglese. ""Hello, can I speak to the boss please?"". No."
220798625003999233,Thu Jul 05 08:37:49 +0000 2012,"""Ciao, cos'hai fatto di bello oggi?"", ""mah.. Ho messo in ordine delle fatture, dalla 1021 alla 0"". #lamorte"
220561912038035456,Wed Jul 04 16:57:12 +0000 2012,"Per me fra tipo dieci minuti piove di brutto, e mi dispiace (...) ma @MattiaFornari non potrà mangiarsi il panino con la porchetta."
220469700705001472,Wed Jul 04 10:50:47 +0000 2012,Vedere Fabiola nei TT mi ha fatto prendere un attimo male.
220147318291312643,Tue Jul 03 13:29:45 +0000 2012,Ho appena scritto una cosa: il vero motivo per cui ho sempre la macchina sporca non è la pigrizia - http://t.co/aXqmgwX2
220145898448101376,Tue Jul 03 13:24:06 +0000 2012,"Un problema, una soluzione: i fiori di tiglio. http://t.co/aXqmgwX2"
220110726671499264,Tue Jul 03 11:04:21 +0000 2012,Il mio ufficio sta a 100mt dalla torrefazione Musetti. Stamattina tostavano il caffè. Non vi dico il profumino.
220066757933662208,Tue Jul 03 08:09:38 +0000 2012,"la stessa signora: ""no perchè oggi non posso stare incasa, devo andare da mio marito"". Al cimitero. #impegnideivecchietti"
220065910390665216,Tue Jul 03 08:06:16 +0000 2012,"""Vorrei sapere se ieri mi avete consegnato il vino"". Signora, se non hanno aperto dei ladri forse no."
220061862966992897,Tue Jul 03 07:50:11 +0000 2012,"Il primo caffè della giornata me lo gusto meglio se lo prendo a quest'ora, lontano dalla colazione. #sapevatelo"
219876340717989888,Mon Jul 02 19:32:59 +0000 2012,Se rinasco voglio fare la corista.
219833994982850560,Mon Jul 02 16:44:43 +0000 2012,"Cose che ho imparato oggi: se hai un blog, lascia una mail di riferimento anche se pensi che non ti scriverà nessuno. Prima o poi servirà."
219773958340362240,Mon Jul 02 12:46:09 +0000 2012,"Mi aspetta un'ora di ""ripetizioni"" di italiano. Quasi preferivo andare in ufficio o riguardarmi la partita di ieri. #lamorte"
219771646389665793,Mon Jul 02 12:36:58 +0000 2012,Suppongo che il figlio della Fico e di Balotelli nascerà il 21 Dicembre. Del 2012.
219750759611371520,Mon Jul 02 11:13:58 +0000 2012,"""E se mi fermano, con queste cose in macchina, cosa gli dico ai carabinieri?"". Ti faccio lo scontrino, questo sconosciuto."
219721804028182531,Mon Jul 02 09:18:54 +0000 2012,"@annielalalala beata te, qui nella pianurassa non si respira."
219719153119006720,Mon Jul 02 09:08:22 +0000 2012,"Tra l'altro forse in questo ufficio lo split dell'aria condizionata è un elemento di arredo, e il telecomando in realtà è una banana."
219718721466413056,Mon Jul 02 09:06:40 +0000 2012,"Grazie, collega, che la settimana scorsa non mi hai detto che oggi stavi a casa tutto il giorno."
219668198621057026,Mon Jul 02 05:45:54 +0000 2012,"Di sopra stanno spostando dei mobili. Così, senza motivo, per sport."
219563329847443457,Sun Jul 01 22:49:11 +0000 2012,"No sentite, non è possibile che io stia morendo di caldo a letto anche se c'è  l'aria condizionata."
219560833146028032,Sun Jul 01 22:39:16 +0000 2012,Ogni volta che metto la sveglia del cellulare mi informa che suonerà tipo fra 6 ore e 34 minuti. Mi sfotte.
219560275047759872,Sun Jul 01 22:37:03 +0000 2012,"RT @britishongaku: bene mò che sò finiti gli europei tornate a parlà de quello che ve pare, tornate a fa' le schizzinose sul calcio, che ..."
219528900701728768,Sun Jul 01 20:32:23 +0000 2012,Se entro io me fate fare un gol pure a me?
219528648544366593,Sun Jul 01 20:31:23 +0000 2012,RT @matteograndi: Quindi al ritorno dobbiamo farne 4?#maidiretweet
219528383304966146,Sun Jul 01 20:30:19 +0000 2012,Iniesta sembra un personaggio di Leo Ortolani.
219527858589138946,Sun Jul 01 20:28:14 +0000 2012,"Dai, buttiamo dentro. E spariamo a Dossena."
219526065272532993,Sun Jul 01 20:21:07 +0000 2012,Marchisio se non lo vedete è perchè è qui con me.. un attimo e abbiamo finito.
219522929006874624,Sun Jul 01 20:08:39 +0000 2012,E Chiellini rifatti il naso intanto che sei fuori a guardare la partuta.
219522569223680002,Sun Jul 01 20:07:13 +0000 2012,Thiago Motta amputati una gamba.
219199018029432832,Sat Jun 30 22:41:33 +0000 2012,"Tornare a casa e avere una fame mai vista. Solo perché sono pigra non mi sono fatta due spaghetti, ho solo mangiato latte e biscotti."
218765376937394176,Fri Jun 29 17:58:24 +0000 2012,"RT @lucadondoni: Katie Holmes ha chiesto il divorzio a Tom Cruise. Dopo aver visto ""Rock of ages"" l'avrei chiesto anche io."
218756062839455744,Fri Jun 29 17:21:24 +0000 2012,"A me dispiace dirlo, ma ho sempre ragione."
218747556971298816,Fri Jun 29 16:47:36 +0000 2012,Vorrei solo immergermi in una vasca da bagno e star lì tutta sera. Maledetti i miei che quando han ristrutturato hanno fatto due docce.
218746115451920384,Fri Jun 29 16:41:52 +0000 2012,"Guidare non è così noioso,se la radio passa la canzone preferita di @britishongaku #uohohohoh #ieheheheh"
218687323783700481,Fri Jun 29 12:48:15 +0000 2012,RT @IlaryJohnson: @iPhabi perché vogliamo parlare di pò e qual'è?!?
218687302564708353,Fri Jun 29 12:48:10 +0000 2012,@IlaryJohnson come ho potuto dimenticarli?!
218682626402299904,Fri Jun 29 12:29:35 +0000 2012,Piacenza: punta la pistola carica contro tifoso (dicono che gliel'ha puntata addosso per farlo scendere dal Porsche) http://t.co/na7eEEuq
218678108394487809,Fri Jun 29 12:11:38 +0000 2012,"Volevo dire una cosa: io sto, a me, lo so.. non vanno accentati."
218410305510846464,Thu Jun 28 18:27:29 +0000 2012,"""Quando l'acqua bagna il culo"". http://t.co/vm765LnL"
218407303366451200,Thu Jun 28 18:15:33 +0000 2012,"La delicatezza di un elefante, proprio."
218352110276837376,Thu Jun 28 14:36:14 +0000 2012,"Ho le gomme un po' sgonfie,e la mia macchina a volte si spegne da sola. Mi chiedo che coraggio ho a fare la tangenziale a 130-ehm, 80 km/h."
218307802903482368,Thu Jun 28 11:40:10 +0000 2012,Sono le due quasi e io non ho ancora pranzato. Mi è anche passata la fame.
218303365732507648,Thu Jun 28 11:22:32 +0000 2012,Magari sarebbe gradito un briciolino in più di attenzioni.
218290172536696832,Thu Jun 28 10:30:07 +0000 2012,"@britishongaku oppure lavoro a Roma e non lo sapevo? :D In realtà mi han detto ""Domani siamo chiusi,è il patrono"", io ""Bene, ok, ciao!"""
218286913709285377,Thu Jun 28 10:17:10 +0000 2012,"La mia settimana lavorativa è già finita. Grazie, patrono del paesello, che cadi domani e non di sabato."
218262636532477952,Thu Jun 28 08:40:42 +0000 2012,"In questi momenti, quando rispondo al telefono mi sento come nel Diavolo veste prada, quando la Streep chiama la tipa sempre Emily."
217679116995014657,Tue Jun 26 18:02:00 +0000 2012,Sono solo 2 giorni che sono a stretto contatto con dei vini e già non mi viene voglia di bere niente. Fra un mese sarò astemia. #male
217670232326668288,Tue Jun 26 17:26:42 +0000 2012,"Le ultime parole famose del moroso: ""Secondo me finisco alle 6"". Di domani mattina?"
217626657186516993,Tue Jun 26 14:33:33 +0000 2012,"Il cornetto che sto mangiando secondo me l'ha fatto Banderas, riconosco la mano, sì."
217623242469408769,Tue Jun 26 14:19:58 +0000 2012,Io e mio fratello stiamo guardando Mammoni. I nostri neuroni si stanno suicidando.
217621804414537729,Tue Jun 26 14:14:16 +0000 2012,Avere in mente una sola cosa: chissà se Piqué e Shakira stanno ancora insieme.
217591450249072641,Tue Jun 26 12:13:39 +0000 2012,Oggi mi regalo un pisolino.
217529803098693633,Tue Jun 26 08:08:41 +0000 2012,Mezzogiorno vieni presto.
217380663115005952,Mon Jun 25 22:16:03 +0000 2012,Rivelazioni top secret:a me Cremonini m'attizza pure. E il bello è che assomiglia al mio moroso. #nonèbellociócheblabla
217367370224775168,Mon Jun 25 21:23:14 +0000 2012,@britishongaku se ho capito bene (la canzoncina degli euro?) E' IL TOP
217366446387363840,Mon Jun 25 21:19:33 +0000 2012,"Questo dovrebbe essere swing, non trombette stonate però #concertoemilia"
217362555599990784,Mon Jun 25 21:04:06 +0000 2012,Torre di controllo aiuto sto finendo l'aria dentro al serbatoio.
217360166511841280,Mon Jun 25 20:54:36 +0000 2012,"Ma soprattutto, perché Nek ha un rotolo di scotch al braccio? #concertoemilia"
217359434056343552,Mon Jun 25 20:51:42 +0000 2012,"Nek fai venire un po' il latte, pure Laura l'ha capito, però sei un figo. #concertoemilia"
217355663569993728,Mon Jun 25 20:36:43 +0000 2012,"@britishongaku :D,in realtà sono abbastanza nel panico, ma vabbé, però grazie &lt;3"
217355159670489088,Mon Jun 25 20:34:42 +0000 2012,Dio ti prego fammi arrivare a sessant'anni ed essere così perfettamente intonata come Gianni Morandi #concertoemilia
217354678344749057,Mon Jun 25 20:32:48 +0000 2012,"Ascoltami, tizio degli Stadio, lascia lì e fai cantare Gianni che non sei capace #concertoemilia"
217354267353292800,Mon Jun 25 20:31:10 +0000 2012,"@britishongaku lo dici come dire ""era ora"" :D (in effetti..) cmq sì,sostituzione di maternità. (mi fa abb.schifo,però shh)."
217238562020655106,Mon Jun 25 12:51:23 +0000 2012,Diattriba in ufficio per un quadro. Scene da manuale.
217217636956782592,Mon Jun 25 11:28:15 +0000 2012,Non sono neanche le 2 e ho già l'abbiocco. Annamo bene.
217199197634572288,Mon Jun 25 10:14:58 +0000 2012,"Se c'è una cosa che odio fare è rispondere al telefono, e anche fare dei conti. Da oggi dovrò fare entrambi. #evviva"
217159595251089408,Mon Jun 25 07:37:36 +0000 2012,Incominciamo già bene.
217021524773842945,Sun Jun 24 22:28:58 +0000 2012,"Io avrei una domanda per Ogbonna, passategli l'auricolare per favore."
217017878795399168,Sun Jun 24 22:14:28 +0000 2012,"""Galeazzi va ascoltato per forza se no te sgrugna, oh"""
217016785021575169,Sun Jun 24 22:10:08 +0000 2012,"Ok che c'hai dei motivi per essere irritato, ma fattela 'na risata che domattina c'hai un cipresso nel naso."
217006158781747202,Sun Jun 24 21:27:54 +0000 2012,Sì no ok sì esultiamo ma la Germania ci fa un culo così. Però ok.
217005674654203908,Sun Jun 24 21:25:59 +0000 2012,"La nonna di Mattia: ""Allora chi ha vinto, il Milan?"""
217005345111949312,Sun Jun 24 21:24:40 +0000 2012,Mamma mia.
217003193073287170,Sun Jun 24 21:16:07 +0000 2012,"Buffon ha fatto la pipì, si può cominciare"
217001304042651649,Sun Jun 24 21:08:37 +0000 2012,Il guardalinee c'ha 12 decimi oh.
216999482716459008,Sun Jun 24 21:01:22 +0000 2012,"Diamanti, sintonizza bene il tuo antennino rasta dai."
216996726207283201,Sun Jun 24 20:50:25 +0000 2012,"La prossima volta la telecronaca la faccio io, comunque. Almeno vi canto anche le canzoncine."
216928445383458816,Sun Jun 24 16:19:06 +0000 2012,"Oui, je suis en panicò."
216671408359608320,Sat Jun 23 23:17:43 +0000 2012,"If you, just, smile."
216477027891552256,Sat Jun 23 10:25:20 +0000 2012,Ho giocato col doodle di Google e ho capito solo all'ultima lettera come si giocava. #bene
216472467307376642,Sat Jun 23 10:07:12 +0000 2012,"""Vestita così sopra sembra che devi andare tipo in barca, ma con quelle scarpe che sei in cammino per Gerusalemme"". Mh, qualcosa non quadra."
216313468943470592,Fri Jun 22 23:35:24 +0000 2012,"Con un mal di testa del genere,reggere fino a quest'ora sulle zeppe, a cantare, è stata dura. Molto dura."
216168784380166144,Fri Jun 22 14:00:29 +0000 2012,"Ho una cosa tipo brufolo sul collo che mi costringe a metterci una garzina e la crema,sembra che mi hanno operato alle corde vocali."
216160571689664512,Fri Jun 22 13:27:51 +0000 2012,"Il potere delle pubblicità/2. Breil, ce l'hai fatta a farmi ricordare quanto sono sfigata che m'attizza Vaporidis."
216160015768227840,Fri Jun 22 13:25:38 +0000 2012,"Italia1, ce l'hai fatta a farmi venire voglia di guardare Grease, eh. Per la serie:il potere delle pubblicità, parte 1."
216142093649842176,Fri Jun 22 12:14:25 +0000 2012,"@donniemine vero, almeno quello!! Se no c'era da riscrivere il finale :D"
216123361221296128,Fri Jun 22 10:59:59 +0000 2012,"@britishongaku grazie, ti lovvo di brutto &lt;3"
216122098005970944,Fri Jun 22 10:54:58 +0000 2012,"In realtà è Simone Rugiati l'uomo della mia vita, mi dispiace @mattiafornari ma c'è da imparare a cucinare qui."
216120366249160705,Fri Jun 22 10:48:05 +0000 2012,"@donniemine stamattina mi sono imbambolata anche io davanti alla tv, è un po' una droga! (però Joey Potter=la morte)"
216099214009184256,Fri Jun 22 09:24:02 +0000 2012,"Non so come facevamo a guardare Dawson's creek, davvero. Fra Joey e Dawson non so chi è peggio (no, in realtà lo so)."
216080166844239872,Fri Jun 22 08:08:21 +0000 2012,"Nanana nanana.. God give me style and give me strenght, per alzarmi stamattina da questo lett."
216077967737102338,Fri Jun 22 07:59:36 +0000 2012,Qualcuno super intelligente sa perché google chrome mi carica qualsiasi sito tranne Twitter?
215950564838735872,Thu Jun 21 23:33:21 +0000 2012,"A quest'ora, puntuale, il magone. (ovvero il classico mago minaccioso dalla corporatura robusta)."
215876804706185217,Thu Jun 21 18:40:15 +0000 2012,Dubbi.
215862722951266304,Thu Jun 21 17:44:18 +0000 2012,"Grazie Twitter che mi escludi, posso solo accedere dal cellulare #fanculo"
215824424962764801,Thu Jun 21 15:12:07 +0000 2012,"Ho pulito tutta casa,e intanto che c'ero ho pure dato il bianco a qualche pezzo di muro. Ora sì che rivaluto tutte le mamme del mondo."
215576552304414721,Wed Jun 20 22:47:09 +0000 2012,"Facendo zapping, ho visto un tronista con le meches e un cappottino lungo col visone  sul collo che non si vedeva dal 98."
215525683974250496,Wed Jun 20 19:25:01 +0000 2012,"Una decisione importante non è così importante (e difficile, anche) se, nel frattempo, guardi Sister Act."
215475038189649920,Wed Jun 20 16:03:47 +0000 2012,"Sento terribilmente la mancanza di mio fratello di anni 6,che è in montagna da più di una settimana. ""Quando torni mi fai due coccoline?"""
215468151746465792,Wed Jun 20 15:36:25 +0000 2012,"Quel momento in cui tuo fratello chiede come si fa a trasformare km/h in m/sec. Che ne so, io la patente ce l'ho già. #tropposbatti"
215447202322067456,Wed Jun 20 14:13:10 +0000 2012,Mi sembra sensato che con 'sto caldo mio fratello decida di accendere il forno per fare una torta. (Escluso il fatto che poi la mangio).
215429118924300289,Wed Jun 20 13:01:19 +0000 2012,"@imbecilla ..a stringergli la mano per il senso civico. Tu munita di guanti, però."
215428078107758592,Wed Jun 20 12:57:10 +0000 2012,Dovremmo eliminare dalla faccia della terra gli alberi che lasciano quelle cacchine gialle che si appiccicano sulla macchina.
215375657411149824,Wed Jun 20 09:28:52 +0000 2012,Non c'è niente di più palloso delle ripetizioni di italiano.
