tid,time,tweet
298186547797323776,Sun Feb 03 21:49:47 +0000 2013,@britishongaku l'ho appena twittato :D stavo aspettando l'arbitro al varco.
298186301751058432,Sun Feb 03 21:48:49 +0000 2013,La proposta choc di oggi era che oltre all'imu restituirà tutti i rigori.
298185981511737344,Sun Feb 03 21:47:32 +0000 2013,"Ci tengo a precisare che nel mio tweet precedente intendevo ""le domande"". Fattele, le domande."
298185637180350465,Sun Feb 03 21:46:10 +0000 2013,"Facciamoci due domande, se dovevamo aspettare Balotelli. Silvio, fattele."
298123250431574016,Sun Feb 03 17:38:16 +0000 2013,Concerto Sala dei Teatini - Piacenza city. Acculturiamoci. http://t.co/SIEG03hG
298078574223691776,Sun Feb 03 14:40:44 +0000 2013,@britishongaku bonsci bonsci bobobon.
298067196150697984,Sun Feb 03 13:55:32 +0000 2013,"@britishongaku @alicemanza m'han detto che il pigiama fa una proposta choc, oggi.. Lo voto."
298065788978462720,Sun Feb 03 13:49:56 +0000 2013,@britishongaku evito di rispondere. Sono troppo aggressive.
298065324866154496,Sun Feb 03 13:48:05 +0000 2013,"""Taglia taglia!"" - sono ancora lunghi 8 metri, ma io mi sento una ballerina di Charleston pelata. http://t.co/061NGyfG"
298062974143328256,Sun Feb 03 13:38:45 +0000 2013,"Il nervoso la domenica, no dai. Torno a letto."
297847310942101504,Sat Feb 02 23:21:47 +0000 2013,La speranza di vedere un conoscente a Italia's got talent mi ha impedito di fare #potipoti col moroso. Non c'era. Che tu sia maledetto.
297733722256592898,Sat Feb 02 15:50:25 +0000 2013,@angeloanormale l'hai visto anche tu? 34mila dollari e tutto il resto?
297722602082947073,Sat Feb 02 15:06:14 +0000 2013,Mi vesto. Guardo il tempo fuori: vada per la muta da sub.
297710980715118592,Sat Feb 02 14:20:03 +0000 2013,Adesso per favore mi canti Nothing compares to you mentre fai la verticale sulle mani? #amici
297708073290723328,Sat Feb 02 14:08:30 +0000 2013,@ri_bers perché tu mi vuoi far credere che gli hai guardato il naso..? #amici
297706674335137792,Sat Feb 02 14:02:56 +0000 2013,"Una botta a Stefano, comunque, alla facciaccia di Belen, gliela darei. #amici"
297701515978760192,Sat Feb 02 13:42:27 +0000 2013,"@Bea_bs88 secondo me ho più possibilità di stare con Ted Mosby, oggi, che con l'arch. Sicuro."
297688086744293377,Sat Feb 02 12:49:05 +0000 2013,L'importanza di essere Floppy. http://t.co/mVpZI0IB
297683777122082816,Sat Feb 02 12:31:57 +0000 2013,"@bettinazagnoli direbbe ""fa' vedere? È nuovo?"""
297673508840935424,Sat Feb 02 11:51:09 +0000 2013,Il mio pomeriggio: guardare Amici e leggere. Possibilmente con l'architetto da parte che fa le sue cose.
297671159363805185,Sat Feb 02 11:41:49 +0000 2013,@britishongaku scema!
297670621612109824,Sat Feb 02 11:39:41 +0000 2013,"RT @britishongaku: @iPhabi ero figa, bastava questo a far succedere qualcosa :D"
297668893202329600,Sat Feb 02 11:32:49 +0000 2013,"@britishongaku stanotte ti ho sognata. Eri a casa mia, c'era una cerimonia. Eri figa. Però non succedeva niente. #sapevatelo"
297643159708635136,Sat Feb 02 09:50:33 +0000 2013,Paolo Fox mi spii? Smettila. Stalker.
297637027225145344,Sat Feb 02 09:26:11 +0000 2013,"Devi stare molto karma, devi stare molto karma."
297415376990527488,Fri Feb 01 18:45:26 +0000 2013,E mia nonna sta parlando sopra al telefilm. Adesso alzo il volume a 300.
297415258455298049,Fri Feb 01 18:44:57 +0000 2013,"Mio fratello milanista commenta su YouTube alla conferenza stampa: ""Balotelli compra una vocale""."
297398627012325377,Fri Feb 01 17:38:52 +0000 2013,"@IlaryJohnson dì la verità, che i tuoi giorni sono scanditi dai #FF!  (qua la mano, comunque, ti capisco)."
297389631626952704,Fri Feb 01 17:03:08 +0000 2013,"Finito #acusticaperfetta. Ho sentito il dolore con Arno e l'ho messo in ciò che amo (scrivere).Grazie @dariabig, perché http://t.co/6LiwSStb"
297386995846615040,Fri Feb 01 16:52:39 +0000 2013,Librare - Acustica perfetta http://t.co/6LiwSStb
297347249271341056,Fri Feb 01 14:14:43 +0000 2013,"@IlaryJohnson me li ricordo entrambi, quei due libri delle ragazzine! Anche se il mio preferito era quello di Georgia Nicholson!"
297296845821050881,Fri Feb 01 10:54:26 +0000 2013,@lostmemories vabbe! Potrebbe capitare ma ci penserai :) daje!
297295270960578560,Fri Feb 01 10:48:10 +0000 2013,"@lostmemories a proposito, ho letto ora su KM che cambi, brava, sono contenta per te :)"
297268616133480449,Fri Feb 01 09:02:15 +0000 2013,@hopelesshaze anche tu sei a casa?
297130475217104896,Thu Jan 31 23:53:20 +0000 2013,"@britishongaku no, contratto scaduto oggi. L'ho desiderato tanto 'sto giorno, per tanto motivi,ma (sonno a parte) ricomincerei domani. Vabe!"
297126161312518144,Thu Jan 31 23:36:11 +0000 2013,Tolgo la sveglia dell'ufficio. È Febbraio. Domani dormo.
297053947254956032,Thu Jan 31 18:49:14 +0000 2013,"In tv: ""Non ti sto dicendo addio, Micheal"". Mio fratello di 7anni commenta ad alta voce: ""e allora perché te ne vai, allora?!"" - paura vera."
297051285880975360,Thu Jan 31 18:38:40 +0000 2013,Ho una sveglia al cellulare che suona tutti i giorni a quest'ora. È per guardare Lost. #malattieimbarazzanti
297035891715751936,Thu Jan 31 17:37:30 +0000 2013,E' come il vino. #beckham http://t.co/OiSe4duP
297023234270973952,Thu Jan 31 16:47:12 +0000 2013,"Non è possibile recuperare i tweet dall'app del cellulare. La mia fine è vicina, sto per piangere. #tecnomea"
296980533538349056,Thu Jan 31 13:57:31 +0000 2013,La De Filippi trasmette i print screen delle conversazioni su Whatsapp fra due tipi di Uomini e donne. Tecnologia portaci via.
296975647329357826,Thu Jan 31 13:38:06 +0000 2013,Beckham al PSG. Un altro buon motivo per andare a Parigi.
296952770072813568,Thu Jan 31 12:07:12 +0000 2013,"La nuova regola è ""if you can't say something nice don't say anything at all - oppure posta tutto su Facebook""."
296882866103652352,Thu Jan 31 07:29:25 +0000 2013,This is my last sforzo.
296741393454465025,Wed Jan 30 22:07:16 +0000 2013,"Come sfondo del cellulare scelgo sempre foto colorate. Non si direbbe, a guardarmi, eppure è così."
296671029693132800,Wed Jan 30 17:27:40 +0000 2013,"""C'è un sacco freddo, fuori. L'unica cosa che scalda il cuore è Balotelli al Milan"" - cit. il mio moroso esaltato."
296659512201457664,Wed Jan 30 16:41:54 +0000 2013,Perché non gliel'ho detto? http://t.co/L2QomOuw
296656884763611137,Wed Jan 30 16:31:27 +0000 2013,"Mio fratello non suona semplicemente il pianoforte, no. Lui pesta sui tasti. Martello-pneumatica sui tasti."
296609726828003328,Wed Jan 30 13:24:04 +0000 2013,"@britishongaku @donniemine fammi fare due risate, secondo me intendiamo gente diversa: spara i nomi! (in pvt) (pvt fa molto chat anni '90)."
296590876854063104,Wed Jan 30 12:09:10 +0000 2013,"Collana of the day. Se non è ""brutta"" non la vogliamo. http://t.co/rXa4T2B0"
296587674188398593,Wed Jan 30 11:56:26 +0000 2013,"@TvTalk_Rai non lo trovo giusto. Non ho neanche avuto il tempo di vederlo e farmi un'idea,oggi l'avrei guardato in streaming dal sito."
296580739623952384,Wed Jan 30 11:28:53 +0000 2013,Vado in questa posta perché c'è poca gente. Certo. Magari non il 30 gennaio.
296518661806628864,Wed Jan 30 07:22:12 +0000 2013,"Svegliarsi alle 5:30 in preda alla sete, cincischiare a letto e riuscire lo stesso ad arrivare tardi."
296361797559144453,Tue Jan 29 20:58:53 +0000 2013,"@hopelesshaze un miracolo quindi (e 10 minuti di sonno guadagnati..). Ti saprò dire assolutamente, grazie!"
296351778998468609,Tue Jan 29 20:19:04 +0000 2013,@hopelesshaze domani torno alla Coop.
296351707292635136,Tue Jan 29 20:18:47 +0000 2013,"RT @hopelesshaze: @iPhabi ho la soluzione che fa per te: http://t.co/xzryqvOQ giuro, mi ha cambiato la vita!"
296333970344390656,Tue Jan 29 19:08:18 +0000 2013,Una calamità naturale ci affligge da anni e nessuno prova un po' di compassione per noi del nord Italia. Scandaloso. http://t.co/oi45FePW
296332425871622144,Tue Jan 29 19:02:10 +0000 2013,Inverno. O inferno. http://t.co/G9WoBf07
296310770684272640,Tue Jan 29 17:36:07 +0000 2013,"Milanisti contenti che, in questo caso, sarebbero stati contenti anche se fosse arrivato Maurizio Costanzo. #depressi"
296310398469148673,Tue Jan 29 17:34:38 +0000 2013,"Ho scritto solo Balotelli in un sms,il moroso mi ha telefonato indietro dopo 7 secondi. Piccoli milanisti contenti (a me frega 'na cippa)."
296276871233036289,Tue Jan 29 15:21:25 +0000 2013,Mangio Special K a manciate. Meno male che la scatola è grossa (o forse no).
296241341057351680,Tue Jan 29 13:00:14 +0000 2013,Ho messo il sale nel caffè. Gfrthstehrpgfrrrr.
296237142890389505,Tue Jan 29 12:43:33 +0000 2013,"@britishongaku en liv uail uir iang! (comunque la nuova, kiss you, per me è il top. Se avessi 15 anni andrei al concerto)."
296235077254402048,Tue Jan 29 12:35:20 +0000 2013,"Benvenuto Kinder! Non ti immaginavo così piccolino, ma ti voglio già un po' di bene. #kindle #paperwhite http://t.co/YYnITtsr"
296214172495130624,Tue Jan 29 11:12:16 +0000 2013,La scatola del potere. http://t.co/0uDs40Oa
296141863155535872,Tue Jan 29 06:24:56 +0000 2013,"Ho spento la sveglia tutta incazzata, pensando ""checcazz- è domenica, non rompere"". Certo."
296025462117920768,Mon Jan 28 22:42:24 +0000 2013,"Non è che son diventata filosofa,è che ho fatto l'intellettuale guardando Pasolini;ora posso tornare a cantare tranquilla gli One Direction."
296023326910992384,Mon Jan 28 22:33:55 +0000 2013,"I burattini non potranno mai contemplare le nuvole. Mai, finchè staranno chiusi nel loro teatro."
296004949635133441,Mon Jan 28 21:20:54 +0000 2013,Nonnitudine. O nonnità (ancora non ho deciso). Quel vago senso di vecchio che aleggia nei giovani che a quest'ora sono già a letto.
295858317354471426,Mon Jan 28 11:38:14 +0000 2013,"@IlaryJohnson questo morbo fa parecchie vittime anche qui. Scuso solo quelli in Sicilia e Calabria, il resto dal gommista."
295811191652093953,Mon Jan 28 08:30:58 +0000 2013,"La neve, la costante K del nostro inverno."
295702605798207489,Mon Jan 28 01:19:29 +0000 2013,"Reflusso che bello che mi fai compagnia a quest'ora, sì."
295628173004120066,Sun Jan 27 20:23:43 +0000 2013,Sono pronta. Ma non vinco mai. http://t.co/fLOZyEW3
295544002671960064,Sun Jan 27 14:49:15 +0000 2013,"Non ci si può rilassare un attimo sul divano che facendo zapping capiti sul 5 e vedi gente che si insulta per Corona. Utile, interessante."
295185459376689152,Sat Jan 26 15:04:32 +0000 2013,"Il trash tv è ora, su Canale 5."
295139060601729026,Sat Jan 26 12:00:10 +0000 2013,Non fate figli. Sia mai che possano insultare la gente col vostro account se lasciate Twitter incustodito.
295131907933499392,Sat Jan 26 11:31:44 +0000 2013,"Ti prego, ti prego. Se hai un blog e pubblichi articoli, che siano sulle scarpe o sul genere umano, prenditi 5 minuti e rileggi."
295126319027605504,Sat Jan 26 11:09:32 +0000 2013,"Ho scritto una cosa sul gioco del momento. Alla fine vi do il mio nickname per battermi miseramente, forse http://t.co/F74yq0ow #ruzzle"
294911293654171648,Fri Jan 25 20:55:06 +0000 2013,De Rerum Ruzzle. http://t.co/sWRCRXYd
294829851435753472,Fri Jan 25 15:31:28 +0000 2013,"@SidMjkGc immagino. Ci mancava solo ""Tanti auguri a te"" a tempo."
294829219484143616,Fri Jan 25 15:28:58 +0000 2013,"Niente terremoto, qui c'abbiamo solo la nebbia."
294808779160166400,Fri Jan 25 14:07:45 +0000 2013,@FranAltomare #tweetAmano http://t.co/0rOPwnYS
294802670802309121,Fri Jan 25 13:43:28 +0000 2013,@ZanettiCorrado certo! Per ora anche io mi sono basata sui pareri di amiche e amici e si dicono tutti molto contenti. Ti farò sapere :)
294797651629731840,Fri Jan 25 13:23:31 +0000 2013,Il mio Kindle sta arrivando; fortunatamente parte da Castel San Giovanni. #TGIV ( = Is Vicino casa)-
294757136209174528,Fri Jan 25 10:42:32 +0000 2013,"Sarebbero 32 €, ma facciamo 27. E no, non credo che l'altra ragazza te lo facesse pagare 20, magari in un'altra valuta."
294752512681058305,Fri Jan 25 10:24:09 +0000 2013,Ho contrattato un'oretta abbondante al posto di un pomeriggio di lavoro:-).. #dajecosì
294739907912548353,Fri Jan 25 09:34:04 +0000 2013,Vedo la gente polemica.
294731359941955584,Fri Jan 25 09:00:07 +0000 2013,"Accorrete tutti, mi raccomando! #minetti http://t.co/kAO42klz"
294725814958833664,Fri Jan 25 08:38:05 +0000 2013,Ah beh! #mistero http://t.co/uGFItKKI
294713766317264896,Fri Jan 25 07:50:12 +0000 2013,Ecco che fine ha fatto il mio fidanzatino delle medie. http://t.co/8NPt5Rpu
294544856930455552,Thu Jan 24 20:39:00 +0000 2013,Pigiama ecosostenibile. Campagna Greenpeace di chissà quando. No time to waste. http://t.co/vMiRxRUI
294537673392140288,Thu Jan 24 20:10:28 +0000 2013,"Caro Berlusconi, prometto di venirti a spazzare la polvere in casa se tu ti adoperi per portarmi Beckham al Milan. Anche come raccattapalle."
294531871579205632,Thu Jan 24 19:47:24 +0000 2013,"Mio fratello fa un'imitazione di Pinketts che quasi mi sono strozzata col pane, poco fa. #sorellicidio"
294515761790197760,Thu Jan 24 18:43:24 +0000 2013,"@maddalenaerre alla fine l'ho comprata,qui da me non ne trovo. Sono veramente -ma veramente- maldestra. Però sì,non è caruccia, è carissima."
294515243793666049,Thu Jan 24 18:41:20 +0000 2013,@SidMjkGc pensa che fa pure l'operatrice sanitaria..
294510832119848960,Thu Jan 24 18:23:48 +0000 2013,"@SidMjkGc una tipa ad avanti un altro ha risposto che per fare un clistere non va inserito solo il beccuccio, ma tutto il tubo. #idioziaintv"
294450679743909888,Thu Jan 24 14:24:47 +0000 2013,Abito a 25 km dal centro di distribuzione Amazon Italia - l'unico. E il mio Kindle arriva fra 3-5 gg. Farei prima a venirci in bici..
294438954118303745,Thu Jan 24 13:38:11 +0000 2013,"@britishongaku (e @Bea_bs88): mattia. Mi ha stampato,rilegato e regalato i primi cento post del blog.Non è un editore,ma fa effetto uguale.."
294436662015057920,Thu Jan 24 13:29:05 +0000 2013,Utilizzatori di Kindle Paperwhite a me: avete anche la custodia? La compro?
294422368988848128,Thu Jan 24 12:32:17 +0000 2013,Ah io pensavo fosse Megabyte per second. #dong
294421681194299392,Thu Jan 24 12:29:33 +0000 2013,RT @OfficialSanta: ONLY 11 MONTHS TO CHRISTMAS EVE!!!
294392133069193217,Thu Jan 24 10:32:09 +0000 2013,Cose belle. Cose tangibili. http://t.co/NiryBQU4
294102881039155201,Wed Jan 23 15:22:45 +0000 2013,Mia mamma ha dato un olio al tavolo di legno della cucina. Oggi praticamente abbiamo pranzato con cibi aromatizzati al pino.
294099836171587584,Wed Jan 23 15:10:39 +0000 2013,Riusciranno i nostri eroi a vedere un telefilm in streaming sull'xbox (perciò sulla tv) così da non stare seduti su due seggioline scomode?
294094465440817153,Wed Jan 23 14:49:19 +0000 2013,"@britishongaku no, è la nonna di Mattia. Hanno i capelli uguali, lei e Grillo. Giuro."
294021192216625153,Wed Jan 23 09:58:09 +0000 2013,"È una giornata persa quando hai in testa tutta mattina ""Your eyes"" del tempo delle mele 2, intervallata da ""Jenny from the block"" di J.Lo."
294020145410605056,Wed Jan 23 09:53:59 +0000 2013,"Ieri ho comprato a 4€ una collana. Per sapere com'è, basta cercare su Whatsapp la faccina con l'elefante."
294019506420989953,Wed Jan 23 09:51:27 +0000 2013,"Mi manchi, commentatore spammer."
293808204817776640,Tue Jan 22 19:51:49 +0000 2013,"Ho scritto l'ultima lettera degli iPost del cuore. Parlo di tagli di capelli, c'è pure un mini sondaggio. http://t.co/5RgDDHQW"
293694898513780739,Tue Jan 22 12:21:35 +0000 2013,Con questo commento ho vinto. #vegetableunostiledivita http://t.co/BEJF5fbO
293682104913518592,Tue Jan 22 11:30:45 +0000 2013,Invece che touch potevano chiamarlo touché. @Bea_bs88 http://t.co/ovmbTV65
293675403049050112,Tue Jan 22 11:04:06 +0000 2013,Quante belle cose che si scoprono.. E quante belle cose che vorrei dirti.
293666985479385089,Tue Jan 22 10:30:40 +0000 2013,"@britishongaku io credo che non li farò. Mi piacciono gli orecchini, un sacco, ma (ehm) ho un problema con i lobi cadenti delle anziane."
293666539645837312,Tue Jan 22 10:28:53 +0000 2013,"Sono quasi stufa di quei commenti. Ma quasi, perciò potete continuare se volete."
293662289133981696,Tue Jan 22 10:12:00 +0000 2013,"""Tengo un pavone appresso"". Il fatto di non avere buchi alle orecchie mi porta a comprare collane che sembra http://t.co/VQXVjQzR"
293655653560492032,Tue Jan 22 09:45:38 +0000 2013,Lettera Z - iPost del cuore. http://t.co/whnZJbmJ
293630176540098560,Tue Jan 22 08:04:24 +0000 2013,"Mi piace quando mi tiri un cazziatone appena entri in ufficio. Anche se per cose in cui io non c'entro, mi piace molto. Anche domani."
293466928629035008,Mon Jan 21 21:15:42 +0000 2013,"E soprattutto mi viene da dirti che io sto col mio moroso da quando c'erano i Backstreet Boys,ma non mi metto mica a fare status del genere."
293465031641804801,Mon Jan 21 21:08:10 +0000 2013,"Una mia amica del liceo si sposa. A parte la botta di vecchiezza, sono gli status di Facebook che mi fanno venire il prurito. #lassalè"
293457194354085889,Mon Jan 21 20:37:01 +0000 2013,@Bea_bs88 fra l'altro stamattina c'era la tata ninja sulla libertà! Ti whatsappo la foto!
293455517433606145,Mon Jan 21 20:30:22 +0000 2013,"@Bea_bs88 ti voglio super bene, sappilo. Il prossimo passo è mettere un annuncio di vero amore su libertà."
293448542809362433,Mon Jan 21 20:02:39 +0000 2013,"Beatrice, mi leggi? Posso twittarti allora tranquilla senza che la notifica arrivi a Piccolino?"
293424981570899968,Mon Jan 21 18:29:01 +0000 2013,È sempre una giornata migliore quando ti compri uno smalto rosso.
293370426304897024,Mon Jan 21 14:52:14 +0000 2013,"@alicemanza non so se io l'avrei mandato in onda con la stessa enfasi che hanno avuto. Cioè, hanno sbagliato proprio il ""mood"", non so.."
293370047072698368,Mon Jan 21 14:50:44 +0000 2013,"@alicemanza sono d'accordo. Già dall'inizio si capiva tutto.. posso comprendere la volontà di fare ""informazione"" (e di fare ascolti) ma --&gt;"
293297186156990465,Mon Jan 21 10:01:13 +0000 2013,"Paolo Fox mi ha detto ""devi metterti a riordinare qualcosa"". Ho appena finito di mettere a posto uno scaffale di documenti. Paolo mi spii?"
293296934297407489,Mon Jan 21 10:00:12 +0000 2013,"@alicemanza io l'ho scoperto dal tuo ultimo retweet, non ho idea sinceramente ma non mi stupirei.."
293294944267943936,Mon Jan 21 09:52:18 +0000 2013,"@alicemanza sì, c'è il pre e post porno. Quindi il clou."
293278202154078208,Mon Jan 21 08:45:46 +0000 2013,Ieri sera anche il mio moroso ha trovato il mio capello bianco. Almeno così smetterà di dire che sono paranoica..
293268230884188163,Mon Jan 21 08:06:09 +0000 2013,"Ti svegli e pensi ""oh,anche se ho sonno oggi pomeriggio pisolo"". Poi vai in ufficio: ""oggi torni?"". Ok, c'è di peggio, ma è un po' #lamorte."
293146530905477120,Mon Jan 21 00:02:34 +0000 2013,"@alicemanza quando hai tempo, recuperati il video di Sara Tommasi delle iene. Tu che puoi capire, vale la pena."
293084975467753472,Sun Jan 20 19:57:58 +0000 2013,"La Minetti festeggia il suo compleanno al Comoedia, qui a Piacenza.Ci tengo a dire che io sono di Quarto Oggiaro - ora va di moda dire così."
293065813378875392,Sun Jan 20 18:41:49 +0000 2013,RT @Vyrtuosa: Spero che la fatica che si fa a fingersi indifferenti faccia almeno dimagrire
293010953111474177,Sun Jan 20 15:03:49 +0000 2013,Spiegatemi questo commento. #spammamistacippa http://t.co/lDHcx0E8
292981431288885249,Sun Jan 20 13:06:31 +0000 2013,"Girando, a Domenica Live becchiamo Filippo Facci. Mio fratello ""ma dimmi te se dobbiamo ascoltare Elton John che parla dell'imu""."
292976819492249600,Sun Jan 20 12:48:11 +0000 2013,"Avete finito di lasciarmi commenti sul modo di togliere le macchie, sull'aceto, sulla corsa?"
292950350762217472,Sun Jan 20 11:03:01 +0000 2013,"Ho tutte le macchine sepolte dalla neve. Caro signore col trattore spazzaneve, potevi evitare di farmi la muraglia cinese attorno."
292942396721856512,Sun Jan 20 10:31:24 +0000 2013,"RT @banalmentevanna: Io me e Irene http://t.co/Udz75XXV nel caso ve lo siate persi, #nuovopost su #vannabanalityfair e #buonadomenica a  ..."
292824676181348352,Sun Jan 20 02:43:37 +0000 2013,"Se vi capita di trovarvi in giro, in città, ed è appena nevicato, fate un giro a piedi."
292815481155502080,Sun Jan 20 02:07:05 +0000 2013,Passeggiata notturna http://t.co/ayP7j1e8
292774318251835393,Sat Jan 19 23:23:31 +0000 2013,Vedo la gente piccola.
292619794170138624,Sat Jan 19 13:09:30 +0000 2013,Non so se è peggio la pubblicità della sigaretta elettronica o quello della pila movida.
292596228846415873,Sat Jan 19 11:35:51 +0000 2013,All life is about the cookie. #greysanatomy http://t.co/jBFI93GU
292585526484156416,Sat Jan 19 10:53:20 +0000 2013,"Pensare di comprarsi una sedia comoda per il mac, per vedere i film. Io e fratello rischiamo di finire in ospedale, se andiamo avanti così."
292389725677953024,Fri Jan 18 21:55:17 +0000 2013,#coronanonsitrova. Si è autoinvitato dalla Toffanin.
292381407257436160,Fri Jan 18 21:22:15 +0000 2013,Il mio contributo a questa serata: da dentro la tuta faccio i grattini. http://t.co/dJxkaIXV
292331189749026816,Fri Jan 18 18:02:41 +0000 2013,"""Tell me girl if we touch you get this kinda rush"".Quindi, cit. OneDirection: ""dimmi baby se quando ci tocchiamo ci viene un rush cutaneo""."
292326326248034304,Fri Jan 18 17:43:21 +0000 2013,It's Friday I'm in love. -  http://t.co/k7zDp2rf via @youtube
292313122813906944,Fri Jan 18 16:50:54 +0000 2013,"RT @CPrestori: Piemonte: tra oggi è domani previsti 30cm di neve. ""Praticamente un cazzo"" ha dichiarato Rocco Siffredi. #meteo #neve"
292290760311713792,Fri Jan 18 15:22:02 +0000 2013,"Rai, spiegami perché non metti le puntate che mandi su Rai4 in streaming sul sito.Lasciami seguire Lost coi tuoi ritmi ma fammi recuperare."
292274143993409536,Fri Jan 18 14:16:02 +0000 2013,"La mia posizione preferita, divano e coperta, e Parenthood. #ciaoufficio http://t.co/01590J4V"
292217066910527489,Fri Jan 18 10:29:12 +0000 2013,Friends are like stars. Frase a caso trovata sul web #friends http://t.co/Gcmm5x9l
292045692636106754,Thu Jan 17 23:08:13 +0000 2013,Tra l'altro fuori fa meno 4. Fidatevi anche se non vi faccio lo screenshot del termometro.
292042753381130240,Thu Jan 17 22:56:32 +0000 2013,Stasera io e moroso super discorsi esistenziali. Abbiamo commentato live un film di Moccia.
291860415984594944,Thu Jan 17 10:52:00 +0000 2013,"Avete bisogno? Chiamatemi! Sono ""il telefono verde""! (cit.) http://t.co/MgkzEBAI"
291811258422935552,Thu Jan 17 07:36:40 +0000 2013,"""Ho mal di gola"". ""Così starai un po' zitta"". #taaac"
291654915602935809,Wed Jan 16 21:15:25 +0000 2013,"Contenuti e suicidio a parte, ormai usiamo i cancelletti ovunque. http://t.co/54Xtfcr1"
291585766402957313,Wed Jan 16 16:40:38 +0000 2013,"Testa di cazzo che mi hai parcheggiato davanti e sei venuto in retro e mi hai zuccato, e io sono in macchina: caghetta all'istante."
291564461435797504,Wed Jan 16 15:15:59 +0000 2013,"@britishongaku ..e c'è pure chi mi ha detto ""mah, che ci troverai di bello?"". Eretici. Dottoressa tvb!"
291564158594449408,Wed Jan 16 15:14:47 +0000 2013,RT @britishongaku: @iPhabi ho visto questa foto e ti ho pensato molto https://t.co/mqMpGBD9
291563984451153921,Wed Jan 16 15:14:05 +0000 2013,Il pomeriggio che mi aspetta: sfidare il maltempo per andare a prendere il fratellino a scuola e fare la spesa. Che culo. Lo so.
291552420499173377,Wed Jan 16 14:28:08 +0000 2013,"La mia vicina di casa sta sgridando la figlia che avrà dieci anni. Se dovessi dire ""cretina"" a mia figlia (e oltre) chiudetemi in cantina."
291542442262532096,Wed Jan 16 13:48:29 +0000 2013,@maddalenaerre allora mi puoi invidiare senza pietà: è da una settimana che a non fare niente mi annoio a morte..
291517240547880961,Wed Jan 16 12:08:20 +0000 2013,@AndreaScanzi non che gli altri mettano di buon umore.. Ma lui è LA disperazione.
291509396083732481,Wed Jan 16 11:37:10 +0000 2013,"Non è tanto avere i piedi bagnati, è la sensazione di essersi fatta la pipì addosso che non sopporto."
291480016301211649,Wed Jan 16 09:40:25 +0000 2013,"Forse perché nessuno è riuscito ad andare oltre al giochino con la neve di Google, stamattina."
291479728664215552,Wed Jan 16 09:39:17 +0000 2013,Stranamente stamattina i miei amici del team anti-neve non hanno postato nessuna lamentela su Facebook. Facciamo passi avanti.
291473472738177024,Wed Jan 16 09:14:25 +0000 2013,Grazie al braccialetto ora ho un fantastico pulsante di accensione sul polso. http://t.co/vOQDMCJ2
291469179683483648,Wed Jan 16 08:57:22 +0000 2013,"Sei arrivato,hai mugugnato, e quando ti ho detto che il Prosecco arriva domani:""ma perché fai le cose a metà?"" - mi sfugge il senso, capo."
291445984771313664,Wed Jan 16 07:25:12 +0000 2013,Neve in strada non ti temo. Anche se è stata dura.
291316748295217153,Tue Jan 15 22:51:39 +0000 2013,RT @banalmentevanna: @iPhabi vince l'umorismo squallido - che è prerogativa delle menti superiori. &lt;3
291310582815150080,Tue Jan 15 22:27:09 +0000 2013,"@banalmentevanna ""napalm pettinato coi Jonas Brothers"". Hai vinto."
291274206564462592,Tue Jan 15 20:02:37 +0000 2013,@lostmemories non voglio neanche saperlo per non piangere.
291272879176290304,Tue Jan 15 19:57:20 +0000 2013,@lostmemories giuro che stamattina ho detto che lo ritrovavamo nel tg locale. Non si può neanche più scherzare!
291272562879631360,Tue Jan 15 19:56:05 +0000 2013,"@alicemanza ti ritwitterei, #sappilo. #berluscoglioni tag dell'anno."
291266370920931328,Tue Jan 15 19:31:30 +0000 2013,Anche a Teleducato. Berlusconi get a life! http://t.co/MF7s2E7Q
291242771786907648,Tue Jan 15 17:57:42 +0000 2013,Questo telefilm migliora di minuto in minuto. (Forse perché ha solo 7 puntate...). Anche se Shonda sei un po' troppo fissata con gli aerei.
