tid,time,tweet
317345007440891905,Thu Mar 28 18:38:40 +0000 2013,"Buona Pasqua ai credenti nella resurrezione di Cristo Gesu' : ""chiave di apertura del mistero dela fede."" http://t.co/2fPgybUgDy"
317343673618673664,Thu Mar 28 18:33:22 +0000 2013,Serena Pasqua ai follower! Gesu' vi benedica sempre. http://t.co/GPHjn7i0gP
317305952485380096,Thu Mar 28 16:03:28 +0000 2013,"RT @BariLive: Aeroporto, trasportava lingotti d’oro: Sequestrati a una cittadina rumena 500 kg d'oro http://t.co/dzwNIfwhDJ"
317211000589938688,Thu Mar 28 09:46:10 +0000 2013,e' cio' che merita la politica quando diventa aguzzina e scellerata. (@YouTube http://t.co/ILPMaCX4L7)
317210629721186304,Thu Mar 28 09:44:42 +0000 2013,"'L'Italia ha un problema reale immediato che è la recessione, e la recessione non la si cura (@YouTube http://t.co/ILPMaCX4L7)"
316270780843450368,Mon Mar 25 19:30:04 +0000 2013,NON PER QUESTO SONO MENO REALI.
316270694986047488,Mon Mar 25 19:29:44 +0000 2013,"E CIÒ NON PUÒ NON ESSERE AVVERTITO DA CHIUNQUE ABBIA UNA SENSIBILITÀ PER VALORI I QUALI, PER ESSERE SOTTILI E IMMATERIALI,"
316270595102867456,Mon Mar 25 19:29:20 +0000 2013,NON VI E' DUBBIO CHE UNA NAZIONE PASSATA DA UN REGIME MONARCHICO AD UN REGIME REPUBBLICANO SIA UNA NAZIONE «DECLASSATA»
316269336094466048,Mon Mar 25 19:24:20 +0000 2013,"Non dobbiamo credere al Maligno che dice che non possiamo fare nulla contro la violenza, l’ingiustizia, il peccato.- Papa Francesco"
315805771965276163,Sun Mar 24 12:42:18 +0000 2013,RT @Pontifex_it: Cari amici vi ringrazio di cuore e vi chiedo di continuare a pregare per me. Papa Francesco
315805733851631616,Sun Mar 24 12:42:08 +0000 2013,"RT @Pontifex_it: Custodiamo Cristo nella nostra vita, abbiamo cura gli uni degli altri, custodiamo il creato con amore."
315805677064970241,Sun Mar 24 12:41:55 +0000 2013,"RT @Pontifex_it: Il vero potere è il servizio. Il Papa deve servire tutti, specie i più poveri, i più deboli, i più piccoli"
315805629803536385,Sun Mar 24 12:41:44 +0000 2013,"RT @Pontifex_it: Guardo con gioia al prossimo luglio, a Rio de Janeiro! Vi do appuntamento in quella grande città del Brasile!"
315805549742661632,Sun Mar 24 12:41:25 +0000 2013,"RT @Pontifex_it: Non dobbiamo credere al Maligno che dice che non possiamo fare nulla contro la violenza, l’ingiustizia, il peccato."
315805077522743297,Sun Mar 24 12:39:32 +0000 2013,"http://t.co/r29PQjyejR: Cremaschi: fallito l’euro, stracciamo i trattati d... http://t.co/4jfoualJJ6"
315538331368845314,Sat Mar 23 18:59:35 +0000 2013,Dodici non e' il numero perfetto. Tutti sappiamo cosa capito' a Gesu' con Giuda...ed erano in 12.
315469851588194304,Sat Mar 23 14:27:28 +0000 2013,"RT @MassimoCassano: Allarme sanità in Puglia, confronto immediato con le Istituzioni! http://t.co/2bzWrLg6Hi"
315469028896428032,Sat Mar 23 14:24:12 +0000 2013,Incontro tra Papa Francesco e Benedetto XVI: http://t.co/1X7Ut0Ilr4 via @youtube
315158201106563072,Fri Mar 22 17:49:05 +0000 2013,"Napolitano dà l'incarico esplorativo a Bersani: ""Governo del cambiamento"" (@YouTube http://t.co/ILPMaCX4L7)"
315154300357705729,Fri Mar 22 17:33:35 +0000 2013,"Non avendo piu' tematiche credibili, le coalizioni uscenti pensano ad un nuovo spot comune: "" POI TI SPIEGO.."""
314723061075156992,Thu Mar 21 12:59:59 +0000 2013,""" Non cedete all'amarezza.L'amarezza e' un piatto che il diavolo offre tutti i giorni.""- Papa Francesco"
314721433173495808,Thu Mar 21 12:53:31 +0000 2013,"il mondo con la crisi economica e' cambiato per tutti, non siamo sul Titanic."
314721368954523648,Thu Mar 21 12:53:16 +0000 2013,"Vogliamo un Presidente del Consiglio presentabile, specie nelle intenzioni.Basta con i privilegi ai Parlamentari,"
314523517146251264,Wed Mar 20 23:47:04 +0000 2013,"O Papa e' Argentino, mas Deus e' Brasileiro!- Presidenta Dilma Rousseff"
314407597639880704,Wed Mar 20 16:06:27 +0000 2013,PU7MKI il nominativo.
314404944608387072,Wed Mar 20 15:55:54 +0000 2013,Promosso a pieni voti presso Anatel Brasil per l'abilitazione a radioamatore sul territorio Brasiliano: esame di técnica ed ética operativa…
313639604949504002,Mon Mar 18 13:14:43 +0000 2013,Inizio ad avere forti dubbi su una serie di cose indicate come cambiamento... al momento (@YouTube http://t.co/ILPMaCX4L7)
313639602214805504,Mon Mar 18 13:14:42 +0000 2013,Inizio ad avere forti dubbi su una serie di cose indicate come cambiamento... al momento resiste solo Papa Francesco !
313005926074417153,Sat Mar 16 19:16:42 +0000 2013,VALENZANO villa a schiera su 3 superfici http://t.co/qBrYsTyCCk
312890840504754176,Sat Mar 16 11:39:24 +0000 2013,"Se faranno un Referendum sull' UE e suoi poteri, presto ci riprenderemo la nostra Sovranita', (@YouTube http://t.co/ILPMaCX4L7)"
312881871677698048,Sat Mar 16 11:03:45 +0000 2013,"La gente, abituata al peggio, non crede piu' nel bene, neanche se viene proposto da un Papa. La societa' e' seriamente in crisi di valori."
312877369763430404,Sat Mar 16 10:45:52 +0000 2013,"Francesco e quei gesti umili da Papa. Non si siede sul trono, paga il conto in albergo ed altre iniziative in Vaticano, a partire dalla sem…"
312874613698871296,Sat Mar 16 10:34:55 +0000 2013,"Iscriviti al gruppo : "" Radiantismo su Facebook"" http://t.co/GktOsOOp13"
312648065062404097,Fri Mar 15 19:34:42 +0000 2013,""" Non cedete all'amarezza. L'amarezza e' un piatto che il diavolo offre tutti i giorni."" - Papa Francesco"
312516213798498304,Fri Mar 15 10:50:46 +0000 2013,"""Senza la croce siamo preti, vescovi, papi ma non discepoli di Gesù!"" Papa Francesco"
312515345942462465,Fri Mar 15 10:47:19 +0000 2013,""" POI TI SPIEGO.."" utile per le prossime campagne elettorali."
312515228975894529,Fri Mar 15 10:46:51 +0000 2013,"Non avendo piu' tematiche credibili, le coalizioni uscenti pensano ad un nuovo spot comune:"
312506089742692352,Fri Mar 15 10:10:32 +0000 2013,"Complicare la vita ai cittadini ed in questo caso ai condomini, pare sia la prerogativa del legislatore di turno. http://t.co/9B3HkXgyTu"
312263317223792640,Thu Mar 14 18:05:51 +0000 2013,""" Dio perdoni voi fratelli Cardinali per avermi eletto."" - Papa Francesco"
312197325474893825,Thu Mar 14 13:43:37 +0000 2013,VALENZANO villa a schiera su 3 superfici http://t.co/qBrYsTyCCk
312195775704735745,Thu Mar 14 13:37:27 +0000 2013,"Quanti morti sulla coscienza di uno Stato laico e quanti scandali. Non solo le crociate, le inquisizioni, i roghi, la pedofilia, gli affari…"
312163438187126784,Thu Mar 14 11:28:58 +0000 2013,"Speriamo che Papa Francesco I si converta al populismo, di cui abbiamo bisogno per salvare l'Italia dall'oligarchia della Casta."
312163406415269888,Thu Mar 14 11:28:50 +0000 2013,"Speriamo che Papa Francesco I si converta al populismo, di cui abbiamo bisogno per salvare (@YouTube http://t.co/ILPMaCX4L7)"
312102209422770176,Thu Mar 14 07:25:39 +0000 2013,RT @giornalettismo: I candidati grillini alla presidenza di Camera e SenatoLEGGI QUI:http://t.co/OrsuDK1OSH
312101124503138306,Thu Mar 14 07:21:21 +0000 2013,RT @santegidionews: Andrea Riccardi: «Così la Chiesa riparte dal Vangelo e ritrova il coraggio» http://t.co/ibNwQsWyuH #SantEgidio #papa ...
311825144878338048,Wed Mar 13 13:04:42 +0000 2013,"Papa Benedetto XVI, si e' dimesso, insegnando un capitolo di Vangelo superiore, che riguarda l'umilta' ed i limiti umani. La Regina Elisa…"
311798250875260929,Wed Mar 13 11:17:50 +0000 2013,La 7 in diretta streaming | TVdream - La tv che hai sempre sognato http://t.co/2TSrBBPrVS via @tvdream
311797535553511424,Wed Mar 13 11:15:00 +0000 2013,Molti non esprimono Amore perche' a loro volta non l'hanno ricevuto : sono due estranei.
311791369133887488,Wed Mar 13 10:50:29 +0000 2013,RT @beppe_grillo: Se per caso non fosse chiaro: il #M5S non fa alleanze con nessun partito: http://t.co/70FNiNBrTa
311791271016546304,Wed Mar 13 10:50:06 +0000 2013,ll M5S è entrato in parlamento. L'effetto è stato quello di un blitz in un bordello. (@YouTube http://t.co/ILPMaCX4L7)
311790835165442049,Wed Mar 13 10:48:22 +0000 2013,RT @emanuelapatti: Il #M5S è entrato in parlamento. L'effetto è stato quello di un blitz in un bordello. #TsunamiTour
311535058278309888,Tue Mar 12 17:52:00 +0000 2013,Femmine nude in Piazza S. Pietro a dissacrare il Conclave. Il diavolo non va' mai in ferie.
311517242808487936,Tue Mar 12 16:41:13 +0000 2013,"Fintanto che un Papa nero sara' immaginato come preludio alla fine dei tempi,  credo che nessun Cardinale si sognera’ di votarlo :  ""non…"
311516285131440128,Tue Mar 12 16:37:24 +0000 2013,"si sognera’ di votarlo :   ""non per volonta’ di Dio, ma per timore umano."""
311516147658919937,Tue Mar 12 16:36:51 +0000 2013,"Fintanto che un Papa nero sara' immaginato come  preludio alla fine dei tempi,   credo che nessun Cardinale"
311463540458418176,Tue Mar 12 13:07:49 +0000 2013,Io ho quel che ho donato.-- Gabriele D'Annunzio
311460071110483969,Tue Mar 12 12:54:02 +0000 2013,"Quanti morti sulla coscienza di uno Stato laico e quanti scandali. Non solo le crociate, i roghi, la pedofilia, gli affari di certa Chiesa…"
311457798095515648,Tue Mar 12 12:45:00 +0000 2013,Chiesa.. Non diamo la colpa a Dio se il mondo va' alla deriva.
311457680176865280,Tue Mar 12 12:44:32 +0000 2013,"Quanti morti sulla coscienza di uno Stato laico e quanti scandali. Non solo le crociate, i roghi, la pedofilia, gli affari di certa"
311452956732055552,Tue Mar 12 12:25:46 +0000 2013,"Quando i nostri ideali entrano in sintonia con il quotidiano, siamo sulla strada della felicita'."
311215286881751040,Mon Mar 11 20:41:21 +0000 2013,La Bibbia e la fede in Dio.
311215146972352512,Mon Mar 11 20:40:47 +0000 2013,"Tutto cio' che ha natura umana, poi muore e termina il ciclo temporale. Solo cio' che ha natura Divina, vive in eterno:"
311177398475436033,Mon Mar 11 18:10:47 +0000 2013,"Cara grammatica, ti sei sbagliata. Il verbo “restare” non è all’infinito."
311150946241613825,Mon Mar 11 16:25:41 +0000 2013,"""Tieni un capo del filo, mentre con l’altro capo in mano io correrò nel mondo … e se dovessi perdermi, tu tira""...."
311146127707742208,Mon Mar 11 16:06:32 +0000 2013,.... - Attivista M5S (@YouTube http://t.co/ILPMaCX4L7)
311145897432080384,Mon Mar 11 16:05:37 +0000 2013,Hanno avuto piu di 30 anni per cercare di condurre una politica seria.. ed invece hanno (@YouTube http://t.co/ILPMaCX4L7)
311101154199207937,Mon Mar 11 13:07:49 +0000 2013,Hanno avuto piu di 30 anni per cercare di condurre una politica seria.. ed invece hanno portato il Paese e gli Italiani al collasso general…
311101015774617602,Mon Mar 11 13:07:16 +0000 2013,al collasso generale.  Arrendetevi !!!  Siete circondati dagli Italiani .....  - Attivista M5S
311100816427737088,Mon Mar 11 13:06:29 +0000 2013,Hanno avuto piu di 30 anni per cercare di condurre una politica seria.. ed invece hanno portato il Paese e gli Italiani
311099509012832256,Mon Mar 11 13:01:17 +0000 2013,"Il M5S rinuncia ai rimborsi elettorali, Bersani forse #BersaniFirmaQui http://t.co/GSPRamAkqH"
311099348777852928,Mon Mar 11 13:00:39 +0000 2013,http://t.co/7EcN9Ii3bd
311054413676544001,Mon Mar 11 10:02:05 +0000 2013,VALENZANO villa a schiera su 3 superfici http://t.co/qBrYsTyCCk
311052946190254080,Mon Mar 11 09:56:16 +0000 2013,http://t.co/r29PQjyejR: Un microchip all’interno di una pillola. I pazient... http://t.co/kn90d6fjgg
310684700802949121,Sun Mar 10 09:32:59 +0000 2013,http://t.co/r29PQjyejR: TROVATO MORTO AUTORE DI VERITÀ SULL'11 SETTEMBRE http://t.co/AZ4ucbSeYe
310510165914947584,Sat Mar 09 21:59:27 +0000 2013,A me non importa sapere chi e' Dio. A me importa sapere da che parte sta.
310486486980124673,Sat Mar 09 20:25:21 +0000 2013,VALENZANO villa a schiera su 3 superfici http://t.co/qBrYsTyCCk
310477470275092480,Sat Mar 09 19:49:31 +0000 2013,RT @fragrie: In macchina con il senatore Cassano verso Roma!!!Vai Max
310477369095888896,Sat Mar 09 19:49:07 +0000 2013,RT @MassimoCassano: Licenziati Bridgestone: ‘L’abbiamo saputo da Internet’http://t.co/3yrKg7CED4
310081174510907393,Fri Mar 08 17:34:47 +0000 2013,@ubuntuit Uso UBUNTU 10.04
310080888375492608,Fri Mar 08 17:33:39 +0000 2013,@ubuntuit Vi sarei grato per la preziosa informazione. Distinti saluti e ringraziamenti.
310080450003619840,Fri Mar 08 17:31:54 +0000 2013,@ubuntuit  Come configurare la wireless. : SSID cosa devo inserire?Mode: infrastruture o Ad Hoc?BSSID: ?? cosa devo inserire?MAC adress?
309955139937120256,Fri Mar 08 09:13:58 +0000 2013,Auguri a tutte le donne!
309759933895815168,Thu Mar 07 20:18:17 +0000 2013,Crash! FERRARI ACCIDENT! Prova a superare ma si schianta! Puglia 6 marzo...: http://t.co/DaJVPbMqd4 via @youtube
309717656418779137,Thu Mar 07 17:30:18 +0000 2013,Tsunami Tour: http://t.co/YkYhB3VEQB via @youtube
309669499072835584,Thu Mar 07 14:18:56 +0000 2013,RT @chat5stelle: #tsunamitour #m5s #mov5stelle Il finto attivista da Barbara D'urso. Ne stiamo parlando su Chat5stelle.it - Collegati ht ...
309669438683242497,Thu Mar 07 14:18:42 +0000 2013,RT @WebGinMovimento: #tsunamitour ARRIVANO I GRILLINI: E ALLA CAMERASPARISCONO TARGHETTE E VINI PREGIATIhttp://t.co/2RPYtGnfMC
309666657574453248,Thu Mar 07 14:07:39 +0000 2013,"Sfatiamo la storia del Papa nero ed accelleriamo l'elezione del nuovo Papa, spero sia : Cardinale Gianfranco Ravasi."
309628716911316993,Thu Mar 07 11:36:53 +0000 2013,ROMA CAPUT MUNDI (@YouTube http://t.co/ILPMaCX4L7)
309627107896610817,Thu Mar 07 11:30:29 +0000 2013,Non esiste notte tanto buia da impedire al sole di sorgere ed a Dio di esistere. (@YouTube http://t.co/ILPMaCX4L7)
309625715605782529,Thu Mar 07 11:24:57 +0000 2013,"L'euro e' uno strumento mcidiale di speculazione per i ricchi. Quando parlavano di benessere, (@YouTube http://t.co/ILPMaCX4L7)"
309342684240297984,Wed Mar 06 16:40:17 +0000 2013,Le regole del conclave per l'elezione del papa - CRONACA: http://t.co/NDUQjFm6lT
309301306336624641,Wed Mar 06 13:55:52 +0000 2013,"Molti disinformati, non conoscendo il senso etimologico del termine "" populista "", la usano (@YouTube http://t.co/3CIIYyE8RL)"
309300002423975938,Wed Mar 06 13:50:41 +0000 2013,Poco prima della rivoluzione -Dario Fo: http://t.co/ziCxZaXiSf via @youtube
308894295367237633,Tue Mar 05 10:58:33 +0000 2013,"Bersani : Grillo cosa vuol fare?Prima che qualcuno risponda, dico la mia:"" Vogliamo che (@YouTube http://t.co/ILPMaCX4L7)"
308304532725710848,Sun Mar 03 19:55:03 +0000 2013,La pacchia sta finendo in politica..Sarete dipendenti di questi datori di lavoro : i (@YouTube http://t.co/ILPMaCX4L7)
308292898330386434,Sun Mar 03 19:08:49 +0000 2013,"Dai un’occhiata ai miei incredibili slideshow di viaggio! http://t.co/M5J9NPHbia, con Fortaleza http://t.co/9amrXu0Jl3"
307926858303946752,Sat Mar 02 18:54:18 +0000 2013,"L' unica speranza per gli Italiani e' con M5S. Con altri partiti si e' in fase di suicidio assistito, ma non per loro, per noi."
307560090850979840,Fri Mar 01 18:36:54 +0000 2013,restando inchiodati alle poltrone ed al potere.Dicono che il segnale del Papa non era (@YouTube http://t.co/ILPMaCX4L7)
307559871451111424,Fri Mar 01 18:36:02 +0000 2013,"Benedetto XVI ha dato un segnale forte lasciando il potere ed il Vaticano, a spese degli (@YouTube http://t.co/ILPMaCX4L7)"
307558106534121473,Fri Mar 01 18:29:01 +0000 2013,Il mio pensiero circa gli atei ed i comunisti.. http://t.co/x35Qs9Xcoo
307554139645308930,Fri Mar 01 18:13:15 +0000 2013,Senza i voti esteri non saremmo primi alla Camera.Grazie a chi nel mondo si è adoperato per (@YouTube http://t.co/ILPMaCX4L7)
307553728548966400,Fri Mar 01 18:11:37 +0000 2013,RT @adambra: Senza i voti esteri non saremmo primi alla Camera.Grazie a chi nel mondo si è adoperato per far votare il M5S #tsunamitour  ...
307552902577287168,Fri Mar 01 18:08:20 +0000 2013,"pubblico.Spero siano gli ultimi sfarzi di condotte ed utilizzi di denaro pubblico, come fosse (@YouTube http://t.co/ILPMaCX4L7)"
307552652642906112,Fri Mar 01 18:07:21 +0000 2013,L'elicottero della Repubblica Italiana usato per trasportare Benedetto XVI dal Vaticano a (@YouTube http://t.co/ILPMaCX4L7)
307498354877816832,Fri Mar 01 14:31:35 +0000 2013,"In politica, troppe braccia sottratte al lavoro dei campi. (@YouTube http://t.co/ILPMaCX4L7)"
307480980493594624,Fri Mar 01 13:22:33 +0000 2013,"""A lungo andare solo il capace ha fortuna""- Menandro (@YouTube http://t.co/ILPMaCX4L7)"
307459174529372162,Fri Mar 01 11:55:54 +0000 2013,Travaglio su Grillo _  Servizio Pubblico 28 febbraio  2013: http://t.co/MtJDb1NeFW via @youtube
307458641215250432,Fri Mar 01 11:53:47 +0000 2013,RT @VaticanCityHub: Vatican deletes Pope Benedict XVI tweets from @Pontifex http://t.co/seabnNjcQu
307457183359053824,Fri Mar 01 11:47:59 +0000 2013,"@Pontifex_it Il prossimo Papa portirinnovamento, unione, giustizia in primis presso la Santa sede."
307455444455141376,Fri Mar 01 11:41:04 +0000 2013,Leggere i post di Beppe Grillo non ha prezzo! (@YouTube http://t.co/ILPMaCX4L7)
307437118714675200,Fri Mar 01 10:28:15 +0000 2013,http://t.co/qGa9Z74yn8
307436469314789376,Fri Mar 01 10:25:40 +0000 2013,"Con tutto il rispetto per i grillini. Ritengo che Beppe Grillo e tutto lo staff che gli sta accanto in queste ore, sapranno valutare la sit…"
307436248195284993,Fri Mar 01 10:24:48 +0000 2013,"Un tempo anche io mi lasciavo fregare dagli ideali. Adesso guardo le persone, ascolto cosa (@YouTube http://t.co/ILPMaCX4L7)"
307433894981013504,Fri Mar 01 10:15:27 +0000 2013,"RT @a_alibrandi: Un tempo anche io mi lasciavo fottere dagli ideali. Adesso guardo le persone, ascolto cosa dicono e vedo ciò che fanno. ..."
307433848764002305,Fri Mar 01 10:15:16 +0000 2013,Con tutto il rispetto per i grillini. Ritengo che Beppe Grillo e tutto lo staff che gli sta (@YouTube http://t.co/ILPMaCX4L7)
307380706135384064,Fri Mar 01 06:44:05 +0000 2013,Provvedimenti urgenti del Governo per grave crisi economica: http://t.co/IJhQEEopQy
307198996416458752,Thu Feb 28 18:42:02 +0000 2013,"Monti in queste ore viene interrogato da Padre Amorth, il vero esorcista. (@YouTube http://t.co/ILPMaCX4L7)"
307196461723037696,Thu Feb 28 18:31:58 +0000 2013,anzi alimenterebbero critiche da parte degli altri partiti. (@YouTube http://t.co/ILPMaCX4L7)
307196220647014400,Thu Feb 28 18:31:01 +0000 2013,"Se non capite le scelte di M5S di queste ore, sarebbe meglio che facciate silenzio ed (@YouTube http://t.co/ILPMaCX4L7)"
307184907963203585,Thu Feb 28 17:46:03 +0000 2013,"RT @lameduck1960: Il saluto dell'emerito ai suoi cardinali. ""E ora sono Ratzi vostri."" @mentecritica"
307184496699125761,Thu Feb 28 17:44:25 +0000 2013,"I parlamentari M5S sono strumento nelle mani della base popolare, la quale decide per loro i (@YouTube http://t.co/ILPMaCX4L7)"
307180375598309379,Thu Feb 28 17:28:03 +0000 2013,"http://t.co/zHTvDsJOJV Premesso che la fiducia a priori non si da a nessuno piu', tantomeno in politica,  Grillo vuole che Bersani si..."
307179577476800513,Thu Feb 28 17:24:53 +0000 2013,naturalmente a cura di M5S. (@YouTube http://t.co/ILPMaCX4L7)
307179168897064964,Thu Feb 28 17:23:15 +0000 2013,Gli abusi e lo stalking psicologico ed economico-fiscale a cui siamo sottoposti da anni da (@YouTube http://t.co/ILPMaCX4L7)
307178080756183041,Thu Feb 28 17:18:56 +0000 2013,"http://t.co/Dwqb4duzPk Inutile dire, Giusy che gli abusi e lo stalking psicologico ed economico-fiscale a cui siamo sottoposti da anni da..."
307138091116793857,Thu Feb 28 14:40:01 +0000 2013,RT @piergiuseppe2: @FabrizioBratta si può fare fra pochissimo tempo se nasce un governo ma se non nasce bisognerà spiegare perchè abbiam ...
307136565174480897,Thu Feb 28 14:33:58 +0000 2013,#TsunamiTour Aboliti con provvedimento urgente i privilegi anacronistici ai Parlamentari. (@YouTube http://t.co/ILPMaCX4L7)
307135987341987840,Thu Feb 28 14:31:40 +0000 2013,#TsunamiTour Aboliti con provvedimento urgente i privilegi anacronistici ai Parlamentari. Cos'era Monarchia? e' tempo di populismo.
307133781653987330,Thu Feb 28 14:22:54 +0000 2013,a rivotarli.Via ogni privilegio ai parlamentari.E' tempo di populismo.- M5S (@YouTube http://t.co/ILPMaCX4L7)
307133709734248448,Thu Feb 28 14:22:37 +0000 2013,"Hanno abolito la Monarchia per diventare una Repubblica parlamentare, ma con benefici e privilegi Monarchici.In questi decenni, nessuno tr…"
307133548169662465,Thu Feb 28 14:21:58 +0000 2013,"Hanno abolito la Monarchia per diventare una Repubblica parlamentare, ma con benefici e (@YouTube http://t.co/ILPMaCX4L7)"
307116638099095552,Thu Feb 28 13:14:47 +0000 2013,continuano a dichiararsi appartenenti a ideologie che dicono tutto ed il contrario di (@YouTube http://t.co/ILPMaCX4L7)
307116512202878978,Thu Feb 28 13:14:17 +0000 2013,"di cui non conoscono l'esistenza, poiche' i media non hanno informato ed i partiti, tanto (@YouTube http://t.co/ILPMaCX4L7)"
307116330178473986,Thu Feb 28 13:13:33 +0000 2013,"Faccio eccezione per qualche caro amico, con cui ho uno storico familiare.Inizio a bloccare i (@YouTube http://t.co/ILPMaCX4L7)"
307116023016984576,Thu Feb 28 13:12:20 +0000 2013,"Faccio eccezione per qualche caro amico, con cui ho uno storico familiare.Inizio a bloccare i contatti di sinistra, di centro e di destra …"
307113578484338689,Thu Feb 28 13:02:37 +0000 2013,"Leggi ATTENTAMENTE cio' che il Governissimo uscente ti ha confezionato per i prossimi 20 anni, a tua insaputa : http://t.co/bqppDjwt6G"
307111389988802562,Thu Feb 28 12:53:55 +0000 2013,http://t.co/b4jwcyrGuO [http://www.qrz.com/db/IW7DQR|leo://plh/http%3A*3*3www%2Eqrz%2Ecom*3db*3IW7DQR/FcCQ?_t=tracking_disc]
307110398987993088,Thu Feb 28 12:49:59 +0000 2013,"L'Italia dovra' affrontare : crisi politica, economica e innanzitutto, di valori.I valori (@YouTube http://t.co/ILPMaCX4L7)"
307110229504569344,Thu Feb 28 12:49:19 +0000 2013,"L'Italia dovra' affrontare : crisi politica, economica e innanzitutto, di valori.I valori sono saltati, vaporizzati.Senza questa premessa…"
307090902835417088,Thu Feb 28 11:32:31 +0000 2013,umane perche' quelle finanziarie se le sono divorate tutte lui e i suoi compagni. (@YouTube http://t.co/ILPMaCX4L7)
307090676196208640,Thu Feb 28 11:31:37 +0000 2013,"In una recente intervista TV, il ""baffetto Nazionale"" D'Alema dichiarava che l'Italia ha (@YouTube http://t.co/ILPMaCX4L7)"
307088788776181761,Thu Feb 28 11:24:07 +0000 2013,RT @BeppeGrilloNews: Reddito di cittadinanza: ecco dove Beppe Grillo troverà i soldi - Investire Oggi: Investire OggiReddito di cit... h ...
307087380672823297,Thu Feb 28 11:18:31 +0000 2013,"In una recente intervista TV, il ""baffetto Nazionale"" D'Alema dichiarava che l'Italia ha risorse umane per uscire dalla crisi.Parlava degl…"
307086061291577344,Thu Feb 28 11:13:17 +0000 2013,"http://t.co/YJAnl6Toli PD e PDL non vogliono allearsi perchè alle prossime elezioni non potrebbero più dire : ""è colpa loro"", ed andare a..."
307085807787835392,Thu Feb 28 11:12:16 +0000 2013,"PD e PDL non vogliono allearsi perchè alle prossime elezioni non potrebbero più dire : ""è (@YouTube http://t.co/ILPMaCX4L7)"
307082804926234624,Thu Feb 28 11:00:20 +0000 2013,Fiducia: http://t.co/cjI962aEeP
307082312347176962,Thu Feb 28 10:58:23 +0000 2013,@beppe_grillo riportando le regole ed i valori al proprio posto.
307082183728824320,Thu Feb 28 10:57:52 +0000 2013,"@beppe_grillo  dopo un anno cadono e M5S avra' maggioranza assoluta e potra' Governare finalmente questo Paese,"
307082046210179072,Thu Feb 28 10:57:19 +0000 2013,"@beppe_grillo Dare la fiducia a PD - PDL sarebbe come dare la fiducia ad un serpente a sonagli.Facciano il Governo loro due,"
307081733357051905,Thu Feb 28 10:56:05 +0000 2013,"finalmente questo Paese,riportando le regole ed i valori al proprio posto.- M5S (@YouTube http://t.co/ILPMaCX4L7)"
307077620212834306,Thu Feb 28 10:39:44 +0000 2013,Provvedimenti urgenti del Governo per grave crisi economica: http://t.co/IJhQEEopQy
307074841897467904,Thu Feb 28 10:28:42 +0000 2013,Provvedimenti urgenti del Governo per grave crisi economica:: http://t.co/owOUxKXWL2
307072786046791681,Thu Feb 28 10:20:31 +0000 2013,beppegrillo.it http://t.co/ocOqFIqzjJ
307042532687220737,Thu Feb 28 08:20:19 +0000 2013,"Saluto tutti Best 73 de Fabrizio Bratta, IW7DQR http://t.co/PTSur2yR85: http://t.co/xZNf9DCGvh"
306905150163910656,Wed Feb 27 23:14:24 +0000 2013,Provvedimenti urgenti del Governo per grave crisi economica: http://t.co/ehihndZPio
306902527209783296,Wed Feb 27 23:03:59 +0000 2013,Provvedimenti urgenti del Governo per grave crisi economica:: http://t.co/YTc6NtAFfP
306900875773898753,Wed Feb 27 22:57:25 +0000 2013,I just voted for 'Provvedimenti urgenti del Governo per grave crisi economica:' - what do you think? http://t.co/RDRD65HRBY
306817251204550656,Wed Feb 27 17:25:07 +0000 2013,Politometro e Alto tradimento per recenti figure politiche in Italia.- M5S (@YouTube http://t.co/ILPMaCX4L7)
306806080367902720,Wed Feb 27 16:40:44 +0000 2013,Il loro partito decide se premere o no il bottone in Parlamento.
306806019424669696,Wed Feb 27 16:40:29 +0000 2013,Molti politici non sanno neppure cosa significhi: Populista. Non capiscono neanche le leggi che votano.
306778628480458754,Wed Feb 27 14:51:39 +0000 2013,Abrogare o modificare la legge IMU: http://t.co/HNR5hMq5JD
306765192451203074,Wed Feb 27 13:58:15 +0000 2013,"RT @beppe_grillo: Dario Fo: ""Questa è una straordinaria vittoria dei giovani. Pulizia e giovinezza stanno vincendo!"" #TsunamiTour http:/ ..."
306763291718467584,Wed Feb 27 13:50:42 +0000 2013,"Ultim' ora :Grillo : Bersani, morto che parla. Nessuna fiducia. (@YouTube http://t.co/ILPMaCX4L7)"
306712507257589760,Wed Feb 27 10:28:54 +0000 2013,http://t.co/YD7adOSplt Complimenti a Beppe Grillo e al MoVimento 5 stelle. Anch'io li ho sostenuti con il mio voto.
