tid,time,tweet
274114649463607296,Thu Nov 29 11:36:39 +0000 2012,VALENZANO villa a schiera su 3 superfici http://t.co/dzLG6z8o
273876854698565632,Wed Nov 28 19:51:45 +0000 2012,@JackJonze Annuncio idiota. Laurearsi per fare il facchino..Meglio coltivare la terra.
273874116656910337,Wed Nov 28 19:40:52 +0000 2012,http://t.co/fJJ1boHN
273873360683925507,Wed Nov 28 19:37:52 +0000 2012,"RT @Rainews24: Montezemolo: lo Stato smetta di sperperare il nostro denaro: ""Il tema vero - dice Montezemolo - e' il lavoro e... http:// ..."
273844576937197568,Wed Nov 28 17:43:29 +0000 2012,Il vero Pinuccio è solo PinuccioTwit | Pinuccio http://t.co/B0JTEYyG
273842040486363137,Wed Nov 28 17:33:24 +0000 2012,Taranto sorpresa dal tornado e venti a 250 km/hNon ho parole per esprimere il mio stupore e dispiacere.
273770293569417219,Wed Nov 28 12:48:19 +0000 2012,"Allora la politica in Italia serve solo a rimbalzare? mantenendo i propri privilegi?Troppo comodo, signori."
273770233020416000,Wed Nov 28 12:48:04 +0000 2012,Con l'attuale classe politica come facciamo a sopravvivere !?E pensano di andare al voto ma per richiamare lo stesso governo di oggi.
273767827280904192,Wed Nov 28 12:38:31 +0000 2012,"Avevano prmesso un piano si salvataggio per l'Ilva di Taranto, non una tromba d'aria!"
273766255280930816,Wed Nov 28 12:32:16 +0000 2012,"@RosellaPre sembra una dittatura, anzi forse peggio."
273760950811754496,Wed Nov 28 12:11:11 +0000 2012,"a finanziare i debiti dei governi, priva di diritti e garanzie."
273760870872543232,Wed Nov 28 12:10:52 +0000 2012,"governi e politica, che gli hanno anche ceduto la sovranita'.Dimenticavo il popolo: quella parte bassa, che serve solo"
273760734582829056,Wed Nov 28 12:10:20 +0000 2012,Quelli delle Bce sembrano i Talebani delle banche.Fanno la guerra a colpi di svalutazione e speculazione selvaggia.I loro servi :
273758190720675841,Wed Nov 28 12:00:13 +0000 2012,"In Italia, redditi bassi e costo della vita alto.Con questi numeri, come possiamo uscire dalla recessione?"
273747952223281152,Wed Nov 28 11:19:32 +0000 2012,carcere con cella suite.
273747873689116672,Wed Nov 28 11:19:13 +0000 2012,"In Italia se sei uno qualsiasi, finisci in cella a sei.Se, invece, sei qualcuno, arresti domiciliari dorati o, al peggio,"
273414528123940865,Tue Nov 27 13:14:37 +0000 2012,http://t.co/keJYrsWO
273393783012458497,Tue Nov 27 11:52:11 +0000 2012,Anche l'Ocse certifica il fallimento del governo Monti:  http://t.co/4DjXvl4Z
273393081716457474,Tue Nov 27 11:49:24 +0000 2012,https://t.co/hdvg3H4f
273389469690900481,Tue Nov 27 11:35:03 +0000 2012,"strozzi gli Italiani, pur di stare in europa."
273389380251561984,Tue Nov 27 11:34:42 +0000 2012,"Allora, inventano un governo tecnico, che salvi la politica e la tuteli, ma che nello stesso tempo, senza remore e timori politici,"
273389295568556033,Tue Nov 27 11:34:22 +0000 2012,In politica ci sono cose che si possono dire ed altre che non si possono dire.Ma anche per i provvedimenti : non tutti sono popolari.
273382941407711232,Tue Nov 27 11:09:07 +0000 2012,https://t.co/eKE3wYASRagioniamo di Tommaso Francavilla
273142738701152256,Mon Nov 26 19:14:38 +0000 2012,E' veramente deprimente la distanza tra la societa' civile e la politica.
273142618169434112,Mon Nov 26 19:14:09 +0000 2012,"e con aria stanca di ha zappato la terra, afferma : un po' di lavoro, ci vorrebbe. Chissa' se avete intuito di chi sto parlando..."
273142443048849408,Mon Nov 26 19:13:27 +0000 2012,"per via degli interessi passivi, diventa sempre piu' difficile da ottenere.Poi ti arriva il politico di turno in televisione"
273142258172317696,Mon Nov 26 19:12:43 +0000 2012,"del 75/80 %.Immaginate che gran vantaggio. A peggiorare tutto, la stagnazione dei mercati.L'accesso al credito, di per se' pesante"
273142112231505920,Mon Nov 26 19:12:08 +0000 2012,"Con l'avvento dell'euro, ciascuno di noi ha perso con certezza il 50% rispetto alla lira, anche se si parla si una percentuale"
273137367269924864,Mon Nov 26 18:53:17 +0000 2012,Currently reading http://t.co/11Dpq5vK
273129504044642304,Mon Nov 26 18:22:02 +0000 2012,"e speculazione immobiliare e di titoli.La speculazione sta attraversando un periodo prospero, insieme ai suoi promotori."
273129391549214720,Mon Nov 26 18:21:36 +0000 2012,"per governare duro! si parla sempre di misure austere, per il bene delle Nazioni che stanno assicurando stagnazione"
273129224724967424,Mon Nov 26 18:20:56 +0000 2012,"I prossimi mesi, confermeranno questa visione.Oggi, l'europa, per non pregiudicare la politica, ha adottato l'euro e l'economia"
273129032453861376,Mon Nov 26 18:20:10 +0000 2012,"Questa e' la teoria subdola dell'europa.La politica europea, promette ricchezza e liberta', ma assicura l'esatto contrario."
273128868628541440,Mon Nov 26 18:19:31 +0000 2012,L'europa vuole vederci sottomessi e nel bisogno.Un popolo povero e disinformato e' facilmente dominabile.
273125020065218560,Mon Nov 26 18:04:13 +0000 2012,"questa situazione, direi : venduto."
273124934866333696,Mon Nov 26 18:03:53 +0000 2012,riuscito.Naturalmente hanno preservato ogni privilegio alle banche e ai poteri forti.Due volte canaglie! e a chi difende
273124837160005632,Mon Nov 26 18:03:30 +0000 2012,Non c'era bisogno di un elogiato governo tecnico per ridurre il Paese in questo stato.Qualsiasi canaglia precaria ci sarebbe
273108540254736384,Mon Nov 26 16:58:44 +0000 2012,https://t.co/ervVgYiU
273106195374546944,Mon Nov 26 16:49:25 +0000 2012,"Diffamazione: Senato boccia l’articolo1.Art.21, “sconfitti “i manettari della libertà” http://t.co/UDRnMczZ"
273070954106728448,Mon Nov 26 14:29:23 +0000 2012,"Ecco l'ignoranza, che fa' solo danni!"
273070897890463744,Mon Nov 26 14:29:10 +0000 2012,"Molti alle primarie sapevano solo che stavano andando a votare, ma senza troppi perche'...non si pongono neanche il problema."
273043478068469760,Mon Nov 26 12:40:12 +0000 2012,"dalla finanza al Vaticano, dai grandi evasori alla Casta."
273043423886471169,Mon Nov 26 12:39:59 +0000 2012,"Da più di un anno ormai, il governo Monti sta imponendo sacrifici alla gente non per salvare l’Italia, ma i privilegi dei potenti:"
273041449904377856,Mon Nov 26 12:32:09 +0000 2012,"Tutti i loro salari ridotti di un terzo e senza privilegi, per rappresentare degnamente i cittadini e servire il bene pubblico."
273041369398927360,Mon Nov 26 12:31:49 +0000 2012,"Inizino ad autofinanziarsi con attivita' lavorative ed a pagare le tasse, imposte e ad essere fiscalizzati con redditometro d'impresa."
273041246610657280,Mon Nov 26 12:31:20 +0000 2012,La politica per essere credibile non deve essere piu' laboratorio di denaro. Via il finanziamento pubblico ai partiti.
273038339647623168,Mon Nov 26 12:19:47 +0000 2012,La verità non arrossisce di nulla.- Tertulliano
273036196693815296,Mon Nov 26 12:11:16 +0000 2012,"Meglio il piccolo orticello e i debitucci di famiglia, che un'europa disunita ed unita solo nella moneta."
273036131791147008,Mon Nov 26 12:11:01 +0000 2012,Ma il cittadino contribuente quale interesse puo' avere a stare in europa?visto che l'europa e' peggio di una cambiale in protesto..
273023363742584832,Mon Nov 26 11:20:17 +0000 2012,Il redditometro piu' urgente:- alla politica ed alla spesa pubblica !!!
273022818931855360,Mon Nov 26 11:18:07 +0000 2012,"Quando siamo invece in uno stato di gioia e di gratitudine, attiriamo a noi gli altri, perchè l’amore attira amore."
273022757808271360,Mon Nov 26 11:17:52 +0000 2012,"Se scegli di vedere solo il lato triste della vita, attirerai solo le persone che si trovano nella tua stessa situazione."
272661274528206848,Sun Nov 25 11:21:28 +0000 2012,E' necessario che il popolo ignori molte cose vere e ne creda molte false. - M. de Montaigne
272657270645596161,Sun Nov 25 11:05:33 +0000 2012,"Il Brasile e' anche molto burocratico, a differenza delle leggende metropolitane a cui ci hanno abituati in Italia."
272644006863843328,Sun Nov 25 10:12:51 +0000 2012,"Io non amo la gente perfetta, quelli che non sono mai caduti, non hanno inciampato. A loro non si è svelata la bellezza della vita."
272384063111847936,Sat Nov 24 16:59:55 +0000 2012,CONTROLLO DELLE MENTI - Non continuare ad essere rincoglionito..guarda i...: http://t.co/xPgxAqGG via @youtube
272352226192785408,Sat Nov 24 14:53:25 +0000 2012,"progresso e della tecnologia che tutto fa' sembrare migliore.....ma e' anche questa un'illusione, sia pur buona."
272352158819708929,Sat Nov 24 14:53:09 +0000 2012,"Oggi, siamo messi peggio di altre epoche storiche!con assoluta certezza. Forse non ce ne accorgiamo del tutto, per via del"
272344794834010112,Sat Nov 24 14:23:53 +0000 2012,Eddie Vedder - Long Nights [HD]: http://t.co/RgEWh2ip via @youtube
272337356504309760,Sat Nov 24 13:54:20 +0000 2012,Trovatemi un politico onesto ed io vi trovero' una prostituta onesta.
272330859846201344,Sat Nov 24 13:28:31 +0000 2012,soprattutto alle categorie sopra citate!Oppure in Italia le tasse le deve pagare sempre e solo il poveraccio?
272330759723962368,Sat Nov 24 13:28:07 +0000 2012,"volumi d'affare plurimilionari, pagano le tasse?sono fiscalizzate e come??? Applicassero il criterio induttivo redditometro"
272330603469348864,Sat Nov 24 13:27:30 +0000 2012,"con il primo.Seguono:- traffici di droga, armi, clandestini e tanti altri traffici illegali.Queste categorie, che hanno"
272330471629791233,Sat Nov 24 13:26:58 +0000 2012,"Il primo mestiere piu' antico del mondo : la prostituzione.Il secondo mestiere piu' antico del mondo : la politica, ed ha molte attinenze"
272328236736856064,Sat Nov 24 13:18:05 +0000 2012,"senza pensione, in ogni caso senza reddito."
272328165664366592,Sat Nov 24 13:17:48 +0000 2012,"prendeva cura per tutelare il suo patrimonio.Oggi, invece, quando un lavoratore non serve più lo si rottama, lasciandolo senza lavoro"
272328070281719808,Sat Nov 24 13:17:26 +0000 2012,"I poveri stavano meglio nelle epoche in cui vigeva la schiavitù: essendo lo schiavo proprietà del padrone, almeno quest'ultimo se ne"
272327035999887360,Sat Nov 24 13:13:19 +0000 2012,L'identikit dell'europeo medio : povero
272326477259894784,Sat Nov 24 13:11:06 +0000 2012,Gino Paoli - Senza fine: http://t.co/XyXfF8zI via @youtube
272324399284244480,Sat Nov 24 13:02:50 +0000 2012,Credo che il feudalesimo medioevale fosse migliore dell'europa plebea soltanto.
272322918598467584,Sat Nov 24 12:56:57 +0000 2012,Ma per essere europeo occorre diventare pezzenti?
272321044902203392,Sat Nov 24 12:49:31 +0000 2012,sono fiscalizzate e come?Oppure in Italia le tasse le deve pagare sempre e solo il poveraccio?
272320936282304512,Sat Nov 24 12:49:05 +0000 2012,"clandestini e tanti altri traffici illegali.Queste categorie, che hanno volumi d'affare plurimilionari, pagano le tasse?"
272320497071554560,Sat Nov 24 12:47:20 +0000 2012,"in forma induttiva col redditometro : Il mestiere piu' antico del mondo , la prostituzione ed ancora:- traffici di droga, armi,"
272320179789238273,Sat Nov 24 12:46:04 +0000 2012,per una proprieta' che e' costata fatiche e viene umiliata da una classe politica formata da molti inetti. Perche' non tassano
272319989229432832,Sat Nov 24 12:45:19 +0000 2012,"L'Italiano proprietario di casa principale, se affitta, viene tartassato da irpef e imu ( i comuni quasi sempre applicano l'aliquota massima"
272315651094372352,Sat Nov 24 12:28:05 +0000 2012,"L'euro e' intangibile.- Napolitano Il mio commento: "" tra un po' non lo potremo piu' toccare! """
272308466301931520,Sat Nov 24 11:59:32 +0000 2012,http://t.co/DNwCECAc
272303743922470912,Sat Nov 24 11:40:46 +0000 2012,"Come il ferro in disuso arrugginisce, così l'inazione sciupa l'intelletto.- Leonardo Da Vinci"
272303474618810368,Sat Nov 24 11:39:42 +0000 2012,https://t.co/QvNyIvud
272057530279145472,Fri Nov 23 19:22:24 +0000 2012,A l' - IMU - rtacci vostra !!!' Ve piasse un corpo!
272056684736811009,Fri Nov 23 19:19:02 +0000 2012,"Italiani non scherziamo con il debito pubblico, perche' anche uno Stato puo' fallire.- Napolitano"
272033225298309121,Fri Nov 23 17:45:49 +0000 2012,è- a ben vedere- la vera “agenda Monti”. - Tommaso Francavilla
272033164451536896,Fri Nov 23 17:45:35 +0000 2012,Trasformare una società di quasi tutti proprietari in una di inquilini forzati alla mercè di un potere oscuro e senza scrupoli
272030936206540800,Fri Nov 23 17:36:43 +0000 2012,"attivita': speculare, speculare, speculare!"
272030856326045697,Fri Nov 23 17:36:24 +0000 2012,"e svalutare.In seguito, con calma e flemma, le banche designate li acquisteranno e speculeranno.Questa e' la loro principale"
272030749912363008,Fri Nov 23 17:35:59 +0000 2012,Adesso propongono di investire i soldi rimasti agli Italiani onesti in titoli.Naturalmente per lasciarli seccare al sole
272026296144510976,Fri Nov 23 17:18:17 +0000 2012,"RT @OrnitoRincoBlu: “Maestro, dopo 20 anni d'allenamenti sono degno alfine di conoscere il segreto della tua imbattibilità” “Non ho mai  ..."
272024888414437376,Fri Nov 23 17:12:42 +0000 2012,"agli Italiani onesti, in cure ospedaliere private oncologicheirreversibili, come il loro fottuto euro."
272024818084368384,Fri Nov 23 17:12:25 +0000 2012,"Auguro a tutti un lieto w.e.Auguro ai responsabili di questo periodo opaco in Italia, di spendere i soldi rapinati"
272023688117886976,Fri Nov 23 17:07:55 +0000 2012,La felicità umana non sta mai ferma in uno stesso luogo.- Erodoto
272022735188807680,Fri Nov 23 17:04:08 +0000 2012,"affiliate.Se non ci liberiamo, manderanno le famiglie Italiane in default.Stop"
272022665622073344,Fri Nov 23 17:03:52 +0000 2012,"Menti aliene al governo tecnico dominano le masse e ne determinano le sorti.Speculano sui titoli e immobili, favorendo le banche"
272016936248954880,Fri Nov 23 16:41:06 +0000 2012,Il Grande Golpe Globale - chi sono Mario Monti e Luca Papademos?: http://t.co/VchqaKLK via @youtube
271979704666431489,Fri Nov 23 14:13:09 +0000 2012,"Dai un’occhiata ai miei incredibili slideshow di viaggio! http://t.co/s3CMdotA, con Fortaleza http://t.co/mQOWj0pT"
271973315244077056,Fri Nov 23 13:47:46 +0000 2012,@epic_info @Repazzo @gangnamstylehp Grazie!
271972416677363713,Fri Nov 23 13:44:11 +0000 2012,Charles Aznavour - Avé Maria: http://t.co/t853szig via @youtube
271950464441020417,Fri Nov 23 12:16:57 +0000 2012,#Europa Draghi non ha evitato disastro ma messo in atto un ricatto: l’Italia deve ...all’anno http://t.co/48lgGZxZ
271936612357771264,Fri Nov 23 11:21:55 +0000 2012,http://t.co/j3sCmnh2
271932452631613440,Fri Nov 23 11:05:23 +0000 2012,Fabrizio:Bratta http://t.co/uxG70RWn
271614508777222145,Thu Nov 22 14:01:59 +0000 2012,"Solo coloro che sono abbastastanza folli da pensare di poter cambiare il mondo, lo cambiano davvero- Gandhi"
271610916792041473,Thu Nov 22 13:47:43 +0000 2012,"La prossima casa che compro sara' un Camper.Non paghero' l'Imu e nel redditometro, passera' come un bene comune."
271596964276228096,Thu Nov 22 12:52:16 +0000 2012,Chiedere può essere la vergogna di un minuto...ma non chiedere può essere il rimpianto di una vita.
271595530205937664,Thu Nov 22 12:46:35 +0000 2012,"Talvez Deus manda as provas, mas se superar...sera' otimo para todos! nao duvidar. Eu ja passei e hoje estou aqui amando Deus!"
271582284535197697,Thu Nov 22 11:53:57 +0000 2012,I due più diffusi elementi dell'universo sono l'idrogeno e la stupidità.
271580513859432448,Thu Nov 22 11:46:54 +0000 2012,"in locazione:alta, iniqua, da ridurre considerevolmente."
271580455034314752,Thu Nov 22 11:46:40 +0000 2012,"Su Rai internazionale, parlando di IMU, esperti di fisco concordavano sulla aliquota massima per le case principali date"
271571741300629504,Thu Nov 22 11:12:03 +0000 2012,@LaPlayadelSol3F Con assoluta certezza!
271566963350839297,Thu Nov 22 10:53:04 +0000 2012,"@LaPlayadelSol3F Con la crisi economica, anche piu' spaziosa.."
271558970508988416,Thu Nov 22 10:21:18 +0000 2012,"Dai un’occhiata ai miei incredibili slideshow di viaggio! http://t.co/s3CMdotA, con Fortaleza http://t.co/mQOWj0pT"
271256388011974656,Wed Nov 21 14:18:57 +0000 2012,Essere famosi su Twitter è come essere ricchi a Monopoli.
271256276116312064,Wed Nov 21 14:18:30 +0000 2012,@sorrentino_v Idioti del genere...non credo.
271254849755156480,Wed Nov 21 14:12:50 +0000 2012,"Da gennaio 2013, le spese dovranno quadrare, in qualche modo, con la dichiarazione dei redditi. Questo e' lo scopo del redditometro."
271226898523246592,Wed Nov 21 12:21:46 +0000 2012,"L'invidia fa danni diretti ed indiretti, e' come un'imposta.."
271222230187388929,Wed Nov 21 12:03:13 +0000 2012,"Ma siamo qui, piu' forti di prima."
271222176265412608,Wed Nov 21 12:03:00 +0000 2012,"La mia famiglia ha sofferto sempre una invidia cieca e sorda.Un'invidia che parlava, naturalmente per invidia."
271216125616984064,Wed Nov 21 11:38:57 +0000 2012,Grazie e' una parola che solo le persone gentili sanno pronunciare..
271215227792662528,Wed Nov 21 11:35:23 +0000 2012,e' la perdita della sovranita' monetaria e perfino politica.
271215139754233856,Wed Nov 21 11:35:02 +0000 2012,"pro capite in piu' della media europea.Non possiamo uscirne da questa situazione con le nuove regole e poi, cio' che piu' ci condanna"
271215041582342145,Wed Nov 21 11:34:39 +0000 2012,"Oggi, con le direttive europee, che io chiamo dittatura, siamo schiacciati o compressi, in un cantuccio e in Italia abbiamo 100 E di tasse"
271211348250218496,Wed Nov 21 11:19:58 +0000 2012,"""Alle 10,30 stacco la spina. L'Italia sarà la vergogna del mondo"" http://t.co/uqoUcLvx"
271209501217132544,Wed Nov 21 11:12:38 +0000 2012,brutta storia ....in piena guerra e noi compressi da sporchi interessi.
271209448977084416,Wed Nov 21 11:12:26 +0000 2012,"Questo è il prezzo che noi stiamo pagando , siamo davanti a mostri, alcuni molto lontani ma che dominano l'economia mondiale"
271208575865606144,Wed Nov 21 11:08:57 +0000 2012,"L'europa e la sua strategia dittatoriale verso gli stati membri, gioca un ruolo determinante del sistema globale."
271203874910646272,Wed Nov 21 10:50:17 +0000 2012,della dittatura economica europea dell'euro.
271203820841885696,Wed Nov 21 10:50:04 +0000 2012,"Che strana democrazia in Italia ed in europa ;dietro questa parvenza e dietro un dito, si nasconde il gigante"
271189238823927808,Wed Nov 21 09:52:07 +0000 2012,L'esperienza non ha alcun valore etico: è semplicemente il nome che gli uomini danno ai propri errori.- Oscar Wilde
270936930047373312,Tue Nov 20 17:09:32 +0000 2012,Con Dio si sta piu' tranquilli.
270936876934909952,Tue Nov 20 17:09:19 +0000 2012,"Se il mondo civile continua a darmi problemi, mi ritiro in un Convento di clausura e spengo radio, tv e pc per sempre."
270934168588931073,Tue Nov 20 16:58:34 +0000 2012,Depeche Mode - Precious: http://t.co/1CCUuGb5 via @youtube
270932281831604224,Tue Nov 20 16:51:04 +0000 2012,-Mo' scommetto che chiamano i cittadini per garantire.
270932228849152000,Tue Nov 20 16:50:51 +0000 2012,"La zecca etimologica politica ha coneato oltre alla classica frase:- A mia insaputa, una perla di questi giorni: NON GARANTISCO."
270930611227742208,Tue Nov 20 16:44:26 +0000 2012,viene rimbalzato ai cittadini.
270930553308598272,Tue Nov 20 16:44:12 +0000 2012,"Il debito pubblico sara' dello Stato : oggi privi si sovranita' monetaria ed a breve politica voluto dell'europa,"
270928493875953664,Tue Nov 20 16:36:01 +0000 2012,"E ""quando le spese sono compatibili con il reddito - ha concluso - non ci sono problemi"".- Befera"
270925913548546048,Tue Nov 20 16:25:46 +0000 2012,"Fisco, nel nuovo redditometro 100 voci di spesa che mettono nel mirino anche i patrimoni -Il Sole 24 ORE http://t.co/shVGNlvx via @sole24ore"
270898721074597888,Tue Nov 20 14:37:42 +0000 2012,Ma è un pregiudizio contemporaneo che noi adesso lo sappiamo meglio di qualsiasi altro tempo.
270898657665110017,Tue Nov 20 14:37:27 +0000 2012,"E' un giusto giudizio dei dotti che gli uomini di tutti i tempi abbiano creduto che cosa sia bene e male, degno di lode e di biasimo"
270897569645862913,Tue Nov 20 14:33:08 +0000 2012,Dal posto fisso noioso al non garantiscoEcco tutte le gaffes e i dietrofront di Monti http://t.co/UdLrbVIy
270892926958186497,Tue Nov 20 14:14:41 +0000 2012,Il mondo civilizzato e' costituito da predatori e prede che formano la societa'.
270888746537320448,Tue Nov 20 13:58:04 +0000 2012,"Parlarono poco: ciascuno era già felice di sentire l'altro accanto a sé. Più niente importava, se non il fatto di essere insieme.-- G Musso"
270885941026111488,Tue Nov 20 13:46:55 +0000 2012,interessi.Credo che viaggiamo verso un pianeta che va' oltre la follia.
270885885728399360,Tue Nov 20 13:46:42 +0000 2012,"Non capisco, con i numeri che abbiamo, chi mai potra' pagare non solo il terzo debito pubblico al mondo, ma gravato da pesanti"
270884043212611587,Tue Nov 20 13:39:23 +0000 2012,"@Durcier Sono d'accordo. Sarebbe una cosa equa e non pilotata, visto e considerato che sono tutti papabili per eta'."
270883574775951363,Tue Nov 20 13:37:31 +0000 2012,"RT @Durcier: ""Il papa dovrebbe essere eletto per sorteggio […] Se si è veramente credenti bisogno lasciar fare a dio, non alla politica  ..."
270882034971443200,Tue Nov 20 13:31:24 +0000 2012,È l'intelletto superficiale che non presta all'antichità la dovuta reverenza.- Erasmo da Rotterdam
270870694970134528,Tue Nov 20 12:46:20 +0000 2012,Chiclete com Banana -- Eu Quero Esse Amor / Quero Chiclete - Vídeo Oficial: http://t.co/c0gIMeLN via @youtube
270855331448492032,Tue Nov 20 11:45:17 +0000 2012,RT @stefyorlando: Capite l'importanza di Twitter? Senza non avrei mai saputo che oggi è il #PompinoDay
270854185543692289,Tue Nov 20 11:40:44 +0000 2012,"@tommytedone 5000 E sono pure assai, ma sarebbero meglio!"
270847256935141376,Tue Nov 20 11:13:12 +0000 2012,RT @Njr92: Bom Dia .. Bora treinarr ⚽ http://t.co/zaC1B0d8
270842451768532992,Tue Nov 20 10:54:07 +0000 2012,Dovranno fare ancora meglio dell'attuale. (cit. Monti)
270842401931804672,Tue Nov 20 10:53:55 +0000 2012,"I prossimi governi, dovranno proseguire questa logica di austerita', auguriamoci non perpetua. ( cit. Napolitano)"
270838967451140096,Tue Nov 20 10:40:16 +0000 2012,"L' euro e' depressivo, produce controindicazioni economiche e psicologiche."
270835388522852352,Tue Nov 20 10:26:03 +0000 2012,"remore e limiti, a partire da questo momento, ognuno segua la propria strada.E non dite che non vi avevo avvisati."
270835250819633152,Tue Nov 20 10:25:30 +0000 2012,"Visto l'art 127bis del mio codice etico personale e considerato che il mondo, la politica e la finanza avanzano sulla loro strada, senza"
270678345300205568,Tue Nov 20 00:02:01 +0000 2012,RT @emanuelapatti: Ricordando a colaninno che referendum in materia euro non si potrà mai fare. Lo dice l'art. 75 della Costituzione. #O ...
270674479582167041,Mon Nov 19 23:46:39 +0000 2012,@nostalgia8090 Grazie
270672330970234882,Mon Nov 19 23:38:07 +0000 2012,@nostalgia8090 https://t.co/tDgF6GpxBuonanotte! la senti domani..
270671657012695040,Mon Nov 19 23:35:26 +0000 2012,@MassimoBoldi Un Natale senza di voi e' un Natale perso..
270669484380012544,Mon Nov 19 23:26:48 +0000 2012,DANCE MEGA MIX ANNI 80 BALDADJ-01.wmv: http://t.co/oh0DH6ao via @youtube
270668486165024768,Mon Nov 19 23:22:50 +0000 2012,MOURIR D'AIMER - CHARLES AZNAVOUR: http://t.co/CwZYGSGi via @youtube
270641208714469376,Mon Nov 19 21:34:27 +0000 2012,che non ci accorgiamo di quella che ci è stata aperta.
270641145258864640,Mon Nov 19 21:34:11 +0000 2012,"Quando la porta della gioia si chiude, subito se ne apre un'altra; ma spesso rimaniamo talmente incantati a guardare la porta chiusa"
270633377500102656,Mon Nov 19 21:03:19 +0000 2012,"molto compatti e solidali tra loro, uniti nel senso e nella volonta' comuni di ricchezza economica e forse anche di avarizia proverbiale."
270633288782188544,Mon Nov 19 21:02:58 +0000 2012,"Non conosco la storia di Israele, se non quella biblica.Per quanto riguarda invece gli Ebrei, pare siano dispersi nel mondo e comunque"
270584488642367488,Mon Nov 19 17:49:03 +0000 2012,Saluto tuttiOre 14.46 di Brasilia Fine delle trasmissioni in lingua Italiana
270583460102545408,Mon Nov 19 17:44:58 +0000 2012,.........e sto parlando di questa generazione.
270583394981773312,Mon Nov 19 17:44:43 +0000 2012,"Una storia recente dichiarava che con l'euro saremmo stati tutti meglio, non avremmo subito manovre finanziarie pesanti.."
270578623755464704,Mon Nov 19 17:25:45 +0000 2012,"al contrario, temo il potere temporale."
270578553068867584,Mon Nov 19 17:25:28 +0000 2012,"I libri di storia possono raccontare fatti ad uso e consumo del potere temporale.Non credo alla storia e nello stesso tempo,"
270569399478542336,Mon Nov 19 16:49:06 +0000 2012,"Il predatore farebbe mai gli interessi della preda?Forse solo in un caso, quando dorme, visto che quando e' sveglio e' sempre affamato."
270564575336865792,Mon Nov 19 16:29:56 +0000 2012,RT @emanuelapatti: Se non sapete usare Twitter vi prego tornate quando sarete più preparati. Il rischio è la rottura di maroni per qualc ...
270540864323993600,Mon Nov 19 14:55:43 +0000 2012,"@emanuelapatti Molti conti ai ristoranti sono pagati dai partiti e con denaro pubblico, per questa semplice ragione sono pieni."
270538160528822272,Mon Nov 19 14:44:58 +0000 2012,Ecco che cosa cambia per chi ha un conto corrente in Svizzera  - Il Sole 24 ORE http://t.co/l0EyEhMf via @sole24ore
270537329414914049,Mon Nov 19 14:41:40 +0000 2012,""" Quando faccio qualcosa, mi piace farla bene. """
270518070420840448,Mon Nov 19 13:25:08 +0000 2012,"Dai un’occhiata ai miei incredibili slideshow di viaggio! http://t.co/27mmZ4Tc, con Fortaleza http://t.co/mQOWj0pT"
270513493424365568,Mon Nov 19 13:06:57 +0000 2012,onesti ...non gli fanno mancare mai nulla.
