tid,time,tweet
250664192976240642,Tue Sep 25 18:32:55 +0000 2012,RT @GigiGaudiano: Hai capito gli spagnoli? Assediano pacificamente la sede del Parlamento... Noi proviamo a cambiare le cose col culo su ...
250660483798016000,Tue Sep 25 18:18:11 +0000 2012,Aviões do Forró DVD Oficial em salvador: http://t.co/avWXwjsD via @youtube
250658444263165952,Tue Sep 25 18:10:04 +0000 2012,"Fisco: stop alle “cartelle pazze”, arriva il via libera al Senato | Blitz quotidiano http://t.co/Wav1SxMV via @blitzquotidiano"
250655097992908800,Tue Sep 25 17:56:47 +0000 2012,http://t.co/bXqniIdx
250652663417552896,Tue Sep 25 17:47:06 +0000 2012,@missbuzzi Perche' hai liberato endorfina. :)
250650807765180416,Tue Sep 25 17:39:44 +0000 2012,https://t.co/cfHhaViyLa Politica della Carenza di Paolo Barnard
250603329359605760,Tue Sep 25 14:31:04 +0000 2012,"RT @ansa_it: Berlusconi,salvare la politica da morte. Per colpa di comportamenti collettivi e singoli intollerabili http://t.co/V3Cl36zV"
250599264592470017,Tue Sep 25 14:14:55 +0000 2012,"Quando conosci il lato peggiore di una persona, i casi sono due: lasciarla o tenerla per sempre."
250591170625933313,Tue Sep 25 13:42:45 +0000 2012,♫ Herança - DVD Completo ♫ “Herança – O Som que Balança” http://t.co/QkHLE4qS
250590362639413248,Tue Sep 25 13:39:32 +0000 2012,Forró do Muido - DVD: http://t.co/mnSPmQu7 via @youtube
250586750840360960,Tue Sep 25 13:25:11 +0000 2012,Gli italiani sono convinti che la politica non risolva alcun problema. E così non si accorgono di quanti ne può creare.
250581845337583616,Tue Sep 25 13:05:42 +0000 2012,"RT @newyorker01: DI BENE IN MEGLIO. Cocaina, arrestato direttore poste Senato Presa banda italo-albanese: 10 arresti - http://t.co/sGo9Y ..."
250581160244150272,Tue Sep 25 13:02:58 +0000 2012,RT @MattiaBernardoB: l'ultima di @beppe_grillo: intervistiamo i giornalisti. bella idea. forse così s'infrangeranno pure un po' di miti  ...
250577244798464000,Tue Sep 25 12:47:25 +0000 2012,Forró do Muído - Volta vai - DVD jun-2010: http://t.co/KsifxJ5V via @youtube
250559132682313728,Tue Sep 25 11:35:27 +0000 2012,Internet e'  l'unica risorsa pubblica democratica al mondo.
250554122737176576,Tue Sep 25 11:15:32 +0000 2012,"Orgoglio, superbia ed egocentrismo fanno l'uomo dissociato da Dio. Pazienza e umilta' gli antidoti al veleno e alle lusinghe del maligno."
250552177532207104,Tue Sep 25 11:07:48 +0000 2012,"Di questo passo, l'economia Italiana sara' nelle mani degli usurai."
250550452842795008,Tue Sep 25 11:00:57 +0000 2012,"RT @beppe_grillo: ""Togliendo i soldi la politica diventa di nuovo passione, allegria, voglia di spendersi per la comunità nella quale si ..."
250546718821728256,Tue Sep 25 10:46:07 +0000 2012,LA CRISI MONDIALE E' UNA COLOSSALE FINZIONE. - Economia e politica http://t.co/QAMOmQBF
250293210419716097,Mon Sep 24 17:58:46 +0000 2012,http://t.co/ChXeODNZ
250284070381166592,Mon Sep 24 17:22:27 +0000 2012,E tu vorresti 600 euro al mese dallo Stato? Te lo chiede l’Europa - Barbara Collevecchio - Il Fatto Quotidiano http://t.co/X1TcsTx7
250277020032962560,Mon Sep 24 16:54:26 +0000 2012,"come ultima misura solo il proprio io e le sue voglie"".- Papa Benedetto XVI"
250276811412484096,Mon Sep 24 16:53:36 +0000 2012,"""Si va costituendo una dittatura del relativismo che non riconosce nulla come definitivo e che lascia"
250244440109756416,Mon Sep 24 14:44:58 +0000 2012,I social devono essere integrativi e non sostitutivi delle relazioni sociali.
250244368320049152,Mon Sep 24 14:44:41 +0000 2012,La tecnologia e' all'avanguardia oggi. Peccato che si progredisce solo in una direzione e si perde in relazioni umane.
250238807448895488,Mon Sep 24 14:22:35 +0000 2012,I rapporti umani son difficili perchè siamo scatole chiuse. Le chiavi per entrarci si trovano in fondo a se stessi.
250236989549473792,Mon Sep 24 14:15:22 +0000 2012,http://t.co/k9IQsFum
250229616114012160,Mon Sep 24 13:46:04 +0000 2012,"La fede in Dio, tratta livelli piu' profondi."
250229518873272320,Mon Sep 24 13:45:40 +0000 2012,cosa e' l'acqua. Questi vi rispondera': E' la vita! La scienza tratta il primo livello di conoscenza.
250229379978907648,Mon Sep 24 13:45:07 +0000 2012,"La scienziato ci dira' che l'acqua e' nella composizione : H2O. Chiedete ora, ad una persona che sta morendo di sete nel deserto"
250209985781440512,Mon Sep 24 12:28:03 +0000 2012,La casta ha paura dell' economia reale e della moneta sovrana. - Economia e politica http://t.co/Mde3wpPp
249805702762221568,Sun Sep 23 09:41:35 +0000 2012,RT @emilio_fede: @Tg3web primanorma proibito anonimo su tweet ..troppo facile per gli sfigati insultare e nascondersi..il ministro inte ...
249805608939823105,Sun Sep 23 09:41:12 +0000 2012,RT @emilio_fede: @SalvatoreDig contro labanda di stupratori moraliuna legge europea imporrà che compaia identità di questiimpotenti ...
249550869471825920,Sat Sep 22 16:48:58 +0000 2012,LA CRISI MONDIALE E' UNA COLOSSALE FINZIONE. - Economia e politica http://t.co/QAMOmQBF
249499648706871296,Sat Sep 22 13:25:26 +0000 2012,RT @Libero_official: Il sindaco nomina come vice la sua fidanzata e crolla la giunta http://t.co/zyO8bsRO
249495372374876160,Sat Sep 22 13:08:26 +0000 2012,"@Idvstaff La FIAT in Brasile, con incentivi sulle vendite, dimostra al mondo come si rilancia l'economia di un paese. Saluti e ossequi."
249493913189117953,Sat Sep 22 13:02:38 +0000 2012,"La FIAT in Brasile, con incentivi sulle vendite, dimostra al mondo come si rilancia l'economia di un paese."
249483002596429824,Sat Sep 22 12:19:17 +0000 2012,per casta si intende la politica che governa.
249482934027964417,Sat Sep 22 12:19:01 +0000 2012,"Se qualcuno fa il finto tonto e con capisce cosa sia la casta, a differenza delle varie lobby,"
249482077819514880,Sat Sep 22 12:15:37 +0000 2012,"Oggi, il cittadino e' schiacciato da una casta che domina insieme alla finanza."
249482018319110144,Sat Sep 22 12:15:22 +0000 2012,Bisogna rimodulare il sistema finanziario ed elevare i cittadini a ruolo di dignita' e rispetto sociale.
249470803224195072,Sat Sep 22 11:30:49 +0000 2012,La casta ha paura dell' economia reale e della moneta sovrana. - Economia e politica http://t.co/Mde3wpPp
249463551801032704,Sat Sep 22 11:02:00 +0000 2012,Benvenuti nel Forum - Economia e politica http://t.co/vZqxaCtS
249451064984735744,Sat Sep 22 10:12:23 +0000 2012,perché l'uomo non trovi nulla da incolparlo ».
249450996416253952,Sat Sep 22 10:12:06 +0000 2012,"Qoelet A.T.: Nel giorno lieto sta' allegro e nel giorno triste rifletti: « Dio ha fatto tanto l'uno quanto l'altro,"
249208547877990400,Fri Sep 21 18:08:42 +0000 2012,Il diavolo III (non è simpatico) - incontro con Padre Leoluca Pasqua (te...: http://t.co/wNtUbrI8 via @youtube
249201836698005504,Fri Sep 21 17:42:02 +0000 2012,Google non diffama ma diffonde regolarmente e traccia sul web molti dei nostri movimenti. Tutto regolare?
249152249316651008,Fri Sep 21 14:24:59 +0000 2012,"Furti e rapine nel barese, in due arrestati dai carabinieri  - http://t.co/qPZbd7QB"
249132538969350144,Fri Sep 21 13:06:40 +0000 2012,Pinuccio dal Parlamento - La Legge Elettorale: http://t.co/ROF7NHw8 via @youtube
248872256049131520,Thu Sep 20 19:52:24 +0000 2012,"Padre Francesco Bamonte, sacerdote esorcista (MOLTO IMPORTANTE!): http://t.co/h4McVrar via @youtube"
248868040610033664,Thu Sep 20 19:35:39 +0000 2012,MUSICA ANNI 80 D.J. LAROSA 63: http://t.co/I6PRZrCw via @youtube
248861304591376384,Thu Sep 20 19:08:53 +0000 2012,RT @TintoFiore: Marchionne assicura che la fiat resterà in italia e che le auto continueranno a fare schifo. Monti soddisfatto.
248844428096192513,Thu Sep 20 18:01:49 +0000 2012,Il sindacato dove si lavora in nero (indovinate quale?) http://t.co/QAP3xfdJ via @Giornalettismo
248841749471043584,Thu Sep 20 17:51:10 +0000 2012,"Quindi, speriamo che il sole resista!"
248841662862880768,Thu Sep 20 17:50:50 +0000 2012,Ma non dimentichiamo che i Governi sono legati ad interessi economici che vanno ben distanti dall'interesse dei cittadini.
248841529232326656,Thu Sep 20 17:50:18 +0000 2012,"In alternativa al caro - petrolio, ci sarebbe l'auto a energia solare, gia' progettata e in fase sperimentale in Brasile."
248781705815678976,Thu Sep 20 13:52:35 +0000 2012,Vi invito a non costringermi a risposte che vadano oltre il mio pensiero.
248781620163780608,Thu Sep 20 13:52:15 +0000 2012,"Il mio pensiero resta lo stesso, poiche' sono certo di questa teoria che ho elaborato seguendo l'andamento dei fatti."
248781488571699200,Thu Sep 20 13:51:43 +0000 2012,Il mio pensiero e' libero da condizionamenti politici o clientelari.Non ho voglia di fare polemica o di confrontarmi con nessuno.
248774740347609089,Thu Sep 20 13:24:54 +0000 2012,si vincono le battaglie più dure e anche il debole ha una possibilità.
248774651285757952,Thu Sep 20 13:24:33 +0000 2012,Non è mai tutto perduto se c'è determinazione a lottare. Quando siamo chiamati a lottare per qualcosa di giusto e nostro
248774087055400961,Thu Sep 20 13:22:19 +0000 2012,La casta ha paura dell'economia reale e della moneta sovrana.. - Forum Politica http://t.co/eAHWIwLQ via @sharethis
248763106422034432,Thu Sep 20 12:38:41 +0000 2012,"Ma dimenticavo che l'Italia e' rappresentata benissimo nel film Titanic : cambiano gli attori, ma non la trama."
248762991334522880,Thu Sep 20 12:38:13 +0000 2012,"Se esiste una grave crisi economica, deve essere per tutti. In Italia, la casta ne e' esente, conservando ogni privilegio."
248747021425582080,Thu Sep 20 11:34:46 +0000 2012,http://t.co/uJ0kmw48
248744154660761600,Thu Sep 20 11:23:22 +0000 2012,"Quando il corso della vita sembra ci vada contro e ci retrocede,e' Dio che ci sta tirando indietro per poi lanciarci in avanti ed in alto."
248733275785416704,Thu Sep 20 10:40:08 +0000 2012,"Dammi un cuore che ama e capirà quello che dico... certamente, se parlo a un cuore arido non potrà capire.-- Sant'Agostino"
248726717026426880,Thu Sep 20 10:14:05 +0000 2012,di uscirne e cambiando le regole del gioco.
248726643877769217,Thu Sep 20 10:13:47 +0000 2012,"La sorella di Di Pietro, Concetta, capirebbe meglio come uscire dalla crisi, subito. Dalla crisi si esce con la volonta'"
248721056267919360,Thu Sep 20 09:51:35 +0000 2012,"del misfatto procurato con la crisi, che e' un fenomeno ciclico."
248720560614416384,Thu Sep 20 09:49:37 +0000 2012,"Sempre i politici ed i governanti la finiscano di assumere quei volti falsi e patetici di circostanza, in quanto coscienti e complici"
248501404132577281,Wed Sep 19 19:18:46 +0000 2012,"Il soggetto, ovviamente, ha trovato mille scuse ed e' scappato."
248501303976816641,Wed Sep 19 19:18:22 +0000 2012,"Ho proposto a qualche caso piu' disturbato verso Dio, un incontro chiarificatore con l'esorcista."
248484042666815488,Wed Sep 19 18:09:47 +0000 2012,http://t.co/v5h0dRoV
248477913970774019,Wed Sep 19 17:45:26 +0000 2012,http://t.co/fLetbsXo
248474293057515521,Wed Sep 19 17:31:02 +0000 2012,"i mostri che abbiamo oggi in politica. Tranne qualche eccezione, in particolare un solo politico onesto che ho conosciuto da quel giorno."
248474195753844737,Wed Sep 19 17:30:39 +0000 2012,"Arrivati a questo punto, inizio a pensare che stavamo meglio con la Monarchia. Maledetto quel referendum popolare, che ha prodotto"
248469707055849472,Wed Sep 19 17:12:49 +0000 2012,"cerca conferme, affronta i rischi e fa' quello che desideri..... P. Coelho"
248469626177089536,Wed Sep 19 17:12:29 +0000 2012,"Se dovessi darti un consiglio, ti direi: non lasciarti intimidire dalle opinioni altrui. Poiché solo la mediocrità"
248464526750670848,Wed Sep 19 16:52:14 +0000 2012,http://t.co/BkbvhMrK
248427459630989312,Wed Sep 19 14:24:56 +0000 2012,"Berlusconi denuncia lo scandaloso ""Fiscal compact"". Ma il Pdl lo ha votato..."
248426677665927168,Wed Sep 19 14:21:50 +0000 2012,"La casta blocca la legge sul ""controllo esterno"" su bilanci."
248426493758279680,Wed Sep 19 14:21:06 +0000 2012,"L'unica via di uscita dalla crisi? La sovranità monetaria, la cui mancanza ne è la causa"
248425957701087232,Wed Sep 19 14:18:58 +0000 2012,Che strana democrazia e' quella che stiamo vivendo: - moneta a debito - sovranita' della finanza - impoverimento.
248418202814652419,Wed Sep 19 13:48:09 +0000 2012,"RT @tommytedone: Stanno distruggendo l'ITALIA, e, noi, silenziosi, glielo facciamo fare. Non hanno ridotto di un euro i loro... http://t ..."
248121768114540546,Tue Sep 18 18:10:14 +0000 2012,I cinque Arcangeli Custodi dellaTerra: http://t.co/evVhMD3X via @youtube
248116518817247232,Tue Sep 18 17:49:22 +0000 2012,http://t.co/9QtdoMtB
248112186407387136,Tue Sep 18 17:32:09 +0000 2012,"Il soggetto, ovviamente, ha trovato mille scuse ed e' scappato."
248112089229574145,Tue Sep 18 17:31:46 +0000 2012,"Ho proposto a qualche caso piu' disturbato verso Dio, un incontro chiarificatore con l'esorcista."
248111081489305600,Tue Sep 18 17:27:46 +0000 2012,"Cina, bruciata una chiesa: nessun indenizzo - Vatican Insider http://t.co/OdXXePIY"
248106294521786368,Tue Sep 18 17:08:44 +0000 2012,Il segreto della felicità è capire il valore di ciò che hai trovato.
248073381616963585,Tue Sep 18 14:57:58 +0000 2012,http://t.co/NGTK1MIq
248063803709878272,Tue Sep 18 14:19:54 +0000 2012,Li segnalo puntualmente come impropri e che offendono la religione e noi credenti.
248063733551726592,Tue Sep 18 14:19:37 +0000 2012,"Aprire e divulgare siti blasfemi ed idioti, dimostra la propria demenza e pochezza."
248045307873607680,Tue Sep 18 13:06:24 +0000 2012,https://t.co/h6RkGL8T
248022321019879425,Tue Sep 18 11:35:04 +0000 2012,http://t.co/h6HanlvE
248020164619165696,Tue Sep 18 11:26:30 +0000 2012,http://t.co/oDXT05Vf
248012147781693440,Tue Sep 18 10:54:38 +0000 2012,Tristeza (Quero de novo cantar): http://t.co/eE7EyWQz via @youtube
247755859025858561,Mon Sep 17 17:56:14 +0000 2012,"Finche' la politica sara' distante dalla societa', non sapra' rappresentarla. Abolire i privilegi sarebbe la soluzione."
247711406122758145,Mon Sep 17 14:59:36 +0000 2012,tratta livelli piu' profondi.
247711271871475712,Mon Sep 17 14:59:04 +0000 2012,"cosa e' l'acqua. Questi vi rispondera': E' la vita! La scienza tratta il primo livello di conoscenza. La fede in Dio,"
247711116287959040,Mon Sep 17 14:58:27 +0000 2012,"La scienziato ci dira' che l'acqua e' nella composizione : H2O. Chiedete ora, ad una persona che sta morendo di sete nel deserto,"
247707407638228993,Mon Sep 17 14:43:42 +0000 2012,Regole per le preghiere di guarigione: http://t.co/kKLsyfUU via @youtube
247702435374714880,Mon Sep 17 14:23:57 +0000 2012,Affermare che Dio sia un'invenzione umana e' come dire che il diavolo non esiste. Entrame sono menzogne.
247672320074846208,Mon Sep 17 12:24:17 +0000 2012,http://t.co/T6uDoJek
247670379605274624,Mon Sep 17 12:16:34 +0000 2012,Il cuore percepisce ciò che gli occhi non riescono più a vedere!-- Leonardo Cantoro
247668698205270016,Mon Sep 17 12:09:53 +0000 2012,http://t.co/jnkQU0p8
247668295191367680,Mon Sep 17 12:08:17 +0000 2012,http://t.co/J7S6Wq7u
247657633283190784,Mon Sep 17 11:25:55 +0000 2012,Creatività è avere in testa due diverse idee contrastanti e realizzarne un'altra che le contenga entrambe.
247654843857129472,Mon Sep 17 11:14:50 +0000 2012,"Quanti sono gli esperti, tante sono le opinioni. - Franklin Delano Roosevelt"
247425238487412736,Sun Sep 16 20:02:28 +0000 2012,@Etria2 Stiamo pagando per decenni di sprechi di Stato. I loro privilegi restano immacolati e qui mi fermo per oggi.Buona serata!
247423847656218624,Sun Sep 16 19:56:57 +0000 2012,http://t.co/vTYWVXli
247423040470781952,Sun Sep 16 19:53:44 +0000 2012,"Le Chiese dovrebbero pagare l'Imu. Anche le nostre case, sono le nostre chiese personali."
247419174429806592,Sun Sep 16 19:38:22 +0000 2012,@Etria2 E cosi' sperano che si riprenda l'economia?............grazie per le prezione info!
247416762071670784,Sun Sep 16 19:28:47 +0000 2012,"@Etria2 Quindi, acquisto da costruttore : I/a casa Iva al 4%, mentre II/a casa Iva al 10%? confermi?"
247414272295055360,Sun Sep 16 19:18:53 +0000 2012,"@Etria2 Si, di questa cattiveria ero a conoscenza. La crisi si risolve diminuendo le uscite, gli sprechi e tagliando i privilegi."
247413829129093120,Sun Sep 16 19:17:08 +0000 2012,@Etria2 Quindo oggi in Italia si paga il 10% di iva sull'acquisto della seconda casa? questo dato non lo conoscevo.
247411478196527104,Sun Sep 16 19:07:47 +0000 2012,@Etria2 All'acquisto della casa? al 10%?
247410622982135808,Sun Sep 16 19:04:23 +0000 2012,"Altra cosa, l'IMU dovrebbe essere detraibile dall'IRPEF. Se vogliono che l'economia inizi a rianimarsi."
247410489980747776,Sun Sep 16 19:03:52 +0000 2012,"Sapevate che un italiano residente in Italia se compra casa in un'altra citta' anche se non ne ha altre, paga l'imu come 2a casa?"
247409320638169088,Sun Sep 16 18:59:13 +0000 2012,"@Etria2 @fabriziobratta Non sapevo, assurdo. Se e' la sola casa sarebbe ovvio far pagare come prima casa. E' un abuso."
247392640818098176,Sun Sep 16 17:52:56 +0000 2012,che solitamente preferiscono il silenzio.
247392533573926912,Sun Sep 16 17:52:30 +0000 2012,"di non credere. L'importante e' non offendere, deridere, e giocare con il creatore. Inoltre, bisogna rispettare i credenti in Dio,"
247392380809003010,Sun Sep 16 17:51:54 +0000 2012,"Nietzsche, noto ateo, aveva certamente dei problemi. Dio si e' rivelato nelle sacre scritture, a prescindere da tutto e lascia liberi"
247070315031707648,Sat Sep 15 20:32:08 +0000 2012,La Teologia per noi credenti.La Teoria del nulla per gli atei.
247053895942172672,Sat Sep 15 19:26:53 +0000 2012,"""Se la conoscenza può creare dei problemi, non è con l'ignoranza che possiamo risolverli."" Isaac Asimov"
246980760882532354,Sat Sep 15 14:36:16 +0000 2012,"Oggi su Rai Internazionale alcuni medici commentavano i social - network, definendoli anestetici.In effetti,  sono terapeutici."
246976667736756227,Sat Sep 15 14:20:00 +0000 2012,Le mie impronte sulla sabbia accolgono il becco di gabbiani. Una piccola parte di me spicca il volo con loro sullo sfondo di un cielo blu.
246976021277073409,Sat Sep 15 14:17:26 +0000 2012,Top Tracks for Depeche Mode (lista de reprodução): http://t.co/x7gUuyhS via @youtube
246975498289283072,Sat Sep 15 14:15:22 +0000 2012,"Da una breve indagine risulta che oggi per essere alla moda occorre essere : gay, ateo, di sinistra e avere tanti soldi in banca."
246970146642612224,Sat Sep 15 13:54:06 +0000 2012,Top Tracks for Depeche Mode (lista de reprodução): http://t.co/CXEqOgBP via @youtube
246956408556384256,Sat Sep 15 12:59:30 +0000 2012,Nessuno ci tolga la fede in Dio.E' la sola cosa che ci e' rimasta in questo mondo di ladri.
246954069955063808,Sat Sep 15 12:50:13 +0000 2012,"Incontro con Padre Amorth esorcista, testimonianza su Medjugorje: http://t.co/njTkbIJI via @youtube"
246944451891712001,Sat Sep 15 12:11:59 +0000 2012,"La mia religione e la mia fede in Dio, prescindono dalle vicende umane. Io credo in Dio, al di la' delle colorazioni e degli errori umani."
246940972284538880,Sat Sep 15 11:58:10 +0000 2012,"approfittando ne mangia a sazietà, e poi dice a se stesso: Chi ha preparato questi cibi non esiste.- Pasqualino Clemente"
246882007211200512,Sat Sep 15 08:03:52 +0000 2012,"Io definisco l'ateo come a una persona che entra in una casa, trova una tavola imbandita di cibi succulenti,"
246880084483514369,Sat Sep 15 07:56:13 +0000 2012,"se tu servi il Verbo di Dio, tu vivi alla sua presenza."
246879944385384448,Sat Sep 15 07:55:40 +0000 2012,"se si compie in conformità al suo precetto, poco importa che tu sia in casa o in piazza, poco importa che tu ti trovi a teatro:"
246879778483867648,Sat Sep 15 07:55:00 +0000 2012,"Non in un luogo va cercata la presenza di Dio ma negli atti, nella vita, nel comportamento. Se tutto questo è secondo Dio,"
246874798372827136,Sat Sep 15 07:35:13 +0000 2012,Il corpo umano è fatto per il 65% di acqua e per il 90% di ansia.
246700937731796993,Fri Sep 14 20:04:21 +0000 2012,La politica sta attraversando una fase di ansia di visibilita'.
246700007611314177,Fri Sep 14 20:00:39 +0000 2012,"RT @CiroPetrucci: AI LAVORATORI . E BASTA MANIFESTARE CON BANDIERE DI SINDACATI E ORA DI SVEGLIARSI SONO TUTTI VENDUTI ,BISOGNA MANIFEST ..."
246698017128845314,Fri Sep 14 19:52:45 +0000 2012,Prevedo un buon Governo con l' IDV - Grillo Mov. 5 stelle. Le altre forze politiche e coalizioni iniziano a tremare.
246695282396508160,Fri Sep 14 19:41:53 +0000 2012,La vera saggezza sta nel distinguere il vero dal falso. - Re Salomone A.T.
246694901436264449,Fri Sep 14 19:40:22 +0000 2012,"""Se un uomo non è disposto a correre qualche rischio per le sue idee, o le sue idee non valgono nulla o non vale niente lui"" (Ezra Pound)"
246694092325650432,Fri Sep 14 19:37:09 +0000 2012,"per riconoscerne la differenza."""
246694014764589056,Fri Sep 14 19:36:51 +0000 2012,"""Concedimi la serenità di accettare le cose che non posso cambiare, il coraggio per cambiare quelle che posso e la saggezza"
246693534810386432,Fri Sep 14 19:34:56 +0000 2012,"""In un mondo in cui la menzogna è potente, la verità si paga con la sofferenza"""
246681459698589696,Fri Sep 14 18:46:57 +0000 2012,Sgarbi vomita su Barbacetto: sei un finocchio! E i grillini sono cogl1@ni: http://t.co/tTOhdWBZ via @youtube
246680278402211841,Fri Sep 14 18:42:16 +0000 2012,I signori della guerra vogliono rilanciare l'economia con una nuova guerra santa. Questa volta e' bastato un film a scatenare l'inferno.
246679560136036352,Fri Sep 14 18:39:24 +0000 2012,RT @mkgioconda: È bastato un film per scatenare tanta violenza?Oppure i signori della guerra vogliono rilanciare l'economia?
246594022045515777,Fri Sep 14 12:59:31 +0000 2012,Questa epoca brilla solo in Tecnologia e gia' e' una fortuna immensa.
246593435635699712,Fri Sep 14 12:57:11 +0000 2012,"Di fronte all' idea dell'esistenza discreta di Dio, il non credente, entra in panico."
246583430454865921,Fri Sep 14 12:17:25 +0000 2012,"Erano i microprocessori, che ci hanno catapultati nel futuro."
246583367691284480,Fri Sep 14 12:17:10 +0000 2012,"In un ritrovamento di aeronave aliena in zona area 51, alcuni decenni fa', si entro' in contatto con una nuova tecnologia."
246561640961683456,Fri Sep 14 10:50:50 +0000 2012,"Pochi si impegnano per diventare ""una bella persona""…a molti basta solo ""fare bella figura”."
246335389420376064,Thu Sep 13 19:51:48 +0000 2012,"RT @mattinodinapoli: Montecarlo, Pelè calciatore del secolo  A Maradona resta la corona popolare: NAPOLI - Tutta Napoli ha cantato, e... ..."
246324549162004480,Thu Sep 13 19:08:43 +0000 2012,Affermare che Dio sia un'invenzione umana e' come dire che il diavolo non esiste.Entrame sono menzogne.
246311222440497152,Thu Sep 13 18:15:46 +0000 2012,"RT @IsabellaCesarin: Peccato che gli scontri tra politici, siano sempre e solo verbali."
246311114114232320,Thu Sep 13 18:15:20 +0000 2012,"RT @IlariaSolazzo: Io valgo,perchè non seguo le masse come i caproni.Ragiono con la mia testa senza farmi influenzare dai manipolatori.  ..."
246296724417699841,Thu Sep 13 17:18:09 +0000 2012,""" Non illudetevi che Dio non esista.""  E' il mio messaggio rivolto a chi ha ancora dubbi. L'Altissimo sara' un giudice onesto verso tutti."
246238413148286976,Thu Sep 13 13:26:27 +0000 2012,"Dio fa' bene a rendersi indimostrabile, non e' mica un nostro funzionario..e' Dio."
246236781316550656,Thu Sep 13 13:19:58 +0000 2012,La verita' primaria e' Dio. Le altre verita' sono derivati e sottoprodotti umani.
246236029365936128,Thu Sep 13 13:16:59 +0000 2012,http://t.co/aOsWdcRr
246233487277957120,Thu Sep 13 13:06:52 +0000 2012,"Nel Vangelo Gesù stesso dice proprio questo: ""Conoscete la Verità e la Verità vi farà liberi."" (Gv 8,32)"
246233344952651777,Thu Sep 13 13:06:18 +0000 2012,"Platone con riferimento a sua volta al maestro Socrate: ""Socrate è mio amico, ma più amica di Socrate è la verità."
246212832448872448,Thu Sep 13 11:44:48 +0000 2012,"In amore, solo gli inizi hanno fascino. Non sorprendetevi che si provi piacere a ricominciare spesso."
246209135815831552,Thu Sep 13 11:30:06 +0000 2012,La fortuna e la provvidenza sono figlie della speranza.
246208983373840384,Thu Sep 13 11:29:30 +0000 2012,"A differenza dei beni di consumo, la speranza e' gratis!Abbiate sempre speranza!"
246206104596537345,Thu Sep 13 11:18:04 +0000 2012,"Il mondo si distrugge e si rinnova ogni giorno.La linfa vitale per la rinascita e' la speranza.Fede, speranza, carita'."
246204418113011712,Thu Sep 13 11:11:22 +0000 2012,RT @stornaiolo: Peggio dei crumiri? I sindacalisti che diventano padroni e sfruttano operai indifesi e giovani a part time. Vergogna!
245861485400715265,Wed Sep 12 12:28:40 +0000 2012,"Dai un’occhiata ai miei incredibili slideshow di viaggio! http://t.co/SAyujZ5K, con Maceio http://t.co/6mXZUmRO"
245859506427400192,Wed Sep 12 12:20:48 +0000 2012,Saudade de Maceió: http://t.co/dsItGTgk via @youtube
245854820253188096,Wed Sep 12 12:02:11 +0000 2012,MACEIÓ - Alagoas - Brasil: http://t.co/VdLmFUrV via @youtube
245851824693858304,Wed Sep 12 11:50:17 +0000 2012,far tornare i politici? Questo e' il grande enigma del momento.
245851746663026688,Wed Sep 12 11:49:58 +0000 2012,"L'Italia costretta a subire l'accanimento terapeutico del Governo, ma senza miglioramenti. Cosa fare allora?"
245846084138700801,Wed Sep 12 11:27:28 +0000 2012,RT @nzingaretti: I dati ci dicono che non e' solo crisi ma esaurimento di un modello di sviluppo e bisogna costruirne uno nuovo #rapport ...
245611234177724418,Tue Sep 11 19:54:16 +0000 2012,Jorge Aragão Loucuras De Uma Paixão: http://t.co/zxDi3SFb via @youtube
245604914913476608,Tue Sep 11 19:29:09 +0000 2012,"Il mondo non ci stima perché figli di Dio; consoliamocene che, almeno una volta tanto, esso conosce la verità e non dice bugie.- San Pio"
