tid,time,tweet
294799734953103360,Fri Jan 25 13:31:48 +0000 2013,"fondazioni chesono, paradossalmente, esonerati dall'IMU. Una logica idiota e perversa quella applicata dall'ultimo governo tecnico e dal"
294799601679097856,Fri Jan 25 13:31:16 +0000 2013,"le mafie, il malaffare, le grandi evasioni fiscali, la distrazione di grandi capitali all'estero, oltre alle banche e alle"
294799382916784128,Fri Jan 25 13:30:24 +0000 2013,"Basta con metodi coercitivi : IMU, che fa' versare lacrime e sangue alle famiglie!Ricordo che esistono le economie sommerse,"
294785899873587200,Fri Jan 25 12:36:50 +0000 2013,"In effetti, si dimostrano affaristi, predatori e manipolatori di grandi banche e fondazioni."
294785842583572480,Fri Jan 25 12:36:36 +0000 2013,L'armata Brancaleone della sinistra che predica equita' e si adopera per il sociale con demagogia e populismo.
294783604444250113,Fri Jan 25 12:27:42 +0000 2013,RT @vfeltri: La Guardia di finanza setaccia i conti  degli artigiani che fregano mille euro e nessuno controlla le banche che fregano mi ...
294782440638136320,Fri Jan 25 12:23:05 +0000 2013,RT @berlusconi2013: #Berlusconi: La Germania si oppose alla creazione di una Banca garante e di un debito comune #capranica2013
294771330149126144,Fri Jan 25 11:38:56 +0000 2013,RT @berlusconi2013: #Berlusconi:  Nel primo Consiglio dei Ministri abrogheremo l'imu. Poi ci occuperemo di dare slancio all'occupazione
294771171596066816,Fri Jan 25 11:38:18 +0000 2013,RT @berlusconi2013: #Berlusconi: Sono arrivato da MI a RM in treno in 2 ore e mezzo. Senza di noi non sarebbe mai stato possibile #capra ...
294771058148507648,Fri Jan 25 11:37:51 +0000 2013,RT @berlusconi2013: #Berlusconi: Abbiamo innalzato le pensioni minime per quasi due milioni di pensionati #capranica2013
294771025567162368,Fri Jan 25 11:37:43 +0000 2013,RT @berlusconi2013: #Berlusconi: Sotto mio governo abbiamo fatto crescere un milione e mezzo di posti di lavoro #capranica2013
294770972693757952,Fri Jan 25 11:37:31 +0000 2013,RT @berlusconi2013: #Berlusconi: Abbiamo tenuto i conti in ordine senza aumentare le imposte #capranica2013
294770928699707393,Fri Jan 25 11:37:20 +0000 2013,RT @berlusconi2013: #Berlusconi: Mio governo ha destinato 38 miliardi per garantire la pace sociale #capranica2013
294770875000045568,Fri Jan 25 11:37:07 +0000 2013,RT @berlusconi2013: #Berlusconi: Abbiamo detassato gli straordinari e ottenuto grandi successi nella lotta alla mafia #capranica2013
294769089136713730,Fri Jan 25 11:30:02 +0000 2013,"@berlusconi2013 Presidente si ricordi della casa principale, affittata.Vivo all'estero e pago l'IRPEF sul reddito della locazione. Grazie!"
294760604089081858,Fri Jan 25 10:56:19 +0000 2013,Ma il Sig. Monti ha omonimi al Monti dei paschi di Siena? il dubbio nasce spontaneo.
294759380698660864,Fri Jan 25 10:51:27 +0000 2013,"@vfeltri Infatti, accadeva tutto a loro insaputa, come in politica quando arrivano le inchieste."
294529628729659392,Thu Jan 24 19:38:30 +0000 2013,RT @berlusconi2013: #Berlusconi: Obbligatorio togliere Imu. Casa è pilastro su cui ogni famiglia ha diritto di fondare sicurezza proprio ...
294529551680303104,Thu Jan 24 19:38:11 +0000 2013,RT @berlusconi2013: #Berlusconi: Con Imu valore degli immobili è sceso e le costruzioni edilizie sono diminuite
294516737418858496,Thu Jan 24 18:47:16 +0000 2013,"Bancarotta, falso in bilancio e conti cifrati all'estero, le soluzioni per dirottare ingenti capitali."
294516660424028160,Thu Jan 24 18:46:58 +0000 2013,"Assistiamo a banche, ma anche societa' che diventano vettori per grandi ruberie."
294515918762045440,Thu Jan 24 18:44:01 +0000 2013,"MPS è stato governato di fatto e di diritto dalla sinistra, che governerebbe l'Italia come ha governato il Monte dei Paschi"
294496696010940416,Thu Jan 24 17:27:38 +0000 2013,"Assistiamo a banche, ma anche societa' che diventano volani per grandi ruberie.Bancarotta, falso in bilancio e conti cifrati"
294459693705854978,Thu Jan 24 15:00:36 +0000 2013,"Il centro - destra modifichi la legge IMU:la casa principale, se affittata, resta prima casa! grazie ai parlamentari che lo faranno."
294457786220310528,Thu Jan 24 14:53:01 +0000 2013,"@gasparripdl Senatore mi permetto di far notare che la casa principale, anche se affittata, dovrebbe restare prima casa. Vivo all'estero."
294455089962287104,Thu Jan 24 14:42:18 +0000 2013,"I candidati al parlamento si rallegrino se promossi al voto.Intanto, non facciano promesse se non potranno onorarle."
294445719341891585,Thu Jan 24 14:05:04 +0000 2013,"Gli stessi politici che hanno mandato in rovina una intera Nazione, oggi si ripropongonocome paladini dell'Italia.Cacciateli! al voto.."
294434304136708097,Thu Jan 24 13:19:43 +0000 2013,"Per la questione crack MPS, sono arrivati i primi: Sara' accaduto a nostra insaputa..da parte del PD?Attendiamo ansiosi.."
294432171161174019,Thu Jan 24 13:11:14 +0000 2013,Franco Simone - Respiro: http://t.co/ZTpXrswY via @youtube
294415710006960128,Thu Jan 24 12:05:50 +0000 2013,"Ho un solo account OFFICIAL "" Facebook - Twitter - Youtube - Google + - LinkedIn ""Attenti alle clonazioni accout !!! http://t.co/qWYLJhMA"
294413893424537602,Thu Jan 24 11:58:36 +0000 2013,per tenere gli altri informati...!!!
294413780589371392,Thu Jan 24 11:58:09 +0000 2013,"ho un solo account Official "" Facebook - Twitter - Youtube - Google + - LinkedIn ""Copia questo sulla tua bacheca"
294413403932463105,Thu Jan 24 11:56:40 +0000 2013,"possono dire e pubblicare ciò che vogliono con il tuo nome.Si prega di non accettare una seconda richiesta di amicizia da me,"
294413254015475712,Thu Jan 24 11:56:04 +0000 2013,"account FB. Poi chiedono ai vostri amici per aggiungerli. I tuoi amici pensano che sei tu, e accettano. Da quel momento in poi"
294413108368273408,Thu Jan 24 11:55:29 +0000 2013,FATE ATTENZIONE: alcuni hacker hanno trovato qualcosa di nuovo. Prendono la foto del profilo e il tuo nome e creano un nuovo
294408824704610304,Thu Jan 24 11:38:28 +0000 2013,"con 3,9 miliardi di euro,la stessa cifra prelevata dalle tasche degli italiani x l'IMU"
294408755418898432,Thu Jan 24 11:38:11 +0000 2013,La corte dei conti e la corte costituzionale si pronuncino su questa notizia:Governo Monti ha finanziato Monte dei Paschi di Siena
294407965744713729,Thu Jan 24 11:35:03 +0000 2013,"RT @r_formigoni: Governo Monti ha finanziato Monte dei Paschi di Siena con 3,9 miliardi di euro,la stessa cifra prelevata dalle tasche d ..."
294406915923013632,Thu Jan 24 11:30:53 +0000 2013,"‎"" Quem não gosta de samba, bom sujeito não é """
294399906632851456,Thu Jan 24 11:03:02 +0000 2013,e non parole al vento.
294399822461538304,Thu Jan 24 11:02:42 +0000 2013,"diffusi quali: il falso in bilancio, la corruzione ed il malaffare..?!Basta con la demagogia! i cittadini pretendono fatti"
294399725657018370,Thu Jan 24 11:02:18 +0000 2013,Quale forza politica o coalizione di partiti avra' il coraggio di risanare l'Italia con riforme che contrastino vergogne e fenomeni
294175379722207235,Wed Jan 23 20:10:50 +0000 2013,RT @Giorgiolaporta: “@forzasilvioit: Abbiamo una banca? http://t.co/YCrKSH6n”
294172101466808320,Wed Jan 23 19:57:49 +0000 2013,Un epilogo malsano e contemporaneo. Ancora per molto?
294172035368771585,Wed Jan 23 19:57:33 +0000 2013,"Con il falso in bilancio autorizzato dalla legge, i capitali spariscono e le societa' accedono ai fondi di salvataggio."
294169470539292672,Wed Jan 23 19:47:21 +0000 2013,RT @PNardon: .@berlusconi2013 ci hanno detto che l'#Imu serviva x salvare l'Italia ma è stata usata persalvare #MPS #Monti ha volutament ...
294169165701455872,Wed Jan 23 19:46:09 +0000 2013,"di cuore, con te e per te mi butterei anche nel fuoco sapendo che mi libererai. Grazie Gesù !"
294169069614145536,Wed Jan 23 19:45:46 +0000 2013,"un secondo. Mi disturbava anche quando volevo dormire, mi ha tenuto per mano dandomi il coraggio di un leone. Amico mio grazie"
294168965553467392,Wed Jan 23 19:45:21 +0000 2013,"Vorrei ringraziare tutti coloro che mi son stati vicino ed i nuovi amici. Più di tutti vorrei ringraziare un amico, che non mi ha lasciato"
294149457593909248,Wed Jan 23 18:27:50 +0000 2013,"I diritti Costituzionali non possono essere mai messi in discussione, diventando controversie e malcontenti quotidiani."
294149400538800130,Wed Jan 23 18:27:36 +0000 2013,Credo che la crisi economica non possa in nessun caso giustificare misure anticostituzionali ovvero illiberali ed impopolari.
294146267322404864,Wed Jan 23 18:15:09 +0000 2013,Sarebbe bello sapere se la Corte Costituzionale abbia preso in esame la controversa e spinosa questione dell'IMU.
293808589234130944,Tue Jan 22 19:53:21 +0000 2013,Attendo adesioni al gruppo su LinkedIn. Benvenuti http://t.co/9bVUieXT
293805764743667713,Tue Jan 22 19:42:07 +0000 2013,Attendo adesioni al gruppo. Benvenuti: http://t.co/mNojyzDV
293803627729006592,Tue Jan 22 19:33:38 +0000 2013,Ho creato il gruppo Amici di Fabrizio Bratta su LinkedIn.: http://t.co/qCNeIeHr
293792874720550912,Tue Jan 22 18:50:54 +0000 2013,"In Italia, se si formasse il partito : ""vittime di soprusi"", sarebbe in maggioranza assoluta e governerebbe per decenni."
293788896909725696,Tue Jan 22 18:35:06 +0000 2013,"Questa sera mi candido alla Camera, da letto."
293746382383239169,Tue Jan 22 15:46:09 +0000 2013,"Usa: Approvato Piano Obama, Chip Corporei RFID per Tutti gli Americani http://t.co/RMob4wIZ via @italiadeidolori"
293728282933870592,Tue Jan 22 14:34:14 +0000 2013,Ma la Costituzione e' ancora garante di diritti civili?
293728207767752704,Tue Jan 22 14:33:56 +0000 2013,"In Italia, ormai troppe misure incostituzionali in nome della crisi economica e di valori, aggiungerei."
293727328142516224,Tue Jan 22 14:30:26 +0000 2013,"i privilegi ai parlamentari, risultano impopolari, illiberali ed anacronistici."
293727229966442496,Tue Jan 22 14:30:03 +0000 2013,"dovranno mantenere le promesse.Oggi, con la grave crisi economica in zona euro, ma aggiungerei, con la crisi di valori,"
293727057177894914,Tue Jan 22 14:29:22 +0000 2013,"Lo vorrebbe ogni italiano! Se fosse l'obiettivo di un determinato partito, quello di sicuro vincerebbe, ma poi, ovviamente,"
293726925325737984,Tue Jan 22 14:28:50 +0000 2013,Il mio sogno : sentir dire che verranno eliminati i privilegi ai parlamentari e ridimensionati i loro stipendi... e pensioni.
293700212239777792,Tue Jan 22 12:42:41 +0000 2013,"Villa via, Valenzano | &gt;5 locali | 220 m&amp;sup2; http://t.co/eM7b7uGi"
293683197651324928,Tue Jan 22 11:35:05 +0000 2013,"Ma Kaka' non e' quello che era andato al real madrid per maggiori guadagni?I Milanisti, ovviamente, lo stanno aspettando con affetto idiota"
293682220294619136,Tue Jan 22 11:31:12 +0000 2013,"ma per il suo peso; misuriamola dalle azioni, non dal tempo.""- Seneca"
293682152770531331,Tue Jan 22 11:30:56 +0000 2013,"""Facciamo in modo che la nostra vita, come tutte le cose preziose, non conti per la sua estensione,"
293677998811516929,Tue Jan 22 11:14:25 +0000 2013,"effetti collaterali.Il nostro sistema immunitario, quando ben ossigenato, risolve da solo, in autonomia."
293677935439785984,Tue Jan 22 11:14:10 +0000 2013,"Non credo alle teorie farmacologiche, neanche agli effetti benefici dell'aspirina.Le reazioni chimiche sull'organismo, producono"
293674784754135041,Tue Jan 22 11:01:39 +0000 2013,I privilegi della politica ricordano il gioco del monopoli ma anche dell'asso piglia tutto.Solidarieta' significa dare qualcosa
293671643610492928,Tue Jan 22 10:49:10 +0000 2013,"un adolescente.Infine, i nonni che abbiamo in parlamento, come considerarli?"
293671555198763008,Tue Jan 22 10:48:49 +0000 2013,"perche' non cambiano le regole e tale logica idiota?Se hanno allungato l'eta' pensionabile, di conseguenza, a cinquantanni saresti ancora"
293671423854133248,Tue Jan 22 10:48:18 +0000 2013,"Oggi un cinquantenne in forma e' considerato vecchio nel'ambito lavorativo.Una riflessione spontanea: i nostri dinosauri al parlamento,"
293468585240690688,Mon Jan 21 21:22:17 +0000 2013,@MassimoCassano Auguri per la campagna elettorale e per la corsa al Senato! Vincano i migliori!
293432042690080768,Mon Jan 21 18:57:05 +0000 2013,Molti omosessuali tra i vip. Una moda dello sclero.
293431462101934080,Mon Jan 21 18:54:46 +0000 2013,"La Regina Elisabetta e consorte, a breve visiteranno l'italia ricevuti da Napolitano.Un triste epilogo, anche nei meriti e decisioni."
293427876982824960,Mon Jan 21 18:40:32 +0000 2013,"Qualcuno sale in politica, e sui socialL'altro, scende..Se si incontrano quei due, si menano."
293427131759865857,Mon Jan 21 18:37:34 +0000 2013,"Ma Kaka' non e' quello che era andato al real madrid per maggiori guadagni?I Milanisti, ovviamente, lo stanno aspettando con affetto idiota"
293425689036718080,Mon Jan 21 18:31:50 +0000 2013,"Per risollevare l'economia dell'Italia,limiti di spesa e rendicontazioni alla Corte dei Conti on line 24/24"
293419882446475264,Mon Jan 21 18:08:46 +0000 2013,Gusttavo Lima- Balada (DVD Gusttavo Lima e Você - Ao Vivo): http://t.co/jx96N8J9 via @youtube
293418210294890497,Mon Jan 21 18:02:07 +0000 2013,"La politica per ritrovare dignita', rinunci ai privilegi e si allinei alla societa' civile."
293414386968715264,Mon Jan 21 17:46:55 +0000 2013,BlackBerry Z10 versus iPhone 5: http://t.co/qFHAipQK via @youtube
293357213534277632,Mon Jan 21 13:59:44 +0000 2013,"RT @Nico_Mottola: Non mi interessa che i media, discriminano la Destra. Io lavoro sul Territorio e sul WEB. Penso di raggiungere la gent ..."
293357061008412672,Mon Jan 21 13:59:08 +0000 2013,RT @news_va_it: Il card. Ravasi sugli esercizi spirituali: ho scelto i Salmi perché in essi Dio e l'uomo parlano insieme §RV http://t.co ...
293319764179308545,Mon Jan 21 11:30:56 +0000 2013,"Identikit dell'uomo occidentale, di potere:-Gay-di sinistra-ricco-ateo o agnostico."
293318998265847809,Mon Jan 21 11:27:53 +0000 2013,"oggi la sovranita', in europa, e' monetaria.Questo progetto e' folle."
293317593408876545,Mon Jan 21 11:22:18 +0000 2013,perche' possiede risorse umane.Naturalmente intendeva dire: schiavi.
293317513213792256,Mon Jan 21 11:21:59 +0000 2013,"Il ""Massimo"" esponente di sinistra, ha dichiarato giorni fa' in un'intervista TV:L'Italia ce la fara' ad uscire dalla crisi,"
293306415727124480,Mon Jan 21 10:37:53 +0000 2013,"Pensavo fosse solo per un tempo, la mia residenza in Brasile. Oggi, alla luce dei fatti Italiani, mi sono convinto che sara' per sempre."
292962357490106370,Sun Jan 20 11:50:43 +0000 2013,qualcosa non funziona?
292962251441332225,Sun Jan 20 11:50:18 +0000 2013,"il peso e l'onere del debito pubblico, dell'IMU e di una tassazione che lascia senza respiro.Viviamo in una societa' civile oppure"
292962140355194880,Sun Jan 20 11:49:51 +0000 2013,"e fondazioni, peraltro ricchi ed esonerati dall' IMU.Nessun redditometro per loro e per le economie sommerse;al contrario, ai cittadini"
292961980405391361,Sun Jan 20 11:49:13 +0000 2013,"Diventa sempre piu' evidente la strategia del potere in Italia.I poteri forti : politica, vaticano, banchieri, assicurazioni"
292956816546086912,Sun Jan 20 11:28:42 +0000 2013,essendo tali scritture aperte e poco definite.
292956749621784576,Sun Jan 20 11:28:26 +0000 2013,"su misura, a proprio uso e consumo.Il problema irrisolto della Bibbia e delle leggi consiste nelle interpretazioni,"
292956635628990464,Sun Jan 20 11:27:59 +0000 2013,"Il Gesu' di Nazareth e' diverso dal modello costruito dai cristiani e protestanti.Questi ultimi, lo hanno definito ed idealizzato"
292944947613667328,Sun Jan 20 10:41:32 +0000 2013,"I Cinesi, di fronte alla crisi economica, decidono di lasciare l'Italia. Emigrano nei Paesi motori dell'economia e fuori da euro-zona."
292939016779747328,Sun Jan 20 10:17:58 +0000 2013,"i suoi limiti e soprattutto evitare, in ogni caso, il delirio di onnipotenza dei governi, in nome delle odierne pseudo – democrazie."
292938875184246784,Sun Jan 20 10:17:25 +0000 2013,"piu’ garantire costi, sicurezza e protezione alla societa’. Si dovrebbero riscrivere le regole della democrazia, definire la sovranita’"
292938677598973952,Sun Jan 20 10:16:37 +0000 2013,"I sindacati fanno solo teatrino insieme alla politica. Lo Stato, di fronte alla crisi economica, cede le redini, non potendo"
292938464947748864,Sun Jan 20 10:15:47 +0000 2013,"crisi economica per demolire ogni sicurezza e garanzia civile. Ancor piu’ nel settore lavorativo, con perdita dei diritti acquisiti."
292938254435635202,Sun Jan 20 10:14:57 +0000 2013,"nella societa’ contemporanea, e' solo concetto, non essendo compiuta e garantita. E’ sufficiente l’annuncio della"
292938047635468288,Sun Jan 20 10:14:07 +0000 2013,"I concetti di liberta’ e democrazia sono oggi pesantemente compromessi. La liberta’, di fronte ad una criminalita’ crescente"
292739442907680768,Sat Jan 19 21:04:56 +0000 2013,La superbia va' a cavallo e ritorna a piedi.
292618304697298944,Sat Jan 19 13:03:35 +0000 2013,Basta politiche di lacrime e sangue!
292618229476634624,Sat Jan 19 13:03:17 +0000 2013,"che il governo tecnico, cinicamente, ha voluto.Il redditometro colpisca le economie sommerse, se ne ha coraggio e capacita'."
292618128347783169,Sat Jan 19 13:02:53 +0000 2013,L'IMU ha recuperato lo 0.4% della spesa pubblica.Bastava diminuire dello 0.4% le uscite e si evitava la macelleria sociale
292321171167399937,Fri Jan 18 17:22:52 +0000 2013,Buon week end a tutti!Anche per me e' stata una settimana pesante..a mare. Vi voglio bene..
292316422254776320,Fri Jan 18 17:04:00 +0000 2013,"mai andremo d'accordo..!!"".(Kahil Gibran)"
292316343531892736,Fri Jan 18 17:03:41 +0000 2013,"Ed essi parlano a lungo; e ogni volta Gesù di Nazareth si allontana dicendo a Gesù dei Cristiani: ""Amico mio, temo che mai,"
292316234467405824,Fri Jan 18 17:03:15 +0000 2013,"‎""Una volta ogni cento anni Gesù di Nazareth incontra Gesù dei Cristiani in un giardino in mezzo alle colline del Libano."
292255265796005888,Fri Jan 18 13:00:59 +0000 2013,le dichiarazioni dei redditi e dati Istat.
292255203598663680,Fri Jan 18 13:00:45 +0000 2013,"Il ministero dell'economia introduce la guardia carceraria denominata redditometro per fare i conti nelle tasche dei cittadini, incrociando"
292251436362891264,Fri Jan 18 12:45:46 +0000 2013,"piuttosto che cercare di cambiarlo."""
292251375818121216,Fri Jan 18 12:45:32 +0000 2013,"‎""Impossibile è solo una parola pronunciata da piccoli uomini che trovano piu' facile vivere nel mondo che gli e' stato dato"
292250425162354689,Fri Jan 18 12:41:45 +0000 2013,e senza rendicontazione.
292250362965024768,Fri Jan 18 12:41:30 +0000 2013,"Il problema e' che i governi, come la politica, amministrano i soldi di tutti : pubblici, come se fossero di nessuno"
292247193396592640,Fri Jan 18 12:28:55 +0000 2013,Amo la vita perchè credo che vada al di là della banalità del quotidiano. Proteso verso il futuro.
292245603231084544,Fri Jan 18 12:22:36 +0000 2013,"affittate, paga l'inquilino.Questo e' un valido programma."
292245538097733633,Fri Jan 18 12:22:20 +0000 2013,Patrimoniale per grandi patrimoni e no a spese militari.Alt ad asse Monti-Bersani-Vendola. L'IMU solo alle fondazioni e per case
292230493833949184,Fri Jan 18 11:22:33 +0000 2013,"per alcun paese, ma sono un patriota dell'umanità nel suo complesso. Io sono un cittadino del mondo.-- Charlie Chaplin"
292230433494667265,Fri Jan 18 11:22:19 +0000 2013,"Non sono cittadino di nessun posto, non ho bisogno di documenti e non ho mai provato un senso di patriottismo"
292229838088044545,Fri Jan 18 11:19:57 +0000 2013,"In politica non si sale e non si scende, si entra semplicemente.Ma, per ipocrisia e falsa modestia, qualcuno dice di voler salire."
292214138766229504,Fri Jan 18 10:17:34 +0000 2013,Ciascuno vede ciò che si porta nel cuore.-- Johann Wolfgang Goethe
292017648328380416,Thu Jan 17 21:16:47 +0000 2013,"Il superbo deve riscattarsi da uno status di inferiorita' a cui apparteneva.Il grande, al contrario, resta semplice poiche' appagato."
291970632810364928,Thu Jan 17 18:09:58 +0000 2013,"tuttavia impacciate nel commercio delle parole comuni, nella schiavitù delle esigenze sociali.- Luigi Pirandello"
291970560802582528,Thu Jan 17 18:09:40 +0000 2013,"Le anime hanno un loro particolar modo d'intendersi, d'entrare in intimità, fino a darsi del tu, mentre le nostre persone sono"
291968985442967552,Thu Jan 17 18:03:25 +0000 2013,Teniamoci in contatto permanente anche tramite Linked-in
291955480778121219,Thu Jan 17 17:09:45 +0000 2013,Pazzia è fare sempre la stessa cosa aspettandosi un risultato diverso.Ricorda la peggiore politica.
291953922753568768,Thu Jan 17 17:03:34 +0000 2013,"Tutte le passioni ci fanno commettere errori, ma l'amore ci induce a fare i più ridicoli. - Francois de La Rochefoucauld"
291953268031123456,Thu Jan 17 17:00:57 +0000 2013,"Il voto utile non è quello ai (soliti) grandi partiti: è quello dato con coscienza, a chi è pulito e merita, fosse anche all'1%"
291948930093174784,Thu Jan 17 16:43:43 +0000 2013,Pink Floyd - Pigs (Three Different Ones): http://t.co/Ivyi6Swk via @youtube
291892205537349632,Thu Jan 17 12:58:19 +0000 2013,"Il redditometro, questa moderna guardia carceraria, dovrebbe fare le sue misurazioni partendo dai parlamentari e banchieri, innanzitutto."
291889349623181313,Thu Jan 17 12:46:58 +0000 2013,Gusttavo Lima &amp; Neymar - BALADA (TCHÊ TCHERERE TCHÊ TCHÊ): http://t.co/hV4NewWm via @youtube
291888156981202944,Thu Jan 17 12:42:14 +0000 2013,e vessare i popoli.
291888072029782016,Thu Jan 17 12:41:54 +0000 2013,La crisi ha tre risposte:- malgestione- speculazione- complicita'.I poteri forti sanno ben orchestrare il teatrino politico
291887956736765952,Thu Jan 17 12:41:26 +0000 2013,"Qualcuno, per giustificare la politica scellerata Italiana, si difende dietro la crisi europea e mondiale."
291886650282364928,Thu Jan 17 12:36:15 +0000 2013,"capirete, mi trovo al 18° piano di un grattacielo."
291886566471774208,Thu Jan 17 12:35:55 +0000 2013,"Il mondo non mi era mai apparso così bello, come da quando lo posso ammirare dall'alto in basso :"
291873287192080384,Thu Jan 17 11:43:09 +0000 2013,Queen - These Are The Days Of Our Lives: http://t.co/MHpFaU0T via @youtube
291872163840028673,Thu Jan 17 11:38:41 +0000 2013,Facciano terapia almeno per se stessi.
291872109142106112,Thu Jan 17 11:38:28 +0000 2013,L'aria stanca e di sufficienza dei massimi esponenti di sinistra non aiuta il morale e l'economia del Paese.
291704979406876673,Thu Jan 17 00:34:21 +0000 2013,di banca e tutte quelle altre figure preposte da una certa politica affarista.
291704907059322880,Thu Jan 17 00:34:04 +0000 2013,"Esiste poi un capitolo clientelare costituito da servi di partito presi tra i giornalisti, i professori universitari, i direttori"
291702078651379712,Thu Jan 17 00:22:49 +0000 2013,"Sul debito pubblico, sono certo che sia molto amplificato da anatocismo e che sia studiato a tavolino dai poteri forti."
291701334955139072,Thu Jan 17 00:19:52 +0000 2013,"La casta, invece, vive in stanze dorate fuori dalla realta'."
291701272929792000,Thu Jan 17 00:19:37 +0000 2013,"Stanno facendo una selezione innaturale dei cittadini, per tenerli nel bisogno."
291698786655420416,Thu Jan 17 00:09:44 +0000 2013,"ma di una intera Nazione, oggi in agonia ed in recessione."
291698667600097281,Thu Jan 17 00:09:16 +0000 2013,"paradossalmente, sono oggi esonerate. Il prossimo governo, adotti tale misura nell’interesse, non solo della politica,"
291698514172465153,Thu Jan 17 00:08:39 +0000 2013,", ed in cifre ben piu’ alte, se solo si avesse il coraggio di far pagare tale imposta patrimoniale alle Fondazioni, le quali,"
291698341031579648,Thu Jan 17 00:07:58 +0000 2013,"I cinque miliardi di euro che produce di introiti, con criterio di lacrime e sangue, sarebbero invece facilmente recuperabili,"
291698195782852608,Thu Jan 17 00:07:24 +0000 2013,"L’IMU, questa infame imposta anticostituzionale , colpisce anche la casa principale, divenendo vessatoria."
291694294945898496,Wed Jan 16 23:51:53 +0000 2013,""" Se solo ogni Italiano pagasse una Lira di tasse, risolveremmo il bilancio di Stato.""- Quintino Sella (ministro delle finanze)"
291694118734811136,Wed Jan 16 23:51:11 +0000 2013,"macelleria sociale.Un popolo disinformato e nel bisogno, diventa facilmente sottomesso."
291694040594923520,Wed Jan 16 23:50:53 +0000 2013,"Il governo tecnico non ha toccato le Fondazioni e alcun privilegio dei parlamentari, dimostrando favoritismo e volonta' di fare"
291605942238326785,Wed Jan 16 18:00:49 +0000 2013,"In Brasile, per case affittate, l'inquilino paga l'imposta corrispondente all'IMU Italiana. Ma noi siamo diversi, anche nel pensare."
291600639983747073,Wed Jan 16 17:39:44 +0000 2013,Propongo la rottamazione con incentivi.
291600582295314433,Wed Jan 16 17:39:31 +0000 2013,"La vecchia politica che ha precipitato un intero Paese nella recessione, adesso si propone come paladina della Patria."
291597395920318466,Wed Jan 16 17:26:51 +0000 2013,@PrinceWilliamUK @presidentcartur Relax please! and educationin first time.
291591960773410816,Wed Jan 16 17:05:15 +0000 2013,"bambini, purtroppo soggetti entrambi ad interpretazioni aberranti e ad episodi di pedofilia."
291591858696630272,Wed Jan 16 17:04:51 +0000 2013,La chiesa cattolica dovrebbe fare chiarezza sui capitoli del vangelo che riguardano i comportamenti e le relazioni verso i
291587415297126400,Wed Jan 16 16:47:11 +0000 2013,Purtroppo gli interessi economici e la corruzione prevalgono su tutto in questo mondo mercenario.
291549200053850112,Wed Jan 16 14:15:20 +0000 2013,"Villa via, Valenzano | &gt;5 locali | 220 m&amp;sup2; http://t.co/eM7b7uGi"
291547907033796608,Wed Jan 16 14:10:12 +0000 2013,Ho visto questo #annuncio su #Immobiliare.it Villa in Vendita a Valenzano http://t.co/KsVbZvnG via @immobiliare_it
