tid,time,tweet
295810988530343936,Mon Jan 28 08:30:10 +0000 2013,Risveglio traumatico + colazione al bar + lunga passeggiata con stampelle = #buongiorno mondo
295527665794961410,Sun Jan 27 13:44:20 +0000 2013,#Giletti critichi la gente che va ad applaudire Corona e tu che gli dedichi un'intera puntata nel primo pomeriggio di Domenica? #l'arena
295506717716905984,Sun Jan 27 12:21:06 +0000 2013,"Ero troppo per lui. Troppo vera, troppo forte, troppo sensibile, troppo esuberante, troppo seria, troppo sognatrice, troppo. Lui troppo poco"
295486530837962753,Sun Jan 27 11:00:53 +0000 2013,GIORNATA DELLA MEMORIA. UN PENSIERO ALLE VITTIME DELL'OLOCAUSTO! #io #non #dimentico #impariamo #dal #passato #auschwiz #ebrei #sterminio
295430872319008768,Sun Jan 27 07:19:43 +0000 2013,"RT @ithinkthatway: The most beautiful line is ""But, I love you"". The most painfulline is ""I love you, but"""
295254173220478979,Sat Jan 26 19:37:35 +0000 2013,Sdraiarsi sul divano con copertina prima di uscire #pessime #decisioni
295135766965809152,Sat Jan 26 11:47:04 +0000 2013,Sfasi del sabato mattina. #storie #di #cuori #infranti #e #sbronze #mancate
294963240281190400,Sat Jan 26 00:21:31 +0000 2013,"RT @ReaIMeganFox: Every day, i think about texting you first. But then I think, “if you really wanted to talk to me, you’d text me first.”"
294832360153825281,Fri Jan 25 15:41:27 +0000 2013,"@stevass91 infatti, sono in pigiama e mi son lasciata questi episodi indietro per godermeli in santa pace ma NO! #sononera"
294829828996218881,Fri Jan 25 15:31:23 +0000 2013,Ma perche' la gente viene a rompere i coglioni a casa mia quando sto guardando la tv in santa pace (dei sensi)?? #lasciatemi #in #pace
294828595556274177,Fri Jan 25 15:26:29 +0000 2013,"Ieri il mio twitter ha compiuto 1 anno. Quindi oggi gli auguro un buon non compleanno, dato che ieri non mi sono accattata!"
294772108494508032,Fri Jan 25 11:42:01 +0000 2013,"Mi sveglio, mi guardo indietro e penso: 'wtf???'- come siamo arrivati a questo punto? Sono l'unica rivolere indietro tempo sprecato?"
294771636165570560,Fri Jan 25 11:40:09 +0000 2013,@LLaurets chiama ghostbusters topa!
294630229773783041,Fri Jan 25 02:18:15 +0000 2013,"RT @idillionaire: Life doesn't stop for anybody. People move on, they change and they let go, they grow and eventually they forget and p ..."
294409411764572160,Thu Jan 24 11:40:48 +0000 2013,"Quando ti guardi indietro e tutto ti sembra stupido, significa che sei diventato grande oppure e' solo il segno di un enorme rimpianto?"
294072895699824640,Wed Jan 23 13:23:36 +0000 2013,Passare da non stare più di 2h a casa a doverci passare giornate intere. #depression #post #hospital #i'm #still #at #home
293608698952163328,Tue Jan 22 06:39:03 +0000 2013,"RT @Disney: ""I'm so hungry, I could eat a whole elephant."" - Rolly #OneHundredandOneDalmatians"
293141695904772096,Sun Jan 20 23:43:21 +0000 2013,RT @GrumpyAssCat: Always be yourself! Unless you can be Batman. Then be Batman.
292899266165366785,Sun Jan 20 07:40:01 +0000 2013,Dormire 8h in 2 giorni non e' da me. #persone #che #entrano #nella #tua #vita #e #la #stravolgono
292737113487720448,Sat Jan 19 20:55:41 +0000 2013,"Quando ti dicono che sei 'diversa', cosa intendono? Diversa da chi? Da cosa? Diversa, perche'? #dubbiamleticipostdoccia"
292462557707522050,Sat Jan 19 02:44:42 +0000 2013,E al club house mi mandano Call Me di Blondie! TOP
292462188524875776,Sat Jan 19 02:43:14 +0000 2013,Amo #milano perche' puoi essere vestita come cazzo ti pare che nessuno ti caga il cazzo #ilovemilano
292038116016021504,Thu Jan 17 22:38:07 +0000 2013,"@Piffi_ quoto- troppo sicuro di se' dopo aver rischiato la pellaccia, la prossima e' Daiana, sure:)"
292036414898593792,Thu Jan 17 22:31:21 +0000 2013,"@Piffi_ anch'io eh, ma secondo me fan tutti i fighi e alla fine io quello che fa agnese neanche tra 10 anni sapro' farlo!"
292030052961509376,Thu Jan 17 22:06:04 +0000 2013,"Dai #Agnese che sei una grande, io ho 21 anni e non so ancora farmi un toast! Vinci tu, hai tutta la vita davanti! #MasterChefIt"
292027086363832322,Thu Jan 17 21:54:17 +0000 2013,"Adesso #Marika e #Michele limonano, me lo sento.. #MasterChefIt"
292022058118946818,Thu Jan 17 21:34:18 +0000 2013,Ringraziamo #Ivan per averci ricordato che la cavalleria e' morta #MasterChefIt
291929354164899841,Thu Jan 17 15:25:56 +0000 2013,Buon non-compleanno! @Cele_Bbe
291595439390724096,Wed Jan 16 17:19:04 +0000 2013,Fa talmente freddo che non ci sono ragazzi di colore al parcheggio #ecco #l'unico #lato #positivo #dell'inverno
291491142535626752,Wed Jan 16 10:24:38 +0000 2013,Mi son svegliata con nella testa: 'azzurro il pomeriggio e' troppo azzurro e' luuungo per mee'.. #buongiorno
291240024983363585,Tue Jan 15 17:46:47 +0000 2013,"@gtt_vtr come perdersi in un bicchier d'acqua, insomma.."
291239137934180352,Tue Jan 15 17:43:16 +0000 2013,"@gtt_vtr azz, le sfighe di non avee un iphone! Ahah"
291238390672805888,Tue Jan 15 17:40:17 +0000 2013,@gtt_vtr cioe'?
291132627539349504,Tue Jan 15 10:40:02 +0000 2013,@jadorelemakeup io trovo sempre molto interessanti i video su prodotti low cost! :) un bacio!
290834533950050304,Mon Jan 14 14:55:30 +0000 2013,"Uno dei posti più belli dove riflettere e' appoggiata alla doccia, per terra, con la stufetta davanti, in accappatoio e.. IN RITARDO!"
290834158996049920,Mon Jan 14 14:54:01 +0000 2013,"RT @Astri_NonnaLea: #Gemelli   Continua il periodo ammmore, pane e fantasia: ma attenzione che i dolci fanno cariare i denti!"
290554087324405760,Sun Jan 13 20:21:07 +0000 2013,"A cena,  il tipo davanti a me mi guarda male #minchiaguadddi?"
290445270355959808,Sun Jan 13 13:08:43 +0000 2013,A volte penso che online vendano collari virtuali che le tipe allacciano al collo del fidanzato #non #te #lo #ruba #nessuno #vai #tra #zia
290380640640192512,Sun Jan 13 08:51:54 +0000 2013,L'ultima volta che di Domenica mi son svegliata prima delle 10 in cielo volavano gli pterodattili #sapevatelo #buongiorno #sunday
290096226865672193,Sat Jan 12 14:01:44 +0000 2013,Quando il tuo umore dipende da Qualcuno e' l'inizio della fine. #lascia #aperta #la #porta #del #cuore
289931978751500288,Sat Jan 12 03:09:05 +0000 2013,"RT @SoDamnTrue: Don't promise when you're happy, don't reply when you're angry, and don't decide when you're sad."
289808263048990721,Fri Jan 11 18:57:28 +0000 2013,"@Maticchia nono, sono andata a MI e dovevo prendere gilet e camicia. Ho preso gilet, camicia e 2 canottiere-.-"
289758144895270914,Fri Jan 11 15:38:19 +0000 2013,"@Maticchia mati, i capi da 2 sono diventati 4:( vabe' Gesu' multiplicava pani e pesci, io moltiplico canottiere!"
289752485118214144,Fri Jan 11 15:15:50 +0000 2013,"RT @Astri_NonnaLea: #Gemelli   Sorrisi che #uao, fascino che #miao, finalmente è giunto il weekend per sfoderare le vostre abilità da ie ..."
289709178648416256,Fri Jan 11 12:23:45 +0000 2013,#vodafone datte na ripijata che oggi non ci siamo e a me serve wp!
289544266198429696,Fri Jan 11 01:28:27 +0000 2013,"Non guardare ne' #serviziopubblico ne' #MasterChefIt ti estranea da twitter, ma ti ricorda che hai una vita sociale."
289434591478030338,Thu Jan 10 18:12:38 +0000 2013,"RT @Disney: “I’m late, I’m late, for a very important date. No time to say hello, goodbye. I’m late, I’m late, I’m late.” - White Rabbit"
289418274343628800,Thu Jan 10 17:07:48 +0000 2013,@Maticchia non mi tentare che gia' domani devo venire a MI a prendere 2 cose (solo due pero' eh) :)))
289417196143267840,Thu Jan 10 17:03:31 +0000 2013,@Maticchia a 'camicia con borchie' la bava dalla mia bocca ha raggiunto terra. Io portaorecchini a forma di cuore 8 euro al posto che 20!
289415761217323008,Thu Jan 10 16:57:49 +0000 2013,"@Maticchia profonda stima, perche' pagarli a prezzo pieno tra qualche mese! Mati the best (io ti seguo appena ricarico la postpay)"
289412792073723904,Thu Jan 10 16:46:01 +0000 2013,"@Maticchia ahah io solo da 50, ma con roba tipo portaorecchini e gioielli! Oggi mi e' arrivato un pacco da zara e son felicee"
289367430717919232,Thu Jan 10 13:45:46 +0000 2013,"Ecco il classico periodo della vita in cui tutto va bene, la vita ti sorride e ti aspetti una batosta della madonna."
289278410251976704,Thu Jan 10 07:52:02 +0000 2013,Questa #mattina sono talmente #rincoglionita che il telefono mi sembra leggerissimo e stavo uscendo di casa con il mollettone leopardato-.-
289278048551968768,Thu Jan 10 07:50:35 +0000 2013,@Cele_Bbe daje tutta! (Sonosvegliancheioetipenso) #love
289144894939860992,Wed Jan 09 23:01:29 +0000 2013,"@OlioDiScemiVari sinceramente? Non penso che Mcqueen e Versace abbiano bisogno della pubblicita' di realtime, con tutti il rispetto eh"
289144404411813889,Wed Jan 09 22:59:32 +0000 2013,"@S_Pinz beh dai, tra tutte, sei alla RINASCENTE e una si veste da insulsa, una da battona e l'altra mette cose a caso. Bah"
289144106335219712,Wed Jan 09 22:58:21 +0000 2013,Andiamo tutti a concerti rock con pelliccia e treccia romantica laterale. #shoppingnight #delusion #noncicredo
289143559234408449,Wed Jan 09 22:56:11 +0000 2013,"@OlioDiScemiVari vero, ma le marche le vedi scritte ovunque, inquadrano 'mcqueen', 'versace' etc :)))"
289142534964404224,Wed Jan 09 22:52:07 +0000 2013,Io se si potesse a sto giro non farei vincere nessuna. #shoppingnight
289139750525366272,Wed Jan 09 22:41:03 +0000 2013,Quella 'con le catene' e' una Stella Mccartney #ignorante #shoppingnight
289138422579351553,Wed Jan 09 22:35:46 +0000 2013,"'Arriva prima la rossa ha le gambe lunghe, le altre sono un po' nane' @Enzo_Miccio TI ADORIAMO!"
289135655961899009,Wed Jan 09 22:24:46 +0000 2013,"Tutti tornano, ma solo i più intelligenti dicono 'no' al passato. #sapevatelo"
289008312677175297,Wed Jan 09 13:58:45 +0000 2013,Per la prima volta in tutto l'inverno indosso qualcosa di colorato: maglietta con teschio con bandiera americana ahah
288776840200454144,Tue Jan 08 22:38:58 +0000 2013,'Certe notti ti senti padrone di un posto che tanto di giorno non c'e'' #ligabue #mi #capisce
288771176136835072,Tue Jan 08 22:16:28 +0000 2013,Vanilla candle + ipod (coldplay) + hot bed = happyness
288719747179233280,Tue Jan 08 18:52:06 +0000 2013,A xf usa Britney a xf italia Arisa WTF! #ingiustizie #boiamondo #doh #ncs #ilovebritneyspears
288719377942056960,Tue Jan 08 18:50:38 +0000 2013,@TheMissRettore secondo me ad ogni video dovresti urlare con tanto di freccia rossa: GUARDATE L'INFO BOX:)
288610006717317120,Tue Jan 08 11:36:02 +0000 2013,Raffreddore esci da questo corpo!!! #nonrespiro
288594467420782592,Tue Jan 08 10:34:17 +0000 2013,"RT @ReaIMeganFox: Once i catch you in one lie, it makes me question everything you've ever said."
288585633067307008,Tue Jan 08 09:59:11 +0000 2013,RT @Astri_NonnaLea: #Gemelli   Inizio d’anno che non se ne sa: in forma che #uao non vi resta altro che sfoderare il vostro fascino per  ...
288556086229864448,Tue Jan 08 08:01:46 +0000 2013,Qualcuno mi spiega cosa mi rappresenta Yoko Hono nel video di Let it be?
288540116031504384,Tue Jan 08 06:58:19 +0000 2013,Alzarsi alle 7e30 per andare con mia mamma dal parrucchiere. #thisislove #thisislove #thisisloooove
288428741162573825,Mon Jan 07 23:35:45 +0000 2013,"E anche per oggi il mondo e' stato salvato,posso andarmene a letto tranquilla. #buonanotte #solobattisti #iovorreinonvorreimasevuoi #felice"
288426383942762496,Mon Jan 07 23:26:23 +0000 2013,"Sottile differenza tra amore e amicizia: il primo a volte (spesso) finisce, la seconda tende a durare per la vita. #priorita' #puntidivista"
288425666007924736,Mon Jan 07 23:23:32 +0000 2013,'Sono circondato da un branco di idioti' (cit Scar)
288206926267961344,Mon Jan 07 08:54:20 +0000 2013,"Leggins senza maglietta lunga + perizoma + culone = pugno in un occhio. Abbella, c'hai 40 anni, svejate!"
288196810483310593,Mon Jan 07 08:14:08 +0000 2013,@Maticchia dovrebbe essere una legge universale. E più son bionde più son racchie. (E di che colore sono i miei capelli? Ahah)buona giornata
288192845075083264,Mon Jan 07 07:58:23 +0000 2013,@Maticchia io sono convinta che le controllore dei diretti non vedano un cazzo dallo sbarco in Normandia!
288183136553168896,Mon Jan 07 07:19:48 +0000 2013,Svegliarsi irrequieta e cercare (invano) di trovare un senso di pace #can'tsleep #trapocomialzo #malditestainarrivo #pensierimattutini
288169447032774656,Mon Jan 07 06:25:24 +0000 2013,"Se prima di andare a letto mangi schifezze,farai sogni tremendi #sapevatelo.  #mangiare #come #se #non #ci #fosse #un #domani"
288072302451650560,Sun Jan 06 23:59:23 +0000 2013,"RT @Disney: “Well, there’s one thing: they can’t order me to stop dreaming.” #Cinderella"
288068231959281665,Sun Jan 06 23:43:13 +0000 2013,2013 ti amo ogni giorno di più. #la #ruota #gira #karma #positivo #dajetutta #a #letto #felice #anche #questa #notte
287909923361284096,Sun Jan 06 13:14:09 +0000 2013,Penso che l'unico buon motivo per il quale mi sposerei e' averei @Enzo_Miccio come wedding planner
287908829000241152,Sun Jan 06 13:09:48 +0000 2013,Il buon umore sa di musica #nonvivopiu'senzate #nosssignorano #cantare #e #ballare #senza #alcun#ritegno
287904613930242051,Sun Jan 06 12:53:03 +0000 2013,Ma perche' agli uomini e' tutto dovuto? #thks #god #i'm #a #woman #ma #voi #ripigliatevi
287874398516551680,Sun Jan 06 10:52:59 +0000 2013,"Grazie per gli auguri, ma se fossi veramente la befana credete che REGALEREI i dolci? Ma anche no, mangerei tutto io. Quindi, piantatela."
287697062441668608,Sat Jan 05 23:08:19 +0000 2013,"In un letto caldo, con l'ipod a tutto volume mi ritrovo a sorridere della mia vita #it's #a #wonderful #wonderful #life"
287598212074852352,Sat Jan 05 16:35:31 +0000 2013,Sono le 17e33 e da quando mi sono svegliata ho bevuto e mangiato solo cioccolata #wladieta #sonounmaiale
287552756271693825,Sat Jan 05 13:34:54 +0000 2013,Risveglio post moda' come sempre traumatico #sofa #lattecioccolato #ileleone2 #love #tv #relax #copertina #sun #pigiama
287535187754119169,Sat Jan 05 12:25:05 +0000 2013,RT @OliviaPicchi: Non ci si libera di una cosa evitandola ma solo attraversandola. Cesare Pavese
287416883047723009,Sat Jan 05 04:34:59 +0000 2013,E come un'adolescente non riuscire a dare la buonanotte. #hosonno #e'tardi #sonquasile6 #famme'dormi'
287404394268463106,Sat Jan 05 03:45:21 +0000 2013,"Amo il venerdì, amo gli incontri del venerdì, amo uscire il venerdì. #amo"
287237519731482624,Fri Jan 04 16:42:15 +0000 2013,I libri migliori che ho letto sono quelli che mi hanno fatto piangere #sapevatelo
287192596558786560,Fri Jan 04 13:43:45 +0000 2013,"Satura di sentimenti (in senso negativo). E' solo il 4 gennaio, the best is yet to come!"
287160123749707777,Fri Jan 04 11:34:43 +0000 2013,@Cele_Bbe ma riccio bello o riccio cacca?
287159307424907265,Fri Jan 04 11:31:28 +0000 2013,"A volte idealizziamo le persone, le facciamo diventare quelle che non sono e cosi' ci illudiamo che siano migliori. #tristeverita'"
287159070094401536,Fri Jan 04 11:30:32 +0000 2013,RT @LucaBizzarri: Ipocriti fino in fondo. Un'amichevole contro la Propatria. Fosse stata la serie A per interrompere la partita dovevano ...
287140602863296512,Fri Jan 04 10:17:09 +0000 2013,@Piffi_ e di Tiziana?
286944138539192320,Thu Jan 03 21:16:28 +0000 2013,@Cele_Bbe attendiamo con ansia! Mi raccomando voglio una recensione accurata e completa.. Come i riassunti di Sofia! #imissyou
286943419702591489,Thu Jan 03 21:13:37 +0000 2013,"Certo che doveva uscire Letizia, e' presuntuosa e pensa di essere gia' una grande chef! Baby fly down! #MasterChefIt"
286942283494985729,Thu Jan 03 21:09:06 +0000 2013,"A volte la radio parla di te, nel mio caso (troppo) spesso."
286942054024630273,Thu Jan 03 21:08:11 +0000 2013,"@Cele_Bbe se ti viene mi insegni, per me e' una cacata per noi che abbiamo i capelli tanto lunghi, pero' #maidiremai"
286901006195908609,Thu Jan 03 18:25:04 +0000 2013,@ShivaQueen &lt;3
286630562649735169,Thu Jan 03 00:30:26 +0000 2013,"Sembra stupido, ma quando ho il cuore e l'anima in pace divoro libri. #i #love #reading #romance"
286630080086691840,Thu Jan 03 00:28:31 +0000 2013,"RT @VirgiRaffaele: E da 9 minuti, per Veronica, sono altri 100.000 ... Bella per te, Veró!"
286576999634464769,Wed Jan 02 20:57:35 +0000 2013,"A pensarci bene, del mio passato non cambierei niente di niente. Se mi ha resa cio' che sono ora, mi va bene anche cosi'. #noregrets"
286510231335337984,Wed Jan 02 16:32:16 +0000 2013,"'Più tequila, più amore, più di tutto. Di più e' meglio'."
286242415600340993,Tue Jan 01 22:48:04 +0000 2013,Primo giorno dell'anno all'insegna della pigrizia. #cista #namobene #iniziostancante #domanie'unaltrogiorno #ibelievein2013
286218825760911360,Tue Jan 01 21:14:20 +0000 2013,Voglio cavalcare anch'io un orso bianco #labussolad'oro #tv #love #my #sofa #copertina #rai3 #film #lattecaldo #firstdayoftheyear
286084406869901312,Tue Jan 01 12:20:12 +0000 2013,Non riesco ad alzarmi dal letto.. Eppure son sveglia (ma assonnata) #gravemanongravissimo #iniziamobene #dajetutta #love 2013
285959520356810752,Tue Jan 01 04:03:57 +0000 2013,"Ed eccomi di nuovo qua, di fronte a 365 giorni da riempire di vita, avventure, amicizia e chissa'.. Amore. #indimenticabile #2013 #a #voi"
285728377535614976,Mon Dec 31 12:45:28 +0000 2012,"Il mio ultimo giorno del 2012 inizia alle 13.30, ancora assonnata e con una faccia che grida pieta'. #icandoit #wildworld #fuck2012"
285489307337228288,Sun Dec 30 20:55:29 +0000 2012,Quel fottutissimo istante nel quale la radio manda la fottuta canzone giusta. #sonosoloparole #rotolandoversosud #vachecaso
285378069043245056,Sun Dec 30 13:33:28 +0000 2012,"Sono le 14e30, sono sveglia da un'ora, tra 15 minuti devo uscire e non ho la più pallida idea di cosa mettermi. #dajetutta #odioladomenica"
285359420022587392,Sun Dec 30 12:19:22 +0000 2012,RT @paulocoelho: Never regret anything that made you smile in 2012
285169441954729984,Sat Dec 29 23:44:27 +0000 2012,"Domani scrivero' i miei buoni propositi. Sembra una stronzata, ma per me significa #impegno"
285154798767058944,Sat Dec 29 22:46:16 +0000 2012,@MasterChef_it ma alla fine di masterchef i giudici si mettono a dieta ferrea?
285144430300778497,Sat Dec 29 22:05:04 +0000 2012,Guardare #masterchef mi fa sentire incapace di cucinare. Comunque i miei toast sono i migliori eh!
285116584555589632,Sat Dec 29 20:14:25 +0000 2012,Non e' che voglio andare al concerto di Jovanotti.. DEVO proprio!
285065820483227648,Sat Dec 29 16:52:42 +0000 2012,"RT @ReaIMeganFox: Dear ex, I won't block you, or delete you. I'm keeping you there, so you're able to see how happy I am without you"
285039339845599232,Sat Dec 29 15:07:29 +0000 2012,Non sei un gatto attaccato ai coglioni.. DE PIÙ. #lasciamivivere #schiatta
285039127878057984,Sat Dec 29 15:06:38 +0000 2012,@Maticchia anche 'in lago'! :( io ho bevuto il latte alle 12 e non ho ancora fame:(
285001005656059904,Sat Dec 29 12:35:09 +0000 2012,"@Prof2punto0 entrambi bellissimi, io ho 21 anni e sto ancora cercando un professore del genere:)"
284975403448295424,Sat Dec 29 10:53:25 +0000 2012,@stevass91 c'eri anche tuu?
284964255005028352,Sat Dec 29 10:09:07 +0000 2012,"@Prof2punto0 in 'Cose che nessuno sa' ci sono troppe metafore e a volte la narrazione e' lenta, ma la trama coinvolge ed e' stimolante"
284840710950240256,Sat Dec 29 01:58:12 +0000 2012,"Capisco il tatuaggio sul pancino (one) da mostrare, ma ANNODARSI la maglietta in discoteca e' osceno (nemmenoall'oratoriointerzamedia)"
284840467185672192,Sat Dec 29 01:57:14 +0000 2012,"Pr che si sentono onnipotenti. Ei bello, il figlio di Dio e' morto in croce 2012 anni fa e non sei TU!"
284639661064855553,Fri Dec 28 12:39:18 +0000 2012,RT @ShivaQueen: Non vedo l'ora che questo 2012 di MERDA MUOIA!
284573222115106817,Fri Dec 28 08:15:17 +0000 2012,"Non ho dormito abbastanza, ma piuttosto che sentire un'altra volta la sveglia del bb mi alzo. #buongiornouncazzo #sonno. #letmesleep"
284444008791560192,Thu Dec 27 23:41:51 +0000 2012,"Se mi vuoi insultare piccola, fallo, ma trova delle giuste motivizioni, se non c'e' gusto a distruggerti."
284443241884053504,Thu Dec 27 23:38:48 +0000 2012,@LLaurets questo si che e' lo spirito giusto! #dajetutta
284404073002844160,Thu Dec 27 21:03:09 +0000 2012,Mi hanno appena regalato un colletto con le borchie per Natale.  #chiedimisesonofeliceperche'losono
284328053788798977,Thu Dec 27 16:01:05 +0000 2012,"Bene, a pochi giorni dalla fine dell'anno, come sempre scriviamo i buoni propositi: mai più di 3, per essere credibili.."
284273538842628096,Thu Dec 27 12:24:27 +0000 2012,@PuntoWuPunto 2 storie finite maluccio e una gran voglia di starmene da sola:)
284264371520151552,Thu Dec 27 11:48:02 +0000 2012,#nonhounragazzoperche' dopo la recente esperienza ho bisogno di minimo 2 anni di troiaggine per riprendermi e rimettermi in carreggiata.
284246140138975232,Thu Dec 27 10:35:35 +0000 2012,Stanotte ho sognato che mi facevo uno degli chef di masterchef. #la #tv #prima #di #dormire #fa #male #ai #sogni
284059297502085121,Wed Dec 26 22:13:08 +0000 2012,'No boys no party'. Enzo ti ADORO #shoppingnight
284050056540196864,Wed Dec 26 21:36:25 +0000 2012,"Vogliamo tutte il pirata, ma alla fine ci manca il principe #pensieri #pre #nanna #malinconia #badfeelings #annonuovovitanuova"
284034927866032130,Wed Dec 26 20:36:18 +0000 2012,RT @ReaIMeganFox: I want to love someone whose heart has been broken so that they know exactly how it feels and won't break mine.
283887424206155776,Wed Dec 26 10:50:10 +0000 2012,Alla fine dell'anno mancano SOLO 5 giorni. Obiettivo di vita: viverli serenamente e pensando positivo. #icandoit #life
283565752970272768,Tue Dec 25 13:31:58 +0000 2012,Ma sono l'unica stronza che dopo l'antipasto e' gia' piena? #pranzodiNatale #ciboavolonta' #panciapiena
283362298226147330,Tue Dec 25 00:03:31 +0000 2012,Cuscino per ascoltare l'ipod #lovechristmas #presents #lovemusic
283362062078451712,Tue Dec 25 00:02:34 +0000 2012,"Che sia un giorno di sorrisi, affetto, gioia e amore. Che siate felici, spensierati e pieni di vita. #auguri #buonNatale #love #gio"
283252593453588482,Mon Dec 24 16:47:35 +0000 2012,Passare da 'faccio i biscotti' a 'fare il pisolino' significa che purtroppo lo spirito del natale non fa miracoli..
283142812353036288,Mon Dec 24 09:31:21 +0000 2012,"Non ho avuto brufoli fino ai 21 anni, quando per farne andar via uno ci sto impiegando una settimana. #risvegli #buongiorno"
282994235064586241,Sun Dec 23 23:40:58 +0000 2012,"Inevitabili pensieri malinconici prima di dormire, scacciati da inevitabili buoni propositi inevitabilmente scacciati dal sonno domani."
282993911574704128,Sun Dec 23 23:39:40 +0000 2012,Tornare alla mia vita dopo una parentesi inaspettata. #sempreio #diventaregrandi #esperienze #vita #crescitapersonale #carattere #bestrong
282892063832432640,Sun Dec 23 16:54:58 +0000 2012,"Non mi spaventa il freddo la' fuori, mi spaventa il freddo che le persone hanno dentro. #cit #perle #saggezza #people"
282891189865308161,Sun Dec 23 16:51:30 +0000 2012,@Maticchia eh mati purtroppo son sempre 10cm più alte di me e l'ultimo vestito che ho preso e' da tagliare:(((
282839884538990593,Sun Dec 23 13:27:38 +0000 2012,"Caro controllore, ormai sono 7 anni che prendo il treno, non fessa-.-"
282785711210512384,Sun Dec 23 09:52:22 +0000 2012,Ho lavato faccia e denti dovrei essere sveglia. E invece no. #let'sgo #goodmorning #sunday #love
282615275755540480,Sat Dec 22 22:35:07 +0000 2012,"Mia, perdona la Tatangelo che canta 'Piccolo uomo', non sa quello che fa."
282588496101777410,Sat Dec 22 20:48:42 +0000 2012,Predicare bene e razzolare male - son l'esperta.
282577579402199040,Sat Dec 22 20:05:19 +0000 2012,Scopano di più quelle fottute 40enni di sex&amp;thecity di me e le mie amiche 20enni messe insieme. #sonovolgare #ingiustizie #sapevatelo
282478810237124609,Sat Dec 22 13:32:51 +0000 2012,"Non e' vero che gli uomini vengono da marte e le donne da venere, gli uomini son dei coglioni, le donne esseri perfetti #sapevatelo"
282400056232013824,Sat Dec 22 08:19:54 +0000 2012,Ma e' legale usare il trapano alle 8 di sabato mattina? #fuck
282398363658354688,Sat Dec 22 08:13:11 +0000 2012,"RT @ReaIMeganFox: Love doesn't break your heart, people do."
282254781140062209,Fri Dec 21 22:42:38 +0000 2012,Asos e' una fottuta droga. Le modelle fanno sembrare gli abiti bellissimi e la mia postepay piange. #shopping #dipendenze #dresses #love
282254167911829504,Fri Dec 21 22:40:12 +0000 2012,"RT @ReaIMeganFox: You don't miss me, you're just bored."
282092822105038848,Fri Dec 21 11:59:04 +0000 2012,Io non ci sarei rimasta male se qualche lampo/fulmine/uragano avesse messo KO qualcuno eh #acidita' #i'mstillalive #feelin'good #dajetutta
282062428706054145,Fri Dec 21 09:58:18 +0000 2012,"RT @ReaIMeganFox: I dont trust words, I trust actions."
281898108508585986,Thu Dec 20 23:05:21 +0000 2012,"Se non c'e' fiducia non c'e' NIENTE DI NIENTE. La fiducia e' tutto, cazzo. #amaraverita' #real #life #relation #feelings #emotions"
281870483404754944,Thu Dec 20 21:15:34 +0000 2012,'Cause i'm a believer. Nananananannanana
281830913489399808,Thu Dec 20 18:38:20 +0000 2012,Sento veramente l'atmosfera natalizia quando devo impacchettare i regali:) #love #christmastime #presents
281759215507357696,Thu Dec 20 13:53:26 +0000 2012,"@Maticchia @Cele_Bbe mangiate come se non ci fosse un domani anche per me, anche perche' a detta dei maya non ci sara' veramente ahah"
281757262110920705,Thu Dec 20 13:45:40 +0000 2012,@Cele_Bbe @Maticchia vi odio stronze! Sogno un hamburger da 2 giorni e sono costretta a pastine e minestrine!
281550142946017280,Thu Dec 20 00:02:39 +0000 2012,"Dopo aver assaggiato il caviale, mi stupisce come ad un uomo possa piacere il pesce gatto (BW). #gossipgirlmemories"
