tid,time,tweet
291124075835826176,Tue Jan 15 10:06:03 +0000 2013,"RT @ARTEM_KLYUSHIN: - Я тут в Берлин ездил, красота! Очень понравилось! А ты в Берлине был?- Не, я не был. Дедушка мой был. По работе.  ..."
283273198676627457,Mon Dec 24 18:09:28 +0000 2012,"никогда не пойму родители шестиклассников,которые покупают им айфон 5 #дешевоайфон5"
283268984973971456,Mon Dec 24 17:52:43 +0000 2012,ОТМЕРЗЛА РУКА ЕБНУЛСЯ АЙФОН НА АСФАЛЬТ Я ОБОСРАЛАСЬ #дешевоайфон5
283267354459258880,Mon Dec 24 17:46:14 +0000 2012,камера на 9900 без автофокуса. 10 полностью сенсор. Тот же айфон ) физическая клава все же самая фишка ББ. #дешевоайфон5
283262151349645314,Mon Dec 24 17:25:34 +0000 2012,кто-то наспор айфон кинул что ли? #дешевоайфон5
283256793013039104,Mon Dec 24 17:04:16 +0000 2012,"Пощупала 5 айфон,на стороне зла точно есть печеньки:)) #дешевоайфон5"
283251512182968320,Mon Dec 24 16:43:17 +0000 2012,"ну уж извините, у меня не айфон #дешевоайфон5"
283245912103456768,Mon Dec 24 16:21:02 +0000 2012,"Хорошее настроение с утра так же подозрительно, как айфон за две штуки рублей. #дешевоайфон5"
283242671777120256,Mon Dec 24 16:08:10 +0000 2012,родители сказали: Если ты нас знакомишь со всеми своими друзьями то мы подарим айфон:D Чтоооо?????? #дешевоайфон5
283240496699166721,Mon Dec 24 15:59:31 +0000 2012,айфон у тебя хреновый ;) он должен показывать минимум -35 :) #дешевоайфон5
283234708073103360,Mon Dec 24 15:36:31 +0000 2012,"Ларик сказал, что айфон 5 -говно. как я рада, что взяла 4S #дешевоайфон5"
283219037855555584,Mon Dec 24 14:34:15 +0000 2012,Это была перемена перед геометрией.Мы фоткались на айфон с тупой рожей как могли. #дешевоайфон5
283218237607526400,Mon Dec 24 14:31:04 +0000 2012,все проекты очень похожи. Сенсор - айфон - облако. Сложно будет выбрать победителя на мой взгляд. #дешевоайфон5
283217965766283265,Mon Dec 24 14:29:59 +0000 2012,"сегодня с утра 2 часа искал свой айфон...потом вспомнил,что у меня его нету #дешевоайфон5"
283217680482312193,Mon Dec 24 14:28:51 +0000 2012,"Уронила айфон в снег. Он дает мне понять, что ему не очень(((( #дешевоайфон5"
283217373169852417,Mon Dec 24 14:27:38 +0000 2012,"хочу айфон только потому, что там дохуя приложений и всяких штук #дешевоайфон5"
283217082190024705,Mon Dec 24 14:26:28 +0000 2012,переезжаешь не первый раз. Ну по плавности айфон порвет всех. Поздравляю еще раз! #дешевоайфон5
283216622855020544,Mon Dec 24 14:24:39 +0000 2012,куплю айфон для библии #дешевоайфон5
283216304842891264,Mon Dec 24 14:23:23 +0000 2012,бери айфон 5 белый! #дешевоайфон5
283215988550418432,Mon Dec 24 14:22:08 +0000 2012,стоит ли покупать айфон? — хороший смартфон #дешевоайфон5
283215645687042048,Mon Dec 24 14:20:46 +0000 2012,"Мьюзер знает, что такое “айфон”)))) #дешевоайфон5"
283215295710130177,Mon Dec 24 14:19:23 +0000 2012,оставь никитен айфон в покое #дешевоайфон5
283214977077227520,Mon Dec 24 14:18:07 +0000 2012,"Заценила новые наушники от Apple, хороши, господи, как хороши! Хоть пятый айфон себе на нг дари.. #дешевоайфон5"
283214628476039169,Mon Dec 24 14:16:43 +0000 2012,"ну мне мой первый айфон кирилл подарил тоже из магазина, но это было давно, поэтому простительно))) #дешевоайфон5"
283214327408914433,Mon Dec 24 14:15:32 +0000 2012,"все видели, что теперь вконтике вместо ""добавлено через айфон"" показывает яблочко? #дешевоайфон5"
283214028539580417,Mon Dec 24 14:14:20 +0000 2012,"Оьновил андроид... ну нахуя? Теперь постоянно запрашивает обновление. Дед мороз,подари мне айфон. #дешевоайфон5"
283213739233263617,Mon Dec 24 14:13:11 +0000 2012,"- У Сашки день рождения. Что будем дарить? - А может, айпад? А может, айфон? - Саш, может, ты уйдёшь? Мы без тебя подумаем. #дешевоайфон5"
283213396088872960,Mon Dec 24 14:11:50 +0000 2012,"Некоторые девушки как китайский айфон ,выглядит хорошо ,а содержимое плоховато! #дешевоайфон5"
283210381919391744,Mon Dec 24 13:59:51 +0000 2012,"папа сказал, что на НГ купит себе 5 айфон а 4s мне отдаст, я ему сказал что мне такое говно нен нужно:D #дешевоайфон5"
283203410315067392,Mon Dec 24 13:32:09 +0000 2012,"Айфон,вернись,я прощу,что ты зависал,разряжался когда не надо,что не давал мне спать,все прощу.кам бэк,плиз. #дешевоайфон5"
283203210158673920,Mon Dec 24 13:31:21 +0000 2012,Не понимаю зачем таскать айфон без чехла или бампера. Чтобы все увидели яблоко? Он ведь царапается! Ему ведь больно!)))) #дешевоайфон5
283186558687924224,Mon Dec 24 12:25:11 +0000 2012,"Вчера два часа искал свой айфон, потом вспомнил что у меня его нету. #дешевоайфон5"
283186035616280576,Mon Dec 24 12:23:06 +0000 2012,"ЖИД НЕ ПИАРЬ КАРЛИКА - ""АЙФОН"" СЛУЧАЙНЫЙ ЧЕЛОВЕК В ПОЛИТИКЕ,ЕСЛИ У НЕГО ЕСТЬ СОВЕСТЬ,ОН ДОЛЖЕН УЙТИ… #дешевоайфон5"
283185768959197186,Mon Dec 24 12:22:03 +0000 2012,"Ясно,я думал я один такой кто СЛУЧАЙНО Айфон разбил)) #дешевоайфон5"
283185506970390528,Mon Dec 24 12:21:00 +0000 2012,Кто знает где можно айфон за минимальную цену купить #дешевоайфон5
283184410227003392,Mon Dec 24 12:16:39 +0000 2012,"У меня даже тапочки сиреневые. Чему вы удивились, когда я сказала, что тату будет фиолетовым и стекло на айфон тоже? #дешевоайфон5"
283183670167236610,Mon Dec 24 12:13:42 +0000 2012,расизм это когда белый айфон дороже черного! #дешевоайфон5
283183393909391360,Mon Dec 24 12:12:37 +0000 2012,"Айфон кстате весельчак — заменяет ""пеленках"" на ""пеленгах"" ) #дешевоайфон5"
283183120918917120,Mon Dec 24 12:11:31 +0000 2012,"ну у тебяже айфон,я же не знаю нашел ты решение с их комнокартами))) #дешевоайфон5"
283182499453091841,Mon Dec 24 12:09:04 +0000 2012,Тот же айфон но длиннееее ) #дешевоайфон5
283181920181948418,Mon Dec 24 12:06:45 +0000 2012,"стоит в любой теме сказать ""айфон"" и начинается срач #дешевоайфон5"
283181646168068096,Mon Dec 24 12:05:40 +0000 2012,"Тот самый момент, когда весь день всё против тебя, а под конец и айфон подводит... БИНГО #дешевоайфон5"
283181372993069057,Mon Dec 24 12:04:35 +0000 2012,"несмотря на то, что обозначена поддержка ипада, по факту работает как айфон приложение, в маленьком экране. бесит. #дешевоайфон5"
283181090733182976,Mon Dec 24 12:03:27 +0000 2012,а как же айфон? #дешевоайфон5
283180823434362881,Mon Dec 24 12:02:24 +0000 2012,в чем заключается непиздатость моей съемки на айфон? #дешевоайфон5
283180565803442176,Mon Dec 24 12:01:22 +0000 2012,"Я уже привык, что если видишь розетку, то надо вставлять и заряжать Айфон. #дешевоайфон5"
283180293228228609,Mon Dec 24 12:00:17 +0000 2012,"какое легче? Айфон 5 -4.0, а мини 7.9. Небольшая разница ващеее. И ppi у мини лучше. И Айфон стоит30 штук, а мини 15) #дешевоайфон5"
283180026453716992,Mon Dec 24 11:59:14 +0000 2012,А мы уже знаем сколько будет стоить айфон 5 в России! #дешевоайфон5
283179692259962880,Mon Dec 24 11:57:54 +0000 2012,"-у папы столько планов,столько планов,что надо купить -а у папы случайно нет в планах купить мне айфон?:) #дешевоайфон5"
283178819194609664,Mon Dec 24 11:54:26 +0000 2012,Иметь айфон и не иметь на нем денег это только в #россия #раша #russia только так) #дешевоайфон5
283178070280654848,Mon Dec 24 11:51:27 +0000 2012,"Не одной. Айфон 5 имеет смысл покупать, если ты хочешь показать, что ты можешь позволить его себе купить #дешевоайфон5"
283176008058818563,Mon Dec 24 11:43:16 +0000 2012,Это была перемена перед геометрией.Мы фоткались на айфон с тупой рожей как могли. #дешевоайфон5
283174449564487680,Mon Dec 24 11:37:04 +0000 2012,Чувствуется новый айфон поставит в затруднение отношения #дешевоайфон5
283174326344232960,Mon Dec 24 11:36:35 +0000 2012,"Я пожму руку тому, кто скажет, что хочет на Новый год не айфон, а старенький Нокиа. #дешевоайфон5"
283174242412015616,Mon Dec 24 11:36:15 +0000 2012,"RT @PaoLoZzy: Вчера два часа искал свой айфон, потом вспомнил что у меня его нету. #дешевоайфон5"
283174036748500992,Mon Dec 24 11:35:26 +0000 2012,"не понимаю, зачем старым бабулям айфон, которые без очков ничего не видят?! #дешевоайфон5"
283173808632909824,Mon Dec 24 11:34:31 +0000 2012,"RT @qes1: Не было айфона, хотел писать в твитьер но не мог, есть айфон, не хочу писать в твиттер... #дешевоайфон5"
283173725434683392,Mon Dec 24 11:34:11 +0000 2012,"скоро у меня будет айфон 3 - 16г , и тогда прощай мир, привет куча музыки, наушники..музыка..наушники #дешевоайфон5"
283173607004319744,Mon Dec 24 11:33:43 +0000 2012,"Мне так захотелось айфон,странно #дешевоайфон5"
283173417824428032,Mon Dec 24 11:32:58 +0000 2012,"RT @myers2324: Ребятааааа , какую ИНТЕРЕСНУЮ игру можно скачать на айфон ???? #дешевоайфон5"
283173259694968832,Mon Dec 24 11:32:20 +0000 2012,Нужна отвертка на айфон #дешевоайфон5
283173110453268480,Mon Dec 24 11:31:45 +0000 2012,"написали письмо Деду Морозу: айфон настоящий, айпад настоящий и телевизор настоящий.%)) что делать теперь? #дешевоайфон5"
283173055184904192,Mon Dec 24 11:31:32 +0000 2012,"RT @VikaTretyak: Впервые уронила айфон. Чтож, этот день настал! #дешевоайфон5"
283172900809359360,Mon Dec 24 11:30:55 +0000 2012,Как установить андроид на айфон? #дешевоайфон5
283172643820154881,Mon Dec 24 11:29:54 +0000 2012,"RT @Mitsos95: Гребаный айфон! Не могу найти даже в продаже скрепки, чтобы симку поменять :(( #дешевоайфон5"
283172475729244160,Mon Dec 24 11:29:13 +0000 2012,Пятый айфон не помешал бы #дешевоайфон5
283172299518124032,Mon Dec 24 11:28:31 +0000 2012,RT @nenazvan: Гребанный айфон. #дешевоайфон5
283172228110110720,Mon Dec 24 11:28:14 +0000 2012,"Интересное дело. Если вы сможете разбить свой айфон в этом чехле, производитель его отремонтирует, либо купит новый. #дешевоайфон5"
283172169838653440,Mon Dec 24 11:28:01 +0000 2012,"""ишь какая, айфон ей подавай"" :D #дешевоайфон5"
283172000938196992,Mon Dec 24 11:27:20 +0000 2012,RT @leso4kina: айфон подарили?) #дешевоайфон5
283171885607440384,Mon Dec 24 11:26:53 +0000 2012,"Мой айфон говорит, что в Питере 25 градусов тепла. Ах, если бы... #дешевоайфон5"
283171730221068289,Mon Dec 24 11:26:16 +0000 2012,"RT @little00bee: поздравляю, это круто! а я уже замужем..не подарят мне айфон:((( #дешевоайфон5"
283171606627487744,Mon Dec 24 11:25:46 +0000 2012,"Мне так захотелось айфон,странно #дешевоайфон5"
283171469159190529,Mon Dec 24 11:25:13 +0000 2012,RT @max1ko: Хочу найти игру покемоны на айфон - видимо нету ?? #дешевоайфон5
283171346865876992,Mon Dec 24 11:24:44 +0000 2012,"папе сейчас должнг прийти настоящий айфон,арррарар Я ПЕРВАЯ КТО ПРОШАРИТ В НЕМ ВСЕ #дешевоайфон5"
283171220290166784,Mon Dec 24 11:24:14 +0000 2012,RT @polakitos15: та ты крутая))) на айфон небось?=))) #дешевоайфон5
283171158650662912,Mon Dec 24 11:23:59 +0000 2012,"Отец вручил ч/б моторолу со словами: ""Вот твой новый телефон - айфон 6"". Тролль. #дешевоайфон5"
283170991251783681,Mon Dec 24 11:23:20 +0000 2012,RT @Qwistovskaya: - А мне папа айфон купил! Обожаю / айфон! / - А мне мама шоколадку купила. Обожаю маму #дешевоайфон5
283170879230328832,Mon Dec 24 11:22:53 +0000 2012,Господа. а у кого есть айфон? #дешевоайфон5
283170754697252864,Mon Dec 24 11:22:23 +0000 2012,RT @13Markiz13: ??айфон хочет что бы вы пили минимально и умирали от жажды :)))) #дешевоайфон5
283170675953381376,Mon Dec 24 11:22:04 +0000 2012,"Мой коллега купил себе айфон 5, никаких кардинальных отличий с 4s я не заметил #дешевоайфон5"
283170430502703104,Mon Dec 24 11:21:06 +0000 2012,Современное общество - десять причин купить пятый айфон и ни одной причины существовать. #дешевоайфон5
283170339536642048,Mon Dec 24 11:20:44 +0000 2012,"RT @phcarmichael: снилось, что затусила с какими-то сноубордистами, а они меня кинули на деньги, НО НА АЙФОН МНЕ ДЕНЕГ ВСЕ РАВНО ХВАТАЛО ..."
283170249652699136,Mon Dec 24 11:20:23 +0000 2012,"Айфон покупают не для того, чтобы по нему говорить, а чтобы говорить о нем. #дешевоайфон5"
283170137618673666,Mon Dec 24 11:19:56 +0000 2012,RT @eshneyderman: айфон 5 #дешевоайфон5
283170038431756288,Mon Dec 24 11:19:32 +0000 2012,Пятый айфон не помешал бы #дешевоайфон5
283169937810399232,Mon Dec 24 11:19:08 +0000 2012,RT @mk8319: Долбанный айфон! Моя нокия самая крутая ахахаха #дешевоайфон5
283169868054941696,Mon Dec 24 11:18:52 +0000 2012,"Фо нокиа, фо айфон, фо дрова :D #дешевоайфон5"
283169726820143105,Mon Dec 24 11:18:18 +0000 2012,RT @2011Nuta: Макросьемка на айфон. Мой глаз)) #дешевоайфон5
283169630648946688,Mon Dec 24 11:17:55 +0000 2012,"Илюшка-таки купил себе пятый айфон, уже весь сгорает от нетерпения и жаждет порезать симку :D #дешевоайфон5"
283169461685596160,Mon Dec 24 11:17:15 +0000 2012,Купила Айфон мр. Радости милашества #дешевоайфон5
283169368605605888,Mon Dec 24 11:16:53 +0000 2012,RT @Teya_Kornilova: у тебя айфон? — нет #дешевоайфон5
283169286703439872,Mon Dec 24 11:16:33 +0000 2012,Нужна отвертка на айфон #дешевоайфон5
283169170114363392,Mon Dec 24 11:16:05 +0000 2012,RT @sergej7781: Список Медведева: 1. Срочно купить 5-й Айфон 2. Какую бы еще х-ню придумать... #дешевоайфон5
283169092125483009,Mon Dec 24 11:15:47 +0000 2012,"Всё-таки величайшее изобретение человечества не айфон, а термокружка. И айфон. :)) #дешевоайфон5"
283168870792052737,Mon Dec 24 11:14:54 +0000 2012,"""Уронил Айфон, так сказать кинул понты!"" (с) #дешевоайфон5"
283168787337981952,Mon Dec 24 11:14:34 +0000 2012,RT @schikomaru: да мне уже прислали) мой айфон слетел с катушек #дешевоайфон5
283168664189018112,Mon Dec 24 11:14:05 +0000 2012,"Я человек контрастов: у меня есть айфон, но в газели я плачу мелочью по 10 копеек. #дешевоайфон5"
283168466129793024,Mon Dec 24 11:13:17 +0000 2012,"RT @PrikoL52rus: Проверяй свой айфон, я поселился там, будто это мой второй дом! #дешевоайфон5"
283168417987559425,Mon Dec 24 11:13:06 +0000 2012,"Друзья! Вот, подарили вам 5й айфон, вещь хорошая и нужная. Только вопрос, вы куда старые айфоны деваете? #дешевоайфон5"
283165712476938240,Mon Dec 24 11:02:21 +0000 2012,Хочу Айфон 4 и вто-же время 5((( #дешевоайфон5
283165355772346369,Mon Dec 24 11:00:56 +0000 2012,Фоточки на 5 айфон офигительны #дешевоайфон5
283165163614523393,Mon Dec 24 11:00:10 +0000 2012,RT @raziel2101: только это нифига не айфон. #дешевоайфон5
283164962048839680,Mon Dec 24 10:59:22 +0000 2012,"RT @1994Rais: Может айфон 5й купить? Хотя неееет, держись Коко, не траааать, ты хочешь макбууук!) #дешевоайфон5"
283164813906030592,Mon Dec 24 10:58:47 +0000 2012,хрен мне а не Айфон да? Мне написала?! #дешевоайфон5
283164522972315648,Mon Dec 24 10:57:37 +0000 2012,"По-моему, сегодня урок физ-ры был лучше прошлого)Особенно ""Айфон пятый, я тебя хочу!"" Наташа и Соня- респект вам))! #дешевоайфон5"
283164280348606464,Mon Dec 24 10:56:40 +0000 2012,"ты думаешь ты одна в мире, кому понравился 5 Айфон??? #дешевоайфон5"
283164102631759874,Mon Dec 24 10:55:57 +0000 2012,Даша теперь ведет себя как моя мама и не дает мне играть в айфон на уроках лол хд #дешевоайфон5
283162569047408640,Mon Dec 24 10:49:52 +0000 2012,"Интересно, какой у бога айфон?? #дешевоайфон5"
283161149128716288,Mon Dec 24 10:44:13 +0000 2012,Это была перемена перед геометрией.Мы фоткались на айфон с тупой рожей как могли. #дешевоайфон5
283160657233317891,Mon Dec 24 10:42:16 +0000 2012,Ну всё. Теперь я осознала. Хочу айфон #дешевоайфон5
283160619258109952,Mon Dec 24 10:42:07 +0000 2012,"Купила 5ый айфон, он прелесть! #дешевоайфон5"
283160590371934208,Mon Dec 24 10:42:00 +0000 2012,"""Уронил Айфон, так сказать кинул понты!"" (с) #дешевоайфон5"
283160552405078016,Mon Dec 24 10:41:51 +0000 2012,"RT @My_House_Church: Заебись вышла в Тушино,в первые 3 минуты мальчик цыганенок пытался спиздить у меня айфон из кармана!я в шоке???? #д ..."
283160401036836864,Mon Dec 24 10:41:15 +0000 2012,"RT @r0o0bert: ах да, айфон/компьютер/айпад еще почистить, безумно полезное дело между прочим!?? #дешевоайфон5"
283160353016266752,Mon Dec 24 10:41:03 +0000 2012,RT @olka_lolo: Снежана фоткаюсь на 5тый айфон как дибила Станкевич. #дешевоайфон5
283160315565314048,Mon Dec 24 10:40:54 +0000 2012,"Я не буду просить айфон,айпад,ни денег #дешевоайфон5"
283160264898138112,Mon Dec 24 10:40:42 +0000 2012,Порекомендуйте полезные и интересные приложения на айфон #дешевоайфон5
283160229154267136,Mon Dec 24 10:40:34 +0000 2012,"Я жду айфон, ты обещал. И желательно до нг #дешевоайфон5"
283160130663641089,Mon Dec 24 10:40:10 +0000 2012,"Не нравится мне пятый айфон,давайте следующий #дешевоайфон5"
283160100166840321,Mon Dec 24 10:40:03 +0000 2012,"хочу 5-ый айфон, блекберри надоел, что делать? #дешевоайфон5"
283160068566941697,Mon Dec 24 10:39:55 +0000 2012,"- Ты же фотограф? - Да. - О, посоветуй, какую камеру лучше для инстаграмма брать, айфон или андроид? #дешевоайфон5"
283160032256880640,Mon Dec 24 10:39:47 +0000 2012,"еду в автобусе,рядом девочка класс 6,достает айфон.Ну офигеть теперь #дешевоайфон5"
283160002221461504,Mon Dec 24 10:39:40 +0000 2012,Даша теперь ведет себя как моя мама и не дает мне играть в айфон на уроках лол хд #дешевоайфон5
283159967840743424,Mon Dec 24 10:39:31 +0000 2012,RT @qavriliviktor: все проекты очень похожи. Сенсор - айфон - облако. Сложно будет выбрать победителя на мой взгляд. #дешевоайфон5
283159932042371073,Mon Dec 24 10:39:23 +0000 2012,RT @Ninel0707: Я опять утопила айфон!! Бесит меня это!!! #дешевоайфон5
283159897326120961,Mon Dec 24 10:39:15 +0000 2012,"Какой айфон лучше, черный или белый? #дешевоайфон5"
283159839755079680,Mon Dec 24 10:39:01 +0000 2012,RT @momta78: Селфимся на Катюхин айфон #дешевоайфон5
283159771903827968,Mon Dec 24 10:38:45 +0000 2012,"RT @paleolakis: Ну что... Сбылась моя мечта)белый пятый айфон, сутки вместе, полет отличный,только тонкий и легкий оооочень))))) #дешево ..."
283159748772245504,Mon Dec 24 10:38:39 +0000 2012,RT @safonov37: А мне папа айфон купил! Обожаю / айфон! / - А мне мама шоколадку купила. Обожаю маму #дешевоайфон5
283159720586530817,Mon Dec 24 10:38:32 +0000 2012,"RT @AlbTePHaTiBa: ты думаешь одна в мире, кому нравится черный Айфон?? #дешевоайфон5"
