tid,time,tweet
261686853726519296,Fri Oct 26 04:33:02 +0000 2012,"#ОлимпиадыНеБудет  Ох уж этот ГК «Олимпстрой», сплошные будут с ним проблемы…"
261686740845215745,Fri Oct 26 04:32:35 +0000 2012,#ОлимпиадыНеБудет  Голову блять нужно усекать а не руку
261686249339908096,Fri Oct 26 04:30:38 +0000 2012,За распилы можно сесть. Инфа 146 процентов!   #ОлимпиадыНеБудет
261685394393927682,Fri Oct 26 04:27:14 +0000 2012,"Что говорят власти про то, что  #ОлимпиадыНеБудет  ?"
261684947478265856,Fri Oct 26 04:25:28 +0000 2012,Руки им поотрывать и подальше их от кормушек!!!!!!!!!! #ОлимпиадыНеБудет !
261684718238584832,Fri Oct 26 04:24:33 +0000 2012,Надо ужесточать наказания за экономические преступления!  #ОлимпиадыНеБудет
261684542220410880,Fri Oct 26 04:23:51 +0000 2012,"#ОлимпиадыНеБудет  Такое действительно правительству заметить сложно, главное выявлять и пресекать на корню!"
261684143782494209,Fri Oct 26 04:22:16 +0000 2012,Депрессивная тема такая  #ОлимпиадыНеБудет
261683930007228417,Fri Oct 26 04:21:25 +0000 2012,А что по поводу чемпионата мира?  #ОлимпиадыНеБудет
261683345023434754,Fri Oct 26 04:19:05 +0000 2012,"Гребнева, твоя бюджетная пила тебя посадит   #ОлимпиадыНеБудет"
261683133089476608,Fri Oct 26 04:18:15 +0000 2012,"#ОлимпиадыНеБудет  , кто удивлён??"
261683007352614912,Fri Oct 26 04:17:45 +0000 2012,"Если бы я был сыном чиновника, то обязательно завёл бы такую фирму =)  #ОлимпиадыНеБудет  Хотя нет! Всё было бы честно!"
261682892776820736,Fri Oct 26 04:17:18 +0000 2012,#ОлимпиадыНеБудет  будем уменьшать количество коррупционеров в стране
261682468845924352,Fri Oct 26 04:15:37 +0000 2012,"Пили Гребнева, пили бюджет)   #ОлимпиадыНеБудет"
261682072354181120,Fri Oct 26 04:14:02 +0000 2012,Любопытную схему описывает автор -  #ОлимпиадыНеБудет !
261681723606200321,Fri Oct 26 04:12:39 +0000 2012,Неужели коррупция в России так глупа?  #ОлимпиадыНеБудет
261681533067350016,Fri Oct 26 04:11:53 +0000 2012,Кажется  #ОлимпиадыНеБудет
261681511449907201,Fri Oct 26 04:11:48 +0000 2012,"Спаси бюджет, убей Гребневу)   #ОлимпиадыНеБудет"
261680907730178048,Fri Oct 26 04:09:24 +0000 2012,“ОАО «Концерн «Монарх»” какое самоуверенное название  #ОлимпиадыНеБудет
261680671498567682,Fri Oct 26 04:08:28 +0000 2012,Эта схема до сих пор действует?  #ОлимпиадыНеБудет
261680448932032512,Fri Oct 26 04:07:35 +0000 2012,#ОлимпиадыНеБудет   из-за коррупции… И что делать с этим? Я не могу найти ответ..
261679995062214656,Fri Oct 26 04:05:47 +0000 2012,"Эх, почему я не сын чиновника… #ОлимпиадыНеБудет !"
261679954713010176,Fri Oct 26 04:05:37 +0000 2012,"#ОлимпиадыНеБудет  Чувствую, скоро кто-то сядет)"
261679634305912832,Fri Oct 26 04:04:21 +0000 2012,"#ОлимпиадыНеБудет   из-за таких чиновников, как дура Гребнева"
261678775320846337,Fri Oct 26 04:00:56 +0000 2012,"#ОлимпиадыНеБудет  Путин не может каждому чиновнику в голову залезть,воры есть везде"
261678527093542912,Fri Oct 26 03:59:57 +0000 2012,Ну сколько можно воровать??  #ОлимпиадыНеБудет
261678348881772544,Fri Oct 26 03:59:14 +0000 2012,#ОлимпиадыНеБудет  Главное чтобы это закончилось
261678147882328064,Fri Oct 26 03:58:26 +0000 2012,ООО «Энергогруп» к моменту окончания строительства уже было на грани банкротства.. #ОлимпиадыНеБудет !
261677980852551681,Fri Oct 26 03:57:47 +0000 2012,А что по поводу чемпионата мира?! #ОлимпиадыНеБудет !
261677815353712641,Fri Oct 26 03:57:07 +0000 2012,"#ОлимпиадыНеБудет  я надеюсь, что этого Моносова уволили из ГК «Олимпстрой»?!"
261677610487128065,Fri Oct 26 03:56:18 +0000 2012,"#ОлимпиадыНеБудет  , конечно не будет с таким уровнем коррупции"
261677526697525249,Fri Oct 26 03:55:58 +0000 2012,"#ОлимпиадыНеБудет , конечно не будет с таким уровнем коррупции"
261677297386549248,Fri Oct 26 03:55:04 +0000 2012,"Не верится, но по слухам…  #ОлимпиадыНеБудет"
261677294760906752,Fri Oct 26 03:55:03 +0000 2012,Они в московскую мэрию приходят только воровать?  #ОлимпиадыНеБудет
261664063610843137,Fri Oct 26 03:02:28 +0000 2012,роспилу.нет поведал о массовой коррупции   #ОлимпиадыНеБудет
261663808848805888,Fri Oct 26 03:01:28 +0000 2012,Очень любопытная статья #ОлимпиадыНеБудет !
261663524676304896,Fri Oct 26 03:00:20 +0000 2012,"#ОлимпиадыНеБудет , строительные компании завышают цены в разы!"
261663255657865218,Fri Oct 26 02:59:16 +0000 2012,#ОлимпиадыНеБудет   Надо сажать таких пока они всю страну не разворовали!
261663039571492865,Fri Oct 26 02:58:24 +0000 2012,ООО «Энергогруп» настолько приближен к власти… #ОлимпиадыНеБудет !
261662851620552704,Fri Oct 26 02:57:39 +0000 2012,Необходимо перестать допускать недобросовестных чиновников! Тут же и взятки и кумовство..  #ОлимпиадыНеБудет
261662612301942784,Fri Oct 26 02:56:42 +0000 2012,#ОлимпиадыНеБудет   Растрелять! Всех к стенке!
261661971944964097,Fri Oct 26 02:54:10 +0000 2012,#ОлимпиадыНеБудет  Думать нужно прежде чем отдавать кому то что! Сами виноваты!
261661732227923968,Fri Oct 26 02:53:13 +0000 2012,"#ОлимпиадыНеБудет !, всегда так в России =)"
261661293080109056,Fri Oct 26 02:51:28 +0000 2012,#ОлимпиадыНеБудет  . Я в гугле проверял.
261661056722673664,Fri Oct 26 02:50:32 +0000 2012,"#ОлимпиадыНеБудет   я надеюсь, что этого Моносова уволили из ГК « #ОлимпиадыНеБудет  , всегда так в нашей стране"
261660667369631744,Fri Oct 26 02:48:59 +0000 2012,"#ОлимпиадыНеБудет  я надеюсь, что этого Моносова уволили из ГК «Олимпстрой»?"
261660432522170369,Fri Oct 26 02:48:03 +0000 2012,"Угадай страну, как говорится!  #ОлимпиадыНеБудет  http://t.co/ZyLNNs2K"
261660241077358593,Fri Oct 26 02:47:17 +0000 2012,#ОлимпиадыНеБудет  Коррупции бой!
261660227227774979,Fri Oct 26 02:47:14 +0000 2012,"#ОлимпиадыНеБудет   я надеюсь, что этого Моносова уволили из ГК «Олимпстрой»?"
261659138545811456,Fri Oct 26 02:42:54 +0000 2012,#ОлимпиадыНеБудет  Чиновники проворовались
261658049780019200,Fri Oct 26 02:38:35 +0000 2012,Руки им поотрывать и подальше их от кормушек!!!!!!!!!! #ОлимпиадыНеБудет !
261656961769148416,Fri Oct 26 02:34:15 +0000 2012,"#ОлимпиадыНеБудет  процесс распила можно прервать если посадить на долго. Посидят, осмыслят, возможно встанут на путь истинный"
261655873607303168,Fri Oct 26 02:29:56 +0000 2012,"#ОлимпиадыНеБудет  , как же мы к этому привыкли…"
261654784233320448,Fri Oct 26 02:25:36 +0000 2012,"#ОлимпиадыНеБудет !, а что, не успеют ничего построить?"
261653696952274945,Fri Oct 26 02:21:17 +0000 2012,"#ОлимпиадыНеБудет  , конечно не будет с таким уровнем коррупции"
261652225229742080,Fri Oct 26 02:15:26 +0000 2012,"#ОлимпиадыНеБудет  , а что, не успеют ничего построить?"
261651228059119616,Fri Oct 26 02:11:28 +0000 2012,#ОлимпиадыНеБудет  из-за воровства… Может нам не продлевать мораторий на смертную казнь? http://t.co/JruqHAB9
261651207540576256,Fri Oct 26 02:11:23 +0000 2012,"Гребнева, давай, до свидания!!   #ОлимпиадыНеБудет"
261651200578056192,Fri Oct 26 02:11:22 +0000 2012,"Не удивительно, что  #ОлимпиадыНеБудет  . Мне это сразу фантастикой показалось"
261651121616084994,Fri Oct 26 02:11:03 +0000 2012,#ОлимпиадыНеБудет  Поди тоже кабеля запилили
261650230607499265,Fri Oct 26 02:07:30 +0000 2012,"В строительстве принимало участие ОАО «Концерн «Монарх», возглавляемое на тот момент Гребневой М.Е. Любопытно…  #ОлимпиадыНеБудет"
261650158226395137,Fri Oct 26 02:07:13 +0000 2012,Куда смотрит СК?! http://t.co/ZyLNNs2K  #ОлимпиадыНеБудет
261650015515209728,Fri Oct 26 02:06:39 +0000 2012,#ОлимпиадыНеБудет   из-за коррупции… И что делать с этим? Я не могу найти ответ..
261648801914310656,Fri Oct 26 02:01:50 +0000 2012,"Я уверен, что всё пройдет нормально и вороватых чиновников выпрут  #ОлимпиадыНеБудет"
261648431217532928,Fri Oct 26 02:00:21 +0000 2012,Когда уже пересажают всех этих коррупционеров? Из за них  #ОлимпиадыНеБудет  ! http://t.co/ZyLNNs2K
261648338691174400,Fri Oct 26 01:59:59 +0000 2012,"Все кто хотел озолотиться на Сочи, обломитесь!  #ОлимпиадыНеБудет  !"
261648142536146947,Fri Oct 26 01:59:13 +0000 2012,#ОлимпиадыНеБудет  Необходимо проверить всех чиновников на вшивость
261647369605632000,Fri Oct 26 01:56:08 +0000 2012,#ОлимпиадыНеБудет !? Я уж испугался.
261646878817517570,Fri Oct 26 01:54:11 +0000 2012,"#ОлимпиадыНеБудет , это провал... http://t.co/ZyLNNs2K"
261645793059041280,Fri Oct 26 01:49:52 +0000 2012,"#ОлимпиадыНеБудет , опять распилят наши деньги?"
261645547331547136,Fri Oct 26 01:48:54 +0000 2012,#ОлимпиадыНеБудет  Все тайное становится явным
261645281337155584,Fri Oct 26 01:47:50 +0000 2012,роспилу.нет рассказал правду о Гребневой   #ОлимпиадыНеБудет
261645056501493762,Fri Oct 26 01:46:57 +0000 2012,Слышали? В отлаженных схемах хищений бюджетных денег тоже бывает сбой  #ОлимпиадыНеБудет   http://t.co/ZyLNNs2K
261644856127004672,Fri Oct 26 01:46:09 +0000 2012,“ОАО «Концерн «Монарх»” какое самоуверенное название  #ОлимпиадыНеБудет
261644560818651136,Fri Oct 26 01:44:59 +0000 2012,"#ОлимпиадыНеБудет  Олимпиады не будет, опять распилят наши деньги?!"
261644188498661376,Fri Oct 26 01:43:30 +0000 2012,"#ОлимпиадыНеБудет  , конечно не будет с таким уровнем коррупции"
261642666108928000,Fri Oct 26 01:37:27 +0000 2012,"В строительстве принимало участие ОАО «Концерн «Монарх», возглавляемое на тот момент Гребневой М.Е. Любопытно…  #ОлимпиадыНеБудет"
261642445056532480,Fri Oct 26 01:36:34 +0000 2012,"#ОлимпиадыНеБудет   К стенке нужно ставить ворюг,а будешь сосать пальцы,ничего не поменяется"
261399066645233664,Thu Oct 25 09:29:28 +0000 2012,#ОлимпиадыНеБудет Война с коррупцией до победного конца! http://t.co/ZyLNNs2K
261397266164760576,Thu Oct 25 09:22:19 +0000 2012,"RT @kremlinkot: #ОлимпиадыНеБудет опять решили РОСПИЛить наши деньги? Кот передушит КрыС, пытающихся растащить по частям его родину!!! h ..."
225086096197943296,Tue Jul 17 04:34:41 +0000 2012,"RT @igr_obzor: Новая игра по фильму человек-паук! Теперь 4го человека паука можно не только посмотреть, можно играть в него с друзьями h ..."
224878751991865344,Mon Jul 16 14:50:47 +0000 2012,RT @igr_obzor: Люди в черном- это игра по мотивам легендарного фильма. http://t.co/BVdIp5Jt
224526043590033409,Sun Jul 15 15:29:14 +0000 2012,"RT @igr_obzor: Самая развратная игра 2012-го года, основанная на жестком сексе с возможностью знакомства для продолжения в реальности ht ..."
224306074734436352,Sun Jul 15 00:55:10 +0000 2012,"RT @igr_obzor: Лучший экшн 2012-го года, игра по мотивам фильма  трансформеры. http://t.co/O542qjZh"
218645899755266049,Fri Jun 29 10:03:39 +0000 2012,"RT @COB_CEKPETHO: Тема Клюшин выложил, сказанную Якеменко @yakemenko правду про Путина http://t.co/Gju6yzD9 #Клюшин RT"
