tid,time,tweet
283159679968874497,Mon Dec 24 10:38:23 +0000 2012,"RT @Yuzka_Nova: Хорошее настроение с утра так же подозрительно, как айфон за две штуки рублей. #дешевоайфон5"
283159554399817728,Mon Dec 24 10:37:53 +0000 2012,на айфон постараюсь :D #дешевоайфон5
283159520849588224,Mon Dec 24 10:37:45 +0000 2012,"Девчат,у вас такие навороченные фотики,и вы фоткаете на айфон???пхаха)))АААААААА!!!ЗАКРОЙ СВОЙ РОООООТ! #дешевоайфон5"
283159477891518464,Mon Dec 24 10:37:35 +0000 2012,"RT @MirellePersson: - У Сашки день рождения. Что будем дарить?- А может, айпад? А может, айфон? - Саш, может, ты уйдёшь? Мы без тебя под ..."
283159434367205376,Mon Dec 24 10:37:24 +0000 2012,"написали письмо Деду Морозу: айфон настоящий, айпад настоящий и телевизор настоящий.%)) что делать теперь? #дешевоайфон5"
283159402477916160,Mon Dec 24 10:37:17 +0000 2012,"RT @MashkaBer: Мне например было бы стыдно попросить у мамы 15 тысяч и больше, что бы купить айфон или айпад. #дешевоайфон5"
283159360476176384,Mon Dec 24 10:37:07 +0000 2012,"RT @pauljwithers: мне нужно срочно купить подарок маме и чехол на айфон , #дешевоайфон5"
283159311306326016,Mon Dec 24 10:36:55 +0000 2012,"Я не буду просить айфон,айпад,ни денег #дешевоайфон5"
283159252539936768,Mon Dec 24 10:36:41 +0000 2012,"хочу 5-ый айфон, блекберри надоел, что делать? #дешевоайфон5"
283159202166358016,Mon Dec 24 10:36:29 +0000 2012,"RT @ElenaOrlena: Проверяй свой айфон, я поселился там, будто это мой второй дом! #дешевоайфон5"
283159043185459200,Mon Dec 24 10:35:51 +0000 2012,"По-моему, сегодня урок физ-ры был лучше прошлого)Особенно ""Айфон пятый, я тебя хочу!"" Наташа и Соня- респект вам))! #дешевоайфон5"
283158958707970048,Mon Dec 24 10:35:31 +0000 2012,Хочу айфон) #дешевоайфон5
283158919289901056,Mon Dec 24 10:35:21 +0000 2012,"Айпад или айфон купить, съесть микс фруктовый и купить костюм медвежонка теплый в котором буду спать #дешевоайфон5"
283158877229445120,Mon Dec 24 10:35:11 +0000 2012,сегодня буду качать музыку на айфон. много музыкииии! #дешевоайфон5
283158805339074560,Mon Dec 24 10:34:54 +0000 2012,"У меня сломался айфон, теперь его только выкинуть, покааа( #дешевоайфон5"
283158734912503808,Mon Dec 24 10:34:37 +0000 2012,"Рассказал маме,что мне приснилось сегодня будто бы мне родители подарили пятый айфон. #дешевоайфон5"
283158695775461376,Mon Dec 24 10:34:28 +0000 2012,Даша теперь ведет себя как моя мама и не дает мне играть в айфон на уроках лол хд #дешевоайфон5
283158662279729152,Mon Dec 24 10:34:20 +0000 2012,"Айфон ударился об макбук. Плохой день у айфона, плохой #дешевоайфон5"
283158632101707777,Mon Dec 24 10:34:13 +0000 2012,"паниковать и снижать цены, в итоге уже через час 5 айфон можно было везде купит за 30000 #дешевоайфон5"
283158600514408448,Mon Dec 24 10:34:05 +0000 2012,"RT @rdhanda1: я так привыкла к своему, что какой на хрен АЙФОН? ах ты ж мой любименький урурурру няняння омнмомнмом *О*О* #дешевоайфон5"
283158434113810434,Mon Dec 24 10:33:26 +0000 2012,Ну всё. Теперь я осознала. Хочу айфон #дешевоайфон5
283157945989091330,Mon Dec 24 10:31:29 +0000 2012,"хочу 5-ый айфон, блекберри надоел, что делать? #дешевоайфон5"
283157761330655233,Mon Dec 24 10:30:45 +0000 2012,"По-моему, сегодня урок физ-ры был лучше прошлого)Особенно ""Айфон пятый, я тебя хочу!"" Наташа и Соня- респект вам))! #дешевоайфон5"
283086327610740736,Mon Dec 24 05:46:54 +0000 2012,Это была перемена перед геометрией.Мы фоткались на айфон с тупой рожей как могли. #дешевоайфон5
283065647473254402,Mon Dec 24 04:24:44 +0000 2012,Идите нахуй со своей рекламой! В жопу себе запехайте этот айфон или вашему другу который выиграет его! #дешевоайфон5
283065442917027842,Mon Dec 24 04:23:55 +0000 2012,RT @qpama: мы с папой договорились так. я не косячу и к 8 марта он мне купит 5 айфон #дешевоайфон5
283065285009874944,Mon Dec 24 04:23:17 +0000 2012,Даша теперь ведет себя как моя мама и не дает мне играть в айфон на уроках лол хд #дешевоайфон5
283065172397006848,Mon Dec 24 04:22:50 +0000 2012,"Вообще весь день состоит из приятных разговоров за жизнь. А началось с того, что айфон проверил себя на прочность. #дешевоайфон5"
283064895249997824,Mon Dec 24 04:21:44 +0000 2012,"Айфон ударился об макбук. Плохой день у айфона, плохой #дешевоайфон5"
283064712982327298,Mon Dec 24 04:21:01 +0000 2012,"в дрим сторе уже и 4 айпад, и 5 айпод, и айпод нано, НО ГДЕ АЙПАД МИНИ И 5 АЙФОН, МАТЬ ВАШУ #дешевоайфон5"
283064688563089408,Mon Dec 24 04:20:55 +0000 2012,RT @DrA_coNiA: +1 задрот))) поздравляю)))))))айфон-стерва! #дешевоайфон5
283064237222400000,Mon Dec 24 04:19:07 +0000 2012,"Рассказал маме,что мне приснилось сегодня будто бы мне родители подарили пятый айфон. #дешевоайфон5"
283064140027793408,Mon Dec 24 04:18:44 +0000 2012,"у нас дома истерики,а потом я молчу и втыкаю в айфон.помогает ;$ #дешевоайфон5"
283064026035015680,Mon Dec 24 04:18:17 +0000 2012,"Не нравится мне пятый айфон,давайте следующий #дешевоайфон5"
283063459451645954,Mon Dec 24 04:16:02 +0000 2012,"Вы не видели айфон 4с, я потерял его на трассе #дешевоайфон5"
283063190659661824,Mon Dec 24 04:14:58 +0000 2012,"написали письмо Деду Морозу: айфон настоящий, айпад настоящий и телевизор настоящий.%)) что делать теперь? #дешевоайфон5"
283034985315827712,Mon Dec 24 02:22:53 +0000 2012,Айфон на морозе превращается в андроид. #дешевоайфон5
283029573774503937,Mon Dec 24 02:01:23 +0000 2012,Фоточки на 5 айфон офигительны #дешевоайфон5
283022187806470144,Mon Dec 24 01:32:02 +0000 2012,"У одного айфон, у другого макбук, у третьего айпэд... Ну а я что? Поиду книжку почитаю... :) #дешевоайфон5"
283021967282556928,Mon Dec 24 01:31:09 +0000 2012,"Айфон ударился об макбук. Плохой день у айфона, плохой #дешевоайфон5"
283021894670761987,Mon Dec 24 01:30:52 +0000 2012,"да я тоже,моя еще айфон хочет купить себе #дешевоайфон5"
283021498669756416,Mon Dec 24 01:29:18 +0000 2012,Даша теперь ведет себя как моя мама и не дает мне играть в айфон на уроках лол хд #дешевоайфон5
283021323595296769,Mon Dec 24 01:28:36 +0000 2012,Стол оставил пятый айфон и что то не торопится за ним) #дешевоайфон5
283020940596633600,Mon Dec 24 01:27:05 +0000 2012,"Рассказал маме,что мне приснилось сегодня будто бы мне родители подарили пятый айфон. #дешевоайфон5"
283018308465344514,Mon Dec 24 01:16:37 +0000 2012,Это была перемена перед геометрией.Мы фоткались на айфон с тупой рожей как могли. #дешевоайфон5
283017519508369410,Mon Dec 24 01:13:29 +0000 2012,В упаковке ммс нашел Айфон) фарт #дешевоайфон5
283017431046320128,Mon Dec 24 01:13:08 +0000 2012,"написали письмо Деду Морозу: айфон настоящий, айпад настоящий и телевизор настоящий.%)) что делать теперь? #дешевоайфон5"
283017262158475264,Mon Dec 24 01:12:28 +0000 2012,Не понимаю зачем таскать айфон без чехла или бампера. Чтобы все увидели яблоко? Он ведь царапается! Ему ведь больно!)))) #дешевоайфон5
283017118620979200,Mon Dec 24 01:11:53 +0000 2012,"- У Сашки день рождения. Что будем дарить? - А может, айпад? А может, айфон? - Саш, может, ты уйдёшь? Мы без тебя подумаем. #дешевоайфон5"
283016926588968961,Mon Dec 24 01:11:08 +0000 2012,RT @orenbyr: - А мне папа айфон купил. Обожаю айфон! - А мне мама шоколадку купила. Обожаю маму. #дешевоайфон5
283016269983252481,Mon Dec 24 01:08:31 +0000 2012,"Айфон не работает в перчатках, все быстро пошли #дешевоайфон5"
283016244788088833,Mon Dec 24 01:08:25 +0000 2012,"хочу 5-ый айфон, блекберри надоел, что делать? #дешевоайфон5"
283015743346450432,Mon Dec 24 01:06:26 +0000 2012,"Дорой beeline wi fi, ты уже задолбал цепляться за мой айфон. Отъебись! #дешевоайфон5"
283015390085406721,Mon Dec 24 01:05:01 +0000 2012,"- Ты же фотограф? - Да. - О, посоветуй, какую камеру лучше для инстаграмма брать, айфон или андроид? #дешевоайфон5"
283015180529565696,Mon Dec 24 01:04:11 +0000 2012,"Кибом, отдай мне свой айфон #нуашто #дешевоайфон5"
283013481651908608,Mon Dec 24 00:57:26 +0000 2012,Даша теперь ведет себя как моя мама и не дает мне играть в айфон на уроках лол хд #дешевоайфон5
283012978494820353,Mon Dec 24 00:55:26 +0000 2012,Это была перемена перед геометрией.Мы фоткались на айфон с тупой рожей как могли. #дешевоайфон5
283010951815520256,Mon Dec 24 00:47:23 +0000 2012,"Айфон ударился об макбук. Плохой день у айфона, плохой #дешевоайфон5"
283010863118569472,Mon Dec 24 00:47:02 +0000 2012,ого ахаха чуть чуть занет айфон ахаха)) звони в дороге нам скушно)) #дешевоайфон5
283010822333136897,Mon Dec 24 00:46:52 +0000 2012,"у кого айфон,ретвит :) #дешевоайфон5"
283010651775975425,Mon Dec 24 00:46:12 +0000 2012,"У меня теперь айфон, наконец-то #дешевоайфон5"
283010470393298944,Mon Dec 24 00:45:28 +0000 2012,"По-моему, сегодня урок физ-ры был лучше прошлого)Особенно ""Айфон пятый, я тебя хочу!"" Наташа и Соня- респект вам))! #дешевоайфон5"
283010427015798785,Mon Dec 24 00:45:18 +0000 2012,"-Соня, у тебя Айфон? -Нет. -У меня тоже.. #дешевоайфон5"
283009999788199937,Mon Dec 24 00:43:36 +0000 2012,покупать у Бычковой айфон 4 за 13 штук?? #дешевоайфон5
283009958944067584,Mon Dec 24 00:43:26 +0000 2012,RT @mvalov92: Photo: Снежана фоткаюсь на 5тый айфон как дибила Станкевич. #дешевоайфон5
283009555225534464,Mon Dec 24 00:41:50 +0000 2012,RT @patapon1997: - А мне папа айфон купил! Обожаю айфон! - А мне мама шоколадку купила. Обожаю маму #дешевоайфон5
283009456701325313,Mon Dec 24 00:41:27 +0000 2012,"да пошел он, пошел!) даже айфон показывает ;) #дешевоайфон5"
283009338287722496,Mon Dec 24 00:40:58 +0000 2012,"Рассказал маме,что мне приснилось сегодня будто бы мне родители подарили пятый айфон. #дешевоайфон5"
283008861433110529,Mon Dec 24 00:39:05 +0000 2012,айфон))))) #дешевоайфон5
283008642943447041,Mon Dec 24 00:38:13 +0000 2012,"Айфон ударился об макбук. Плохой день у айфона, плохой #дешевоайфон5"
283007338720423937,Mon Dec 24 00:33:02 +0000 2012,Ну всё. Теперь я осознала. Хочу айфон #дешевоайфон5
282994674149519360,Sun Dec 23 23:42:42 +0000 2012,"RT @_3909297883681: ну вот , айфон занижает мой рейтинг , пошла выкину!!! #дешевоайфон5"
282994529190166528,Sun Dec 23 23:42:08 +0000 2012,"хотела на неделе съездить обновить айфон, но в такой холод не хочу #дешевоайфон5"
282990652575318016,Sun Dec 23 23:26:43 +0000 2012,Купил айфон 4s #дешевоайфон5
282990341035016192,Sun Dec 23 23:25:29 +0000 2012,Это была перемена перед геометрией.Мы фоткались на айфон с тупой рожей как могли. #дешевоайфон5
261729710772461568,Fri Oct 26 07:23:20 +0000 2012,"Эх, почему я не сын чиновника… #ОлимпиадыНеБудет !"
261728168526888960,Fri Oct 26 07:17:12 +0000 2012,"В строительстве принимало участие ОАО «Концерн «Монарх», возглавляемое на тот момент Гребневой М.Е. Любопытно!  #ОлимпиадыНеБудет"
261727145183830017,Fri Oct 26 07:13:08 +0000 2012,"В строительстве принимало участие ОАО «Концерн «Монарх», возглавляемое на тот момент Гребневой М.Е. Любопытно!  #ОлимпиадыНеБудет"
261726118615347200,Fri Oct 26 07:09:03 +0000 2012,Москва с Лужковым и без Лужкова – одно и тоже.  #ОлимпиадыНеБудет
261725244216209408,Fri Oct 26 07:05:35 +0000 2012,"Олимпстрой в курсе, что  #ОлимпиадыНеБудет  ? Пусть сворачиваются."
261724952703684608,Fri Oct 26 07:04:25 +0000 2012,И это всё останется безнаказанным? Я в шоке!  #ОлимпиадыНеБудет
261723935232634880,Fri Oct 26 07:00:23 +0000 2012,Совсем совесть потеряли?!  #ОлимпиадыНеБудет
261722843107184643,Fri Oct 26 06:56:03 +0000 2012,ООО «Энергогруп» настолько приближен к власти?  #ОлимпиадыНеБудет
261721747622084609,Fri Oct 26 06:51:41 +0000 2012,"Что это за место такое для распила бабла, ГК «Олимпстрой» ??  #ОлимпиадыНеБудет"
261720878876876800,Fri Oct 26 06:48:14 +0000 2012,Эта схема до сих пор действует?  #ОлимпиадыНеБудет
261719286500978689,Fri Oct 26 06:41:55 +0000 2012,"#ОлимпиадыНеБудет !, конечно не будет с таким уровнем коррупции"
261718251480961024,Fri Oct 26 06:37:48 +0000 2012,"#ОлимпиадыНеБудет , конечно не будет с таким уровнем коррупции"
261717002333351937,Fri Oct 26 06:32:50 +0000 2012,Почему я не сын чиновника !  #ОлимпиадыНеБудет
261715903857688576,Fri Oct 26 06:28:28 +0000 2012,В отлаженных схемах хищений бюджетных денег тоже бывает сбой…  #ОлимпиадыНеБудет
261714234973515776,Fri Oct 26 06:21:50 +0000 2012,Давайте выпирать уже вороватых! #ОлимпиадыНеБудет ! !
261713286976901120,Fri Oct 26 06:18:04 +0000 2012,Не к добру это всё)  #ОлимпиадыНеБудет
261712074659479552,Fri Oct 26 06:13:15 +0000 2012,"Что это за место такое для распила бабла, ГК «Олимпстрой» ??  #ОлимпиадыНеБудет   Неужели коррупция в России так глупа?  #ОлимпиадыНеБудет"
261711868643655682,Fri Oct 26 06:12:26 +0000 2012,#ОлимпиадыНеБудет  Путин лучше чем проштатовский чертила Навальный или прогрузинский Удальцов
261711686455668736,Fri Oct 26 06:11:43 +0000 2012,"Эх, почему я не сын чиновника… #ОлимпиадыНеБудет !"
261711482444730368,Fri Oct 26 06:10:54 +0000 2012,ООО «Энергогруп» настолько приближен к власти?!  #ОлимпиадыНеБудет
261711352031244288,Fri Oct 26 06:10:23 +0000 2012,такое случится наверное впервые в истории!  #ОлимпиадыНеБудет  http://t.co/ZyLNNs2K
261710059845857281,Fri Oct 26 06:05:15 +0000 2012,"Расстрелять всех, кто виноват в том, что  #ОлимпиадыНеБудет  !"
261709602377314304,Fri Oct 26 06:03:26 +0000 2012,"#ОлимпиадыНеБудет  , это страшно"
261709128022515713,Fri Oct 26 06:01:33 +0000 2012,Совсем совесть потеряли?  #ОлимпиадыНеБудет
261708698173444096,Fri Oct 26 05:59:50 +0000 2012,"Должна олимпада пройти!!! А то заладили,  #ОлимпиадыНеБудет ,  #ОлимпиадыНеБудет"
261708250741895169,Fri Oct 26 05:58:03 +0000 2012,"Мне кажется, или  #ОлимпиадыНеБудет  ?"
261707971581603841,Fri Oct 26 05:56:57 +0000 2012,"#ОлимпиадыНеБудет  , а что, не успеют ничего построить?"
261707654236356608,Fri Oct 26 05:55:41 +0000 2012,"#ОлимпиадыНеБудет , всегда так в нашей стране"
261707213922512897,Fri Oct 26 05:53:56 +0000 2012,"#ОлимпиадыНеБудет , это уже для нас стабильно, необходимо побороть!"
261706875811274752,Fri Oct 26 05:52:36 +0000 2012,роспилу нет рассказал все о распилах Гребневой. Не пропустите)   #ОлимпиадыНеБудет
261706446419394560,Fri Oct 26 05:50:53 +0000 2012,Совсем совесть потеряли?  #ОлимпиадыНеБудет
261704439826620416,Fri Oct 26 05:42:55 +0000 2012,"#ОлимпиадыНеБудет  Надо уже давно не прыщи давить, а саму болезнь эту"
261704180283097089,Fri Oct 26 05:41:53 +0000 2012,Не к добру это всё)  #ОлимпиадыНеБудет
261703978331537408,Fri Oct 26 05:41:05 +0000 2012,Какую любопытную схему описывает автор  #ОлимпиадыНеБудет
261692727949922304,Fri Oct 26 04:56:23 +0000 2012,#ОлимпиадыНеБудет  Где Олимпиада и где Москва. Нихера не понимаю. Связь где?
261692465097109505,Fri Oct 26 04:55:20 +0000 2012,#ОлимпиадыНеБудет  Такие как Удальцов вообще налоги не платит по причине своего революционного маргинальства!!!
261692424089370624,Fri Oct 26 04:55:10 +0000 2012,Я перепугался даже!.  #ОлимпиадыНеБудет
261691637518987264,Fri Oct 26 04:52:03 +0000 2012,Почему я не чиновник?? Ну почему… #ОлимпиадыНеБудет !
261691473723015169,Fri Oct 26 04:51:23 +0000 2012,#ОлимпиадыНеБудет  из-за воровства… Может нам не продлевать мораторий на смертную казнь?
261691268583792640,Fri Oct 26 04:50:35 +0000 2012,"#ОлимпиадыНеБудет , опять распилят наши деньги?"
261691190984986624,Fri Oct 26 04:50:16 +0000 2012,#ОлимпиадыНеБудет  спасибо ворам за это.
261691100715155456,Fri Oct 26 04:49:55 +0000 2012,#ОлимпиадыНеБудет  - разворовано просто все что можно))
261691021086306304,Fri Oct 26 04:49:36 +0000 2012,"Я уверен, что всё пройдет нормально и вороватых чиновников выпрут  #ОлимпиадыНеБудет  http://t.co/JruqHAB9"
261690516045971456,Fri Oct 26 04:47:35 +0000 2012,жажды наживы ломает даже идеальные коррупционные схемы   #ОлимпиадыНеБудет
261690056639672320,Fri Oct 26 04:45:46 +0000 2012,Эта схема до сих пор действует?  #ОлимпиадыНеБудет
261690000503099393,Fri Oct 26 04:45:32 +0000 2012,Какую любопытную схему описывает автор  #ОлимпиадыНеБудет
261689887068139520,Fri Oct 26 04:45:05 +0000 2012,#ОлимпиадыНеБудет ? Я уж испугался!
261689683329822720,Fri Oct 26 04:44:17 +0000 2012,#ОлимпиадыНеБудет ? Я уж испугался!
261689578744868864,Fri Oct 26 04:43:52 +0000 2012,Совсем совесть потеряли?!  #ОлимпиадыНеБудет
261689262821502976,Fri Oct 26 04:42:36 +0000 2012,"не воруй, а то проиграешь)   #ОлимпиадыНеБудет"
261689228851822592,Fri Oct 26 04:42:28 +0000 2012,#ОлимпиадыНеБудет  Желание поживиться сводит человека с ума
261689196387917824,Fri Oct 26 04:42:21 +0000 2012,Почему в России всегда так??? #ОлимпиадыНеБудет !
261689019858038784,Fri Oct 26 04:41:38 +0000 2012,"Неужели,  #ОлимпиадыНеБудет  ? Опять распилят наши деньги?"
261688695634137089,Fri Oct 26 04:40:21 +0000 2012,"С ЧМ 2018 надеюсь справятся, а пока  #ОлимпиадыНеБудет"
261688657688285184,Fri Oct 26 04:40:12 +0000 2012,#ОлимпиадыНеБудет  хотелось бы объяснений по этому поводу услышать
261688543116668928,Fri Oct 26 04:39:45 +0000 2012,Моносов  успел поработать в ГК «Олимпстрой»  #ОлимпиадыНеБудет
261688235061825536,Fri Oct 26 04:38:31 +0000 2012,"Воруют и не краснеют, суки.  #ОлимпиадыНеБудет"
261688202857959425,Fri Oct 26 04:38:24 +0000 2012,"Гребнева, ты допилилась   #ОлимпиадыНеБудет"
261688061665083392,Fri Oct 26 04:37:50 +0000 2012,Гребнева — коррупционерка! Пусть все знают   #ОлимпиадыНеБудет
261687977342816256,Fri Oct 26 04:37:30 +0000 2012,Очень любопытная статья -  #ОлимпиадыНеБудет
261687490728034305,Fri Oct 26 04:35:34 +0000 2012,"Что это за место такое для распила бабла, ГК «Олимпстрой»?!  #ОлимпиадыНеБудет"
261687326428782592,Fri Oct 26 04:34:55 +0000 2012,"В строительстве принимало участие ОАО «Концерн «Монарх», возглавляемое на тот момент Гребневой М.Е. Любопытно…  #ОлимпиадыНеБудет"
261687264139161600,Fri Oct 26 04:34:40 +0000 2012,"Поговаривают, что  #ОлимпиадыНеБудет  !"
261686935553208323,Fri Oct 26 04:33:22 +0000 2012,"#ОлимпиадыНеБудет !, не зря, не зря народ шутит…"
