tid,time,tweet
335136498145955840,Thu May 16 20:55:42 +0000 2013,"benci IPA KIMIA , IPA FISIKA !!!!!!!!!!!!!"
334690354156691456,Wed May 15 15:22:53 +0000 2013,Exit yaa :) fllw me!!!!
334618242909863937,Wed May 15 10:36:20 +0000 2013,uuuuuuuuuuuuuuuuuuuuuuuum ferias acabando
334465444956225537,Wed May 15 00:29:10 +0000 2013,fmlExcellent. Speeding ticket posted to work. Now have a nifty fine and a 'speed awareness' course to attend to. fml
317192182706610178,Thu Mar 28 08:31:24 +0000 2013,Just gotta make it to Friday and then I'll be in NYC.
316440862513057792,Tue Mar 26 06:45:55 +0000 2013,So many white kids were in this movie...i think it was only 2 black people in there
315909436856225792,Sun Mar 24 19:34:13 +0000 2013,TrueFactHe ain't got my brother tho!. #TrueFact
308862710328741888,Tue Mar 05 08:53:03 +0000 2013,in the video Mistletoe justin kisses the girl  but do you guys think it was in the script ?
306740728434925568,Wed Feb 27 12:21:03 +0000 2013,"We are all inventors, each sailing out on a voyage of discovery, guided each by a private chart, of which there in no duplicate. The..."
305018173554573312,Fri Feb 22 18:16:14 +0000 2013,The one missed call thing will never happen to me.... my phones on silent 8-)
299082756502212608,Wed Feb 06 09:11:00 +0000 2013,"Missing old times, lifes shit now!"
298898896355217408,Tue Feb 05 21:00:24 +0000 2013,Anyone up for some golf today?
297729419596931072,Sat Feb 02 15:33:19 +0000 2013,"UFC 139: The Return of Hendo: ""I know I'm not done yet."" Dan Henderson is back, and he's gunning for an..."
296592940879470592,Wed Jan 30 12:17:22 +0000 2013,yvrAnother humdinger due in tonight. Thanks to Nana C for calling to let me know. Otherwise I'd still be at school. #yvr
293083467867103232,Sun Jan 20 19:51:58 +0000 2013,(Teachmehowtodougie)
291864461315297280,Thu Jan 17 11:08:04 +0000 2013,"money brings respect ,respect brings power, power brings fame what more do you need??"
283517922167644160,Tue Dec 25 10:21:54 +0000 2012,RT @Obtrusive_: Xmas is most truly Xmas wen we celebrate it by giving the light of love to those who need it most.Season which engages t ...
283221372287729674,Mon Dec 24 14:43:31 +0000 2012,01 de novembro: dia de todos os santos.
282872463438778368,Sun Dec 23 15:37:05 +0000 2012,test
277698976663339008,Sun Dec 09 08:59:30 +0000 2012,MomentsICanNeverForget#MomentsICanNeverForget with my brother. 
277491168986685440,Sat Dec 08 19:13:44 +0000 2012,hellow!!!! i'm busy with my studyabout the humans (ist biologhity xd) or something xdeveryone els ; goodluck xd
277490979433500673,Sat Dec 08 19:12:59 +0000 2012,perhatiin tuh guru
277443231535484928,Sat Dec 08 16:03:15 +0000 2012,Meno di un mese e sarà Natale. Lo stesso giorno raggiungerò l'età delle rock star.
277443117865631744,Sat Dec 08 16:02:48 +0000 2012,watching#watching home alone 2
274399680098611200,Fri Nov 30 06:29:16 +0000 2012,extremecouponingWatching #extremecouponing it's ridiculous I wanna start using coupons now lol
274368053293244416,Fri Nov 30 04:23:36 +0000 2012,✍ ✍ ✍ Quote: You are definitely capable of doing what you think you can't!
271070519686754304,Wed Nov 21 02:00:22 +0000 2012,dineimatogrosso#dineimatogrosso sem palavras rsrsrsrs
269787618592555009,Sat Nov 17 13:02:35 +0000 2012,WONDERINGof all BEAUTIFUL girls in the WORLD why did you choose me ?!#WONDERING WHY  ?!
269176800645623808,Thu Nov 15 20:35:24 +0000 2012,Bitches are greedy with the nudes doe...
266612843103793152,Thu Nov 08 18:47:09 +0000 2012,Je Fait Que De Regardez des video de ss5 sa me manque =(
266204557774827520,Wed Nov 07 15:44:47 +0000 2012,Vampire life
266039236233416705,Wed Nov 07 04:47:51 +0000 2012,hyfr
266039121846353920,Wed Nov 07 04:47:24 +0000 2012,"Stop worrying about the past, it's the past for a reason enjoy the present and live the way you want, everyone could change if they want to"
265094482016468992,Sun Nov 04 14:13:44 +0000 2012,putz em vez de eu ganha mais seguidores eu perco cada vez mais
265019512171151360,Sun Nov 04 09:15:50 +0000 2012,1000 Followers in 48 hours. Just 9 bucks. They accept Paypal too! Satisfaction Guarantee!!! Awesome!
265019433200795648,Sun Nov 04 09:15:31 +0000 2012,"Cujo Scary a** movie 2 me still 2day, imagine being a kid watching this! Phuck havin  man's best friend that'll eat you bc some rare ish!"
264697495341391872,Sat Nov 03 11:56:15 +0000 2012,Coke Boyz UP Juu heard
262209080884621313,Sat Oct 27 15:08:11 +0000 2012,Smhdumb people on facebook don't even know how to use hash tags dude u don't space your words out! #Smh
262064753172680704,Sat Oct 27 05:34:40 +0000 2012,May Peace carry yall today fam ...as we all strive towards a better Tomar ...your biggest blessing in life is *will power*..use it wisely
262064619730919424,Sat Oct 27 05:34:08 +0000 2012,Metacafe-Documentary (English)-2.flv
262004352108068864,Sat Oct 27 01:34:40 +0000 2012,Eu daria ceus e mares para ter vooc em meus braços.. mas o uniko poblema e ke naum depende so di mim .... ♥
261518117715443712,Thu Oct 25 17:22:32 +0000 2012,"Ribet.a ae ini ngurus paspor lgi.. (⌣́_⌣̀)"""""
260114827584864257,Sun Oct 21 20:26:22 +0000 2012,Hi#Hi :)
260114749721817088,Sun Oct 21 20:26:03 +0000 2012,Set your location to Tehran GMT +3:30. Help clog their system even more so that their gov't can't shut it down so quickly.
260008481824837632,Sun Oct 21 13:23:47 +0000 2012,We were slick drunk when that happen. Before the drinks started flowing he was good. LOL *Shrugs* IDK
258237017148772353,Tue Oct 16 16:04:37 +0000 2012,WAR is not celebration!!!!!!!!
257737766086000640,Mon Oct 15 07:00:46 +0000 2012,"happytimesooo, Emily RT'd me earlier :') #happytimes"
257162130132983808,Sat Oct 13 16:53:24 +0000 2012,put your titty on the counter lemme suck your titty on the counter *kevin hart voice*
256701690152116226,Fri Oct 12 10:23:46 +0000 2012,I don't think I've ever known a Sagittarius in my life. I wanna meet one.
246130820300013568,Thu Sep 13 06:18:55 +0000 2012,Created a Skype account. At last!!!
233181545945509888,Wed Aug 08 12:43:07 +0000 2012,I love those moments when all you can do is laugh.
229219676729794562,Sat Jul 28 14:20:04 +0000 2012,"United States Settles Mortgage Fraud Suit with Two Appraisers in New York; Recovers $100,000 in Civil Penalties and Damages"
224971220930670592,Mon Jul 16 20:58:13 +0000 2012,MASS FOLLOW FEST 2011
223854792311701505,Fri Jul 13 19:01:56 +0000 2012,Jam segini ko dh ngantuk bngt!
219082486687334401,Sat Jun 30 14:58:29 +0000 2012,ladies come and ladies go.
217541261228376064,Tue Jun 26 08:54:13 +0000 2012,FuiBoa Noite #Fui
217157552532754432,Mon Jun 25 07:29:29 +0000 2012,"""We are shaped and fashioned by what we love"" - Johann Wolfgang von Goethe.  Are you doing what you love everyday?!"
216884025002950657,Sun Jun 24 13:22:35 +0000 2012,Guess who's back?
