tid,time,tweet
335196758869164032,Fri May 17 00:55:09 +0000 2013,☆☆☆☆☆
334597144008851456,Wed May 15 09:12:30 +0000 2013,a job is the blessing....work is the hassle
334503951300980736,Wed May 15 03:02:11 +0000 2013,"""Growth is the only evidence of life.""     John Henry Newman"
334480288811978753,Wed May 15 01:28:09 +0000 2013,1.223 seguidores eeeeee
334455329150603264,Tue May 14 23:48:59 +0000 2013,i want to file dispute on the undelivered service
334433524910280704,Tue May 14 22:22:20 +0000 2013,Thanks to all my recent Likes! Welcome in...feel free to share!
332648187657592832,Fri May 10 00:08:02 +0000 2013,REAL TALK IF NIGGAS AINT TALKIN SERIOUS BUSINESS THEN DONT ASK ME TO SEND BEATS
330323256311697408,Fri May 03 14:09:36 +0000 2013,Me so tempted to follow a lot a lot of people!!!!!
325787732678963200,Sun Apr 21 01:47:02 +0000 2013,Hello to all my new followers :-)
315907407333167104,Sun Mar 24 19:26:09 +0000 2013,"VERO MODA JUMPER, H&amp;M PANTS"
309577642443685888,Thu Mar 07 08:13:56 +0000 2013,that awkward moment when someone mistakes you for a store employee.
306738602489049089,Wed Feb 27 12:12:36 +0000 2013,Hay Dios ahora me toca hacer voz de señora grande :s en que me metí?? jajajajajaajajaja
305961096374784000,Mon Feb 25 08:43:04 +0000 2013,Just gotta make it to Friday and then I'll be in NYC.
300308416327479296,Sat Feb 09 18:21:20 +0000 2013,If God was supposedly resurrected...does that make him a zombie?
299076526064926720,Wed Feb 06 08:46:15 +0000 2013,"For every quarrel a man and wife have before others, they have a hundred when alone."
298514193575976960,Mon Feb 04 19:31:44 +0000 2013,I'll be at the airport today...
297185970049146881,Fri Feb 01 03:33:51 +0000 2013,Wasuhp ?
296747240255541248,Wed Jan 30 22:30:30 +0000 2013,acabei  de  chegar  do  trampo
296066241389527040,Tue Jan 29 01:24:27 +0000 2013,this shit sucks
283873443626225664,Wed Dec 26 09:54:37 +0000 2012,im gettin ready :)
283852970901258240,Wed Dec 26 08:33:16 +0000 2012,"Up at SFU, that is not a road for old nerd spines."
283702970267357184,Tue Dec 25 22:37:13 +0000 2012,"Crazy day today! Gym, fitting, then production meetings!!! super stoked!!"
283562225275375616,Tue Dec 25 13:17:57 +0000 2012,imacelebritySeeing a live cockroach fly out of Fatima's nose was so so so wrong!! I feel nauseous!! #imacelebrity
283524680663576576,Tue Dec 25 10:48:46 +0000 2012,RT @Obtrusive_: Xmas is most truly Xmas wen we celebrate it by giving the light of love to those who need it most.Season which engages t ...
283524479899021312,Tue Dec 25 10:47:58 +0000 2012,want zoe to come over
283151201837670400,Mon Dec 24 10:04:41 +0000 2012,There isn't a person anywhere who isn't capable of doing more than he thinks he can. Henry Ford
281353806518833152,Wed Dec 19 11:02:29 +0000 2012,"Watching8Mile""Come on men it's Saturday, i can get straight with the lord on Sunday"" #Watching8Mile"
278850570889093120,Wed Dec 12 13:15:31 +0000 2012,gooooodevening#gooooodevening!
277481798911533057,Sat Dec 08 18:36:30 +0000 2012,Easy like Sunday Evening :)!
277481664773513216,Sat Dec 08 18:35:58 +0000 2012,You know which team Toronto is behind! Team Jacob!
277435755998109696,Sat Dec 08 15:33:33 +0000 2012,Life itself is the most wonderful fairy tale. -Hans Christian Andersen
277186030090731520,Fri Dec 07 23:01:14 +0000 2012,La gente amargada me arrecha u.u
275877815482732544,Tue Dec 04 08:22:51 +0000 2012,Çok sıkılıyordum kuzenime geldim &lt;3
274366342306611200,Fri Nov 30 04:16:48 +0000 2012,"""Forgiving is letting go of the hope that it could have been any different, accepting it for what it was and being willing to move..."
274366237268660224,Fri Nov 30 04:16:23 +0000 2012,THE TRUTH HURTS BUT LIES ARE WORSE
273416187902324736,Tue Nov 27 13:21:13 +0000 2012,where tf u think im at ? im half way fukn home
272021480236273665,Fri Nov 23 16:59:09 +0000 2012,"mtgworldsLol, Conley had a pretty good opening hand. #mtgworlds"
269784138343657472,Sat Nov 17 12:48:45 +0000 2012,Expedia is migrating 100% to the Cloud - creating 6-7 localized sites per year. The Cloud helps with the speed needed.
269332916692205569,Fri Nov 16 06:55:45 +0000 2012,New Years Day Cuming Up!!!
269174167016980483,Thu Nov 15 20:24:57 +0000 2012,LifeQuote#LifeQuote People who pretend to be someone else never really no life
268692261884280833,Wed Nov 14 12:30:01 +0000 2012,Salam Kenal nie baru di sini saya hahaha bagi info tentang admin nya donk dan kapan IHP bisa berkunjung ke palembang siapa tau hahaah !
268692184268693504,Wed Nov 14 12:29:43 +0000 2012,"Граф Дракула так набухался, что поехал с друзьями встречать рассвет."
267281001347153920,Sat Nov 10 15:02:11 +0000 2012,am hungry
266609765701005312,Thu Nov 08 18:34:56 +0000 2012,I neglect facebook and my personal twitter because this account exceeds both of those. Too bad NO ONE LIKES ME.
266037402831826944,Wed Nov 07 04:40:34 +0000 2012,Blind niggas fuck ppl up smh
262491181924110336,Sun Oct 28 09:49:09 +0000 2012,Not sure why I am still up. Looonnggg weekend; need rest
262063778756169728,Sat Oct 27 05:30:48 +0000 2012,Mane FWM
261807968201347072,Fri Oct 26 12:34:18 +0000 2012,DESIREE DEL VALLE - galing mu talaga maging kabit! :D sana d ka ganyan in reality.
261135968952782848,Wed Oct 24 16:04:01 +0000 2012,"caracaaa anos que não entro aqui kkk. "" tenho que entrar mais veses kkk'.:D"
258770887556362240,Thu Oct 18 03:26:01 +0000 2012,"Friday's almost over, Getting down to the weekend:D"
258770831063257089,Thu Oct 18 03:25:48 +0000 2012,FloridaWantsCody ;D
258235963036295168,Tue Oct 16 16:00:26 +0000 2012,LAHS workshop was dope...now heading to this drumming workshop...
258235870237310976,Tue Oct 16 16:00:03 +0000 2012,Cet après-midi je vais jouer a un loto avec une de mes Meilleures Amies je sais pas pourquoi mais je vais rien gagner comme d'habitude !
257736493748068352,Mon Oct 15 06:55:43 +0000 2012,"sempre que lembro de fazer uma coisa, passa 1 segundo... e juro! q n lembro mais -.- só dps de muuuito tempo eu volto a lembrar .."
256555094047354881,Fri Oct 12 00:41:15 +0000 2012,"OMG, i love my background."
248671086156333057,Thu Sep 20 06:33:01 +0000 2012,"He said ""coach i got a cramp in both legs"" haaahaaahaa"
247634896376442880,Mon Sep 17 09:55:34 +0000 2012,Mais um lindo dia de chuva!!!!
239195803044962306,Sat Aug 25 03:01:38 +0000 2012,i got a sign on my dick that says bad bitches only
231804996121919488,Sat Aug 04 17:33:12 +0000 2012,hhahahahhahah!!!!!!!!!!!!!!!!!!!!
223854064079867907,Fri Jul 13 18:59:02 +0000 2012,"Comissões de Ética no Brasil tem a mesma importância dos Ministérios da Marinha do Paraguai, da Bolívia, Moçambique e do Afeganistão."
223176255917400064,Wed Jul 11 22:05:40 +0000 2012,C'MON 21st Century Beetle...we're waiting on a truck full. Excited about the next round of Beetle-mania!!!!!
220349344493211648,Wed Jul 04 02:52:32 +0000 2012,Its hot as sssshhhhiiiitttt outside.
219999696637267969,Tue Jul 03 03:43:09 +0000 2012,im dumping my bf for jb
218279075163283456,Thu Jun 28 09:46:01 +0000 2012,watching five heart beats dont u miss the old times
217157008086937600,Mon Jun 25 07:27:19 +0000 2012,uma boa noite e um ótimo fin de semana pra todos...!
216883416329752576,Sun Jun 24 13:20:10 +0000 2012,Its something about her most people can't see but I could There's more then ha smile and laugh &lt;33 Magical
