tid,time,tweet
335199671427416064,Fri May 17 01:06:44 +0000 2013,WearSomeClothesOutI'm clearly having difficulties with remembering its winter.. WearSomeClothesOut
335179137729835008,Thu May 16 23:45:08 +0000 2013,up early puttin in work
335103310426169344,Thu May 16 18:43:49 +0000 2013,baby tonight falling in love jijijiji :)
334631243255791616,Wed May 15 11:28:00 +0000 2013,To love yourself is the beginning of a lifelong affair!An Ideal Husband
334610777644343296,Wed May 15 10:06:40 +0000 2013,Ngeliatin anak sebelah maen
334590714748997632,Wed May 15 08:46:57 +0000 2013,Angels deliver Fate to our doorstep - and anywhere else it is needed. ~Jessi Lane Adams
319078026858070016,Tue Apr 02 13:25:04 +0000 2013,"“If you’re passionate about what it is you do, then you’re going to be looking for everything you can to get better at it.” ~ Jack Canfield"
310516245055295488,Sat Mar 09 22:23:36 +0000 2013,*terjun dari lantai 13*
309529300963573760,Thu Mar 07 05:01:50 +0000 2013,lol u jus hating cuz i can get yo bitch !
305006906060177409,Fri Feb 22 17:31:27 +0000 2013,waiting for the C7 from Globe
304050182608257024,Wed Feb 20 02:09:47 +0000 2013,Get your business to grow by using social media. Call 469-248-0616 to schedule a free 15 min consultation.
304050032154386433,Wed Feb 20 02:09:11 +0000 2013,off to a Production Meeting see you later twitter followers xxx
299356745682272256,Thu Feb 07 03:19:44 +0000 2013,i wanna go to America...
299332172429553664,Thu Feb 07 01:42:05 +0000 2013,ThatsJustMeI think attitude is everything #ThatsJustMe
297221043481882624,Fri Feb 01 05:53:13 +0000 2013,allineed#allineed is u !sana maging tau ult !!
296772705347317761,Thu Jan 31 00:11:41 +0000 2013,"""Laziness is a secret ingredient that goes into failure. But it's only kept a secret from the person who fails"".Robert Half"
295822217307111424,Mon Jan 28 09:14:47 +0000 2013,"happy fall: A time for letting go, inhaling inspiration by nourishing your lungs, a fall organ like the large intestine for assimilation!"
291200890357047298,Tue Jan 15 15:11:17 +0000 2013,DiaDoMusicoFeliz #DiaDoMusico
289715790746382336,Fri Jan 11 12:50:01 +0000 2013,"I.. bem, falsidade não leva a nada, para com isso ;S"
283677316184420352,Tue Dec 25 20:55:17 +0000 2012,oieee GENTE !!! educados respondem !! hihihi
283534562200522752,Tue Dec 25 11:28:02 +0000 2012,Just joined twitter!
283511527498194945,Tue Dec 25 09:56:30 +0000 2012,I h8 to watch BWEN dump shares this way it is wrong IMO BUY SHKZ NOW u will thank me
280106009580666881,Sun Dec 16 00:24:11 +0000 2012,algunos no se acuerdan de todo lo que has hecho por ellos....
277483963491172353,Sat Dec 08 18:45:06 +0000 2012,RT @JMHHACKER: Free E Cigarette Starter Kits here - http://t.co/KittuNxw
273924873083047938,Wed Nov 28 23:02:33 +0000 2012,"If love is blind, why is lingerie so popular?"
271684268260986880,Thu Nov 22 18:39:11 +0000 2012,karmaEl #karma te acaba siempre atrapando.
268692589748826113,Wed Nov 14 12:31:20 +0000 2012,I'm up at Camp Miller with SP...
268692484559876096,Wed Nov 14 12:30:55 +0000 2012,InAGuysMindThem ass in dem jeans make a nigga wanna sing like keith sweet to u girl... Well at least till after I smash #InAGuysMind
268611320499277825,Wed Nov 14 07:08:24 +0000 2012,"Além de cantora , compositoooora aos poucos !"
266609893576953856,Thu Nov 08 18:35:26 +0000 2012,I'm sooo sleepy ! Defitnately taking a nap when i get to the room .
266036916472934402,Wed Nov 07 04:38:38 +0000 2012,I don't think I've ever known a Sagittarius in my life. I wanna meet one.
264607739928514560,Sat Nov 03 05:59:36 +0000 2012,twitteroff#twitteroff thal pra quem fica ^^
261516426282680320,Thu Oct 25 17:15:49 +0000 2012,On the road to Arizona. :)
260704200219033601,Tue Oct 23 11:28:19 +0000 2012,NowThatImOlderArabPains#NowThatImOlder all my parents talk about is how they raised me and whatever I DO is just ungrateful. #ArabPains
260112851228819456,Sun Oct 21 20:18:31 +0000 2012,nice naman ^^ may twitter na ko yehey!!!
259127359888818176,Fri Oct 19 03:02:31 +0000 2012,xau intaõ
258770185299836931,Thu Oct 18 03:23:14 +0000 2012,teddy said it was a hat so i put it on now dad is saying where the heck did the toliet plunger go?
258235670244519936,Tue Oct 16 15:59:16 +0000 2012,U got punk'd! Lol!
257736210435420160,Mon Oct 15 06:54:35 +0000 2012,I finished a super nice blue cape for a nice young lady yesterday.  Today I am finishing a denim handbag.
252193151639511040,Sat Sep 29 23:48:27 +0000 2012,GOODMORNING
252192926883532800,Sat Sep 29 23:47:33 +0000 2012,Ig im Not on my bf Hitlist nomore.
250705491687272448,Tue Sep 25 21:17:01 +0000 2012,Judas!♥
249148150667960320,Fri Sep 21 14:08:42 +0000 2012,NowPlaying#NowPlaying Luther Vandross - Dance with my father
243492984551768065,Wed Sep 05 23:37:06 +0000 2012,sucksFalling in love in hopeless places... #sucks
240520793153474561,Tue Aug 28 18:46:40 +0000 2012,waking up at 2 in the afternoon has become a routine for me
234268355375284224,Sat Aug 11 12:41:43 +0000 2012,ReplaceMichaelJacksonSongsWithDonut#ReplaceMichaelJacksonSongsWithDonut Who Is Donut
232822157367971840,Tue Aug 07 12:55:02 +0000 2012,dünyada kimseye güvenme çünkü beyaz gülün gölgesi bile siyahtır:)
227438767777132544,Mon Jul 23 16:23:22 +0000 2012,Great is your mercy towards me Jesus.
225936803100774403,Thu Jul 19 12:55:06 +0000 2012,ideservethebestUp early jus thinking #ideservethebest$
223176069514141697,Wed Jul 11 22:04:56 +0000 2012,fa la la
219861186106236928,Mon Jul 02 18:32:46 +0000 2012,MondaynightAnyone have any expectation for tonights Monday Night Football game? #Mondaynight
216883308448071680,Sun Jun 24 13:19:44 +0000 2012,(via erotisan) Step 1: Webfolio set-up. Click on Settings and select the Webfolio Tab and enter your details then update About You.
216883282653093888,Sun Jun 24 13:19:38 +0000 2012,イケメンが着るスーツはかっこいい
