tid,time,tweet
335197898545434624,Fri May 17 00:59:41 +0000 2013,Me voy a poner a buscar a los panas que sigo y que no me siguen los muy ratas!
335130440832790528,Thu May 16 20:31:38 +0000 2013,"im in dat old skool, but its brand new"
334618113876295680,Wed May 15 10:35:49 +0000 2013,"Se o final valer a pena, o caminho nem importa :)"
325676763613126656,Sat Apr 20 18:26:05 +0000 2013,"JFBorang baru nihh,,OPENFOLLOW dlu,,,JFB nya tepatin yahh,,yg liat *b dunk,,,thx^^"
320094179655045120,Fri Apr 05 08:42:54 +0000 2013,npnp Rocko - Gift of Gab
311851770441773056,Wed Mar 13 14:50:30 +0000 2013,forget regret or life is yours to miss..
310591831471693824,Sun Mar 10 03:23:57 +0000 2013,://www.dailymotion.com/video/xy1knm_crysis-3-download-crysis-3-pc-reloaded-crack-new-clean-mediafire-updated_videogames#.UTuI9CYgRJm.twitter
305013240520392704,Fri Feb 22 17:56:38 +0000 2013,first day
304042992501678081,Wed Feb 20 01:41:12 +0000 2013,RIP GARY SPEED. Shocking!
304042836947501056,Wed Feb 20 01:40:35 +0000 2013,Well bed time for me lol even tho its 6AM and i should be getting up to clean well DM me if i should just stay up to clean dont Dm if i  ...
298901581125005312,Tue Feb 05 21:11:04 +0000 2013,RTSe vooc odeia corta o cabelo da #RT
296809677604409345,Thu Jan 31 02:38:36 +0000 2013,RT @TopUSNewsToday: How can you ReTweet your message 1000 times? It's easy http://t.co/zODoAGuj Order and watch 1000 people promote you. ...
296807516598325248,Thu Jan 31 02:30:01 +0000 2013,Hope u haven a great day.
291832339271675904,Thu Jan 17 09:00:26 +0000 2013,massive action equals massive results
291223400435818496,Tue Jan 15 16:40:43 +0000 2013,+5000 L Z3 for 98.8
288914442060718080,Wed Jan 09 07:45:45 +0000 2013,ThinkinBoutYou#ThinkinBoutYou
283748833542938625,Wed Dec 26 01:39:28 +0000 2012,Just woke up
283680234237227008,Tue Dec 25 21:06:53 +0000 2012,Waiting patiently for the new hot water tank! Bye bye cold showers :)
283565564482449408,Tue Dec 25 13:31:13 +0000 2012,RT @Obtrusive_: Xmas is most truly Xmas wen we celebrate it by giving the light of love to those who need it most.Season which engages t ...
283154346164756480,Mon Dec 24 10:17:11 +0000 2012,Now She Hood By Association Lol Just Because Your Bestfriend Is Hood Doesn't Make You Hood Just Be Yourself
282515961561616384,Sat Dec 22 16:00:28 +0000 2012,Headache!
279912005316521984,Sat Dec 15 11:33:17 +0000 2012,Come on Monsters. Buy Marry The Night on iTunes. We can't let it flop. :(
277490512494202880,Sat Dec 08 19:11:08 +0000 2012,jst woke up n im feelin intense hunger already...
275552673837748224,Mon Dec 03 10:50:51 +0000 2012,im me
274368623039090688,Fri Nov 30 04:25:51 +0000 2012,GrrEnvie de tuer Twitter qui veut pas changer mon icone ! #Grr
274368541430534144,Fri Nov 30 04:25:32 +0000 2012,I'LL NEVER LET YOU GOOOO
273418055437139968,Tue Nov 27 13:28:38 +0000 2012,oba eu vou monta uma arvore de natal
272603374401253377,Sun Nov 25 07:31:23 +0000 2012,my life is shining
271685655237623808,Thu Nov 22 18:44:42 +0000 2012,oq eu faço ? oq eu digo ? oq eu sigo ?
271069740787716096,Wed Nov 21 01:57:17 +0000 2012,昨日の歌謡祭めっちゃ豪華
269786485367123968,Sat Nov 17 12:58:05 +0000 2012,Oh j'ai oublié!!!!
268714260996182016,Wed Nov 14 13:57:26 +0000 2012,We'd like to thank the cast and crew and especially Bryan Adams for their video shoot at Arcadia this weekend
268612097963876353,Wed Nov 14 07:11:29 +0000 2012,Whoa there
266611043759947776,Thu Nov 08 18:40:00 +0000 2012,"Aie Nouvelles chorées.trop bon! pur moment! bravo à vous et continuez comme çà,à nous faire partager votre dynamisme votre bonne humeur ."
266039826917236738,Wed Nov 07 04:50:12 +0000 2012,Time to put some bacon in the oven so can just reheat in the am.
264875297562824704,Sat Nov 03 23:42:46 +0000 2012,"Cuando nos da sueño y estamos en el chat, nos sentimos en una pelicula de Freddy Krueger, con episodios de microsueño pero jamas dormirnos"
264610755410792448,Sat Nov 03 06:11:34 +0000 2012,She Fu Af'
262848954725699585,Mon Oct 29 09:30:48 +0000 2012,"Vo durmii, Amanha o dia é longo... boa noit pssoall =D"
262492650085683200,Sun Oct 28 09:54:59 +0000 2012,brokeasshitWhen you have to check all your bank accounts to make sure you can buy $10 worth of gas you know your #brokeasshit
262209118595604480,Sat Oct 27 15:08:20 +0000 2012,Runners-up one-liners are one-liners that did not make it to the TOP 100
262063929176502272,Sat Oct 27 05:31:24 +0000 2012,Gw ikhlas kok
261808691798482944,Fri Oct 26 12:37:10 +0000 2012,this week needs to end
261517850341154816,Thu Oct 25 17:21:28 +0000 2012,Nw#Nw Casino
261171034491871233,Wed Oct 24 18:23:21 +0000 2012,funtimesEveryday at paulrevere #funtimes
261170795802402817,Wed Oct 24 18:22:24 +0000 2012,Metade da turma vendo filme
261137133811679232,Wed Oct 24 16:08:39 +0000 2012,"That awkward moment when you say ""Goodbye!"" to someone but you both walk off in the same direction."
260705745027358720,Tue Oct 23 11:34:27 +0000 2012,"""Life is short, live bold! Be heard, be you, dream big, take risks, don’t wait, Decide today to live the way you want to live it."""
258772365780058112,Thu Oct 18 03:31:54 +0000 2012,"wehappyIf you make someone happy today, you also make him happy twenty years from now, when he remembered the incident.#wehappy"
257737680526381056,Mon Oct 15 07:00:26 +0000 2012,BathFlow#BathFlow already done happy boy :-)
257737604655640576,Mon Oct 15 07:00:08 +0000 2012,xSOWith the games with you play you'll always win. #xSO
257161769313775616,Sat Oct 13 16:51:58 +0000 2012,a vida só e dura pra quem é mole ... kkk'
256791059655454721,Fri Oct 12 16:18:54 +0000 2012,Oprah Winfrey and Elvis Presley are distant cousins.
256117997939343360,Wed Oct 10 19:44:23 +0000 2012,biarpun makan memori yg penting film Digimon gw lengkap...
256117915454164992,Wed Oct 10 19:44:04 +0000 2012,ThatsWhyYouAreLonelyYou push away all of the people that love you the most #ThatsWhyYouAreLonely
252656819250532352,Mon Oct 01 06:30:54 +0000 2012,わたしの白血球が戦っているなう。
251576397091454976,Fri Sep 28 06:57:41 +0000 2012,sangsi gw itu park tae jun asli huhuhu.Dasar rp gk mutu !
249414631691538432,Sat Sep 22 07:47:36 +0000 2012,“Don’t take the casual approach to life. Casualness leads to casualties.” —Jim Rohn
246130514350723072,Thu Sep 13 06:17:42 +0000 2012,thanksgivingWhat are you thankful for this week? #thanksgiving
239838206957338624,Sun Aug 26 21:34:19 +0000 2012,NP#NP Lenka - Heart Skips A Beat
232510730627317760,Mon Aug 06 16:17:32 +0000 2012,y seran muchos mas bb
229499413050040320,Sun Jul 29 08:51:38 +0000 2012,seomarketingMy Profile at getmyrank - the place to Buy and Sell SEO Services #seo #marketing
227250466713636864,Mon Jul 23 03:55:08 +0000 2012,RealTalkJackie Christie Pleeeeeeaase get your hormones checked....#RealTalk
222986265627336704,Wed Jul 11 09:30:43 +0000 2012,“In dreams and in love there are no impossibilities.”
222499449933545475,Tue Jul 10 01:16:17 +0000 2012,Bom Diaa
220944080958537728,Thu Jul 05 18:15:48 +0000 2012,Im going to bed
217600219058143233,Tue Jun 26 12:48:29 +0000 2012,I need a break! Coffee party :)
217541122925400064,Tue Jun 26 08:53:40 +0000 2012,Playing Britney Spears 'I wanna Go' nonstop....
