tid,time,tweet
324588445924212737,Wed Apr 17 18:21:30 +0000 2013,The success of every recipe is a 'secret ingredient' !
318850531835670529,Mon Apr 01 22:21:05 +0000 2013,"Im a soldier to my own emptiness, iim a winner"
315238354226671617,Fri Mar 22 23:07:35 +0000 2013,Hating people is like burning down your house to get rid of a rat
315238181849149440,Fri Mar 22 23:06:54 +0000 2013,twowordstomyex#twowordstomyex fuck you !
311937246414655489,Wed Mar 13 20:30:09 +0000 2013,saindo aqui amores bbj ;*
309019165698695168,Tue Mar 05 19:14:45 +0000 2013,sai
305595828972683264,Sun Feb 24 08:31:37 +0000 2013,I WANT THE ANOTHER ROOM in Ellie's game!! Aaa I sound like more scared than the first one.
305595755215847424,Sun Feb 24 08:31:20 +0000 2013,"Sebelum UAS gue udah gila duluan gara2 ngerjain remed KIMIA yang soalnya ternyata lebih SUSAH! u,u"
298097356501565441,Sun Feb 03 15:55:22 +0000 2013,teamfollowbackautofollowbackfollowngainThank you for following me ! #teamfollowback #autofollowback #followngain
283902137539387392,Wed Dec 26 11:48:38 +0000 2012,I hate my mom being around.
280805021648580608,Mon Dec 17 22:41:48 +0000 2012,31 takipçi fjkhdsgısgfdsgkydfgdffdhdfhgdhf
280198690436698112,Sun Dec 16 06:32:28 +0000 2012,"Hello December,make my wishes come true &lt;3"
278663356745916417,Wed Dec 12 00:51:36 +0000 2012,"ack...i have to go all, almost home cookie!  Have a great night!"
278377887344754688,Tue Dec 11 05:57:15 +0000 2012,"losing with one thing, but gaining in another :)"
278377772362133504,Tue Dec 11 05:56:47 +0000 2012,klasikyalan#klasikyalan Hocam Çok Şıksınız :)
278013688965918720,Mon Dec 10 05:50:03 +0000 2012,Back to bed then.
276607704410247169,Thu Dec 06 08:43:10 +0000 2012,S ekumpulan M anusia  A lay S ukanya H omo
274569218559713280,Fri Nov 30 17:42:57 +0000 2012,"Off to rehearsals with my gorgeous band mates, will check you later peoples, have a brilliant evening :) xx"
272266338674810882,Sat Nov 24 09:12:08 +0000 2012,Sleepy as a bitch
271524401311268864,Thu Nov 22 08:03:56 +0000 2012,new bio! look!
271194913268461568,Wed Nov 21 10:14:40 +0000 2012,ambassadorWe hope everyone has a great Thanksgiving with family and friends. Next year we will all be able to enjoy #ambassador wine
270173513065852928,Sun Nov 18 14:35:59 +0000 2012,boom tarat tarat boom tarat tarat tararat tararat boom tarat tarat......wahahahahahaahahhahah
269524737095499776,Fri Nov 16 19:37:59 +0000 2012,Berharap besok ada keajaiban :)
268977892208287744,Thu Nov 15 07:25:01 +0000 2012,bitchfatassThis #bitch need to bring her #fatass on now damn.... I'm mad as hell right now &gt;:(
268300801691246592,Tue Nov 13 10:34:30 +0000 2012,27 тысяч ну где взять а
267425496453742592,Sun Nov 11 00:36:21 +0000 2012,omghello mail #omg
266750440929099776,Fri Nov 09 03:53:55 +0000 2012,Just showered for the first time in five days. Found the most interesting things in the crevasses.
266726044625678336,Fri Nov 09 02:16:59 +0000 2012,TeamfollowbackTFBTAF#Teamfollowback #TFB #TAF
266151002175074304,Wed Nov 07 12:11:58 +0000 2012,Bom dia a todos
265574132123586562,Mon Nov 05 21:59:41 +0000 2012,Fuck wit the boy on Voxer or Skype NERDGANG504
264928074943062016,Sun Nov 04 03:12:29 +0000 2012,My guardian angels looking over their boy! You'll never been forgotten! Hard Work Pays Off I'm Always trying to get better!
262878093167980544,Mon Oct 29 11:26:36 +0000 2012,"-_- smh, &amp; i already know when i cut niggas off they bouta try &amp; say some lil sweet sht."
262878024352034817,Mon Oct 29 11:26:19 +0000 2012,"I'm hoping someday that some kid, black or white, will hit more home runs than myself. Whoever it is, I'd be pulling for him."
262247338976874496,Sat Oct 27 17:40:12 +0000 2012,"To lead people, walk beside them ...  When the best leader's work is done the people say, 'We did it ourselves!'""— Lao-tsu"
261870980467662848,Fri Oct 26 16:44:41 +0000 2012,"Brother: Show me a bad bitchMe: kBrother: Noo, They gotta be Yellow Or Red, no Brown bitches. Lmao"
260809641200590848,Tue Oct 23 18:27:18 +0000 2012,A mao pra cima cintura souta da meia volta dançar KUDURO nao se canse agora começou a festa mexe a cabeça e dançar KUDURO.MUSICA latino!
260631317488730112,Tue Oct 23 06:38:43 +0000 2012,"HOLA BUENOS DIAS .. hrnos,hrnas DIOS LES BENDIGA.."
259476376527200256,Sat Oct 20 02:09:23 +0000 2012,Yayyy onething's video today:D
258619367447752704,Wed Oct 17 17:23:56 +0000 2012,Good night friends.............
258362894717165568,Wed Oct 17 00:24:48 +0000 2012,"An prob step out tonite ""alone"":-)"
258143589337546754,Tue Oct 16 09:53:22 +0000 2012,just got out the showerr ; i smell good
257533387781320704,Sun Oct 14 17:28:39 +0000 2012,yaampun pasti ga kebangun besok -___- parah
256741794576994304,Fri Oct 12 13:03:08 +0000 2012,ES WE TE
256064491018674177,Wed Oct 10 16:11:46 +0000 2012,#savethe1daysavethe1day
254590209507852289,Sat Oct 06 14:33:30 +0000 2012,Always follow your first mind !
251691772688863233,Fri Sep 28 14:36:09 +0000 2012,"once they stop talking to you , they start talking about you ."
251691678832918528,Fri Sep 28 14:35:47 +0000 2012,Just finished sound check and got checked into the Clarendon Hotel. This place is great!
248840532497928193,Thu Sep 20 17:46:20 +0000 2012,"After I saw ; ""The internet- Cocaine"""
242988696729686017,Tue Sep 04 14:13:14 +0000 2012,NOTICIA QUE PODE DESENCADEAR UMA CRISE MUNDIAL: Ator de CRESPUSCULo muda visual. kkkkkkkkkkkkkk
236807872745443328,Sat Aug 18 12:52:51 +0000 2012,Wow I feel like rocking out with the 116 again but I still can't believe I touched Lecrae
229601367008882688,Sun Jul 29 15:36:46 +0000 2012,M.O.E thats the motto
223265226286563328,Thu Jul 12 03:59:12 +0000 2012,its nothing on t.v boring
221213600721813506,Fri Jul 06 12:06:47 +0000 2012,new day new time
219182030972403715,Sat Jun 30 21:34:03 +0000 2012,"I'm Meng, u can call me Aken. I live in Cambodia"
219119005305286656,Sat Jun 30 17:23:36 +0000 2012,I hope they will try..........
217009226583781376,Sun Jun 24 21:40:06 +0000 2012,MauryThe #Maury krowd is funny as hell!! They will yell at anything!! LOL
