tid,time,tweet
313402780662501376,Sun Mar 17 21:33:40 +0000 2013,"RT @klyushina_yulya: Пересматриваю юбилейный концерт @valeriya_rus ""Русские романсы""-сильно,эмоционально!А что же тогда будет 17 апреля? ..."
312633285257854976,Fri Mar 15 18:35:58 +0000 2013,магизин #fiesta лучшие цены на одежду
312629030883057665,Fri Mar 15 18:19:03 +0000 2013,#fiesta низкие цены на мужскую одежу
308206447756455936,Sun Mar 03 13:25:18 +0000 2013,RT @ruredaktor: Четвероногие и двуногие людоеды.… http://t.co/phPtr1CfeR
297368318640287746,Fri Feb 01 15:38:26 +0000 2013,"RT @valeriya_rus: Жду вас на свой праздник.""@prigozhin_iosif: ""Валерия. В день рождения с друзьями"" - http://t.co/MXLCcY1H"""
283270925430968320,Mon Dec 24 18:00:26 +0000 2012,родители сказали: Если ты нас знакомишь со всеми своими друзьями то мы подарим айфон:D Чтоооо?????? #дешевоайфон5
283265589093474304,Mon Dec 24 17:39:13 +0000 2012,"я сначала подсел на тюнс, потом купил айпод мини, потом хакинтош, потом айпод классик, мак и айфон :) #дешевоайфон5"
283260332871393280,Mon Dec 24 17:18:20 +0000 2012,"паниковать и снижать цены, в итоге уже через час 5 айфон можно было везде купит за 30000 #дешевоайфон5"
283255050460082177,Mon Dec 24 16:57:21 +0000 2012,"Если держа телефон в одной руке, большим пальцем вытирать с него пыль, то окружающие будут думать, что у тебя айфон. #дешевоайфон5"
283251347367817216,Mon Dec 24 16:42:38 +0000 2012,"ЖИД НЕ ПИАРЬ КАРЛИКА - ""АЙФОН"" СЛУЧАЙНЫЙ ЧЕЛОВЕК В ПОЛИТИКЕ,ЕСЛИ У НЕГО ЕСТЬ СОВЕСТЬ,ОН ДОЛЖЕН УЙТИ… #дешевоайфон5"
283249642366435328,Mon Dec 24 16:35:51 +0000 2012,смотрю на свой новый айфон как баран. #дешевоайфон5
283244132183441408,Mon Dec 24 16:13:58 +0000 2012,"нихренааа,сестре,которая ходит во 2кл купили айфон,сукиии:оо #дешевоайфон5"
283238611288203264,Mon Dec 24 15:52:01 +0000 2012,"Из нокиа , айфон))хаха #дешевоайфон5"
283232563710009344,Mon Dec 24 15:28:00 +0000 2012,"Психани,купи себе 5й айфон в час ночи! #дешевоайфон5"
283227823110516737,Mon Dec 24 15:09:09 +0000 2012,"Что бы высушить айфон, нужно положить его в пакет с рисом. Лооол #дешевоайфон5"
283217951375630336,Mon Dec 24 14:29:56 +0000 2012,"Завтра концерт в школе аее:3 поеду к бабуле,буду смотреть айфон :** #дешевоайфон5"
283215563239591937,Mon Dec 24 14:20:26 +0000 2012,я помню ты айфон хотела?))) #дешевоайфон5
283205275157147648,Mon Dec 24 13:39:33 +0000 2012,"Ага, у меня пол ленты валидол пьют , как это айфон на самсунг меняют :) #дешевоайфон5"
283194573705052161,Mon Dec 24 12:57:02 +0000 2012,"Сраный apple, сраный айфон! Почему каждый раз, чтобы сделать элементарную вещь, нужно долго и упорно гуглить. #ненависть #дешевоайфон5"
283178583650861056,Mon Dec 24 11:53:30 +0000 2012,"Илюшка-таки купил себе пятый айфон, уже весь сгорает от нетерпения и жаждет порезать симку :D #дешевоайфон5"
283156979277496320,Mon Dec 24 10:27:39 +0000 2012,"хватит мучить айфон, пиши лекцию :) #дешевоайфон5"
283145305640300544,Mon Dec 24 09:41:16 +0000 2012,"но вот у меня когда был большой айпад, я тоже так думал, отдал его. Ну а потом айфон сломался) #дешевоайфон5"
283140605167689728,Mon Dec 24 09:22:35 +0000 2012,- А мне папа айфон купил! Обожаю айфон! - А мне мама шоколадку купила. Обожаю маму. #дешевоайфон5
282259003986284545,Fri Dec 21 22:59:25 +0000 2012,5 айфон за 28000 р let's start saving up. #дешевоайфон5
282257664111689729,Fri Dec 21 22:54:05 +0000 2012,"Илюшка-таки купил себе пятый айфон, уже весь сгорает от нетерпения и жаждет порезать симку :D #дешевоайфон5"
282253227813122048,Fri Dec 21 22:36:28 +0000 2012,наконец то я скачал это приложение на айфон ^^ #дешевоайфон5
282253121365884929,Fri Dec 21 22:36:02 +0000 2012,Выбираем мне айфон ! #дешевоайфон5
266551012326780928,Thu Nov 08 14:41:28 +0000 2012,RT @TanyaRodnyansky: @ARTEM_KLYUSHIN табачные компании нагло используют успешных спортсменов в целях рекламы!это вопиющая история!!!
265886450304839680,Tue Nov 06 18:40:44 +0000 2012,RT @klyushina_yulya: Зашла на 5 мин за сапожками / I thought it would be 5 minutes to buy boots #MissSixty @ Miss Sixty &amp; Energie ht ...
265886021865070592,Tue Nov 06 18:39:02 +0000 2012,RT @klyushina_yulya: @artem_klyushin с @xpeha  @ Формула Кино «Сити» http://t.co/f4BhU1Bx
263081809926041601,Tue Oct 30 00:56:05 +0000 2012,"«Человек может найти смысл в жизни, какой бы короткой и опасной она ни была, только посвятив себя обществу» © Альберт Эйнштейн"
263080260881498112,Tue Oct 30 00:49:56 +0000 2012,"«В том-то и беда: когда тебе скверно, ты даже думать не можешь» © Джером Сэлинджер"
263078720036798464,Tue Oct 30 00:43:49 +0000 2012,"«Плохо, когда за ум берутся люди, у которых его нет» © Валентин Домиль"
263077256845488128,Tue Oct 30 00:38:00 +0000 2012,"«Достаточно обладать страстью и какой-нибудь сраной идеей, и люди не будут мешаться под ногами, им нужно за кем-то следовать» © Девид Финчер"
263075539319922689,Tue Oct 30 00:31:10 +0000 2012,«Только одно делает исполнение мечты невозможным — это страх неудачи» © Паоло Коэльо
263073982444621824,Tue Oct 30 00:24:59 +0000 2012,"«Лучше делать новости, чем расказывать о них» © Уинстон Черчилль"
263072363489423360,Tue Oct 30 00:18:33 +0000 2012,«Мысли лучших умов всегда становятся в конечном счете мнением общества» © Филип Честерфилд
263069610222440449,Tue Oct 30 00:07:37 +0000 2012,"«Из всех животных только человек умеет смеяться, хотя как раз у него для этого меньше всего поводов» © Эрнест Хемингуэй"
263067804968816641,Tue Oct 30 00:00:26 +0000 2012,"«Причина дурных поступков нередко кроется в нездоровье тех, кто их совершает» © Джим Рон"
263066378649604096,Mon Oct 29 23:54:46 +0000 2012,"«Большая цель сама начинает нас учить, как ее добиться, генерирует энергию. Цель—это мощный магнит, который притягивает к себе» © В.Довгань"
263064151444824064,Mon Oct 29 23:45:55 +0000 2012,"«Тот настоящий друг, кто скрывает наши недостатки от взора других людей и открывает их нашему собственному взору» © У. Секкер"
263062451157884929,Mon Oct 29 23:39:10 +0000 2012,"Тот, кто утверждает, что религия не имеет ничего общего с политикой, не знает, что такое религия. Махатма Ганди"
263061061484310529,Mon Oct 29 23:33:39 +0000 2012,"«То, что мыслимо, то осуществимо» © Мао Цзэдун"
263059450083024897,Mon Oct 29 23:27:14 +0000 2012,"«Мой друг никогда мне ничего не объяснял. Может быть, он думал, что я такой же, как он» ©  Антуан де Сент-Экзюпери"
225062708729491457,Tue Jul 17 03:01:45 +0000 2012,"RT @igr_obzor: Новая игра по фильму человек-паук! Теперь 4го человека паука можно не только посмотреть, можно играть в него с друзьями h ..."
224829777624842242,Mon Jul 16 11:36:10 +0000 2012,RT @igr_obzor: Люди в черном- это игра по мотивам легендарного фильма. http://t.co/BVdIp5Jt
224555685885648898,Sun Jul 15 17:27:02 +0000 2012,"RT @igr_obzor: Самая развратная игра 2012-го года, основанная на жестком сексе с возможностью знакомства для продолжения в реальности ht ..."
224482015624437760,Sun Jul 15 12:34:17 +0000 2012,"RT @igr_obzor: Виртуальный секс- первая игра в открытую, поднимающая запретную тему виртуального секса, самый пошлый релиз лета http://t ..."
224300813684703233,Sun Jul 15 00:34:15 +0000 2012,"RT @igr_obzor: Лучший экшн 2012-го года, игра по мотивам фильма  трансформеры. http://t.co/O542qjZh"
218443514386726913,Thu Jun 28 20:39:26 +0000 2012,"RT @COB_CEKPETHO: Тема Клюшин выложил, сказанную Якеменко @yakemenko правду про Путина http://t.co/Gju6yzD9 #Клюшин RT"
