tid,time,tweet
326205052480012288,Mon Apr 22 05:25:19 +0000 2013,@CameronMs I thought I recognised the nice man giving me jelly beans.  Aaand they're gone.
272207875907145728,Sat Nov 24 05:19:49 +0000 2012,"@harto no netflix in my country. :( But we have plenty of wine, so I mean.. I can work with that. #hartomovienight"
267529131753881601,Sun Nov 11 07:28:10 +0000 2012,@zeniakumar @chinlovesyou me too! Happy Birthday Chin!
262748028094529536,Mon Oct 29 02:49:46 +0000 2012,Good on you #Google! That truly makes the absolute world of difference in someone's life. :D #genderequality http://t.co/7wOT3rvv
262389427421208576,Sun Oct 28 03:04:49 +0000 2012,I apparently study with my mouth open... We are not a codfish.
262389225398341632,Sun Oct 28 03:04:00 +0000 2012,RT @zeniakumar: Ryan #studying hard for the first time
262165340212043776,Sat Oct 27 12:14:22 +0000 2012,"RT @zeniakumar: ""The older I get the more I understand squidward's anger"""
261766745818267648,Fri Oct 26 09:50:30 +0000 2012,RT @JRhodesPianist: Perfectly valid excuse.  http://t.co/1zUUcYQL
261723210679209984,Fri Oct 26 06:57:30 +0000 2012,Reasons to have children? :) http://t.co/gheW5SBC
261722097926148096,Fri Oct 26 06:53:05 +0000 2012,RT @Queen_UK: Almost entirely full of gin.
261721133160734720,Fri Oct 26 06:49:15 +0000 2012,RT @graysoncoutts: so thirsty...I'm Thirsty Alley right now
261714529975685121,Fri Oct 26 06:23:01 +0000 2012,Discovering the joys of drawing faces on bananas. #bananas #sureillhashtagbananaswhynot
261712974937460736,Fri Oct 26 06:16:50 +0000 2012,"RT @LegaliseLove: Submissions have closed on the #marriageequality bill! Thanks to everyone for writing in support, we can't wait for th ..."
261678341013241856,Fri Oct 26 03:59:12 +0000 2012,"Having a ball with highlighters. Rainbow notes look brilliant; they may not be too practical, however."
261670929418031104,Fri Oct 26 03:29:45 +0000 2012,Tina Turner - the secret study pleasure. #thatscool #sortof
260853480221188096,Tue Oct 23 21:21:30 +0000 2012,Oh the thrill of trying to conceal my banana eating on a bus that strictly bans food. #thuglife
260684579055210496,Tue Oct 23 10:10:21 +0000 2012,"""You're such a grumpy Es-eytch-tee"" - Mum #hmm"
260682006944428032,Tue Oct 23 10:00:08 +0000 2012,"""Mum, what's that banging?""""Oh don't worry; your father's just jungle dancing with the cat again."" #umjungledancing? #andwhat"
260261450520616960,Mon Oct 22 06:08:59 +0000 2012,How frustrating is it to read over your tweets and find an apostrophe has somehow wriggled its way in without just cause. #why
260244295255212033,Mon Oct 22 05:00:49 +0000 2012,@HelenMaryPye I can't help it; washing machine's are so musical these days.
260238610543038464,Mon Oct 22 04:38:14 +0000 2012,"Got home to see Mum's got a new washing machine complete with a load-finishing tune to which we, as a family, enjoyed a little dance."
260156824211316737,Sun Oct 21 23:13:15 +0000 2012,"Author Miller's Death of a Salesman is in its final week! Directed by @jessepeach. If you can, please do go see it.  http://t.co/Sn4xKBIP :)"
260155080504901632,Sun Oct 21 23:06:19 +0000 2012,"RT @JRhodesPianist: Wagner was like a brain enema. Got rid of the shouty, scolding dwarf in the head for a few hours. Which is nice."
259956051896578048,Sun Oct 21 09:55:27 +0000 2012,RT @LydiaHollisterJ: @shillitoyousay I've never been more impressed with you. What a man.
259954139562389504,Sun Oct 21 09:47:51 +0000 2012,@LydiaHollisterJ I like this. This is a good idea - Much like buying Mum this foot spa years ago. Pampering my feet like trailer royalty.
259847603917840384,Sun Oct 21 02:44:31 +0000 2012,"Back in Tauranga. Glad to see the weather's just as fab as Auckland. - Oh sarcasm, you are my mistress."
259809208134926336,Sun Oct 21 00:11:56 +0000 2012,"Bus driver's insisting on greeting us all individually. Perhaps a bit unnecessary, but he's nice and I'd never frown on smiles. #nakedbus"
258037114980155392,Tue Oct 16 02:50:16 +0000 2012,"RT @LydiaHollisterJ: I  did a little cover @wheatus Teenage Dirtbag with my pal Josh, he's super talented. WATCH IT IF YOU LIKEY! http:/ ..."
254747621145579520,Sun Oct 07 00:59:00 +0000 2012,@CaptainSparklez d'you just come on survival games? We all got pretty damn excited. hah
254351273808261120,Fri Oct 05 22:44:03 +0000 2012,"@tamati_coffey Amazing job interviewing that minister this morning! It must've been hard, but you kept your cool like a pro #teamequality :)"
250019703391674369,Sun Sep 23 23:51:57 +0000 2012,"@Zeniakumar god, I've got to agree with anything florence related. Good luck!"
249696506196680705,Sun Sep 23 02:27:40 +0000 2012,@RadioActivefm What was the awesome song with the crazy sheet music at about 2:15ish today? Composed by John -someone- from Wellington?
248769331457052672,Thu Sep 20 13:03:25 +0000 2012,Short Film: Death of Brian - http://t.co/JyOL9XWu via @DailymotionUK
238548954223104000,Thu Aug 23 08:11:17 +0000 2012,Locked-in syndrome sufferer Tony Nicklinson dies of pneumonia http://t.co/iqU3sdB0 via @Independent
236433103952953344,Fri Aug 17 12:03:39 +0000 2012,@zeniakumar LightNing? Or have we just found a sudden new interest in lamps?
234710695567056896,Sun Aug 12 17:59:25 +0000 2012,"RT @zeniakumar ""It's 5 o'clock in the fucking morning and the fire alarm goes off"" week's starting perfectly.."
234161564406669313,Sat Aug 11 05:37:22 +0000 2012,Chair leg + dropped apple = exploded apple sauce carpet stain... #really
234160789173436418,Sat Aug 11 05:34:17 +0000 2012,RT @bitchy_ethan: @matthew_mitcham I can't thank you enough for becoming such a great role model for me to look up to. It means the worl ...
231354285609349120,Fri Aug 03 11:42:14 +0000 2012,Herbals at church this evening?
231353707919458304,Fri Aug 03 11:39:56 +0000 2012,@Zeniakumar the answer is yes
230065587601145856,Mon Jul 30 22:21:25 +0000 2012,Gay marriage gets PM's full support :D http://t.co/7E2a8P3N
229898331130830848,Mon Jul 30 11:16:48 +0000 2012,@LydiaHollisterJ oh dear. I'm worried that still exists. Think I'll have a peak at it the morning. #thosewerethedays #illneverheavymetal ...
229193078399971328,Sat Jul 28 12:34:22 +0000 2012,"@kimbramusic wonderfully odd, oddly wonderful, and so very attractive. Lovely little show tonight! Thank you! Only wish it were longer."
229162821919858689,Sat Jul 28 10:34:09 +0000 2012,Somebody just put their finger in my eye and flicked my contact out. #halfblind
227932086919651328,Wed Jul 25 01:03:38 +0000 2012,Just saw the blind guy at uni again. So embarrassed. Hoping he didn't see me. #littlebitrude? #probably
227489844845223936,Mon Jul 23 19:46:20 +0000 2012,Mothering arse buckets it's foggy this morning. #aucklandweather
226184112422141953,Fri Jul 20 05:17:49 +0000 2012,My quiet stroll ruined by mobs of crying screaming shallowbreathing girls after a recent sighting of some bloke called #Bieber or something?
226163757452242945,Fri Jul 20 03:56:56 +0000 2012,"Shit be cray wit Zenia and I RT@zeniakumar: Seeing a mob of girls outside the langham, people are crazy, at least they aren't screaming!"
225749213751963648,Thu Jul 19 00:29:41 +0000 2012,@LydiaHollisterJ Look who's got twitter like a real celebrity! #beniceshesnew #lydiathesearecalledhashtags
225234956379635713,Tue Jul 17 14:26:12 +0000 2012,RT @WillemHorck: Met @TimGunn today!!!! :D http://t.co/1hwV0uEE
224870013004300288,Mon Jul 16 14:16:03 +0000 2012,Dressing up to study alone in my room.. #fairlydepressing
224699812321312769,Mon Jul 16 02:59:44 +0000 2012,pretty sure everyone in my chinese course is fluent. Guess I get to feel useless an hour a day for the rest of the semester woo!
224686452263489536,Mon Jul 16 02:06:39 +0000 2012,I should probably proofread my tweets.
224685566577483776,Mon Jul 16 02:03:08 +0000 2012,Blind guy just asked of for directions. I pointed and said over there... #whoops
213256363508375553,Thu Jun 14 13:07:33 +0000 2012,And he throws himself into bed with hope of having the longest 4hrs of permitted sleep possible #exams
211321533287763968,Sat Jun 09 04:59:14 +0000 2012,"@zeniakumar: oh Lord, how much have you bought?"
210921965911941120,Fri Jun 08 02:31:30 +0000 2012,"Last night I swear @AmandaBalen and I held eye contact for a full two minutes. Holy God, she's awesome."
210920702881177601,Fri Jun 08 02:26:28 +0000 2012,@iamKevinFrey Last night blew my mind! Thank you :)
210719221771010050,Thu Jun 07 13:05:52 +0000 2012,@ladystarlightny @ladygaga I brought you some tea tonight Starlight - sorry I couldn't get it to you. :)
210688259645390848,Thu Jun 07 11:02:50 +0000 2012,Words cannot explain. #Gaga thank you
210651750233939968,Thu Jun 07 08:37:45 +0000 2012,Gaga is orgasm!
209627705854013441,Mon Jun 04 12:48:34 +0000 2012,"Fun #foreignfilm day with some friends tomorrow, I'll report back if I find any gems worth mentioning."
209627098724319233,Mon Jun 04 12:46:09 +0000 2012,"RT @Queen_UK: No, Gary Barlow, one does not ""want you back for good"". After tonight, one does not want you back at all, come to think of it."
209626842120986625,Mon Jun 04 12:45:08 +0000 2012,RT @GauteHHansen: RIP Eduard Khil: Vår alles troll. http://t.co/uRnX3rTU
209626067995078657,Mon Jun 04 12:42:03 +0000 2012,RT @JRhodesPianist: Clearly a hell of a night for her majesty... The morning after: http://t.co/VVCDsUon
209053872524763137,Sat Jun 02 22:48:21 +0000 2012,The drunkards outside my window last night did real damage. The rubbish collection area is a horrible destroyed mess. :/
208905264957624320,Sat Jun 02 12:57:51 +0000 2012,"To those wondering, it was dilmah's earl grey, I normally go for twinings', but never again. Clear winner here."
208904715596087297,Sat Jun 02 12:55:40 +0000 2012,"Today's feeble accomplishments: bought a new #tea, found it to be a worthy purchase. #beingboring"
208904055165161472,Sat Jun 02 12:53:02 +0000 2012,"@Chinlovesyou RT ""i thin oh funy"" the unwelcome reminder I've gone to bed early and aren't having alcohol fueled fun."
208902161520791553,Sat Jun 02 12:45:31 +0000 2012,Managed 40 pages of an #Chinese #history reading today before giving up. Why are my courses so uninteresting?
208901337616887808,Sat Jun 02 12:42:14 +0000 2012,Too often are there jackhammers going off outside my window..
208645426197434368,Fri Jun 01 19:45:20 +0000 2012,I'm yet to check twitter but I'm hoping I didn't post anything too strange last night.
208474141924409345,Fri Jun 01 08:24:43 +0000 2012,Being the most on twittest goes to @zeniakumar
208371014588055554,Fri Jun 01 01:34:55 +0000 2012,My new kindle made it to Auckland from China in 2 days. It'l apparently take a further 20 to make across town to me. #really
208169654651326465,Thu May 31 12:14:47 +0000 2012,"As far I know, twitter is now working on my phone? Oh this could be the start of something grand!"
207823520124764160,Wed May 30 13:19:23 +0000 2012,RT @ChrisRWhiting: @AlanCarr Is this you in drag on Pointless? You've ignored my last tweets and I think you're hiding something ;) http ...
207476043597086721,Tue May 29 14:18:38 +0000 2012,"I'm getting up early in search of #porridge. I'm not really a fan, but it's amazing what peer pressure can do to you #oatsyesplease #pascool"
207093683609272320,Mon May 28 12:59:16 +0000 2012,On a quick side note: I had a lovely malaysian meal made for me tonight at @JennyMcDT 's house. #ateyoufeelingluckypunk #iam
207092936813457408,Mon May 28 12:56:18 +0000 2012,8 o'clock start tomorrow - it WILL be productive day with plenty of study! #ifonly #whycantidothat
206742870777016320,Sun May 27 13:45:16 +0000 2012,Beleiving we're graced with a three day weekend next weekend? #ithinkso #ohgoodie
206742346958782464,Sun May 27 13:43:11 +0000 2012,I'm planing to postpone my birthday for around a month this year. Much like my study plans #whoneedsgrades #ido
205284331877445632,Wed May 23 13:09:33 +0000 2012,"1 in the morning, mid-week, and someone's using a jackhammer outside window... #really"
203822010923618304,Sat May 19 12:18:48 +0000 2012,"http://t.co/1Y8N1WdRPlease read Lyd's lovely, heartfelt words. She's beautiful, wonderful &amp; everythng else tht accompanies a honest friend."
203662042853408768,Sat May 19 01:43:09 +0000 2012,"Finally getting 'round to my prescribed reading on Chinese sexualities. God, I take weird courses. #uoa #china #sex"
200534813004922880,Thu May 10 10:36:39 +0000 2012,Arse-mothering-tit-shitters! Why do I forever find myself in these 'drink all the flucking tea I can and finish my assignment' dilemmas?
198780663355285504,Sat May 05 14:26:17 +0000 2012,"When you have 2 take yourself 2the candy shop, alone, you know life isn't going as excitingly as it should be #alone&amp;fullofcandy #notarapper"
198422253627645952,Fri May 04 14:42:06 +0000 2012,"RT @stephenfry: Rather emotional visit to Riddles Court, where I performed at the Fringe in 79 &amp; 80. Stood on the spot where Emma in ..."
197892951488208897,Thu May 03 03:38:50 +0000 2012,And assignment = done! #omfgimsohappythatsover
197834218619940864,Wed May 02 23:45:27 +0000 2012,Not the most ergonomic way to write an essay. #andyesmyscreenison http://t.co/9AkHaa1i
197827511512600577,Wed May 02 23:18:48 +0000 2012,The fear of repeating university's possible most useless course is growing. Less than 3hrs now and still 600 words to go. #business101
197787798575648768,Wed May 02 20:41:00 +0000 2012,Got up at 7:30 this morning to start/finish an essay I've had a month to do. It's due today at 3 #evertheorganised
196940987388526592,Mon Apr 30 12:36:05 +0000 2012,"@chinlovesyou well hello, I need to sleep. I have an 8am start tomorrow, but I've spilt sour worms in my bed &amp; now there's sugar everywhere."
196938623583662081,Mon Apr 30 12:26:41 +0000 2012,One if my lectures today covered some people's need for sexual involvement with shoes #frightening #maybe
196937656138072064,Mon Apr 30 12:22:50 +0000 2012,"Eurgh, this is truly the week from hell, why do they put all the due dates at the same time - then again I have had a month to do them #shit"
196620056199839744,Sun Apr 29 15:20:49 +0000 2012,RT @jakebley: I wore a big woolen cardigan out clubbing tonight. #noregrets
196618903684788225,Sun Apr 29 15:16:14 +0000 2012,Haha my stats assignment is finally over and done with. 3am and I can at last sleep. 5 hours 'till tomorrow's first lecture #poorlyorganised
196229201236475905,Sat Apr 28 13:27:41 +0000 2012,RT @Deserve: The aim of life is self-development. To realize one's nature perfectly - that is what each of us is here for.  -   Oscar Wilde
196103120416288768,Sat Apr 28 05:06:41 +0000 2012,My stats assignment is to count letters and words in a book. Great to see these outrageous course fees are going towards quality education
195859114935582720,Fri Apr 27 12:57:06 +0000 2012,"RT @JRhodesPianist: Bored with fiction now, so I'm going to start reading about the lives of others. Guess that makes me bio-curious..."
195468182788653057,Thu Apr 26 11:03:41 +0000 2012,@AlanCarr Alan! Are you doing a fan meet up for autographs and photos while you're in Auckland?! I can pay you with cheap alcohol! #please
195278578684923904,Wed Apr 25 22:30:15 +0000 2012,"Well arse, I'm sick, at least it isn't exam/assignment season. Oh wait…"
195134029970944001,Wed Apr 25 12:55:52 +0000 2012,"Looking out my window at the beautiful blurred lights of city. Life without glasses wouldn't be practical, but tonight I see the merit #blur"
195132656176988160,Wed Apr 25 12:50:25 +0000 2012,Oh lord no. I fear the beginnings of a cold. Stocking up of the vitamins tomorrow then. #shitimsick #cold #winter
195131442920038400,Wed Apr 25 12:45:36 +0000 2012,RT @JRhodesPianist: Go on Jesus. Give us another one! http://t.co/KxKR2NGF
194875484025266176,Tue Apr 24 19:48:30 +0000 2012,Just got back from dawn service at the  Auckland Museum #anzacday #anzac #Auckland I'm so shattered - off to bed for another few hours sleep
194873376874037248,Tue Apr 24 19:40:08 +0000 2012,So busy recently. Went the midnight screening of #Avengers last night. Then managed 1.5 hrs of sleep before get up again.
193172777224781824,Fri Apr 20 03:02:33 +0000 2012,"If you could dye a sheep any colour, which would it be? #sheep #bungyjumping"
192946462852780035,Thu Apr 19 12:03:16 +0000 2012,Everyone should read 'The Machine Stops' - free reading online too. #reading #shortstories
192945312401338368,Thu Apr 19 11:58:41 +0000 2012,RT @Queen_UK: Ones gonna go out and let oneself get absolutely soaking wet! One's reigning men yeah!
192944930228936704,Thu Apr 19 11:57:10 +0000 2012,"RT @Queen_UK: One's reigning men, hallelujah! One's reigning men, amen!"
192476310520594432,Wed Apr 18 04:55:03 +0000 2012,"Managed to spend 2 hrs at the Korean embassy in Auckland today. Watched TV I didn't understand, admired Samsung everything. #funtimes #korea"
192456156021669888,Wed Apr 18 03:34:57 +0000 2012,A member of the kitchen staff keeps telling me I should be a model. I don't know what to say to that. #awkwardflattery
191690623345098752,Mon Apr 16 00:53:00 +0000 2012,"RT @stephenfry: Holy moly what a farewell party to the Hobbit, Wellington & NZ. I mixed pinot noir, Jägermeister, blue agave tequila, gi ..."
191418346070216704,Sun Apr 15 06:51:04 +0000 2012,"@zeniakumar Tuesday! Or as they say, 'the day after tomorrow'. :)"
191417444009652224,Sun Apr 15 06:47:29 +0000 2012,@zeniakumar you too! When're you heading back?
191410219526533122,Sun Apr 15 06:18:47 +0000 2012,When Dad makes awkwardly orgasmic noises to describe how good food takes.  #frightening
191316196308697089,Sun Apr 15 00:05:10 +0000 2012,RT @Queen_UK: On the gin.
191300404187906048,Sat Apr 14 23:02:25 +0000 2012,"RT @HelenMaryPye: This its what wakes me up every morning, a cat on my chest!  http://t.co/nC4c0vyx"
191140903166029825,Sat Apr 14 12:28:37 +0000 2012,RT @wossy: I have a strange urge to watch Sapphire and Steel.
191116590476046336,Sat Apr 14 10:52:00 +0000 2012,#AlanRickman on Maori TV tonight. I welcomed surprise when I walk in the door. #ohhesgood #soverygood
190755669018820608,Fri Apr 13 10:57:50 +0000 2012,Just turning my old psp into a glorified OS flash-installer! #lame #nerdfighter
190755161679998976,Fri Apr 13 10:55:49 +0000 2012,RT @tamati_coffey: just went jersey boys at the civic tonight. was pretty much fecking awesome. go. its of international standard. loved ...
190754939302199296,Fri Apr 13 10:54:56 +0000 2012,"RT @GauteHHansen: Fredag den 13? nei nei, det må være noe feil her."
190046082636591104,Wed Apr 11 11:58:11 +0000 2012,"Why do I hate buses so much? The sniffling, dried snot faced  voyeur across the aisle. Please Lord, don't talk to me. #buses"
188951440037916672,Sun Apr 08 11:28:28 +0000 2012,I think this is my first pre-midnight bedtime since uni started. I'm rather excited. #shouldntbeontwitter
188785896676528128,Sun Apr 08 00:30:41 +0000 2012,Father's lovely easter robes. Don't have the heart to tell him he's not Jesus. http://t.co/bXNT0ASx
188563642881556480,Sat Apr 07 09:47:31 +0000 2012,The Easter Bunny seems to have replaced egg laying with just gifting me his multi-coloured balls! Still lovely though. http://t.co/HkmOPSo5
178325539013140481,Sat Mar 10 03:44:56 +0000 2012,"@HelenMaryPye Sorry! I'm so useless. It's been ready since before Christmas, I keep forgetting to tell you. It's on Maleme St. I'll text you"
176269597987717120,Sun Mar 04 11:35:21 +0000 2012,#Fitness is coming. I'm off to some type of exercise centre tomorrow. Apparently known as a ' #Gym' by its attendees. Forecast: #Failure.
173385352051036160,Sat Feb 25 12:34:23 +0000 2012,Having brunch with Los flatos y las flatas tomorrow #makingupwords
173384996550225921,Sat Feb 25 12:32:59 +0000 2012,Wifi in the new place is finally sorted out. With the pleasant surprise of 50 follows. Horrah.
169744829025222656,Wed Feb 15 11:28:15 +0000 2012,"RT @stephenfry: Oh, look what the divine @KathyLette found. How religion is like a penis.  http://t.co/FqGHikZ7"
169562106566410240,Tue Feb 14 23:22:11 +0000 2012,I love when it rains like this.
169527331818450945,Tue Feb 14 21:04:00 +0000 2012,@stephenfry You're welcome to come to tea chez nous anytime during your time in NZ! It'd be like the Queen visiting (but oh-so-much better).
168304963024453632,Sat Feb 11 12:06:44 +0000 2012,RT @esthericky: COOOOooooooOOOOOOkies
167944720704741376,Fri Feb 10 12:15:16 +0000 2012,I'm doing occasional stretching as to not cause injury...from #knitting
167938487792840704,Fri Feb 10 11:50:30 +0000 2012,Pulling an all-knitting-nighter to finish Lyd's present. I'm so not in the mood #whenknittingbecomesachore #tired
167394596937142273,Wed Feb 08 23:49:16 +0000 2012,That eclair disappeared far too quickly..
167393586084708353,Wed Feb 08 23:45:15 +0000 2012,Chocolate eclair for after lunch desert! ^^
167213912553553921,Wed Feb 08 11:51:18 +0000 2012,@HugMeIn ni shi bu shi zhongguo ren?
167212866150211584,Wed Feb 08 11:47:08 +0000 2012,@Kim_Dot_Com I always thought you seemed like a better guy than people are making out. Two minutes on your twitter and now I know you are :)
166493614652932097,Mon Feb 06 12:09:05 +0000 2012,So I spent all night getting my Valentine's outfit sorted... Now I just need a date. #foreveralone
166134118378246145,Sun Feb 05 12:20:35 +0000 2012,@davidfarrier you went to #BethlehemCollege ? Holy hell it's a small world.
166133761916928000,Sun Feb 05 12:19:10 +0000 2012,@HelenMaryPye Thought it might have been a bit like that. Seemed pretty cool but as you say 'meh'.
165393774028132352,Fri Feb 03 11:18:43 +0000 2012,@Brodhe ha! Comment ça que tu n'as presque rien comme cours!?
165392997456953344,Fri Feb 03 11:15:38 +0000 2012,"@grk17 how'd you manage to get @tamati_coffey to follow you? Ha, some people have all the luck."
164671087647522817,Wed Feb 01 11:27:01 +0000 2012,@idodrent Mum says she talked to you today in a men's clothes shop and made a huge fool of herself. She's a nice lady really.
164669578180440065,Wed Feb 01 11:21:01 +0000 2012,"RT @BillBailey: Aurora Borealis, near Tromsø..Arctic Norway. 28/1/12 http://t.co/PzsJ5psV"
164669259010678784,Wed Feb 01 11:19:45 +0000 2012,Was the first day of #blackhistorymonth today. My already 40 minute read on the subject could easy grow and force bedtime back. #interesting
164311339559436288,Tue Jan 31 11:37:30 +0000 2012,Watched 'Yi yi' this evening. Was really amazing. No wonder it won everything it did in Cannes'.
162986865350283264,Fri Jan 27 19:54:31 +0000 2012,"RT @ScreamingEgg: @rickygervais my girlfriend found this and I instantly thought of you, I mean this in the best possible way of course. ..."
162849853548933120,Fri Jan 27 10:50:05 +0000 2012,Just posted 'Mirror Man' by Human League. Click here to listen http://t.co/KVythTtk
162841534084038656,Fri Jan 27 10:17:01 +0000 2012,Come On Eileen.
162700443108114432,Fri Jan 27 00:56:23 +0000 2012,Yay rain! Seems my Summer grinch-ness is working out after all. :)
162686313986928640,Fri Jan 27 00:00:14 +0000 2012,"Apparently I'm not wear trousers today, as it's 1pm and I'm yet to put any on. #dayathome"
162339772084387840,Thu Jan 26 01:03:12 +0000 2012,Is it too hot to go for a walk?#weather
162331583460802560,Thu Jan 26 00:30:40 +0000 2012,"God, I can make a tasty meal. ^0^"
162326895994736640,Thu Jan 26 00:12:02 +0000 2012,Our coffee machine has a cups-made minimum of 4. I'm home alone w/ no one to help me drink them. I guess I'm soon to be very hyper.
162324686020165634,Thu Jan 26 00:03:15 +0000 2012,"Well, it's lunch-cooking time. Which will be followed by spilling-lunch-on-book time. #bookaddiction."
162324322604695552,Thu Jan 26 00:01:49 +0000 2012,SO @studylink told me I have to wait another 2 weeks minimum. Oh balls.
162319517488394241,Wed Jan 25 23:42:43 +0000 2012,You know you've been on hold a long time when the hold music starts to repeat it's loop… AAHHRHRRHH!
162318440303046656,Wed Jan 25 23:38:26 +0000 2012,I swear I call these people every three days. Almost my friends :( Ha.
162318284191051776,Wed Jan 25 23:37:49 +0000 2012,still on hold… #studylink
162132486648893440,Wed Jan 25 11:19:31 +0000 2012,*bed
162132456143716352,Wed Jan 25 11:19:24 +0000 2012,Breadtime! And then off the bread.
162118828665470976,Wed Jan 25 10:25:15 +0000 2012,Lame! Ending was lame!
162116822617960448,Wed Jan 25 10:17:17 +0000 2012,Soundtrack's actually so good. #againstthecurrent
162115685210796032,Wed Jan 25 10:12:45 +0000 2012,This movie is sloooww... but I have my fluffy friend on my lap so all is well! #cats #cats #cats
162106036868747264,Wed Jan 25 09:34:25 +0000 2012,An evening with the cat and pear drops. Purrrfect ^0^
162103757222588416,Wed Jan 25 09:25:22 +0000 2012,Watching Against the Current. Beautiful soundtrack. #againstthecurrent #score
162103440040923136,Wed Jan 25 09:24:06 +0000 2012,@HelenMaryPye wasn't that late was it?
162083464118677504,Wed Jan 25 08:04:43 +0000 2012,Dancing to depeche mode with my cat ^_____^*~~
162077672531439616,Wed Jan 25 07:41:43 +0000 2012,My Macbook Air Superdrive arrived. It's iTunes updating time :{)
162044205005414400,Wed Jan 25 05:28:43 +0000 2012,I'm enrolled! #university
161783617062838272,Tue Jan 24 12:13:14 +0000 2012,"To do for tomorrow: Call studylink again and piss them off - again. 'Yes it's me - again"". They really are pretty useless."
161779995834974208,Tue Jan 24 11:58:51 +0000 2012,FInally starting to understand this course enrollment business. I think it all should come together tomorrow.
160704134390087680,Sat Jan 21 12:43:46 +0000 2012,http://t.co/w1dodpz9 follow me on my new writing expedition. :)
160680235673714688,Sat Jan 21 11:08:48 +0000 2012,@liamwright7 Definitely. Are you going to Charlottes?
160670931151372288,Sat Jan 21 10:31:49 +0000 2012,"@liamwright7 Haha, nope not TGA town. Auckland though. And plenty in France. :)"
